index,url,valid,domain,title,description,image,published,archive,content,quote,language,keyword
https://www.c21media.net/news/cherokee-film-hires-michael-musante-as-part-of-film-and-tv-funding-push/,https://www.c21media.net/news/cherokee-film-hires-michael-musante-as-part-of-film-and-tv-funding-push/,0,www.c21media.net,Cherokee Film hires Michael Musante as part of film and TV funding push,"US-based Cherokee Film has appointed Michael Musante as executive in charge of film and TV finance and development. Musante joins Cherokee Film with an extensive background in film production, acquisit...",https://cdn.c21media.net/wp-content/uploads/2024/08/mikemusante2024-ls.jpg,2024-08-01T09:34:30Z,,"US-based Cherokee Film has appointed Michael Musante as executive in charge of film and TV finance and development.
Michael Musante
Musante joins Cherokee Film with an extensive background in film … [+1727 chars]",,en,'Lily Gladstone'
https://comicbookmovie.com/tv/marvel/agatha-coven-of-chaos/agatha-all-along-new-stills-reveal-first-look-at-aubrey-plaza-in-her-green-witch-costume-a212447,https://comicbookmovie.com/tv/marvel/agatha-coven-of-chaos/agatha-all-along-new-stills-reveal-first-look-at-aubrey-plaza-in-her-green-witch-costume-a212447,0,comicbookmovie.com,AGATHA ALL ALONG: New Stills Reveal First Look At Aubrey Plaza In Her Green Witch Costume,"Some new promo stills for Marvel Studios' Agatha All Along have been released, and they give us a first look at Aubrey Plaza suited-up as Rio Vidal in her ""warrior witch"" costume...",https://comicbookmovie.com/images/articles/banners/212447.jpg,2024-08-01T14:56:11Z,,"Some new promo stills for Marvel Studios' Agatha All Along have been unveiled (via Empire), giving us another look at Kathryn Hahn as the returning Agatha Harkness along with the show's supporting pl… [+2766 chars]",,en,'Aubrey Plaza'
https://www.stereogum.com/2274324/charli-xcx-guess-remix-feat-billie-eilish/music/,https://www.stereogum.com/2274324/charli-xcx-guess-remix-feat-billie-eilish/music/,0,www.stereogum.com,Charli XCX – “Guess (Remix Feat. Billie Eilish)”,"There was “Girl, so confusing” with Lorde, “360” with Yung Lean and Robyn, “Von dutch” with Addison Rae, and now, there’s “Guess” with Billie Eilish. After teasing a “Guess” rework with a surprise collaborator the other day, Charli XCX has unveiled the latest…",https://static.stereogum.com/uploads/2024/08/Guess-feat-Billie-Eilish-Charli-xcx-1722538366.jpeg,2024-08-01T22:00:31Z,,"There was “Girl, so confusing” with Lorde, “360” with Yung Lean and Robyn, “Von dutch” with Addison Rae, and now, there’s “Guess” with Billie Eilish. After teasing a “Guess” rework with a surprise co… [+793 chars]",,en,'Billie Eilish'
http://www.rollingstone.com/music/music-news/billie-eilish-charli-xcx-guess-remix-1235072590/,http://www.rollingstone.com/music/music-news/billie-eilish-charli-xcx-guess-remix-1235072590/,0,www.rollingstone.com,Billie Eilish Crashes Charli XCX’s Panty Party in Video for ‘Guess’ Remix,"Charli XCX released single 'Guess' alongside Billie Eilish, who's also having a major summer thanks to Hit Me Hard and Soft's 'Birds of a Feather.'",https://www.rollingstone.com/wp-content/uploads/2024/08/charlie-billie-remix.jpg?crop=0px%2C0px%2C1798px%2C1014px&resize=1600%2C900,2024-08-01T22:17:44Z,,"It’s a Brat and Billie summer! On Thursday, Charli XCX and Billie Eilish released a remix for Charli’s song “Guess” that’s sending the internet into a frenzy.
The pair also released a video directed… [+2316 chars]",,en,'Billie Eilish'
https://pitchfork.com/news/charli-xcx-and-billie-eilish-share-new-guess-remix-watch-the-video/,https://pitchfork.com/news/charli-xcx-and-billie-eilish-share-new-guess-remix-watch-the-video/,0,pitchfork.com,Charli XCX and Billie Eilish Share New “Guess” Remix: Watch the Video,"The new “Guess Featuring Billie Eilish” visual features a ton of underwear, all of which has been charitably redistributed","https://media.pitchfork.com/photos/66ac164e8d96df8166737778/16:9/w_1280,c_limit/Billie-Eilish-Charli-XCX.jpg",2024-08-01T23:18:30Z,,"Charli XCX has released another Brat remix. This time, shes enlisted Billie Eilish for a new version of the bonus song Guess. The new song comes with a video directed by Aidan Zamiri. It features a t… [+1029 chars]",,en,'Billie Eilish'
https://hypebeast.com/2024/8/charli-xcx-billie-eilish-guess-single-stream,https://hypebeast.com/2024/8/charli-xcx-billie-eilish-guess-single-stream,0,hypebeast.com,"Charli XCX and Billie Eilish Drop Flirtatious Remix of ""Guess""","Charli XCX has joined forces with Billie Eilish for a remix of her BRAT deluxe cut, ""Guess.""Produced by The Dare and FINNEAS, the two-and-a-half-minute joint hears the pair brazenly trade flirtatious verses involving underwear, a hark back to Eilish's lyric o…",https://image-cdn.hypb.st/https%3A%2F%2Fhypebeast.com%2Fimage%2F2024%2F08%2F01%2Fcharli-xcx-billie-eilish-guess-single-stream-tw.jpg?w=1080&cbr=1&q=90&fit=max,2024-08-02T04:12:47Z,,"Charli XCX has joined forces with Billie Eilish for a remix of her BRAT deluxe cut, “Guess.”
Produced by The Dare and FINNEAS, the two-and-a-half-minute joint hears the pair brazenly trade flirtatio… [+389 chars]",,en,'Billie Eilish'
https://rlsbb.ru/beat-bobby-flay-s36e08-1080p-web-h264-frequency/,https://rlsbb.ru/beat-bobby-flay-s36e08-1080p-web-h264-frequency/,0,rlsbb.ru,Beat Bobby Flay S36E08 1080p WEB h264-FREQUENCY,"Season 36, Episode 08 – “Breakfast of Champions”Pastry chef Duff Goldman and journalist Gayle King interrogate Bobby Flay, while chefs Brian Ingram and Dayana Joseph cook up a breakfast of champions.Links: HOMEPAGE – TVDBBeat.Bobby.Flay.S36E08.1080p.WEB.H264-…",,2024-08-02T04:27:45Z,,"Season 36, Episode 08 “Breakfast of Champions”Pastry chef Duff Goldman and journalist Gayle King interrogate Bobby Flay, while chefs Brian Ingram and Dayana Joseph cook up a breakfast of champions.
… [+379 chars]",,en,'Gayle King'
https://www.counterpunch.org/2024/08/02/just-calm-down/,https://www.counterpunch.org/2024/08/02/just-calm-down/,0,www.counterpunch.org,“Just Calm Down”,"Emmanuel Macron dissolved France’s National Assembly, tensions have been running high. Politicians have been attacked, their offices vandalised and activists beaten up. Threats proliferate online; political leaders trade insults. In the media, journalists and…",https://www.counterpunch.org/wp-content/uploads/2021/06/cp-default-share.png,2024-08-02T05:45:35Z,,"Emmanuel Macron dissolved Frances National Assembly, tensions have been running high. Politicians have been attacked, their offices vandalised and activists beaten up. Threats proliferate online; pol… [+3627 chars]",,en,'Emmanuel Macron'
https://newrepublic.com/article/184485/foreign-policy-mistake-us-keeps-repeating-middle-east,https://newrepublic.com/article/184485/foreign-policy-mistake-us-keeps-repeating-middle-east,0,newrepublic.com,The Foreign Policy Mistake the U.S. Keeps Repeating in the Middle East,"Early in his presidency, Barack Obama addressed
an audience at Cairo University in an attempt to improve America’s standing in
the Arab world. Titled “A New Beginning,”
the speech called for “mutual interest and mutual respect” between the United
States and M…",https://images.newrepublic.com/e58dcc2df98ad8c9c9f603b7f7d345d56cf18bae.jpeg?w=1200&h=630&crop=faces&fit=crop&fm=jpg,2024-08-02T10:00:00Z,,"What Really Went Wrong: The West and the Failure of Democracy in the Middle East
Yale University Press, 317 pp., $28.00
The implosion of Obamas visionand his replication
of Cold Warera American po… [+2579 chars]",,en,'Barack Obama'
https://www.businessinsider.com/ryan-salame-posting-ftx-crypto-trump-sbf-awaiting-prison-2024-8,https://www.businessinsider.com/ryan-salame-posting-ftx-crypto-trump-sbf-awaiting-prison-2024-8,0,www.businessinsider.com,"As Ryan Salame stares down years in prison for his role in FTX, he's spending his time doing what he loves: posting","As the FTX insider recovers from a dog attack that delayed his prison sentence, he's posting on X about Sam Bankman-Fried's trial and Donald Trump.",https://i.insider.com/66aba1ca1a227600e633758c?width=1200&format=jpeg,2024-08-02T11:20:02Z,,"Ryan Salame is returned to X ahead of his prison sentence.REUTERS/Brendan McDermid
<ul><li>Ryan Salame was sentenced to 7½ years in prison for his role in the collapse of FTX.</li><li>Awaiting priso… [+11057 chars]",,en,'Donald Trump'
https://www.forbes.com/sites/hughmcintyre/2024/08/02/billie-eilish-may-be-headed-for-another-smash-with-her-new-collaboration/,https://www.forbes.com/sites/hughmcintyre/2024/08/02/billie-eilish-may-be-headed-for-another-smash-with-her-new-collaboration/,0,www.forbes.com,Billie Eilish May Be Headed For Another Smash With Her New Collaboration,"Billie Eilish joined Charli XCX on the remix of the latter's song ""Guess,"" now called “Guess featuring Billie Eilish,” which has become a quick sales win.",https://imageio.forbes.com/specials-images/imageserve/61fd63b61e8bbea6bccba91b/0x0.jpg?format=jpg&height=900&width=1600&fit=bounds,2024-08-02T17:27:07Z,,"LOS ANGELES, CALIFORNIA - DECEMBER 04: Billie Eilish attends Variety 2021 Music Hitmakers Brunch ... [+] presented by Peacock and GIRLS5EVA at City Market Social House on December 04, 2021 in Los Ang… [+2775 chars]",,en,'Billie Eilish'
https://www.businessinsider.com/charli-xcx-brat-remix-features-billie-eilish-lorde-addison-rae-2024-8,https://www.businessinsider.com/charli-xcx-brat-remix-features-billie-eilish-lorde-addison-rae-2024-8,0,www.businessinsider.com,Charli XCX's 'Brat' era is making remixes fun again. Other pop stars should take note.,"Charli XCX has released several remixed versions of fan-favorite ""Brat"" tracks, featuring artists like Billie Eilish, Lorde, and Addison Rae.",https://i.insider.com/66acf438393cd3c8629ae46f?width=1200&format=jpeg,2024-08-02T19:51:48Z,,"Billie Eilish and Charli XCX.Terrence O'Connor
<ul><li>Charli XCX released a new version of her fan-favorite song ""Guess"" on Thursday featuring Billie Eilish.</li><li>The ""Brat"" remixes all feel lik… [+5967 chars]",,en,'Billie Eilish'
https://screenrant.com/1990s-box-office-flops-everyone-loves/,https://screenrant.com/1990s-box-office-flops-everyone-loves/,0,screenrant.com,10 Box Office Flops From The 1990s That Everyone Loves,"Financial success has never been a dependable measure of a movies success, and some of the best movies of the 1990s failed to turn a profit.",https://static1.srcdn.com/wordpress/wp-content/uploads/2024/07/imagery-from-the-big-lebowski-and-true-romance.jpg,2024-08-03T14:30:10Z,,"Summary
<ul><li>
 Box office returns don't always measure a movie's success, and some 90s flops gained cult followings later.
 </li><li>
 Marketing and timing play a big role in a movie's commerc… [+12341 chars]",,en,'nan nan'
https://www.forbes.com/sites/hughmcintyre/2024/08/03/billie-eilish-replaces-kendrick-lamar-at-no-1/,https://www.forbes.com/sites/hughmcintyre/2024/08/03/billie-eilish-replaces-kendrick-lamar-at-no-1/,0,www.forbes.com,Billie Eilish Replaces Kendrick Lamar At No. 1,"Billie Eilish and Charli XCX's “Guess featuring Billie Eilish” jumps 182 spots to hit No. 1 on Spotify's daily U.S. chart, replacing Kendrick Lamar's ""Not Like Us"" on top.","https://imageio.forbes.com/specials-images/imageserve/66ae6d79413686df747e7c9c/0x0.jpg?format=jpg&crop=1559,1169,x0,y0,safe&height=900&width=1600&fit=bounds",2024-08-03T17:49:33Z,,"GLASTONBURY, ENGLAND - JUNE 24: Billie Eilish headlines the Pyramid Stage during day three of ... [+] Glastonbury Festival at Worthy Farm, Pilton on June 24, 2022 in Glastonbury, England. Billie Eili… [+2301 chars]",,en,'Billie Eilish'
https://pitchfork.com/news/charli-xcx-billie-eilish-jane-remover-high-vis-this-week-pitchfork-selects-playlist/,https://pitchfork.com/news/charli-xcx-billie-eilish-jane-remover-high-vis-this-week-pitchfork-selects-playlist/,0,pitchfork.com,"Charli XCX & Billie Eilish, Jane Remover, High Vis, and More: This Week’s Pitchfork Selects Playlist","Our weekly playlist highlights songs that our writers, editors, and contributors are listening to on repeat","https://media.pitchfork.com/photos/66afe0c532283d834154cfc7/16:9/w_1280,c_limit/August%205_2-1.png",2024-08-05T12:20:57Z,,"The staff of Pitchfork listens to a lot of new music. A lot of it. On any given day our writers, editors, and contributors go through an imposing number of new releases, giving recommendations to eac… [+1108 chars]",,en,'Billie Eilish'
