index,url,valid,domain,title,description,image,published,archive,content,quote,language,keyword
https://www.avclub.com/exorcist-believer-moves-release-date-for-taylor-swift-1850794950,https://www.avclub.com/exorcist-believer-moves-release-date-for-taylor-swift-1850794950,0,www.avclub.com,The power of Taylor Swift compels Exorcist: Believer to move release date,"Another day, another movie portmanteau lost to the sea of forced memes. There will be no “Exorswift” for the crowds of cosplayers looking to dump pea soup on their Eras outfit and attend a double feature of Taylor Swift’s Eras Tour movie and The Exorcist: Bel…","https://i.kinja-img.com/gawker-media/image/upload/c_fill,f_auto,fl_progressive,g_center,h_675,pg_1,q_80,w_1200/269e7a20b7432790411f0e397373d989.jpg",2023-09-01T00:29:00Z,,"Another day, another movie portmanteau lost to the sea of forced memes. There will be no Exorswift for the crowds of cosplayers looking to dump pea soup on their Eras outfit and attend a double featu… [+1492 chars]",,en,'Taylor Swift'
https://www.forbes.com/sites/brianbushard/2023/09/01/robinhood-shares-jump-after-company-buys-back-bankman-frieds-seized-shares/,https://www.forbes.com/sites/brianbushard/2023/09/01/robinhood-shares-jump-after-company-buys-back-bankman-frieds-seized-shares/,0,www.forbes.com,Robinhood Shares Jump After Company Buys Back Bankman-Fried’s Seized Shares,"Robinhood’s shares, which had been slumping in recent weeks, shot up after it announced it bought more than $605 million in shares that had previously been controlled by Sam Bankman-Fried.","https://imageio.forbes.com/specials-images/imageserve/64f1f91b190e771af585ccab/0x0.jpg?format=jpg&crop=2262,1274,x0,y3,safe&width=1200",2023-09-01T15:03:26Z,,Shares of Robinhood jumped more than 4% Friday morning after the online brokerage bought back more than $605 million in company stock that had been owned by indicted former FTX head Sam Bankman-Fried… [+2975 chars],,en,'Caroline Ellison'
https://www.newyorker.com/culture/the-weekend-essay/listening-to-taylor-swift-in-prison,https://www.newyorker.com/culture/the-weekend-essay/listening-to-taylor-swift-in-prison,0,www.newyorker.com,Listening to Taylor Swift in Prison,Joe Garcia writes about the impact that Taylor Swift’s music has made on him while he has been incarcerated.,"https://media.newyorker.com/photos/64e388ca3509ae8868af78a8/16:9/w_1280,c_limit/Garcia_TaylorSwift_Prison.jpg",2023-09-02T10:00:00Z,,"The first time I heard about Taylor Swift, I was in a Los Angeles County jail, waiting to be sent to prison for murder. Sheriffs would hand out precious copies of the Los Angeles Times, and they woul… [+14521 chars]",,en,'Taylor Swift'
https://biztoc.com/x/b8954a7a522439e5,https://biztoc.com/x/b8954a7a522439e5,0,biztoc.com,FTX filing shows company bought yacht for former co-CEO Sam Trabucco,The filings also revealed over $900 million in payments to Sam Bankman-Fried and $3.5 million for his ex-girlfriend Caroline Ellison. #sambankmanfried #carolineellison,https://c.biztoc.com/p/b8954a7a522439e5/s.webp,2023-09-02T16:42:12Z,,"The filings also revealed over $900 million in payments to Sam Bankman-Fried and $3.5 million for his ex-girlfriend Caroline Ellison.
#sambankmanfried#carolineellison
This story appeared on thebloc… [+6 chars]",,en,'Caroline Ellison'
http://bitcoinist.com/former-alameda-ceos-2-5m-yacht-deal-exposed/,http://bitcoinist.com/former-alameda-ceos-2-5m-yacht-deal-exposed/,0,bitcoinist.com,Former Alameda CEO’s $2.5 Million Yacht Deal Exposed In FTX Court Documents,Recently submitted court filings to the U.S. Bankruptcy Court for the District of Delaware have shown a sequence of financial transactions that preceded the decline of FTX in November 2022. The aforementioned papers suggest that the majority of these transact…,https://bitcoinist.com/wp-content/uploads/2023/09/a-3.jpg,2023-09-03T13:41:48Z,,Recently submitted court filings to the U.S. Bankruptcy Court for the District of Delaware have shown a sequence of financial transactions that preceded the decline of FTX in November 2022. The afore… [+3185 chars],,en,'Caroline Ellison'
