index,url,valid,domain,title,description,image,published,archive,content,quote,language,keyword
https://pagesix.com/2023/10/31/entertainment/sophie-turner-makes-out-with-aristocrat-amid-pending-joe-jonas-divorce-and-custody-battle-report/,https://pagesix.com/2023/10/31/entertainment/sophie-turner-makes-out-with-aristocrat-amid-pending-joe-jonas-divorce-and-custody-battle-report/,0,pagesix.com,Sophie Turner makes out with aristocrat amid pending Joe Jonas divorce and custody battle: report,"""He then took his hat off and leaned in to give her a big kiss. After the kiss, they parted ways,"" an eyewitness claims.",https://pagesix.com/wp-content/uploads/sites/3/2023/10/sophie-turner-kisses-british-aristocrat-on-street.jpg?quality=75&strip=all&w=1024,2023-11-01T01:06:06Z,,"Sophie Turner reportedly made out with an English aristocrat amid her ongoing divorce from Joe Jonas.
According to the UK Sun, the actress, 27, was seen locking lips with 29-year-old Peregrine “Perr… [+2825 chars]",,en,'Sophie Turner'
https://www.justjared.com/2023/10/31/sophie-turner-spotted-kissing-british-aristocrat-peregrine-pearson-both-recently-went-through-major-breakups/,https://www.justjared.com/2023/10/31/sophie-turner-spotted-kissing-british-aristocrat-peregrine-pearson-both-recently-went-through-major-breakups/,0,www.justjared.com,Sophie Turner Spotted Kissing British Aristocrat Peregrine Pearson; Both Recently Went Through Major Breakups,"Sophie Turner appears to have a new man in her life. The 27-year-old Game of Thrones actress was spotted kissing British aristocrat Peregrine Pearson, 29, during a day out in Paris over the weekend. The kiss reportedly happened on Saturday (October 28), just …",https://cdn.justjared.com/wp-content/uploads/headlines/2023/10/sophie-peregrine.jpg,2023-11-01T01:06:37Z,,"Sophie Turner appears to have a new man in her life.
The 27-year-old Game of Thrones actress was spotted kissing British aristocrat Peregrine Pearson, 29, during a day out in Paris over the weekend.… [+1204 chars]",,en,'Sophie Turner'
https://www.the-sun.com/entertainment/9470138/britney-spears-book-tv-series/,https://www.the-sun.com/entertainment/9470138/britney-spears-book-tv-series/,0,www.the-sun.com,Britney Spears wants TV series...,BRITNEY Spears’ book has smashed sales records for a celebrity memoir and it could soon be doing the same in a different format. Sources in the US have claimed a bidding war has been sparked to bri…,https://www.the-sun.com/wp-content/uploads/sites/6/2023/10/newspress-collage-24588893-1698778315445.jpg?1698766581&strip=all&quality=100&w=1920&h=1080&crop=1,2023-11-01T01:31:38Z,,"BRITNEY Spears book has smashed sales records for a celebrity memoir and it could soon be doing the same in a different format.
Sources in the US have claimed a bidding war has been sparked to bring… [+2353 chars]",,en,'Justin Timberlake'
https://www.aljazeera.com/features/2023/11/1/inside-benjamin-netanyahus-mind-how-is-israels-pm-plotting-the-war,https://www.aljazeera.com/features/2023/11/1/inside-benjamin-netanyahus-mind-how-is-israels-pm-plotting-the-war,0,www.aljazeera.com,Inside Benjamin Netanyahu’s mind: How is Israel’s PM plotting the war?,"Netanyahu's indecisive, distrustful nature adds to the dangers of his war on Gaza, say experts who've studied his mind.",https://www.aljazeera.com/wp-content/uploads/2023/11/AP23301668145777-1698823815.jpg?resize=1920%2C1440,2023-11-01T07:12:50Z,http://wayback.archive-it.org/all/20231101163546/https://www.aljazeera.com/features/2023/11/1/inside-benjamin-netanyahus-mind-how-is-israels-pm-plotting-the-war,"Beirut, Lebanon Gal Hirsch has no known experience in hostage negotiations, and in 2006, he left the Israeli forces, disgraced over his role in military failures during the war with Hezbollah in Leba… [+8365 chars]",,en,'Nicolas Sarkozy'
https://radaronline.com/p/britney-spears-sam-asghari-career-thriving-amid-divorce/,https://radaronline.com/p/britney-spears-sam-asghari-career-thriving-amid-divorce/,0,radaronline.com,"Britney Spears' Ex Sam Asghari Not Being Blacklisted in Hollywood, Career Thriving Despite Claims: Sources","Sources claimed Asghari has been shut out of Hollywood after he filed for divorce from Spears, but others argued the single model is booked and busy.",https://media.radaronline.com/brand-img/HHe_25QP-/1200x628/sam-asgharis-dying-career-1698778172668.png,2023-11-01T10:00:00Z,,"As this outlet reported, the fitness trainer hit Spears with divorce papers on August 16, citing irreconcilable differences, after only 14 months of marriage and amid accusations of physical abuse on… [+386 chars]",,en,'Sam Asghari'
https://www.cosmopolitan.com/entertainment/celebs/a45707956/sophie-turner-kissing-british-aristocrat-peregrine-pearson/,https://www.cosmopolitan.com/entertainment/celebs/a45707956/sophie-turner-kissing-british-aristocrat-peregrine-pearson/,0,www.cosmopolitan.com,Sophie Turner Was Seemingly Spotted Kissing British Aristocrat Peregrine Pearson in Paris,"Peregrine previously dated King Charles' goddaughter, a casual Princess.","https://hips.hearstapps.com/hmg-prod/images/screen-shot-2023-11-01-at-7-10-05-am-6542321a05249.png?crop=0.8987341772151899xw:1xh;center,top&resize=1200:*",2023-11-01T11:18:00Z,https://web.archive.org/web/20231102071538/https://www.cosmopolitan.com/entertainment/celebs/a45707956/sophie-turner-kissing-british-aristocrat-peregrine-pearson/,"Important update: 
Sophie Turner has leveled up and was seemingly spotted having a PDA moment with British aristocrat Peregrine Pearson in Paris on Saturday. In photos exclusively posted by The Sun,… [+1570 chars]",,en,'Prince Charles'
https://ohnotheydidnt.livejournal.com/127146825.html,https://ohnotheydidnt.livejournal.com/127146825.html,0,ohnotheydidnt.livejournal.com,Sophie Turner spotted making out with British aristocrat,"""Sophie Turner & Peregrine Wentworth, spotted sharing a kiss at a train station. Sophie with her signature green bag from February. Peregrine, recently separated from Princess Maria-Olympia. Sophie, fresh from a summer breakup with Joe Jonas, now navigating a…",https://l-files.livejournal.net/og_image/3616053/496667?v=1698844914,2023-11-01T13:21:52Z,,"""Sophie Turner &amp; Peregrine Wentworth, spotted sharing a kiss at a train station. Sophie with her signature green bag from February. Peregrine, recently separated from Princess Maria-Olympia. Soph… [+487 chars]",,en,'Sophie Turner'
https://jezebel.com/sophie-turner-reportedly-spotted-making-out-with-one-of-1850979760,https://jezebel.com/sophie-turner-reportedly-spotted-making-out-with-one-of-1850979760,0,jezebel.com,Sophie Turner Reportedly Spotted Making Out With 'One of Britain's Most Eligible Bachelors',"The universe works in mysterious ways: Sophie Turner and Joe Jonas reportedly separated because, among other alleged reasons, they disagreed on whether to raise their two young daughters in England. Now, mere weeks after the exes confirmed that they’ve worked…","https://i.kinja-img.com/image/upload/c_fill,h_675,pg_1,q_80,w_1200/7a1c2a248deac75ea5d73d4b25a67055.png",2023-11-01T13:48:00Z,,"The universe works in mysterious ways: Sophie Turner and Joe Jonas reportedly separated because, among other alleged reasons, they disagreed on whether to raise their two young daughters in England. … [+2275 chars]",,en,'Sophie Turner'
https://hollywoodlife.com/2023/11/01/sophie-turner-spotted-kissing-peregrine-pearson-amid-joe-jonas-divorce/,https://hollywoodlife.com/2023/11/01/sophie-turner-spotted-kissing-peregrine-pearson-amid-joe-jonas-divorce/,0,hollywoodlife.com,Sophie Turner Spotted Kissing British Billionaire Peregrine Pearson Amid Joe Jonas Divorce,"The ‘Game of Thrones’ alum was seen getting cozy with the aristocrat, who just broke up with King Charles’ goddaughter, Princess Maria-Olympia",https://hollywoodlife.com/wp-content/uploads/2023/11/sophie-turner-featured.jpg?quality=100,2023-11-01T13:56:34Z,,"Image Credit: Image Press Agency/NurPhoto/Shutterstock
Sophie Turner is embracing the single life amid her divorce from estranged husband Joe Jonas. The former Game of Thrones actress, 27, was spott… [+2789 chars]",,en,'Sophie Turner'
https://www.justjared.com/2023/11/01/over-40-stars-have-their-own-barbie-dolls-including-4-royals-2-athletes-5-grammy-winners-more/,https://www.justjared.com/2023/11/01/over-40-stars-have-their-own-barbie-dolls-including-4-royals-2-athletes-5-grammy-winners-more/,0,www.justjared.com,"Over 40 Stars Have Their Own Barbie Dolls, Including 4 Royals, 2 Athletes, 5 Grammy Winners & More!","Margot Robbie isn’t the only star that has been turned into a Barbie doll. For years, Mattel has honored many celebrities with special, one-of-a-kind dolls in recognition of their attributes to pop culture, activism and more. Barbie first launched their mega …",https://cdn.justjared.com/wp-content/uploads/headlines/2023/11/celebs-barbies.jpg,2023-11-01T15:26:13Z,,"Margot Robbie isn’t the only star that has been turned into a Barbie doll.
For years, Mattel has honored many celebrities with special, one-of-a-kind dolls in recognition of their attributes to pop … [+607 chars]",,en,'Margot Robbie'
https://pagesix.com/celebrity-news/who-is-sophie-turner-boyfriend-peregrine-pearson/,https://pagesix.com/celebrity-news/who-is-sophie-turner-boyfriend-peregrine-pearson/,0,pagesix.com,"Meet Peregrine Pearson, Sophie Turner’s rumored new aristocrat boyfriend","The ""Game of Thrones"" star and the heir to the 4th Viscount Cowdray reportedly locked lips in Paris in broad daylight amid her divorce from Joe Jonas.",https://pagesix.com/wp-content/uploads/sites/3/2023/11/Meet-Peregrine-Pearson-Sophie-Turner-rumored-new-aristocrat-boyfriend.jpg?quality=75&strip=all&w=1024,2023-11-01T15:46:03Z,https://web.archive.org/web/20231101154802/https://pagesix.com/celebrity-news/who-is-sophie-turner-boyfriend-peregrine-pearson/,"Rumor has it Sophie Turner has someone special in her life but who is Peregrine Perry John Dickinson Pearson?
The “Game of Thrones” star was reportedly spotted locking lips with the aristocrat in Oc… [+2837 chars]",,en,'Sophie Turner'
https://www.globalresearch.ca/nato-provoked-putin-stoltenberg-comes-clean-ukraine-war/5838529,https://www.globalresearch.ca/nato-provoked-putin-stoltenberg-comes-clean-ukraine-war/5838529,0,www.globalresearch.ca,NATO Provoked Putin: Stoltenberg “Comes Clean” on the Ukraine War. “The War Started in 2014”,"All Global Research articles can be read in 51 languages by activating the Translate Website button below the author’s name.
To receive Global Research’s Daily Newsletter (selected articles), click here.
Click the share button above to email/forward this arti…",https://www.globalresearch.ca/wp-content/uploads/2023/09/russia-nato.jpg,2023-11-01T15:55:08Z,https://web.archive.org/web/20231102054733/https://www.globalresearch.ca/nato-provoked-putin-stoltenberg-comes-clean-ukraine-war/5838529,"All Global Research articles can be read in 51 languages by activating the Translate Website button below the authors name.
To receive Global Researchs Daily Newsletter (selected articles), click he… [+9311 chars]",,en,'Jens Stoltenberg'
https://www.eonline.com/news/1389062/sophie-turner-kisses-british-aristocrat-peregrine-pearson-after-joe-jonas-break-up,https://www.eonline.com/news/1389062/sophie-turner-kisses-british-aristocrat-peregrine-pearson-after-joe-jonas-break-up,0,www.eonline.com,Sophie Turner Kisses Aristocrat Peregrine Pearson Amid Joe Jonas Split,"Perhaps a new relationship is coming for Sophie Turner.
The Game of Thrones alum was photographed Oct. 28 kissing British aristocrat Peregrine Pearson during an outing in Paris. In a photo...","https://akns-images.eonline.com/eol_images/Entire_Site/2023101/rs_1200x1200-231101074249-Sophie_SPLIT_.jpg?fit=around%7C1080:1080&output-quality=90&crop=1080:1080;center,top",2023-11-01T16:04:00Z,,"Perhaps a new relationship is coming for Sophie Turner.
The Game of Thrones alum was photographed Oct. 28 kissing British aristocrat Peregrine Pearson during an outing in Paris. In a photo published… [+899 chars]",,en,'Sophie Turner'
http://www.thecut.com/2023/11/sophie-turner-peregrine-pearson-aristocrat-kiss.html,http://www.thecut.com/2023/11/sophie-turner-peregrine-pearson-aristocrat-kiss.html,0,www.thecut.com,Who’s This Aristocrat Kissing Sophie Turner?,"Amid her divorce from Joe Jonas, Sophie Turner was spotted kissing someone royal at a train station in Paris: Future viscount Peregrine Pearson, who until very recently was dating King Charles’s goddaughter. There’s a rebound for everyone.",https://pyxis.nymag.com/v1/imgs/f46/76e/02ab97660667a72e39d6237ad4973985ee-sophie-turner-peregrine-pearson.1x.rsocial.w1200.jpg,2023-11-01T16:17:58Z,,"Whos your ideal rebound? An emotionally unavailable chef?A problematic musician? How about the heir to the 4th Viscount Cowdray? Unattainable for some, maybe, but not for Sophie Turner, who was spott… [+1652 chars]",,en,'Sophie Turner'
https://www.tmz.com/2023/11/01/britney-spears-childhood-home-louisiana-market/,https://www.tmz.com/2023/11/01/britney-spears-childhood-home-louisiana-market/,0,www.tmz.com,Britney Spears Childhood Louisiana Home On Market For $1.2 Million,"Britney Spears' childhood home in Kentwood, Louisiana hit the market Tuesday for a cool $1.2M ... TMZ has learned. Nearly 2 and a half years after the property was sold by the pop star's estranged father, Jamie Spears, for just $289K ... the new…",https://imagez.tmz.com/image/fb/16by9/2023/11/01/fb681b8f334a4bf4b4569847745a0dc9_xl.png,2023-11-01T17:20:33Z,,"Britney Spears' childhood home in Kentwood, Louisiana hit the market Tuesday for a cool $1.2M ... TMZ has learned.
Nearly 2 and a half years after the property was sold by the pop star's estranged f… [+1227 chars]",,en,'Britney Spears'
https://www.vanityfair.com/style/2023/11/mathew-rosengart-britney-spears-lawyer,https://www.vanityfair.com/style/2023/11/mathew-rosengart-britney-spears-lawyer,0,www.vanityfair.com,How Britney Spears’s Lawyer Mathew Rosengart Helped Regain Her Right to Risk,"With the recent release of Britney Spears’s memoir, the pop star has been able to tell her side of the 13-year conservatorship that once ruled her life. Mathew Rosengart, the attorney who played a crucial part in ending it, reflects on his client’s plight the…","https://media.vanityfair.com/photos/6536bef3077939f0a7086fcf/16:9/w_1280,c_limit/vf1023-Rosengart-001.jpg",2023-11-01T17:30:00Z,,"Britney Spearss case was not a typical one for attorney Mathew Rosengart. It was a matter of probate law, and he had never pursued a probate conservatorship case. He could not, prior to summer 2021, … [+9448 chars]",,en,'Sam Asghari'
https://www.newsweek.com/angelina-jolie-losing-fans-over-israel-gaza-comment-1839947,https://www.newsweek.com/angelina-jolie-losing-fans-over-israel-gaza-comment-1839947,0,www.newsweek.com,Angelina Jolie Is Losing Fans Over Israel-Gaza Comment,"""You've lost my respect,"" wrote one social media user, while another said: ""Disappointed but then again expected nothing less from the likes of you!!""",https://d.newsweek.com/en/full/2302978/angelina-jolie-2019.png,2023-11-01T17:51:11Z,,"When commenting on such a complex political issue as the Israel-Hamas conflict, celebrities are bound to ruffle a few feathers.
While famous faces supporting either Israel or Palestinians may expect… [+4840 chars]",,en,'Angelina Jolie'
https://biztoc.com/x/f9540d817fff88cd,https://biztoc.com/x/f9540d817fff88cd,0,biztoc.com,Angelina Jolie is losing fans over Israel-Gaza comment,"When commenting on such a complex political issue as the Israel-Hamas conflict, celebrities are bound to ruffle a few feathers. While famous faces supporting either Israel or Palestinians may expect to divide opinions, even stars choosing to remain impartial …",https://c.biztoc.com/p/f9540d817fff88cd/s.webp,2023-11-01T17:56:07Z,,"When commenting on such a complex political issue as the Israel-Hamas conflict, celebrities are bound to ruffle a few feathers.While famous faces supporting either Israel or Palestinians may expect t… [+287 chars]",,en,'Angelina Jolie'
https://www.usmagazine.com/celebrity-news/news/inside-sophie-turners-dating-status-after-peregrine-pearson-pics/#article,https://www.usmagazine.com/celebrity-news/news/inside-sophie-turners-dating-status-after-peregrine-pearson-pics/#article,0,www.usmagazine.com,"Sophie Turner Isn’t in 'Committed' Relationship, But Open to Dating Again","Sophie Turner has reentered the dating scene following her split from estranged husband Joe Jonas, but she’s taking it slow. “Sophie is open to the idea of dating again,” a source exclusively tells Us Weekly. “She isn’t fully committed to anybody at the momen…",https://www.usmagazine.com/wp-content/uploads/2023/11/Sophie-Turner-Isnt-Fully-Committed-to-Anyone-But-Open-to-Dating-After-Joe-Jonas-Split-Source.jpg?crop=0px%2C82px%2C1562px%2C821px&resize=1200%2C630&quality=86&strip=all,2023-11-01T19:02:38Z,,"Sophie Turner, Joe JonasIgnat/Bauer-Griffin;Dia Dipasupil/GC Images(2),Getty Images(2)
Sophie Turnerhas reentered the dating scene following her split from estranged husband Joe Jonas, but shes taki… [+3036 chars]",,en,'Sophie Turner'
https://www.gofugyourself.com/for-some-reason-sophie-turner-presented-the-rugby-world-cup-trophy-11-2023,https://www.gofugyourself.com/for-some-reason-sophie-turner-presented-the-rugby-world-cup-trophy-11-2023,0,www.gofugyourself.com,For Some Reason Sophie Turner Presented the Rugby World Cup Trophy,"I mean... why not!
The post For Some Reason Sophie Turner Presented the Rugby World Cup Trophy first appeared on Go Fug Yourself.",https://static.gofugyourself.com/uploads/2023/11/GettyImages-1764813496-1698731199.jpg,2023-11-01T19:12:02Z,,"When I say that Sophie Turner presented the World Cup trophy, I mean that she literally helped present its existence to the crowd before the match; she did not physically hand it to the winning team … [+1236 chars]",,en,'Sophie Turner'
https://pagesix.com/2023/11/01/parents/joe-jonas-takes-daughters-out-on-halloween-as-sophie-turner-kisses-aristocrat/,https://pagesix.com/2023/11/01/parents/joe-jonas-takes-daughters-out-on-halloween-as-sophie-turner-kisses-aristocrat/,0,pagesix.com,Joe Jonas gives daughters the royal treatment on Halloween as Sophie Turner moves on with aristocrat,The musician was photographed strolling the streets of NYC Monday evening while pushing 3-year-old Willa and 1-year-old Delphine in a princess-themed carriage.,https://pagesix.com/wp-content/uploads/sites/3/2023/11/NYPICHPDPICT000071623129.jpg?quality=75&strip=all&w=1024,2023-11-01T19:16:36Z,https://web.archive.org/web/20231101191745/https://pagesix.com/2023/11/01/parents/joe-jonas-takes-daughters-out-on-halloween-as-sophie-turner-kisses-aristocrat/,"Joe Jonas is a sucker for his daughters.
While his estranged wife was macking on an English aristocrat across the pond, the Jonas Brothers frontman was dressed as Prince Charming while taking their … [+3619 chars]",,en,'Sophie Turner'
https://www.eonline.com/news/1389084/who-is-peregrine-pearson-bend-the-knee-to-these-details-about-sophie-turners-rumored-new-man,https://www.eonline.com/news/1389084/who-is-peregrine-pearson-bend-the-knee-to-these-details-about-sophie-turners-rumored-new-man,0,www.eonline.com,Who Is Peregrine Pearson? Details on Sophie Turner's Rumored New Man,"There's a lot more nobility behind Peregrine ""Perry"" Pearson than you would've guessed. ICYMI, the British aristocrat was spotted kissing Game of Thrones alum Sophie Turner during an outing in...","https://akns-images.eonline.com/eol_images/Entire_Site/2023101/rs_1200x1200-231101121001-Perry1200X1200_SPLIT_.jpg?fit=around%7C1080:1080&output-quality=90&crop=1080:1080;center,top",2023-11-01T19:38:33Z,,"Who is Peregrine ""Perry"" Pearson?
The 29-year-old is a British aristocrat, property developer, and a descendant of Samuel Pearson, the entrepreneur who founded the London-based publishing company, P… [+1245 chars]",,en,'Sophie Turner'
https://www.pajiba.com/celebrities_are_better_than_you/sophie-turner-rebounds-with-peregrine-perry-john-dickinson-pearson-british-aristocrat.php,https://www.pajiba.com/celebrities_are_better_than_you/sophie-turner-rebounds-with-peregrine-perry-john-dickinson-pearson-british-aristocrat.php,0,www.pajiba.com,"Sophie Turner Rebounds With Peregrine 'Perry' John Dickinson Pearson, British Aristocrat","It's been nearly two months since Sophie Turner and Joe Jonas announced they were breaking up after four years of marriage. Since then, Sophie's been focused on her kids, work, much needed girls nights out, and figuring out a temporary...",https://www.pajiba.com/assets_c/2023/11/peregrine%20sophie%20turner%20perry-thumb-700x500-257956.png,2023-11-01T20:00:00Z,https://web.archive.org/web/20231101213926/https://www.pajiba.com/celebrities_are_better_than_you/sophie-turner-rebounds-with-peregrine-perry-john-dickinson-pearson-british-aristocrat.php,"It's been nearly two months since Sophie Turner and Joe Jonas announced they were breaking up after four years of marriage. Since then, Sophie's been focused on her kids, work, much needed girls nigh… [+3717 chars]",,en,'Sophie Turner'
https://www.7x7.com/banana-republic-union-square-2666057312.html,https://www.7x7.com/banana-republic-union-square-2666057312.html,0,www.7x7.com,New Banana Republic flagship brings blast of fresh air to Union Square + more local style scoop,"Just opened in Union Square, Banana Republic's chic, two-level flagship features men's and women's clothing, of course, along with decor, bedding, and furniture from BR Home.Plus, Marché is hosting a can't-miss holiday marketplace in Oakland, local artists Er…",https://www.7x7.com/media-library/image.jpg?id=50350388&width=1200&height=600&coordinates=0%2C66%2C0%2C66,2023-11-01T20:16:49Z,,"Just opened in Union Square, Banana Republic's chic, two-level flagship features men's and women's clothing, of course, along with decor, bedding, and furniture from BR Home.
Plus, Marché is hosting… [+4910 chars]",,en,'nan nan'
https://pagesix.com/2023/11/01/entertainment/sophie-turner-keeping-her-options-open-after-kissing-aristocrat-report/,https://pagesix.com/2023/11/01/entertainment/sophie-turner-keeping-her-options-open-after-kissing-aristocrat-report/,0,pagesix.com,"Sophie Turner ‘keeping her options open’ after kissing aristocrat, ‘isn’t fully committed to anybody’: report","The ""Game of Thrones"" star was spotted making out with the English aristocrat outside of a Paris train station Saturday.",https://pagesix.com/wp-content/uploads/sites/3/2023/11/sophie-turner-not-tied-to-anyone-after-kissing-british-aristocrat.jpg?quality=75&strip=all&w=1024,2023-11-01T21:39:33Z,https://web.archive.org/web/20231101214223/https://pagesix.com/2023/11/01/entertainment/sophie-turner-keeping-her-options-open-after-kissing-aristocrat-report/,"Sophie Turner isn’t yet committing to anyone new despite locking lips with an English aristocrat amid her divorce from Joe Jonas.
Sophie is open to the idea of dating again, a source told Us Weekly … [+2965 chars]",,en,'Sophie Turner'
https://pagesix.com/2023/11/01/celebrity-news/see-photos-of-sophie-turner-kissing-aristocrat-peregrine-pearson-amid-joe-jonas-divorce-custody-battle/,https://pagesix.com/2023/11/01/celebrity-news/see-photos-of-sophie-turner-kissing-aristocrat-peregrine-pearson-amid-joe-jonas-divorce-custody-battle/,0,pagesix.com,"See photos of Sophie Turner kissing aristocrat Peregrine Pearson amid Joe Jonas divorce, custody battle","The ""Game of Thrones"" star, 27, and the British aristocrat, 29, were spotted locking lips in Paris over the weekend following their respective breakups.",https://pagesix.com/wp-content/uploads/sites/3/2023/11/NYPICHPDPICT000071634726.jpg?quality=75&strip=all&w=1024,2023-11-01T22:17:12Z,https://web.archive.org/web/20231101221746/https://pagesix.com/2023/11/01/celebrity-news/see-photos-of-sophie-turner-kissing-aristocrat-peregrine-pearson-amid-joe-jonas-divorce-custody-battle/,"Anything can happen in the City of Love. 
Sophie Turner, 27, was photographed sharing a sweet smooch with Peregrine Perry John Dickinson Pearson  heir to the 4th Viscount Cowdray, a county in Sussex… [+2927 chars]",,en,'Sophie Turner'
https://www.eonline.com/news/1389117/see-the-photo-of-sophie-turner-and-aristocrat-peregrine-pearsons-paris-pda,https://www.eonline.com/news/1389117/see-the-photo-of-sophie-turner-and-aristocrat-peregrine-pearsons-paris-pda,0,www.eonline.com,See the Photo of Sophie Turner and Peregrine Pearson's Paris PDA,"The Queen of the North is getting cozy in Paris.
Sophie Turner was photographed out and about in the City of Love, kissing British aristocrat Peregrine Pearson amid her divorce from Joe Jonas...","https://akns-images.eonline.com/eol_images/Entire_Site/2023821/cr_1200x1200-230921174234-GettyImages-1471685867.jpg?fit=around%7C1080:1080&output-quality=90&crop=1080:1080;center,top",2023-11-01T22:29:00Z,,"The Queen of the North is getting cozy in Paris.
Sophie Turner was photographed out and about in the City of Love, kissing British aristocratPeregrine Pearson amid her divorce from Joe Jonas after f… [+807 chars]",,en,'Sophie Turner'
