index,url,valid,domain,title,description,image,published,archive,content,quote,language,keyword
https://www.newsweek.com/entertainment/celebrity-news/travis-kelce-early-reservations-taylor-swift-relationship-jason-kelce-1949409,https://www.newsweek.com/entertainment/celebrity-news/travis-kelce-early-reservations-taylor-swift-relationship-jason-kelce-1949409,0,www.newsweek.com,"Travis Kelce's Early Reservations About Dating Taylor Swift, According to Jason Kelce",The NFL player's older brother revealed Travis was cautious in his early days dating the pop star.,https://d.newsweek.com/en/full/2465166/travis-taylor.jpg,2024-09-05T15:35:43Z,,"Entertainment gossip and news from Newsweek's network of contributors
Travis Kelce was initially tight-lipped about his romance with Taylor Swift, even keeping his brother Jason in the dark about th… [+2849 chars]",,en,'Travis Kelce'
https://hollywoodlife.com/2024/09/05/jason-kelce-shares-insight-into-travis-cautious-mindset-at-start-of-swift-romance/,https://hollywoodlife.com/2024/09/05/jason-kelce-shares-insight-into-travis-cautious-mindset-at-start-of-swift-romance/,0,hollywoodlife.com,Jason Kelce Shares Insight into Travis’ Mindset at Start of Taylor Swift Romance,"""He was very cautious about even telling me or anybody,” Jason shared on 'The Pivot Podcast.'",https://hollywoodlife.com/wp-content/uploads/2024/09/GettyImages-2161358910-e1725549684115.jpg?fit=5472%2C3091,2024-09-05T15:47:41Z,,"Image Credit: Getty Images
When Travis Kelce first started dating Taylor Swift, he was apparently reluctant to share the details, even with his brother, Jason Kelce.
I think he was very cautious ab… [+2432 chars]",,en,'Travis Kelce'
https://ambcrypto.com/kamala-harris-super-pac-opens-its-doors-for-crypto-donations/,https://ambcrypto.com/kamala-harris-super-pac-opens-its-doors-for-crypto-donations/,0,ambcrypto.com,Kamala Harris-linked Super PAC opens its doors for crypto donations,"Cryptos are a hot button election issue, and this Super PAC news proved that yet again!",https://ambcrypto.com/wp-content/uploads/2024/09/Harris-3-1000x600.webp,2024-09-05T16:30:23Z,,<ul><li>Harris campaign may have taken the first steps towards crypto donations</li><li>Crypto executives backing harris will soon organize a fundraiser too</li></ul>After months of being on the back… [+2434 chars],,en,'Elizabeth Warren'
https://www.cinemablend.com/movies/the-best-10s-movies-for-these-actors,https://www.cinemablend.com/movies/the-best-10s-movies-for-these-actors,0,www.cinemablend.com,The Best '10s Movies For These 32 Actors,From Emma Stone to Mahershala Ali to Matthew McConaughey.,https://cdn.mos.cms.futurecdn.net/Ws5vHsnjMQzFwNXD3VdJME-1200-80.jpg,2024-09-05T16:33:26Z,,"The 2010s were a transformative decade for movies as directors like Damien Chazelle, Greta Gerwig and Jordan Peele hit the mainstream, and many actors exploded into stardom or gave career-defining pe… [+13609 chars]",,en,'Emma Stone'
https://www.vox.com/2024-elections/370194/harris-foreign-policy-gaza-ukraine-china,https://www.vox.com/2024-elections/370194/harris-foreign-policy-gaza-ukraine-china,0,www.vox.com,The guessing game over Kamala Harris’s foreign policy,"Is Vice President Kamala Harris a “human rights hawk,” who would use American power to promote democracy and freedom abroad? Or is she a “pragmatic internationalist” who would back gingerly away from American hegemony? Is she poised to end an era of American …",https://platform.vox.com/wp-content/uploads/sites/2/2024/09/gettyimages-2010307889.jpg?quality=90&strip=all&crop=0%2C9.3491875543889%2C100%2C81.301624891222&w=1200,2024-09-05T17:15:59Z,http://wayback.archive-it.org/all/20240906132004/https://www.vox.com/2024-elections/370194/harris-foreign-policy-gaza-ukraine-china,"Is Vice President Kamala Harris a human rights hawk, who would use American power to promote democracy and freedom abroad? Or is she a pragmatic internationalist who would back gingerly away from Ame… [+7278 chars]",,en,'George Bush'
https://abcnews.go.com/US/wireStory/markey-warren-condemn-stewards-ceo-refusing-comply-senate-113423656,https://abcnews.go.com/US/wireStory/markey-warren-condemn-stewards-ceo-refusing-comply-senate-113423656,0,abcnews.go.com,Markey and Warren condemn Steward's CEO for refusing to comply with a Senate subpoena,Massachusetts U.S. Sens. Edward Markey and Elizabeth Warren are among several political leaders who are attacking the leader of a troubled health care system for refusing to comply with a subpoena to appear before a Senate committee,https://i.abcnewsfe.com/a/c7dfe47c-ba8d-42c3-ae50-1d0a601fa63e/wirestory_7eefc8b915866600928e21e919616ef9_16x9.jpg?w=1600,2024-09-05T17:26:29Z,,"BOSTON -- Several political leaders, including Massachusetts U.S. Sens. Edward Markey and Elizabeth Warren, attacked the leader of a troubled health care system on Thursday for refusing to comply wit… [+3210 chars]",,en,'Elizabeth Warren'
https://biztoc.com/x/6c2117771ee8e3eb,https://biztoc.com/x/6c2117771ee8e3eb,0,biztoc.com,Markey and Warren condemn Steward's CEO for refusing to comply with a Senate subpoena,"Several political leaders, including Massachusetts U.S. Sens. Edward Markey and Elizabeth Warren, attacked the leader of a troubled health care system on Thursday for refusing to comply with a subpoena to appear before a Senate committee.
Lawyers for Steward …",https://biztoc.com/cdn/6c2117771ee8e3eb_s.webp,2024-09-05T17:29:37Z,,"Several political leaders, including Massachusetts U.S. Sens. Edward Markey and Elizabeth Warren, attacked the leader of a troubled health care system on Thursday for refusing to comply with a subpoe… [+133 chars]",,en,'Elizabeth Warren'
https://www.darkhorizons.com/series-trailer-taylor-sheridans-landman/,https://www.darkhorizons.com/series-trailer-taylor-sheridans-landman/,0,www.darkhorizons.com,Series Trailer: Taylor Sheridan’s “Landman”,"Paramount+ has released the trailer for “Yellowstone” creator Taylor Sheridan’s new drama series “Landman”. The contemporary set series boasts an impressive cast including Billy Bob Thornton, Jon Hamm, Demi Moore, Michelle Randolph, Kayla Wallace, James Jorda…",https://cdndark.darkhorizons.com/wp-content/uploads/2024/09/series-trailer-taylor-sheridans-landman.jpg,2024-09-05T17:49:50Z,https://web.archive.org/web/20240905210446/https://www.darkhorizons.com/series-trailer-taylor-sheridans-landman/,"Paramount+ has released the trailer for “Yellowstone” creator Taylor Sheridan’s new drama series “Landman”.
The contemporary set series boasts an impressive cast including Billy Bob Thornton, Jon Ha… [+965 chars]",,en,'Jon Hamm'
https://biztoc.com/x/dd8f923f1d4f3050,https://biztoc.com/x/dd8f923f1d4f3050,0,biztoc.com,Markey and Warren condemn Steward’s CEO for refusing to comply with a Senate subpoena,Massachusetts U.S. Sens. Edward Markey and Elizabeth Warren are among several political leaders who are attacking the leader of a troubled health care system for refusing to comply with a subpoena to appear before a Senate committee.,https://biztoc.com/cdn/dd8f923f1d4f3050_s.webp,2024-09-05T17:52:25Z,,Massachusetts U.S. Sens. Edward Markey and Elizabeth Warren are among several political leaders who are attacking the leader of a troubled health care system for refusing to comply with a subpoena to… [+87 chars],,en,'Elizabeth Warren'
https://dailycaller.com/2024/09/05/jonathan-turley-hunter-biden-headed-to-jail/,https://dailycaller.com/2024/09/05/jonathan-turley-hunter-biden-headed-to-jail/,0,dailycaller.com,‘Legal Death Wish’: Jonathan Turley Says Hunter Biden Likely Headed To Jail,"George Washington University law professor Jonathan Turley said that despite a sudden guilty plea, Hunter Biden would likely face prison time on tax charges.",https://cdn01.dailycaller.com/wp-content/uploads/2024/09/DCNF-Turley-Biden-Plea-Change-Featured.jpg,2024-09-05T18:08:32Z,https://web.archive.org/web/20240905192106/https://dailycaller.com/2024/09/05/jonathan-turley-hunter-biden-headed-to-jail/,"Readers,
Instead of sucking up to the political and corporate powers that dominate America, The Daily Caller is fighting for you our readers. We humbly ask you to consider joining us in this fight.… [+3541 chars]",,en,'Jonathan Turley'
https://www.foxnews.com/media/jonathan-turley-says-hunter-biden-lost-his-game-chicken-guilty-plea-tax-case,https://www.foxnews.com/media/jonathan-turley-says-hunter-biden-lost-his-game-chicken-guilty-plea-tax-case,0,www.foxnews.com,Jonathan Turley says Hunter Biden 'lost his game of chicken' with guilty plea in tax case,"Constitutional law expert Jonathan Turley joined ""Outnumbered"" Thursday to discuss Hunter Biden expecting to plead guilty in tax case and likely face jail time.",https://static.foxnews.com/foxnews.com/content/uploads/2024/02/Hunter-Biden-Abbe-Lowell-Congress-Deposition.jpg,2024-09-05T18:30:50Z,https://web.archive.org/web/20240905185317/https://www.foxnews.com/media/jonathan-turley-says-hunter-biden-lost-his-game-chicken-guilty-plea-tax-case,"Join Fox News for access to this content
Plus special access to select articles and other premium content with your account - free of charge.
By entering your email and pushing continue, you are ag… [+2881 chars]",,en,'Hunter Biden'
https://reason.com/2024/09/05/kamala-harris-vs-elon-musk/,https://reason.com/2024/09/05/kamala-harris-vs-elon-musk/,0,reason.com,Kamala Harris vs. Elon Musk,The Democratic nominee has favored policing online speech. Would a future Harris administration defend free expression?,https://d2eehagpk5cl65.cloudfront.net/img/q60/uploads/2022/12/Elon_Musk_Colorado_2022.jpeg,2024-09-05T18:33:51Z,,"Would President Kamala Harris shut down X, the social media site now run by Elon Musk? Supporters of former President Donald Trumpincluding Musk himselfcertainly seem to think so.
Robert F. Kennedy … [+8710 chars]",,en,'Elizabeth Warren'
https://www.cbsnews.com/news/whistleblower-steward-health-care-ceo-ralph-de-la-torre-malta/,https://www.cbsnews.com/news/whistleblower-steward-health-care-ceo-ralph-de-la-torre-malta/,0,www.cbsnews.com,Whistleblower claims Steward CEO bragged he could sway foreign officials with bags of cash,Federal grand jury focuses on financial activities of Steward Health Care under CEO Ralph de la Torre.,https://assets2.cbsnewsstatic.com/hub/i/r/2024/09/05/cd1c66e2-7654-4740-84a3-22ee3df6b8f3/thumbnail/1200x630g2/f7a37c939fb6d3fb0e899936e724fab0/ram-tumuluri.jpg?v=631cf5f2b4e8db7f9bc428589402864d,2024-09-05T19:57:32Z,,A whistleblower has come forward to Congress alleging Steward Health Care CEO Ralph de la Torre and other Steward executives illegally conspired with foreign officials to secure a hospital contract a… [+9722 chars],,en,'nan nan'
https://dailycaller.com/2024/09/05/jonathan-turley-hunter-bidens-lawyers-plea-deal/,https://dailycaller.com/2024/09/05/jonathan-turley-hunter-bidens-lawyers-plea-deal/,0,dailycaller.com,Jonathan Turley Says He Thinks Hunter Biden’s Lawyers Put Him In ‘Worst Possible Position’ With Plea Switch,Jonathan Turley criticized Hunter Biden's attorneys on Thursday for proposing to change his plea to avoid a trial in his federal tax case.,https://cdn01.dailycaller.com/wp-content/uploads/2024/09/Screenshot-2024-09-05-4.07.37-PM-e1725566944900.png,2024-09-05T20:25:28Z,https://web.archive.org/web/20240905215151/https://dailycaller.com/2024/09/05/jonathan-turley-hunter-bidens-lawyers-plea-deal/,"Readers,
Instead of sucking up to the political and corporate powers that dominate America, The Daily Caller is fighting for you our readers. We humbly ask you to consider joining us in this fight.… [+3541 chars]",,en,'Jonathan Turley'
https://www.businessinsider.com/diamond-certified-albums-made-by-women-riaa,https://www.businessinsider.com/diamond-certified-albums-made-by-women-riaa,0,www.businessinsider.com,Only 30 albums by women have been certified diamond — here they all are,"Out of more than 100 diamond-certified albums, only a handful are by women or female-fronted bands. Katy Perry is the most recent addition.",https://i.insider.com/66da0acca0ff598b2664fe50?width=1200&format=jpeg,2024-09-05T20:29:30Z,,"Whitney Houston and Shania Twain each have three diamond-certified albums.David Corio/Redferns; Paul Natkin/Getty Images
<ul>
<li>The RIAA gives diamond certifications (upon request) to albums that … [+4975 chars]",,en,'Britney Spears'
https://www.esquire.com/entertainment/tv/a62067471/travis-kelce-commercials-reaction/,https://www.esquire.com/entertainment/tv/a62067471/travis-kelce-commercials-reaction/,0,www.esquire.com,I'm Really Questioning How Much Travis Kelce Is Too Much Travis Kelce,Gladiator Travis Kelce! Creepy Ryan Murphy Travis Kelce! And the one who plays football sometimes!,"https://hips.hearstapps.com/hmg-prod/images/screenshot-2024-09-05-at-4-22-49-pm-66da1321f0d52.png?crop=1.00xw:0.533xh;0,0.0784xh&resize=1200:*",2024-09-05T22:34:00Z,,"Do me a favor. Watch the beginning of this trailer for Ryan Murphy's new creepo FXshow, Grotesquerie (streaming below), but pretend like you don't know it's a trailer for Grotesquerie. You'll find a … [+2969 chars]",,en,'Kylie Kelce'
https://www.cinemablend.com/movies/brad-pitt-george-clooney-rumored-ocean-s-14-may-have-landed-director-edward-berger,https://www.cinemablend.com/movies/brad-pitt-george-clooney-rumored-ocean-s-14-may-have-landed-director-edward-berger,0,www.cinemablend.com,"Brad Pitt And George Clooney's Rumored Ocean's 14 May Have Landed A Director, And I Don't Know If I'm Totally On Board With This Shakeup… Yet",It's once again time to ask if we're in or we're out with the Ocean's gang.,https://cdn.mos.cms.futurecdn.net/vhMMi5fm2vC3nKFSGLuZyL-1200-80.jpg,2024-09-05T22:56:30Z,,"As the Venice Film Festival has highlighted some late 2024 movies
 to mark down on the calendar, the dark comedy Wolfs continues to pick up steam. The on-screen reunion of George Clooney and Brad Pi… [+3735 chars]",,en,'Brad Pitt'
https://www.foxnews.com/politics/hunter-bidens-high-drama-day-court-ends-shocking-guilty-plea,https://www.foxnews.com/politics/hunter-bidens-high-drama-day-court-ends-shocking-guilty-plea,0,www.foxnews.com,Hunter Biden's 'high drama' day in court ends in shocking guilty plea,"The criminal trial of first son Hunter Biden for federal tax charges was expected to get underway in normal order, before he said he intended to plead guilty to the charges in a shocking twist.",https://static.foxnews.com/foxnews.com/content/uploads/2024/09/Hunter-Biden-Court-Sketch-LA-Tax-Trial_01.jpg,2024-09-05T23:18:12Z,,"The criminal trial of first son Hunter Biden for federal tax charges was expected to get underway in normal order Thursday, until the younger Biden said he intended to plead guilty to the charges in … [+5946 chars]",,en,'Hunter Biden'
https://www.hoover.org/research/what-ukraine-gains-kursk-incursion,https://www.hoover.org/research/what-ukraine-gains-kursk-incursion,0,www.hoover.org,What Ukraine Gains from the Kursk Incursion,The operation reinforces the view that Putin is weak and Zelenskyy is far from defeated.,https://www.hoover.org/sites/default/files/styles/facebook/public/images/media/existing/istock-655630006.jpg?h=4201be17&itok=l78e4UKd,2024-09-06T00:00:00Z,https://web.archive.org/web/20240906195955/https://www.hoover.org/research/what-ukraine-gains-kursk-incursion,The political implications of Ukraines military incursion into the Kursk region of Russia are becoming increasingly clear: it is bad for Vladimir Putin and Russian society and good for Volodymyr Zele… [+4348 chars],,en,'Putin'
https://www.dailysignal.com/2024/09/05/hunter-biden-pleads-guilty-to-tax-charges/,https://www.dailysignal.com/2024/09/05/hunter-biden-pleads-guilty-to-tax-charges/,0,www.dailysignal.com,Hunter Biden Pleads Guilty to Tax Charges,"DAILY CALLER NEWS FOUNDATION—Hunter Biden pleaded guilty Thursday to federal tax charges in California, according to multiple reports. President Joe Biden‘s son pleaded guilty to... Read More
The post Hunter Biden Pleads Guilty to Tax Charges appeared first o…",https://www.dailysignal.com/wp-content/uploads/2024/09/240905_HunterPlea_DCNF.jpg,2024-09-06T00:21:57Z,https://web.archive.org/web/20240906010641/https://www.dailysignal.com/2024/09/05/hunter-biden-pleads-guilty-to-tax-charges/,"DAILY CALLER NEWS FOUNDATIONHunter Biden pleaded guilty Thursday to federal tax charges in California, according to multiple reports.
President Joe Biden‘s son pleaded guilty to each of six misdemea… [+1834 chars]",,en,'Joe Biden'
https://www.foxnews.com/opinion/jonathan-turley-sorry-hunter-theres-no-nice-way-say-youre-guilty,https://www.foxnews.com/opinion/jonathan-turley-sorry-hunter-theres-no-nice-way-say-youre-guilty,0,www.foxnews.com,"JONATHAN TURLEY: Sorry Hunter, there's no nice way to say you're guilty",Law professor and author Jonathan Turley says even Hunter Biden's 11th hour guilty plea was part of a pattern of avoiding accountability until the very last minute,https://static.foxnews.com/foxnews.com/content/uploads/2024/09/Hunter-Bidens-criminal-tax-trial-begins-with-jury-selection-in-California.jpg,2024-09-06T00:43:09Z,https://web.archive.org/web/20240906010856/https://www.foxnews.com/opinion/jonathan-turley-sorry-hunter-theres-no-nice-way-say-youre-guilty,"""Guilty."" That word repeated nine times by Hunter Biden in a federal courtroom in California represented something that he had evaded for much of his life: accountability. 
Five years ago, Biden had… [+5187 chars]",,en,'Hunter Biden'
https://www.globalresearch.ca/gazas-polio-vaccine-project-bill-gates-comes-to-the-rescue-of-palestinian-children-can-you-trust-him/5867225,https://www.globalresearch.ca/gazas-polio-vaccine-project-bill-gates-comes-to-the-rescue-of-palestinian-children-can-you-trust-him/5867225,0,www.globalresearch.ca,Gaza’s Polio Vaccine Project: Bill Gates comes to the Rescue of Palestinian Children. Can you Trust Him?,"The first thing which was denied to Palestinians was water and food. It was the onslaught of the genocide against the People of Palestine. 
Netanyahu ordered a complete blockade of the Gaza Strip starting on October 9, 2023, preventing and …
The post Gaza’s P…",https://www.globalresearch.ca/wp-content/uploads/2024/09/netanyahu-bill-gates.jpeg,2024-09-06T00:57:47Z,,"The first thing which was denied to Palestinians was water and food. It was the onslaught of the genocide against the People of Palestine. 
Netanyahu ordered a complete blockade of the Gaza Strip st… [+7716 chars]",,en,'Bill Gates'
https://nypost.com/2024/09/05/opinion/hunter-biden-ruined-himself-every-step-of-the-way-now-hes-betting-it-all-on-pardon-from-dad/,https://nypost.com/2024/09/05/opinion/hunter-biden-ruined-himself-every-step-of-the-way-now-hes-betting-it-all-on-pardon-from-dad/,0,nypost.com,Hunter Biden ruined himself every step of the way — now he’s betting it all on pardon from dad,Hunter Biden just showed the perils of playing the game of chicken with yourself.,https://nypost.com/wp-content/uploads/sites/2/2024/09/newspress-collage-e75l3mpa9-1725579315761.jpg?quality=75&strip=all&1725565029&w=1024,2024-09-06T00:59:57Z,https://web.archive.org/web/20240906013646/https://nypost.com/2024/09/05/opinion/hunter-biden-ruined-himself-every-step-of-the-way-now-hes-betting-it-all-on-pardon-from-dad/,"Hunter Biden just showed the perils of playing the game of chicken with yourself. 
For months, many of us have marveled at the sight of Hunter careening toward a cliff while declaring publicly that … [+4081 chars]",,en,'Hunter Biden'
https://www.stereogum.com/2278881/halsey-announces-new-album-the-great-impersonator-hear-ego/music/,https://www.stereogum.com/2278881/halsey-announces-new-album-the-great-impersonator-hear-ego/music/,0,www.stereogum.com,Halsey Announces New Album The Great Impersonator: Hear “Ego”,"Halsey has been rolling out her new era for the past few months. In June, she shared “The End,” co-produced by herself, Michael Uzowuru, and Alex G. The following month she shared “Lucky,” a song inspired by Britney Spears that led to a weird, short-lived tif…",https://static.stereogum.com/uploads/2024/09/Halsey-1725498441.jpeg,2024-09-06T04:00:01Z,,"Halsey has been rolling out her new era for the past few months. In June, she shared “The End,” co-produced by herself, Michael Uzowuru, and Alex G. The following month she shared “Lucky,” a song ins… [+1467 chars]",,en,'Britney Spears'
https://www.businessinsider.com/lauren-sanchez-jeff-bezo-set-rule-morning-routine-no-phones-2024-9,https://www.businessinsider.com/lauren-sanchez-jeff-bezo-set-rule-morning-routine-no-phones-2024-9,0,www.businessinsider.com,Lauren Sánchez says Jeff Bezos has a no-phone rule in the morning,"""The mornings are just for us as long as we can,"" Sánchez told People magazine.",https://i.insider.com/66da73725444ffafa762fe9b?width=1200&format=jpeg,2024-09-06T04:44:51Z,http://archive.md/20240906052009/https://www.businessinsider.com/lauren-sanchez-jeff-bezo-set-rule-morning-routine-no-phones-2024-9,"Lauren Sánchez and Jeff Bezos enjoy quiet mornings together.Stefanie Keenan/VF24/ Getty Images
<ul><li>Lauren Sánchez said her fiancé, Jeff Bezos, set a rule not to use their phones in the morning.<… [+3203 chars]",,en,'Jeff Bezos'
https://www.businessinsider.com/bill-gates-pay-billions-more-in-tax-in-charge-system-2024-9,https://www.businessinsider.com/bill-gates-pay-billions-more-in-tax-in-charge-system-2024-9,0,www.businessinsider.com,Bill Gates said if he were in charge of the US tax system he'd have paid 'tens of billions' more,"Bill Gates told the Independent he'd pay ""tens of billions"" more if he designed the US tax system, and that economic power shouldn't be generational.",https://i.insider.com/66dacda35444ffafa7630654?width=1200&format=jpeg,2024-09-06T10:44:19Z,,"Bill Gates is one of the world's wealthiest people.Sean Gallup/Getty Images
<ul><li>Bill Gates said he would be billions of dollars poorer if he were in charge of the US tax system.</li><li>He told … [+2346 chars]",,en,'Bill Gates'
https://nypost.com/2024/09/06/entertainment/king-charles-leaves-siblings-princess-anne-prince-edward-disappointed-over-andrew-feud-report/,https://nypost.com/2024/09/06/entertainment/king-charles-leaves-siblings-princess-anne-prince-edward-disappointed-over-andrew-feud-report/,0,nypost.com,"King Charles leaves siblings Princess Anne, Prince Edward ‘disappointed’ over Andrew feud: report",Princess Anne and Prince Edward are reportedly unhappy with the monarch's handling of things as his disgraced brother refuses to move out of the Royal Lodge.,https://nypost.com/wp-content/uploads/sites/2/2024/09/89051992.jpg?quality=75&strip=all&w=1024,2024-09-06T10:57:00Z,https://web.archive.org/web/20240906185716/https://nypost.com/2024/09/06/entertainment/king-charles-leaves-siblings-princess-anne-prince-edward-disappointed-over-andrew-feud-report/,"King Charles’ ongoing feud with his scandal-scarred brother Prince Andrew has left their siblings “disappointed,” according to a new report.
Princess Anne, Prince Edward, and his wife Sophie are rep… [+2617 chars]",,en,'Prince Andrew'
https://biztoc.com/x/796eedbd499a8ee8,https://biztoc.com/x/796eedbd499a8ee8,0,biztoc.com,"""That Has To Stop"": Harris Denounces Unfettered Free Speech In 2019 CNN Interview","""That Has To Stop"": Harris Denounces Unfettered Free Speech In 2019 CNN Interview
 
Authored by Jonathan Turley,
I previously wrote how a Harris-Walz Administration would be a nightmare for free speech. Both candidates have shown pronounced anti-free speech v…",https://biztoc.com/cdn/796eedbd499a8ee8_s.webp,2024-09-06T11:29:09Z,,"""That Has To Stop"": Harris Denounces Unfettered Free Speech In 2019 CNN Interview
Authored by Jonathan Turley,I previously wrote how a Harris-Walz Administration would be a nightmare for free speech… [+132 chars]",,en,'Jonathan Turley'
https://www.businessinsider.com/elizabeth-warren-backs-justice-department-nvidia-antitrust-investigation-2024-9,https://www.businessinsider.com/elizabeth-warren-backs-justice-department-nvidia-antitrust-investigation-2024-9,0,www.businessinsider.com,EXCLUSIVE: Sen. Elizabeth Warren backs DOJ investigation into Nvidia antitrust allegations,"Nvidia's chipmaking dominance starves startups and competitors, Elizabeth Warren wrote in a letter to the Justice Department.",https://i.insider.com/66da1da95444ffafa762f2d8?width=1200&format=jpeg,2024-09-06T12:15:02Z,,"US Sen. Elizabeth Warren is warning that Nvidia, led by CEO Jensen Huang, has too much dominance in the chipmaking market.REUTERS/Andrew Kelly; SAM YEH/AFP via Getty Images
<ul><li>Sen. Elizabeth Wa… [+2888 chars]",,en,'Elizabeth Warren'
https://biztoc.com/x/310e2c5a5c607e1f,https://biztoc.com/x/310e2c5a5c607e1f,0,biztoc.com,Sen. Elizabeth Warren backs DOJ investigation into Nvidia antitrust allegations,"US Sen. Elizabeth Warren is warning that Nvidia, led by CEO Jensen Huang, has too much dominance in the chipmaking market.
REUTERS/Andrew Kelly; SAM YEH/AFP via Getty Images
Sen. Elizabeth Warren applauded reports that the DOJ opened an antitrust probe into N…",https://biztoc.com/cdn/310e2c5a5c607e1f_s.webp,2024-09-06T12:24:55Z,,"US Sen. Elizabeth Warren is warning that Nvidia, led by CEO Jensen Huang, has too much dominance in the chipmaking market.REUTERS/Andrew Kelly; SAM YEH/AFP via Getty ImagesSen. Elizabeth Warren appla… [+135 chars]",,en,'Elizabeth Warren'
