index,url,valid,domain,title,description,image,published,archive,content,quote,language,keyword
https://6abc.com/post/bruce-springsteen-gives-surprise-performance-during-zach-bryan-concert-lincoln-financial-field-south-philadelphia/15159327/,https://6abc.com/post/bruce-springsteen-gives-surprise-performance-during-zach-bryan-concert-lincoln-financial-field-south-philadelphia/15159327/,0,6abc.com,Bruce Springsteen gives surprise performance during Zach Bryan concert at Lincoln Financial Field in South Philadelphia,Bruce Springsteen gives surprise performance during Zach Bryan concert at Lincoln Financial Field in South Philadelphia6abc.com,https://cdn.abcotvs.com/dip/images/15159811_080824-wpvi-bruce-springsteen-zach-bryan-concert-img.jpg?w=1600,2024-08-08T16:09:26Z,,"PHILADELPHIA (WPVI) -- There was an incredible surprise at the Zach Bryan concert in Philadelphia on Wednesday night!
None other than Bruce Springsteen showed up to perform with him at Lincoln Finan… [+256 chars]",,en,'Bruce Springsteen'
https://nypost.com/2024/08/08/entertainment/zach-bryan-in-atlanta-where-to-buy-tickets-best-prices-dates/,https://nypost.com/2024/08/08/entertainment/zach-bryan-in-atlanta-where-to-buy-tickets-best-prices-dates/,0,nypost.com,What do last-minute tickets cost to see Zach Bryan in Atlanta?,"The ""Revival"" singer headlines at Mercedes-Benz Stadium on Aug. 10-11.",https://nypost.com/wp-content/uploads/sites/2/2024/08/Zach-Bryan.jpg?quality=75&strip=all&w=1024,2024-08-08T18:03:54Z,,"Vivid Seats is the New York Post's official ticketing partner. We may receive revenue from this partnership for sharing this content and/or when you make a purchase.
One of country’s fastest rising … [+5411 chars]",,en,'Zach Bryan'
https://people.com/bruce-springsteen-joins-zach-bryan-for-atlantic-city-duet-in-philadelphia-8692644,https://people.com/bruce-springsteen-joins-zach-bryan-for-atlantic-city-duet-in-philadelphia-8692644,0,people.com,Bruce Springsteen Joins Zach Bryan for 'Atlantic City' Duet in Philadelphia,"On Wednesday, Aug. 7, Zach Bryan invited Bruce Springsteen onstage for a performance of ""Atlantic City"" during his concert in Philadelphia. He also brought out The Lumineers and Shane Gillis during the show.",https://people.com/thmb/mkPIxC-VgDfS7cQimsql1r8JN_4=/1500x0/filters:no_upscale():max_bytes(150000):strip_icc():focal(749x0:751x2)/zach-bryan-bruce-springsteen-tout-080824-a8fffe38c4c74f1ba6df7f645752e1b5.jpg,2024-08-08T19:00:00Z,,"Zach Bryan reunited once again with Bruce Springsteen.
On Wednesday, Aug. 7, the country star, 28, and ""The Rising"" artist, 74, performed a duet of Springsteen's 1982 song ""Atlantic City"" as well as… [+2517 chars]",,en,'Zach Bryan'
https://www.dailydot.com/memes/tim-walz-memes/,https://www.dailydot.com/memes/tim-walz-memes/,0,www.dailydot.com,Just 30 really good Tim Walz memes,"Tim Walz memes swept the internet as soon as the Minnesota governor was officially announced as Vice President Kamala Harris's running mate for the upcoming election. And unlike JD Vance walking into a furniture store, they have been a welcome sight.


Many o…",https://uploads.dailydot.com/2024/08/tim-walz-memes-1.jpg?auto=compress&fm=pjpg,2024-08-08T19:53:13Z,,Tim Walz memes swept the internet as soon as the Minnesota governor was officially announced as Vice President Kamala Harris‘s running mate for the upcoming election. And unlike JD Vance walking into… [+2617 chars],,en,'Kamala Harris'
https://www.irishtimes.com/business/2024/08/09/gaa-works-to-make-its-finances-add-up/,https://www.irishtimes.com/business/2024/08/09/gaa-works-to-make-its-finances-add-up/,0,www.irishtimes.com,GAA works to make its finances add up,Concern over lacklustre attendances at some games and uneven commercial revenue comes as capital spending pressure mounts,https://www.irishtimes.com/resizer/v2/7JILUGXGR7KYLYOV4NEI7MWTYY.jpg?smart=true&auth=b7a1920f99d60026905a25f200060a5c36210eedf667387fff9faf26f8449b7f&width=1200&height=630,2024-08-09T04:00:00Z,,"Somewhere deep in the bowels of Croke Park, someone is finalising the calculations for how many people attended all the matches in this years Gaelic football and hurling championships a reliable baro… [+10451 chars]",,en,'nan nan'
https://www.businessinsider.com/harris-freedom-2024-campaign-songs-trump-vance-walz-2024-8,https://www.businessinsider.com/harris-freedom-2024-campaign-songs-trump-vance-walz-2024-8,0,www.businessinsider.com,What Kamala Harris and Donald Trump's music choices say about the 2024 race,"Harris, Trump, and their running mates have fine-tuned their playlists ahead of the election.",https://i.insider.com/66b54629955b01c3294d1630?width=1200&format=jpeg,2024-08-09T11:00:02Z,,"Vice President Kamala Harris and former President Donald Trump have picked walk-up songs that underline their campaign's themes.Kent Nishimura/Getty Images; Alex Wroblewski/AFP via Getty
<ul><li>Cam… [+7245 chars]",,en,'Bruce Springsteen'
