index,url,valid,domain,title,description,image,published,archive,content,quote,language,keyword
31,https://radaronline.com/p/trump-pope-leo-pontiff-birthday-party-parade/,0,radaronline.com,Pope V Trump! Rumors Erupt Leftie Pontiff is Behind 'Plot' to Embarrass President on 79th Birthday By Pulling Crowds Away From Party Parade,"Pope Leo may be doing all he can to make sure President Trump's birthday is a complete bust, according to sources.",https://media.radaronline.com/brand-img/JcCe6Ol_7/1200x628/trump-pope-leo-pontiff-birthday-party-parade-pp-1749575379317.jpg,2025-06-10T17:45:00Z,,"The church is already calling the timing a coincidence, as the celebration will be held at Chicago's Rate Field stadium, home of the pope's favorite team, the Chicago White Sox, the only upcoming Sat… [+527 chars]",,en,'Pope Leo'
32,https://economictimes.indiatimes.com/markets/stocks/news/mukesh-ambanis-consumer-empire-overtakes-decades-old-energy-business-of-ril/articleshow/121767066.cms,0,economictimes.indiatimes.com,Mukesh Ambani's consumer empire overtakes decades-old energy business of RIL,"Reliance Industries, under Mukesh Ambani, witnesses a significant shift with consumer ventures like Reliance Retail and Jio now contributing over half of its operating cash profit. Analysts predict substantial EBITDA growth driven by these sectors, leading to…","https://img.etimg.com/thumb/msid-121767055,width-1200,height-630,imgsize-159088,overlay-etmarkets/articleshow.jpg",2025-06-11T03:20:21Z,,"Marking the transition of Asias richest billionaire Mukesh Ambani from being an oil baron to a consumer titan, every second rupee of Reliance Industries Ltds (RIL) operating cash profit now comes fro… [+4362 chars]",,en,'Mukesh Ambani'
33,https://timesofindia.indiatimes.com/toi-plus/international/the-two-masterminds-driving-trumps-disruption-and-putins-war/articleshow/121771745.cms,0,timesofindia.indiatimes.com,The two masterminds driving Trump's disruption and Putin's war,"International News: Curtis Yarvin and Aleksandr Dugin – the gurus that have inspired Trumpism and Putinism, and are fuelling their dangerous actions","https://static.toiimg.com/thumb/msid-121772138,width-1070,height-580,imgsize-114038,resizemode-75,overlay-toi_sw,pt-32,y_pad-40/photo.jpg",2025-06-11T07:38:58Z,,"Curtis Yarvin and Aleksandr Dugin the gurus that have inspired Trumpism and Putinism, and are fuelling their dangerous actions
Curtis Yarvin, an American math prodigy-turned-blogger, thinks governme… [+183 chars]",,en,'Curtis Yarvin'
34,https://abcnews.go.com/International/wireStory/pope-leo-xiv-names-chinese-bishop-signalling-continuing-122722995,0,abcnews.go.com,"Pope Leo XIV names first Chinese bishop, signalling he is continuing Vatican's accord",Pope Leo XIV has made his first appointment of a Chinese bishop,https://i.abcnewsfe.com/a/4a110327-5fc2-49a7-bcdc-89604d3cf412/wirestory_552ba1789e9770f2a1ee66b1e903b87c_16x9.jpg?w=1600,2025-06-11T11:17:06Z,,"VATICAN CITY -- VATICAN CITY (AP) Pope Leo XIV made his first appointment of a Chinese bishop under the Vaticans 2018 agreement with Beijing, signalling he is continuing one of Pope Francis most cont… [+2540 chars]",,en,'Pope Leo'
35,https://www.motherjones.com/politics/2025/06/donald-trump-elon-musk-andreesen-technofascism-doge/,0,www.motherjones.com,Trump’s Washington Is a Technofascist Fantasy—With or Without Musk,"The so-called Department of Government Efficiency was many things in the first months of the second Trump administration. It was a chain saw, a wood chipper, and “a way of life, like Buddhism,” according to Elon Musk, its fearless leader according to everyone…",https://www.motherjones.com/wp-content/uploads/2025/05/504_TECHNOFASCISM-ESSAY_A_2000-1.jpg?w=1200&h=630&crop=1,2025-06-11T12:35:14Z,,"Get your news from a source thats not owned and controlled by oligarchs. Sign up for the free Mother Jones Daily.
The so-called Department of Government Efficiency was many things in the first month… [+9247 chars]",,en,'Elon Musk'
36,https://www.aljazeera.com/news/2025/6/11/uk-lawmakers-slam-former-foreign-secretary-cameron-for-threatening-icc,0,www.aljazeera.com,UK MPs react to report alleging David Cameron ‘threatened’ ICC withdrawal,"Cameron told ICC's Khan arrest warrants for Israeli officials would be like ‘dropping hydrogen bomb', media report says.",https://www.aljazeera.com/wp-content/uploads/2024/06/2024-05-09T110129Z_124347615_RC2YM7AD1859_RTRMADP_3_BRITAIN-POLITICS-CAMERON-1717294521.jpg?resize=1920%2C1440,2025-06-11T13:50:29Z,,Several United Kingdom lawmakers have criticised the previous government over allegations in a recent media report that former Foreign Secretary David Cameron privately threatened to defund and withd… [+3402 chars],,en,'David Cameron'
37,https://www.snopes.com//fact-check/photos-pope-leo-falling-stairs/,0,www.snopes.com,Don't fall for photos of Pope Leo XIV tumbling down stairs,"In June 2025, a series of photographs authentically showed Pope Leo XIV falling down stairs.",https://mediaproxy.snopes.com/width/1200/https://media.snopes.com/2025/06/these_images_of_pope_leo_xiv_falling_down_stairs_are_fake.jpg,2025-06-11T16:00:00Z,,"Claim:
In June 2025, a series of photographs authentically showed Pope Leo XIV falling down stairs.
In 2025, a set of photographs allegedly depicting Pope Leo XIV falling down stairs circulated onl… [+2460 chars]",,en,'Pope Leo'
38,https://economictimes.indiatimes.com/news/international/us/clickbait-in-dc-democrat-john-fetterman-spotted-chatting-with-maga-kingmaker-steve-bannon-internet-goes-wild/articleshow/121783137.cms,0,economictimes.indiatimes.com,Clickbait in DC: Democrat John Fetterman spotted chatting with MAGA kingmaker Steve Bannon — Internet goes wild,Senator John Fetterman was seen talking to MAGA supporter Steve Bannon at a D.C. restaurant. People were surprised because Fetterman is a Democrat. He says it was not planned. He has also recently disagreed with his party on some issues.,"https://img.etimg.com/thumb/msid-121783176,width-1200,height-630,imgsize-102768,overlay-economictimes/articleshow.jpg",2025-06-11T16:02:26Z,,"Senator John Fetterman, who is a Democrat from Pennsylvania, was seen talking to Steve Bannon on Monday night. They were at a restaurant called Butterworths in Washington D.C. This place is popular w… [+1816 chars]",,en,'John Fetterman'
39,https://www.dazeddigital.com/art-photography/article/67007/1/us-enlist-dissident-right-art-hos-win-venice-biennale-curtis-yarvin-dimes-square?utm_source=Link&utm_medium=Link&utm_campaign=RSSFeed&utm_term=will-the-us-enlist-dissident-right-art-hoes-to-win-the-venice-biennale,0,www.dazeddigital.com,Will the US enlist ‘dissident-right art hoes’ to win the Venice Biennale?,"Right-wing ‘philosopher’ Curtis Yarvin has pitched the idea to the Trump administration, and it wouldn’t be the first time America has used art to flaunt its power on the world stage",https://images-prod.dazeddigital.com/1024/0-0-1024-682/azure/dazed-prod/1410/3/1413546.jpg,2025-06-12T12:25:56Z,,"In 1964, at the height of the Cold War, Robert Rauschenberg became the first US artist to win the grand prize at the Venice Biennale. As told in the 2023 documentary Taking Venice, the victory was cl… [+5094 chars]",,en,'Curtis Yarvin'
40,https://www.memeorandum.com/250612/p52,0,www.memeorandum.com,pontiff reveals. — in collaboration with American Ancestors and the Cuban Genealogy Club of Miami (Henry Louis Gates Jr/New York Times),"Henry Louis Gates Jr / New York Times:
pontiff reveals.  —  in collaboration with American Ancestors and the Cuban Genealogy Club of Miami  —  On May 8, moments after the world learned that an American cardinal named Robert Francis Prevost was becoming Pope L…",https://static01.nyt.com/images/2025/06/15/magazine/15mag-pope-promostill2/15mag-pope-promostill2-facebookJumbo-v2.png,2025-06-12T15:10:01Z,,"memeorandum is an auto-generated summary of the stories that US political commentators are discussing online right now.
Unlike sister sites Techmeme and Mediagazer, it is not a human-edited news out… [+72 chars]",,en,'Robert Francis Prevost'
41,https://brobible.com/sports/article/picture-of-pope-in-white-sox-hat-jokes/,0,brobible.com,Picture Of The Pope In White Sox Hat Has Sports Fans Joking About The Obscure White Sox Knowledge He Likely Possesses,"There is a chance that Pope Leo XIV, a.k.a Robert Francis Prevost, told Houston Astros Hall of Famers Jeff Bagwell and Craig Biggio to get bent — or perhaps a milder heckle befitting a man of god — during the 2005 World Series, which he famously attended in h…",https://brobible.com/wp-content/uploads/2025/06/pope-leo-white-sox-hat.jpg,2025-06-12T18:21:44Z,,"Getty Image
Audio By Carbonatix
There is a chance that Pope Leo XIV, a.k.a Robert Francis Prevost, told Houston Astros Hall of Famers Jeff Bagwell and Craig Biggio to get bent — or perhaps a milder… [+1856 chars]",,en,'Pope Francis'
42,https://economictimes.indiatimes.com/news/india/ahmedabad-plane-crash-mukesh-ambani-condoles-tragedy-offers-support-to-the-ongoing-relief-efforts/articleshow/121815883.cms,0,economictimes.indiatimes.com,"Ahmedabad plane crash: Mukesh Ambani condoles tragedy, offers support to the ongoing relief efforts","A devastating Air India crash in Ahmedabad claimed 265 lives, including 241 onboard a London-bound flight. The Boeing 787 Dreamliner crashed into a medical college complex shortly after takeoff. Mukesh Ambani and Reliance offered condolences and support for r…","https://img.etimg.com/thumb/msid-121816131,width-1200,height-630,imgsize-28662,overlay-economictimes/articleshow.jpg",2025-06-13T02:57:08Z,,"Business tycoon Mukesh Ambani condoled the Air India plane crash in Ahmedabad that claimed the lives of at least 265 people, including 241 onboard, marking one of the worst air disasters in recent ti… [+2311 chars]",,en,'Mukesh Ambani'
43,https://www.forbes.com/sites/yessarrosendar/2025/06/13/indian-billionaire-mukesh-ambanis-reliance-industries-sells-895-million-asian-paints-shares/,0,www.forbes.com,Indian Billionaire Mukesh Ambani’s Reliance Industries Sells $895 Million Asian Paints Shares,Reliance has been cutting its stake in Asian Paints amid softening demand and intensifying competition from new players such as billionaire Kumar Birla’s Birla Opus.,https://imageio.forbes.com/specials-images/imageserve/684ba915123422c9ca86ed44/0x0.jpg?format=jpg&height=900&width=1600&fit=bounds,2025-06-13T04:46:45Z,,"Buckets of Asia Paints Ltd. paint at a store in Mumbai, India, on Saturday, Feb 6, 2021. ... More Photographer: Dhiraj Singh/Bloomberg
© 2021 Bloomberg Finance LP
Reliance Industries
the energy-to… [+1326 chars]",,en,'Mukesh Ambani'
https://economictimes.indiatimes.com/markets/stocks/news/the-ambani-formula-for-making-money-17-years-1-nifty-stock-2200-profit/articleshow/121826116.cms,https://economictimes.indiatimes.com/markets/stocks/news/the-ambani-formula-for-making-money-17-years-1-nifty-stock-2200-profit/articleshow/121826116.cms,0,economictimes.indiatimes.com,"The Ambani formula for making money: 17 years + 1 Nifty stock = 2,200% profit","Mukesh Ambani's Reliance Industries sold a 3.6% stake in Asian Paints for ₹7,704 crore, booking a 23x return after investing during the 2008 crisis. This marks a masterclass in long-term, value-based investing amid changing market dynamics.","https://img.etimg.com/thumb/msid-121826104,width-1200,height-630,imgsize-37860,overlay-etmarkets/articleshow.jpg",2025-06-13T09:50:26Z,,"Buy right, sit tight and sell right! Asia's richest billionaire Mukesh Ambani has just taught stock market investors how making smart bets at cheap valuations can create long-term wealth. In a master… [+3879 chars]",,en,'Mukesh Ambani'
44,https://consent.yahoo.com/v2/collectConsent?sessionId=1_cc-session_fdac4d24-b76d-498c-8a25-2b03a5f6f0ee,0,consent.yahoo.com,"Pope Leo, from Chicago, makes his first US pitch at White Sox Park",,,2025-06-14T21:26:34Z,,"If you click 'Accept all', we and our partners, including 240 who are part of the IAB Transparency &amp; Consent Framework, will also store and/or access information on a device (in other words, use … [+714 chars]",,en,'Pope Leo'
45,https://www.foxsports.com/stories/mlb/white-sox-stadium-broadcast-pope-leo-xiv-sends-message-hope,0,www.foxsports.com,"In White Sox stadium broadcast, Pope Leo XIV sends a message of hope",Pope Leo XIV told young people how to find hope and meaning in their lives in a video broadcast at the White Sox's stadium.,https://a57.foxsports.com/statics.foxsports.com/www.foxsports.com/content/uploads/2025/06/1408/814/sox2.jpg?ve=1&tl=1,2025-06-14T21:28:02Z,,"In his first words directed specifically at Americans, Pope Leo XIV the first American pope told young people how to find hope and meaning in their lives in a video broadcast on the jumbotron at the … [+2120 chars]",,en,'Pope Leo'
46,https://abcnews.go.com/International/video/1st-address-us-pope-leo-xiv-sends-message-122853692,0,abcnews.go.com,"WATCH: In 1st address to US, Pope Leo XIV sends message of hope at White Sox Field","In a recorded message from the Vatican prepared exclusively for the audience at Rate Field, home of the Chicago White Sox, Pope Leo XIV delivered a message of hope.",https://i.abcnewsfe.com/a/88ffa7c7-f8a3-4724-90d1-cdf2a40630ce/250616_VOD_LeoWhiteSoxmessage_hpMain_16x9.jpg?w=992,2025-06-14T22:19:10Z,,"<ul><li>Minnesota officials give an update on targeted shootings of two state lawmakers
</li><li>'No Kings' protests underway across the US
</li><li>Iran launches missiles toward Israel, IDF says
… [+4451 chars]",,en,'Pope Leo'
47,https://abcnews.go.com/US/video/new-service-members-sworn-us-army-president-trump-122857554,0,abcnews.go.com,WATCH: New service members sworn into US Army by Trump,"President Donald Trump carried out the swearing in of 300 new U.S. service members during Saturday's Washington, D.C., military parade.",https://i.abcnewsfe.com/a/e0335683-e734-410b-81fb-afd96f156985/parade_oath_trump_250614_hpMain_16x9.jpg?w=992,2025-06-15T00:22:03Z,,"<ul><li>Crowds in downtown Los Angeles start getting dispersed by police
</li><li>Missiles launched from Iran toward Israel: IDF
</li><li>New service members sworn into US Army by Trump
</li><li>D… [+4416 chars]",,en,'Pope Leo'
48,https://www.bostonherald.com/2025/06/14/pope-chicago/,0,www.bostonherald.com,"In White Sox stadium broadcast, Pope Leo XIV sends message of hope to Chicago and the US",Pope Leo urged those listening to be beacons of hope capable of inspiring others.,https://www.bostonherald.com/wp-content/uploads/2025/06/Pope_Chicago_93725-1.jpg?w=1024&h=682,2025-06-15T01:16:43Z,,"By HOLLY MEYER
In his first words directed specifically to Americans, Pope Leo XIV told young people on Saturday how to find hope and meaning in their lives through God and in service to others.
So… [+2401 chars]",,en,'Robert Francis Prevost'
49,https://www.snopes.com//fact-check/kings-quote-christ-pope-leo/,0,www.snopes.com,Debunking alleged Pope Leo XIV quote about following both 'Christ and the cruelty of kings',"Pope Leo XIV said, ""You cannot follow both Christ and the cruelty of kings. A leader who mocks the weak, exalts himself, and preys on the innocent is not sent by God. He is sent to test you. And many are failing.""",https://mediaproxy.snopes.com/width/1200/https://media.snopes.com/2025/06/pope_leo_quote_repackage.png,2025-06-15T02:00:00Z,,"Claim:
Pope Leo XIV said, ""You cannot follow both Christ and the cruelty of kings. A leader who mocks the weak, exalts himself, and preys on the innocent is not sent by God. He is sent to test you. … [+1672 chars]",,en,'Pope Leo'
50,https://economictimes.indiatimes.com/news/india/et-womens-forum-empowerment-transforms-lives-says-deepthi-reddy-n/articleshow/121868495.cms,0,economictimes.indiatimes.com,"ET Women's Forum: Empowerment transforms lives, says Deepthi Reddy N","Reliance Foundation prioritizes women's empowerment as crucial for India's development by 2047. Their initiatives, spanning digital and financial inclusion, aim to drive systemic change at all levels. Programs across multiple states economically empower a mil…","https://img.etimg.com/thumb/msid-121868499,width-1200,height-630,imgsize-585255,overlay-economictimes/articleshow.jpg",2025-06-15T19:26:14Z,,"The empowerment of women is central to the work done by Reliance Foundation, said Deepthi Reddy N, who heads the women's empowerment initiative at the foundation.""Women's empowerment, the nuclei to t… [+2113 chars]",,en,'Mukesh Ambani'
51,https://abcnews.go.com/Politics/video/trump-announced-presidential-run-10-years-ago-today-122882732,0,abcnews.go.com,WATCH: Trump announced presidential run 10 years ago today,"In 2015, Donald Trump was the 12th Republican to announce his candidacy after descending a golden escalator at Trump Tower in New York.",https://i.abcnewsfe.com/a/98ea325c-0c3b-4a6a-aa80-9edd6eb078e6/250616_gmafl_trump_10_years_hpMain_16x9.jpg?w=992,2025-06-16T10:00:47Z,,"<ul><li>Israel and Iran trade strikes as conflict intensifies
</li><li>Police search for suspects in deadly mass shooting in Indiana
</li><li>Manhunt for suspect in Minnesota shooting enters 2nd da… [+4414 chars]",,en,'Donald Trump'
52,http://deadline.com/2025/06/al-pacino-pope-leo-xiv-vatican-1236434651/,0,deadline.com,Al Pacino Meets Pope Leo XIV At The Vatican,"Veteran actor Al Pacino met the newly elected pontiff, Leo XIV, at the Vatican on Monday.  Pacino met the Pope alongside Andrea Iervolino, the Italian producer behind Maserati: The Brothers, a biopic on Italy’s legendary Maserati family that stars Pacino, Ant…",https://deadline.com/wp-content/uploads/2025/06/image3-e1750069958151.jpeg?w=1024,2025-06-16T10:33:53Z,,"Veteran actor Al Pacino met the newly elected pontiff, Leo XIV, at the Vatican on Monday. 
Pacino met the Pope alongside Andrea Iervolino, the Italian producer behind Maserati: The Brothers, a biopi… [+1627 chars]",,en,'Pope Leo'
53,https://economictimes.indiatimes.com/markets/stocks/news/reliance-industries-sells-85-lakh-shares-of-asian-paints-for-rs-1876-cr/articleshow/121887323.cms,0,economictimes.indiatimes.com,"Reliance Industries sells 85 lakh shares of Asian Paints for Rs 1,876 cr","Billionaire Mukesh Ambani-led Reliance Industries on Monday sold 85 lakh shares of Asian Paints for Rs 1,876 crore through an open market transaction.","https://img.etimg.com/thumb/msid-121887331,width-1200,height-630,imgsize-37860,overlay-etmarkets/articleshow.jpg",2025-06-16T13:39:47Z,,"(What's moving Sensex and Nifty Track latest market news, stock tips, Budget 2025, Share Market on Budget 2025 and expert advice, on ETMarkets. Also, ETMarkets.com is now on Telegram. For fastest new… [+330 chars]",,en,'Mukesh Ambani'
54,http://www.rollingstone.com/tv-movies/tv-movie-news/al-pacino-pope-leo-xiv-vatican-maserati-film-1235365494/,0,www.rollingstone.com,Al Pacino Becomes First Movie Star to Meet With Pope Leo XIV,"Al Pacino met with Pope Leo XIV at the Vatican on Monday, becoming the first movie star to have an audience with the new pontiff.",https://www.rollingstone.com/wp-content/uploads/2025/06/al-pacino-meets-the-pope.jpg?crop=0px%2C0px%2C1800px%2C1014px&resize=1600%2C900,2025-06-16T16:32:53Z,,Al Pacino kicked off his week with a quick trip to Rome. The actor arrived at the Vatican on Monday for a meeting with Pope Leo XIV. He was joined in his audience with the newly-electedofficial by An… [+1535 chars],,en,'Al Pacino'
55,https://freerepublic.com/focus/f-chat/4323475/posts,0,freerepublic.com,2025 Bilderberg Meeting Participant List,"2025 BILDERBERG MEETING Stockholm, Sweden 12 – 15 June 2025 Abrams, Stacey (USA), CEO, Sage Works Production Albuquerque, Maria Luís (INT), European Commissioner Financial Services and the Savings and Investments Union Alcázar Benjumea, Diego del (ESP), CEO, …",,2025-06-16T23:49:11Z,,"Skip to comments.
2025 Bilderberg Meeting Participant List Public Intelligence ^
 | June 14, 2025
 | Staff
Posted on 06/16/2025 4:49:11 PM PDT by Openurmind
2025 BILDERBERG MEETING 
Stockholm, … [+8707 chars]",,en,'nan nan'
56,https://economictimes.indiatimes.com/markets/stocks/news/mukesh-ambanis-masterstroke-rs-500-crore-bet-delivers-rs-9580-crore-windfall-gain-for-reliance-industries/articleshow/121905446.cms,0,economictimes.indiatimes.com,"Mukesh Ambani's masterstroke: Rs 500 crore bet delivers Rs 9,580 crore windfall gain for Reliance Industries","On Monday, Reliance Industries (RIL) announced the sale of its remaining 87 lakh equity shares in Asian Paints through a block deal valued at ₹1,876 crore. The shares were sold to ICICI Prudential Life Mutual Fund at an average price of ₹2,207.65 per share.","https://img.etimg.com/thumb/msid-121905432,width-1200,height-630,imgsize-37860,overlay-etmarkets/articleshow.jpg",2025-06-17T08:23:38Z,,"In what ranks among the most spectacular long-term bets in Indian corporate history, Asias richest billionaire, Mukesh Ambani, has finally cashed out of his Asian Paints investment, transforming a Rs… [+3916 chars]",,en,'Mukesh Ambani'
57,https://www.fairobserver.com/politics/russian-influence-in-central-europe-evolves-from-disinformation-to-democratic-erosion/,0,www.fairobserver.com,Russian Influence in Central Europe Evolves From Disinformation to Democratic Erosion,"The global fight against foreign influence has entered a precarious phase. In April, US President Donald Trump shut down the last State Department office specifically tasked with countering foreign information manipulation, raising concerns about America’s vu…",https://www.fairobserver.com/wp-content/uploads/2025/06/world-map.jpg,2025-06-17T14:19:56Z,,"The global fight against foreign influence has entered a precarious phase.
In April, US President Donald Trump shut down the last State Department office specifically tasked with countering foreign … [+10054 chars]",,en,'Donald Trump'
58,https://www.tmz.com/2025/06/17/pope-leo-xiv-related-justin-bieber-madonna/,0,www.tmz.com,"Pope Leo XIV Related to Justin Bieber, Madonna","Pope Leo XIV may now go by ""Pop Leo"" because he's related to some big music stars, as well as some famous politicians. Leo can now call Justin Bieber and Madonna ""cuz,"" because he shares a bloodline with both, according to the New York Times. The…",https://imagez.tmz.com/image/05/16by9/2025/06/17/0573db989c7e41948bea335244b8a7ac_xl.jpg,2025-06-17T14:51:42Z,,"Pope Leo XIV may now go by ""Pop Leo"" because he's related to some big music stars, as well as some famous politicians.
Leo can now call Justin Bieber and Madonna ""cuz,"" because he shares a bloodline… [+688 chars]",,en,'Pope Leo'
59,https://www.thehindubusinessline.com/news/reliance-ind-scions-akash-anant-isha-top-wealth-creators-list-surpass-father-in-personal-wealth/article69704792.ece,0,www.thehindubusinessline.com,"Reliance Ind scions Akash, Anant, Isha top wealth creators list, surpass father in personal wealth","Mumbai's Reliance scions top wealth creators list, with Ambani family dominating India's net worth landscape.",https://bl-i.thgim.com/public/incoming/xum2pz/article69705863.ece/alternates/LANDSCAPE_1200/Black%20and%20Dark%20Space%20Photo%20YouTube%20Thumbnail%202.png,2025-06-17T15:30:18Z,,"The scions of Reliance Industries Akash Ambani and Anant Ambani have topped the maiden 360 ONE Wealth creators list with a wealth of 3.59 lakh crore each.
Isha Ambani features third on the list with… [+2548 chars]",,en,'nan nan'
60,https://www.eonline.com/news/1418828/pope-leo-xiv-related-to-madonna-justin-bieber-and-angelina-jolie,0,www.eonline.com,"Pope Leo XIV Is Related to Madonna, Justin Bieber and More—Yes Really","The Father, the Son and the Hollywood cousins.
It turns out, the newly appointed Pope Leo XIV (born Robert Francis Prevost) has an astonishingly celebrity-ridden family tree.
According to Finding...","https://akns-images.eonline.com/eol_images/Entire_Site/20250508/493c27c8-c5a9-4f5a-9634-366f8603052a_1746733655.jpg?fit=around%7C1080:1080&output-quality=90&crop=1080:1080;center,top",2025-06-17T16:40:29Z,,"The Father, the Son and the Hollywood cousins.
It turns out, the newly appointed Pope Leo XIV(born Robert Francis Prevost)has an astonishingly celebrity-ridden family tree.
According to Finding You… [+943 chars]",,en,'Robert Francis Prevost'
61,https://www.activistpost.com/2025-bilderberg-meeting-attendees-revealed-global-elites-convene-in-secret-amid-global-chaos/,0,www.activistpost.com,2025 Bilderberg Meeting Attendees Revealed: Global Elites Convene In Secret Amid Global Chaos,"Bilderberg’s 71st meeting kicked off in Stockholm, Sweden Thursday, where global elites convened behind closed doors amid tensions across Europe and the Middle East, and against the backdrop of President Donald Trump’s assault on their favorite thing of all t…",https://www.activistpost.com/wp-content/uploads/2025/06/eyes-wide-shut-1-26-12.jpg,2025-06-17T18:00:00Z,,"Bilderbergs 71st meeting kicked off in Stockholm, Sweden Thursday, where global elites convened behind closed doors amid tensions across Europe and the Middle East, and against the backdrop of Presid… [+11370 chars]",,en,'Donald Trump'
