index,url,valid,domain,title,description,image,published,archive,content,quote,language,keyword
https://www.independent.ie/world-news/jeffrey-epstein-sent-secret-letter-to-gymnastics-abuser-larry-nassar-before-his-suicide/a1204972630.html,https://www.independent.ie/world-news/jeffrey-epstein-sent-secret-letter-to-gymnastics-abuser-larry-nassar-before-his-suicide/a1204972630.html,0,www.independent.ie,Jeffrey Epstein sent secret letter to gymnastics abuser Larry Nassar before his suicide,"Jeffrey Epstein had unsuccessfully tried to reach out to another high-profile paedophile via a letter that was eventually returned to sender, a new trove of documents about the disgraced billionaire financier has revealed.",https://focus.independent.ie/thumbor/j7XEwhwR4VFdsJ9MNNkda2Ut50A=/0x88:2000x1420/2000x1332/prod-mh-ireland/6d6e9d46-3651-4b3e-82fd-8f4c6d4f2955/1f64e0d4-b087-45c4-8046-b4c35faeac9b/6d6e9d46-3651-4b3e-82fd-8f4c6d4f2955.jpg,2023-06-02T13:30:12Z,https://web.archive.org/web/20230602145302/https://www.independent.ie/world-news/jeffrey-epstein-sent-secret-letter-to-gymnastics-abuser-larry-nassar-before-his-suicide/a1204972630.html,"Jeffrey Epstein had unsuccessfully tried to reach out to another high-profile paedophile via a letter that was eventually returned to sender, a new trove of documents about the disgraced billionaire … [+22 chars]",,en,'Jeffrey Epstein'
https://news.sky.com/story/jeffrey-epstein-tried-to-contact-disgraced-us-gymnastics-team-doctor-larry-nassar-while-in-prison-12895112,https://news.sky.com/story/jeffrey-epstein-tried-to-contact-disgraced-us-gymnastics-team-doctor-larry-nassar-while-in-prison-12895112,0,news.sky.com,Epstein tried to contact disgraced US gymnastics team doctor Larry Nassar while in prison,"Billionaire paedophile Jeffrey Epstein tried to contact a disgraced US gymnastics team doctor while in prison, newly-released documents show.",https://e3.365dm.com/23/06/1600x900/skynews-jeffrey-epstein_6176230.jpg?20230602155216,2023-06-02T13:57:00Z,https://web.archive.org/web/20230602165301/https://news.sky.com/story/jeffrey-epstein-tried-to-contact-disgraced-us-gymnastics-team-doctor-larry-nassar-while-in-prison-12895112,"Billionaire paedophile Jeffrey Epstein tried to contact a disgraced US gymnastics team doctor while in prison, newly-released documents show.
Epstein's letter to Larry Nassar was found returned to s… [+3642 chars]",,en,'Jeffrey Epstein'
https://www.westernjournal.com/biden-speaks-air-force-academy-fall-gives-bizarre-excuse/,https://www.westernjournal.com/biden-speaks-air-force-academy-fall-gives-bizarre-excuse/,0,www.westernjournal.com,"Biden Speaks Out on His Air Force Academy Fall, Gives Bizarre Excuse","Although President Joe Biden had a glib phrase ready for the media, others say his fall Thursday is no laughing matter.",https://www.westernjournal.com/wp-content/uploads/2023/06/Biden-fall.jpg,2023-06-02T14:03:37Z,https://web.archive.org/web/20230602171600/https://www.westernjournal.com/biden-speaks-air-force-academy-fall-gives-bizarre-excuse/,"President Joe Biden sought to save face Thursday night after his fall on stage at the Air Force Academy graduation earlier that day in Colorado.
President Joe Biden falls at the U.S. Air Force Acade… [+3186 chars]",,en,'Kamala Harris'
https://www.nbcnews.com/news/us-news/jeffrey-epstein-tried-send-letter-larry-nassar-death-records-show-rcna87400,https://www.nbcnews.com/news/us-news/jeffrey-epstein-tried-send-letter-larry-nassar-death-records-show-rcna87400,0,www.nbcnews.com,"Jeffrey Epstein tried to send a letter to Larry Nassar before his death, records show","Two weeks before ending his life, Jeffrey Epstein sat in the corner of his Manhattan jail cell with his hands over his ears, desperate to muffle the sound of a toilet that wouldn’t stop running.","https://media-cldnry.s-nbcnews.com/image/upload/t_nbcnews-fp-1200-630,f_auto,q_auto:best/rockcms/2023-06/230601-jeffrey-epstein-2005-ac-547p-94aa33.jpg",2023-06-02T14:37:49Z,https://web.archive.org/web/20230602153317/https://www.nbcnews.com/news/us-news/jeffrey-epstein-tried-send-letter-larry-nassar-death-records-show-rcna87400,"NEW YORK Two weeks before ending his life, Jeffrey Epstein sat in the corner of his Manhattan jail cell with his hands over his ears, desperate to muffle the sound of a toilet that wouldnt stop runni… [+8399 chars]",,en,'Jeffrey Epstein'
https://www.celebitchy.com/820009/theres_a_rumor_that_leo_dicaprio_is_dating_neelam_gill_a_28-year-old_model/,https://www.celebitchy.com/820009/theres_a_rumor_that_leo_dicaprio_is_dating_neelam_gill_a_28-year-old_model/,0,www.celebitchy.com,"There’s a rumor that Leo DiCaprio is dating Neelam Gill, a 28-year-old model","You know what’s weird? We’re coming up on the one-year anniversary of Leonardo DiCaprio dumping Camila Morrone on her 25th birthday and Leo still doesn’t actually have an “official girlfriend.” Usually, he likes to pick out his new lady by the spring, and the…",,2023-06-02T14:40:04Z,,"You know whats weird? Were coming up on the one-year anniversary of Leonardo DiCaprio dumping Camila Morrone on her 25th birthday and Leo still doesnt actually have an official girlfriend. Usually, h… [+4008 chars]",,en,'Leonardo DiCaprio'
https://freerepublic.com/focus/f-news/4157806/posts,https://freerepublic.com/focus/f-news/4157806/posts,0,freerepublic.com,Joe Biden’s fall was but one of several indications there that he is now unfit for the responsibilities he carries,"Once again, the President of the United States has fallen down at a public event, this time after delivering the graduation speech at the Air Force Academy in Colorado Springs. Anyone can slip and fall, but when an 80-year-old elder repeatedly falls in public…",,2023-06-02T14:41:03Z,https://web.archive.org/web/20230602145102/https://freerepublic.com/focus/f-news/4157806/posts,"Skip to comments.
Joe Bidens fall was but one of several indications there that he is now unfit for the responsibilities he carriesAmerican Thinker ^
 | 06/02/2023
 | Thomas Lifson
Posted on 06/0… [+6875 chars]",,en,'Kamala Harris'
https://biztoc.com/x/587fe5340e4d8d98,https://biztoc.com/x/587fe5340e4d8d98,0,biztoc.com,"Jeffrey Epstein tried to send a letter to Larry Nassar before his death, records show","NEW YORK — Two weeks before ending his life, Jeffrey Epstein sat in the corner of his Manhattan jail cell with his hands over his ears, desperate to muffle the sound of a toilet that wouldn’t stop running. Epstein was agitated and unable to sleep, jail offici…",https://c.biztoc.com/p/587fe5340e4d8d98/s.webp,2023-06-02T14:50:52Z,https://web.archive.org/web/20230602155542/https://biztoc.com/x/587fe5340e4d8d98,"NEW YORK Two weeks before ending his life, Jeffrey Epstein sat in the corner of his Manhattan jail cell with his hands over his ears, desperate to muffle the sound of a toilet that wouldnt stop runni… [+315 chars]",,en,'Jeffrey Epstein'
https://www.niemanlab.org/reading/vice-has-made-thousands-of-public-records-regarding-jeffrey-epstein-available-to-the-public/,https://www.niemanlab.org/reading/vice-has-made-thousands-of-public-records-regarding-jeffrey-epstein-available-to-the-public/,0,www.niemanlab.org,Vice has made thousands of public records regarding Jeffrey Epstein available to the public,,,2023-06-02T14:56:03Z,,"CLOSE
MLA
, . ""Vice has made thousands of public records regarding Jeffrey Epstein available to the public."" Nieman Journalism Lab. Nieman Foundation for Journalism at Harvard, 2 Jun. 2023. Web. 2 … [+1002 chars]",,en,'Jeffrey Epstein'
https://abovethelaw.com/2023/06/judge-in-disney-case-against-ron-desantis-recuses/,https://abovethelaw.com/2023/06/judge-in-disney-case-against-ron-desantis-recuses/,0,abovethelaw.com,Judge In Disney’s Case Against Ron DeSantis Recuses Himself Because Father’s Brother’s Nephew’s Cousin’s Former Roommate Owns 30 Shares Of Disney,"Judge in Disney-DeSantis throwdown demonstrates commitment to ethics that the Supreme Court couldn't find on a map. 
The post Judge In Disney’s Case Against Ron DeSantis Recuses Himself Because Father’s Brother’s Nephew’s Cousin’s Former Roommate Owns 30 Shar…",https://abovethelaw.com/uploads/2023/06/GettyImages-145762645.jpg,2023-06-02T15:01:19Z,,"(Photo by Chip Somodevilla/Getty Images)
Ron DeSantis’s lawyers are so bad that their only “win” against Disney comes so entirely in spite of their efforts that the judge described their motion as “… [+5860 chars]",,en,'Ron DeSantis'
https://freerepublic.com/focus/f-religion/4157822/posts,https://freerepublic.com/focus/f-religion/4157822/posts,0,freerepublic.com,"Educating a child takes a village, Pope says","Educating a child takes a village, Pope saysCWN Editor's Note: Pope Francis strongly encouraged the work of the African Education Compact in a June 1 address, using language that will be familiar to Americans. “To educate a child, it takes a whole village,” h…",,2023-06-02T15:14:53Z,https://web.archive.org/web/20230602152636/https://freerepublic.com/focus/f-religion/4157822/posts,"Skip to comments.
Educating a child takes a village, Pope saysCatholic Culture ^
 | June 1, 2023
 | Catholic World News
Posted on 06/02/2023 8:14:53 AM PDT by ebb tide
CWN Editor's Note: Pope Fr… [+1957 chars]",,en,'Pope Francis'
https://radaronline.com/p/jeffrey-epstein-prison-letter-larry-nassar/,https://radaronline.com/p/jeffrey-epstein-prison-letter-larry-nassar/,0,radaronline.com,Honor Among Creeps: Jeffrey Epstein Penned Mystery Prison Letter To Pedophile Larry Nassar Before Suicide,Jeffrey Epstein's unopened letter was labeled 'return to sender' and found in prison mailroom.,https://media.radaronline.com/brand-img/2N2ny4iuf/1200x628/epstein-nassar-pp-1685719191964.jpg,2023-06-02T15:45:00Z,,"USA Gymnastics and the U.S. Olympic and Paralympic Committee agreed to pay $380 million to victims for ignoring complaints.
As RadarOnline.com previously reported, the documents also showed Epstein … [+211 chars]",,en,'Jeffrey Epstein'
https://www.dailymail.co.uk/tvshowbiz/article-12149329/Leonardo-DiCaprio-leaves-Sardinia-longtime-friend-disgraced-art-dealer-Helly-Nahmad.html,https://www.dailymail.co.uk/tvshowbiz/article-12149329/Leonardo-DiCaprio-leaves-Sardinia-longtime-friend-disgraced-art-dealer-Helly-Nahmad.html,0,www.dailymail.co.uk,Leonardo DiCaprio leaves Sardinia with longtime friend and disgraced art dealer Helly Nahmad,"Leonardo DiCaprio's long-time friendship with New York art dealer Hillel 'Helly' Nahmad, 45, appears to be going strong a decade after the convicted felon's stint in jail.",https://i.dailymail.co.uk/1s/2023/06/01/21/71671191-0-image-a-161_1685652577043.jpg,2023-06-02T16:35:34Z,https://web.archive.org/web/20230602165324/https://www.dailymail.co.uk/tvshowbiz/article-12149329/Leonardo-DiCaprio-leaves-Sardinia-longtime-friend-disgraced-art-dealer-Helly-Nahmad.html,"It's The Wolf of Wall Street meets The Gambler.
Hollywood superstar Leonardo DiCaprio's long-time friendship with disgraced New York art dealer Hillel 'Helly' Nahmad, 45, appears to be going strong … [+6016 chars]",,en,'Leonardo DiCaprio'
https://news.yahoo.com/records-detail-jeffrey-epsteins-last-165307745.html,https://news.yahoo.com/records-detail-jeffrey-epsteins-last-165307745.html,0,news.yahoo.com,"Lies, complaints and Larry Nassar: Takeaways from the records detailing Jeffrey Epstein's final days","Nearly four years after Jeffrey Epstein's death, thousands of pages of records obtained by The Associated Press are shedding new light on the financier’s...",https://s.yimg.com/ny/api/res/1.2/QRL4Nay4nwGGTIvc_hNcBw--/YXBwaWQ9aGlnaGxhbmRlcjt3PTEyMDA7aD0xNTY4/https://media.zenfs.com/en/ap.org/026acc471a350b3fe95d41d8ca748699,2023-06-02T16:53:07Z,https://web.archive.org/web/20230602170342/https://news.yahoo.com/records-detail-jeffrey-epsteins-last-165307745.html,"NEW YORK (AP) Nearly four years after Jeffrey Epstein's death, thousands of pages of records obtained by The Associated Press are shedding new light on the financiers time behind bars and a frantic r… [+5512 chars]",,en,'Jeffrey Epstein'
https://www.businessinsider.com/alexei-navalny-demands-kangaroo-nunchucks-moonshine-penal-colony-wardens-2023-6,https://www.businessinsider.com/alexei-navalny-demands-kangaroo-nunchucks-moonshine-penal-colony-wardens-2023-6,0,www.businessinsider.com,"Alexei Navalny is amusing himself by demanding a kangaroo, nunchucks, and a bottle of moonshine from his penal colony wardens","Navalny, a political opponent of Putin serving 11-and-a-half years in a Russian penal colony, said all of his outlandish requests have been denied.",https://i.insider.com/647a154f06699900194c8eef?width=1200&format=jpeg,2023-06-02T17:00:25Z,https://web.archive.org/web/20230602173525/https://www.businessinsider.com/alexei-navalny-demands-kangaroo-nunchucks-moonshine-penal-colony-wardens-2023-6,"Russian opposition leader Alexei Navalny is seen on a TV screen, as he appears in a video link provided by the Russian Federal Penitentiary Service in a courtroom at Moscow City Court in Moscow.Mosco… [+2311 chars]",,en,'Putin'
https://freerepublic.com/focus/f-religion/4157857/posts,https://freerepublic.com/focus/f-religion/4157857/posts,0,freerepublic.com,"[Catholic Caucus] Report: Archbishop Gänswein Ordered to Leave Vatican, Return to Home Diocese Without New Role","[Catholic Caucus] Report: Archbishop Gänswein Ordered to Leave Vatican, Return to Home Diocese Without New RoleAccording to a German newspaper report, Pope Francis ordered Archbishop Georg Gänswein to leave the Vatican and return to Germany by the end of June…",,2023-06-02T17:11:57Z,https://web.archive.org/web/20230602173735/https://freerepublic.com/focus/f-religion/4157857/posts,"Skip to comments.
[Catholic Caucus] Report: Archbishop Gänswein Ordered to Leave Vatican, Return to Home Diocese Without New RoleNational Catholic Register ^
 | June 2, 2023
 | AC Wimmer
Posted o… [+1603 chars]",,en,'Georg Gänswein'
https://www.foxnews.com/sports/angel-reese-makes-appearance-in-latto-cardi-b-video,https://www.foxnews.com/sports/angel-reese-makes-appearance-in-latto-cardi-b-video,0,www.foxnews.com,"LSU star Angel Reese makes appearance in Latto, Cardi B music video","The LSU women’s basketball phenomenon added another item to her unprecedented offseason resume when she made a cameo in Latto and Cardi B’s “Put It On Da Floor Again"" music video.",https://static.foxnews.com/foxnews.com/content/uploads/2023/04/Angel-Reese21.jpg,2023-06-02T17:24:59Z,https://web.archive.org/web/20230603023031/https://www.foxnews.com/sports/angel-reese-makes-appearance-in-latto-cardi-b-video,"Angel Reese had an incredible season on the court with the LSU women's basketball team. She was one of the key pieces in the Tigers national championship run in March, and since then her popularity o… [+1832 chars]",,en,'Kamala Harris'
https://www.catholicnewsagency.com/news/254474/florida-bishops-plead-with-desantis-to-spare-life-of-death-row-inmate,https://www.catholicnewsagency.com/news/254474/florida-bishops-plead-with-desantis-to-spare-life-of-death-row-inmate,0,www.catholicnewsagency.com,Florida bishops plead with DeSantis to spare life of death row inmate,"Florida Gov. Ron DeSantis at a campaign stop in Salem, New Hampshire, on June 1, 2023. / Credit: JOSEPH PREZIOSO/AFP via Getty Images

Washington D.C., Jun 2, 2023 / 11:25 am (CNA).
Florida’s Catholic bishops are calling on Gov. Ron DeSantis to issue a stay o…",https://www.catholicnewsagency.com/storage/image/gettyimages-1258359488.jpg?jpg,2023-06-02T17:25:00Z,https://web.archive.org/web/20230602192214/https://www.catholicnewsagency.com/news/254474/florida-bishops-plead-with-desantis-to-spare-life-of-death-row-inmate,"The letter acknowledged the suffering Owen has caused but stated the bishops opposition to the death penalty and belief in the sanctity of life.
His senseless and horrific acts tragically ended the … [+1340 chars]",,en,'Ron DeSantis'
https://www.irishtimes.com/world/europe/2023/06/02/bickering-among-berlin-coalition-partners-leaves-public-unimpressed/,https://www.irishtimes.com/world/europe/2023/06/02/bickering-among-berlin-coalition-partners-leaves-public-unimpressed/,0,www.irishtimes.com,Bickering among Berlin coalition partners leaves public unimpressed,Chancellor Olaf Scholz’s SPD party has slumped in polls and is now neck-and-neck with Germany’s far-right AfD,https://www.irishtimes.com/resizer/j4Kvp1iKH07dDqgfgQKYm9clR9o=/1200x630/filters:format(jpg):quality(70)/cloudfront-eu-central-1.images.arcpublishing.com/irishtimes/3OOMH3X46MOMBBO4Q7FR3FKD44.jpg,2023-06-02T18:00:00Z,https://web.archive.org/web/20230602181654/https://www.irishtimes.com/world/europe/2023/06/02/bickering-among-berlin-coalition-partners-leaves-public-unimpressed/,"As Berlins bickering traffic-light coalition nears the midpoint of its term, just one in five Germans is impressed with its work.
Two years after election victory saw Olaf Scholz take the chanceller… [+3156 chars]",,en,'Olaf Scholz'
https://www.westernjournal.com/biden-injured-shortly-nasty-fall-air-force-commencement/,https://www.westernjournal.com/biden-injured-shortly-nasty-fall-air-force-commencement/,0,www.westernjournal.com,Biden Injured Himself Again Shortly After Nasty Fall at Air Force Commencement,Thursday turned out to be one of the most randomly abysmal days in the entire presidency of Joe Biden and his administration.,https://www.westernjournal.com/wp-content/uploads/2023/06/Joe-Biden.jpg,2023-06-02T18:02:07Z,https://web.archive.org/web/20230602184805/https://www.westernjournal.com/biden-injured-shortly-nasty-fall-air-force-commencement/,"President Joe Biden is redefining the term “June gloom” after his no-good, very-bad start to the month Thursday.
And it turns out that bad things really do happen in threes.
While two of the bad th… [+3032 chars]",,en,'Kamala Harris'
https://www.dailysignal.com/2023/06/02/end-american-gerontocracy/,https://www.dailysignal.com/2023/06/02/end-american-gerontocracy/,0,www.dailysignal.com,End American Gerontocracy,"President Joe Biden’s viscerally jarring fall on Thursday in Colorado Springs, while on stage dispensing diplomas to new U.S. Air Force Academy graduates, underscores a... Read More
The post End American Gerontocracy appeared first on The Daily Signal.",https://first-heritage-foundation.s3.amazonaws.com/live_files/2023/06/GettyImages-1258355194.jpg,2023-06-02T18:46:58Z,https://web.archive.org/web/20230602192138/https://www.dailysignal.com/2023/06/02/end-american-gerontocracy/,"President Joe Biden’s viscerally jarring fall on Thursday in Colorado Springs, while on stage dispensing diplomas to new U.S. Air Force Academy graduates, underscores a terrifying reality: The octoge… [+6475 chars]",,en,'Joe Biden'
https://www.forbes.com/sites/ariannajohnson/2023/06/02/what-new-details-into-jeffrey-epsteins-controversial-death-reveal/,https://www.forbes.com/sites/ariannajohnson/2023/06/02/what-new-details-into-jeffrey-epsteins-controversial-death-reveal/,0,www.forbes.com,What New Details Into Jeffrey Epstein’s Controversial Death Reveal,"Around 4,000 new pages of documents released by the Bureau of Prisons in response to public records requests give more insight into the days leading up to Epstein’s death.",https://imageio.forbes.com/specials-images/imageserve/647a3f7cc7c7e6b0f413b285/0x0.jpg?format=jpg&width=1200,2023-06-02T19:15:03Z,https://web.archive.org/web/20230602193633/https://www.forbes.com/sites/ariannajohnson/2023/06/02/what-new-details-into-jeffrey-epsteins-controversial-death-reveal/,"New details of Jeffrey Epsteins final days before his deathwhich sparked conspiracies linked to two former presidentsgive new insight into his mental health in his final days, including his claims th… [+3370 chars]",,en,'Jeffrey Epstein'
https://www.independent.co.uk/news/world/americas/gun-control-america-kamala-harris-b2350638.html,https://www.independent.co.uk/news/world/americas/gun-control-america-kamala-harris-b2350638.html,0,www.independent.co.uk,Watch live: Kamala Harris delivers remarks on National Gun Violence Awareness Day,Watch live as Kamala Harris delivers remarks on National Gun Violence Awareness Day.,https://static.independent.co.uk/2023/06/02/20/Kamala-SITE.jpg?quality=75&width=1200&auto=webp,2023-06-02T20:09:52Z,https://web.archive.org/web/20230602201851/https://www.independent.co.uk/news/world/americas/gun-control-america-kamala-harris-b2350638.html,"Sign up to our Evening Headlines email for your daily guide to the latest news
Sign up to our free US Evening Headlines email
Watch live as Kamala Harris delivers remarks on National Gun Violence A… [+921 chars]",,en,'Kamala Harris'
https://www.independent.co.uk/news/uk/rupert-everett-leonardo-dicaprio-the-sun-hollywood-noel-coward-b2350651.html,https://www.independent.co.uk/news/uk/rupert-everett-leonardo-dicaprio-the-sun-hollywood-noel-coward-b2350651.html,0,www.independent.co.uk,Rupert Everett says coverage of Schofield affair is ‘homophobic and outrageous’,The actor said age gaps in reported heterosexual relationships of Hollywood star Leonardo DiCaprio were ‘accepted’.,https://static.independent.co.uk/2023/06/02/21/587529c69c24c5fdf4bf9d66b47eb65bY29udGVudHNlYXJjaGFwaSwxNjg1ODIzODAy-2.67763577.jpg?quality=75&width=1200&auto=webp,2023-06-02T20:36:27Z,https://web.archive.org/web/20230602210602/https://www.independent.co.uk/news/uk/rupert-everett-leonardo-dicaprio-the-sun-hollywood-noel-coward-b2350651.html,"For free real time breaking news alerts sent straight to your inbox sign up to our breaking news emails
Sign up to our free breaking news emails
Rupert Everett has said the coverage of Phillip Scho… [+2748 chars]",,en,'Leonardo DiCaprio'
https://www.cnn.com/2023/06/02/politics/juan-merchan-trump-judge-new-york-recuse/index.html,https://www.cnn.com/2023/06/02/politics/juan-merchan-trump-judge-new-york-recuse/index.html,0,www.cnn.com,Trump seeks recusal of judge overseeing New York hush money criminal case,"Donald Trump is seeking for the judge overseeing his criminal case in New York to recuse himself from it, the latest bid by the former president to try to undercut the case now set for trial next year.","https://media.cnn.com/api/v1/images/stellar/prod/230404185037-juan-manuel-merchan-juez-colombiano-corte-suprema-ny-eeuu-dusa-molinares-00000228.png?c=16x9&q=w_800,c_fill",2023-06-02T20:41:59Z,https://web.archive.org/web/20230602221053/https://www.cnn.com/2023/06/02/politics/juan-merchan-trump-judge-new-york-recuse/index.html,"Donald Trump is seeking for the judge overseeing his criminal case in New York to recuse himself from it, the latest bid by the former president to try to undercut the case now set for trial next yea… [+2774 chars]",,en,'Donald Trump'
https://freebeacon.com/biden-administration/slippy-joe/,https://freebeacon.com/biden-administration/slippy-joe/,0,freebeacon.com,Slippy Joe Strikes Again: A Frame-by-Frame Analysis of Biden's Latest Fall,"Please enjoy the Washington Free Beacon's exclusive frame-by-frame analysis of Joe Biden's hard fall, which raises troubling questions.
The post Slippy Joe Strikes Again: A Frame-by-Frame Analysis of Biden's Latest Fall appeared first on Washington Free Beaco…",https://freebeacon.com/wp-content/uploads/2023/06/biden-fall.jpg,2023-06-02T21:00:05Z,https://web.archive.org/web/20230602211713/https://freebeacon.com/biden-administration/slippy-joe/,"What happened: President Joe Biden, 80, took a hard fall during the graduation ceremony at the Air Force Academy in Colorado Springs.
What they're saying: ""I would suggest to the president that he r… [+721 chars]",,en,'Kamala Harris'
https://news.yahoo.com/donald-trump-lawyers-ask-judge-210144831.html,https://news.yahoo.com/donald-trump-lawyers-ask-judge-210144831.html,0,news.yahoo.com,"Donald Trump’s lawyers ask judge to exit criminal case, echoing claims of political bias","Within hours of his historic arraignment this spring, Donald Trump fixed his ire on the judge, complaining that he’s “a Trump-hating judge"" with a family...",https://s.yimg.com/ny/api/res/1.2/zBgYpK.mjaUZo3PDjI7Zbw--/YXBwaWQ9aGlnaGxhbmRlcjt3PTEyMDA7aD04MDA-/https://media.zenfs.com/en/ap.org/c9ebc6f4deb4a729a79c4b47c7dc4c80,2023-06-02T21:01:44Z,https://web.archive.org/web/20230602212139/https://news.yahoo.com/donald-trump-lawyers-ask-judge-210144831.html,"NEW YORK (AP) Within hours of his historic arraignment this spring, Donald Trump fixed his ire on the judge, complaining that hes a Trump-hating judge"" with a family full of Trump haters.
On Friday,… [+5355 chars]",,en,'Kamala Harris'
https://www.independent.co.uk/news/world/americas/us-politics/donald-trump-ap-alvin-bragg-manhattan-new-york-b2350663.html,https://www.independent.co.uk/news/world/americas/us-politics/donald-trump-ap-alvin-bragg-manhattan-new-york-b2350663.html,0,www.independent.co.uk,"Donald Trump’s lawyers ask judge to exit criminal case, echoing claims of political bias","Donald Trump’s lawyers are demanding that the judge in his New York City criminal case step aside, echoing the former president’s complaints that he’s “a Trump hating-judge” with a family full of “Trump haters.”",https://static.independent.co.uk/2023/05/24/05/Trump_Indictment_91133.jpg?quality=75&width=1200&auto=webp,2023-06-02T21:01:45Z,https://web.archive.org/web/20230603032244/https://www.independent.co.uk/news/world/americas/us-politics/donald-trump-ap-alvin-bragg-manhattan-new-york-b2350663.html,"Sign up for the daily Inside Washington email for exclusive US coverage and analysis sent to your inbox
Get our free Inside Washington email
Within hours of his historic arraignment this spring, Do… [+5462 chars]",,en,'Donald Trump'
