index,url,valid,domain,title,description,image,published,archive,content,quote,language,keyword
https://freerepublic.com/focus/f-religion/4194270/posts,https://freerepublic.com/focus/f-religion/4194270/posts,0,freerepublic.com,Cardinal Pierre on why the U.S. bishops are struggling to connect with Pope Francis,"Cardinal Pierre on why the U.S. bishops are struggling to connect with Pope FrancisCardinal Christophe Pierre has been apostolic nuncio to the United States since 2016 and, at Pope Francis’ request, he will continue in this role for the foreseeable future, he…",,2023-11-03T17:26:07Z,,"Skip to comments.
Cardinal Pierre on why the U.S. bishops are struggling to connect with Pope FrancisAmerica Magazine ^
 | November 2, 2023
 | Gerard OConnell
Posted on 11/03/2023 10:26:07 AM PDT… [+14915 chars]",,en,'Pope Francis'
https://press.un.org/en/2023/sg2265.doc.htm,https://press.un.org/en/2023/sg2265.doc.htm,0,press.un.org,Secretary General Discusses Anti-Racism Agenda with United Nations Experts,"Today, Secretary-General António Guterres met with the Chairpersons and mandate holders of the eight United Nations anti-racism mechanisms*and discussed the current state of the world with regards to racism, racial discrimination, xenophobia and related intol…",,2023-11-03T17:36:03Z,,"Today, Secretary-General António Guterres met with the Chairpersons and mandate holders of the eight United Nations anti-racism mechanisms*and discussed the current state of the world with regards to… [+2092 chars]",,en,'António Guterres'
https://press.un.org/en/2023/sgsm22018.doc.htm,https://press.un.org/en/2023/sgsm22018.doc.htm,0,press.un.org,"Recommit to ‘Realizing Every Person’s Human Right to Safe Sanitation’, Says Secretary-General, in Message for World Toilet Day","Following is UN Secretary-General António Guterres’ message on World Toilet Day, observed on 19 November.",,2023-11-03T17:43:10Z,,"Following is UN Secretary-General António Guterres message on World Toilet Day, observed on 19 November.
Toilets transform lives.  They deliver dignity, boost school attendance particularly for girl… [+1142 chars]",,en,'António Guterres'
https://www.cosmopolitan.com/entertainment/celebs/a45737034/joe-jonas-sophie-turner-dating-feelings-peregrine-pearson-kiss/,https://www.cosmopolitan.com/entertainment/celebs/a45737034/joe-jonas-sophie-turner-dating-feelings-peregrine-pearson-kiss/,0,www.cosmopolitan.com,How Joe Jonas Feels About Sophie Turner Dating Again After Her Kiss with Peregrine Pearson,"The newly single star is ""putting herself out there and keeping her options open.""","https://hips.hearstapps.com/hmg-prod/images/joe-jonas-and-sophie-turner-attend-the-2nd-annual-academy-news-photo-1698941561.jpg?crop=1.00xw:0.711xh;0,0.0901xh&resize=1200:*",2023-11-03T18:40:00Z,https://web.archive.org/web/20231104101728/https://www.cosmopolitan.com/entertainment/celebs/a45737034/joe-jonas-sophie-turner-dating-feelings-peregrine-pearson-kiss/,"Yes, Sophie Turner and British aristocrat Peregrine Pearson were 
photographed kissing. But its not serious, a source told Us Weekly, and Sophie is seeing multiple people right now as she adjusts to… [+1886 chars]",,en,'Sophie Turner'
https://www.cbsnews.com/video/missy-elliott-sheryl-crow-rock-roll-hall-of-fame/,https://www.cbsnews.com/video/missy-elliott-sheryl-crow-rock-roll-hall-of-fame/,0,www.cbsnews.com,"Missy Elliott, Sheryl Crow to be inducted into Rock & Roll Hall of Fame","Missy Elliott will become the first woman rapper inducted to the Rock & Roll Hall of Fame Friday night. Joe Levy, a contributing editor for Rolling Stone and entertainment editor at The Observer, joined CBS News to discuss Elliott's influence on the music ind…",https://assets2.cbsnewsstatic.com/hub/i/r/2023/11/03/22689025-4d21-450d-a94e-87cd44c86117/thumbnail/1200x630/90181335691f9c009c8574d12be0647c/missyelliott.jpg?v=c81a9d6c51e6280f2f4f876031d7d9bc,2023-11-03T19:17:00Z,https://web.archive.org/web/20231103193426/https://www.cbsnews.com/video/missy-elliott-sheryl-crow-rock-roll-hall-of-fame/,"Watch CBS News
Copyright ©2023 CBS Interactive Inc. All rights reserved.
Get browser notifications for breaking news, live events, and exclusive reporting.
Not NowTurn On",,en,'Sheryl Crow'
https://www.vice.com/en/article/93kg45/solawave-sale,https://www.vice.com/en/article/93kg45/solawave-sale,0,www.vice.com,The Solawave Wand (That Even Pedro Pascal Loves) Is BOGO Right Now,The internet-famous LED light skincare device will have you looking like Handsome Squidward (in a good way).,https://video-images.vice.com/articles/65455e540480339e5c8ab698/lede/1699046831142-solawavelede.png?image-resize-opts=Y3JvcD0xeHc6MXhoO2NlbnRlcixjZW50ZXImcmVzaXplPTEyMDA6KiZyZXNpemU9MTIwMDoq,2023-11-03T21:40:03Z,,"VICE may receive a commission if you buy products through the links on our site. Read morehere.
We all wish we could press a button and make our skincare concerns vanish, but sadly we havent gotten … [+2911 chars]",,en,'Pedro Pascal'
https://ohnotheydidnt.livejournal.com/127166138.html,https://ohnotheydidnt.livejournal.com/127166138.html,0,ohnotheydidnt.livejournal.com,The Rock and Roll Hall of Fame Induction Ceremony will be Streamd Live,"This year's Rock & Roll Hall of Fame induction ceremony will stream live for the first time, honoring Missy Elliott, Kate Bush, Sheryl Crow, Rage Against the Machine, Willie Nelson, and more. https://t.co/hLf2ATMjsG
— Entertainment Weekly (@EW) November 3, 2…",https://l-files.livejournal.net/og_image/3616053/496742?v=1699048108,2023-11-03T21:48:26Z,https://web.archive.org/web/20231105015631/https://ohnotheydidnt.livejournal.com/127166138.html,"This year's Rock &amp; Roll Hall of Fame induction ceremony will stream live for the first time, honoring Missy Elliott, Kate Bush, Sheryl Crow, Rage Against the Machine, Willie Nelson, and more. htt… [+66 chars]",,en,'Sheryl Crow'
https://radaronline.com/p/joe-jonas-and-sophie-turner-ordered-to-florida-court-hearing/,https://radaronline.com/p/joe-jonas-and-sophie-turner-ordered-to-florida-court-hearing/,0,radaronline.com,'Special Hearing': Joe Jonas and Ex Sophie Turner Set to Appear in Divorce Court After Weeks of Negotiations,The exes will appear before Miami judge next month.,https://media.radaronline.com/brand-img/9EBwVWT0A/1200x628/sophie-turner-joe-jonas-selling-nyc-apartment-4-1699029041080.jpg,2023-11-03T22:30:00Z,,"Jonas, 34, allegedly blindsided Turner in September by filing divorce papers in Miami while she was in the UK working on a film project.
Recently, Turner was spotted publicly locking lips with the h… [+354 chars]",,en,'Sophie Turner'
https://press.un.org/en/2023/sgsm22109.doc.htm,https://press.un.org/en/2023/sgsm22109.doc.htm,0,press.un.org,"Scale Up Financial, Technical Contributions to Make Roads Safer Everywhere, Secretary-General Urges Donors, in Message for World Day","Following is UN Secretary-General António Guterres’ message for the World Day of Remembrance for Road Traffic Victims, observed on 21 November:",,2023-11-03T23:01:04Z,,"Following is UN Secretary-General António Guterres message for the World Day of Remembrance for Road Traffic Victims, observed on 21 November:
The World Day of Remembrance of Road Traffic Victims sh… [+944 chars]",,en,'António Guterres'
https://consequence.net/2023/11/olivia-rodrigo-stevie-nicks-sheryl-crow-rock-hall-of-fame/,https://consequence.net/2023/11/olivia-rodrigo-stevie-nicks-sheryl-crow-rock-hall-of-fame/,0,consequence.net,Olivia Rodrigo and Stevie Nicks Perform with Sheryl Crow at Rock and Roll Hall of Fame: Watch,"Watch Crow perform ""If It Makes You Happy,"" ""Strong Enough,"" and ""Everyday Is a Winding Road"" with backing from Rodrigo, Nicks, and Peter Frampton.
Olivia Rodrigo and Stevie Nicks Perform with Sheryl Crow at Rock and Roll Hall of Fame: Watch
Carys Anderson",https://consequence.net/wp-content/uploads/2023/11/Stevie-Nicks-with-Sheryl-Crow.jpeg,2023-11-04T00:35:53Z,,"Olivia Rodrigo, Stevie Nicks, and Peter Frampton helped Sheryl Crow celebrate her inauguration into the Rock and Roll Hall of Fame by joining the legend.
To kick off the show, Rodrigo joined Crow fo… [+1514 chars]",,en,'Sheryl Crow'
https://consequence.net/2023/11/willie-nelson-rock-roll-hall-fame-shery-crow-dave-matthews-chris-stapleton/,https://consequence.net/2023/11/willie-nelson-rock-roll-hall-fame-shery-crow-dave-matthews-chris-stapleton/,0,consequence.net,"Willie Nelson Performs with Sheryl Crow, Dave Matthews, and Chris Stapleton at Rock Hall of Fame Ceremony: Watch","Watch Nelson celebrate his enshrinement with renditions of ""Whiskey River,"" Crazy,"" and ""On the Road Again.""
Willie Nelson Performs with Sheryl Crow, Dave Matthews, and Chris Stapleton at Rock Hall of Fame Ceremony: Watch
Scoop Harrison",https://consequence.net/wp-content/uploads/2023/11/Willie-Nelson.jpeg,2023-11-04T03:41:59Z,,"Willie Nelson was welcomed into the Rock and Roll Hall of Fame on Friday.
The 90-year-old music legend was introduced by Dave Matthews, who shared various anecdotes about Nelson’s altruism and weed … [+1459 chars]",,en,'Sheryl Crow'
https://www.philstar.com/entertainment/movies/2023/11/04/2308895/watch-ryan-gosling-emily-blunt-the-fall-guy-trailer,https://www.philstar.com/entertainment/movies/2023/11/04/2308895/watch-ryan-gosling-emily-blunt-the-fall-guy-trailer,0,www.philstar.com,"WATCH: Ryan Gosling, Emily Blunt in 'The Fall Guy' trailer","""The Fall Guy,"" based on the 1980s television show of the same name, features Ryan Gosling as a veteran stuntman who has been employed to work on his ex-girlfriend's feature directorial debut.",https://media.philstar.com/photos/2023/11/04/ryan-gosling-emily-blunt-fall-guy_2023-11-04_11-12-20.jpg,2023-11-04T06:45:18Z,,"MANILA, Philippines — Universal Pictures has released the first official trailer for David Leitch's ""The Fall Guy,"" starring Ryan Gosling and Emily Blunt.
""The Fall Guy"" serves as a bigscreen dedica… [+2112 chars]",,en,'Ryan Gosling'
https://www.breitbart.com/entertainment/2023/11/04/sheryl-crow-really-scared-of-artificial-intelligence/,https://www.breitbart.com/entertainment/2023/11/04/sheryl-crow-really-scared-of-artificial-intelligence/,0,www.breitbart.com,Sheryl Crow 'Really Scared' of Artificial Intelligence,"Grammy Award-winning singer Sheryl Crow says she is ""really scared"" of artificial intelligence (AI) being used in the entertainment industry.",https://media.breitbart.com/media/2023/11/SherylCrow4-640x335.jpg,2023-11-04T14:15:34Z,https://web.archive.org/web/20231104161914/https://www.breitbart.com/entertainment/2023/11/04/sheryl-crow-really-scared-of-artificial-intelligence/,"Grammy Award-winning singer and songwriter Sheryl Crow says she is “really scared” of artificial intelligence (AI) being used in the entertainment industry.
The “All I Wanna Do” singer appeared on N… [+2917 chars]",,en,'Sheryl Crow'
https://screenrant.com/joker-2-trailer-lady-gaga-music-video/,https://screenrant.com/joker-2-trailer-lady-gaga-music-video/,0,screenrant.com,Genius Joker 2 Fan Trailer Turns Lady Gaga’s Music Videos Into Her Villain Origin Story,A Joker: Folie à Deux fan trailer has ingeniously paired footage from one of Lady Gaga's music videos with Joker to create a compelling origin story.,https://static1.srcdn.com/wordpress/wp-content/uploads/2023/10/gaga-music-video-harley-quinn.jpg,2023-11-04T14:20:12Z,,"Summary
<ul><li> Lady Gaga's history of music videos, including ""Marry The Night,"" showcases her ability to portray complex and dramatic characters, making her a perfect fit for the role of Harley Q… [+2876 chars]",,en,'Margot Robbie'
https://www.brooklynvegan.com/rock-roll-hall-of-fame-2023-missy-elliott-george-michael-tribute-willie-nelson-sheryl-crow-olivia-rodrigo-chris-stapleton-more-watch/,https://www.brooklynvegan.com/rock-roll-hall-of-fame-2023-missy-elliott-george-michael-tribute-willie-nelson-sheryl-crow-olivia-rodrigo-chris-stapleton-more-watch/,0,www.brooklynvegan.com,"Rock & Roll Hall of Fame 2023: Missy Elliott, George Michael tribute, Willie Nelson, Sheryl Crow, Olivia Rodrigo, Chris Stapleton, more (watch)","The 2023 Rock & Roll Hall of Fame induction ceremony happened Friday night at Brooklyn’s Barclays Center which was broadcast live on Disney+. While Kate Bush wasn’t there, there was no shortage of superstars on stage. Queen Latifah inducted Missy Elliott, the…",https://www.brooklynvegan.com/wp-content/uploads/2023/11/04/willie-sheryl.jpg,2023-11-04T16:43:36Z,,"The 2023 Rock &amp; Roll Hall of Fame induction ceremony happened Friday night at Brooklyn’s Barclays Center which was broadcast live on Disney+. While Kate Bush wasn’t there, there was no shortage o… [+4166 chars]",,en,'George Bush'
https://www.justjared.com/2023/11/04/sheryl-crow-teases-new-song-about-ai-says-it-really-scares-her/,https://www.justjared.com/2023/11/04/sheryl-crow-teases-new-song-about-ai-says-it-really-scares-her/,0,www.justjared.com,Sheryl Crow Teases New Song About AI & Says it 'Really Scares' Her,"Sheryl Crow is opening up about AI and new music. During a Thursday (November 2) appearance on The Tonight Show, the “If It Makes You Happy” singer discussed her upcoming album, Evolution, and how new technology impacts music. She admitted that artists using …",https://cdn.justjared.com/wp-content/uploads/headlines/2023/11/sheryl-crow-ai-1.jpg,2023-11-04T16:59:43Z,,"Sheryl Crow is opening up about AI and new music. 
During a Thursday (November 2) appearance on The Tonight Show, the “If It Makes You Happy” singer discussed her upcoming album, Evolution, and how … [+1289 chars]",,en,'Sheryl Crow'
https://www.eonline.com/news/1389288/sheryl-crows-sons-look-all-grown-up-during-rare-red-carpet-outing-with-mom,https://www.eonline.com/news/1389288/sheryl-crows-sons-look-all-grown-up-during-rare-red-carpet-outing-with-mom,0,www.eonline.com,Sheryl Crow's Sons Look All Grown Up During Rare Red Carpet Outing,"All Sheryl Crow wants to do is have some fun with her family.
The legendary singer celebrated her Rock & Roll Hall of Fame induction on Nov. 3 by making a rare red carpet appearance with her sons,...","https://akns-images.eonline.com/eol_images/Entire_Site/202312/rs_1200x1200-230202083812-1200-Sheryl-Crow-LT-020223.jpg?fit=around%7C1080:1080&output-quality=90&crop=1080:1080;center,top",2023-11-04T17:46:08Z,,"Of course, the ""All I Wanna Do"" artist is just as proud of her kids and gushed over their milestones earlier this year.
""My 15-year-old, in about three months, is going to get his driver's license,""… [+588 chars]",,en,'Sheryl Crow'
https://www.justjared.com/2023/11/04/olivia-rodrigo-reflects-on-her-rock-roll-hall-of-fame-induction-ceremony-performance-with-sheryl-crow/,https://www.justjared.com/2023/11/04/olivia-rodrigo-reflects-on-her-rock-roll-hall-of-fame-induction-ceremony-performance-with-sheryl-crow/,0,www.justjared.com,Olivia Rodrigo Reflects on Her Rock & Roll Hall of Fame Induction Ceremony Performance with Sheryl Crow,"Olivia Rodrigo is reflecting on her special night at the 2023 Rock & Roll Hall of Fame Induction Ceremony, which took place in Brooklyn. The 20-year-old “Vampire” singer helped honor inductee Sheryl Crow, joining Sheryl to perform one of the 61-year-old’s big…",https://cdn.justjared.com/wp-content/uploads/headlines/2023/11/olivia-rodrigo-on-sheryl-song-1.jpg,2023-11-04T20:17:20Z,,"Olivia Rodrigo is reflecting on her special night at the 2023 Rock &amp; Roll Hall of Fame Induction Ceremony, which took place in Brooklyn.
The 20-year-old “Vampire” singer helped honor inductee Sh… [+964 chars]",,en,'Sheryl Crow'
https://www.justjared.com/2023/11/04/taylor-swift-sophie-turner-get-dinner-with-3-chiefs-wags-including-brittany-mahomes-photos/,https://www.justjared.com/2023/11/04/taylor-swift-sophie-turner-get-dinner-with-3-chiefs-wags-including-brittany-mahomes-photos/,0,www.justjared.com,"Taylor Swift & Sophie Turner Get Dinner with 3 Chiefs WAGs, Including Brittany Mahomes! (Photos)","Taylor Swift is enjoying a girls night out with some of her very famous friends, including Sophie Turner and Brittany Mahomes, while Travis Kelce is in Germany for a game! On Saturday (November 4), the 33-year-old “Blank Space” superstar and her friends grabb…",https://cdn.justjared.com/wp-content/uploads/headlines/2023/11/taylor-pals.jpg,2023-11-04T23:45:52Z,,"Taylor Swift is enjoying a girls night out with some of her very famous friends, including Sophie Turner and Brittany Mahomes, while Travis Kelce is in Germany for a game!
On Saturday (November 4), … [+1083 chars]",,en,'Sophie Turner'
https://www.justjared.com/2023/11/04/selena-gomez-gigi-hadid-join-taylor-swift-sophie-turners-star-studded-girls-night-out-more-photos/,https://www.justjared.com/2023/11/04/selena-gomez-gigi-hadid-join-taylor-swift-sophie-turners-star-studded-girls-night-out-more-photos/,0,www.justjared.com,Selena Gomez & Gigi Hadid Join Taylor Swift & Sophie Turner's Star-Studded Girls Night Out (More Photos!),Taylor Swift and Sophie Turner‘s girls night out in New York City is even more star-studded than we initially thought! The pop star and Game of Thrones actress were spotted grabbing a bite to eat at Bond St Sushi on Saturday night (November 4) with three Kans…,https://cdn.justjared.com/wp-content/uploads/headlines/2023/11/selena-taylor.jpg,2023-11-05T00:42:17Z,,"Taylor Swift and Sophie Turner‘s girls night out in New York City is even more star-studded than we initially thought! 
The pop star and Game of Thrones actress were spotted grabbing a bite to eat a… [+1140 chars]",,en,'Sophie Turner'
https://english.khabarhub.com/2023/05/324619/,https://english.khabarhub.com/2023/05/324619/,0,english.khabarhub.com,Understanding Resilience,"On March 23, 2022, UN Secretary-General António Guterres set a target to protect everyone on Earth with early warning systems against increasing extreme weather and climate change. He emphasized the urgent need to invest equally in adaptation and resilience. …",https://english.khabarhub.com/wp-content/uploads/2023/11/Khabar-Hub-Article_Kanchan-Mani-Dixit_1200px-630X-px-Final_2023.11.02-Upload.jpg,2023-11-05T01:15:10Z,,"On March 23, 2022, UN Secretary-General António Guterres set a target to protect everyone on Earth with early warning systems against increasing extreme weather and climate change.
He emphasized the… [+5851 chars]",,en,'António Guterres'
https://www.usmagazine.com/celebrity-news/news/taylor-swift-brittany-mahomes-and-sophie-turner-enjoy-night-out-in-nyc/#article,https://www.usmagazine.com/celebrity-news/news/taylor-swift-brittany-mahomes-and-sophie-turner-enjoy-night-out-in-nyc/#article,0,www.usmagazine.com,"Taylor Swift, Brittany Mahomes and Sophie Turner Enjoy Night Out in NYC","Gotham/GC Images Taylor Swift enjoyed a Saturday night out with Brittany Mahomes and Sophie Turner. The singer, 33, was photographed in New York City on Saturday, November 4, as she headed to dinner with her pals. Swift embraced a “deep fall” look with a blac…",https://www.usmagazine.com/wp-content/uploads/2023/11/Taylor-Swift-Brittany-Mahomes-girls-night.jpg?crop=240px%2C18px%2C1093px%2C572px&resize=1200%2C630&quality=86&strip=all,2023-11-05T01:23:47Z,,"Gotham/GC Images
Taylor Swift enjoyed a Saturday night out with Brittany Mahomes and Sophie Turner.
The singer, 33, was photographed in New York City on Saturday, November 4, as she headed to dinne… [+3391 chars]",,en,'Taylor Swift'
https://dailycaller.com/2023/11/04/sheryl-crow-rock-roll-hall-of-fame/,https://dailycaller.com/2023/11/04/sheryl-crow-rock-roll-hall-of-fame/,0,dailycaller.com,Sheryl Crow Inducted Into Rock & Roll Hall Of Fame,"Sheryl Crow was inducted into the Rock &amp; Roll Hall of Fame Friday night during a star-studded ceremony in New York City, Fox News reported.",https://cdn01.dailycaller.com/wp-content/uploads/2023/11/GettyImages-1773540974-scaled-e1699149505265.jpg,2023-11-05T01:59:23Z,,"Sheryl Crow was inducted into the Rock &amp; Roll Hall of Fame Friday night during a star-studded ceremony in New York City, Fox News reported.
Crow, 61, reflected on her journey in music ahead of r… [+1721 chars]",,en,'Sheryl Crow'
https://ohnotheydidnt.livejournal.com/127171340.html,https://ohnotheydidnt.livejournal.com/127171340.html,0,ohnotheydidnt.livejournal.com,Taylor Swift's 2023 Girl Squad Assembles in New York City,"Brittany Mahomes, Taylor Swift, Selena Gomez, Cara Delevigne, Gigi Hadid and Sophie Turner in New York City. pic.twitter.com/n88yqcBtyf
— @22metgala (@22metgala) November 5, 2023
It's certainly the 1989 era all over again.Taylor Swift was seen with Selena G…",https://l-files.livejournal.net/og_image/3616053/496763?v=1699150677,2023-11-05T02:17:56Z,,"Brittany Mahomes, Taylor Swift, Selena Gomez, Cara Delevigne, Gigi Hadid and Sophie Turner in New York City. pic.twitter.com/n88yqcBtyf
— @22metgala (@22metgala) November 5, 2023
It's certainly the… [+808 chars]",,en,'Sophie Turner'
https://news.sky.com/story/the-uk-is-floundering-and-has-a-problem-adam-boulton-12999845,https://news.sky.com/story/the-uk-is-floundering-and-has-a-problem-adam-boulton-12999845,0,news.sky.com,The UK is floundering and has a problem | Adam Boulton,Boris Johnson's term as prime minister tested the British state to destruction.,https://e3.365dm.com/23/11/1600x900/skynews-boris-johnson-dominic-cummings_6347198.jpg?20231103203715,2023-11-05T03:03:00Z,https://web.archive.org/web/20231105042538/https://news.sky.com/story/the-uk-is-floundering-and-has-a-problem-adam-boulton-12999845,"Boris Johnson's term as prime minister tested the British state to destruction. 
In the end, his ill-considered, negligent and self-deceiving style of leadership destroyed his political career. He t… [+9102 chars]",,en,'Margaret Thatcher'
https://brobible.com/culture/article/taylor-swift-brittany-mahomes-kelce-2/,https://brobible.com/culture/article/taylor-swift-brittany-mahomes-kelce-2/,0,brobible.com,"Taylor Swift, Brittany Mahomes, Selena Gomez, Sophie Turner Enjoy Girls Night Out","Looks like Taylor Swift and her famous girls squad had night out in the Big Apple over the weekend. According to the DailyMail, the pop sensation was joined by Selena Gomez, Sophie Turner, Gigi Hadid, Cara Delevingne, and Brittany Mahomes, wife of Chiefs quar…",https://brobible.com/wp-content/uploads/2023/11/Taylor-Swift-Selena-Gomez-Brittany-Mahomes.jpg,2023-11-05T04:22:01Z,https://web.archive.org/web/20231105042222/https://brobible.com/culture/article/taylor-swift-brittany-mahomes-kelce-2/,"Gotham/Getty Images
Looks like Taylor Swift and her famous girls squad had night out in the Big Apple over the weekend.
According to the DailyMail, the pop sensation was joined by Selena Gomez, Sop… [+1301 chars]",,en,'Sophie Turner'
https://www.justjared.com/2023/11/05/mandy-moore-hilary-duff-enjoy-a-night-out-together-photo/,https://www.justjared.com/2023/11/05/mandy-moore-hilary-duff-enjoy-a-night-out-together-photo/,0,www.justjared.com,Mandy Moore & Hilary Duff Enjoy a Night Out Together (Photo!),"Taylor Swift wasn’t the only celebrity to enjoy a star-studded girls night out this weekend: Mandy Moore and Hilary Duff also got in on the fun! While the “Shake It Off” pop star was enjoying a night out with the likes of Selena Gomez, Gigi Hadid and Sophie T…",https://cdn.justjared.com/wp-content/uploads/headlines/2023/11/mandy-hilary.jpg,2023-11-05T07:14:38Z,,"Taylor Swift wasn’t the only celebrity to enjoy a star-studded girls night out this weekend: Mandy Moore and Hilary Duff also got in on the fun! 
While the “Shake It Off” pop star was enjoying a nig… [+987 chars]",,en,'Taylor Swift'
https://www.cosmopolitan.com/entertainment/celebs/a45744056/taylor-swift-nyc-selena-gomez-brittany-mahomes-chiefs-germany/,https://www.cosmopolitan.com/entertainment/celebs/a45744056/taylor-swift-nyc-selena-gomez-brittany-mahomes-chiefs-germany/,0,www.cosmopolitan.com,Taylor Swift Grabs Dinner With Selena Gomez and Brittany Mahomes While Chiefs Play in Germany,"Taylor, Selena, and Brittany were joined by Gigi Hadid, Sophie Turner, and Cara Delevingne.","https://hips.hearstapps.com/hmg-prod/images/brittany-mahomes-taylor-swift-selena-gomez-gigi-hadid-and-news-photo-1699186436.jpg?crop=1.00xw:0.335xh;0,0.210xh&resize=1200:*",2023-11-05T12:26:00Z,,"Taylor Swift stepped out for a star-studded outing in New York City on Saturday night (November 4), grabbing dinner at Bond St Sushi with celeb friends including *clears throat* Selena Gomez, Sophie … [+1459 chars]",,en,'Taylor Swift'
https://www.teenvogue.com/story/taylor-swift-steps-out-with-girl-group,https://www.teenvogue.com/story/taylor-swift-steps-out-with-girl-group,0,www.teenvogue.com,"Taylor Swift Steps Out With Selena Gomez, Sophie Turner, Gigi Hadid, and Brittany Mahomes",Swift and her girl group were spotted out in New York City on Friday night.,"https://assets.teenvogue.com/photos/6547a797e2c655d22665c0ff/16:9/w_1280,c_limit/1775397910",2023-11-05T14:53:50Z,http://wayback.archive-it.org/all/20231106091419/https://www.teenvogue.com/story/taylor-swift-steps-out-with-girl-group,Taylor Swift is in her girls' dinner era and it's nothing short of iconic. The superstar musician continues to strut the streets of New York City with some of her high-profile friends including Selen… [+855 chars],,en,'Taylor Swift'
