index,url,valid,domain,title,description,image,published,archive,content,quote,language,keyword
94,https://www.catholicnewsagency.com/news/265003/jonathan-roumie-jesus-in-the-chosen-meets-pope-leo-xiv-an-immeasurable-honor,0,www.catholicnewsagency.com,"Jonathan Roumie, Jesus in ‘The Chosen,’ meets Pope Leo XIV: ‘An immeasurable honor’","Jonathan Roumie, the actor who plays Jesus in the series “The Chosen,” greets Pope Leo XIV at the end of Wednesday’s general audience on June 25, 2025, in St. Peter’s Square at the Vatican. / Credit: Vatican Media

ACI Prensa Staff, Jun 25, 2025 / 15:32 pm (C…",https://www.catholicnewsagency.com/images/roumiemeetspopeleo062525.jpeg?jpg,2025-06-25T19:32:00Z,,"ACI Prensa Staff, Jun 25, 2025 /
 15:32 pm
Jonathan Roumie, the actor who plays Jesus in the series The Chosen, greeted Pope Leo XIV at the end of Wednesdays general audience on June 25 in St. Pete… [+2243 chars]",,en,'Pope Leo'
95,https://www.today.com/popculture/the-chosen-jesus-jonathan-roumie-meets-pope-leo-rcna215080,0,www.today.com,Actor Who Plays Jesus in 'The Chosen' Meets Pope Leo XIV,"Jonathan Roumie, the actor who plays Jesus on the hit biblical series ""The Chosen,"" met Pope Leo XIV this week at the Vatican.","https://media-cldnry.s-nbcnews.com/image/upload/t_social_share_1200x630_center,f_auto,q_auto:best/rockcms/2025-06/Jonathan-Roumie-the-chosen-pope-leo-mc-250625-409bd7.jpg",2025-06-25T20:23:14Z,,"Jonathan Roumie, the actor who plays Jesus on the hit biblical series ""The Chosen,"" was all smiles when he snapped a selfie with Pope Leo XIV this week at the Vatican.
Roumie pulled out his smartpho… [+1798 chars]",,en,'Pope Leo'
96,https://www.rigzone.com/news/wire/ambani_and_adani_team_up_to_use_each_others_fuel_pumps-25-jun-2025-180944-article/,0,www.rigzone.com,Ambani and Adani Team Up to Use Each Other's Fuel Pumps,Billionaires Mukesh Ambani and Gautam Adani have partnered to sell transportation fuels using their respective groups' retail stations across India.,https://images.rigzone.com/images/news/articles/Ambani-and-Adani-Team-Up-to-Use-Each-Others-Fuel-Pumps-180944-1200x628.png,2025-06-25T21:00:00Z,,"Billionaires Mukesh Ambani and Gautam Adani have partnered to sell transportation fuels using their respective groups’ retail stations across India, bolstering their distribution network across the w… [+1167 chars]",,en,'Gautam Adani'
97,https://freerepublic.com/focus/f-religion/4325304/posts,0,freerepublic.com,"[Catholic Caucus] Pope Leo XIV affirms celibacy for priests, demands ‘firm’ action on sex abuse","[Catholic Caucus] Pope Leo XIV affirms celibacy for priests, demands ‘firm’ action on sex abusePope Leo XIV affirmed Wednesday that priests must be celibate and insisted that bishops take “firm and decisive” action to deal with sex abusers, as he gave marchin…",,2025-06-25T23:09:36Z,,"Skip to comments.
[Catholic Caucus] Pope Leo XIV affirms celibacy for priests, demands firm action on sex abuseAP ^
 | June 25, 2025
 | Nicole Winfield
Posted on 06/25/2025 4:09:36 PM PDT by ebb … [+1921 chars]",,en,'Pope Leo'
98,https://people.com/the-chosen-star-jonathan-roumie-takes-selfie-with-pope-leo-xiv-11761509,0,people.com,'The Chosen' Star Jonathan Roumie Takes Selfie with Pope Leo XIV,"Jonathan Roumie, who plays Jesus Christ on 'The Chosen,' took a selfie with Pope Leo XIV during the pontiff's general audience in Vatican City on Wednesday, June 25. The pontiff shared a photo of the moment to Instagram the same day.",https://people.com/thmb/iGUcLl3XzHufjesfkbuA-Di87vk=/1500x0/filters:no_upscale():max_bytes(150000):strip_icc():focal(780x355:782x357)/Jonathan-Roumie-Pope-062525-7f10a26514be49f0a67ab3dd3271ff66.jpg,2025-06-26T00:08:52Z,,"<ul><li>Jonathan Roumie, who plays Jesus Christ on The Chosen, met Pope Leo XIV during the pope's general audience on Wednesday, June 25</li><li>The pope shared a photo of the moment to Instagram the… [+2596 chars]",,en,'Pope Leo'
99,https://www.forbes.com/sites/yessarrosendar/2025/06/25/billionaires-mukesh-ambani-gautam-adani-in-fuel-retailing-partnership-across-india/,0,www.forbes.com,"Billionaires Mukesh Ambani, Gautam Adani In Fuel Retailing Partnership Across India","This is the second partnership between the India's richest persons. In July 2024, Mukesh Ambani’s Reliance Industries bought a 26% stake in Mahan Energen, a unit of Adani Power for $5.8 million.",https://imageio.forbes.com/specials-images/imageserve/685cbfd9ff407470a988b9b6/0x0.jpg?format=jpg&height=900&width=1600&fit=bounds,2025-06-26T03:50:09Z,,"Jio-BP gas station in Mumbai, India, on Tuesday, Oct. 26, 2021. Photographer: Dhiraj Singh/Bloomberg
© 2021 Bloomberg Finance LP
Indias richest persons Mukesh Ambani
 and Gautam Adani
 are partne… [+1731 chars]",,en,'Mukesh Ambani'
100,https://www.catholicnewsagency.com/news/265007/castel-gandolfo-prepares-to-welcome-pope-leo-xiv-the-heart-of-the-city-returns,0,www.catholicnewsagency.com,Castel Gandolfo prepares to welcome Pope Leo XIV: ‘The heart of the city returns’,"An aerial view of the papal palace of Castel Gandolfo near Rome. The apostolic palace is a complex of buildings served for centuries as a summer residence for the pope and overlooks Lake Albano. / Credit: Stefano Tammaro/Shutterstock

Rome Newsroom, Jun 26, 2…",https://www.catholicnewsagency.com/images/castelgandolfo062525.jpg?jpg,2025-06-26T10:00:00Z,,"Rome Newsroom, Jun 26, 2025 /
 06:00 am
Castel Gandolfo is preparing to welcome Pope Leo XIV on July 6. The imposing papal villa in this town on the shores of Lake Albano, a fortified 17th-century … [+4848 chars]",,en,'Pope Leo'
101,https://www.sueddeutsche.de/projekte/artikel/politik/the-vatican-knows-an-industrial-revolution-when-it-sees-one-e851440/,0,www.sueddeutsche.de,Ideas: The Vatican Knows an ‘Industrial Revolution’ When It Sees One,"To update Catholic teaching for the age of AI, Pope Leo should revisit the 19th century.",,2025-06-26T11:04:00Z,,"The pope didn’t take long to explain why he picked the name Leo. Two days after his election, he cited his inspiration: the preceding Pope Leo, who led the Church while the West confronted the social… [+421 chars]",,en,'Pope Leo'
102,https://www.catholicnewsagency.com/news/265013/pope-leo-xiv-urges-law-enforcement-to-target-drug-traffickers-not-addicts,0,www.catholicnewsagency.com,"Pope Leo XIV urges law enforcement to target drug traffickers, not addicts","Pope Leo XIV speaks to an anti-drug advocate at the Apostolic Palace in Vatican City, Thursday, June 26, 2025 / Credit: Vatican Media

Vatican City, Jun 26, 2025 / 09:23 am (CNA).
Pope Leo XIV on Thursday called on governments and law enforcement agencies to …",https://www.catholicnewsagency.com/images/fra4633.jpg?jpg,2025-06-26T13:23:00Z,,"Vatican City, Jun 26, 2025 /
 09:23 am
Pope Leo XIV on Thursday called on governments and law enforcement agencies to focus their efforts on dismantling criminal organizations that profit from drug… [+4570 chars]",,en,'Pope Leo'
103,https://www.catholicnewsagency.com/news/265019/pope-leo-xiv-pope-francis-legacy-of-synodality-is-a-style-attitude,0,www.catholicnewsagency.com,"Pope Leo XIV: Pope Francis’ legacy of synodality is a style, attitude","Pope Leo XIV meets with the synod’s 16th ordinary council near the Vatican on Thursday, June 26, 2025. / Credit: Vatican Media

Vatican City, Jun 26, 2025 / 12:55 pm (CNA).
Pope Francis’ biggest legacy regarding synodality is “as a style, an attitude that hel…",https://www.catholicnewsagency.com/images/ris786550.jpg?jpg,2025-06-26T16:55:00Z,,"Vatican City, Jun 26, 2025 /
 12:55 pm
Pope Francis biggest legacy regarding synodality is as a style, an attitude that helps us to be Church, Pope Leo XIV said Thursday in a meeting with synod lea… [+3565 chars]",,en,'Pope Leo'
104,https://www.lesswrong.com/posts/DiHX6C6knmA5cezaf/ai-122-paying-the-market-price,0,www.lesswrong.com,AI #122: Paying The Market Price,"Published on June 26, 2025 6:10 PM GMTIf you are Meta, and you want to attract top AI talent, you have a problem, because no one wants to work for you or on your products. So it is going to cost you. Mark Zuckerberg has decided he will pay what it takes to ge…","https://res.cloudinary.com/lesswrong-2-0/image/upload/f_auto,q_auto/v1/mirroredImages/DiHX6C6knmA5cezaf/wlzh5a8lwljve0unmwo5",2025-06-26T18:10:03Z,,"If you are Meta, and you want to attract top AI talent, you have a problem, because no one wants to work for you or on your products. So it is going to cost you. Mark Zuckerberg has decided he will p… [+68534 chars]",,en,'Pope Leo'
105,https://www.aljazeera.com/news/2025/6/26/pope-leo-decries-shameful-disregard-for-international-law,0,www.aljazeera.com,Pope Leo decries ‘shameful’ disregard for international law,Catholic pontiff says international rules have been 'replaced by the presumed right to overpower others'.,https://www.aljazeera.com/wp-content/uploads/2025/06/2025-06-25T070938Z_1382257051_RC2J9FAUJY3G_RTRMADP_3_POPE-LEO-AUDIENCE-1750960824.jpg?resize=1920%2C1440,2025-06-26T18:19:30Z,,Pope Leo XIV has lamented what he described as the rise of blunt power over the rules of international law as conflicts rage around the world and global institutions continue to fail to end abuses an… [+2597 chars],,en,'Pope Leo'
106,https://theconversation.com/poland-divided-between-trump-and-the-eu-260007,0,theconversation.com,"Poland, divided between Trump and the EU","With the new Polish president, nationalist Karol Nawrocki, European Trump supporters, led by Viktor Orbán, have gained an additional ally.",https://images.theconversation.com/files/676997/original/file-20250606-62-fhhbi2.jpeg?ixlib=rb-4.1.0&rect=0%2C372%2C3000%2C1500&q=45&auto=format&w=1356&h=668&fit=crop,2025-06-27T09:14:10Z,,"Karol Nawrocki in the Oval Office with Donald Trump on May 25th 2025, ten days before the first round of the Polish presidential election. It is very rare for a sitting US president to receive a cand… [+12349 chars]",,en,'Viktor Orbán'
107,https://consent.yahoo.com/v2/collectConsent?sessionId=1_cc-session_fc138cce-b531-4f67-9518-37e6bbb1fe17,0,consent.yahoo.com,Pope Leo XIV appeals for unity within the Catholic Church in Holy Year messages to priests,,,2025-06-27T12:08:50Z,,"If you click 'Accept all', we and our partners, including 235 who are part of the IAB Transparency &amp; Consent Framework, will also store and/or access information on a device (in other words, use … [+714 chars]",,en,'Pope Leo'
108,https://www.catholicnewsagency.com/news/265065/benedict-xvi-francis-and-leo-xiv-recommend-this-book-which-warns-of-a-world-without-god,0,www.catholicnewsagency.com,"Benedict XVI, Francis, and Leo XIV recommend this book, which warns of a world without God","null / Credit: TippaPatt/Shutterstock

ACI Prensa Staff, Jun 28, 2025 / 09:00 am (CNA).
The last three popes — Benedict XVI, Francis, and Leo XIV — have on more than one occasion recommended reading “Lord of the World,” the dystopian science fiction novel wri…",https://www.catholicnewsagency.com/images/personreadingbook080424.jpg?jpg,2025-06-28T13:00:00Z,,"ACI Prensa Staff, Jun 28, 2025 /
 09:00 am
The last three popes Benedict XVI, Francis, and Leo XIV have on more than one occasion recommended reading Lord of the World, the dystopian science fictio… [+3725 chars]",,en,'Benedict XVI'
109,https://www.politico.eu/article/pope-leo-maga-megadonors-church-finance-united-states-conservative/,0,www.politico.eu,Pope Leo looks to MAGA megadonors to shore up Church finances,Wealthy American conservatives hint they're ready to cough up again to rescue the scandal-ridden Church from going broke.,"https://www.politico.eu/cdn-cgi/image/width=1200,height=630,fit=crop,quality=80,onerror=redirect/wp-content/uploads/2025/06/28/13148114-scaled.jpg",2025-06-28T13:44:32Z,,"The Vaticans income is mainly derived from property assets and donations including from bishops and Peters Pence, the annual June collection by churches for the popes mission and charitable works. Bu… [+1722 chars]",,en,'Pope Leo'
110,https://www.forbes.com/sites/ewelinaochab/2025/06/28/british-politicians-call-upon-pope-leo-xiv-to-stand-up-for-jimmy-lai/,0,www.forbes.com,British Politicians Call Upon Pope Leo XIV To Stand Up For Jimmy Lai,"On June 21, 2025, Alex Sobel MP, Member of the U.K. Parliament, delivered a letter to Pope Leo XIV after a special audience for members of the Inter-Parliamentary...",https://imageio.forbes.com/specials-images/imageserve/68605b813297332c27fbeeaa/0x0.jpg?format=jpg&height=900&width=1600&fit=bounds,2025-06-28T21:35:18Z,,"Vatican, June 21, 2025. Pope Leo XIV meets with political leaders during the Jubilee of Governments ... More at the Apostolic Palace on June 21, 2025, in Vatican City, Vatican. Greeting the members o… [+4344 chars]",,en,'Pope Leo'
https://www.thehindubusinessline.com/companies/anant-ambani-to-get-10-20-cr-salary-profit-commission-as-executive-director-of-reliance/article69751397.ece,https://www.thehindubusinessline.com/companies/anant-ambani-to-get-10-20-cr-salary-profit-commission-as-executive-director-of-reliance/article69751397.ece,0,www.thehindubusinessline.com,"Anant Ambani to get ₹10-20 cr salary, profit commission as Executive Director of Reliance","Anant Ambani appointed Executive Director at Reliance Industries with ₹10-20 crore salary, perks, and profit commission.",https://bl-i.thgim.com/public/incoming/jqmm6y/article69751473.ece/alternates/LANDSCAPE_1200/20240303092L.jpg,2025-06-29T10:03:14Z,,"Anant Ambani, the youngest son of billionaire Mukesh Ambani and the first among three siblings to be appointed Executive Director on flagship Reliance Industries, will be paid 10-20 crore salary annu… [+4652 chars]",,en,'nan nan'
111,https://www.space.com/entertainment/space-movies-shows/war-of-the-worlds-at-20-steven-spielberg-made-three-quarters-of-an-apocalyptic-classic,0,www.space.com,'War of the Worlds' at 20: Steven Spielberg made three-quarters of an apocalyptic classic,Spielberg's contemporary spin on H. G. Wells would be up there with his best if only he could have nailed the ending.,https://cdn.mos.cms.futurecdn.net/FanoDo6tJdVLa4HUU99xRg.jpg,2025-06-29T16:00:00Z,,"It had been less than a decade since outer space had launched a blockbuster assault on planet Earth. ""Independence Day"" conquered the worldwide box office in 1996, mercilessly wiping out tourist dest… [+8432 chars]",,en,'Steven Spielberg'
