index,url,valid,domain,title,description,image,published,archive,content,quote,language,keyword
https://cafemom.com/entertainment/kate-middleton-heartbroken-prince-william-insists-sending-george-boarding-school,https://cafemom.com/entertainment/kate-middleton-heartbroken-prince-william-insists-sending-george-boarding-school,0,cafemom.com,Kate Middleton Is 'Heartbroken' Prince William Insists on Sending George to Boarding School,Kate Middleton Is 'Heartbroken' Prince William Insists on Sending George to Boarding Schoolcafemom.com,https://cafemom.com/wp-content/uploads/2024/08/prince_william_prince_george_royal_jubilee_2022-4.jpg,2024-12-02T21:51:01Z,,"And, as Katie mentioned while talking to the Mirror, Will and Kate appreciated the “sense of normality” Lambrook gave their children while Kate navigated her cancer treatment.
“The school gives them… [+386 chars]",,en,'Prince William'
https://www.marca.com/en/lifestyle/uk-news/2024/12/02/674e284b46163f8f708b4588.html,https://www.marca.com/en/lifestyle/uk-news/2024/12/02/674e284b46163f8f708b4588.html,0,www.marca.com,Why Kate Middleton's next appearance will make pull on King Charles' heartstrings,"Kate Middleton is set to make a public appearance that will hold special meaning for King Charles, according to royal expert Jennie Bond. 

The Princess of Wales will accompany Pri",https://phantom-marca.unidadeditorial.es/c83d37ca8dabf341e548de223a9eb3e6/resize/1200/f/webp/assets/multimedia/imagenes/2024/12/02/17331750055955.jpg,2024-12-02T22:03:15Z,https://web.archive.org/web/20241204020610/https://www.marca.com/en/lifestyle/uk-news/2024/12/02/674e284b46163f8f708b4588.html,"Kate Middleton is set to make a public appearance that will hold special meaning for King Charles, according to royal expert Jennie Bond. 
The Princess of Wales will accompany Prince William on Dece… [+1944 chars]",,en,'Prince Charles'
https://www.marca.com/en/lifestyle/uk-news/2024/12/02/674e297ae2704e13ad8b458c.html,https://www.marca.com/en/lifestyle/uk-news/2024/12/02/674e297ae2704e13ad8b458c.html,0,www.marca.com,Kate Middleton drops subtle message to Harry in Christmas letter,"Kate Middletonhas touched hearts with a deeply personal Christmas message accompanying this year&apos;s Westminster Abbey Christmas Carol concert. 

The Princess of Wales penned a",https://phantom-marca.unidadeditorial.es/7e0aae1a1dd94af8f63deb9cc297b6d3/crop/21x0/2047x1351/resize/1200/f/webp/assets/multimedia/imagenes/2024/12/02/17331749530221.png,2024-12-02T22:05:20Z,https://web.archive.org/web/20241204020614/https://www.marca.com/en/lifestyle/uk-news/2024/12/02/674e297ae2704e13ad8b458c.html,"Kate Middletonhas touched hearts with a deeply personal Christmas message accompanying this year's Westminster Abbey Christmas Carol concert. 
The Princess of Wales penned a reflective letter emphas… [+2692 chars]",,en,'Kate Middleton'
https://www.gbnews.com/royal/princess-kate-more-royal-duties-major-appearance-amid-health-crisis-royal-news,https://www.gbnews.com/royal/princess-kate-more-royal-duties-major-appearance-amid-health-crisis-royal-news,0,www.gbnews.com,Kate Middleton to undertake more royal duties during major appearance amid royal health crisis,Princess Kate is expected to undertake more royal duties than previously planned as she attends her first state visit since she announced she was diagnosed with cancer.She will join King Charles and the Prince of Wales as they host the Emir of Qatar and one o…,https://www.gbnews.com/media-library/watch-the-emir-of-qatar-arrives-for-state-visit-to-the-uk.png?id=55120207&width=1200&height=600&coordinates=0%2C0%2C0%2C85,2024-12-02T22:41:16Z,https://web.archive.org/web/20241203050223/https://www.gbnews.com/royal/princess-kate-more-royal-duties-major-appearance-amid-health-crisis-royal-news,"Princess Kate is expected to undertake more royal duties than previously planned as she attends her first state visit since she announced she was diagnosed with cancer.
She will join King Charles an… [+2699 chars]",,en,'King Charles'
https://www.espn.com/nfl/story/_/id/42743651/eli-manning-tom-brady-trolls-fishing,https://www.espn.com/nfl/story/_/id/42743651/eli-manning-tom-brady-trolls-fishing,0,www.espn.com,'Cute Minnow': Eli Manning pokes fun at Tom Brady's fishing post,The troll is just another chapter between the former quarterbacks of the New York Giants and New England Patriots.,https://a.espncdn.com/combiner/i?img=%2Fphoto%2F2024%2F1202%2Fr1422819_1296x729_16%2D9.jpg,2024-12-02T23:56:17Z,https://web.archive.org/web/20241204020705/https://www.espn.com/nfl/story/_/id/42743651/eli-manning-tom-brady-trolls-fishing,"A familiar rival of Tom Brady's poked fun at the future Pro Football Hall of Famer on Monday.
Eli Manning.
Editor's Picks
The former New York Giants quarterback one-upped Brady, à la Super Bowl XL… [+1042 chars]",,en,'Tom Brady'
https://www.bbc.com/news/articles/c20e79nlpe6o?xtor=AL-72-%5Bpartner%5D-%5Byahoo.north.america%5D-%5Bheadline%5D-%5Bnews%5D-%5Bbizdev%5D-%5Bisapi%5D,https://www.bbc.com/news/articles/c20e79nlpe6o?xtor=AL-72-%5Bpartner%5D-%5Byahoo.north.america%5D-%5Bheadline%5D-%5Bnews%5D-%5Bbizdev%5D-%5Bisapi%5D,0,www.bbc.com,Trump picks investment banker Warren Stephens as UK ambassador,The billionaire donated millions to President-elect Donald Trump’s re-election campaign this year.,https://media.zenfs.com/en/bbc_us_articles_995/c82628e6f23c4d5c0c0bdf4dc503e719,2024-12-03T01:32:30Z,,"Yahoo is using AI to generate takeaways from this article. This means the info may not always match what's in the article. Reporting mistakes helps us improve the experience.Generate Key Takeaways
P… [+2594 chars]",,en,'Nikki Haley'
https://economictimes.indiatimes.com/magazines/panache/why-kate-middleton-and-meghan-markle-cannot-get-princess-dianas-precious-tiara/articleshow/115915920.cms,https://economictimes.indiatimes.com/magazines/panache/why-kate-middleton-and-meghan-markle-cannot-get-princess-dianas-precious-tiara/articleshow/115915920.cms,0,economictimes.indiatimes.com,Why Kate Middleton and Meghan Markle cannot get Princess Diana's precious tiara?,"Princess Diana's iconic Spencer tiara, which she wore for her 1981 wedding, remains out of reach for Kate Middleton and Meghan Markle. As a Spencer family heirloom, its $500 million value will not be passed to the royal wives but likely to Viscount Althorp, c…","https://img.etimg.com/thumb/msid-115916128,width-1200,height-630,imgsize-84124,overlay-etpanache/articleshow.jpg",2024-12-03T02:23:02Z,https://web.archive.org/web/20241203025919/https://economictimes.indiatimes.com/magazines/panache/why-kate-middleton-and-meghan-markle-cannot-get-princess-dianas-precious-tiara/articleshow/115915920.cms,"Princess Dianas wedding to then-Prince Charles on July 29, 1981, remains one of the most unforgettable moments in British royal history. With an estimated 750 million viewers tuning in worldwide to s… [+2417 chars]",,en,'Kate Middleton'
https://www.justjared.com/2024/12/02/the-gothams-film-awards-2024-zendaya-angelina-jolie-nicole-kidman-more-stars-hit-the-red-carpet-in-nyc/,https://www.justjared.com/2024/12/02/the-gothams-film-awards-2024-zendaya-angelina-jolie-nicole-kidman-more-stars-hit-the-red-carpet-in-nyc/,0,www.justjared.com,"The Gothams Film Awards 2024: Zendaya, Angelina Jolie, Nicole Kidman, & More Stars Hit the Red Carpet in NYC!","The stars are kicking off awards season in New York City! Zendaya, Sebastian Stan, Angelina Jolie, Colman Domingo, and Nicole Kidman stepped out for the 2024 The Gothams Film Awards on Monday evening (December 2) held at Cipriani Wall Street in New York City.…",https://cdn01.justjared.com/wp-content/uploads/headlines/2024/12/gothams-awards.jpg,2024-12-03T02:37:23Z,,"The stars are kicking off awards season in New York City!
Zendaya, Sebastian Stan, Angelina Jolie, Colman Domingo, and Nicole Kidman stepped out for the 2024 The Gothams Film Awards on Monday evenin… [+3116 chars]",,en,'Angelina Jolie'
https://www.cbsnews.com/news/pete-hegseth-concerned-veterans-for-america-jessie-jane-duff/,https://www.cbsnews.com/news/pete-hegseth-concerned-veterans-for-america-jessie-jane-duff/,0,www.cbsnews.com,GOP insiders sought Hegseth's removal as leader of veterans' group in 2016,"A Trump loyalist is at the center of new allegations facing Pete Hegseth, Donald Trump's pick for defense secretary.",https://assets3.cbsnewsstatic.com/hub/i/r/2024/12/03/03a72aff-9d39-4f0a-bffc-5a2d6e5043b1/thumbnail/1200x630/eeae5a730e360ee7225e331ab2168cb8/gettyimages-2185953336.jpg?v=e3aa8b4a58817620ee227c79202c9709,2024-12-03T03:01:59Z,http://archive.md/20241203054456/https://www.cbsnews.com/news/pete-hegseth-concerned-veterans-for-america-jessie-jane-duff/,"Monterey, California — The battle over President-elect Trump's pick for Secretary of Defense, Pete Hegseth, may become a test of loyalty for Republican stalwarts — some of whom stood at the center of… [+8893 chars]",,en,'David Koch'
https://economictimes.indiatimes.com/news/international/global-trends/prince-harry-meghan-markle-divorce-rumours-made-this-comment-we-are-at-crossroads-in-one-of-final-appearances-before-professional-separation/articleshow/115931284.cms,https://economictimes.indiatimes.com/news/international/global-trends/prince-harry-meghan-markle-divorce-rumours-made-this-comment-we-are-at-crossroads-in-one-of-final-appearances-before-professional-separation/articleshow/115931284.cms,0,economictimes.indiatimes.com,Prince Harry-Meghan Markle made this comment in one of final appearances before 'professional separation',"Prince Harry-Meghan Markle divorce rumours: Amid speculation of rift between the Duke and Duchess of Sussex, a comment by the young royals have gone viral before their professional separation. Harry and Meghan are now working on separate projects, and this ha…","https://img.etimg.com/thumb/msid-115931442,width-1200,height-630,imgsize-1917567,overlay-economictimes/articleshow.jpg",2024-12-03T09:45:55Z,https://web.archive.org/web/20241203102150/https://economictimes.indiatimes.com/news/international/global-trends/prince-harry-meghan-markle-divorce-rumours-made-this-comment-we-are-at-crossroads-in-one-of-final-appearances-before-professional-separation/articleshow/115931284.cms,"Prince Harry and Meghan Markle are reportedly exploring separate career paths, with increasing speculation about ""professional separation"". The Duke and Duchess of Sussex are no longer working on joi… [+4251 chars]",,en,'Meghan Markle'
https://www.forbes.com/sites/maggiemcgrath/2024/12/03/30-under-30-hollywood--entertainment-2025-kathryn-newton-wesley-wang-and-marcello-hernandez-are-thriving-going-into-25/,https://www.forbes.com/sites/maggiemcgrath/2024/12/03/30-under-30-hollywood--entertainment-2025-kathryn-newton-wesley-wang-and-marcello-hernandez-are-thriving-going-into-25/,0,www.forbes.com,"30 Under 30 Hollywood & Entertainment 2025: Kathryn Newton, Wesley Wang And Marcello Hernandez Are Thriving Going Into ‘25","The young entertainers shaping the future of Hollywood across film, tv, comedy, theater and more.","https://imageio.forbes.com/specials-images/imageserve/673e77cd39c2c6e8386b8de9/0x0.jpg?format=jpg&crop=1920,1080,x0,y0,safe&height=900&width=1600&fit=bounds",2024-12-03T11:00:00Z,http://archive.md/20241203133544/https://www.forbes.com/sites/maggiemcgrath/2024/12/03/30-under-30-hollywood--entertainment-2025-kathryn-newton-wesley-wang-and-marcello-hernandez-are-thriving-going-into-25/,"Kathryn Newton did not go into acting intending to become Americas next Scream Queen. Her first big acting break came at 15, for a role in Paranormal Activity 4. She found herself returning to the ge… [+4354 chars]",,en,'Sabrina Carpenter'
https://nypost.com/2024/12/03/lifestyle/celebrating-20-years-of-celeb-stories-at-nycs-employees-only/,https://nypost.com/2024/12/03/lifestyle/celebrating-20-years-of-celeb-stories-at-nycs-employees-only/,0,nypost.com,Partying all night with Elon Musk and saying no to Madonna: 20 years of NYC hotspot Employees Only,"“We never wanted to make a big deal if a celebrity comes in,” Dushan Zaric of Employees Only said. “A lot of these people are used to being in places where everybody kisses their ass.”…",https://nypost.com/wp-content/uploads/sites/2/2024/12/employees-only_720.jpg?quality=75&strip=all&w=720,2024-12-03T11:00:00Z,http://archive.md/20241203155454/https://nypost.com/2024/12/03/lifestyle/celebrating-20-years-of-celeb-stories-at-nycs-employees-only/,"When the West Village speakeasy Employees Only opened two decades ago on Hudson Street, a flood of stars poured in, wanting VIP treatment.
But that’s not the bar’s M.O.
Months after the splashy wat… [+6037 chars]",,en,'Kate Middleton'
https://www.celebitchy.com/900330/prince_william_kate_will_skip_the_windsors_christmas_lunch_at_sandringham/,https://www.celebitchy.com/900330/prince_william_kate_will_skip_the_windsors_christmas_lunch_at_sandringham/,0,www.celebitchy.com,Prince William & Kate will skip the Windsors’ Christmas lunch at Sandringham,"Last week, Buckingham Palace confirmed something widely assumed: the Princess of Wales would attend the Windsors’ Christmas festivities in Norfolk this year. It was at last year’s Christmas celebrations where everything seemed to go wrong for Kate. On Christm…",,2024-12-03T12:15:57Z,,"Last week, Buckingham Palace confirmed something widely assumed: the Princess of Wales would attend the Windsors Christmas festivities in Norfolk this year. It was at last years Christmas celebration… [+5448 chars]",,en,'Kate Middleton'
https://www.cosmopolitan.com/entertainment/celebs/a63079991/kate-middleton-golden-carriage-state-visit/,https://www.cosmopolitan.com/entertainment/celebs/a63079991/kate-middleton-golden-carriage-state-visit/,0,www.cosmopolitan.com,Kate Middleton Arrives in Golden Carriage for Latest Return to Royal Duties,"Kate Middleton showed up to an event for the official state visit of the Emir of Qatar in a golden carriage, wearing a burgundy dress by Sarah Burton for Alexander McQueen.","https://hips.hearstapps.com/hmg-prod/images/catherine-princess-of-wales-and-prince-william-prince-of-news-photo-1733231477.jpg?crop=1.00xw:0.753xh;0,0.115xh&resize=1200:*",2024-12-03T13:30:00Z,https://web.archive.org/web/20241204040125/https://www.cosmopolitan.com/entertainment/celebs/a63079991/kate-middleton-golden-carriage-state-visit/,"Kate Middleton made a rare public appearance this morning, stepping out for her first official state visit since announcing her cancer diagnosis. The Princess of Wales joined her husband Prince Willi… [+1353 chars]",,en,'Kate Middleton'
https://nypost.com/2024/12/03/entertainment/prince-william-kate-middleton-welcome-emir-of-qatar-to-uk/,https://nypost.com/2024/12/03/entertainment/prince-william-kate-middleton-welcome-emir-of-qatar-to-uk/,0,nypost.com,"Kate Middleton gives a royal welcome to Emir of Qatar with subtle tributes to Queen Elizabeth, Princess Diana","The Princess of Wales joined her husband, Prince William, for her first state visit since her cancer diagnosis.",https://nypost.com/wp-content/uploads/sites/2/2024/12/94672465.jpg?quality=75&strip=all&w=1024,2024-12-03T13:31:10Z,https://web.archive.org/web/20241203135219/https://nypost.com/2024/12/03/entertainment/prince-william-kate-middleton-welcome-emir-of-qatar-to-uk/,"The British royals laid out the proverbial red carpet for the Emir of Qatar’s arrival to the UK on Tuesday. 
Prince William and Kate Middleton greeted Sheikh Tamim bin Hamad Al Thani, 44, and his fi… [+3183 chars]",,en,'Kate Middleton'
https://timesofindia.indiatimes.com/world/uk/royal-grandeur-prince-william-and-kate-middleton-host-qatars-emir-and-his-wife-for-a-state-visit-to-britain/photostory/115940664.cms,https://timesofindia.indiatimes.com/world/uk/royal-grandeur-prince-william-and-kate-middleton-host-qatars-emir-and-his-wife-for-a-state-visit-to-britain/photostory/115940664.cms,0,timesofindia.indiatimes.com,Royal grandeur: Prince William and Kate Middleton host Qatar's Emir and his wife for a state visit to Britain,"Britain's King Charles III, Prince William, and the Princess of Wales, Kate Middleton, on Tuesday welcomed Qatar's Emir, Sheikh Tamim bin Hamad Al Thani, and his wife, Sheikha Jawaher, for a two-day state visit. (Photo: AP)",https://static.toiimg.com/photo/115940974.cms,2024-12-03T14:18:14Z,,"Britain's King Charles III, Prince William, and the Princess of Wales, Kate Middleton, on Tuesday welcomed Qatar's Emir, Sheikh Tamim bin Hamad Al Thani, and his wife, Sheikha Jawaher, for a two-day … [+23 chars]",,en,'Kate Middleton'
https://www.newsbreak.com/share/3699743598298-they-re-eating-the-cats-american-woman-jailed-in-ohio?_f=app_share&amp;pd=07h9b5Sl&amp;lang=en_US&amp;send_time=1733276956&amp;trans_data=%7B%22platform%22:0%2C%22cv%22:%2224.48.0.25%22%2C%22languages%22:%22en%22%7D&amp;sep=ns_foryou_rank_exp_24q4-v9%2Cns_foryou_blend_exp_24q4-v6%2Cns_local_strategy_24q4_exp-v15%2Cns_foryou_recall_exp_24q4-v8%2Cns_foryou_model_exp_24q4-v8&amp;s=i2,https://www.newsbreak.com/share/3699743598298-they-re-eating-the-cats-american-woman-jailed-in-ohio?_f=app_share&amp;pd=07h9b5Sl&amp;lang=en_US&amp;send_time=1733276956&amp;trans_data=%7B%22platform%22:0%2C%22cv%22:%2224.48.0.25%22%2C%22languages%22:%22en%22%7D&amp;sep=ns_foryou_rank_exp_24q4-v9%2Cns_foryou_blend_exp_24q4-v6%2Cns_local_strategy_24q4_exp-v15%2Cns_foryou_recall_exp_24q4-v8%2Cns_foryou_model_exp_24q4-v8&amp;s=i2,0,www.newsbreak.com,‘They’re Eating the Cats’: American Woman Jailed in Ohio,"An Ohio woman has been jailed for a year for killing and eating a cat. Allexis T. Ferrell’s arrest received worldwide attention after it was falsely used as proof of claims by Donald Trump and running mate JD Vance that Haitian immigrants in Springfield, Ohio…",https://img.particlenews.com/img/id/3fjZrP_0xAxCift00?type=thumbnail_1600x1200,2024-12-03T14:23:00Z,,"Kate Middleton 'Heartbroken' Husband Prince William Wants to Send Son Prince George to 'Stuffy' All-Boys Boarding School: Source
 Are Kate Middleton and Prince William butting heads? According to ro… [+482 chars]",,en,'Kate Middleton'
https://www.newsbreak.com/share/3700128289457-donald-trump-s-mental-collapse-rages-on-with-suggestion-that-an-entire-country-become-america-s-51st-state?s=a2&amp;share_destination_id=MTI1MTM2ODk4LTE3MzMyODA5NDk3NDE%3D&amp;pd=08T3p47f&amp;hl=en_US&amp;send_time=1733280949&amp;actBtn=bottomBar&amp;_f=app_share&amp;trans_data=%7B%22platform%22:1%2C%22cv%22:%2224.48.0%22%2C%22languages%22:%22en%22%7D&amp;sep=ns_push_exp_rt_bucketv12-v6%2Cns_foryou_blend_exp_24q4-v8%2Cns_foryou_rank_exp_24q4-v3%2Cns_local_strategy_24q4_exp-v16%2Cns_foryou_model_exp_24q4-v4%2Cns_foryou_recall_exp_24q4-v7,https://www.newsbreak.com/share/3700128289457-donald-trump-s-mental-collapse-rages-on-with-suggestion-that-an-entire-country-become-america-s-51st-state?s=a2&amp;share_destination_id=MTI1MTM2ODk4LTE3MzMyODA5NDk3NDE%3D&amp;pd=08T3p47f&amp;hl=en_US&amp;send_time=1733280949&amp;actBtn=bottomBar&amp;_f=app_share&amp;trans_data=%7B%22platform%22:1%2C%22cv%22:%2224.48.0%22%2C%22languages%22:%22en%22%7D&amp;sep=ns_push_exp_rt_bucketv12-v6%2Cns_foryou_blend_exp_24q4-v8%2Cns_foryou_rank_exp_24q4-v3%2Cns_local_strategy_24q4_exp-v16%2Cns_foryou_model_exp_24q4-v4%2Cns_foryou_recall_exp_24q4-v7,0,www.newsbreak.com,Donald Trump’s mental collapse rages on with suggestion that an entire country become America’s 51st state,"Without a doubt, Donald Trump has made a plethora of head-scratching decisions in his life, but proposing an entire country become the 51st state in the U.S. might be proof in the pudding that his brain has gone to absolute mush. In the aftermath of Trump get…",https://img.particlenews.com/img/id/4IW8xU_0xBKdBcl00?type=thumbnail_1600x1200,2024-12-03T14:34:00Z,,"Kate Middleton 'Heartbroken' Husband Prince William Wants to Send Son Prince George to 'Stuffy' All-Boys Boarding School: Source
 Are Kate Middleton and Prince William butting heads? According to ro… [+482 chars]",,en,'Kate Middleton'
http://www.thehollywoodgossip.com/2024/12/kate-middleton-returns-welcomes-special-u-k-visitors-see-the-photos/,http://www.thehollywoodgossip.com/2024/12/kate-middleton-returns-welcomes-special-u-k-visitors-see-the-photos/,0,www.thehollywoodgossip.com,Kate Middleton Returns! Welcomes Special U.K. Visitors! See the Photos!,"Kate Middleton has made a Royal return! On Tuesday, amid her ongoing cancer recovery, the Princess of Wales when she …
Kate Middleton Returns! Welcomes Special U.K. Visitors! See the Photos! was originally published on The Hollywood Gossip.",https://cdn.thehollywoodgossip.com/uploads/2024/12/GettyImages-2188011689-scaled.jpg,2024-12-03T14:48:08Z,,"Kate Middleton has made a Royal return!
On Tuesday, amid her ongoing cancer recovery, the Princess of Wales when she joined husband Prince William to help welcome special visitors to the United King… [+3610 chars]",,en,'Kate Middleton'
https://slashdot.org/firehose.pl?op=view&amp;id=175586799,https://slashdot.org/firehose.pl?op=view&amp;id=175586799,0,slashdot.org,Princess of Wales joins royals for Qatar state visit as Queen Camilla misses welcome due to illness - CNN,Princess of Wales joins royals for Qatar state visit as Queen Camilla misses welcome due to illnessCNN Kate Middleton Joins Prince William amid Her Cancer Recovery to Help Welcome Amir of QatarPEOPLE Kate joins royals in welcoming Emir of Qatar on state visit…,,2024-12-03T15:32:43Z,,The Fine Print: The following comments are owned by whoever posted them. We are not responsible for them in any way.,,en,'Kate Middleton'
https://economictimes.indiatimes.com/magazines/panache/prince-william-vs-kate-middleton-why-the-royal-couple-is-divided-over-prince-georges-next-big-step-in-life/articleshow/115942205.cms,https://economictimes.indiatimes.com/magazines/panache/prince-william-vs-kate-middleton-why-the-royal-couple-is-divided-over-prince-georges-next-big-step-in-life/articleshow/115942205.cms,0,economictimes.indiatimes.com,Prince William Vs Kate Middleton: Why the royal couple is divided over Prince George’s next big step in life?,"Kate Middleton and Prince William are facing a pivotal decision about Prince George's education as his time at Lambrook School nears its end. While William is eager for George to follow royal tradition by attending Eton, Kate prefers a co-educational school l…","https://img.etimg.com/thumb/msid-115942563,width-1200,height-630,imgsize-53308,overlay-etpanache/articleshow.jpg",2024-12-03T15:33:55Z,https://web.archive.org/web/20241204024348/https://economictimes.indiatimes.com/magazines/panache/prince-william-vs-kate-middleton-why-the-royal-couple-is-divided-over-prince-georges-next-big-step-in-life/articleshow/115942205.cms,"The Princess of Wales, Kate Middleton, is navigating a pivotal decision about Prince Georges education as his time at Lambrook School draws to an end. Together with Prince William, she is deliberatin… [+2788 chars]",,en,'Kate Middleton'
https://www.eonline.com/news/1410667/kate-middleton-attends-state-visit-with-prince-william-after-chemotherapy,https://www.eonline.com/news/1410667/kate-middleton-attends-state-visit-with-prince-william-after-chemotherapy,0,www.eonline.com,Kate Middleton Is Royally Flawless With Prince William at State Visit,"Heir is Kate Middleton out and about.
Three months after completing her chemotherapy treatment, the Princess of Wales stepped out alongside her husband Prince William on Dec. 3 to welcome the Amir...","https://akns-images.eonline.com/eol_images/Entire_Site/2024113/cr_1200x1200-241203071457-GettyImages-2188012090.jpg?fit=around%7C1080:1080&output-quality=90&crop=1080:1080;center,top",2024-12-03T15:35:50Z,,"Heir is Kate Middleton out and about.
Three months after completing her chemotherapy treatment, the Princess of Wales stepped out alongside her husband Prince William on Dec. 3 to welcome the Amir o… [+831 chars]",,en,'Prince William'
http://wwd.com/pop-culture/celebrity-news/kate-middleton-alexander-mcqueen-coat-prince-william-state-visit-1236744735/,http://wwd.com/pop-culture/celebrity-news/kate-middleton-alexander-mcqueen-coat-prince-william-state-visit-1236744735/,0,wwd.com,Kate Middleton Goes Monochrome in Burgundy Alexander McQueen Coat and Queen Elizabeth’s Pearls for a Ceremonial Welcome in London With Prince William,Kate Middleton wore a burgundy Alexander McQueen coat and Queen Elizabeth's Japenese pearl choker at a welcome ceremony in London with Prince William.,https://wwd.com/wp-content/uploads/2024/12/kate-middleton-alexander-mcqueen-fi.jpg?w=1000&h=563&crop=1,2024-12-03T15:44:25Z,,"Kate Middleton joined husband Prince William for her latest public outing, as the Prince and Princess of Wales welcomed the Amir of Qatar Sheikh Tamim bin Hamad Al Thani and his wife Sheikha Jawaher … [+2153 chars]",,en,'Prince William'
http://footwearnews.com/fashion/celebrity-style/kate-middleton-brown-leather-boots-state-visit-1234737444/,http://footwearnews.com/fashion/celebrity-style/kate-middleton-brown-leather-boots-state-visit-1234737444/,0,footwearnews.com,Kate Middleton Pays Tribute to the Late Queen Elizabeth in Burgundy Ensemble and Brown Leather Boots for Qatar State Visit,"Kate Middleton was a vision in a full burgundy ensemble and chocolate brown boots to attend a ceremonial welcome Horse Guards Parade on Dec. 3 in London, England. The Princess of Wales and her husband Prince William arrived in a carriage at Buckingham Palace …",https://footwearnews.com/wp-content/uploads/2024/12/kate-middleton-boots.jpg,2024-12-03T15:49:36Z,,"Kate Middleton was a vision in a full burgundy ensemble and chocolate brown boots to attend a ceremonial welcome Horse Guards Parade on Dec. 3 in London, England.
The Princess of Wales and her husba… [+2233 chars]",,en,'Kate Middleton'
