index,url,valid,domain,title,description,image,published,archive,content,quote,language,keyword
https://www.newsweek.com/sean-hannity-defends-efforts-pressure-jim-jordan-opponents-1835215,https://www.newsweek.com/sean-hannity-defends-efforts-pressure-jim-jordan-opponents-1835215,0,www.newsweek.com,Sean Hannity Defends Efforts to Pressure Jim Jordan Opponents,"""I offer no apologies for doing my job and seeking answers from those elected public servants,"" Hannity said during a segment of his Fox News show.",https://d.newsweek.com/en/full/2295376/hannity-defends-jim-jordan-questions.jpg,2023-10-17T04:44:53Z,,"In a Monday night segment, Fox News host Sean Hannity lashed out at the ""snowflakes"" in Congress and the ""media mob"" in response to reports that his show had gotten involved in the efforts to elect a… [+4510 chars]",,en,'Steve Scalise'
https://nypost.com/2023/10/17/jim-jordan-still-facing-opposition-on-eve-of-house-speakership-vote/,https://nypost.com/2023/10/17/jim-jordan-still-facing-opposition-on-eve-of-house-speakership-vote/,0,nypost.com,Jim Jordan still facing opposition on eve of House speakership vote,Several Republican lawmakers emerged from Monday night’s House GOP conference meeting saying that they won’t vote for Rep. Jim Jordan (R-Ohio) on the eve of his speakership election.,https://nypost.com/wp-content/uploads/sites/2/2023/10/Untitled-1-57-1.jpg?quality=75&strip=all&w=1024,2023-10-17T04:49:22Z,,"Several Republican lawmakers emerged from Monday nights House GOP conference meeting saying that they wont vote for Rep. Jim Jordan (R-Ohio) on the eve of his speakership election. 
Jordan, 59, came… [+5117 chars]",,en,'Steve Scalise'
https://www.thedailybeast.com/do-gop-moderates-have-the-stomach-to-block-jim-jordan,https://www.thedailybeast.com/do-gop-moderates-have-the-stomach-to-block-jim-jordan,0,www.thedailybeast.com,Do GOP ‘Moderates’ Have the Stomach to Block Jim Jordan?,"Photo Illustration by Kelly Caminero / The Daily Beast / Getty
On Friday, after 55 House Republicans said they would refuse to vote for Rep. Jim Jordan (R-OH) on the House floor, his path to the speakership looked impossible. But just a few days later, with …","https://img.thedailybeast.com/image/upload/c_crop,d_placeholder_euli9k,h_675,w_1200,x_0,y_0/dpr_2.0/c_limit,w_740/fl_lossy,q_auto/v1697508462/231016-Brodey-Jim-Jordan-tease_ufjbhx",2023-10-17T08:17:44Z,,"On Friday, after 55 House Republicans said they would refuse to vote for Rep. Jim Jordan (R-OH) on the House floor, his path to the speakership looked impossible. But just a few days later, with a vo… [+11966 chars]",,en,'Steve Scalise'
https://www.cnn.com/2023/10/17/politics/jordan-speaker-vote-house-floor/index.html,https://www.cnn.com/2023/10/17/politics/jordan-speaker-vote-house-floor/index.html,0,www.cnn.com,Jim Jordan takes speaker vote to the House floor in bid to end GOP leadership vacuum,Conservative Republican Rep. Jim Jordan of Ohio is bringing the House back to the floor Tuesday to vote on whether he will succeed ousted Speaker Kevin McCarthy and finally end the chamber's prolonged paralysis amid deep GOP divisions.,"https://media.cnn.com/api/v1/images/stellar/prod/231016204150-jim-jordan-10162023.jpg?c=16x9&q=w_800,c_fill",2023-10-17T09:01:04Z,,Conservative Republican Rep. Jim Jordan of Ohio is bringing the House back to the floor Tuesday to vote on whether he will succeed ousted Speaker Kevin McCarthy and finally end the chambers prolonged… [+3938 chars],,en,'Jim Jordan'
https://newrepublic.com/article/176266/jim-jordan-republican-speaker-extremist,https://newrepublic.com/article/176266/jim-jordan-republican-speaker-extremist,0,newrepublic.com,Jim Jordan Is the Nihilist That House Republicans Deserve,"The House of Representatives will hold a vote on Tuesday for a new speaker. While it’s far from guaranteed at this point, one likely outcome is that Ohio Representative Jim Jordan will be elected to replace Kevin McCarthy, who lost a motion to vacate the spea…",https://images.newrepublic.com/23e00cac64563a7c5904e30529ae726adc5b4515.jpeg?w=1200&h=630&crop=faces&fit=crop&fm=jpg,2023-10-17T10:00:00Z,,"Even now, the full scale of Jordans involvement is unclear. He defied a subpoena by the House January 6 committee after Speaker Nancy Pelosi rejected McCarthys brazen effort to place him on the commi… [+1608 chars]",,en,'Jim Jordan'
https://www.cnn.com/2023/10/17/politics/house-speaker-questions-what-matters/index.html,https://www.cnn.com/2023/10/17/politics/house-speaker-questions-what-matters/index.html,0,www.cnn.com,It's been 14 days without a speaker. Here's what needs to happen in the House,It's been 14 days since eight Republicans were able to bounce former House Speaker Kevin McCarthy from the top position in Congress and hit pause on all legislative business on Capitol Hill.,"https://media.cnn.com/api/v1/images/stellar/prod/231016100540-03-jim-jordan-101323.jpg?c=16x9&q=w_800,c_fill",2023-10-17T10:00:44Z,,"A version of this story appeared in CNNs What Matters newsletter. To get it in your inbox, sign up for free here.
Its been 14 days since eight Republicans were able to bounce former House Speaker Ke… [+7866 chars]",,en,'Kevin McCarthy'
https://www.politico.com/newsletters/playbook/2023/10/17/jim-jordans-day-of-reckoning-00121910,https://www.politico.com/newsletters/playbook/2023/10/17/jim-jordans-day-of-reckoning-00121910,0,www.politico.com,Jim Jordan's day of reckoning,And President Joe Biden is headed to Israel.,https://static.politico.com/19/65/77bc97aa4d8f99ff28b3d434110f/jim-jordan-81384.jpg,2023-10-17T10:12:02Z,,"With help from Eli Okun and Garrett Ross
DRIVING THE DAY
STILL TAKING APPLICATIONS How House Speaker Became Washingtons Most Miserable Job, by Ian Ward: You basically have a tied House with no oper… [+22286 chars]",,en,'Steve Scalise'
https://www.theonion.com/sen-menendez-s-wife-offers-to-hit-anyone-with-her-car-1850925749,https://www.theonion.com/sen-menendez-s-wife-offers-to-hit-anyone-with-her-car-1850925749,0,www.theonion.com,Sen. Menendez’s Wife Offers To Hit Anyone With Her Car In Exchange For Dropping Charges,"WASHINGTON—In an effort to make a deal following a new indictment accusing her and her husband of conspiring to act as foreign agents, Nadine Menendez, wife of Sen. Robert Menendez (D-NJ), reportedly offered to hit anyone with her car Tuesday in exchange for …","https://i.kinja-img.com/image/upload/c_fill,f_auto,fl_progressive,g_center,h_675,pg_1,q_80,w_1200/39fa6dbde1af2938e44be0e15ee36f55.jpg",2023-10-17T10:30:00Z,,"WASHINGTONIn an effort to make a deal following a new indictment accusing her and her husband of conspiring to act as foreign agents, Nadine Menendez, wife of Sen. Robert Menendez (D-NJ), reportedly … [+876 chars]",,en,'Robert Menendez'
https://www.newsweek.com/jim-jordan-house-speaker-vote-gop-pressure-1835266,https://www.newsweek.com/jim-jordan-house-speaker-vote-gop-pressure-1835266,0,www.newsweek.com,Jim Jordan's Team's Pressure Tactics Backfire,The Ohio congressman appears to be heading into Tuesday's House speaker vote without the required backing from the GOP.,https://d.newsweek.com/en/full/2295455/jim-jordan-dc.jpg,2023-10-17T10:33:35Z,,"Rep. Jim Jordan's attempt to get almost unanimous backing from GOP lawmakers to elect him House speaker looks set to fail, despite a reported ""pressure"" campaign from the Ohio congressman.
On Tuesda… [+4111 chars]",,en,'Jim Jordan'
https://www.irishtimes.com/world/us/2023/10/17/republicans-failure-to-replace-kevin-mccarthy-as-house-speaker-leaves-lower-house-in-stalemate/,https://www.irishtimes.com/world/us/2023/10/17/republicans-failure-to-replace-kevin-mccarthy-as-house-speaker-leaves-lower-house-in-stalemate/,0,www.irishtimes.com,Republicans gather again as Jim Jordan inches towards speaker position,McCarthy removed from post after rebellion by small number of hard-right members in Republican party,https://www.irishtimes.com/resizer/7s2kUEfvZMNTC7C8DgBsnDQazas=/1200x630/filters:format(jpg):quality(70)/cloudfront-eu-central-1.images.arcpublishing.com/irishtimes/2XZ5KDM7S42WIEY3S7CYE4NGKE.jpg,2023-10-17T10:49:56Z,,"Nearly two weeks after he was ousted, Kevin McCarthys name has not yet been replaced above the door of the office of Speaker of the US House of Representatives in Washington.
McCarthy was removed fr… [+6057 chars]",,en,'Jim Jordan'
https://apnews.com/article/jim-jordan-house-speaker-mccarthy-trump-0b92b9a88864dcbc9edcba94aede74f3,https://apnews.com/article/jim-jordan-house-speaker-mccarthy-trump-0b92b9a88864dcbc9edcba94aede74f3,0,apnews.com,Jordan shoring up support and peeling off detractors ahead of speaker vote...,"Hard-charging right-wing Republican Rep. Jim Jordan is shoring up support to win the House speaker's gavel. One by one Jordan, has been peeling off detractors who view the Ohio Republican as too extreme. He's not home yet, with some lawmakers holding out. Aft…",https://dims.apnews.com/dims4/default/c2490cd/2147483647/strip/true/crop/5625x3164+0+293/resize/1440x810!/quality/90/?url=https%3A%2F%2Fassets.apnews.com%2Fdb%2F08%2F55f5c5eb056378208c661070dfb9%2Fd71b70c9c1714b529e65b14b4b385c23,2023-10-17T11:07:37Z,,"WASHINGTON (AP) With a push by allies of Donald Trump, far-right firebrand Rep. Jim Jordan appeared Monday to be shoring up support to become U.S. House speaker, winning over reluctant Republicans wh… [+6300 chars]",,en,'Steve Scalise'
https://www.celebitchy.com/840900/insurrectionist_jim_jordan_will_probably_be_the_next_speaker_of_the_house/,https://www.celebitchy.com/840900/insurrectionist_jim_jordan_will_probably_be_the_next_speaker_of_the_house/,0,www.celebitchy.com,Insurrectionist Jim Jordan will probably be the next Speaker of the House,"Less than two weeks ago, Kevin McCarthy was ousted as Speaker of the House when a handful of deranged Republicans orchestrated what amounted to a vote of no confidence. McCarthy only lost by six votes, but that was enough, given the Republicans’ razor-slim ma…",,2023-10-17T11:20:26Z,,"Less than two weeks ago, Kevin McCarthy was ousted as Speaker of the House when a handful of deranged Republicans orchestrated what amounted to a vote of no confidence. McCarthy only lost by six vote… [+2614 chars]",,en,'Jim Jordan'
https://www.poynter.org/commentary/2023/fox-news-sean-hannity-email-house-republican-representatives/,https://www.poynter.org/commentary/2023/fox-news-sean-hannity-email-house-republican-representatives/,0,www.poynter.org,Fox News’ Sean Hannity gets involved in the House speaker vote,"Will Jim Jordan end up being the House speaker? That remains to be seen, but someone influential in the Republican Party is pushing for him: Fox News prime-time host Sean […]
The post Fox News’ Sean Hannity gets involved in the House speaker vote appeared fir…",https://www.poynter.org/wp-content/uploads/2023/10/California_Newsom_Hannity_23164123140936.jpg,2023-10-17T11:30:13Z,,"Will Jim Jordan end up being the House speaker? That remains to be seen, but someone influential in the Republican Party is pushing for him: Fox News prime-time host Sean Hannity.
The popular person… [+13946 chars]",,en,'Steve Scalise'
https://www.denverpost.com/2023/10/17/live-updates-jordan-loses-20-republicans-in-speakers-vote-creating-uphill-climb-to-win-gavel/,https://www.denverpost.com/2023/10/17/live-updates-jordan-loses-20-republicans-in-speakers-vote-creating-uphill-climb-to-win-gavel/,0,www.denverpost.com,"Live updates | Jordan loses 20 Republicans in speaker’s vote, creating uphill climb to win gavel","As the House prepares to vote on a speaker, the Democratic leader of the Senate says his chamber will move quickly to respond to the war between Israel and Hamas. Senate Majority Leader Chuck Schumer said Tuesday on the Senate floor that they will not delay a…",https://www.denverpost.com/wp-content/uploads/2023/10/Congress_Speaker_38537-2.jpg?w=1024&h=682,2023-10-17T11:51:41Z,,"WASHINGTON (AP) — Rep. Jim Jordan lost 20 Republican votes Tuesday in his first round of balloting for House speaker, creating an uphill climb to win the gavel.
Another vote is expected, although th… [+13013 chars]",,en,'Steve Scalise'
https://www.bostonherald.com/2023/10/17/live-updates-jordan-loses-first-vote-for-house-speaker-but-more-rounds-of-balloting-are-expected/,https://www.bostonherald.com/2023/10/17/live-updates-jordan-loses-first-vote-for-house-speaker-but-more-rounds-of-balloting-are-expected/,0,www.bostonherald.com,"Live updates | Jordan loses first vote for House speaker, but more rounds of balloting are expected",The House of Representatives is voting on Jim Jordan’s nomination for speaker two weeks after the chamber ousted Kevin McCarthy from the top spot.,https://www.bostonherald.com/wp-content/uploads/2023/10/Congress_Speaker_38537-2.jpg?w=1024&h=682,2023-10-17T11:51:41Z,,"WASHINGTON (AP) — The House of Representatives has rejected Jim Jordan’s nomination for speaker two weeks after the chamber ousted Kevin McCarthy from the top spot.
Jordan scrambled unsuccessfully t… [+12690 chars]",,en,'Jim Jordan'
https://www.denverpost.com/2023/10/17/live-updates-house-nears-vote-on-jim-jordan-as-speaker/,https://www.denverpost.com/2023/10/17/live-updates-house-nears-vote-on-jim-jordan-as-speaker/,0,www.denverpost.com,Live updates | House nears vote on Jim Jordan as speaker,"As the House prepares to vote on a speaker, the Democratic leader of the Senate says his chamber will move quickly to respond to the war between Israel and Hamas. Senate Majority Leader Chuck Schumer said Tuesday on the Senate floor that they will not delay a…",https://www.denverpost.com/wp-content/uploads/2023/10/Congress_Speaker_38537-2.jpg?w=1024&h=682,2023-10-17T11:51:41Z,,"WASHINGTON (AP) — The House of Representatives is set to vote on Jim Jordan’s nomination for speaker on Tuesday afternoon, two weeks after the chamber ousted Kevin McCarthy from the top spot.
Jordan… [+7415 chars]",,en,'Steve Scalise'
https://www.denverpost.com/2023/10/17/live-updates-jordan-appears-on-brink-of-defeat-in-first-round-of-voting-for-house-speaker/,https://www.denverpost.com/2023/10/17/live-updates-jordan-appears-on-brink-of-defeat-in-first-round-of-voting-for-house-speaker/,0,www.denverpost.com,Live updates | Jordan appears on brink of defeat in first round of voting for House speaker,"As the House prepares to vote on a speaker, the Democratic leader of the Senate says his chamber will move quickly to respond to the war between Israel and Hamas. Senate Majority Leader Chuck Schumer said Tuesday on the Senate floor that they will not delay a…",https://www.denverpost.com/wp-content/uploads/2023/10/Congress_Speaker_38537-2.jpg?w=1024&h=682,2023-10-17T11:51:41Z,,"WASHINGTON (AP) — The House of Representatives is voting on Jim Jordan’s nomination for speaker two weeks after the chamber ousted Kevin McCarthy from the top spot.
Jordan has been scrambling to sho… [+11350 chars]",,en,'Steve Scalise'
https://www.bostonherald.com/2023/10/17/live-updates-jordan-loses-20-republicans-in-speakers-vote-creating-uphill-climb-to-win-gavel/,https://www.bostonherald.com/2023/10/17/live-updates-jordan-loses-20-republicans-in-speakers-vote-creating-uphill-climb-to-win-gavel/,0,www.bostonherald.com,"Live updates | Jordan loses 20 Republicans in speaker’s vote, creating uphill climb to win gavel",The House of Representatives is voting on Jim Jordan’s nomination for speaker two weeks after the chamber ousted Kevin McCarthy from the top spot.,https://www.bostonherald.com/wp-content/uploads/2023/10/Congress_Speaker_38537-2.jpg?w=1024&h=682,2023-10-17T11:51:41Z,,"WASHINGTON (AP) — Rep. Jim Jordan lost 20 Republican votes Tuesday in his first round of balloting for House speaker, creating an uphill climb to win the gavel.
Another vote is expected, although th… [+13818 chars]",,en,'Jim Jordan'
https://www.bostonherald.com/2023/10/17/live-updates-jordan-appears-on-brink-of-defeat-in-first-round-of-voting-for-house-speaker/,https://www.bostonherald.com/2023/10/17/live-updates-jordan-appears-on-brink-of-defeat-in-first-round-of-voting-for-house-speaker/,0,www.bostonherald.com,Live updates | Jordan appears on brink of defeat in first round of voting for House speaker,The House of Representatives is voting on Jim Jordan’s nomination for speaker two weeks after the chamber ousted Kevin McCarthy from the top spot.,https://www.bostonherald.com/wp-content/uploads/2023/10/Congress_Speaker_38537-2.jpg?w=1024&h=682,2023-10-17T11:51:41Z,,"WASHINGTON (AP) — The House of Representatives is voting on Jim Jordan’s nomination for speaker two weeks after the chamber ousted Kevin McCarthy from the top spot.
Jordan has been scrambling to sho… [+10836 chars]",,en,'Kevin McCarthy'
https://www.stereogum.com/2239047/sun-june-bad-dream-jaguar/interviews/qa/,https://www.stereogum.com/2239047/sun-june-bad-dream-jaguar/interviews/qa/,0,www.stereogum.com,How Sun June Made Their Remarkable New Album Bad Dream Jaguar,"There aren’t many indie bands that can say they owe their existence to Ryan Gosling, but Austin’s Sun June is one that can. Lead vocalist Laura Colwell and lead guitarist Stephen Salisbury, the project’s two songwriters, both arrived in the city looking for w…",https://static.stereogum.com/uploads/2023/10/Sun-June-Bad-Dream-Jaguar-_-Press-Photo-by-by-Alex-Winker-1-scaled-1697216235.jpeg,2023-10-17T12:35:29Z,,"There aren’t many indie bands that can say they owe their existence to Ryan Gosling, but Austin’s Sun June is one that can. Lead vocalist Laura Colwell and lead guitarist Stephen Salisbury, the proje… [+12870 chars]",,en,'Ryan Gosling'
https://www.tmz.com/2023/10/17/britney-spears-shaved-head-rebel-act-out-conservatorship-new-book/,https://www.tmz.com/2023/10/17/britney-spears-shaved-head-rebel-act-out-conservatorship-new-book/,0,www.tmz.com,Britney Spears Shaved Head As Act of Rebellion Before Conservatorship,Britney Spears says she shaved her head back in the day -- pre-conservatorship -- as an act of rebellion ... a stunning new revelation she just made in her forthcoming memoir. The pop star's new book -- 'The Woman In Me' -- is coming out later this…,https://imagez.tmz.com/image/5e/16by9/2023/10/17/5e2617210778468eaa7759a4e768b4c0_xl.jpg,2023-10-17T13:54:35Z,,"Britney Spears says she shaved her head back in the day -- pre-conservatorship -- as an act of rebellion ... a stunning new revelation she just made in her forthcoming memoir.
The pop star's new boo… [+1720 chars]",,en,'Britney Spears'
https://biztoc.com/x/82cc04bed280a8d0,https://biztoc.com/x/82cc04bed280a8d0,0,biztoc.com,"Britney Spears Says Father Jamie Repeatedly Told Her She “Looked Fat,” “Infantilized” Her in Conservatorship","Britney Spears says her father belittled and degraded her while in her 13-year conservatorship, which ended in 2021 but had left her feeling “robot-like.” In a new cover story for People, Britney Spears briefly speaks to the magazine about her reason for doin…",https://c.biztoc.com/p/82cc04bed280a8d0/s.webp,2023-10-17T14:38:31Z,,"Britney Spears says her father belittled and degraded her while in her 13-year conservatorship, which ended in 2021 but had left her feeling robot-like.In a new cover story for People, Britney Spears… [+322 chars]",,en,'Britney Spears'
https://www.forbes.com/sites/saradorn/2023/10/17/jim-jordan-heads-into-speaker-election-without-the-votes-to-win-these-republicans-plan-to-block-his-victory/,https://www.forbes.com/sites/saradorn/2023/10/17/jim-jordan-heads-into-speaker-election-without-the-votes-to-win-these-republicans-plan-to-block-his-victory/,0,www.forbes.com,Jim Jordan Heads Into Speaker Election Without The Votes To Win—These Republicans Plan To Block His Victory,Some Republicans have said they plan to vote for Reps. Kevin McCarthy (Calif.) and Steve Scalise (La.).,https://imageio.forbes.com/specials-images/imageserve/652ea2bb4751f9ddbe817436/0x0.jpg?format=jpg&height=900&width=1600&fit=bounds,2023-10-17T15:07:22Z,,"At least seven Republicans said as recently as Monday they will not vote for Rep. Jim Jordan (R-Ohio) in Tuesdays speaker election, leaving him several votes short of the threshold to clinch the gave… [+3741 chars]",,en,'Steve Scalise'
https://www.tmz.com/2023/10/17/britney-spears-justin-timberlake-pregnant-abortion-memoir-book/,https://www.tmz.com/2023/10/17/britney-spears-justin-timberlake-pregnant-abortion-memoir-book/,0,www.tmz.com,"Britney Spears Says Justin Timberlake Got Her Pregnant, Had Abortion, Memoir Claims","Britney Spears has what insiders have described as a ""bombshell"" in her upcoming memoir, and multiple sources tell TMZ ... that bombshell is that Justin Timberlake got her pregnant and after some heart-wrenching discussions they agreed she would get an aborti…",https://imagez.tmz.com/image/68/16by9/2023/10/17/68a1a46104e643299f62e86ad3ab5416_xl.jpg,2023-10-17T15:19:37Z,,"Britney Spears has what insiders have described as a ""bombshell"" in her upcoming memoir, and multiple sources tell TMZ ... that bombshell is that Justin Timberlake got her pregnant and after some hea… [+1129 chars]",,en,'Britney Spears'
https://pagesix.com/2023/10/17/britney-spears-reveals-she-had-an-abortion-with-justin-timberlake/,https://pagesix.com/2023/10/17/britney-spears-reveals-she-had-an-abortion-with-justin-timberlake/,0,pagesix.com,Britney Spears reveals she had an abortion with ex Justin Timberlake: He ‘didn’t want to be a father’,The former Mouseketeers started dating in 1999 when they were teenagers and broke up in 2002 over allegations that Spears had cheated on Timberlake.,https://pagesix.com/wp-content/uploads/sites/3/2023/10/britney-spears-justin-timberlake-2.jpg?quality=75&strip=all&w=1024,2023-10-17T15:29:10Z,https://web.archive.org/web/20231017165422/https://pagesix.com/2023/10/17/britney-spears-reveals-she-had-an-abortion-with-justin-timberlake/,"Britney Spears reveals she had an abortion during her relationship with Justin Timberlake in her bombshell new memoir.
The Princess of Pop shares in “The Woman in Me,” which hits bookstores on Oct. … [+3042 chars]",,en,'Jessica Biel'
https://www.forbes.com/sites/alejandrochafuen/2023/10/17/pern-the-central-bank-and-the-argentine-elections/,https://www.forbes.com/sites/alejandrochafuen/2023/10/17/pern-the-central-bank-and-the-argentine-elections/,0,www.forbes.com,"Perón, The Central Bank, And The Argentine Elections","Economist Javier Milei is leading in the polls of the upcoming presidential elections in Argentina. If he wins, he promised to close the Central Bank.",https://imageio.forbes.com/specials-images/imageserve/652ea35c458fa129cd04980d/0x0.jpg?format=jpg&height=900&width=1600&fit=bounds,2023-10-17T15:29:53Z,,"Argentina was once one of the wealthiest countries in the world. Though it has been on a downward spiral for eight decades, it still represents approximately 15% of South American GDP. However, a new… [+10982 chars]",,en,'Javier Milei'
https://brobible.com/culture/article/britney-spears-justin-timberlake-abortion/,https://brobible.com/culture/article/britney-spears-justin-timberlake-abortion/,0,brobible.com,Britney Spears Claims She Aborted Justin Timberlake’s Baby,"In her new memoir The Woman in Me, singer Britney Spears claims that her ex-boyfriend, fellow pop star Justin Timberlake, got her pregnant and that she had an abortion. According to Spears, she found out she was pregnant with Timberlake’s baby in late 2000, w…",https://brobible.com/wp-content/uploads/2023/10/britney-spears-and-justin-timberlake-in-the-early-2000s.jpg,2023-10-17T15:39:35Z,https://web.archive.org/web/20231017154631/https://brobible.com/culture/article/britney-spears-justin-timberlake-abortion/,"Getty Image
In her new memoir The Woman in Me, singer Britney Spears claims that her ex-boyfriend, fellow pop star Justin Timberlake, got her pregnant and that she had an abortion.
According to Spe… [+1763 chars]",,en,'Justin Timberlake'
https://www.avclub.com/britney-spears-crossroads-the-woman-in-me-1850933890,https://www.avclub.com/britney-spears-crossroads-the-woman-in-me-1850933890,0,www.avclub.com,Britney Spears accidentally got a bit too into Method acting in Crossroads,"At long last, Britney Spears has finally waded into the Method acting discourse. Okay, okay. We know. You probably never want to hear that phrase again, post Jeremy Strong and his “monastic chic” (not to mention, you know, all the other stuff). Still, it seem…","https://i.kinja-img.com/image/upload/c_fill,f_auto,fl_progressive,g_center,h_675,pg_1,q_80,w_1200/cb8589ab9a173b0dd7da5ba1b48a4620.jpg",2023-10-17T16:04:00Z,,"At long last, Britney Spears has finally waded into the Method acting discourse. Okay, okay. We know. You probably never want to hear that phrase again, post Jeremy Strong and his monastic chic (not … [+1872 chars]",,en,'Britney Spears'
https://www.rollingstone.com/music/music-news/britney-spears-reveals-abortion-while-dating-justin-timberlake-1234855860/,https://www.rollingstone.com/music/music-news/britney-spears-reveals-abortion-while-dating-justin-timberlake-1234855860/,0,www.rollingstone.com,Britney Spears Reveals She Had an Abortion While Dating Justin Timberlake,"In her new memoir, the pop star claims Timberlake ""wasn't happy about the pregnancy""",https://www.rollingstone.com/wp-content/uploads/2023/10/Britney-Spears-Justin-Timberlake.jpg?crop=0px%2C7px%2C1800px%2C1014px&resize=1600%2C900,2023-10-17T16:19:09Z,,"Britney Spears‘ highly-anticipated memoir The Woman in Me comes out next week, but some bombshells from the book have dropped early. One securely-kept secret that Spears reveals is that at 19, she be… [+1694 chars]",,en,'Britney Spears'
