index,url,valid,domain,title,description,image,published,archive,content,quote,language,keyword
http://wwd.com/pop-culture/celebrity-news/sheikha-jawaher-wife-qatar-emir-kate-middleton-1236744858/,http://wwd.com/pop-culture/celebrity-news/sheikha-jawaher-wife-qatar-emir-kate-middleton-1236744858/,0,wwd.com,"Meet Sheikha Jawaher, Wife of Qatar’s Emir Sheikh Tamim bin Hamad Al Thani and a Dior Enthusiast","Kate Middleton, Princess of Wales welcomed Qatari Emir Sheikh Tamim bin Hamad Al Thani and his wife, Sheikha Jawaher to London on Tuesday.",https://wwd.com/wp-content/uploads/2024/12/Sheikha-Jawaher-04-e1733241934320.jpg?w=1000&h=563&crop=1,2024-12-03T16:45:35Z,,"Qatar’s Emir, Sheikh Tamim bin Hamad Al Thani, and his wife, Sheikha Jawaher bint Hamad Al Thani, arrived in London on Tuesday, where they were welcomed by members of the British royal family.
The K… [+1362 chars]",,en,'Kate Middleton'
https://hiphopwired.com/2504654/democrats-republicans-alike-critical-of-president-joe-bidens-pardon-of-hunter-biden/,https://hiphopwired.com/2504654/democrats-republicans-alike-critical-of-president-joe-bidens-pardon-of-hunter-biden/,0,hiphopwired.com,Democrats & Republicans Alike Critical Of President Joe Biden’s Pardon Of Hunter Biden,Politicians on both sides of the aisle are bashing President Joe Biden's decision to pardon Hunter Biden ahead of his sentencing,https://hiphopwired.com/wp-content/uploads/sites/43/2024/12/17332445354982.jpg,2024-12-03T16:52:57Z,https://web.archive.org/web/20241204033845/https://hiphopwired.com/2504654/democrats-republicans-alike-critical-of-president-joe-bidens-pardon-of-hunter-biden/,"HipHopWired Featured Video
President Joe Biden is nearing the end of his term, and as that time nears, he has just weeks to make any sweeping orders before he leaves office at the top of next year. … [+2570 chars]",,en,'Joe Biden'
https://dianeravitch.net/2024/12/03/heather-cox-richardson-why-biden-pardoned-hunter/,https://dianeravitch.net/2024/12/03/heather-cox-richardson-why-biden-pardoned-hunter/,0,dianeravitch.net,Heather Cox Richardson: Why Biden Pardoned Hunter,"Heather Cox Richardson writes here about President Biden’s pardon of his son Hunter, which was condemned widely in the media, even in liberal publications like The Atlantic and The New Yorker. in her post, she wrote first about Jane Mayer’s expose of Pete Heg…",https://dianeravitch.net/wp-content/uploads/2017/12/diane.jpg?w=200,2024-12-03T17:00:00Z,https://web.archive.org/web/20241205021030/https://dianeravitch.net/2024/12/03/heather-cox-richardson-why-biden-pardoned-hunter/,"Heather Cox Richardson writes here about President Biden’s pardon of his son Hunter, which was condemned widely in the media, even in liberal publications like The Atlantic and The New Yorker. in her… [+5368 chars]",,en,'James Comer'
https://www.vanityfair.com/hollywood/story/sing-sing-takes-the-gotham-awards-by-storm,https://www.vanityfair.com/hollywood/story/sing-sing-takes-the-gotham-awards-by-storm,0,www.vanityfair.com,'Sing Sing' Takes the Gotham Awards By Storm,"Zendaya, Angelina Jolie, Timothée Chalamet, and countless others also attended the 34th annual Gothams, the first major show of awards season.","https://media.vanityfair.com/photos/674f18d57c642f85643cce9e/16:9/w_1280,c_limit/vf1224-Gotham-Awards-001.jpg",2024-12-03T17:20:13Z,,"No matter where you start, you should always be able to dream of where you can go and be,"" said an emotional Sean Dino Johnson, the formerly incarcerated actor turned recipient of a social justice tr… [+2428 chars]",,en,'Angelina Jolie'
https://nypost.com/2024/12/03/entertainment/queen-camilla-reveals-pneumonia-forced-her-to-cancel-royal-events/,https://nypost.com/2024/12/03/entertainment/queen-camilla-reveals-pneumonia-forced-her-to-cancel-royal-events/,0,nypost.com,Queen Camilla reveals scary health battle that forced her to cancel string of royal engagements,"On the eve of the Qatari state visit, the palace noted King Charles III's wife wouldn't be at the traditional kickoff.",https://nypost.com/wp-content/uploads/sites/2/2024/12/stand-qatars-emir-sheikh-tamim-94679877.jpg?quality=75&strip=all&w=1024,2024-12-03T17:36:35Z,https://web.archive.org/web/20241204031925/https://nypost.com/2024/12/03/entertainment/queen-camilla-reveals-pneumonia-forced-her-to-cancel-royal-events/,"Queen Camilla is speaking out about her health. 
The Queen, 77,  reduced her duties for the Qatar state visit while recovering from a chest infection last month, and has now explained what occurred.… [+4038 chars]",,en,'Camilla'
https://pagesix.com/2024/12/03/style/kate-middleton-returns-to-royal-duties-in-monochromatic-burgundy-and-queen-elizabeths-pearls/,https://pagesix.com/2024/12/03/style/kate-middleton-returns-to-royal-duties-in-monochromatic-burgundy-and-queen-elizabeths-pearls/,0,pagesix.com,Kate Middleton returns to royal duties in monochromatic burgundy and Queen Elizabeth’s pearls,The Princess of Wales made a bold statement in the color to honor the flag of Qatar while hosting Sheikh Tamim bin Hamad Al Thani on his royal visit.,https://pagesix.com/wp-content/uploads/sites/3/2024/12/kate-middleton.jpg?quality=75&strip=all&w=1024,2024-12-03T18:19:21Z,https://web.archive.org/web/20241203182418/https://pagesix.com/2024/12/03/style/kate-middleton-returns-to-royal-duties-in-monochromatic-burgundy-and-queen-elizabeths-pearls/,"On Monday, Kate Middleton arrived at the Ceremonial Welcome at Horse Guards Parade for the State of Qatar visit to the UK. Getty Images
Kate Middleton is back in burgundy.
On Tuesday, the Princess … [+3070 chars]",,en,'Tamim bin Hamad Al Thani'
https://www.rd.com/article/what-queen-elizabeth-thought-of-meghan-markle/,https://www.rd.com/article/what-queen-elizabeth-thought-of-meghan-markle/,0,www.rd.com,Here’s How Queen Elizabeth Really Felt About Meghan Markle,"You know you’re curious! And new information from a royal expert reveals the answer to this question and more.
The post Here’s How Queen Elizabeth Really Felt About Meghan Markle appeared first on Reader's Digest.",https://www.rd.com/wp-content/uploads/2024/12/GettyImages-974765218-scaled.jpg,2024-12-03T19:02:09Z,,"It’s been quite the rocky road for Meghan Markle ever since she and Prince Harry fell in love. There have been rumors, rifts, outright feuds and so much moreand it has all played out in the public ey… [+5972 chars]",,en,'Meghan Markle'
https://www.foxnews.com/entertainment/queen-camillas-extended-illness-explained-royal-cancels-major-appearance,https://www.foxnews.com/entertainment/queen-camillas-extended-illness-explained-royal-cancels-major-appearance,0,www.foxnews.com,Queen Camilla's extended illness explained as royal cancels major appearance,"On Tuesday, Queen Camilla, who reduced her duties for the Qatar state visit this week as she recovers from an ongoing illness, revealed she developed a form of pneumonia.",https://static.foxnews.com/foxnews.com/content/uploads/2024/12/queen-camilla-1.jpg,2024-12-03T20:02:14Z,http://archive.md/20241203203122/https://www.foxnews.com/entertainment/queen-camillas-extended-illness-explained-royal-cancels-major-appearance,"Queen Camilla
's ongoing chest infection continues to affect her royal duties. 
On Tuesday, Her Majesty, who reduced her duties for the Qatar state visit this week as she recovers, told guests at t… [+2372 chars]",,en,'Kate Middleton'
https://japantoday.com/category/world/south-korean-president-declares-emergency-martial-law-accusing-opposition-of-anti-state-activities1,https://japantoday.com/category/world/south-korean-president-declares-emergency-martial-law-accusing-opposition-of-anti-state-activities1,0,japantoday.com,South Korean parliament votes to defy president by lifting his declaration of martial law,"South Korean President Yoon Suk Yeol declared martial law late Tuesday, vowing to eliminate “anti-state” forces as he struggles against an opposition that controls the country’s parliament and that he accuses of sympathizing with communist North Korea. Hours …",,2024-12-03T20:48:48Z,https://web.archive.org/web/20241203235959/https://japantoday.com/category/world/south-korean-president-declares-emergency-martial-law-accusing-opposition-of-anti-state-activities1,"South Korean President Yoon Suk Yeol declared martial law late Tuesday, vowing to eliminate anti-state forces as he struggles against an opposition that controls the countrys parliament and that he a… [+4832 chars]",,en,'Moon Hyung-jin'
http://www.thehollywoodgossip.com/2024/12/queen-camilla-reveals-her-own-health-crises-basis-for-extended-absence/,http://www.thehollywoodgossip.com/2024/12/queen-camilla-reveals-her-own-health-crises-basis-for-extended-absence/,0,www.thehollywoodgossip.com,"Queen Camilla Reveals Her Own Health Crises, Basis for Extended Absence","Stop us if you’ve heard this one before: A member of The Royal Family is being forced from the spotlight …
Queen Camilla Reveals Her Own Health Crises, Basis for Extended Absence was originally published on The Hollywood Gossip.",https://cdn.thehollywoodgossip.com/uploads/2024/12/GettyImages-2187524494-scaled.jpg,2024-12-03T21:16:28Z,,"Stop us if you’ve heard this one before:
A member of The Royal Family is being forced from the spotlight due to an illness.
To close a year during which both Kate Middletonand King Charles revealed… [+2690 chars]",,en,'Camilla'
https://www.buzzfeed.com/associatedpress/south-korea-martial-law-imposed-voted-to-be-lifted,https://www.buzzfeed.com/associatedpress/south-korea-martial-law-imposed-voted-to-be-lifted,0,www.buzzfeed.com,"If You're Seeing A Ton Of Headlines About South Korea But Don't Know What's Happening, Here's What We Know","South Korean President Yoon Suk Yeol said that he would soon lift the military rule he imposed overnight, after the parliament voted to reject his martial...",https://s.yimg.com/ny/api/res/1.2/IKCKxl0QAaP_tD3icmeiAA--/YXBwaWQ9aGlnaGxhbmRlcjt3PTEyMDA7aD03OTc-/https://media.zenfs.com/en/buzzfeed_articles_778/653397d8cc9d67a353204b08183d5aa4,2024-12-03T21:33:22Z,https://web.archive.org/web/20241204024113/https://www.buzzfeed.com/associatedpress/south-korea-martial-law-imposed-voted-to-be-lifted,"Yahoo is using AI to generate takeaways from this article. This means the info may not always match what's in the article. Reporting mistakes helps us improve the experience.Generate Key Takeaways
S… [+8086 chars]",,en,'Moon Hyung-jin'
https://freebeacon.com/democrats/former-house-lawyers-agree-hunter-biden-cant-plead-the-fifth-after-pardon/,https://freebeacon.com/democrats/former-house-lawyers-agree-hunter-biden-cant-plead-the-fifth-after-pardon/,0,freebeacon.com,Former House Lawyers Agree: Hunter Biden Can’t Plead the Fifth After Pardon,"Hunter Biden will no longer be able to invoke his Fifth Amendment right to silence if he is called to testify before Congress after accepting a presidential pardon from his father, two former House general counsels told the Washington Free Beacon.
The post Fo…",https://freebeacon.com/wp-content/uploads/2023/12/hunter-biden-addresses-being-called-to-testify-to-house-oversight-comm-e1703257646608.jpg,2024-12-03T21:45:58Z,http://archive.md/20241205212601/https://freebeacon.com/democrats/former-house-lawyers-agree-hunter-biden-cant-plead-the-fifth-after-pardon/,"Hunter Biden will no longer be able to invoke his Fifth Amendment right to silence if he is called to testify before Congress after accepting a presidential pardon from his father, two former House g… [+2968 chars]",,en,'James Comer'
https://www.foxsports.com/stories/nfl/tom-brady-azeez-al-shaair-trevor-lawrence-hit-both-offense-defense-should-penalized,https://www.foxsports.com/stories/nfl/tom-brady-azeez-al-shaair-trevor-lawrence-hit-both-offense-defense-should-penalized,0,www.foxsports.com,"Tom Brady on Trevor Lawrence hit: Both offense, defense should be penalized on QB slides","Tom Brady provided his take on Azeez Al-Shaair's hit on Trevor Lawrence on Tuesday's edition of ""The Herd.""",https://a57.foxsports.com/statics.foxsports.com/www.foxsports.com/content/uploads/2024/12/1408/814/trevor2.jpg?ve=1&tl=1,2024-12-03T22:06:13Z,https://web.archive.org/web/20241203230414/https://foxsports.com/stories/nfl/tom-brady-azeez-al-shaair-trevor-lawrence-hit-both-offense-defense-should-penalized,"The Houston Texans and Jacksonville Jaguars made headlines in their Week 13 matchup, when Houston linebacker Azeez Al-Shaair knocked Jacksonville quarterback Trevor Lawrence out of the game in the se… [+3641 chars]",,en,'Tom Brady'
https://www.vanityfair.com/style/story/kate-middleton-curtsy-qatar-state-visit,https://www.vanityfair.com/style/story/kate-middleton-curtsy-qatar-state-visit,0,www.vanityfair.com,Kate Middleton Proves Her Curtsy Reigns Supreme During Qatari State Visit,The Princess of Wales flexed her protocol skills during a state visit from Qatar's emir,"https://media.vanityfair.com/photos/674f715a7e9625c69e4e8a6f/16:9/w_1280,c_limit/2187492448",2024-12-03T22:45:34Z,,"Kate Middletons public appearances have been few and far between in 2024, owing to her cancer diagnosis and subsequent treatment, but her time out of the spotlight hasnt made her very particular set … [+1939 chars]",,en,'Kate Middleton'
https://www.forbes.com/sites/robertanaas/2024/12/03/tom-brady-artifacts-from-sothebys-the-goat-collection-auction-on-exhibit/,https://www.forbes.com/sites/robertanaas/2024/12/03/tom-brady-artifacts-from-sothebys-the-goat-collection-auction-on-exhibit/,0,www.forbes.com,Inside Tom Brady’s Rare Watch Collection And NFL Memorabilia Up For Auction At Sotheby’s,"For lovers of the seven-time Super Bowl champion Tom Brady, and for watch lovers, it is a not-to-be-missed exhibit or auction event.",https://imageio.forbes.com/specials-images/imageserve/674f8dacdd29425abbcdad53/0x0.jpg?format=jpg&height=900&width=1600&fit=bounds,2024-12-03T23:09:54Z,https://web.archive.org/web/20241204045604/https://www.forbes.com/sites/robertanaas/2024/12/03/tom-brady-artifacts-from-sothebys-the-goat-collection-auction-on-exhibit/,"Sotheby's The GOAT Collection: Watches &amp; Treasures from Tom Brady auction pieces are on exhibit in ... [+] New York starting December 5, 2024.
Sotheby's
Beginning on Thursday, December 5, 2024,… [+2798 chars]",,en,'Tom Brady'
https://www.newsbreak.com/share/3700294282125-trump-cites-hunter-biden-pardon-in-latest-legal-attempt-to-throw-out-hush-money-conviction?_f=app_share&amp;pd=09I8QUsw&amp;lang=en_US&amp;send_time=1733270139&amp;trans_data=%7B%22platform%22:0%2C%22cv%22:%2224.39.1.3%22%2C%22languages%22:%22en%22%7D&amp;sep=ns_foryou_rank_exp_24q4-v1%2Cns_foryou_recall_exp_24q4-v3%2Cns_push_exp_rt_bucketv12-v3%2Cns_foryou_blend_exp_24q4-v7%2Cns_foryou_model_exp_24q4-v1%2Cns_local_strategy_24q4_exp-v8&amp;s=i2,https://www.newsbreak.com/share/3700294282125-trump-cites-hunter-biden-pardon-in-latest-legal-attempt-to-throw-out-hush-money-conviction?_f=app_share&amp;pd=09I8QUsw&amp;lang=en_US&amp;send_time=1733270139&amp;trans_data=%7B%22platform%22:0%2C%22cv%22:%2224.39.1.3%22%2C%22languages%22:%22en%22%7D&amp;sep=ns_foryou_rank_exp_24q4-v1%2Cns_foryou_recall_exp_24q4-v3%2Cns_push_exp_rt_bucketv12-v3%2Cns_foryou_blend_exp_24q4-v7%2Cns_foryou_model_exp_24q4-v1%2Cns_local_strategy_24q4_exp-v8&amp;s=i2,0,www.newsbreak.com,Trump cites Hunter Biden pardon in latest legal attempt to throw out hush money conviction,Defense lawyers for President-elect Donald Trump are using President Joe Biden’s pardon of his son Hunter to argue that Trump’s conviction in his Manhattan hush money case should be dismissed.,https://img.particlenews.com/img/id/3NGghg_0xBVA1v000?type=thumbnail_1600x1200,2024-12-03T23:58:09Z,,"Kate Middleton 'Heartbroken' Husband Prince William Wants to Send Son Prince George to 'Stuffy' All-Boys Boarding School: Source
 Are Kate Middleton and Prince William butting heads? According to ro… [+482 chars]",,en,'Kate Middleton'
https://www.eonline.com/news/1410699/sabrina-carpenter-and-barry-keoghan-break-up-after-one-year,https://www.eonline.com/news/1410699/sabrina-carpenter-and-barry-keoghan-break-up-after-one-year,0,www.eonline.com,Sabrina Carpenter and Barry Keoghan Break Up After One Year of Dating,"It turns out Sabrina Carpenter and Barry Keoghan might have really bad chem. 
The ""Taste"" singer and Saltburn star have called it quits after one year of dating, according to multiple outlets. 
E!...","https://akns-images.eonline.com/eol_images/Entire_Site/2024109/rs_1200x1200-241109120631-1200-barry-keoghan-sabrina-carpenter-met-gala-cjh-050624.jpg?fit=around%7C1080:1080&output-quality=90&crop=1080:1080;center,top",2024-12-04T00:00:31Z,,"It turns out Sabrina Carpenter and Barry Keoghan might have really bad chem. 
The ""Taste"" singer and Saltburn star have called it quits after one year of dating, according to multipleoutlets. 
E! N… [+849 chars]",,en,'Sabrina Carpenter'
https://slashdot.org/firehose.pl?op=view&amp;id=175589145,https://slashdot.org/firehose.pl?op=view&amp;id=175589145,0,slashdot.org,Kate Middleton returns to royal duties in monochromatic burgundy and Queen Elizabeth's pearls - Page Six,Kate Middleton returns to royal duties in monochromatic burgundy and Queen Elizabeth's pearlsPage Six Kate Middleton Joins Prince William amid Her Cancer Recovery to Help Welcome Amir of QatarPEOPLE Princess of Wales joins royals for Qatar state visit as Quee…,,2024-12-04T00:33:27Z,,The Fine Print: The following comments are owned by whoever posted them. We are not responsible for them in any way.,,en,'Prince William'
https://gothamist.com/news/mayor-adams-says-undocumented-new-yorkers-arent-owed-due-process-defying-constitution,https://gothamist.com/news/mayor-adams-says-undocumented-new-yorkers-arent-owed-due-process-defying-constitution,0,gothamist.com,"Mayor Adams says undocumented New Yorkers aren’t owed due process, defying Constitution","New York City Mayor Eric Adams speaks at City Hall on November 12, 2024.
 

“The Constitution is for Americans,” Adams said, contradicting amendments that grant due process to all persons regardless of immigration status. [ more › ]",https://api-prod.gothamist.com/images/348477/fill-1200x650|format-webp|webpquality-85/,2024-12-04T01:39:00Z,,"Mayor Eric Adams on Tuesday incorrectly asserted that undocumented immigrants are not entitled the right to due process under the U.S. Constitution, aligning himself with a notion previously expresse… [+4689 chars]",,en,'Eric Adams'
https://dailycaller.com/2024/12/03/hunter-biden-pardon-is-just-another-example-of-biden-admins-failure-to-bring-promised-transparency-to-government/,https://dailycaller.com/2024/12/03/hunter-biden-pardon-is-just-another-example-of-biden-admins-failure-to-bring-promised-transparency-to-government/,0,dailycaller.com,Hunter Biden Pardon Is Just Another Example Of Biden Admin’s Failure To Bring Promised Transparency To Government,President Joe Biden's decision to pardon his son after repeatedly stating he would not is only the latest in a series of letdowns.,https://cdn01.dailycaller.com/wp-content/uploads/2024/12/GettyImages-2187280340-1-e1733251090977.jpg,2024-12-04T01:55:46Z,https://web.archive.org/web/20241204042222/https://dailycaller.com/2024/12/03/hunter-biden-pardon-is-just-another-example-of-biden-admins-failure-to-bring-promised-transparency-to-government/,"President Joe Biden’s decision to pardon his son after repeatedly stating he would not is one of many broken promises from his administration.
On day one, Biden’s former press secretary Jen Psaki pr… [+7281 chars]",,en,'Hunter Biden'
https://www.naturalnews.com/2024-12-04-trump-hints-pardon-for-j6-political-prisoners.html,https://www.naturalnews.com/2024-12-04-trump-hints-pardon-for-j6-political-prisoners.html,0,www.naturalnews.com,Trump hints at pardon for J6 political prisoners after Joe Biden pardons his son,"President-elect Donald Trump has insinuated that he will pardon jailed participants of the Jan. 6, 2021 false flag riot in the U.S. Capitol when he assumes his second term next month. Trump’s remark came after outgoing President Joe Biden issued a “full and u…",https://www.naturalnews.com/wp-content/uploads/sites/91/2024/12/Capitol-March-2.jpg,2024-12-04T06:00:00Z,https://web.archive.org/web/20241205095848/https://naturalnews.com/2024-12-04-trump-hints-pardon-for-j6-political-prisoners.html,"President-elect Donald Trump has insinuated that he will pardon jailed participants of the Jan. 6, 2021 false flag riot in the U.S. Capitol when he assumes his second term next month.
Trump's remark… [+4456 chars]",,en,'Joe Biden'
https://economictimes.indiatimes.com/magazines/panache/kate-middleton-resumes-her-duties-princess-of-wales-welcomes-emir-of-qatar-amid-rumours-of-divorce-from-prince-william/articleshow/115965956.cms,https://economictimes.indiatimes.com/magazines/panache/kate-middleton-resumes-her-duties-princess-of-wales-welcomes-emir-of-qatar-amid-rumours-of-divorce-from-prince-william/articleshow/115965956.cms,0,economictimes.indiatimes.com,Kate Middleton resumes her duties? Princess of Wales welcomes Emir of Qatar amid rumours of divorce from Prince William,"Kate Middleton, the Princess of Wales, continues to exemplify her unwavering dedication to royal duties, undeterred by challenges such as health battles or persistent rumors of a rift with her husband, Prince William. In a notable recent event, she joined Pri…","https://img.etimg.com/thumb/msid-115966036,width-1200,height-630,imgsize-36084,overlay-etpanache/articleshow.jpg",2024-12-04T08:07:11Z,https://web.archive.org/web/20241205021809/https://economictimes.indiatimes.com/magazines/panache/kate-middleton-resumes-her-duties-princess-of-wales-welcomes-emir-of-qatar-amid-rumours-of-divorce-from-prince-william/articleshow/115965956.cms,"Nothing, not even battling with cancer or rumours of a rift with her husband, can prevent the Princess of Wales from fulfilling her responsibilities. Kate Middleton recently made a rare public appear… [+2008 chars]",,en,'Prince William'
https://www.foxnews.com/entertainment/king-charles-excluded-prince-harry-christmas-son-demands-expert,https://www.foxnews.com/entertainment/king-charles-excluded-prince-harry-christmas-son-demands-expert,0,www.foxnews.com,"King Charles excluded Prince Harry from Christmas, feels son makes 'too many demands': expert","Prince Harry and Meghan Markle, the Duke and Duchess of Sussex, reportedly haven’t received an invitation to this year’s gathering at Sandringham, the royal family’s country estate.",https://static.foxnews.com/foxnews.com/content/uploads/2023/08/Getty_KingCharles_MeghanMarkle.jpg,2024-12-04T09:00:49Z,https://web.archive.org/web/20241204090923/https://www.foxnews.com/entertainment/king-charles-excluded-prince-harry-christmas-son-demands-expert,"Join Fox News for access to this content
Plus special access to select articles and other premium content with your account - free of charge.
By entering your email and pushing continue, you are ag… [+7325 chars]",,en,'Prince Harry'
https://hypebeast.com/2024/12/sothebys-the-goat-collection-watches-treasures-from-tom-brady,https://hypebeast.com/2024/12/sothebys-the-goat-collection-watches-treasures-from-tom-brady,0,hypebeast.com,"Sotheby's Readies ""The GOAT Collection: Watches & Treasures From Tom Brady""","Sotheby's is officially launching its upcoming ""The GOAT Collection: Watches & Treasures From Tom Brady"" auction. The news comes after the auction house revealed that the ex-NFL quarterback is selling off $6 million USD worth of rare watches. The exhibition o…",https://image-cdn.hypb.st/https%3A%2F%2Fhypebeast.com%2Fimage%2F2024%2F12%2F03%2Fsothebys-the-goat-collection-watches-treasures-from-tom-brady-tw.jpg?w=1080&cbr=1&q=90&fit=max,2024-12-04T09:13:15Z,,Sotheby’s is officially launching its upcoming “The GOAT Collection: Watches &amp; Treasures From Tom Brady” auction. The news comes after the auction house revealed that the ex-NFL quarterback is se… [+1581 chars],,en,'Tom Brady'
https://seths.blog/2024/12/elites-vs-elitism/,https://seths.blog/2024/12/elites-vs-elitism/,0,seths.blog,Elites (vs. elitism),"Tom Brady is an elite athlete. Few have even approached the stats he had playing football. And Catherine Walker, NSTA Science Teacher of the Year, is an elite, because her pedagogy and understanding give her the ability to create better outcomes for her stude…",https://seths.blog/wp-content/uploads/2018/06/seth_godin_ogimages_v02_18061318.jpg,2024-12-04T10:03:00Z,,"Tom Brady is an elite athlete. Few have even approached the stats he had playing football. And Catherine Walker, NSTA Science Teacher of the Year, is an elite, because her pedagogy and understanding … [+1431 chars]",,en,'Tom Brady'
