index,url,valid,domain,title,description,image,published,archive,content,quote,language,keyword
https://www.sbnation.com/2024/8/5/24213598/hailey-van-lith-rhyne-howards-usa-basketball-womens-3x3-team-olympic-gold-medal-paris,https://www.sbnation.com/2024/8/5/24213598/hailey-van-lith-rhyne-howards-usa-basketball-womens-3x3-team-olympic-gold-medal-paris,0,www.sbnation.com,"Dearica Hamby, USA Basketball women’s 3x3 team eye an Olympic gold medal today: ‘We wouldn’t change a single thing that happened’","Hailey Van Lith, Dearica Hamby, Cierra Burdick, and Rhyne Howard have a chance to being first-time Olympic medalists as 3x3 play wraps up in Paris.",https://cdn.vox-cdn.com/thumbor/-lItJNFmoYKdEwVdk_GFUmE8tkI=/0x208:5336x3002/fit-in/1200x630/cdn.vox-cdn.com/uploads/chorus_asset/file/25560044/2165021472.jpg,2024-08-05T13:47:11Z,,"Photo by Lintao Zhang/Getty Images

 

 Hailey Van Lith, Dearica Hamby, Cierra Burdick, and Rhyne Howard have a chance to being first-time Olympic medalists as 3x3 play wraps up in Paris. The U.S. w… [+3435 chars]",,en,'Hailey Van Lith'
https://uproxx.com/music/best-new-music-this-week-billie-eilish-ice-spice/,https://uproxx.com/music/best-new-music-this-week-billie-eilish-ice-spice/,0,uproxx.com,All The Best New Music From This Week That You Need To Hear,"Getty Image/David James Swanson/Derrick Rossignol

Billie Eilish, Charli XCX, Ice Spice, Jack White, Big Sean, and Khalid all made some of the best new music of the week.",https://uproxx.com/wp-content/uploads/2024/08/bnm-710.jpg?w=710,2024-08-05T14:57:51Z,,"Keeping up with new music can be exhausting, even impossible. From the weekly album releases to standalone singles dropping on a daily basis, the amount of music is so vast it’s easy for something to… [+3665 chars]",,en,'Billie Eilish'
https://nypost.com/2024/08/05/entertainment/taylor-swift-eras-tour-in-austria-where-to-buy-tickets-best-prices/,https://nypost.com/2024/08/05/entertainment/taylor-swift-eras-tour-in-austria-where-to-buy-tickets-best-prices/,0,nypost.com,How much do tickets cost to see Taylor Swift’s ‘Eras Tour’ in Austria?,The 2023 Time Person of the Year has 3 concerts at Vienna's Ernst Happel Stadium.,https://nypost.com/wp-content/uploads/sites/2/2024/08/Taylor-Swift.jpg?quality=75&strip=all&w=1024,2024-08-05T15:33:22Z,,"Vivid Seats is the New York Post's official ticketing partner. We may receive revenue from this partnership for sharing this content and/or when you make a purchase.
There’s a huge three-day music f… [+6103 chars]",,en,'Billie Eilish'
https://www.forbes.com/sites/hughmcintyre/2024/08/05/taylor-swift-is-in-charge-of-the-albums-chartagain/,https://www.forbes.com/sites/hughmcintyre/2024/08/05/taylor-swift-is-in-charge-of-the-albums-chartagain/,0,www.forbes.com,Taylor Swift Is In Charge Of The Albums Chart Once Again,Taylor Swift's The Tortured Poets Department returns to No. 1 on the Billboard 200 for its thirteenth stay—after two weeks away from the throne.,https://imageio.forbes.com/specials-images/imageserve/663000d500c47fdd2560733b/0x0.jpg?format=jpg&height=900&width=1600&fit=bounds,2024-08-05T16:00:22Z,,"SINGAPORE, SINGAPORE - MARCH 02: EDITORIAL USE ONLY. NO BOOK COVERS Taylor Swift performs during ... [+] ""Taylor Swift | The Eras Tour"" at the National Stadium on March 02, 2024 in Singapore. Taylor … [+2468 chars]",,en,'Taylor Swift'
https://nypost.com/2024/08/05/entertainment/taylor-swift-london-opening-acts-where-to-buy-tickets-special-guests/,https://nypost.com/2024/08/05/entertainment/taylor-swift-london-opening-acts-where-to-buy-tickets-special-guests/,0,nypost.com,"Taylor Swift announces London opening acts: Holly Humberstone, Raye, more","Maisie Peters, Suki Waterhouse and Sofia Isella will also serve as special guests.",https://nypost.com/wp-content/uploads/sites/2/2024/08/Taylor-Swift-seated.jpg?quality=75&strip=all&w=1024,2024-08-05T16:46:35Z,,"Vivid Seats is the New York Post's official ticketing partner. We may receive revenue from this partnership for sharing this content and/or when you make a purchase.
Taylor Swift has something speci… [+6726 chars]",,en,'Taylor Swift'
https://nypost.com/2024/08/06/sports/hailey-van-lith-got-emotional-after-bronze-medal-win-at-olympics/,https://nypost.com/2024/08/06/sports/hailey-van-lith-got-emotional-after-bronze-medal-win-at-olympics/,0,nypost.com,Hailey Van Lith got ‘super emotional’ after winning Olympic bronze in 3×3 basketball,"After dropping three straight games to open play in Paris, the Americans rallied for bronze, defeating Canada 16-13 after losing in their semifinal to Spain.",https://nypost.com/wp-content/uploads/sites/2/2024/08/newspress-collage-85bl59nfs-1722959833667.jpg?quality=75&strip=all&1722945613&w=1024,2024-08-06T16:13:35Z,,"Team USA failed to repeat as gold medalists in 3×3 women’s basketball, but Hailey Van Lith felt happy with bronze nonetheless.
After dropping three straight games to open play in Paris, the American… [+1865 chars]",,en,'Cameron Brink'
https://www.bbc.com/news/articles/cdxlld174qvo,https://www.bbc.com/news/articles/cdxlld174qvo,0,www.bbc.com,Accordion shop used by rock and pop bands to close,An Allodi accordion was also seen at the White House for Michelle Obama's birthday celebrations.,https://ichef.bbci.co.uk/news/1024/branded_news/21c0/live/a8774660-53e5-11ef-a4ba-4dea28b2b6f8.jpg,2024-08-07T05:08:05Z,,"Emilio, Kim and Claudio Allodi at the shop in Lewisham, which will close later this year
A shop in south-east London that has been selling and repairing accordions for almost half a century will clo… [+3552 chars]",,en,'Sheryl Crow'
https://ambcrypto.com/elon-musk-vs-sam-altman-whats-next-for-worldcoin-amid-the-new-lawsuit/,https://ambcrypto.com/elon-musk-vs-sam-altman-whats-next-for-worldcoin-amid-the-new-lawsuit/,0,ambcrypto.com,Elon Musk vs Sam Altman: What’s next for Worldcoin after new lawsuit,Proxy battle between Elon Musk and Sam Altman threatens Worldcoin adoption but the charts speak differently.,https://ambcrypto.com/wp-content/uploads/2024/08/News-Articles-FI-Editors-88-1000x600.jpg,2024-08-07T10:00:26Z,,"<ul><li>Elon Musk sues Sam Altman over alleged manipulation and deceit.</li><li>Worldcoin token to play a key role in the next bull market cycle.</li></ul>Elon Musk is suing Sam Altman again, accusin… [+2092 chars]",,en,'Elon Musk'
https://finance.yahoo.com/news/why-this-tesla-investor-and-elon-musk-supporter-is-buying-the-stock-dip-125504302.html,https://finance.yahoo.com/news/why-this-tesla-investor-and-elon-musk-supporter-is-buying-the-stock-dip-125504302.html,0,finance.yahoo.com,Why this Tesla investor and Elon Musk supporter is buying the stock dip,Tesla shares have bee hammered along with the rest of the tech space.,https://s.yimg.com/ny/api/res/1.2/GU.mGntNi4ZUW2hdv0vwAg--/YXBwaWQ9aGlnaGxhbmRlcjt3PTEyMDA7aD04MDA-/https://s.yimg.com/os/creatr-uploaded-images/2024-06/0e999c20-3011-11ef-bded-359e0fb4dc25,2024-08-07T12:55:04Z,,"Tesla's (TSLA) stock may be on the skids right now, but one perma bull considers the slide to be a perfect buying opportunity.
Im very convinced this [stock] goes to $5,000 or $10,000 [long-term] on… [+4410 chars]",,en,'Elon Musk'
http://deadline.com/2024/08/tiff-2024-documentary-lineup-adam-kinzinger-film-1236033617/,http://deadline.com/2024/08/tiff-2024-documentary-lineup-adam-kinzinger-film-1236033617/,0,deadline.com,Docs On Trump Foe Adam Kinzinger And Venezuelan Coup Plotter Jordan Goudreau Highlight TIFF Nonfiction Lineup,"Ex-GOP Congressman Adam Kinzinger, a prominent critic of Donald Trump, will get a major platform at the Toronto International Film Festival just weeks before the U.S. presidential election. TIFF announced its full documentary lineup this morning and among the…",https://deadline.com/wp-content/uploads/2024/08/Adam-Kinzinger-TIFF.png?w=1024,2024-08-07T14:00:00Z,,"Ex-GOP Congressman Adam Kinzinger, a prominent critic of Donald Trump, will get a major platform at the Toronto International Film Festival just weeks before the U.S. presidential election.
TIFF ann… [+8605 chars]",,en,'Donald Trump'
http://www.hollywoodreporter.com/news/politics-news/election-2024-hollywood-silicon-valley-1235967050/,http://www.hollywoodreporter.com/news/politics-news/election-2024-hollywood-silicon-valley-1235967050/,0,www.hollywoodreporter.com,'F*** These Trump-Loving Techies': Hollywood Takes On Silicon Valley in Epic Brawl...,L.A.’s liberal moguls are coming after Elon Musk and the rest of the Silicon Valley billionaire boys club in a political clash of the titans: “People are putting up a lot of dough just to teach these dudes they can’t buy an election.”,https://www.hollywoodreporter.com/wp-content/uploads/2024/08/23fea_silicon-MAIN_splash.jpg?w=1440&h=810&crop=1,2024-08-07T14:00:03Z,,"If you were to stick a pin in a timeline at the exact moment Silicon Valley declared war on Hollywood, it would likely land on Aug. 29, 1997. That’s the date Reed Hastings and Marc Randolph got toget… [+13726 chars]",,en,'Elon Musk'
https://www.techmeme.com/240807/p20,https://www.techmeme.com/240807/p20,0,www.techmeme.com,"Sources: Opal, previously Opal Camera, which makes $300 webcams, raised a $60M Series B led by OpenAI Startup Fund and plans to make new OpenAI-powered devices (The Information)","The Information:
Sources: Opal, previously Opal Camera, which makes $300 webcams, raised a $60M Series B led by OpenAI Startup Fund and plans to make new OpenAI-powered devices  —  OpenAI CEO Sam Altman has long been interested in building an AI-powered devic…",https://tii.imgix.net/production/articles/13359/542407df-efb5-4fb8-8373-86a39edc88ae-hwznSG.png?fm=jpeg&auto=compress&w=610,2024-08-07T14:20:01Z,,"About This Page
This is a Techmeme archive page.
It shows how the site appeared at 10:20 AM ET, August 7, 2024.
The most current version of the site as always is available at our home page.
To vi… [+69 chars]",,en,'Sam Altman'
https://www.ibtimes.com.au/elon-musks-x-sues-advertisers-over-boycott-1850378,https://www.ibtimes.com.au/elon-musks-x-sues-advertisers-over-boycott-1850378,0,www.ibtimes.com.au,Elon Musk's X Sues Advertisers Over Boycott,"Elon Musk's X sued an advertising group and several large corporations on Tuesday accusing them of causing billions of dollars of losses by ""illegally"" boycotting the social media platform.",https://d.ibtimes.com.au/en/full/1856129/elon-musks-x-filed-antitrust-lawsuit-against-advertising-group-accusing-it-engaging-illegal.jpg,2024-08-07T14:21:26Z,,"Elon Musk's X sued an advertising group and several large corporations on Tuesday accusing them of causing billions of dollars of losses by ""illegally"" boycotting the social media platform.
""We trie… [+1706 chars]",,en,'Sam Altman'
https://hollywoodlife.com/2024/08/07/tim-walz-is-a-fan-of-beyonce-taylor-swift/,https://hollywoodlife.com/2024/08/07/tim-walz-is-a-fan-of-beyonce-taylor-swift/,0,hollywoodlife.com,Tim Walz Is A Fan Of Beyoncé & Taylor Swift,Tim Walz declared official days in honor of both Beyoncé and Taylor Swift.,https://hollywoodlife.com/wp-content/uploads/2024/08/GettyImages-2165604133_0a662f-e1723038523512.jpg?quality=100,2024-08-07T14:25:29Z,,"Image Credit: Getty Images
Kamala Harris running mate in the 2024 presidential election, seems to be as much of a Beyoncéfan as she is.
Tim Walz, who is now the 59-year-old Vice Presidents running … [+2376 chars]",,en,'Taylor Swift'
https://www.businessinsider.com/openai-brain-drain-isnt-great-for-sam-altman-competition-2024-8,https://www.businessinsider.com/openai-brain-drain-isnt-great-for-sam-altman-competition-2024-8,0,www.businessinsider.com,OpenAI's brain drain isn't a great look for Sam Altman,"OpenAI is losing key members like cofounder John Schulman to rivals, adding to challenges in the AI market and trust issues for CEO Sam Altman.",https://i.insider.com/66b2387db4912df3ae192a3a?width=1200&format=jpeg,2024-08-07T18:58:33Z,,"OpenAI will have to weather the storms of being the first company to take generative AI mainstream.Justin Sullivan/Getty Images;Chelsea Jia Feng/BI
<ul><li>OpenAI is losing key members, including co… [+3348 chars]",,en,'Sam Altman'
https://biztoc.com/x/ae1c6d1dd44effdf,https://biztoc.com/x/ae1c6d1dd44effdf,0,biztoc.com,OpenAI's brain drain isn't a great look for Sam Altman,"OpenAI will have to weather the storms of being the first company to take generative AI mainstream.
Justin Sullivan/Getty Images;Chelsea Jia Feng/BI
OpenAI is losing key members, including cofounder John Schulman, who left for Anthropic.
Despite leading the m…",https://biztoc.com/cdn/ae1c6d1dd44effdf_s.webp,2024-08-07T19:04:38Z,,"OpenAI will have to weather the storms of being the first company to take generative AI mainstream.Justin Sullivan/Getty Images;Chelsea Jia Feng/BIOpenAI is losing key members, including cofounder Jo… [+139 chars]",,en,'Sam Altman'
https://theintercept.com/2024/08/07/silicon-valley-tech-billionaires-president-trump/,https://theintercept.com/2024/08/07/silicon-valley-tech-billionaires-president-trump/,0,theintercept.com,Tech Billionaires Love Trump Now — Because He’s One of Them,"Silicon Valley’s right-wing history goes back over 100 years; Donald Trump is a perfect avatar for their power play.
The post Tech Billionaires Love Trump Now — Because He’s One of Them appeared first on The Intercept.",https://theintercept.com/wp-content/uploads/2024/08/GettyImages-2162187243-e1723059195972.jpg?fit=2140%2C1068&w=1200&h=800,2024-08-07T19:57:10Z,,"Donald Trump and J.D. Vance on the first day of the Republican National Convention on July 15, 2024, in Milwaukee, Wis.Photo: Leon Neal/Getty Images
Silicon Valley has gone MAGA.
GOP vice president… [+10934 chars]",,en,'Sam Altman'
https://www.joblo.com/interstellar-70mm-release-delayed/,https://www.joblo.com/interstellar-70mm-release-delayed/,0,www.joblo.com,Interstellar re-release delayed as studio denies 70mm prints of the movie were destroyed,"The re-release of Christopher Nolan's Interstellar has been delayed as studio denies that they destroyed the 70mm prints of the movie.
The post Interstellar re-release delayed as studio denies 70mm prints of the movie were destroyed appeared first on JoBlo.",https://www.joblo.com/wp-content/uploads/2024/08/interstellar-70mm-rerelease-delayed.jpg,2024-08-07T20:42:09Z,,"The re-release of Christopher Nolan’s Interstellar has been delayed as studio denies that they destroyed the 70mm prints of the movie.
It was announced earlier this year that Christopher Nolan’s Int… [+2351 chars]",,en,'Christopher Nolan'
http://www.hollywoodreporter.com/business/business-news/youtube-creators-step-legal-battle-against-openai-class-action-lawsuit-1235968822/,http://www.hollywoodreporter.com/business/business-news/youtube-creators-step-legal-battle-against-openai-class-action-lawsuit-1235968822/,0,www.hollywoodreporter.com,YouTubers File Lawsuit Against OpenAI Over Transcribing Videos,The lawsuit targets the Sam Altman-led company for allegedly transcribing millions of hours of videos for training data.,https://www.hollywoodreporter.com/wp-content/uploads/2024/08/GettyImages-2153157080_b5e022.jpg?w=1296&h=730&crop=1,2024-08-07T21:17:55Z,,"OpenAI has been sued by a YouTuber whose videos were transcribed and used to train its AI system, opening a new front in the legal battle against companies leading development of the technology.
Wit… [+2731 chars]",,en,'Sam Altman'
https://kotaku.com/interstellar-theaters-70mm-imax-nolan-release-date-1851616103,https://kotaku.com/interstellar-theaters-70mm-imax-nolan-release-date-1851616103,0,kotaku.com,The Return Of Christopher Nolan's Interstellar Gets Delayed,"Christopher Nolan didn’t release a movie this year, so theaters are bringing back one of his old ones to compensate. Interstellar was set to return to theaters next month but will instead be delayed until December, Variety reports. Read more...","https://i.kinja-img.com/image/upload/c_fill,h_675,pg_1,q_80,w_1200/f1f6ebfeaa1aac5225d313c3afa8b98e.jpg",2024-08-07T21:45:00Z,,"Christopher Nolan didnt release a movie this year, so theaters are bringing back one of his old ones to compensate. Interstellar was set to return to theaters next month but will instead be delayed u… [+1827 chars]",,en,'Christopher Nolan'
http://www.rollingstone.com/music/music-news/zach-bryan-bruce-springsteen-duet-atlantic-city-1235076133/,http://www.rollingstone.com/music/music-news/zach-bryan-bruce-springsteen-duet-atlantic-city-1235076133/,0,www.rollingstone.com,"Zach Bryan, Bruce Springsteen Surprise Duet ‘Atlantic City’ in Philadelphia","At Zach Bryan's Philly show on Wednesday, the country star was joined by Bruce Springsteen to deliver a surprise duet of ""Atlantic City.""",https://www.rollingstone.com/wp-content/uploads/2024/08/zach-bryan-bruce-springsteen.jpg?w=1600&h=900&crop=1,2024-08-08T04:49:01Z,,"During Zach Bryan‘s second of two Philly shows on Wednesday, the country star was joined by Bruce Springsteen to deliver a surprise duet of “Atlantic City” and their collaboration track, “Sandpaper.”… [+1592 chars]",,en,'Bruce Springsteen'
https://radio.foxnews.com/2024/08/08/the-quiz-186-read-between-the-lines/,https://radio.foxnews.com/2024/08/08/the-quiz-186-read-between-the-lines/,0,radio.foxnews.com,The Quiz #186 – Read Between The Lines,"Test your SCOTUS knowledge on today’s quiz! Play. Share. Listen with former Dallas Cowboys Cheerleader, Victoria Kalina.   Who is the current Chief Justice of the United States Supreme Court? John Roberts Clarence Thomas Sonia Sotomayor Samuel Alito What is t…",https://static.foxnews.com/radio.foxnews.com/content/uploads/2024/03/7cb4fcbf-the-quiz-friday.png,2024-08-08T07:00:28Z,,"Test your SCOTUS knowledge on today’s quiz!
Play. Share. Listen with former Dallas Cowboys Cheerleader, Victoria Kalina.
<ul><li>John Roberts</li><li>Clarence Thomas</li><li>Sonia Sotomayor</li><li… [+975 chars]",,en,'John Roberts'
https://www.geeky-gadgets.com/chatgpt-5-gpt-q-strawberry/,https://www.geeky-gadgets.com/chatgpt-5-gpt-q-strawberry/,0,www.geeky-gadgets.com,ChatGPT 5 GPT Q Strawberry could be launching soon after teaser from Sam Altman,"Recent activity and rumors suggest that OpenAI may soon release a new ChatGPT 5 AI model, potentially named GPT-5 or “GPT Q Strawberry.” Speculation has been fueled by cryptic tweets from OpenAI CEO Sam Altman and the appearance of anonymous models on LMcis.o…",https://www.geeky-gadgets.com/wp-content/uploads/2024/08/ChatGPT-5-AI-GPT-Q-Strawberry.jpg,2024-08-08T07:25:49Z,,"Recent activity and rumors suggest that OpenAI may soon release a new ChatGPT 5 AI model, potentially named GPT-5 or “GPT Q Strawberry.” Speculation has been fueled by cryptic tweets from OpenAI CEO … [+7079 chars]",,en,'Sam Altman'
https://www.livemint.com/opinion/online-views/sam-altman-chip-manufacturing-data-centres-ai-development-climate-change-world-hunger-universal-healthcare-technology-11723059218667.html,https://www.livemint.com/opinion/online-views/sam-altman-chip-manufacturing-data-centres-ai-development-climate-change-world-hunger-universal-healthcare-technology-11723059218667.html,0,www.livemint.com,"Sam Altman’s $7 trillion AI plan: But then, how else can we save the world?","The OpenAI chief’s eye-popping proposal for investment in an AI ecosystem makes the usual tech-startup pitch look like a lemonade-stand idea. Maybe AI is all the world needs. But wait… $7 trillion could wipe out global hunger, help address climate change and …",https://www.livemint.com/lm-img/img/2024/08/07/1600x900/H9L4G6KO_1640541457649_1723059398701.jpg,2024-08-08T09:30:07Z,,"In a world where billionaires launch into space for fun, Sam Altman of OpenAI fame has upped the game of one-upmanship by throwing a number into the universe that has made economists and mathematicia… [+4781 chars]",,en,'Sam Altman'
https://exystence.net/blog/2024/08/08/bruce-springsteen-the-e-street-band-wembley-stadium-london-uk-july-25-2024-2024/,https://exystence.net/blog/2024/08/08/bruce-springsteen-the-e-street-band-wembley-stadium-london-uk-july-25-2024-2024/,0,exystence.net,"Bruce Springsteen & The E Street Band – Wembley Stadium, London, UK, July 25, 2024 (2024)","During the first of two nights at Wembley Stadium that mark the end of Bruce Springsteen’s current European tour, it’s abundantly clear that The Boss is primed for the occasion. Take for example, his ecstatic run through ‘The Promised Land’ from Darkness On t…",,2024-08-08T10:56:55Z,,"During the first of two nights at Wembley Stadium that mark the end of Bruce Springsteens current European tour, its abundantly clear that The Boss is primed for the occasion. Take for example, his e… [+7183 chars]",,en,'Bruce Springsteen'
https://consequence.net/2024/08/zach-bryan-bruce-springsteen-atlantic-city-sandpaper/,https://consequence.net/2024/08/zach-bryan-bruce-springsteen-atlantic-city-sandpaper/,0,consequence.net,Zach Bryan Brings Out Bruce Springsteen to Duet “Atlantic City” and “Sandpaper”: Watch,"Springsteen later returned for an encore performance of ""Revival"" alongside The Lumineers and Shane Gillis.
Zach Bryan Brings Out Bruce Springsteen to Duet “Atlantic City” and “Sandpaper”: Watch
Eddie Fu",https://consequence.net/wp-content/uploads/2024/08/zach-bryan-bruce-springsteen-philly.jpg,2024-08-08T14:30:10Z,,"Zach Bryan brought out Bruce Springsteen for a surprise appearance during the second Philadelphia concert of his “Quittin Time Tour” (get tickets here) on Wednesday (August 7th).
After duetting Spri… [+1156 chars]",,en,'Bruce Springsteen'
https://www.stereogum.com/2275270/watch-bruce-springsteen-join-zach-bryan-on-atlantic-city-in-philly-last-night/news/,https://www.stereogum.com/2275270/watch-bruce-springsteen-join-zach-bryan-on-atlantic-city-in-philly-last-night/news/,0,www.stereogum.com,Watch Bruce Springsteen Join Zach Bryan On “Atlantic City” In Philly Last Night,"Back in March, the country-rock supernova Zach Bryan played in Newark, and New Jersey’s own Bruce Springsteen joined him onstage to play a then-unreleased song called “Sandpaper.” Last month, Bryan released his new album The Great American Bar Scene, and it w…",https://static.stereogum.com/uploads/2024/08/Zach-Bryan-and-Bruce-Springsteen-1723126592.jpg,2024-08-08T14:31:03Z,,"Back in March, the country-rock supernova Zach Bryan played in Newark, and New Jersey’s own Bruce Springsteen joined him onstage to play a then-unreleased song called “Sandpaper.” Last month, Bryan r… [+1356 chars]",,en,'Bruce Springsteen'
https://nypost.com/2024/08/08/entertainment/get-tickets-to-see-adam-driver-in-hold-on-to-me-darling/,https://nypost.com/2024/08/08/entertainment/get-tickets-to-see-adam-driver-in-hold-on-to-me-darling/,0,nypost.com,What do tickets cost to see Adam Driver in ‘Hold On To Me Darling’?,Opening night is Sept. 24 at the Lucille Lortel Theatre.,https://nypost.com/wp-content/uploads/sites/2/2024/08/Adam-Driver.jpg?quality=75&strip=all&w=1024,2024-08-08T14:58:19Z,,"Vivid Seats is the New York Post's official ticketing partner. We may receive revenue from this partnership for sharing this content and/or when you make a purchase.
Kylo Ren is leaving the dark sid… [+3362 chars]",,en,'Bruce Springsteen'
https://www.techradar.com/computing/artificial-intelligence/everyone-thinks-this-picture-of-strawberries-is-teasing-a-major-chatgpt-update,https://www.techradar.com/computing/artificial-intelligence/everyone-thinks-this-picture-of-strawberries-is-teasing-a-major-chatgpt-update,0,www.techradar.com,Everyone thinks this picture of strawberries is teasing a major ChatGPT update,"OpenAI's Sam Altman posted a picture of strawberries on social media, and everyone thinks its a ChatGPT update teaser.",https://cdn.mos.cms.futurecdn.net/kSArVmiGReJ4zKxxhr5Bm7-1200-80.jpg,2024-08-08T15:11:46Z,,"Is Sam Altman just trying to get people to marvel at a few small strawberries he’s grown, or is the OpenAI CEO (the team behind ChatGPT) teasing the next big upgrade to its chatbot?
That’s what we’r… [+3278 chars]",,en,'Sam Altman'
https://www.techspot.com/news/104181-more-people-returning-humane-ai-pin-than-buying.html,https://www.techspot.com/news/104181-more-people-returning-humane-ai-pin-than-buying.html,0,www.techspot.com,More people are returning the Humane Ai Pin than buying it,"There was so much hype before the Ai Pin's launch that Humane managed to secure $240 million from investors including OpenAI CEO Sam Altman. The company was valued at a massive $850 million last year, but that was before its first product arrived.Read Entire …",https://www.techspot.com/images2/news/bigimage/2024/08/2024-08-08-image-10.jpg,2024-08-08T15:13:00Z,,"Facepalm: In a classic example of why you should never think things can't get any worse, Humane, maker of the much-maligned Ai Pin, is now dealing with a situation where so many people are returning … [+2369 chars]",,en,'Sam Altman'
