index,url,valid,domain,title,description,image,published,archive,content,quote,language,keyword
https://www.forbes.com/sites/monicamercuri/2023/11/06/dancing-with-the-stars-announces-first-taylor-swift-night/,https://www.forbes.com/sites/monicamercuri/2023/11/06/dancing-with-the-stars-announces-first-taylor-swift-night/,0,www.forbes.com,‘Dancing With The Stars’ Announces First Taylor Swift Night,"ABC finally confirmed that there will be a Taylor Swift-themed night on 'Dancing With the Stars' this season. Here's when to tune into “A Celebration of Taylor Swift.""","https://imageio.forbes.com/specials-images/imageserve/6548efac6de1652c0fdbb75c/0x0.jpg?format=jpg&crop=3631,2423,x0,y244,safe&height=900&width=1600&fit=bounds",2023-11-06T14:09:58Z,,"MEXICO CITY, MEXICO - AUGUST 24: EDITORIAL USE ONLY. NO BOOK COVERS. Taylor Swift performs onstage ... [+] during the ""Taylor Swift | The Eras Tour"" at Foro Sol on August 24, 2023 in Mexico City, Mex… [+2968 chars]",,en,'Travis Kelce'
https://www.digitaljournal.com/world/french-justice-minister-goes-on-trial-in-conflict-of-interest-case/article,https://www.digitaljournal.com/world/french-justice-minister-goes-on-trial-in-conflict-of-interest-case/article,0,www.digitaljournal.com,French justice minister goes on trial in conflict of interest case,"France’s justice minister went on trial on Monday in a conflict of interest case that has been a major embarrassment for President Emmanuel Macron’s government. Eric Dupond-Moretti, a former star defence lawyer, was in 2021 charged with misusing his position …",https://www.digitaljournal.com/wp-content/uploads/2023/11/15af0beaeecc85da05c7c661204b12b9dfa2b7ea.jpg,2023-11-06T14:16:06Z,,"Dupond-Moretti is the first sitting justice minister in France to stand trial - Copyright AFP/File Kenzo TRIBOUILLARD
France’s justice minister went on trial on Monday in a conflict of interest case… [+2814 chars]",,en,'Nicolas Sarkozy'
https://pagesix.com/2023/11/06/entertainment/brad-pitt-girlfriend-ines-de-ramon-super-loving-at-lacma-gala/,https://pagesix.com/2023/11/06/entertainment/brad-pitt-girlfriend-ines-de-ramon-super-loving-at-lacma-gala/,0,pagesix.com,"Brad Pitt, girlfriend Ines de Ramon appear as ‘super loving’ couple at LACMA gala","The ""Once Upon a Time in Hollywood"" star and the jewelry designer have been dating since 2022 following his divorce from Angelina Jolie.",https://pagesix.com/wp-content/uploads/sites/3/2023/11/NYPICHPDPICT000071879431.jpg?quality=75&strip=all&w=1024,2023-11-06T14:23:12Z,,"Brad Pitt and Ines de Ramon appeared to be a “super loving” couple during their first public appearance together.
The “Once Upon a Time in Hollywood” star brought the jewelry designer as his plus-on… [+2568 chars]",,en,'Brad Pitt'
https://www.newsweek.com/travis-kelce-quiet-game-without-taylor-swift-present-sparks-questions-1841136,https://www.newsweek.com/travis-kelce-quiet-game-without-taylor-swift-present-sparks-questions-1841136,0,www.newsweek.com,Travis Kelce's Performance Without Taylor Swift Present Sparks Questions,"Still, he passed Pro Football Hall of Fame tight end Tony Gonzalez as the Chiefs' all-time leader in receiving yards on Sunday.",https://d.newsweek.com/en/full/2304816/travis-kelce.jpg,2023-11-06T14:30:29Z,https://web.archive.org/web/20231106221352/http://www.newsweek.com/travis-kelce-quiet-game-without-taylor-swift-present-sparks-questions-1841136,"As the Kansas City Chiefs prepared for their game against the Miami Dolphins in Germany, tight end Travis Kelce spoke to the media at length on Friday, fielding questions about football, his New Heig… [+4086 chars]",,en,'Travis Kelce'
https://biztoc.com/x/e2738beafc00289f,https://biztoc.com/x/e2738beafc00289f,0,biztoc.com,Travis Kelce's performance without Taylor Swift present sparks questions,"As the Kansas City Chiefs prepared for their game against the Miami Dolphins in Germany, tight end Travis Kelce spoke to the media at length on Friday, fielding questions about football, his New Heights podcast (he would love to bring it to Germany, but only …",https://c.biztoc.com/p/e2738beafc00289f/s.webp,2023-11-06T14:34:08Z,,"As the Kansas City Chiefs prepared for their game against the Miami Dolphins in Germany, tight end Travis Kelce spoke to the media at length on Friday, fielding questions about football, his New Heig… [+309 chars]",,en,'Travis Kelce'
https://www.digitaljournal.com/world/sarkozy-back-in-court-to-appeal-corruption-conviction/article,https://www.digitaljournal.com/world/sarkozy-back-in-court-to-appeal-corruption-conviction/article,0,www.digitaljournal.com,Sarkozy back in court to appeal corruption conviction,Former French president Nicolas Sarkozy is scheduled to appear in a court in Paris on Wednesday to appeal a one-year jail sentence for illegal campaign financing. The 68-year-old right-winger has faced a litany of legal problems since his one term in office f…,https://www.digitaljournal.com/wp-content/uploads/2023/11/a1ab6954e0f8969cca4dfb99f7bc8b02cf33df32.jpg,2023-11-06T14:36:07Z,,"Despite his convictions, Sarkozy remains influential - Copyright AFP Geoffroy Van der Hasselt
Former French president Nicolas Sarkozy is scheduled to appear in a court in Paris on Wednesday to appea… [+3459 chars]",,en,'nan nan'
https://www.france24.com/en/live-news/20231106-sarkozy-back-in-court-to-appeal-corruption-conviction,https://www.france24.com/en/live-news/20231106-sarkozy-back-in-court-to-appeal-corruption-conviction,0,www.france24.com,Sarkozy back in court to appeal corruption conviction,"The 68-year-old right-winger has faced a litany of legal problems since his one term in office from 2007 until 2012, and has been charged separately with corruption, bribery, influence-peddling, and breaking campaign financing laws. 

In the so-called ""Bygmal…",https://s.france24.com/media/display/f729a598-7cb1-11ee-81a0-005056bf30b7/w:1280/p:16x9/97480f1890e8506d894034b40ce13fe2fef88e19.jpg,2023-11-06T14:37:10Z,,Paris (AFP) Former French president Nicolas Sarkozy is scheduled to appear in a court in Paris on Wednesday to appeal a one-year jail sentence for illegal campaign financing. The 68-year-old right-wi… [+3368 chars],,en,'Nicolas Sarkozy'
https://www.justjared.com/2023/11/06/taylor-swift-publicly-supports-travis-kelce-after-breaking-kansas-city-chiefs-record/,https://www.justjared.com/2023/11/06/taylor-swift-publicly-supports-travis-kelce-after-breaking-kansas-city-chiefs-record/,0,www.justjared.com,Taylor Swift Publicly Supports Travis Kelce After Breaking Kansas City Chiefs Record!,"Taylor Swift and Travis Kelce are still going strong, and she subtly – and publicly – supported him after his big game against the Miami Dolphins on Sunday (November 5) in Germany. After the game, the 34-year-old tight end made headlines for becoming the all-…",https://cdn.justjared.com/wp-content/uploads/headlines/2023/11/taylor-swift-travis-kelce-latest-updates.jpg,2023-11-06T14:38:49Z,,"Taylor Swift and Travis Kelce are still going strong, and she subtly – and publicly – supported him after his big game against the Miami Dolphins on Sunday (November 5) in Germany.
After the game, t… [+754 chars]",,en,'Travis Kelce'
https://www.newsweek.com/travis-kelce-sunday-was-scary-unclear-who-should-worry-1841133,https://www.newsweek.com/travis-kelce-sunday-was-scary-unclear-who-should-worry-1841133,0,www.newsweek.com,"Travis Kelce's Sunday Was Scary, but It's Unclear Who Should Worry","Travis Kelce had a quiet day on Sunday, but the Chiefs still secured a big victory. Is that a positive or negative sign?",https://d.newsweek.com/en/full/2304839/travis-kelce-germany.jpg,2023-11-06T14:40:33Z,https://web.archive.org/web/20231106193046/http://www.newsweek.com/travis-kelce-sunday-was-scary-unclear-who-should-worry-1841133,"On the whole, the Kansas City Chiefs had a pretty positive trip to Germany. Andy Reid's choice to travel closer to game time paid off, as the reigning Super Bowl champions came out strong in the firs… [+5994 chars]",,en,'Travis Kelce'
https://pagesix.com/2023/11/06/entertainment/taylor-swift-supports-travis-kelces-win-after-skipping-game/,https://pagesix.com/2023/11/06/entertainment/taylor-swift-supports-travis-kelces-win-after-skipping-game/,0,pagesix.com,Taylor Swift subtly supports Travis Kelce’s Chiefs win after skipping game in Germany,The pop star's sign of support for her boyfriend came after she grabbed dinner with several of her famous gal pals in New York City.,https://pagesix.com/wp-content/uploads/sites/3/2023/11/NYPICHPDPICT000071879864.jpg?quality=75&strip=all&w=1024,2023-11-06T14:41:39Z,https://web.archive.org/web/20231106144815/https://pagesix.com/2023/11/06/entertainment/taylor-swift-supports-travis-kelces-win-after-skipping-game/,"Taylor Swift showed a subtle sign of support for her boyfriend, Travis Kelce, by “liking” an Instagram post about the Kansas City Chiefs’ win against the Miami Dolphins.
The post, shared by People, … [+2479 chars]",,en,'Travis Kelce'
https://www.ibtimes.com/sarkozy-back-court-appeal-corruption-conviction-3717728,https://www.ibtimes.com/sarkozy-back-court-appeal-corruption-conviction-3717728,0,www.ibtimes.com,Sarkozy Back In Court To Appeal Corruption Conviction,Former French president Nicolas Sarkozy is scheduled to appear in a court in Paris on Wednesday to appeal a one-year jail sentence for illegal campaign financing.,https://d.ibtimes.com/en/full/4497512/despite-his-convictions-sarkozy-remains-influential.jpg,2023-11-06T14:42:40Z,,"Former French president Nicolas Sarkozy is scheduled to appear in a court in Paris on Wednesday to appeal a one-year jail sentence for illegal campaign financing.
The 68-year-old right-winger has fa… [+3342 chars]",,en,'nan nan'
https://biztoc.com/x/9574266b8df6403e,https://biztoc.com/x/9574266b8df6403e,0,biztoc.com,"Travis Kelce's Sunday was scary, but it's unclear who should worry","On the whole, the Kansas City Chiefs had a pretty positive trip to Germany. Andy Reid's choice to travel closer to game time paid off, as the reigning Super Bowl champions came out strong in the first half. Things got a bit messier as the contest elapsed—it's…",https://c.biztoc.com/p/9574266b8df6403e/s.webp,2023-11-06T14:48:05Z,,"On the whole, the Kansas City Chiefs had a pretty positive trip to Germany. Andy Reid's choice to travel closer to game time paid off, as the reigning Super Bowl champions came out strong in the firs… [+298 chars]",,en,'Travis Kelce'
https://www.usmagazine.com/celebrity-news/news/taylor-swift-subtly-supports-travis-kelce-after-skipping-germany-game/#article,https://www.usmagazine.com/celebrity-news/news/taylor-swift-subtly-supports-travis-kelce-after-skipping-germany-game/#article,0,www.usmagazine.com,Taylor Swift Subtly Supports Travis Kelce Breaking Chiefs Receiver Record,"Taylor Swift didn’t make the lengthy trip to Germany to watch Travis Kelce and the Kansas City Chiefs play the Miami Dolphins — but she still supported her man from afar. The game was one of few held by the NFL overseas this season, taking place at Deutsche B…",https://www.usmagazine.com/wp-content/uploads/2023/11/Taylor-Swift-Travels-to-Germany-to-Attend-Travis-Kelce-s-Kansas-City-Chiefs-Game-Against-Miami-Dolphins-068.jpg?crop=0px%2C74px%2C2000px%2C1051px&resize=1200%2C630&quality=86&strip=all,2023-11-06T14:58:16Z,,"Travis Kelce, Taylor Swift.Gotham/GC Images
Taylor Swift didnt make the lengthy trip to Germany to watch Travis Kelce and the Kansas City Chiefs play the Miami Dolphins but she still supported her m… [+2892 chars]",,en,'Travis Kelce'
https://people.com/taylor-swift-liked-people-instagram-post-about-travis-kelce-amid-romance-8387691,https://people.com/taylor-swift-liked-people-instagram-post-about-travis-kelce-amid-romance-8387691,0,people.com,Taylor Swift Liked PEOPLE's Instagram About Travis Kelce amid Romance,Taylor Swift “liked” PEOPLE's Instagram post about Travis Kelce becoming the new all-time leading receiver in Kansas City Chiefs franchise history.,https://people.com/thmb/VZWmMwdUztkmhs0iuklU0UCcaTI=/1500x0/filters:no_upscale():max_bytes(150000):strip_icc():focal(750x112:752x114)/taylor-swift-travis-kelce-2-092723-c15ea09117424692a9328743ce58f95a.jpg,2023-11-06T15:36:01Z,,"Taylor Swift is Travis Kelce's No. 1 fan!
The singer, 33, liked PEOPLE's Instagram post about the NFL star's latest win on Sunday when Kelce became the new all-time leading receiver in Kansas City C… [+3351 chars]",,en,'Travis Kelce'
https://www.marca.com/en/lifestyle/celebrities/2023/11/06/654908d0ca47415b3c8b459d.html,https://www.marca.com/en/lifestyle/celebrities/2023/11/06/654908d0ca47415b3c8b459d.html,0,www.marca.com,Dancing With The Stars announces Taylor Swift Night with a special guest judge: Will Travis Kelce dance?,"Season 32 of &quot;Dancing With the Stars&quot; has something special in store for its viewers on Tuesday, November 21: Taylor Swift night. 

On this night, the remaining contestan",https://phantom-marca.unidadeditorial.es/2063cea06a8c0650737866ab1a063fc6/resize/1200/f/webp/assets/multimedia/imagenes/2023/11/06/16992840027801.jpg,2023-11-06T15:40:20Z,https://web.archive.org/web/20231107020527/https://www.marca.com/en/lifestyle/celebrities/2023/11/06/654908d0ca47415b3c8b459d.html,"Season 32 of ""Dancing With the Stars"" has something special in store for its viewers on Tuesday, November 21: Taylor Swift night. 
On this night, the remaining contestants will grace the dance floor… [+2291 chars]",,en,'Travis Kelce'
https://www.today.com/popculture/taylor-swift-likes-travis-kelce-post-instagram-rcna123783,https://www.today.com/popculture/taylor-swift-likes-travis-kelce-post-instagram-rcna123783,0,www.today.com,Taylor Swift likes an Instagram post celebrating Travis Kelce's new Chiefs record,Taylor Swift liked a People Magazine post about Travis Kelce setting a new team record as the new all-time leading receiver in Chiefs' history.,"https://media-cldnry.s-nbcnews.com/image/upload/t_social_share_1200x630_center,f_auto,q_auto:best/rockcms/2023-11/travis-kelce-taylor-swift-mc-231106-03-28a016.jpg",2023-11-06T15:41:58Z,https://web.archive.org/web/20231106163406/https://www.today.com/popculture/taylor-swift-likes-travis-kelce-post-instagram-rcna123783,"Travis Kelce's record-breaking football performance over the weekend has received the admiration of one Taylor Swift. 
The tight end's Kansas City Chiefs took on the Miami Dolphins on Nov. 5 in the … [+2080 chars]",,en,'Travis Kelce'
https://www.cosmopolitan.com/entertainment/celebs/a45753920/travis-kelce-asked-in-love-with-taylor-swift-answer/,https://www.cosmopolitan.com/entertainment/celebs/a45753920/travis-kelce-asked-in-love-with-taylor-swift-answer/,0,www.cosmopolitan.com,Travis Kelce Was Asked if He’s in Love With Taylor Swift and His Answer Was Surprising,He then joked about how she changes his game play. ,"https://hips.hearstapps.com/hmg-prod/images/taylor-swift-and-travis-kelce-have-dinner-at-waverly-inn-on-news-photo-1699106549.jpg?crop=1.00xw:0.607xh;0,0.0504xh&resize=1200:*",2023-11-06T16:11:00Z,https://web.archive.org/web/20231107020741/https://www.cosmopolitan.com/entertainment/celebs/a45753920/travis-kelce-asked-in-love-with-taylor-swift-answer/,"Travis Kelce and Taylor Swift have been pretty public about the fact that they're dating, but there are some things the NFL star wants to keep just for himself. On Friday, Travis was interviewed duri… [+1673 chars]",,en,'Taylor Swift'
https://www.marca.com/en/nfl/kansas-city-chiefs/2023/11/06/6549111622601d10138b4596.html,https://www.marca.com/en/nfl/kansas-city-chiefs/2023/11/06/6549111622601d10138b4596.html,0,www.marca.com,"Andy Read justifies Travis Kelce's new downturn without Taylor Swift in the stadium: ""They were aware of him""","While fans blame the discreet performance of tight end Travis Kelce against the Miami Dolphins on Taylor Swift&apos;s absence, Kansas City Chiefs head coach Andy Reid has a more sp",https://phantom-marca.unidadeditorial.es/f6662ecf0c1190cc841fda1fed45c8f6/resize/1200/f/webp/assets/multimedia/imagenes/2023/11/06/16992862870152.jpg,2023-11-06T16:18:05Z,https://web.archive.org/web/20231107053914/https://www.marca.com/en/nfl/kansas-city-chiefs/2023/11/06/6549111622601d10138b4596.html,"While fans blame the discreet performance of tight end Travis Kelce against the Miami Dolphins on Taylor Swift's absence, Kansas City Chiefs head coach Andy Reid has a more sporting explanation for t… [+2299 chars]",,en,'Travis Kelce'
https://biztoc.com/x/910271fd7540a9e2,https://biztoc.com/x/910271fd7540a9e2,0,biztoc.com,Travis Kelce Is Now the Leading Receiver in Chiefs History: Here’s How Taylor Swift Reacted,Travis Kelce became the Kansas City Chiefs’ all-time leading receiver after helping his team triumph over the Miami Dolphins — and Taylor Swift is all for it. Related A Timeline of Taylor Swift & Travis Kelce’s Relationship 11/06/2023 Amid the pair’s buzzwort…,https://c.biztoc.com/p/910271fd7540a9e2/s.webp,2023-11-06T16:22:18Z,,"Travis Kelce became the Kansas City Chiefs all-time leading receiver after helping his team triumph over the Miami Dolphins and Taylor Swift is all for it.
Related 
A Timeline of Taylor Swift &amp;… [+202 chars]",,en,'Travis Kelce'
https://extratv.com/2023/11/06/taylor-swift-s-a-list-girls-night-in-nyc-while-travis-kelce-plays-in-germany/,https://extratv.com/2023/11/06/taylor-swift-s-a-list-girls-night-in-nyc-while-travis-kelce-plays-in-germany/,0,extratv.com,Taylor Swift’s A-List Girls’ Night in NYC while Travis Kelce Plays in Germany,"Taylor Swift and her girl squad enjoyed a night out in NYC over the weekend.
 Swift and her A-list friends made a splash outside BONDST restaurant on Saturday as they were photographed leaving the venue.
 At one point, the singer walked down the steps arm in …",https://extra-images.akamaized.net/image/1b/16by9/2023/11/06/1b572f45ac884a188864c2151ddfa767_xl.jpg,2023-11-06T16:22:42Z,https://web.archive.org/web/20231106195417/https://extratv.com/2023/11/06/taylor-swift-s-a-list-girls-night-in-nyc-while-travis-kelce-plays-in-germany/,"Taylor Swift and her girl squad enjoyed a night out in NYC over the weekend.
Swift and her A-list friends made a splash outside BONDST restaurant on Saturday as they were photographed leaving the ve… [+1509 chars]",,en,'Taylor Swift'
https://www.cnn.com/2023/11/06/entertainment/taylor-swift-brittany-mahomes-squad/index.html,https://www.cnn.com/2023/11/06/entertainment/taylor-swift-brittany-mahomes-squad/index.html,0,www.cnn.com,Taylor Swift adds Brittany Mahomes to her squad | CNN,Taylor Swift adds Brittany Mahomes to her squad | CNNcnn.com,"https://media.cnn.com/api/v1/images/stellar/prod/gettyimages-1775430516.jpg?c=16x9&q=w_800,c_fill",2023-11-06T16:32:33Z,https://web.archive.org/web/20231106195446/https://www.cnn.com/2023/11/06/entertainment/taylor-swift-brittany-mahomes-squad/index.html,"Taylor Swift appears to have a new member of her squad.
Over the weekend she was photographed having a night out with a group of girlfriends, Selena Gomez, Sophie Turner, Gigi Hadid, Cara Delevingne… [+1033 chars]",,en,'Travis Kelce'
https://deadline.com/2023/11/dancing-with-the-stars-taylor-swift-celebration-night-1235594375/,https://deadline.com/2023/11/dancing-with-the-stars-taylor-swift-celebration-night-1235594375/,0,deadline.com,‘Dancing With The Stars’ Sets Taylor Swift “Celebration” Night,"The sounds of Taylor Swift will be heard during “A Celebration of Taylor Swift” on ABC’s Dancing With The Stars, on Tuesday, Nov. 21. The six remaining couples will dance to Swift’s biggest hits during the episode, with longtime Dancing with the Stars choreog…",https://deadline.com/wp-content/uploads/2023/10/taylor-swift-1989.jpg?w=1024,2023-11-06T16:49:00Z,https://web.archive.org/web/20231106165832/https://deadline.com/2023/11/dancing-with-the-stars-taylor-swift-celebration-night-1235594375/,"The sounds of Taylor Swift will be heard during “A Celebration of Taylor Swift” on ABC‘s Dancing With The Stars, on Tuesday, Nov. 21. The six remaining couples will dance to Swift’s biggest hits duri… [+1306 chars]",,en,'Taylor Swift'
https://economictimes.indiatimes.com/news/international/us/woman-ending-10-year-prison-sentence-wishes-to-meet-taylor-swift-first-check-out-why/articleshow/105019685.cms,https://economictimes.indiatimes.com/news/international/us/woman-ending-10-year-prison-sentence-wishes-to-meet-taylor-swift-first-check-out-why/articleshow/105019685.cms,0,economictimes.indiatimes.com,Woman ending 10-year prison sentence wishes to meet Taylor Swift first; Check out why,"As freedom beckons after a decade behind bars, one woman harbors a heartfelt wish that stands above all others. Gypsy Rose Blanchard is on the cusp of release and her first desire is to fulfill a lifelong dream. Her aspiration is not for wealth, fame, or adve…","https://img.etimg.com/thumb/msid-105019717,width-1200,height-630,imgsize-98314,overlay-economictimes/photo.jpg",2023-11-06T16:58:23Z,https://web.archive.org/web/20231107001859/http://economictimes.indiatimes.com/news/international/us/woman-ending-10-year-prison-sentence-wishes-to-meet-taylor-swift-first-check-out-why/articleshow/105019685.cms,"Gypsy Rose Blanchard, who is nearing the end of her 10-year prison sentence, has a specific wish for when she regains her freedom in December. Blanchard, known for her involvement in her mother Dee D… [+1321 chars]",,en,'Travis Kelce'
https://pagesix.com/2023/11/06/entertainment/taylor-swift-hosts-chiefs-viewing-party-for-fellow-kc-wags/,https://pagesix.com/2023/11/06/entertainment/taylor-swift-hosts-chiefs-viewing-party-for-fellow-kc-wags/,0,pagesix.com,Taylor Swift hosts Chiefs vs. Dolphins viewing party at NYC apartment for fellow Kansas City WAGs,"Paige Buechele and Lyndsay Bell were spotted leaving the singer's Tribeca pad, one day after Swift included Brittany Mahomes in a girls' night out.",https://pagesix.com/wp-content/uploads/sites/3/2023/11/taylor-swift-wags.jpg?quality=75&strip=all&w=1024,2023-11-06T16:59:32Z,https://web.archive.org/web/20231106170301/https://pagesix.com/2023/11/06/entertainment/taylor-swift-hosts-chiefs-viewing-party-for-fellow-kc-wags/,"The Kansas City Chiefs WAGs are in the building Taylor Swift’s apartment building, that is.
The singer invited the significant others of multiple NFL stars to her New York City apartment on Sunday t… [+2429 chars]",,en,'Taylor Swift'
https://pagesix.com/2023/11/06/gossip/adam-richmans-wedding-featured-pop-up-food-from-katzs-deli-chick-fil-a/,https://pagesix.com/2023/11/06/gossip/adam-richmans-wedding-featured-pop-up-food-from-katzs-deli-chick-fil-a/,0,pagesix.com,"Foodie Adam Richman’s wedding featured pop-up grub from Katz’s Deli, Shake Shack, Chick-fil-A and more","The groom co-founded Medium Rare, which is known for over-the-top celebrity fêtes with Shaquille O'Neal, Guy Fieri, Travis Kelce and Rob Gronkowski.",https://pagesix.com/wp-content/uploads/sites/3/2023/11/NYPICHPDPICT000071852760.jpg?quality=75&strip=all&w=1024,2023-11-06T17:04:08Z,https://web.archive.org/web/20231107042249/https://pagesix.com/2023/11/06/gossip/adam-richmans-wedding-featured-pop-up-food-from-katzs-deli-chick-fil-a/,"Medium Rare co-founder Adam Richman whose firm is known for over-the-top fêtes with Guy Fieri, Shaquille ONeal, Travis Kelce and Rob Gronkowski staged an equally elaborate food-centric affair for his… [+2084 chars]",,en,'Travis Kelce'
https://www.etonline.com/travis-kelce-becomes-kansas-city-chiefs-all-time-leading-receiver-as-taylor-swift-subtly-shows-her,https://www.etonline.com/travis-kelce-becomes-kansas-city-chiefs-all-time-leading-receiver-as-taylor-swift-subtly-shows-her,0,www.etonline.com,Travis Kelce Becomes Kansas City Chiefs' All-Time Leading Receiver as Taylor Swift Subtly Shows Her Support,Travis Kelce Becomes Kansas City Chiefs' All-Time Leading Receiver as Taylor Swift Subtly Shows Her Supportetonline.com,https://www.etonline.com/sites/default/files/styles/1280x720/public/images/2023-11/GettyImages-1777753064%20%281%29.jpg?h=254d69f1,2023-11-06T17:42:47Z,https://web.archive.org/web/20231107032224/https://www.etonline.com/travis-kelce-becomes-kansas-city-chiefs-all-time-leading-receiver-as-taylor-swift-subtly-shows-her,"Travis Kelce celebrated a major career milestone over the weekend, becoming the Kansas City Chiefs' all-time leading receiver during the team's matchup against the Miami Dolphins on Sunday. 
Kelce a… [+2826 chars]",,en,'Taylor Swift'
https://ftw.usatoday.com/2023/11/taylor-swift-travis-kelce-brittany-mahomes-chiefs-watch-party-nyc,https://ftw.usatoday.com/2023/11/taylor-swift-travis-kelce-brittany-mahomes-chiefs-watch-party-nyc,0,ftw.usatoday.com,Taylor Swift reportedly hosted wives of Travis Kelce's teammates at a Chiefs watch party,Wives of Travis Kelce's teammates were seen leaving Swift's Tribeca home on Sunday.,https://ftw.usatoday.com/wp-content/uploads/sites/90/2023/10/taylor.jpeg?w=1024&h=576&crop=1,2023-11-06T18:11:34Z,,"With the resumption of the mega Eras Tour on the horizon on November 9, it was wholly unsurprising that Taylor Swift wasn’t able to travel to Frankfurt, Germany to see boyfriend Travis Kelce and the … [+988 chars]",,en,'Travis Kelce'
