index,url,valid,domain,title,description,image,published,archive,content,quote,language,keyword
https://www.businessinsider.com/putin-terrified-assassinated-refusing-to-travel-drone-strike-reports-russia-2023-6,https://www.businessinsider.com/putin-terrified-assassinated-refusing-to-travel-drone-strike-reports-russia-2023-6,0,www.businessinsider.com,Putin is terrified of being assassinated and is refusing to travel abroad after a drone attack near his luxury residence: reports,"Drone strikes targeting Moscow Tuesday struck near the Russian president's home in a wealthy suburb, a report claims. Experts say this has caused Putin to become increasingly paranoid.",https://i.insider.com/64788bfbdf2567001837f5b3?width=1200&format=jpeg,2023-06-01T12:38:00Z,https://web.archive.org/web/20230601124742/https://www.businessinsider.com/putin-terrified-assassinated-refusing-to-travel-drone-strike-reports-russia-2023-6,"Russian President Vladimir Putin has long sought to project an image of invincibility, from notorious macho PR stunts to aggressively asserting Russia's role on the world stage. 
But according to a … [+4298 chars]",,en,'Putin'
https://thehill.com/policy/international/4029873-north-korean-leaders-sister-accuses-us-of-gangster-like-hypocrisy-over-failed-spy-satellite-launch/,https://thehill.com/policy/international/4029873-north-korean-leaders-sister-accuses-us-of-gangster-like-hypocrisy-over-failed-spy-satellite-launch/,0,thehill.com,North Korean leader’s sister accuses US of ‘gangster-like’ hypocrisy over failed spy satellite launch,"Kim Yo Jong, the sister of North Korean leader Kim Jong Un, on Thursday accused the U.S. of “gangster-like” hypocrisy for its criticisms of North Korea’s failed attempt to launch a military spy satellite.  Kim Yo Jong said the U.S. “is letting loose a hackney…",https://thehill.com/wp-content/uploads/sites/2/2022/12/d1167a21d34b4c7ba4bd6b9f95165c38-e1685625902802.jpg?w=1280,2023-06-01T14:03:57Z,https://web.archive.org/web/20230601144808/https://thehill.com/policy/international/4029873-north-korean-leaders-sister-accuses-us-of-gangster-like-hypocrisy-over-failed-spy-satellite-launch/,"Skip to content
Kim Yo Jong, the sister of North Korean leader Kim Jong Un, on Thursday accused the U.S. of “gangster-like” hypocrisy for its criticisms of North Korea’s failed attempt to launch a m… [+1709 chars]",,en,'Kim Jong Un'
https://www.businessinsider.com/jeffrey-epstein-dinner-dick-cavett-2023-5,https://www.businessinsider.com/jeffrey-epstein-dinner-dick-cavett-2023-5,0,www.businessinsider.com,"Jeffrey Epstein had dinner scheduled with legendary talk show host Dick Cavett, email records show","The schedule also listed Woody Allen, Soon-Yi Previn, and Bill Gates advisor Boris Nikolic in attendance.",https://i.insider.com/64778e02df2567001837e0ba?width=1200&format=jpeg,2023-06-01T14:11:16Z,https://web.archive.org/web/20230601143710/https://www.businessinsider.com/jeffrey-epstein-dinner-dick-cavett-2023-5,"Jeffrey Epstein and Dick Cavett.Davidoff Studios/Getty Images; Presley Ann/Patrick McMullan via Getty Images
<ul>
<li>Dick Cavett was scheduled to dine with Jeffrey Epstein in February 2012.</li>
<l… [+3580 chars]",,en,'Jeffrey Epstein'
https://www.businessinsider.com/kim-jong-un-weighs-300-pounds-insomnia-lawmaker-says-ai-2023-6,https://www.businessinsider.com/kim-jong-un-weighs-300-pounds-insomnia-lawmaker-says-ai-2023-6,0,www.businessinsider.com,South Korean lawmaker says they estimate Kim Jong Un is over 300 pounds and has a 'severe' sleeping disorder,Yoo Sang-bum told reporters on Wednesday that South Korea has been using artificial intelligence to approximate Kim Jong Un's weight.,https://i.insider.com/64789ffedf2567001837f805?width=1200&format=jpeg,2023-06-01T14:11:38Z,https://web.archive.org/web/20230601145313/https://www.businessinsider.com/kim-jong-un-weighs-300-pounds-insomnia-lawmaker-says-ai-2023-6,"Kim Jong Un in 2019.BRENDAN SMIALOWSKI/Getty Images
<ul>
<li>A South Korean lawmaker says AI estimates that Kim Jong Un weighs about 300 pounds.</li>
<li>The North Korean dictator lives a secretive … [+1608 chars]",,en,'Kim Jong Un'
https://www.ndtv.com/india-news/rape-accused-franco-mulakkal-resigns-as-jalandhar-bishop-pope-accepts-it-4085423,https://www.ndtv.com/india-news/rape-accused-franco-mulakkal-resigns-as-jalandhar-bishop-pope-accepts-it-4085423,0,www.ndtv.com,"Rape-Accused Franco Mulakkal Resigns As Jalandhar Bishop, Pope Accepts It","Bishop Franco Mulakkal, who was temporarily relieved of his pastoral responsibilities by Pope Francis in 2018 following allegations of rape by a nun, has resigned from the Jalandhar Bishop's post.",https://c.ndtvimg.com/2023-06/3glimm9k_bishop-franco-mulakkal-reuters_625x300_01_June_23.jpg,2023-06-01T14:39:04Z,https://web.archive.org/web/20230601145342/https://www.ndtv.com/india-news/rape-accused-franco-mulakkal-resigns-as-jalandhar-bishop-pope-accepts-it-4085423,"Franco Mulakkal resigns as Jalandhar Bishop; Church says not a disciplinary measure
Thiruvananthapuram: Bishop Franco Mulakkal, who was temporarily relieved of his pastoral responsibilities by Pope … [+4011 chars]",,en,'Pope Francis'
https://www.independent.co.uk/tv/lifestyle/curtis-sittenfeld-pete-davidson-love-lives-b2349710.html,https://www.independent.co.uk/tv/lifestyle/curtis-sittenfeld-pete-davidson-love-lives-b2349710.html,0,www.independent.co.uk,Love Lives: Curtis Sittenfeld on ‘dating up’ and the Pete Davidson effect,"As soon as any female celebrity becomes single, Pete Davidson jokes and rumours aren’t far behind, with the SNL star having dated everyone from Kim Kardashian to Ariana Grande.",https://cdn.jwplayer.com/v2/media/wCx9zNVK/poster.jpg?width=720,2023-06-01T15:05:44Z,https://web.archive.org/web/20230601153558/https://www.independent.co.uk/tv/lifestyle/curtis-sittenfeld-pete-davidson-love-lives-b2349710.html,"As soon as any female celebrity becomes single, Pete Davidson jokes and rumours arent far behind, with the SNL star having dated everyone from Kim Kardashian to Ariana Grande.
But how often do we se… [+333 chars]",,en,'Kim Kardashian'
https://www.theguardian.com/us-news/2023/jun/01/jeffrey-epstein-lawsuit-jp-morgan-ceo,https://www.theguardian.com/us-news/2023/jun/01/jeffrey-epstein-lawsuit-jp-morgan-ceo,0,www.theguardian.com,JP Morgan CEO Jamie Dimon claims he had never heard of Epstein before arrest,"Testimony counters claims that the bank ignored signs of malfeasance, including Epstein’s large monthly cash withdrawalsJP Morgan CEO Jamie Dimon has said in a court deposition that he did not recall ever hearing about convicted sex trafficker Jeffrey Epstein…",https://i.guim.co.uk/img/media/967329eb648669532b6eca5f51d7b5fd4902c873/0_301_4510_2706/master/4510.jpg?width=1200&height=630&quality=85&auto=format&fit=crop&overlay-align=bottom%2Cleft&overlay-width=100p&overlay-base64=L2ltZy9zdGF0aWMvb3ZlcmxheXMvdGctZGVmYXVsdC5wbmc&enable=upscale&s=ffd738f8b0412067fd122370073c57d6,2023-06-01T15:20:54Z,https://web.archive.org/web/20230601153550/https://www.theguardian.com/us-news/2023/jun/01/jeffrey-epstein-lawsuit-jp-morgan-ceo,JP Morgan CEO Jamie Dimon has said in a court deposition that he did not recall ever hearing about convicted sex trafficker Jeffrey Epstein or his sexual abuse crimes against teenage girls until the … [+4270 chars],,en,'Jeffrey Epstein'
https://www.huffpost.com/entry/love-and-sports-activewear-walmart_l_64777343e4b045ce24861738,https://www.huffpost.com/entry/love-and-sports-activewear-walmart_l_64777343e4b045ce24861738,0,www.huffpost.com,You Can Shop This Michelle Obama-Approved Designer’s Activewear At Walmart,Your sports bras and leggings are about to get an executive upgrade.,https://img.huffingtonpost.com/asset/64778f512500001a000f228d.png?cache=KxSGgh08l8&ops=1200_630,2023-06-01T15:45:03Z,https://web.archive.org/web/20230601155619/https://www.huffpost.com/entry/love-and-sports-activewear-walmart_l_64777343e4b045ce24861738,"Activewear looks from Love &amp; Sports
Michelle Smith is known to many as the former creative director of fashion brand Milly, which was famously responsible for the dress that former First Lady Mi… [+1678 chars]",,en,'Michelle Obama'
https://www.newsweek.com/kevin-mccarthys-colossal-triumph-1803876,https://www.newsweek.com/kevin-mccarthys-colossal-triumph-1803876,0,www.newsweek.com,Kevin McCarthy's Colossal Triumph,"Kevin McCarthy could emerge ""stronger from this fight, not weaker,"" according to a top political scientist.",https://d.newsweek.com/en/full/2241627/speaker-kevin-mccarthy-addresses-press.jpg,2023-06-01T15:47:30Z,https://web.archive.org/web/20230601160947/https://www.newsweek.com/kevin-mccarthys-colossal-triumph-1803876,"On Wednesday, the House of Representatives approved the debt ceiling deal negotiated by President Biden and Speaker McCarthy by 314 votes to 117, in a move that could prevent the U.S. from defaulting… [+4153 chars]",,en,'Chip Somodevilla'
https://www.foxnews.com/world/kim-jong-un-packs-on-pounds-battles-insomnia-heavy-drinking-smoking-report,https://www.foxnews.com/world/kim-jong-un-packs-on-pounds-battles-insomnia-heavy-drinking-smoking-report,0,www.foxnews.com,"Kim Jong Un packs on pounds, battles insomnia amid heavy drinking and smoking: Report","North Korean leader Kim Jong Un is suffering from insomnia while abusing alcohol and tobacco, said South Korean intelligence, spawning more speculation about his health.",https://static.foxnews.com/foxnews.com/content/uploads/2022/05/AP22119069756273.jpg,2023-06-01T16:41:36Z,https://web.archive.org/web/20230601164902/https://www.foxnews.com/world/kim-jong-un-packs-on-pounds-battles-insomnia-heavy-drinking-smoking-report,"South Korea's intelligence service believes that North Korea's leader could be suffering from insomnia while abusing alcohol and tobacco.
South Korean lawmaker Yoo Sang-bum, who serves as the execut… [+2197 chars]",,en,'Kim Jong Un'
https://www.mirror.co.uk/3am/us-celebrity-news/kim-banned-tv-north-kanye-30133856,https://www.mirror.co.uk/3am/us-celebrity-news/kim-banned-tv-north-kanye-30133856,0,www.mirror.co.uk,"Kim Kardashian bans TV in her house to protect North, 9, from dad Kanye West's antics","Kim Kardashian has made it her priority to protect her children, especially her eldest daughter North West, from their father Kanye West's eyebrow-raising behaviour.",https://i2-prod.mirror.co.uk/incoming/article30133345.ece/ALTERNATES/s1200/0_Warriors-Lakers-Basketball-23133137624625.jpg,2023-06-01T16:55:34Z,https://web.archive.org/web/20230601173029/https://www.mirror.co.uk/3am/us-celebrity-news/kim-banned-tv-north-kanye-30133856,"Kim Kardashian has revealed that she has banned her eldest daughter North West from watching television to protect her from her father Kanye West 's antics. 
Rapper Kanye, 45, has frequently hit the… [+2797 chars]",,en,'Kanye West'
https://www.dailymail.co.uk/tvshowbiz/article-12149463/Kim-Kardashian-reveals-continues-film-TV-series-16-years.html,https://www.dailymail.co.uk/tvshowbiz/article-12149463/Kim-Kardashian-reveals-continues-film-TV-series-16-years.html,0,www.dailymail.co.uk,Kim Kardashian reveals why she continues to film her TV series after 16 years,"Kim argued she gives a lot to her reality TV show. 'I give a lot,' the billionaire stated firmly. 'Khloe and I, we give real content. We're sharing every last detail of our lives.'",https://i.dailymail.co.uk/1s/2023/06/01/18/71664255-0-image-a-110_1685641631836.jpg,2023-06-01T17:48:09Z,https://web.archive.org/web/20230601182414/https://www.dailymail.co.uk/tvshowbiz/article-12149463/Kim-Kardashian-reveals-continues-film-TV-series-16-years.html,"Kim Kardashian was on the defensive on Wednesday's episode of The Kardashians on Hulu.
The 42-year-old addressed criticism that she does not share enough about her personal life on the show and is j… [+3499 chars]",,en,'Kim Kardashian'
http://www.thehollywoodgossip.com/2023/06/kim-kardashian-i-spend-all-my-time-protecting-my-kids-from-kanyes-insanity/,http://www.thehollywoodgossip.com/2023/06/kim-kardashian-i-spend-all-my-time-protecting-my-kids-from-kanyes-insanity/,0,www.thehollywoodgossip.com,Kim Kardashian: I Spend All My Time Protecting My Kids From Kanye’s Insanity!,"When Kim Kardashian divorced Kanye West, she probably did so in the hope that she would be leaving the most …
Kim Kardashian: I Spend All My Time Protecting My Kids From Kanye’s Insanity! was originally published on The Hollywood Gossip.",https://cdn.thehollywoodgossip.com/uploads/2023/06/Screenshot-2023-06-01-at-1.08.42-PM.png,2023-06-01T17:49:35Z,,"When Kim Kardashian divorced Kanye West, she probably did so in the hope that she would be leaving the most bonkers chapter of her life behind her.
Little did she know, the rapper and lunatic was sa… [+2958 chars]",,en,'Kim Kardashian'
https://www.politico.eu/article/robert-habeck-germany-picks-up-climate/,https://www.politico.eu/article/robert-habeck-germany-picks-up-climate/,0,www.politico.eu,From hero to zero: Germany’s Robert Habeck picks up the climate tab,"Once seen as a possibility for Germany's next chancellor, energy policy backlash has put him and his Greens down — and the far-right up.","https://www.politico.eu/cdn-cgi/image/width=1200,height=630,fit=crop,quality=80,onerror=redirect/wp-content/uploads/2023/06/01/GettyImages-1258306893-scaled.jpg",2023-06-01T18:20:22Z,,"Press play to listen to this article
Voiced by artificial intelligence.
BERLIN There was a time when Robert Habeck seemed unstoppable.
Throughout last spring and summer, the German vice chancellor… [+8760 chars]",,en,'Robert Habeck'
https://www.dailymail.co.uk/femail/article-12149427/Fans-convinced-spotted-Middletons-wedding-Jordan.html,https://www.dailymail.co.uk/femail/article-12149427/Fans-convinced-spotted-Middletons-wedding-Jordan.html,0,www.dailymail.co.uk,Fans are convinced they have spotted Middletons at wedding in Jordan,Fans have taken to Twitter to speculate after a livestream of the royal wedding reception at the Al Husseiniya Palace appeared to show Pippa and Carole Middleton among the crowd.,https://i.dailymail.co.uk/1s/2023/06/01/18/71664025-0-image-a-53_1685640765813.jpg,2023-06-01T18:21:55Z,https://web.archive.org/web/20230601185609/https://www.dailymail.co.uk/femail/article-12149427/Fans-convinced-spotted-Middletons-wedding-Jordan.html,"As 4,000 guests descend on the Al Husseiniya Palace in Jordan for the wedding reception of Crown Prince Hussein and Rajwa Al-Saif, royal fans think they may have spotted some familiar faces among the… [+2882 chars]",,en,'Pippa Middleton'
https://etcanada.com/news/996360/forbes-2023-celebrates-americas-richest-self-made-women-including-rihanna-kylie-jenner-kim-kardashian-taylor-swift-beyonce/,https://etcanada.com/news/996360/forbes-2023-celebrates-americas-richest-self-made-women-including-rihanna-kylie-jenner-kim-kardashian-taylor-swift-beyonce/,0,etcanada.com,"Forbes 2023 Celebrates America’s Richest Self-Made Women, Including Rihanna, Kylie Jenner, Kim Kardashian, Taylor Swift & Beyoncé","With the publication of Forbes' list of America's richest self-made women this year, superstars Rihanna, Kylie Jenner, Kim Kardashian, Taylor Swift and Beyoncé have topped the charts. With a ""self-made score"" of 10, Rihanna is in first place, coming in at No.…",https://etcanada.com/wp-content/uploads/2023/06/New-Project.png?w=720&h=480&crop=1,2023-06-01T18:26:10Z,,"With the publication of Forbes‘ list of America’s richest self-made women this year, superstars Rihanna, Kylie Jenner, Kim Kardashian, Taylor Swift and Beyoncé have topped the charts.
With a “self-m… [+1212 chars]",,en,'Kim Kardashian'
https://radaronline.com/p/kim-kardashian-crosses-the-wga-picket-line-to-film-american-horror-story/,https://radaronline.com/p/kim-kardashian-crosses-the-wga-picket-line-to-film-american-horror-story/,0,radaronline.com,Kim Kardashian Blasted for Crossing WGA Picket Line as Strike Rages On: 'Now Part of Her Public Image',Kim Kardashian was called out for crossing the WGA picket line to film 'American Horror Story' in New York City.,https://media.radaronline.com/brand-img/0XP92abV7/1200x628/aaaa-2023-06-01t104713760-1685636529905.png,2023-06-01T18:30:00Z,,"Kim Kardashian is facing intense criticism for crossing the Writers Guild of America (WGA) picket line in New York City to film for the upcoming season of American Horror Story, RadarOnline.comhas le… [+425 chars]",,en,'Kim Kardashian'
https://www.forbes.com/sites/bradadgate/2023/06/01/in-may-fox-news-lost-nearly-one-third-of-its-primetime-audience/,https://www.forbes.com/sites/bradadgate/2023/06/01/in-may-fox-news-lost-nearly-one-third-of-its-primetime-audience/,0,www.forbes.com,"In May, Fox News Lost Nearly One-Third Of Its Primetime Audience","While Fox News continues to be a top rated cable network, with the departure of top-rated Tucker Carlson, ratings dropped notably in May",https://imageio.forbes.com/specials-images/imageserve/6478e6c8fa8f5e7a5688d95d/0x0.jpg?format=jpg&width=1200,2023-06-01T18:45:59Z,https://web.archive.org/web/20230601185746/https://www.forbes.com/sites/bradadgate/2023/06/01/in-may-fox-news-lost-nearly-one-third-of-its-primetime-audience/,"With Tucker Carlson's sudden ouster, Fox News prime time audience has dropped by 32% in one month. ... [+] Carlson's 8 p.m. (ET) program has declined by 50%. (Photo by Spencer Platt/Getty Images)
Ge… [+4506 chars]",,en,'Tucker Carlson'
https://www.wnd.com/2023/06/legendary-director-announces-making-film-jesus-2/,https://www.wnd.com/2023/06/legendary-director-announces-making-film-jesus-2/,0,www.wnd.com,Legendary director announces he's making a film about Jesus,"(IJR) – While visiting the Vatican over the weekend, acclaimed director Martin Scorsese announced that he plans to make a new film about Jesus, according to reports. Scorsese briefly met with Pope Francis prior to the declaration of his future cinematic visio…",https://www.wnd.com/wp-content/uploads/2022/06/film-movie-reel-Unsplash.jpg,2023-06-01T18:51:09Z,https://web.archive.org/web/20230601190225/https://www.wnd.com/2023/06/legendary-director-announces-making-film-jesus-2/,"(Image courtesy Unsplash)
(IJR) While visiting the Vatican over the weekend, acclaimed director Martin Scorsese announced that he plans to make a new film about Jesus, according to reports.
Scorses… [+554 chars]",,en,'Martin Scorsese'
https://dailycaller.com/2023/06/01/kim-jong-un-north-korea-weight-health-smoking-300/,https://dailycaller.com/2023/06/01/kim-jong-un-north-korea-weight-health-smoking-300/,0,dailycaller.com,"Kim Jong Un Has Ballooned To 300+ Pounds Due To Constant Smoking And Drinking, Spies Allege","Kim Jong Un is believed to have put on weight, crossing the 300-pound threshold due to smoking and alcohol, Reuters reported citing South Korean intelligence.",https://cdn01.dailycaller.com/wp-content/uploads/2023/06/GettyImages-1246939690-scaled-e1685645814346.jpg,2023-06-01T19:18:05Z,https://web.archive.org/web/20230601205154/https://dailycaller.com/2023/06/01/kim-jong-un-north-korea-weight-health-smoking-300/,"North Korean dictator Kim Jong Un is believed to have put on weight, crossing the 300-pound threshold due to rampant smoking and alcohol use, Reuters reported citing South Korean intelligence.
A Sou… [+1711 chars]",,en,'Kim Jong Un'
https://freerepublic.com/focus/f-news/4157632/posts,https://freerepublic.com/focus/f-news/4157632/posts,0,freerepublic.com,Nolte: May Ratings Collapse — Fox Loses Third of Viewers Without Tucker Carlson,"May was the Fox News Channel’s first full month without Tucker Carlson and it cost them 32 percent of primetime viewers. Cuck News dropped Tucker Carlson’s primetime show in late April. To keep Carlson silent, he is still technically employed by the Fox fasci…",,2023-06-01T19:23:45Z,,"Skip to comments.
Nolte: May Ratings Collapse Fox Loses Third of Viewers Without Tucker CarlsonBreitbart ^
 | 6/1/23
 | Nick Nolte
Posted on 06/01/2023 12:23:45 PM PDT by CFW
May was the Fox New… [+2653 chars]",,en,'Tucker Carlson'
https://biztoc.com/x/53cd45b21b265779,https://biztoc.com/x/53cd45b21b265779,0,biztoc.com,"Kim Kardashian Refuses to Be Kanye West's ""Clean-Up Crew""","Kim Kardashian was hitting her breaking point with ex-husband Kanye West on the latest Kardashians. Thursday's episode picked up where last week's left off, as Kim cried to mom Kris Jenner about the impact of Kanye’s erratic actions, which at the time had inv…",https://c.biztoc.com/p/53cd45b21b265779/s.webp,2023-06-01T19:40:07Z,https://web.archive.org/web/20230601211146/https://biztoc.com/x/53cd45b21b265779,"Kim Kardashian was hitting her breaking point with ex-husband Kanye West on the latest Kardashians.Thursday's episode picked up where last week's left off, as Kim cried to mom Kris Jenner about the i… [+282 chars]",,en,'Kim Kardashian'
https://hiphopdx.com/news/kanye-west-pockets-25m-from-adidas-yeezy-backstock,https://hiphopdx.com/news/kanye-west-pockets-25m-from-adidas-yeezy-backstock,0,hiphopdx.com,Kanye West Reportedly Pockets $25M From Adidas As Yeezy Backstock Flies Off Shelves,Kanye West is reportedly $25million richer after the remaining Yeezy stock from his fractured partnership with adidas sold out on its first day at rapid pace.,https://static.hiphopdx.com/2023/06/kanye-west-reportedly-pockets-25-m-from-adidas-as-yeezy-backstock-flies-off-shelves-1200x675.jpg,2023-06-01T20:00:10Z,https://web.archive.org/web/20230601200439/https://hiphopdx.com/news/kanye-west-pockets-25m-from-adidas-yeezy-backstock,"Kanye West has reportedly pocketed $25million from adidas in just 24 hours after leftover Yeezy stock from the pairs dysfunctional partnership flew off the shelves this week.
The German sports giant… [+3292 chars]",,en,'Kanye West'
https://www.nzherald.co.nz/entertainment/kim-kardashians-warning-to-pete-davidson-revealed-in-new-episode-of-the-kardashians/SOREBDTYDVB3TDKXEL543QH3MQ/,https://www.nzherald.co.nz/entertainment/kim-kardashians-warning-to-pete-davidson-revealed-in-new-episode-of-the-kardashians/SOREBDTYDVB3TDKXEL543QH3MQ/,0,www.nzherald.co.nz,Kim Kardashian’s warning to Pete Davidson revealed in new episode of The Kardashians,The couple dated for nine months between November 2021 and August 2022.,https://www.nzherald.co.nz/resizer/2LQmpDBZqLhYLPU3U2Ij8hzw6Ag=/1200x675/smart/filters:quality(70)/cloudfront-ap-southeast-2.images.arcpublishing.com/nzme/VC5RNMHLJVAJXFP4ODRR6MT3Q4.jpg,2023-06-01T20:10:35Z,https://web.archive.org/web/20230601214449/https://www.nzherald.co.nz/entertainment/kim-kardashians-warning-to-pete-davidson-revealed-in-new-episode-of-the-kardashians/SOREBDTYDVB3TDKXEL543QH3MQ/,"Pete Davidson, and Kim Kardashian chat with Usher at The Met Gala. Photo / Getty ImagesKim Kardashian had a stern warning for Pete Davidson when they first started dating.
Talking about their relati… [+3027 chars]",,en,'Kim Kardashian'
https://www.vox.com/politics/2023/2/23/23611828/2024-republican-presidential-candidates-trump-pence-christie,https://www.vox.com/politics/2023/2/23/23611828/2024-republican-presidential-candidates-trump-pence-christie,0,www.vox.com,"All the Republicans running for president in 2024, explained",Former Vice President Mike Pence and New Jersey Gov. Chris Christie are set to announce their candidacies next week.,https://cdn.vox-cdn.com/thumbor/XGIfNy1tmo_LogamRTDZsY0Ll4Y=/0x0:8322x4357/fit-in/1200x630/cdn.vox-cdn.com/uploads/chorus_asset/file/24696960/1252176909.jpg,2023-06-01T20:12:28Z,,"Former US Vice President Mike Pence speaks during the Federalist Society’s Executive Branch Review Conference at the Mayflower Hotel April 25, 2023, in Washington, DC. | Drew Angerer/Getty Images

 … [+19619 chars]",,en,'Mike Pence'
https://variety.com/2023/music/news/kanye-west-sued-paparazzi-photographer-throwing-phone-1235630756/,https://variety.com/2023/music/news/kanye-west-sued-paparazzi-photographer-throwing-phone-1235630756/,0,variety.com,Kanye West Sued by Paparazzi Photographer for Grabbing and Throwing Her Phone: ‘He Has No Right to Assault Me’,"A paparazzi photographer is suing Ye — the musician formerly known as Kanye West — for assault, battery and negligence after he was caught on-camera grabbing her phone and throwing it into the street. The photographer, Nichol Lechmanik, says she was just doin…",https://variety.com/wp-content/uploads/2022/10/Kanye-West-4.jpg?w=1000&h=563&crop=1,2023-06-01T20:21:31Z,https://web.archive.org/web/20230601202337/https://variety.com/2023/music/news/kanye-west-sued-paparazzi-photographer-throwing-phone-1235630756/,"A paparazzi photographer is suing Ye — the musician formerly known as Kanye West — for assault, battery and negligence after he was caught on-camera grabbing her phone and throwing it into the street… [+4693 chars]",,en,'Kim Kardashian'
https://conservativebrief.com/perino-73764/,https://conservativebrief.com/perino-73764/,0,conservativebrief.com,Fox News' Dana Perino Discusses Health 'Incident' With Her Doc On Live Segment,"Long-time Fox News host and former White House press secretary for President George W. Bush revealed a health ""incident"" live on the air in a segment with her doctor. During the segment, Perino was jo",https://conservativebrief.com/wp-content/uploads/2023/06/Fox-News-Perino.jpg,2023-06-01T20:42:32Z,,"Advertisement
OPINION: This article may contain commentary which reflects the author's opinion.
Long-time Fox News host and former White House press secretary for President George W. Bush revealed … [+3580 chars]",,en,'George Bush'
