index,url,valid,domain,title,description,image,published,archive,content,quote,language,keyword
https://www.bostonherald.com/2024/12/01/biden-pardons-his-son-hunter-despite-previous-pledges-not-to/,https://www.bostonherald.com/2024/12/01/biden-pardons-his-son-hunter-despite-previous-pledges-not-to/,0,www.bostonherald.com,Biden pardons his son Hunter despite previous pledges not to,"President Joe Biden pardoned his son, Hunter, on Sunday night, sparing the younger Biden a possible prison sentence for federal felony gun and tax convictions and reversing his past promises not to use the extraordinary powers of the presidency for the benefi…",https://www.bostonherald.com/wp-content/uploads/2024/12/Biden_AIDS_Day_30758.jpg?w=1024&h=683,2024-12-02T00:37:18Z,https://web.archive.org/web/20241203023536/https://www.bostonherald.com/2024/12/01/biden-pardons-his-son-hunter-despite-previous-pledges-not-to/,"By ZEKE MILLER, ALANNA DURKIN RICHER and COLLEEN LONG
WASHINGTON (AP) — President Joe Biden pardoned his son, Hunter, on Sunday night, sparing the younger Biden a possible prison sentence for federa… [+7964 chars]",,en,'James Comer'
https://www.yahoo.com/news/biden-pardons-son-hunter-despite-003718639.html,https://www.yahoo.com/news/biden-pardons-son-hunter-despite-003718639.html,0,www.yahoo.com,Biden pardons his son Hunter despite previous pledges not to,"President Joe Biden pardoned his son, Hunter, sparing the younger Biden a possible prison sentence for federal felony gun and tax convictions and reversing...",https://s.yimg.com/ny/api/res/1.2/WY1rOloNfwOzRaK4z1qM8w--/YXBwaWQ9aGlnaGxhbmRlcjt3PTEyMDA7aD04MDA-/https://media.zenfs.com/en/ap.org/7e47915ff35696353b9647926256779b,2024-12-02T00:37:18Z,http://archive.md/20241202032829/https://www.yahoo.com/news/biden-pardons-son-hunter-despite-003718639.html,"Yahoo is using AI to generate takeaways from this article. This means the info may not always match what's in the article. Reporting mistakes helps us improve the experience.Generate Key Takeaways
W… [+8145 chars]",,en,'Joe Biden'
https://www.cbc.ca/news/world/joe-biden-pardons-son-hunter-gun-tax-charges-1.7398369,https://www.cbc.ca/news/world/joe-biden-pardons-son-hunter-gun-tax-charges-1.7398369,0,www.cbc.ca,"Joe Biden pardons son Hunter of gun, tax convictions, despite promise he wouldn't do so","U.S. President Joe Biden pardoned his son, Hunter, on Sunday of gun and tax convictions, despite previous promises that he would not do so.",https://i.cbc.ca/1.7398370.1733099711!/fileImage/httpImage/image.jpg_gen/derivatives/16x9_620/biden.jpg,2024-12-02T00:45:41Z,,"U.S. President Joe Biden on Sunday night pardoned his son, Hunter, sparing the younger Biden a possible prison sentence for federal felony gun and tax convictions and reversing his past promises not … [+8303 chars]",,en,'Joe Biden'
https://www.abc.net.au/news/2024-12-02/joe-biden-pardons-his-son-hunter-during-last-weeks-in-office/104672384,https://www.abc.net.au/news/2024-12-02/joe-biden-pardons-his-son-hunter-during-last-weeks-in-office/104672384,0,www.abc.net.au,"Joe Biden pardons son Hunter in final weeks in office, despite insisting he would not",The White House says US President Joe Biden has issued a pardon for his son Hunter Biden.,https://live-production.wcms.abc-cdn.net.au/27a17bdb4c884f2533a716b7b1038123?impolicy=wcms_watermark_news&cropH=2813&cropW=5000&xPos=0&yPos=332&width=862&height=485&imformat=generic,2024-12-02T00:46:53Z,https://web.archive.org/web/20241202032111/https://www.abc.net.au/news/2024-12-02/joe-biden-pardons-his-son-hunter-during-last-weeks-in-office/104672384,"US President Joe Biden has issued a pardon for his son Hunter Biden, who had been convicted of gun charges and pleaded guilty to federal tax charges.
""From the day I took office, I said I would not … [+9164 chars]",,en,'Hunter Biden'
https://www.dailysignal.com/2024/12/01/breaking-joe-biden-pardons-son-hunter-claims-selective-prosecution/,https://www.dailysignal.com/2024/12/01/breaking-joe-biden-pardons-son-hunter-claims-selective-prosecution/,0,www.dailysignal.com,"BREAKING: Joe Biden Pardons Son Hunter, Claims ‘Selective’ Prosecution","President Joe Biden issued a pardon to his son, Hunter Biden, the White House announced Sunday evening. The president claimed that the charges against his... Read More
The post BREAKING: Joe Biden Pardons Son Hunter, Claims ‘Selective’ Prosecution appeared fi…",https://www.dailysignal.com/wp-content/uploads/2024/12/Joe-hugs-Hunter-Biden.jpg,2024-12-02T01:13:33Z,https://web.archive.org/web/20241202112745/https://www.dailysignal.com/2024/12/01/breaking-joe-biden-pardons-son-hunter-claims-selective-prosecution/,"President Joe Biden issued a pardon to his son, Hunter Biden, the White House announced Sunday evening. The president claimed that the charges against his son were brought selectively and unfairly. P… [+4266 chars]",,en,'Hunter Biden'
https://fortune.com/2024/12/01/joe-biden-pardon-son-hunter-gun-trial-drugs-tax-evasion-felony-misdemeanor/,https://fortune.com/2024/12/01/joe-biden-pardon-son-hunter-gun-trial-drugs-tax-evasion-felony-misdemeanor/,0,fortune.com,Biden pardons his son Hunter despite previous pledges not to,The president had previously said he would not pardon his son or commute his sentence after his convictions in the two cases in Delaware and California.,"https://fortune.com/img-assets/wp-content/uploads/2024/12/AP24337029525062-e1733105980448.jpg?resize=1200,600",2024-12-02T02:26:15Z,https://web.archive.org/web/20241203025923/https://fortune.com/2024/12/01/joe-biden-pardon-son-hunter-gun-trial-drugs-tax-evasion-felony-misdemeanor/,"President Joe Biden pardoned his son, Hunter, on Sunday night, sparing the younger Biden a possible prison sentence for federal felony gun and tax convictions and reversing his past promises not to u… [+7841 chars]",,en,'James Comer'
https://www.abc.net.au/news/2024-12-02/meta-forces-financial-advertisers-verify-information-scams/104672484,https://www.abc.net.au/news/2024-12-02/meta-forces-financial-advertisers-verify-information-scams/104672484,0,www.abc.net.au,Meta announces new rules for financial advertisers in bid to crack down on celebrity scam ads,"Under two new changes, financial advertisers on Facebook and Instagram will be required to reveal who is paying for the ads and who benefits from them.",https://live-production.wcms.abc-cdn.net.au/5295712b38493e64f92bce8f01f9c937?impolicy=wcms_watermark_news&cropH=1474&cropW=2621&xPos=0&yPos=136&width=862&height=485&imformat=generic,2024-12-02T03:55:15Z,,"Meta has bowed to pressure to tackle deep fake images of public figures and celebrities by bringing in new advertising rules to target scammers.
The scams use images of famous people such as David K… [+4900 chars]",,en,'David Koch'
https://biztoc.com/x/8cbb2b3a7b89987f,https://biztoc.com/x/8cbb2b3a7b89987f,0,biztoc.com,"What to stream: Sabrina Carpenter holiday special, ‘Beetlejuice Beetlejuice’ and Rosé goes solo","Sabrina Carpenter hosting a holiday variety music special on Netflix and Keira Knightley and Ben Whishaw playing a spy and an assassin in the TV series “Black Doves"" are some of this week’s new streaming entertainment releases.",https://biztoc.com/cdn/808/og.png,2024-12-02T05:07:28Z,,"Sabrina Carpenter hosting a holiday variety music special on Netflix and Keira Knightley and Ben Whishaw playing a spy and an assassin in the TV series Black Doves"" are some of this weeks new streami… [+88 chars]",,en,'Sabrina Carpenter'
https://nypost.com/2024/12/02/us-news/congressional-republicans-rip-biden-for-about-face-pardon-of-son-hunter-so-corrupt/,https://nypost.com/2024/12/02/us-news/congressional-republicans-rip-biden-for-about-face-pardon-of-son-hunter-so-corrupt/,0,nypost.com,Congressional Republicans rip Biden for about-face pardon of son Hunter: ‘So corrupt’,Congressional Republicans ripped into President Biden after he issued a pardon for his son Sunday night – hammering the lame-duck commander in chief for reversing his vow not to intervene in Hunter's federal criminal cases.,https://nypost.com/wp-content/uploads/sites/2/2024/12/gop-pols-react-biden-pardon-94620482.jpg?quality=75&strip=all&w=1024,2024-12-02T05:41:58Z,http://archive.md/20241203034945/https://nypost.com/2024/12/02/us-news/congressional-republicans-rip-biden-for-about-face-pardon-of-son-hunter-so-corrupt/,Congressional Republicans ripped into President Biden after he issued a pardon for his son Sunday night hammering the lame-duck commander in chief for reversing his vow not to intervene in Hunter’s f… [+3898 chars],,en,'Hunter Biden'
https://www.naturalnews.com/2024-12-02-reid-hoffman-considers-leaving-us-trump-win.html,https://www.naturalnews.com/2024-12-02-reid-hoffman-considers-leaving-us-trump-win.html,0,www.naturalnews.com,LinkedIn co-founder Reid Hoffman considers leaving the U.S. following Trump’s election win,"Reid Hoffman, the founder of professional social networking platform LinkedIn, is considering emigrating from the United States following the victory of President-elect Donald Trump last month. Citing the New York Times, the National Pulse reported that Hoffm…",https://www.naturalnews.com/wp-content/uploads/sites/91/2024/12/reid-hoffman-linkedin.jpg,2024-12-02T06:00:00Z,https://web.archive.org/web/20241203133016/https://www.naturalnews.com/2024-12-02-reid-hoffman-considers-leaving-us-trump-win.html,"Reid Hoffman, the founder of professional social networking platform LinkedIn, is considering emigrating from the United States following the victory of President-elect Donald Trump last month.
Citi… [+4231 chars]",,en,'Donald Trump'
https://www.naturalnews.com/2024-12-02-senate-republicans-blocking-cabinet-nominations-primary-challenges.html,https://www.naturalnews.com/2024-12-02-senate-republicans-blocking-cabinet-nominations-primary-challenges.html,0,www.naturalnews.com,"Senate Republicans blocking Trump’s cabinet nominations will face primary challenges funded by Elon Musk, Trump’s advisors warn",Senate Republicans had been warned that blocking President-elect Donald Trump’s cabinet nominations will see them facing primary challenges funded by Big Tech mogul Elon Musk. Musk was instrumental in bankrolling Trump’s presidential campaign and has been wei…,https://www.naturalnews.com/wp-content/uploads/sites/91/2024/12/Donald-Trump-Elon-Musk.jpg,2024-12-02T06:00:00Z,https://web.archive.org/web/20241204030552/https://www.naturalnews.com/2024-12-02-senate-republicans-blocking-cabinet-nominations-primary-challenges.html,"Senate Republicans had been warned that blocking President-elect Donald Trump's cabinet nominations will see them facing primary challenges funded by Big Tech mogul Elon Musk.
Musk was instrumental … [+4867 chars]",,en,'Nikki Haley'
https://www.newsweek.com/russia-zakharova-hunter-biden-pardon-president-1993891,https://www.newsweek.com/russia-zakharova-hunter-biden-pardon-president-1993891,0,www.newsweek.com,Russia Responds to Hunter Biden Pardon: 'Caricature of Democracy',Russian Foreign Ministry spokeswoman Maria Zakharova has criticized the U.S. president's decision in a pro-Kremlin newspaper.,https://d.newsweek.com/en/full/2533585/president-joe-biden.jpg,2024-12-02T09:33:22Z,https://web.archive.org/web/20241202161618/https://www.newsweek.com/russia-zakharova-hunter-biden-pardon-president-1993891,"Russia has criticized the decision by President Joe Biden to pardon his son Hunter who was set to be sentenced on federal felony gun and tax convictions.
In a reversal of his stance in which he said… [+3024 chars]",,en,'Hunter Biden'
http://deadline.com/2024/12/angelina-jolie-maria-star-on-ageing-1236190804/,http://deadline.com/2024/12/angelina-jolie-maria-star-on-ageing-1236190804/,0,deadline.com,‘Maria’ Star Angelina Jolie Says She Is Landing “Better Work” As She Gets Older,"Angelina Jolie isn’t worried about age impacting her acting career, as her turn as Maria Callas continues to garner rave reviews. The Maria star told The Sunday Times newspaper, “I’ve got better work as I’ve got older,” in an interview published over the week…",https://deadline.com/wp-content/uploads/2024/11/Maria-01.jpg?w=1024,2024-12-02T09:54:26Z,https://web.archive.org/web/20241202114928/https://deadline.com/2024/12/angelina-jolie-maria-star-on-ageing-1236190804/,"Angelina Jolie isn’t worried about age impacting her acting career, as her turn as Maria Callas continues to garner rave reviews.
The Maria star told The Sunday Times newspaper, “I’ve got better wor… [+1709 chars]",,en,'Angelina Jolie'
https://www.cosmopolitan.com/entertainment/celebs/a63067851/prince-william-secret-calendar-king-charles/,https://www.cosmopolitan.com/entertainment/celebs/a63067851/prince-william-secret-calendar-king-charles/,0,www.cosmopolitan.com,Prince William Keeps a Secret Calendar That He Won't Give King Charles Access To,Prince William allegedly keeps a secret calendar that King Charles doesn't have access to.,"https://hips.hearstapps.com/hmg-prod/images/prince-william-prince-of-wales-known-as-the-duke-of-news-photo-1733145602.jpg?crop=1xw:0.75xh;center,top&resize=1200:*",2024-12-02T13:24:00Z,https://web.archive.org/web/20241203040116/https://www.cosmopolitan.com/entertainment/celebs/a63067851/prince-william-secret-calendar-king-charles/,"The vibes appear to be 
somewhat
very tense between Prince William and King Charles lately, largely because William is out here planning his ascension to the throne while Charles is literally still… [+1334 chars]",,en,'Prince William'
http://wwd.com/pop-culture/celebrity-news/fashion-awards-2024-london-red-carpet-celebrity-photos-1989-2023-princess-diana-rihanna-photos-1236742606/,http://wwd.com/pop-culture/celebrity-news/fashion-awards-2024-london-red-carpet-celebrity-photos-1989-2023-princess-diana-rihanna-photos-1236742606/,0,wwd.com,The British Fashion Awards Then and Now: Celebrities on the Red Carpet Through the Years,"From Princess Diana's 1989 Catherine Walker look to Rihanna, Lady Gaga and Sabrina Carpenter, see what celebrities have worn to the annual fundraising event.",https://wwd.com/wp-content/uploads/2024/12/Unknown-1.jpeg?w=1000&h=563&crop=1,2024-12-02T13:28:11Z,https://web.archive.org/web/20241202235432/https://wwd.com/pop-culture/celebrity-news/fashion-awards-2024-london-red-carpet-celebrity-photos-1989-2023-princess-diana-rihanna-photos-1236742606/,"The 2024 Fashion Awards will take place Monday night at Royal Albert Hall, with along list of celebrities and designers set to attend. John Galliano, Jonathan Anderson and Miuccia Prada are among six… [+2831 chars]",,en,'Princess Diana'
https://www.bbc.com/news/articles/ceql5v5v0xlo,https://www.bbc.com/news/articles/ceql5v5v0xlo,0,www.bbc.com,What has Joe Biden said in the past about pardoning his son?,The US president has previously vowed not to intervene in his son's case.,https://ichef.bbci.co.uk/news/1024/branded_news/207c/live/1ada9f90-b0b1-11ef-8403-a73d519cc056.jpg,2024-12-02T14:07:12Z,https://web.archive.org/web/20241202142941/https://www.bbc.com/news/articles/ceql5v5v0xlo,"Since Hunter Biden's conviction on federal felony gun and tax charges over the summer, the White House has insisted that President Joe Biden had no intention of pardoning his son.
But on Sunday, the… [+4044 chars]",,en,'Joe Biden'
https://sputnikglobe.com/20241202/breakdown-of-legal-scandals-hanging-over-hunter-bidens-head-before-dads-pardon-1121070065.html,https://sputnikglobe.com/20241202/breakdown-of-legal-scandals-hanging-over-hunter-bidens-head-before-dads-pardon-1121070065.html,0,sputnikglobe.com,Breakdown of Legal Scandals Hanging Over Hunter Biden's Head Before Dad's Pardon,"Joe Biden pardoned his son Hunter Sunday before jetting off on a trip to Africa, signing the pardon despite repeated pledges “not to interfere” with the DoJ's work. What was Hunter convicted of? What other crimes has he been accused of? As the Bidens' decades…",https://cdn1.img.sputnikglobe.com/images/sharing/article/eng/1121070065.jpg?11210701691733149226,2024-12-02T14:18:37Z,https://web.archive.org/web/20241202150136/https://sputnikglobe.com/20241202/breakdown-of-legal-scandals-hanging-over-hunter-bidens-head-before-dads-pardon-1121070065.html,"Sputnik brings you all the latest breaking stories, expert analysis and videos from North and South America.
https://sputnikglobe.com/20241202/breakdown-of-legal-scandals-hanging-over-hunter-bidens-… [+14686 chars]",,en,'Joe Biden'
https://www.cosmopolitan.com/entertainment/celebs/a63067988/kate-middleton-prince-william-at-odds-prince-george-school/,https://www.cosmopolitan.com/entertainment/celebs/a63067988/kate-middleton-prince-william-at-odds-prince-george-school/,0,www.cosmopolitan.com,"Kate Middleton and Prince William Are at Odds Over Prince George, Leaving Kate ""Heartbroken""","Kate Middleton and Prince William are at odds over Prince George's education, leaving Kate ""heartbroken.""","https://hips.hearstapps.com/hmg-prod/images/prince-william-prince-of-wales-and-catherine-princess-of-news-photo-1733147558.jpg?crop=1.00xw:0.405xh;0,0.108xh&resize=1200:*",2024-12-02T14:33:00Z,,"Looks like Kate Middleton and Prince William are not exactly seeing eye-to-eye when it comes to their eldest son (and eventual heir to the throne) Prince George's education. 
The couple's three chil… [+1317 chars]",,en,'Kate Middleton'
https://www.cosmopolitan.com/entertainment/celebs/a63068255/prince-harry-meghan-markle-snubbed-royals-christmas-2024/,https://www.cosmopolitan.com/entertainment/celebs/a63068255/prince-harry-meghan-markle-snubbed-royals-christmas-2024/,0,www.cosmopolitan.com,Prince Harry and Meghan Markle Weren't Invited to Christmas With the Royals This Year,"They royals snubbed Prince Harry and Meghan Markle, and didn't Invite them to Christmas 2024 in Sandringham.","https://hips.hearstapps.com/hmg-prod/images/prince-harry-and-meghan-markle-duke-and-duchess-of-sussex-news-photo-1733148565.jpg?crop=1.00xw:0.753xh;0,0.0357xh&resize=1200:*",2024-12-02T14:35:00Z,https://web.archive.org/web/20241203031519/https://www.cosmopolitan.com/entertainment/celebs/a63068255/prince-harry-meghan-markle-snubbed-royals-christmas-2024/,"The royals aren't any closer to mending fences with Prince Harry and Meghan Markle. According to a source who spoke to People, the couple didn't receive an invitation for Christmas in Sandringham, wh… [+1264 chars]",,en,'Meghan Markle'
http://nymag.com/intelligencer/article/what-people-are-saying-about-joe-bidens-pardon-of-hunter.html,http://nymag.com/intelligencer/article/what-people-are-saying-about-joe-bidens-pardon-of-hunter.html,0,nymag.com,What People Are Saying About Joe Biden’s Pardon of Hunter,"While some have condemned President Joe Biden’s move to pardon his son Hunter, others view it as a necessary act ahead of Trump’s second term. Here’s a look at some of the most notable opinions.",https://pyxis.nymag.com/v1/imgs/406/0e2/2a4fa6684da772c8944b5d8e2ea3c23749-hunter-biden-pardon.1x.rsocial.w1200.jpg,2024-12-02T16:37:16Z,https://web.archive.org/web/20241202165806/https://nymag.com/intelligencer/article/what-people-are-saying-about-joe-bidens-pardon-of-hunter.html,"On Sunday, President Joe Biden announced that he had issued a pardon to his son, Hunter Biden, who was set to face sentencing on federal tax and gun charges later this month. President Biden, who had… [+7925 chars]",,en,'Hunter Biden'
https://www.prdaily.com/the-scoop-hunter-biden-pardon-digs-deeper-narrative-hole-for-democrats/,https://www.prdaily.com/the-scoop-hunter-biden-pardon-digs-deeper-narrative-hole-for-democrats/,0,www.prdaily.com,The Scoop: Hunter Biden pardon digs deeper narrative hole for Democrats,"Also: Intel’s leadership change sends message to market; important economic updates for PR pros to consider. President Joe Biden has pardoned his son, Hunter Biden, erasing his criminal convictions for federal tax and gun charges. This decision, made over the…",https://s39940.pcdn.co/wp-content/uploads/2020/11/joe-biden-election-lessons.jpg,2024-12-02T17:18:08Z,,"President Joe Biden has pardoned his son, Hunter Biden, erasing his criminal convictions for federal tax and gun charges. This decision, made over the Thanksgiving holiday, occurred despite earlier s… [+6650 chars]",,en,'Hunter Biden'
https://pagesix.com/video/kate-middleton-torn-over-decision-on-prince-georges-future-schooling/,https://pagesix.com/video/kate-middleton-torn-over-decision-on-prince-georges-future-schooling/,0,pagesix.com,Kate Middleton torn over decision on Prince George’s future schooling,"Kate Middleton is reportedly “heartbroken” over a decision that she and Prince William will soon have to make about Prince George’s future. According to The Mirror, the Prince and Princess of Wales are discussing where to send their eldest child to school onc…",https://pagesix.com/wp-content/uploads/sites/3/2024/12/wp-KATE.png?w=1024,2024-12-02T18:43:16Z,https://web.archive.org/web/20241202191555/https://pagesix.com/video/kate-middleton-torn-over-decision-on-prince-georges-future-schooling/,"Kate Middleton is reportedly heartbroken over a decision that she and Prince William will soon have to make about Prince Georges future. According to The Mirror, the Prince and Princess of Wales are … [+234 chars]",,en,'Kate Middleton'
http://www.thehollywoodgossip.com/2024/12/kate-middleton-clashing-with-prince-william-over-plans-for-prince-george-report/,http://www.thehollywoodgossip.com/2024/12/kate-middleton-clashing-with-prince-william-over-plans-for-prince-george-report/,0,www.thehollywoodgossip.com,Kate Middleton Clashing With Prince William Over Plans For Prince George: Report,"Kate Middleton and Prince William reportedly cannot agree on their plans for their eldest child, Prince George. And insiders say …
Kate Middleton Clashing With Prince William Over Plans For Prince George: Report was originally published on The Hollywood Gossi…",https://cdn.thehollywoodgossip.com/uploads/2024/12/GettyImages-1372979446-1.jpg,2024-12-02T19:27:23Z,,"Kate Middleton and Prince William reportedly cannot agree on their plans for their eldest child, Prince George.
And insiders say the situation has left Kate feeling “heartbroken.”
The disagreement … [+3348 chars]",,en,'Prince George'
https://www.dailysignal.com/2024/12/02/joe-bidens-11-year-pardon-hunter-raises-important-questions-ukraine-china-corruption/,https://www.dailysignal.com/2024/12/02/joe-bidens-11-year-pardon-hunter-raises-important-questions-ukraine-china-corruption/,0,www.dailysignal.com,"Joe Biden’s 11-Year Pardon for Hunter Raises Important Questions About Ukraine, China Corruption","President Joe Biden just tacitly acknowledged what conservatives have long suspected—that Hunter Biden may be guilty of far more than just lying on a gun-registration... Read More
The post Joe Biden’s 11-Year Pardon for Hunter Raises Important Questions About…",https://www.dailysignal.com/wp-content/uploads/2024/12/Hunter-Biden.jpg,2024-12-02T21:02:00Z,https://web.archive.org/web/20241202211754/https://www.dailysignal.com/2024/12/02/joe-bidens-11-year-pardon-hunter-raises-important-questions-ukraine-china-corruption/,"President Joe Biden just tacitly acknowledged what conservatives have long suspectedthat Hunter Biden may be guilty of far more than just lying on a gun-registration form and cheating on his taxes.
… [+9188 chars]",,en,'James Comer'
https://www.bostonherald.com/2024/12/02/kate-middleton-princess-heartfelt-plea-love-not-hate-christmas-letter/,https://www.bostonherald.com/2024/12/02/kate-middleton-princess-heartfelt-plea-love-not-hate-christmas-letter/,0,www.bostonherald.com,"Princess of Wales releases plea for ‘love, not hate’ in Christmas letter ahead of carol service","Kate Middleton issued a poignant plea to embrace “love, not fear"" in a letter to guests of an upcoming carol concert she's hosting on Friday.",https://www.bostonherald.com/wp-content/uploads/2024/12/GettyImages-2157029496.jpg?w=1024&h=682,2024-12-02T21:03:15Z,https://web.archive.org/web/20241203022857/https://www.bostonherald.com/2024/12/02/kate-middleton-princess-heartfelt-plea-love-not-hate-christmas-letter/,"Kate Middleton, Princess of Wales, issued a poignant plea to embrace “love, not fear” in a letter to guests of an upcoming carol concert she’s hosting on Friday, noting “love unites and strengthens u… [+2312 chars]",,en,'Kate Middleton'
https://www.forbes.com/sites/stevebaltin/2024/12/02/eric-vetro-unleashing-the-true-voice-with-heart-and-mastery/,https://www.forbes.com/sites/stevebaltin/2024/12/02/eric-vetro-unleashing-the-true-voice-with-heart-and-mastery/,0,www.forbes.com,Eric Vetro: Unleashing The True Voice With Heart And Mastery,"Vocal coach to the stars, Eric Vetro has worked with Sabrina Carpenter, Ariana Grande, everyone. Sage Bava took a lesson with him to see what it was like.",https://imageio.forbes.com/specials-images/imageserve/674e2000ee1f7546bc02cab9/0x0.jpg?format=jpg&height=900&width=1600&fit=bounds,2024-12-02T21:18:54Z,https://web.archive.org/web/20241203030822/https://www.forbes.com/sites/stevebaltin/2024/12/02/eric-vetro-unleashing-the-true-voice-with-heart-and-mastery/,"HOLLYWOOD, CALIFORNIA - OCTOBER 26: Eric Vetro attends the 2024 AFI Fest - ""Maria"" Premiere at TCL ... [+] Chinese Theatre on October 26, 2024 in Hollywood, California. (Photo by Axelle/Bauer-Griffin… [+6372 chars]",,en,'Sabrina Carpenter'
