index,url,valid,domain,title,description,image,published,archive,content,quote,language,keyword
https://www.cosmopolitan.com/entertainment/celebs/a46327001/joe-jonas-stormi-bree-relationship-timeline/,https://www.cosmopolitan.com/entertainment/celebs/a46327001/joe-jonas-stormi-bree-relationship-timeline/,0,www.cosmopolitan.com,Joe Jonas and Stormi Bree's Short but Fast-Moving Rumored Relationship Timeline,Catch up on Joe Jonas and Stormi Bree's short but fast-moving relationship timeline—from when Joe and Stormi started dating to right now in 2024.,"https://hips.hearstapps.com/hmg-prod/images/bgus-2808924-004-659d5e5a3bc14.jpg?crop=1xw:0.7501071581654523xh;center,top&resize=1200:*",2024-01-09T19:46:00Z,,"In what can only be described as an early 2024 plot twist, 
Joe Jonas is rumored to be dating model Stormi Bree following his breakup from Sophie Turner. And based on the fact that they've been out … [+3132 chars]",,en,'Joe Jonas'
https://www.the-sun.com/entertainment/10050313/whoopi-goldberg-rushes-off-stage-called-out-leaving-building/,https://www.the-sun.com/entertainment/10050313/whoopi-goldberg-rushes-off-stage-called-out-leaving-building/,0,www.the-sun.com,Whoopi Goldberg suddenly ditches co-hosts & rushes off stage as Alyssa Farah Griffin says co-star ‘left the building’,WHOOPI Goldberg has been called out by her View co-star for getting out of her seat. Alyssa Farah Griffin said that Whoopi “left the building” after the awkward moment. When The View ca…,https://www.the-sun.com/wp-content/uploads/sites/6/2024/01/lm_whoopiwalks_offplat-copy.jpg?strip=all&quality=100&w=1920&h=1080&crop=1,2024-01-09T20:35:25Z,,"WHOOPI Goldberg has been called out by her View co-star for getting out of her seat. 
Alyssa Farah Griffin said that Whoopi ""left the building"" after the awkward moment. 
Whoopi Goldberg has abrupt… [+2526 chars]",,en,'Alyssa Farah Griffin'
https://www.thewrap.com/the-view-chris-christie-interview-ratings-abc/,https://www.thewrap.com/the-view-chris-christie-interview-ratings-abc/,0,www.thewrap.com,"‘The View’ Chris Christie Interview Scores 2.5 Million Viewers, a 2-Month High | Exclusive","The ABC talks show's Jan. 3 episode reached its biggest audience since Nov. 9, when singer John Legend guested
The post ‘The View’ Chris Christie Interview Scores 2.5 Million Viewers, a 2-Month High | Exclusive appeared first on TheWrap.",https://www.thewrap.com/wp-content/uploads/2024/01/the-view-chris-christie.jpg,2024-01-09T21:23:11Z,,"You are reading an exclusive WrapPRO article for free. Want to level up your entertainment career? Click here for more information.
Chris Christies interview on The View drew the highest viewership … [+2245 chars]",,en,'Chris Christie'
https://pagesix.com/2024/01/09/parents/joe-jonas-takes-daughters-to-music-class-amid-rumored-romance-with-stormi-bree/,https://pagesix.com/2024/01/09/parents/joe-jonas-takes-daughters-to-music-class-amid-rumored-romance-with-stormi-bree/,0,pagesix.com,Joe Jonas takes daughters to Miami music class amid rumored romance with model Stormi Bree,"The DNCE frontman was first linked to Bree last week after the pair was seen together in Cabo San Lucas, Mexico.",https://pagesix.com/wp-content/uploads/sites/3/2024/01/74632726.jpg?quality=75&strip=all&w=1024,2024-01-10T01:38:14Z,,"Joe Jonas is hoping to pass on his musical talents to his daughters.
Photos obtained by Page Six exclusively show the Jonas Brothers member taking his two young daughters, Willa, 3, and Delphine, 1,… [+3200 chars]",,en,'Joe Jonas'
https://www.foxnews.com/media/the-view-co-host-joy-behar-worries-country-fall-apart-media-soft-gop-we-will-lose-this,https://www.foxnews.com/media/the-view-co-host-joy-behar-worries-country-fall-apart-media-soft-gop-we-will-lose-this,0,www.foxnews.com,'The View' co-host Joy Behar worries country will fall apart if media soft on GOP: 'We will lose this',"""The View"" co-host Joy Behar went after NBC News host Kristen Welker following an interview she did with GOP Rep. Elise Stefanik and accused her of not pushing back.",https://static.foxnews.com/foxnews.com/content/uploads/2024/01/JOY-BEHAR-KRISTEN-WELKER-STEFANIK.jpg,2024-01-10T02:00:59Z,,"""The View"" co-host Joy Behar ripped NBC host Kristen Welker and the media on Tuesday over an interview on ""Meet the Press"" with Rep. Elise Stefanik, R-N.Y., saying not being tough enough on Republica… [+2574 chars]",,en,'Sunny Hostin'
https://www.vox.com/24023738/nikki-haley-new-hampshire-polls-trump-desantis-husband,https://www.vox.com/24023738/nikki-haley-new-hampshire-polls-trump-desantis-husband,0,www.vox.com,"Nikki Haley, the one candidate who could still make the GOP primary kinda interesting, explained",How Haley is trying to reject — and co-opt — Trumpism.,https://cdn.vox-cdn.com/thumbor/-5MNZN-12vxHVyw270gOkzFCoTc=/0x0:4751x2487/fit-in/1200x630/cdn.vox-cdn.com/uploads/chorus_asset/file/25214270/GettyImages_1247163437.jpg,2024-01-10T11:00:00Z,,"Former US Ambassador to the UN Nikki Haley speaks during a campaign event to launch her presidential bid, at the Charleston Visitor Center in Charleston, South Carolina, on February 15, 2023. | Logan… [+14329 chars]",,en,'Ivanka Trump'
https://www.newsweek.com/nikki-haley-judge-judy-endorsement-president-1859428,https://www.newsweek.com/nikki-haley-judge-judy-endorsement-president-1859428,0,www.newsweek.com,Judge Judy Under Fire for Endorsing Nikki Haley,"The TV star said the former U.N ambassador was ""whip-smart"" and had ""real common sense.""",https://d.newsweek.com/en/full/2333707/nikki-haley-judge-judy.png,2024-01-10T13:30:22Z,,"TV star Judith Sheindlin has endorsed Republican presidential hopeful Nikki Haley.
Sheindlin, better known as Judge Judy, gave a glowing endorsement for Haley, whom she described as ""whip-smart.""
""… [+2941 chars]",,en,'Alyssa Farah Griffin'
https://allafrica.com/stories/202401100447.html,https://allafrica.com/stories/202401100447.html,0,allafrica.com,President Pays Tribute to Renowned Photographer Magubane,"[SAnews.gov.za] President Cyril Ramaphosa has paid tribute to globally renowned photographer, Dr Peter Magubane, for fearlessly using his camera to capture the atrocities of apartheid while putting his life in danger.",https://cdn08.allafrica.com/static/images/structure/aa-logo-rgba-no-text-square.png,2024-01-10T16:12:37Z,,"President Cyril Ramaphosa has paid tribute to globally renowned photographer, Dr Peter Magubane, for fearlessly using his camera to capture the atrocities of apartheid while putting his life in dange… [+4260 chars]",,en,'Cyril Ramaphosa'
https://allafrica.com/stories/202401100448.html,https://allafrica.com/stories/202401100448.html,0,allafrica.com,President Emphasises Importance of Human Rights,"[SAnews.gov.za] With South Africa heading to the International Court of Justice (ICJ) in The Hague for acts committed by Israel in the context of its attacks on Gaza, President Cyril Ramaphosa says the country approached the court due to its opposition to the…",https://cdn08.allafrica.com/static/images/structure/aa-logo-rgba-no-text-square.png,2024-01-10T16:13:17Z,,"With South Africa heading to the International Court of Justice (ICJ) in The Hague for acts committed by Israel in the context of its attacks on Gaza, President Cyril Ramaphosa says the country appro… [+4732 chars]",,en,'Cyril Ramaphosa'
https://www.news24.com/news24/politics/government/icj-hearing-ramaphosa-stresses-importance-of-genocide-case-in-briefing-with-sas-legal-team-20240110,https://www.news24.com/news24/politics/government/icj-hearing-ramaphosa-stresses-importance-of-genocide-case-in-briefing-with-sas-legal-team-20240110,0,www.news24.com,News24 | ICJ hearing: Ramaphosa stresses importance of genocide case in briefing with SA's legal team,President Cyril Ramaphosa was briefed virtually on Wednesday about South Africa's preparedness in the landmark genocide case against Israel.,https://cdn.24.co.za/files/Cms/General/d/222/8cdaecc706b544929c2fa1330c68d36c.jpg,2024-01-10T16:37:08Z,,"This case is of great importance to humanity.
This was the message President Cyril Ramaphosa relayed to the legal team arguing South Africa's genocide case against Israel at the International Court … [+147 chars]",,en,'Cyril Ramaphosa'
https://www.marca.com/en/lifestyle/music/2024/01/10/659ef0f422601deb598b45fc.html,https://www.marca.com/en/lifestyle/music/2024/01/10/659ef0f422601deb598b45fc.html,0,www.marca.com,Taylor Swift's global tour and media presence propel her to 1.7% share in the U.S. recorded-music market,"In 2023, Taylor Swift continued her dominance in the U.S. recorded-music market, accounting for 1.7% of the entire market, according to the year-end report from Luminate, the indus",https://phantom-marca.unidadeditorial.es/ccf51fd3eddc3129d4d2f46d033f54b6/resize/1200/f/webp/assets/multimedia/imagenes/2024/01/10/17049148890624.jpg,2024-01-10T19:56:26Z,,"In 2023, Taylor Swift continued her dominance in the U.S. recorded-music market, accounting for 1.7% of the entire market, according to the year-end report from Luminate, the industry data partner fo… [+2458 chars]",,en,'nan nan'
https://www.rt.com/news/590427-netanyahu-clarifies-gaza-aims/,https://www.rt.com/news/590427-netanyahu-clarifies-gaza-aims/,0,www.rt.com,Netanyahu clarifies Gaza war aims,Israeli Prime Minister Benjamin Netanyahu insisted his country has no plans for a permanent occupation of the Gaza Strip Read Full Article at RT.com,https://mf.b37mrtl.ru/files/2024.01/article/659f6c3f85f5403810694ddf.jpg,2024-01-11T04:23:04Z,,Israeli Prime Minister Benjamin Netanyahu has insisted his country has no plans for a long-term occupation of Gaza and does not seek to displace civilians there. The Jewish state faces increasing scr… [+2896 chars],,en,'Benjamin Netanyahu'
https://wwd.com/beauty-industry-news/beauty-features/puig-purchases-dr-barbara-sturm-1236119585/,https://wwd.com/beauty-industry-news/beauty-features/puig-purchases-dr-barbara-sturm-1236119585/,0,wwd.com,Puig Acquires Dr. Barbara Sturm,Dr. Barbara Sturm is to remain as chief product development officer and brand ambassador.,https://wwd.com/wp-content/uploads/2023/05/Dr.-Barbara-Sturm-Hyaluronic-Serum.png?w=1000,2024-01-11T08:16:48Z,,"PARIS – Spanish beauty and fashion company Puig has acquired a majority stake in the Dr. Barbara Sturm premium skin care brand.
The terms of the deal were not disclosed.
The German molecular cosmet… [+684 chars]",,en,'Barbara Sturm'
https://www.marketscreener.com/quote/stock/THE-GOLDMAN-SACHS-GROUP-I-12831/news/Spanish-cosmetics-maker-Puig-buys-majority-stake-in-Germany-s-Dr-Barbara-Sturm-45720970/,https://www.marketscreener.com/quote/stock/THE-GOLDMAN-SACHS-GROUP-I-12831/news/Spanish-cosmetics-maker-Puig-buys-majority-stake-in-Germany-s-Dr-Barbara-Sturm-45720970/,0,www.marketscreener.com,Spanish cosmetics maker Puig buys majority stake in Germany's Dr. Barbara Sturm,"(marketscreener.com) Cosmetics maker Puig has
bought a majority stake in German skincare brand Dr. Barbara
Sturm for an undisclosed sum, the family owned Spanish company
said on Thursday.
 The Spanish company, which has said it is evaluating listing
its share…",https://www.marketscreener.com/images/twitter_MS_fdblanc.png,2024-01-11T08:41:48Z,,"MADRID, Jan 11 (Reuters) - Cosmetics maker Puig has
bought a majority stake in German skincare brand Dr. Barbara
Sturm for an undisclosed sum, the family owned Spanish company
said on Thursday.
T… [+1527 chars]",,en,'Barbara Sturm'
https://decider.com/2024/01/11/sunny-hostin-alyssa-farah-griffin-argument-nikki-haley-the-view-interrupted-constantly/,https://decider.com/2024/01/11/sunny-hostin-alyssa-farah-griffin-argument-nikki-haley-the-view-interrupted-constantly/,0,decider.com,Sunny Hostin And Alyssa Farah Griffin Spark Yet Another Argument Over Nikki Haley On ‘The View’: “I’m Being Interrupted Constantly”,View fans will never know peace this election season.,https://decider.com/wp-content/uploads/2024/01/Sunny-Alyssa-1.jpg?quality=75&strip=all&w=1200,2024-01-11T17:12:52Z,,"Tensions between Sunny Hostin and Alyssa Farah Griffin hit a new high on The View today as the co-hosts bickered over identity politics in the 2024 presidential election. 
The two panelists who rare… [+1967 chars]",,en,'Nikki Haley'
https://www.highsnobiety.com/p/puig-acquires-dr-barbara-sturm/,https://www.highsnobiety.com/p/puig-acquires-dr-barbara-sturm/,0,www.highsnobiety.com,The Acquisition of Dr. Barbara Sturm Was Inevitable,"Puig is starting off the new year with a bang: On Thursday, the Spanish luxury conglomerate acquired a majority stake in skincare brand Dr. Barbara Sturm, a fa…",https://www.highsnobiety.com/static-assets/dato/1704992401-puig-acquires-dr-barbara-sturm-feat.jpg,2024-01-11T17:14:22Z,,"Puig is starting off the new year with a bang: On Thursday, the Spanish luxury conglomerate acquired a majority stake in skincare brand Dr. Barbara Sturm, a favorite among A-listers like Oprah, Kim K… [+1435 chars]",,en,'Barbara Sturm'
https://nypost.com/2024/01/11/news/first-lady-jill-biden-whines-republicans-are-cruel-to-stepson-hunter/,https://nypost.com/2024/01/11/news/first-lady-jill-biden-whines-republicans-are-cruel-to-stepson-hunter/,0,nypost.com,First lady Jill Biden gripes that Republicans are ‘cruel’ to stepson Hunter,"First lady Jill Biden said Thursday that congressional Republicans have been “cruel” to her stepson Hunter, one day after two House panels voted to advance contempt charges against the presidential scion. “How have you been coping personally with the onslaugh…",https://nypost.com/wp-content/uploads/sites/2/2024/01/74711720.jpg?quality=75&strip=all&w=1024,2024-01-11T17:22:36Z,,"First lady Jill Biden said Thursday that congressional Republicans have been cruel to her stepson Hunter, one day after two House panels voted to advance contempt charges against the presidential sci… [+5322 chars]",,en,'Hunter Biden'
https://dailycaller.com/2024/01/11/the-view-nikki-haley-debate/,https://dailycaller.com/2024/01/11/the-view-nikki-haley-debate/,0,dailycaller.com,‘Please Continue Interrupting Me’: ‘The View’ Co-Hosts Repeatedly Talk Over Each Other While Debating Nikki Haley,&quot;The View&quot; co-hosts heatedly talked over one another Thursday as they debated why Republican presidential candidate Nikki Haley has gained popularity.,https://cdn01.dailycaller.com/wp-content/uploads/2024/01/Screenshot-2024-01-11-at-12.20.35%e2%80%afPM-e1704993687269.png,2024-01-11T17:41:27Z,,"“The View” co-hosts heatedly talked over one another Thursday as they debated why Republican presidential candidate Nikki Haley has gained popularity.
Co-host Sunny Hostin claimed women voters are o… [+2848 chars]",,en,'Nikki Haley'
https://www.thewrap.com/the-view-jesse-watters-conspiracy-theory-taylor-swift/,https://www.thewrap.com/the-view-jesse-watters-conspiracy-theory-taylor-swift/,0,www.thewrap.com,‘The View’ Hosts Crack Up at Jesse Watters’ Conspiracy Theory That Taylor Swift Is a ‘Psyop’ for the Pentagon: ‘I’m Tired of Dumb People’,"""You people worry about the weirdest stuff!"" Whoopi Goldberg marveled
The post ‘The View’ Hosts Crack Up at Jesse Watters’ Conspiracy Theory That Taylor Swift Is a ‘Psyop’ for the Pentagon: ‘I’m Tired of Dumb People’ appeared first on TheWrap.",https://www.thewrap.com/wp-content/uploads/2024/01/the-view-whoopi.jpg,2024-01-11T17:44:28Z,,"Fox News host Jesse Watters suggested on air this week that Taylor Swift is now a psyop for Democrats, and on Thursday morning, the hosts of The View couldnt help but crack up at the idea, before tea… [+2543 chars]",,en,'Taylor Swift'
https://www.news24.com/news24/politics/ramaphosa-tells-an-ancwl-gathering-why-sa-was-duty-bound-to-approach-the-icj-20240111,https://www.news24.com/news24/politics/ramaphosa-tells-an-ancwl-gathering-why-sa-was-duty-bound-to-approach-the-icj-20240111,0,www.news24.com,News24 | Ramaphosa tells an ANCWL gathering why SA was 'duty bound' to approach the ICJ,"The president of the ANC, Cyril Ramaphosa, addressed an ANCWL programme at the Elshaddai Tabernacle International Church.",https://cdn.24.co.za/files/Cms/General/d/7442/fea9dd2661cf4ada8ec1679139a96ee7.jpg,2024-01-11T18:11:47Z,,"The president of the ANC, Cyril Ramaphosa, told a gathering of the ANC Women's League (ANCWL) in Mbombela, Mpumalanga, on Thursday that the South African government was ""duty bound"" to approach the I… [+572 chars]",,en,'Cyril Ramaphosa'
https://pagesix.com/2024/01/11/entertainment/whoopi-goldberg-view-co-hosts-slam-conspiracy-theory-that-taylor-swift-is-pentagon-psy-op/,https://pagesix.com/2024/01/11/entertainment/whoopi-goldberg-view-co-hosts-slam-conspiracy-theory-that-taylor-swift-is-pentagon-psy-op/,0,pagesix.com,"Whoopi Goldberg, ‘View’ co-hosts slam conspiracy theory that Taylor Swift is Pentagon psy-op: ‘Tired of dumb people’","Jesse Watters presented the theory on his show Tuesday night, asking his viewers, ""Have you ever wondered how or why she blew up like this?""",https://pagesix.com/wp-content/uploads/sites/3/2024/01/74715050.jpg?quality=75&strip=all&w=1024,2024-01-11T19:30:49Z,,The “View” co-hosts are rolling their eyes at a conspiracy theory that’s made its way onto mainstream media that claims Taylor Swift is secretly working with the Pentagon to push a political agenda.,,,
https://www.foxnews.com/media/view-co-host-sunny-hostin-confused-women-backing-nikki-haley,https://www.foxnews.com/media/view-co-host-sunny-hostin-confused-women-backing-nikki-haley,0,www.foxnews.com,'The View' co-host Sunny Hostin confused by women backing Nikki Haley,"""The View"" co-hosts clashed after Sunny Hostin hinted on Thursday that people might be flocking to Nikki Haley because she is a woman.",https://static.foxnews.com/foxnews.com/content/uploads/2024/01/SUNNY-HOSTIN-NIKKI-HALEY-THE-VIEW-WOMEN.jpg,2024-01-11T20:07:01Z,,"Read this article for free!
Plus get unlimited access to thousands of articles, videos and more with your free account!
Please enter a valid email address.
By entering your email, you are agreeing… [+2829 chars]",,en,'Nikki Haley'
https://www.usmagazine.com/celebrity-news/news/whoopi-goldberg-slams-theory-pentagon-is-using-taylor-swift-as-asset/#article,https://www.usmagazine.com/celebrity-news/news/whoopi-goldberg-slams-theory-pentagon-is-using-taylor-swift-as-asset/#article,0,www.usmagazine.com,Whoopi Goldberg Slams Theory Pentagon Is Using Taylor Swift for Control,"Whoopi Goldberg needs people to calm down — especially when it comes to Fox’s latest conspiracy theory that Taylor Swift is being used by the government to control the masses. “There are real issues impacting millions of Americans,” Goldberg, 68, said during …",https://www.usmagazine.com/wp-content/uploads/2024/01/Whoopi-Goldberg-Slams-Dumb-Fox-Conspiracy-Theory-Pentagon-Is-Using-Taylor-Swift-to-Control-People-1.jpg?crop=0px%2C0px%2C1998px%2C1051px&resize=1200%2C630&quality=86&strip=all,2024-01-11T22:24:36Z,,"Whoopi Goldberg, Taylor Swift, Jesse Waters.Getty Images(3)
Whoopi Goldbergneeds people to calm down especially when it comes to Foxs latest conspiracy theory that Taylor Swift is being used by the … [+3972 chars]",,en,'Taylor Swift'
https://variety.com/2024/tv/news/whoopi-goldberg-slams-fox-news-taylor-swift-government-asset-1235869415/,https://variety.com/2024/tv/news/whoopi-goldberg-slams-fox-news-taylor-swift-government-asset-1235869415/,0,variety.com,Whoopi Goldberg Slams Fox News for Touting Taylor Swift Conspiracy That She’s a Government Asset: ‘I’m Tired of Dumb People’,Whoopi Goldberg used the January 11 episode of “The View” to slam Fox News for perpetuating a conspiracy theory that claims the U.S. government is using Taylor Swift to control public opinion (via Entertainment Weekly). “There are real issues impacting millio…,https://variety.com/wp-content/uploads/2024/01/Whoopi-Goldberg-Taylor-Swift.jpg?w=1000&h=562&crop=1,2024-01-11T22:32:37Z,,Whoopi Goldberg used the January 11 episode of “The View” to slam Fox News for perpetuating a conspiracy theory that claims the U.S. government is using Taylor Swift to control public opinion (via En… [+2182 chars],,en,'Sunny Hostin'
https://pagesix.com/2024/01/11/entertainment/stormi-bree-is-a-happy-girl-as-she-reminisces-on-her-aspen-trip-with-joe-jonas/,https://pagesix.com/2024/01/11/entertainment/stormi-bree-is-a-happy-girl-as-she-reminisces-on-her-aspen-trip-with-joe-jonas/,0,pagesix.com,Stormi Bree is a ‘happy girl’ as she reminisces on her Aspen trip with Joe Jonas,The singer and the model were first romantically linked on Jan. 3 when they were spotted arriving at the Cabo airport to jet off to Aspen.,https://pagesix.com/wp-content/uploads/sites/3/2024/01/74721912.jpg?quality=75&strip=all&w=1024,2024-01-11T22:38:33Z,,"Stormi Bree has “Vacation Eyes” for Joe Jonas.
The model took to Instagram Thursday to gush over her “special” winter break, which included a trip to Cabo San Lucas, Mexico and Aspen, Colo. where sh… [+3518 chars]",,en,'Joe Jonas'
https://freerepublic.com/focus/f-chat/4209585/posts,https://freerepublic.com/focus/f-chat/4209585/posts,0,freerepublic.com,Sunny Hostin: ‘Last I Checked’ Nikki Haley ‘Has a Vagina’ Like Hillary Clinton,"Sunny Hostin’s racist and ageist attacks against former U.N. Ambassador Nikki Haley have been well-documented. But during the Thursday edition of ABC’s The View, she seemed to dabble in sexism as well, as she suggested that the only reason people, “especially…",,2024-01-12T02:00:18Z,,"Skip to comments.
Sunny Hostin: Last I Checked Nikki Haley Has a Vagina Like Hillary Clintonmrc NewsBusters ^
 | January 11, 2024
 | Nicholas Fondacaro
Posted on 01/11/2024 6:00:18 PM PST by Morg… [+9498 chars]",,en,'Sunny Hostin'
https://www.huffpost.com/entry/whoopi-goldberg-jesse-watters-taylor-swift-conspiracy-theory_n_65a0ed81e4b0fbd2bc063e93,https://www.huffpost.com/entry/whoopi-goldberg-jesse-watters-taylor-swift-conspiracy-theory_n_65a0ed81e4b0fbd2bc063e93,0,www.huffpost.com,'Talk About Snowflakes': Whoopi Goldberg Slams Jesse Watters' Bonkers Taylor Swift Theory,"""I'm tired of dumb people,"" said ""The View"" co-host of the Fox News personality's suggestion about the pop superstar.",https://img.huffingtonpost.com/asset/65a103cf2200001d00fb0014.jpg?cache=EzeXznM4Cj&ops=1200_630,2024-01-12T09:33:56Z,,"Whoopi Goldberg has bad blood with Jesse Watters bologna about Taylor Swift.
The View co-host, on Thursday, gave her two cents after the Fox News star suggested that the singer could be a government… [+4124 chars]",,en,'Sunny Hostin'
https://www.newsweek.com/whoopi-goldberg-mocks-jesse-waters-taylor-swift-conspiracy-theory-1860218,https://www.newsweek.com/whoopi-goldberg-mocks-jesse-waters-taylor-swift-conspiracy-theory-1860218,0,www.newsweek.com,Whoopi Goldberg Mocks Conservatives for Taylor Swift Conspiracy Theory,"""I'm tired of dumb people... I'm tired of it. I can't handle it,"" Whoopi Goldberg said about the unfounded conspiracy theory.",https://d.newsweek.com/en/full/2334943/whoopi-goldberg-taylor-swift.jpg,2024-01-12T14:19:19Z,,"Whoppi Goldberg has slammed the conspiracy theory put forth byFox News host Jesse Watters that Taylor Swift could be ""a front for a covert political agenda.""
On Tuesday, Watters suggested that the p… [+4228 chars]",,en,'Taylor Swift'
https://decider.com/2024/01/12/the-view-rips-trump-selective-desire-be-with-grieving-melania-after-mother-death/,https://decider.com/2024/01/12/the-view-rips-trump-selective-desire-be-with-grieving-melania-after-mother-death/,0,decider.com,‘The View’ Rips Trump For “Selective” Desire To Be With Grieving Melania After Her Mother’s Death: “Not Exactly Husband Of The Year”,"Ana Navarro called out Trump for ""hosting a party at Mar-a-Lago while Melania was sitting with her dying mother at a hospital in Miami.""",https://decider.com/wp-content/uploads/2024/01/Ana-Trump-Sunny.jpg?quality=75&strip=all&w=1200,2024-01-12T17:01:54Z,,"The View has made clear it’s no fan of Donald Trump‘s politics, and now the panel is taking aim at the former president’s marriage. During a discussion about Trump’s ongoing fraud trial, co-host Ana … [+1676 chars]",,en,'Melania Trump'
https://www.luxurydaily.com/puig-snags-majority-stake-in-dr-barbara-sturm-skincare/,https://www.luxurydaily.com/puig-snags-majority-stake-in-dr-barbara-sturm-skincare/,0,www.luxurydaily.com,Puig snags majority stake in Dr. Barbara Sturm skincare,"The Spanish fashion and fragrance business has acquired the premium German brand, with the eponymous founder retaining a non-controlling interest.",https://www.luxurydaily.com/wp-content/uploads/2024/01/puig-011224.jpeg,2024-01-12T17:21:08Z,,"Commerce
January 12, 2024
 The acquired company's eponymous founder, the doctor herself, will retain a minority stake in the brand. Image credit: Puig 
 By Luxury Daily News Service
Spanish fashi… [+6116 chars]",,en,'Barbara Sturm'
https://decider.com/2024/01/12/ana-navarro-claps-back-sara-haines-sweet-dog-the-view-both-bitches/,https://decider.com/2024/01/12/ana-navarro-claps-back-sara-haines-sweet-dog-the-view-both-bitches/,0,decider.com,Ana Navarro Compares Sara Haines To Her Dog On ‘The View’: “You’re Both B*tches!”,The Pooch Pageant drama lives on.,https://decider.com/wp-content/uploads/2024/01/view2-5.jpg?quality=75&strip=all&w=1200,2024-01-12T17:43:51Z,,"It looks like Ana Navarro is still holding a grudge after Sara Haines snubbed her dog Cha-Cha in The View‘s 2023 Pooch Pageant. On this morning’s episode of the hit daytime talk show, Navarro got fie… [+1749 chars]",,en,'Sunny Hostin'
