index,url,valid,domain,title,description,image,published,archive,content,quote,language,keyword
https://www.businessinsider.com/russia-wagner-chief-war-led-clowns-turn-people-into-meat-2023-6,https://www.businessinsider.com/russia-wagner-chief-war-led-clowns-turn-people-into-meat-2023-6,0,www.businessinsider.com,Russia's Wagner Group chief threatens to pull his mercenary army from fighting in Ukraine if war efforts continue to be 'led by clowns who turn people into meat',"Yevgeny Prigozhin, a longtime ally of Vladimir Putin, has continued to criticize the Kremlin and threaten to pull out the Wagner Group mercenaries.",https://i.insider.com/640aee579ef79f0018287ab0?width=1200&format=jpeg,2023-06-01T21:23:43Z,https://web.archive.org/web/20230601220650/https://www.businessinsider.com/russia-wagner-chief-war-led-clowns-turn-people-into-meat-2023-6,"Russian billionaire and businessman Yevgeny Prigozhin.Mikhail Svetlov/Getty Images
<ul>
<li>Yevgeny Prigozhin, the founder of the Wagner Group, continues to criticize the Kremlin.</li>
<li>Prigozhin… [+2325 chars]",,en,'Yevgeny Prigozhin'
https://freerepublic.com/focus/f-religion/4157667/posts,https://freerepublic.com/focus/f-religion/4157667/posts,0,freerepublic.com,Pope Francis Taps a Like-Minded Portuguese Cardinal to Head the New Dicastery for Culture and Education,"Pope Francis Taps a Like-Minded Portuguese Cardinal to Head the New Dicastery for Culture and EducationCardinal José Mendonça is a published poet whose priestly service has centered on cultural dialogue and education, as well as ministry to homosexuals.VATICA…",,2023-06-01T21:46:58Z,https://web.archive.org/web/20230601222112/https://freerepublic.com/focus/f-religion/4157667/posts,"Skip to comments.
Pope Francis Taps a Like-Minded Portuguese Cardinal to Head the New Dicastery for Culture and EducationNational Catholic Register ^
 | October 19, 2022
 | Edward Pentin
Posted o… [+3058 chars]",,en,'Pope Francis'
https://www.newser.com/story/336014/south-korea-uses-ai-to-guess-kims-weight.html,https://www.newser.com/story/336014/south-korea-uses-ai-to-guess-kims-weight.html,0,www.newser.com,South Korea Takes a Guess at Kim's Weight,"North Korea keeps a tight lid on personal information about Kim Jong Un, but a South Korean lawmaker is happy to speculate. Yoo Sang-bum told reporters that an intelligence report by the South estimates Kim now weighs more than 300 pounds and is in all-around…",https://img2-azrcdn.newser.com/image/1475315-12-20230601170743.jpeg,2023-06-01T21:50:00Z,https://web.archive.org/web/20230601223647/https://www.newser.com/story/336014/south-korea-uses-ai-to-guess-kims-weight.html,"North Korea keeps a tight lid on personal information about Kim Jong Un, but a South Korean lawmaker is happy to speculate. Yoo Sang-bum told reporters that an intelligence report by the South estima… [+883 chars]",,en,'Kim Jong Un'
https://dailycaller.com/2023/06/01/you-supported-the-jab-trump-spars-with-voter-who-blamed-him-for-deaths-from-covid-vaccines/,https://dailycaller.com/2023/06/01/you-supported-the-jab-trump-spars-with-voter-who-blamed-him-for-deaths-from-covid-vaccines/,0,dailycaller.com,‘You Supported The Jab’: Trump Spars With Voter Who Blames Him For Deaths From COVID Vaccines,"Former President Donald Trump sparred with a voter over COVID vaccines during a Thursday event, defending his effort to rapidly develop and field them.",https://cdn01.dailycaller.com/wp-content/uploads/2023/06/DCNF-Trump-Vaccine-Iowa-OANN-Featured.jpg,2023-06-01T21:50:12Z,,"Former President Donald Trump sparred with an Iowa voter over COVID vaccines during a Thursday event, defending his decision to promote and fund their development.
“We have lost people because you s… [+2363 chars]",,en,'Donald Trump'
https://www.comingsoon.net/music/news/1292831-photographer-sues-kanye-west-for-assault,https://www.comingsoon.net/music/news/1292831-photographer-sues-kanye-west-for-assault,0,www.comingsoon.net,Photographer Sues Kanye West for Assault,"A paparazzi photographer is suing Ye — also known as Kanye West — for assault, battery, and negligence. West was caught grabbing her phone and throwing it into the street, according to Variety. What is Kanye West being sued for? Photographer Nichol Lechmanik …","https://www.comingsoon.net/wp-content/uploads/sites/3/2023/06/kanye-header.png?resize=1200,630",2023-06-01T21:52:42Z,https://web.archive.org/web/20230602013946/https://www.comingsoon.net/music/news/1292831-photographer-sues-kanye-west-for-assault,"A paparazzi photographer is suing Ye also known as Kanye West for assault, battery, and negligence. West was caught grabbing her phone and throwing it into the street, according to Variety. 
What is… [+3398 chars]",,en,'Kim Kardashian'
https://www.msnbc.com/the-reidout/reidout-blog/marjorie-taylor-greene-january-6-tapes-tweet-2024-rcna87321,https://www.msnbc.com/the-reidout/reidout-blog/marjorie-taylor-greene-january-6-tapes-tweet-2024-rcna87321,0,www.msnbc.com,Marjorie Taylor Greene’s promise of Jan. 6 footage should make Dems giddy,"With people like Marjorie Taylor Greene atop the Republican Party, Democrats should feel confident about their chances heading into the 2024 elections.","https://media-cldnry.s-nbcnews.com/image/upload/t_nbcnews-fp-1200-630,f_auto,q_auto:best/rockcms/2023-06/230601-Marjorie-Taylor-Greene-ew-331p-4f0b6d.jpg",2023-06-01T21:56:52Z,,"Rep. Marjorie Taylor Greenes giddy social media post about releasing more Jan. 6 footage could be some of the best news Democrats get all week. 
As malicious as the Georgia Republican tends to be, I… [+2197 chars]",,en,'Marjorie Taylor Greene'
https://www.marca.com/en/lifestyle/celebrities/2023/06/02/6479145b22601d826d8b45cb.html,https://www.marca.com/en/lifestyle/celebrities/2023/06/02/6479145b22601d826d8b45cb.html,0,www.marca.com,Kim Kardashian refuses to be there when Kanye West hits rock bottom: 'I lack the energy',Perhaps you may think Kanye West has remained reltively quiet after the recent events in which he displayed concerning and erratic behavior. The one person who decided to move comp,https://phantom-marca.unidadeditorial.es/8941bf7c5658d21059b9b743acdf4fce/resize/1200/f/jpg/assets/multimedia/imagenes/2023/06/01/16856567513689.jpg,2023-06-01T22:02:26Z,,Perhaps you may think Kanye West has remained reltively quiet after the recent events in which he displayed concerning and erratic behavior. The one person who decided to move completely away from th… [+1953 chars],,en,'Kanye West'
https://www.theguardian.com/us-news/2023/jun/01/fox-news-trump-town-hall-iowa,https://www.theguardian.com/us-news/2023/jun/01/fox-news-trump-town-hall-iowa,0,www.theguardian.com,Fox News to host Trump town hall in key test for beleaguered network,"Network, facing second defamation lawsuit after paying $787m to settle with Dominion, to air Iowa event hosted by Sean HannityDonald Trump, the former US president, takes part in a Fox News town-hall event in Iowa on Thursday – a prime-time test for the belea…",https://i.guim.co.uk/img/media/f4c27a86f94efac80fa2f2a69ee2033f5df153d2/0_42_4980_2989/master/4980.jpg?width=1200&height=630&quality=85&auto=format&fit=crop&overlay-align=bottom%2Cleft&overlay-width=100p&overlay-base64=L2ltZy9zdGF0aWMvb3ZlcmxheXMvdGctZGVmYXVsdC5wbmc&enable=upscale&s=95c2f8850eae77a49afb5f13419ce6f1,2023-06-01T23:00:45Z,https://web.archive.org/web/20230601233355/https://www.theguardian.com/us-news/2023/jun/01/fox-news-trump-town-hall-iowa,"Donald Trump, the former US president, takes part in a Fox News town-hall event in Iowa on Thursday a prime-time test for the beleaguered network after its legal battle with an election systems compa… [+2215 chars]",,en,'Donald Trump'
https://www.france24.com/en/live-news/20230601-photographer-sues-kanye-west-over-alleged-assault,https://www.france24.com/en/live-news/20230601-photographer-sues-kanye-west-over-alleged-assault,0,www.france24.com,Photographer sues Kanye West over alleged assault,"Nichol Lechmanik said the artist, who is now formally known as Ye, caused her ""great mental and emotional pain"" in the January confrontation.

A press conference in Los Angeles heard how the paparazzo was outside a sports center in Ventura County, north of th…",https://s.france24.com/media/display/211cc1b0-00d3-11ee-970d-005056a90321/w:1280/p:16x9/Part-GTY-453656491-1-1-1.jpg,2023-06-01T23:22:10Z,https://web.archive.org/web/20230602003650/https://www.france24.com/en/live-news/20230601-photographer-sues-kanye-west-over-alleged-assault,"Los Angeles (AFP) A photographer who claims Kanye West threw her cell phone to the ground in a confrontation is suing the troubled rapper for assault, she said Thursday. Nichol Lechmanik said the art… [+2233 chars]",,en,'Kanye West'
https://www.latimes.com/california/story/2023-06-01/photographer-sues-kanye-west-after-he-allegedly-threw-her-phone-into-the-street,https://www.latimes.com/california/story/2023-06-01/photographer-sues-kanye-west-after-he-allegedly-threw-her-phone-into-the-street,0,www.latimes.com,Kanye West sued by photographer after the rapper allegedly threw her phone into the street,A brief video shows an angry Kanye West allegedly grab the photographer's phone and throw it into the street.,https://ca-times.brightspotcdn.com/dims4/default/24222b1/2147483647/strip/true/crop/3000x1575+0+236/resize/1200x630!/quality/80/?url=https%3A%2F%2Fcalifornia-times-brightspot.s3.amazonaws.com%2Fe7%2F36%2Fc10b8a784de69667a6a4dd839d1e%2Fgettyimages-1495191808.jpg,2023-06-01T23:37:33Z,https://web.archive.org/web/20230601235037/https://www.latimes.com/california/story/2023-06-01/photographer-sues-kanye-west-after-he-allegedly-threw-her-phone-into-the-street,"An angry Kanye West, aka Ye, grabbed a phone from a paparazzi photographer and threw it into oncoming traffic while she recorded him, according to claims in a lawsuit filed in Ventura County.
Video … [+3337 chars]",,en,'Kim Kardashian'
https://www.wnd.com/2023/06/king-tuck-like-trump-transformational/,https://www.wnd.com/2023/06/king-tuck-like-trump-transformational/,0,www.wnd.com,"King Tuck, like Trump, is transformational","King Tuck clearly carried the Fox News network and its nits. ~ ilana Whether full of spleen or in support of Tucker Carlson, the commentariat, as usual, was dead wrong about the effects of his firing on the Fox News network. The disposable clowns at The Dispa…",https://www.wnd.com/wp-content/uploads/2023/04/Trump-Carlson.jpg,2023-06-01T23:39:55Z,,"King Tuck clearly carried the Fox News network and its nits. ~ ilana
Whether full of spleen or in support of Tucker Carlson, the commentariat, as usual, was dead wrong about the effects of his firin… [+4729 chars]",,en,'Tucker Carlson'
https://punchng.com/davido-magicsticks-gave-me-platforms-to-excel-rage/,https://punchng.com/davido-magicsticks-gave-me-platforms-to-excel-rage/,0,punchng.com,"Davido, Magicsticks gave me platforms to excel – Rage","A photographer who claims Kanye West threw her cell phone to the ground in a confrontation is suing the troubled rapper for assault, she said Thursday. Nichol Lechmanik said the artist, who is now formally known as Ye, caused her “great mental and emotional p…",https://cdn.punchng.com/wp-content/uploads/2023/06/02005459/Davido-and-Rage-e1685663699103.jpeg,2023-06-01T23:56:43Z,https://web.archive.org/web/20230602104051/https://punchng.com/davido-magicsticks-gave-me-platforms-to-excel-rage/,"A photographer who claims Kanye West threw her cell phone to the ground in a confrontation is suing the troubled rapper for assault, she said Thursday.
Nichol Lechmanik said the artist, who is now f… [+2201 chars]",,en,'Kanye West'
https://punchng.com/photographer-sue-kanye-west-over-alleged-assault/,https://punchng.com/photographer-sue-kanye-west-over-alleged-assault/,0,punchng.com,Photographer sues Kanye West over alleged assault,"A photographer who claims Kanye West threw her cell phone to the ground in a confrontation is suing the troubled rapper for assault. Nichol Lechmanik said on Thursday that the artiste, who is now formally known as Ye, caused her “great mental and emotional pa…",https://cdn.punchng.com/wp-content/uploads/2020/07/25224924/Kanye-West.jpg,2023-06-02T00:02:12Z,https://web.archive.org/web/20230602132149/https://punchng.com/photographer-sue-kanye-west-over-alleged-assault/,"A photographer who claims Kanye West threw her cell phone to the ground in a confrontation is suing the troubled rapper for assault.
Nichol Lechmanik said on Thursday that the artiste, who is now fo… [+2220 chars]",,en,'Kim Kardashian'
https://www.huffpost.com/entry/photographer-lawsuit-kanye-west_n_64790adce4b0a7554f4370c9,https://www.huffpost.com/entry/photographer-lawsuit-kanye-west_n_64790adce4b0a7554f4370c9,0,www.huffpost.com,Photographer Sues Kanye West For Throwing Her Phone During Confrontation,"“Although I am not a world-famous artist as is Ye, I have just as much right to work as he does,” Nichol Lechmanik said.",https://img.huffingtonpost.com/asset/64790f8b2300001b002bad67.jpg?ops=1200_630,2023-06-02T00:23:08Z,https://web.archive.org/web/20230602004730/https://www.huffpost.com/entry/photographer-lawsuit-kanye-west_n_64790adce4b0a7554f4370c9,"A celebrity photographer filed a lawsuit against Ye on Thursday after he was recorded grabbing her phone from her hand as she was filming him earlier this year. 
Photographer Nichol Lechmanik is sui… [+3839 chars]",,en,'Kanye West'
https://www.voanews.com/a/experts-north-korea-s-satellite-launch-unlikely-to-draw-china-s-action/7119769.html,https://www.voanews.com/a/experts-north-korea-s-satellite-launch-unlikely-to-draw-china-s-action/7119769.html,0,www.voanews.com,Experts: North Korea's Satellite Launch Unlikely to Draw China's Action,"China is unlikely to take any action against North Korea even if Pyongyang tries to relaunch a spy satellite after its first attempt failed, experts said.

North Korean leader Kim Jong Un's powerful sister, Kim Yo Jong, said the regime would try for the secon…",https://gdb.voanews.com/01000000-c0a8-0242-08bb-08db63055f40_w1200_r1.jpg,2023-06-02T01:06:24Z,https://web.archive.org/web/20230602013802/https://www.voanews.com/a/experts-north-korea-s-satellite-launch-unlikely-to-draw-china-s-action/7119769.html,"WASHINGTON  China is unlikely to take any action against North Korea even if Pyongyang tries to relaunch a spy satellite after its first attempt failed, experts said.
North Korean leader Kim Jong Un… [+4053 chars]",,en,'Kim Jong Un'
https://www.telegraph.co.uk/world-news/2023/06/01/kim-jong-un-north-korean-leader-weight-alcohol-22-stone/,https://www.telegraph.co.uk/world-news/2023/06/01/kim-jong-un-north-korean-leader-weight-alcohol-22-stone/,0,www.telegraph.co.uk,Kim Jong-Un gains weight again by ‘gorging on foreign snacks and alcohol’,"Kim Jong-Un has piled on weight after gorging himself on foreign snacks and drinking to excess, South Korean spies believe.",https://focus.independent.ie/thumbor/BSzFzwmy5wPawSLukgnvYSrxU64=/0x0:2000x1332/2000x1332/prod-mh-ireland/995f53a8-586f-420d-826a-da218e86cac4/205a79a9-0eb7-49c3-920a-3f414581ab7b/KOREA-POLITICS.jpg,2023-06-02T01:30:00Z,https://web.archive.org/web/20230601144341/https://www.telegraph.co.uk/world-news/2023/06/01/kim-jong-un-north-korean-leader-weight-alcohol-22-stone/,"Kim Jong-Un has piled on weight after gorging himself on foreign snacks and drinking to excess, South Korean spies believe.",,en,'Kim Jong Un'
https://hiphopdx.com/news/kim-kardashian-kanye-west-rock-bottom,https://hiphopdx.com/news/kim-kardashian-kanye-west-rock-bottom,0,hiphopdx.com,Kim Kardashian Explains Why She Let Kanye West Hit ‘Rock Bottom’,"Kim Kardashian has bared her soul about why she let her now-ex-husband, Kanye West, hit 'rock bottom' rather than help him out of his freefall.",https://static.hiphopdx.com/2023/06/kim-kardashian-explains-why-she-let-kanye-west-hit-rock-bottom-1200x675.jpg,2023-06-02T01:30:43Z,https://web.archive.org/web/20230602013252/https://hiphopdx.com/news/kim-kardashian-kanye-west-rock-bottom,"Kim Kardashian has finally revealed why she left her now-ex-husband, Kanye West, twisting in the wind and eventually hitting rock bottom.
During an episode of The Kardashians, which aired on Hulu on… [+2291 chars]",,en,'Kim Kardashian'
https://www.newsweek.com/trumps-attack-kayleigh-mcenany-costs-him-endorsement-1803961,https://www.newsweek.com/trumps-attack-kayleigh-mcenany-costs-him-endorsement-1803961,0,www.newsweek.com,Trump's Attack on Kayleigh McEnany Costs Him an Endorsement,"A GOP lawmaker dumped Trump and backed Ron DeSantis instead after the ex-president trashed McEnany, his former White House press secretary.",https://d.newsweek.com/en/full/2241773/donald-trump-endorsement-kayleigh-mcenany-ron-desantis.jpg,2023-06-02T01:57:59Z,https://web.archive.org/web/20230602021951/https://www.newsweek.com/trumps-attack-kayleigh-mcenany-costs-him-endorsement-1803961,"Former President Donald Trump has lost a 2024 endorsement to Florida Governor Ron DeSantis over his attack on Kayleigh McEnany.
Trump lashed out at McEnany, his administration's White House press se… [+3847 chars]",,en,'Chip Somodevilla'
https://www.washingtonpost.com/media/2023/06/01/tucker-carlson-media-matters-fox-news-timothy-burke/,https://www.washingtonpost.com/media/2023/06/01/tucker-carlson-media-matters-fox-news-timothy-burke/,0,www.washingtonpost.com,Behind-the-scenes videos of Tucker Carlson were leaked. Was it a crime?,Investigators are probing Media Matters' Tucker Carlson videos as a possible hack of Fox News. But a lawyer for Timothy Burke says he acquired public data.,https://img-s-msn-com.akamaized.net/tenant/amp/entityid/AA1c0n6P.img?h=630&w=1200&m=6&q=60&o=t&l=f&f=jpg&x=490&y=149,2023-06-02T02:00:03Z,,"Behind-the-scenes videos of Tucker Carlson were leaked. Was it a crime? In the days after Tucker Carlson’s abrupt firing from Fox News, a stream of unauthorized, behind-the-scenes videos appeared, sh… [+6126 chars]",,en,'Tucker Carlson'
https://nypost.com/2023/06/01/grand-jury-hears-evidence-against-ex-marine-daniel-penny-in-subway-chokehold-death-of-jordan-neely/,https://nypost.com/2023/06/01/grand-jury-hears-evidence-against-ex-marine-daniel-penny-in-subway-chokehold-death-of-jordan-neely/,0,nypost.com,Grand jury begins hearing evidence against ex-Marine Daniel Penny in NYC subway chokehold death of Jordan Neely,The manslaughter rap carries a sentence of up to 15 years in prison.,https://nypost.com/wp-content/uploads/sites/2/2023/06/Neeley-comp-1.jpg?quality=75&strip=all&w=1024,2023-06-02T02:27:37Z,https://web.archive.org/web/20230602023206/https://nypost.com/2023/06/01/grand-jury-hears-evidence-against-ex-marine-daniel-penny-in-subway-chokehold-death-of-jordan-neely/,"A Manhattan grand jury has begun to hear evidence in the case against Daniel Penny, the former Marine charged with manslaughter for fatally choking Jordan Neely on the subway last month, according to… [+1550 chars]",,en,'Daniel Penny'
https://www.politico.com/news/2023/06/01/trump-maintains-on-docs-00099841,https://www.politico.com/news/2023/06/01/trump-maintains-on-docs-00099841,0,www.politico.com,'Everything I did was right': Trump doubles down amid new classified docs reports,"He quickly pivoted to President Joe Biden, who’s also had classified documents found in his possession.",https://static.politico.com/cd/7d/545285644836b280d939c65648df/election-2024-trump-13596.jpg,2023-06-02T02:39:14Z,,"Trump repeated criticism of DeSantis for saying he wanted two terms to enact a conservative agenda as president.
Frankly, I wouldnt vote for him because he said, You need eight years. You need six m… [+2453 chars]",,en,'Joe Biden'
https://deadline.com/2023/06/debt-ceiling-joe-biden-kevin-mccarthy-1235383834/,https://deadline.com/2023/06/debt-ceiling-joe-biden-kevin-mccarthy-1235383834/,0,deadline.com,"Senate Approves Debt Ceiling Bill, Last Major Hurdle To Avoid U.S. Default On Debt — Update","UPDATE: The Senate cleared the debt ceiling bill late on Thursday, the final hurdle for the U.S. to avoid default on its debt with a deadline approaching in just a matter of days. The bill, which passed 63-36, now goes to President Joe Biden. It ends the most…",https://s.yimg.com/ny/api/res/1.2/wUdSnhx2O9BauV7HJJ8o_A--/YXBwaWQ9aGlnaGxhbmRlcjt3PTEyMDA7aD04MDA-/https://media.zenfs.com/en/deadline.com/fe72315360456c8e8f2a24ed234a1e57,2023-06-02T03:07:00Z,https://web.archive.org/web/20230602000739/https://deadline.com/2023/06/debt-ceiling-joe-biden-kevin-mccarthy-1235383834/,"UPDATE: The Senate cleared the debt ceiling bill late on Thursday, the final hurdle for the U.S. to avoid default on its debt with a deadline approaching in just a matter of days.
The bill, which pa… [+5596 chars]",,en,'Joe Biden'
https://japantoday.com/category/entertainment/photographer-sues-kanye-west-over-alleged-assault,https://japantoday.com/category/entertainment/photographer-sues-kanye-west-over-alleged-assault,0,japantoday.com,Photographer sues Kanye West over alleged assault,"A photographer who claims Kanye West threw her cell phone to the ground in a confrontation is suing the troubled rapper for assault, she said Thursday. Nichol Lechmanik said the artist, who is now formally known as Ye, caused her &quot;great mental and emotio…",,2023-06-02T03:40:05Z,https://web.archive.org/web/20230602055245/https://japantoday.com/category/entertainment/photographer-sues-kanye-west-over-alleged-assault,"A photographer who claims Kanye West threw her cell phone to the ground in a confrontation is suing the troubled rapper for assault, she said Thursday.
Nichol Lechmanik said the artist, who is now f… [+2214 chars]",,en,'Kanye West'
https://nypost.com/2023/06/02/girl-unable-to-enter-kyiv-shelter-killed-in-russia-attack-zelensky-demands-change/,https://nypost.com/2023/06/02/girl-unable-to-enter-kyiv-shelter-killed-in-russia-attack-zelensky-demands-change/,0,nypost.com,"Girl unable to enter Kyiv shelter killed in Russia attack, Zelensky demands change","President Volodymyr Zelenskiy expressed frustration at the miscue and said if local officials were unable to provide protection, they could be prosecuted.",https://nypost.com/wp-content/uploads/sites/2/2023/06/newspress-collage-27317402-1685687489529.jpg?quality=75&strip=all&1685673161&w=1024,2023-06-02T07:12:30Z,https://web.archive.org/web/20230602071447/https://nypost.com/2023/06/02/girl-unable-to-enter-kyiv-shelter-killed-in-russia-attack-zelensky-demands-change/,"A nine-year-old Ukrainian girl, her mother and another woman were killed in a Russian missile strike on Kyiv on Thursday after the air raid shelter they rushed to failed to open, witnesses said.
Pre… [+3474 chars]",,en,'Volodymyr Zelenskiy'
https://news.yahoo.com/turkeys-president-erdogan-maintained-tight-072025227.html,https://news.yahoo.com/turkeys-president-erdogan-maintained-tight-072025227.html,0,news.yahoo.com,How Turkey's president Erdogan has maintained a tight grip on power in the country,"Turkish President Recep Tayyip Erdogan, a populist with increasingly authoritarian tendencies, is scheduled to take the oath of office and start his third...",https://s.yimg.com/ny/api/res/1.2/ECwgfPlSqgkt2Mbk5pf06Q--/YXBwaWQ9aGlnaGxhbmRlcjt3PTEyMDA7aD04MDA-/https://media.zenfs.com/en/ap.org/c6250160f86fb63d37f302a9e764d1d6,2023-06-02T07:20:25Z,https://web.archive.org/web/20230602075322/https://news.yahoo.com/turkeys-president-erdogan-maintained-tight-072025227.html,"ANKARA, Turkey (AP) Turkish President Recep Tayyip Erdogan, a populist with increasingly authoritarian tendencies, is scheduled to take the oath of office and start his third presidential term Saturd… [+4883 chars]",,en,'Kemal Kilicdaroglu'
https://finance.yahoo.com/news/turkeys-president-erdogan-maintained-tight-072025061.html,https://finance.yahoo.com/news/turkeys-president-erdogan-maintained-tight-072025061.html,0,finance.yahoo.com,How Turkey's president Erdogan has maintained a tight grip on power in the country,"Turkish President Recep Tayyip Erdogan, a populist with increasingly authoritarian tendencies, is scheduled to take the oath of office and start his third...",https://s.yimg.com/ny/api/res/1.2/TA0hYgrClIhXFWaucWa.gQ--/YXBwaWQ9aGlnaGxhbmRlcjt3PTEyMDA7aD04MDA-/https://media.zenfs.com/en/ap_finance_articles_694/ebba0b908b18310830893c3b7e81c54d,2023-06-02T07:20:25Z,https://web.archive.org/web/20230602075206/https://finance.yahoo.com/news/turkeys-president-erdogan-maintained-tight-072025061.html,"ANKARA, Turkey (AP) Turkish President Recep Tayyip Erdogan, a populist with increasingly authoritarian tendencies, is scheduled to take the oath of office and start his third presidential term Saturd… [+4883 chars]",,en,'Kemal Kilicdaroglu'
https://www.independent.co.uk/news/world/americas/us-politics/recep-tayyip-erdogan-ap-turkey-ankara-media-b2350186.html,https://www.independent.co.uk/news/world/americas/us-politics/recep-tayyip-erdogan-ap-turkey-ankara-media-b2350186.html,0,www.independent.co.uk,How Turkey's president Erdogan has maintained a tight grip on power in the country,Turkish President Recep Tayyip Erdogan takes the oath of office and starts his third presidential term Saturday following his latest election win,https://static.independent.co.uk/2023/06/02/08/Turkey_Erdogan_Explainer_42736.jpg?quality=75&width=1200&auto=webp,2023-06-02T07:23:58Z,https://web.archive.org/web/20230602080743/https://www.independent.co.uk/news/world/americas/us-politics/recep-tayyip-erdogan-ap-turkey-ankara-media-b2350186.html,"Sign up for the daily Inside Washington email for exclusive US coverage and analysis sent to your inbox
Get our free Inside Washington email
Turkish President Recep Tayyip Erdogan, a populist with … [+5015 chars]",,en,'Kemal Kilicdaroglu'
