index,url,valid,domain,title,description,image,published,archive,content,quote,language,keyword
https://cheezburger.com/38139653/husband-confronts-pop-star-obsessed-42-year-old-wife-after-she-goes-all-out-with-themed-christmas,https://cheezburger.com/38139653/husband-confronts-pop-star-obsessed-42-year-old-wife-after-she-goes-all-out-with-themed-christmas,0,cheezburger.com,Husband confronts pop-star-obsessed 42-year-old wife after she goes all out with themed Christmas decorations: ‘She had decorated the Christmas tree entirely with Taylor Swift-themed ornaments…’,"It's great to have things that you enjoy and allow you to look forward to the days to come. These things may or may not be things that people like, too. I'm a firm believer in the fact that you should never ""Yuck someone's yum"" and not disparage something som…",https://i.chzbgr.com/original/38139653/h25C4D434/relationships-relationship-advice-relationship-drama-long-term-relationship-taylor-swift-fandom,2024-12-06T17:00:00Z,,"It's great to have things that you enjoy and allow you to look forward to the days to come. These things may or may not be things that people like, too. I'm a firm believer in the fact that you shoul… [+816 chars]",,en,'Taylor Swift'
https://nypost.com/2024/12/06/entertainment/kate-middleton-makes-rare-comment-about-unplanned-cancer-battle/,https://nypost.com/2024/12/06/entertainment/kate-middleton-makes-rare-comment-about-unplanned-cancer-battle/,0,nypost.com,Kate Middleton makes rare comment about ‘unplanned’ cancer battle: ‘Didn’t know this year was going to be like this’,Kate Middleton addressed her recent health battle.,https://nypost.com/wp-content/uploads/sites/2/2024/12/newspress-collage-7l8w1xk1k-1733521629762.jpg?quality=75&strip=all&1733503684&w=1024,2024-12-06T21:48:43Z,,"Kate Middleton opened up about her devastating year after being diagnosed with cancer and undergoing chemotherapy. 
The Princess of Wales, 42, made a rare comment about her health battle at the four… [+3220 chars]",,en,'Kate Middleton'
https://www.eonline.com/news/1410900/barry-keoghan-posts-thirst-traps-after-sabrina-carpenter-breakup,https://www.eonline.com/news/1410900/barry-keoghan-posts-thirst-traps-after-sabrina-carpenter-breakup,0,www.eonline.com,Barry Keoghan Posts Thirst Traps After Sabrina Carpenter Breakup,"Barry Keoghan is please, please, pleasing to the eyes in new photos.
The Saltburn actor appears to be enjoying the single life, sharing a series of steamy pics to social media just three days...","https://akns-images.eonline.com/eol_images/Entire_Site/2024719/cr_1200x1200-240819122230-shutterstock_editorial_14461579bx.jpg?fit=around%7C1080:1080&output-quality=90&crop=1080:1080;center,top",2024-12-07T02:33:38Z,,"Barry Keoghan is please, please, pleasing to the eyes in new photos.
The Saltburnactor appears to be enjoying the single life, sharing a series of steamy pics to social media just three days after i… [+822 chars]",,en,'Barry Keoghan'
https://www.tmz.com/2024/12/07/mrbeast-tom-brady-throwing-contest-winnings-plan/,https://www.tmz.com/2024/12/07/mrbeast-tom-brady-throwing-contest-winnings-plan/,0,www.tmz.com,MrBeast Tom Brady Throwing Contest Winner Reveals Plan For $100K Winnings,The Florida high school quarterback who beat Tom Brady in a passing competition apparently has a solid head on his shoulders to go along with a great throwing arm ... 'cause he tells TMZ Sports he's got very modest plans for his $100K winnings. If…,https://imagez.tmz.com/image/34/16by9/2024/12/04/34499e6a22fe4064b3f65edd5a07a524_xl.jpg,2024-12-07T08:40:47Z,,The Florida high school quarterback who beat Tom Bradyin a passing competition apparently has a solid head on his shoulders to go along with a great throwing arm ... 'cause he tells TMZ Sports he's g… [+1368 chars],,en,'Tom Brady'
https://www.tmz.com/2024/12/07/gisele-bundchen-pregnant-in-costa-rica-with-joaquim-valente/,https://www.tmz.com/2024/12/07/gisele-bundchen-pregnant-in-costa-rica-with-joaquim-valente/,0,www.tmz.com,Pregnant Gisele Bündchen In Costa Rica With BF Joaquim Valente & Her Kids,"Pregnant Gisele Bündchen was glowing and showing during her Costa Rican escape with BF Joaquim Valente ... proudly flaunting her growing baby bump. The Brazilian supermodel wasn’t flying solo -- she had her two kids with ex Tom Brady,…",https://imagez.tmz.com/image/67/16by9/2024/12/07/679ceaede15041afa677f48701eb3da1_xl.jpg,2024-12-07T20:12:22Z,,"Pregnant Gisele Bündchen was glowing and showing during her Costa Rican escape with BF Joaquim Valente ... proudly flaunting her growing baby bump.
The Brazilian supermodel wasnt flying solo -- she … [+654 chars]",,en,'nan nan'
https://www.eonline.com/news/1410905/barry-keoghan-breaks-silence-on-hatred-after-sabrina-carpenter-breakup,https://www.eonline.com/news/1410905/barry-keoghan-breaks-silence-on-hatred-after-sabrina-carpenter-breakup,0,www.eonline.com,"Barry Keoghan Breaks Silence on ""Hatred"" After Sabrina Carpenter Split","Barry Keoghan has reached his limit of how much trolling he can take.
The Saltburn actor deactivated his Instagram and then shared a scathing message for his critics, days after his and Sabrina...","https://akns-images.eonline.com/eol_images/Entire_Site/2024117/rs_1200x1200-241207165050-1200-barry-keoghan-governors-awards-cjh-111724.jpg?fit=around%7C1080:1080&output-quality=90&crop=1080:1080;center,top",2024-12-08T00:53:44Z,,"Barry Keoghan has reached his limit of how much trolling he can take.
The Saltburn actor deactivated his Instagram and then shared a scathing message for his critics, days after his and Sabrina Carp… [+792 chars]",,en,'Sabrina Carpenter'
https://www.justjared.com/2024/12/07/kristen-stewart-reunites-with-spencer-director-pablo-larrain-for-qa-event/,https://www.justjared.com/2024/12/07/kristen-stewart-reunites-with-spencer-director-pablo-larrain-for-qa-event/,0,www.justjared.com,Kristen Stewart Reunites With 'Spencer' Director Pablo Larrain for Q&A Event,"Kristen Stewart links up with Spencer director Pablo Larrain on Saturday night (December 7) for an event in Santa Monica, Calif. The 34-year-old actress earned a Best Actress nomination at the Oscars for her portrayal of Princess Diana in the 2021 movie. Thre…",https://cdn01.justjared.com/wp-content/uploads/headlines/2024/12/kristen-spencer.jpg,2024-12-08T04:19:19Z,,"Kristen Stewart links up with Spencer director Pablo Larrain on Saturday night (December 7) for an event in Santa Monica, Calif. 
The 34-year-old actress earned a Best Actress nomination at the Osca… [+736 chars]",,en,'Princess Diana'
https://bleacherreport.com/articles/10146338-report-bill-belichick-wants-to-prove-legacy-in-cfb-without-tom-bradys-shadow,https://bleacherreport.com/articles/10146338-report-bill-belichick-wants-to-prove-legacy-in-cfb-without-tom-bradys-shadow,0,bleacherreport.com,Report: Bill Belichick 'Wants to Prove' Legacy in CFB 'Without Tom Brady's Shadow',"Bill Belichick is arguably the greatest coach in NFL history, but his next stop might be in the college game. ESPN Chicago's Peggy Kusinski reported Sunday…","https://media.bleacherreport.com/image/upload/c_fill,g_faces,w_3800,h_2000,q_95/v1733668573/m9ixvs2gjpfvyfxswmqa.jpg",2024-12-08T14:37:23Z,,"Andy Lewis/Icon Sportswire via Getty Images
Bill Belichick is arguably the greatest coach in NFL history, but his next stop might be in the college game.
ESPN Chicago's Peggy Kusinski reported Sund… [+2551 chars]",,en,'Bill Belichick'
https://www.eonline.com/news/1410909/pregnant-gisele-buendchen-and-ex-tom-brady-share-sweet-birthday-tributes-to-son-benjamin,https://www.eonline.com/news/1410909/pregnant-gisele-buendchen-and-ex-tom-brady-share-sweet-birthday-tributes-to-son-benjamin,0,www.eonline.com,Gisele Bündchen & Ex Tom Brady Share Birthday Tributes to Son Benjamin,"Exes Gisele Bündchen and Tom Brady are kicking off their son Benjamin Brady's birthday celebration with heartwarming messages.
The former couple relayed their well-wishes alongside throwback...","https://akns-images.eonline.com/eol_images/Entire_Site/2024118/rs_1200x1200-241208135119-1200-tom-brady-sons-benjamin-jack-instagram-cjh-120824.jpg?fit=around%7C1080:1080&output-quality=90&crop=1080:1080;center,top",2024-12-08T23:20:21Z,,"Exes Gisele Bündchen and Tom Brady are kicking off their son Benjamin Brady's birthday celebration with heartwarming messages.
The former couple relayed their well-wishes alongside throwback photos … [+804 chars]",,en,'Tom Brady'
https://www.newsweek.com/taylor-swift-eras-tour-madrid-blake-lively-daughters-shoutout-1996199,https://www.newsweek.com/taylor-swift-eras-tour-madrid-blake-lively-daughters-shoutout-1996199,0,www.newsweek.com,Taylor Swift Eras Tour: Singer Gives Shoutout to Blake Lively's Daughters,"Swift called the characters named after Lively's daughters her ""favorites"" on her ""Folklore"" album.",https://d.newsweek.com/en/full/2537066/taylor-swift-madrid-concert-blake-lively-daughters.jpg,2024-12-09T07:00:11Z,,"In this series, Newsweek is recapping every show Taylor Swift has performed on the Eras Tour, city by city.
Swift gave her close friend Blake Lively's three daughters a sweet shoutout when they atte… [+2347 chars]",,en,'Taylor Swift'
https://www.newsweek.com/taylor-swift-eras-tour-atlanta-marjorie-1996224,https://www.newsweek.com/taylor-swift-eras-tour-atlanta-marjorie-1996224,0,www.newsweek.com,Taylor Swift Eras Tour: Singer Tears Up at Moving Tribute to Her Grandma,"Taylor Swift fans joined her in a tribute to her grandma, leaving her tearing up on stage.",https://d.newsweek.com/en/full/2537111/taylor-swift-eras-tour-marjorie-atlanta.jpg,2024-12-09T07:00:11Z,,"In this series, Newsweek is recapping every show Taylor Swift has performed on the Eras Tour, city by city.
Taylor Swift was left in tears after fans surprised her by lighting up their phones as she… [+2549 chars]",,en,'Taylor Swift'
https://www.newsweek.com/taylor-swift-eras-tour-cincinnati-surprise-song-tradition-1996268,https://www.newsweek.com/taylor-swift-eras-tour-cincinnati-surprise-song-tradition-1996268,0,www.newsweek.com,Taylor Swift Eras Tour: Singer Breaks Her Surprise Song Tradition,Taylor Swift fans got an extra surprise during the surprise song set at her Cincinnati concert.,https://d.newsweek.com/en/full/2537177/taylor-swift-cincinnati-surprise-songs-tradition.jpg,2024-12-09T07:00:11Z,,"In this series, Newsweek is recapping every show Taylor Swift has performed on the Eras Tour, city by city.
Taylor Swift broke tradition by playing three surprise songs at a show in Cincinnati.
The… [+2599 chars]",,en,'Taylor Swift'
https://www.newsweek.com/taylor-swift-eras-tour-las-vegas-history-female-artist-allegiant-stadium-1996217,https://www.newsweek.com/taylor-swift-eras-tour-las-vegas-history-female-artist-allegiant-stadium-1996217,0,www.newsweek.com,Taylor Swift Eras Tour: Singer Makes History at Las Vegas Stadium,"Taylor Swift made history at Allegiant Stadium in Las Vegas, but she told fans she wouldn't be the last.",https://d.newsweek.com/en/full/2537095/taylor-swift-eras-tour-allegiant-stadium.jpg,2024-12-09T07:00:11Z,,"In this series, Newsweek is recapping every show Taylor Swift has performed on the Eras Tour, city by city.
Taylor Swift made history in Las Vegas as she became the first female solo artist to headl… [+2328 chars]",,en,'Taylor Swift'
https://www.newsweek.com/taylor-swift-eras-tour-denver-space-satellite-images-1996274,https://www.newsweek.com/taylor-swift-eras-tour-denver-space-satellite-images-1996274,0,www.newsweek.com,Taylor Swift Eras Tour: Denver Concert Seen From Space,Swift's Denver show was so big that satellite images could see it from space.,https://d.newsweek.com/en/full/2537185/taylor-swift-eras-tour-denver-space.jpg,2024-12-09T07:00:12Z,,"In this series, Newsweek is recapping every show Taylor Swift has performed on the Eras Tour, city by city.
Swift's stratospheric status has been confirmed, with a satellite imagery company revealin… [+2403 chars]",,en,'Taylor Swift'
https://www.newsweek.com/taylor-swift-eras-tour-cardiff-speaks-welsh-1996283,https://www.newsweek.com/taylor-swift-eras-tour-cardiff-speaks-welsh-1996283,0,www.newsweek.com,Taylor Swift Eras Tour: Singer Speaks Foreign Language to Fans,Taylor Swift charmed fans in Cardiff when she spoke in the native language.,https://d.newsweek.com/en/full/2537202/taylor-swift-cardiff-concert-speaks-welsh.jpg,2024-12-09T07:00:12Z,,"In this series, Newsweek is recapping every show Taylor Swift has performed on the Eras Tour, city by city.
Taylor Swift charmed fans at her show in Cardiff by speaking Welsh on stage.
The ""Look Wh… [+2465 chars]",,en,'Taylor Swift'
https://www.newsweek.com/taylor-swift-eras-tour-santa-clara-wrong-lyrics-1996282,https://www.newsweek.com/taylor-swift-eras-tour-santa-clara-wrong-lyrics-1996282,0,www.newsweek.com,Taylor Swift Eras Tour: Singer Jokes About Wrong Lyrics at Santa Clara Show,Taylor Swift admitted she was struggling to nail the song and played off the mistake by getting personal with the fans.,https://d.newsweek.com/en/full/2537196/taylor-swift-santa-clara-lyrics-mistake.jpg,2024-12-09T07:00:12Z,,"In this series, Newsweek is recapping every show Taylor Swift has performed on the Eras Tour, city by city.
Swift poked fun at herself as she messed up the words to one of her songs during an Eras T… [+2355 chars]",,en,'Taylor Swift'
https://www.cnn.com/2024/12/09/entertainment/barry-keoghan-instagram-trolling-scli-intl/index.html,https://www.cnn.com/2024/12/09/entertainment/barry-keoghan-instagram-trolling-scli-intl/index.html,0,www.cnn.com,Barry Keoghan hits back over ‘disgusting’ online abuse | CNN,Irish actor Barry Keoghan has retaliated against what he describes as “inhumane” online trolling and accused people of intimidating his family.,"https://media.cnn.com/api/v1/images/stellar/prod/gettyimages-2151833905.jpg?c=16x9&q=w_800,c_fill",2024-12-09T12:42:20Z,http://archive.md/20241209151113/https://www.cnn.com/2024/12/09/entertainment/barry-keoghan-instagram-trolling-scli-intl/index.html,"Irish actor Barry Keoghan has retaliated against what he describes as inhumane online trolling and accused people of intimidating his family.
In a lengthy statement published on X on Saturday after … [+2588 chars]",,en,'Barry Keoghan'
https://www.foxnews.com/sports/social-media-influencer-breaks-silence-sabrina-carpenter-break-up-rumors-after-olivia-dunne-dis,https://www.foxnews.com/sports/social-media-influencer-breaks-silence-sabrina-carpenter-break-up-rumors-after-olivia-dunne-dis,0,www.foxnews.com,Social media influencer breaks silence on Sabrina Carpenter break up rumors after Olivia Dunne dis,Social media influencer Breckie Hill responded to rumors she was the reason why Sabrina Carpenter and Barry Keoghan broke up in recent weeks.,https://static.foxnews.com/foxnews.com/content/uploads/2024/12/dunne-hill.jpg,2024-12-09T13:03:10Z,http://archive.md/20241209134050/https://www.foxnews.com/sports/social-media-influencer-breaks-silence-sabrina-carpenter-break-up-rumors-after-olivia-dunne-dis,"Social media influencer Breckie Hill put rumors to rest that she was the reason why pop star Sabrina Carpenter and Irish actor Barry Keoghan broke up following a dis from an online rival.
Hill said … [+2599 chars]",,en,'Sabrina Carpenter'
https://chilledmagazine.com/sabrina-carpenters-absolut-kahlua-short-n-sweet-espresso-martini/,https://chilledmagazine.com/sabrina-carpenters-absolut-kahlua-short-n-sweet-espresso-martini/,0,chilledmagazine.com,Sabrina Carpenter’s Absolut & Kahlúa Short n’ Sweet Espresso Martini,"Our Drink of the Week is the Absolut & Kahlúa Short n’ Sweet Espresso Martini. As the official spirits sponsor of Sabrina Carpenter’s Short ‘n’ Sweet US Tour, Absolut & Kahlúa are releasing a limited-edition kit to enjoy the signature cocktail. Absolut & Kahl…",https://chilledmagazine.com/wp-content/uploads/2024/12/espresso-martini-kit-feat.jpg,2024-12-09T13:18:09Z,,"As the official spirits sponsor of Sabrina Carpenters Short n Sweet US Tour, Absolut &amp; Kahlúa are releasing a limited-edition kit to enjoy the signature cocktail.
Absolut &amp; Kahlúa, the brand… [+207 chars]",,en,'Sabrina Carpenter'
https://www.forbes.com/sites/daniellechemtob/2024/12/09/forbes-daily-assads-fall-in-syria-upends-middle-east-geopolitics/,https://www.forbes.com/sites/daniellechemtob/2024/12/09/forbes-daily-assads-fall-in-syria-upends-middle-east-geopolitics/,0,www.forbes.com,Forbes Daily: Assad’s Fall In Syria Upends Middle East Geopolitics,"Monday’s edition of Forbes Daily covers what’s next for the TikTok ban, new jobs data, Sam Bankman-Fried’s prison diary, the search for UnitedHealth CEO’s killer and more.","https://imageio.forbes.com/specials-images/imageserve/6756e2d7cd2371347706838e/0x0.jpg?format=jpg&crop=1585,892,x0,y80,safe&height=900&width=1600&fit=bounds",2024-12-09T13:23:06Z,http://archive.md/20241209134905/https://www.forbes.com/sites/daniellechemtob/2024/12/09/forbes-daily-assads-fall-in-syria-upends-middle-east-geopolitics/,"This is a published version of the Forbes Daily newsletter, you can sign-up to get Forbes Daily in your inbox here.
Good morning,
Aritzias viral moment has made its Canadian founder a billionaire.… [+9881 chars]",,en,'Steve Jobs'
https://slashdot.org/firehose.pl?op=view&amp;id=175619633,https://slashdot.org/firehose.pl?op=view&amp;id=175619633,0,slashdot.org,Barry Keoghan hits back over ‘disgusting’ online abuse - CNN,Barry Keoghan hits back over ‘disgusting’ online abuseCNN Sabrina Carpenter plagued by cheating scandal as pop star makes surprise appearance for fansFox News Barry Keoghan Deactivates His Instagram Due to 'Lies' About His FamilyVariety People Are Bothered An…,,2024-12-09T13:32:27Z,,The Fine Print: The following comments are owned by whoever posted them. We are not responsible for them in any way.,,en,'Barry Keoghan'
https://www.cosmopolitan.com/entertainment/celebs/a63133931/breckie-hill-denies-barry-keoghan-cheating-rumors/,https://www.cosmopolitan.com/entertainment/celebs/a63133931/breckie-hill-denies-barry-keoghan-cheating-rumors/,0,www.cosmopolitan.com,"Breckie Hill Releases Statement About Barry Keoghan Cheating Rumors, Denies Ever Meeting Him",Breckie Hill released a TikTok statement denying Barry Keoghan cheating rumors—watch here.,"https://hips.hearstapps.com/hmg-prod/images/screen-shot-2024-12-09-at-8-33-06-am-6756f1a00d969.png?crop=1xw:0.8973684210526316xh;center,top&resize=1200:*",2024-12-09T13:35:00Z,,"This just in: Breckie Hill has never even met Barry Keoghan. After days of cheating rumors amid the Saltburn star's breakup with Sabrina Carpenter, Breckie hopped on TikTok to explain that they are 1… [+1473 chars]",,en,'Sabrina Carpenter'
https://www.businessinsider.com/taylor-swift-eras-tour-facts-earnings-profit-2024-12,https://www.businessinsider.com/taylor-swift-eras-tour-facts-earnings-profit-2024-12,0,www.businessinsider.com,Taylor Swift spent 484 hours — the equivalent of over 20 straight days — singing onstage during the Eras Tour,"On Sunday, Taylor Swift officially wrapped up the Eras Tour in Vancouver after 149 shows in 21 countries, totaling about 484 hours spent performing on stage.",https://i.insider.com/6752424e4adc4cc13434ede1?width=1200&format=jpeg,2024-12-09T14:15:53Z,http://archive.md/20241209183921/https://www.businessinsider.com/taylor-swift-eras-tour-facts-earnings-profit-2024-12,"Taylor Swift performs during the Eras Tour.Kate Green/Getty Images
<ul><li>Taylor Swift's Eras Tour ended in Vancouver on Sunday.</li><li>The tour stretched for 149 dates, visited 21 countries, and … [+10500 chars]",,en,'Sabrina Carpenter'
http://www.autostraddle.com/a-nonsense-christmas-with-sabrina-carpenter-makes-the-yuletide-gay-and-horny/,http://www.autostraddle.com/a-nonsense-christmas-with-sabrina-carpenter-makes-the-yuletide-gay-and-horny/,0,www.autostraddle.com,‘A Nonsense Christmas with Sabrina Carpenter’ Makes the Yuletide Gay and Horny,"Sabrina Carpenter gives the gays everything they want this Christmas.
The post ‘A Nonsense Christmas with Sabrina Carpenter’ Makes the Yuletide Gay and Horny appeared first on Autostraddle.","https://www.autostraddle.com/wp-content/uploads/2024/12/sci-fi-1-3.png?resize=1200,675",2024-12-09T14:24:19Z,,"Sabrina Carpenter’s Netflix holiday special A Nonsense Christmas with Sabrina Carpenter is 50 minutes of pure musical nonsense, Sabrina joined by various guests for duets and silly sketches. It’s mad… [+2672 chars]",,en,'Sabrina Carpenter'
https://community.designtaxi.com/topic/6859-sabrina-carpenter-rolls-out-delectable-me-espresso-fragrance-that-smells-good-enough-to-eat/,https://community.designtaxi.com/topic/6859-sabrina-carpenter-rolls-out-delectable-me-espresso-fragrance-that-smells-good-enough-to-eat/,0,community.designtaxi.com,Sabrina Carpenter Rolls Out ‘Me Espresso’ Perfume That Smells Good Enough To Eat,"Sabrina Carpenter has brewed up something special with her latest fragrance, Me Espresso. Inspired by her chart-topping hit song Espresso, this Eau de Parfum is a delectable addition to her Fragrance by Sabrina collection. With its playful name and warm, swee…",https://media.invisioncic.com/y329496/monthly_2024_12/Sabrina-Carpenter-Me-Espresso-Perfume-Fragrance-1.jpg.26ab261f638f5cd300c48d4c8fb9f8c3.jpg,2024-12-09T14:26:15Z,,"Sabrina Carpenter has brewed up something special with her latest fragrance, Me Espresso. Inspired by her chart-topping hit song Espresso, this Eau de Parfum is a delectable addition to her Fragrance… [+1309 chars]",,en,'Sabrina Carpenter'
https://www.businessinsider.com/sabrina-carpenter-barry-keoghan-drama-timeline-2024-12,https://www.businessinsider.com/sabrina-carpenter-barry-keoghan-drama-timeline-2024-12,0,www.businessinsider.com,Here's a timeline of the Sabrina Carpenter-Barry Keoghan drama as the actor asks fans to stop harassing his young son,"Reports emerged that Sabrina Carpenter and Barry Keoghan are no longer a couple, with the actor later asking fans to stop ""intimidating"" his son.",https://i.insider.com/6756c498a57635a3d24d0665?width=1200&format=jpeg,2024-12-09T14:51:53Z,http://archive.md/20241209210644/https://www.businessinsider.com/sabrina-carpenter-barry-keoghan-drama-timeline-2024-12,"Sabrina Carpenter and Barry Keoghan have reportedly split up and fans are speculating about why things appear to have gone sour.
The couple never confirmed they were dating, but made multiple high-p… [+428 chars]",,en,'Barry Keoghan'
https://biztoc.com/x/27ab4b756679895c,https://biztoc.com/x/27ab4b756679895c,0,biztoc.com,Here's a timeline of the Sabrina Carpenter-Barry Keoghan drama as the actor asks fans to stop harassing his young son,"Barry Keoghan and Sabrina Carpenter attended the 2024 Met Gala in May.
Kevin Mazur/Getty Images
Reports emerged last week that Sabrina Carpenter and Barry Keoghan had split up.
Neither has directly addressed their relationship status publicly.
Keoghan posted …",https://biztoc.com/cdn/808/og.png,2024-12-09T14:56:10Z,,Barry Keoghan and Sabrina Carpenter attended the 2024 Met Gala in May.Kevin Mazur/Getty ImagesReports emerged last week that Sabrina Carpenter and Barry Keoghan had split up.Neither has directly addr… [+146 chars],,en,'Barry Keoghan'
https://www.thelineofbestfit.com/news/chappell-roan-and-sabrina-carpenter-unite-on-a-nonsense-christmas-with-sabrina-carpenter,https://www.thelineofbestfit.com/news/chappell-roan-and-sabrina-carpenter-unite-on-a-nonsense-christmas-with-sabrina-carpenter,0,www.thelineofbestfit.com,Chappell Roan and Sabrina Carpenter unite on A Nonsense Christmas With Sabrina Carpenter,"During Sabrina Carpenter's Christmas special, A Nonsense Christmas With Sabrina Carpenter, she performed a cover of Wham!'s ""Last Christmas"" alongside Chappell Roan.",https://best-fit.transforms.svdcdn.com/production/images/Chappell-Roan-Sabrina-Carpenter.png?w=1200&h=691&q=100&auto=format&fit=crop&dm=1733759721&s=fd3b6b2a7fc4dd23c3fff7ffc6a588b0,2024-12-09T15:00:00Z,,"The holidays have always been so special to me, Carpenter said in a Netflix press release ahead of the airing of the Christmas special. ""I am excited to bring my take to a classic holiday variety sho… [+547 chars]",,en,'Sabrina Carpenter'
https://tinybuddha.com/blog/how-my-life-changed-after-365-days-of-self-discovery/,https://tinybuddha.com/blog/how-my-life-changed-after-365-days-of-self-discovery/,0,tinybuddha.com,How My Life Changed After 365 Days of Self-Discovery,"“The only way to do great work is to love what you do. If you haven’t found it yet, keep looking. Don’t settle.” ~Steve Jobs
In 2017, I stood at a crossroads. Armed with a law degree but burdened by uncertainty, I faced a future that felt both daunting and un…",https://cdn.tinybuddha.com/wp-content/uploads/2024/12/Self-discovery.png,2024-12-09T15:15:20Z,,"“The only way to do great work is to love what you do. If you haven’t found it yet, keep looking. Don’t settle.” ~Steve Jobs
In 2017, I stood at a crossroads. Armed with a law degree but burdened by… [+6307 chars]",,en,'Steve Jobs'
