index,url,valid,domain,title,description,image,published,archive,content,quote,language,keyword
https://www.independent.ie/irish-news/obituary-bride-rosney-teacher-and-campaigner-who-became-adviser-to-mary-robinson-at-the-aras-and-the-un/a1035077642.html,https://www.independent.ie/irish-news/obituary-bride-rosney-teacher-and-campaigner-who-became-adviser-to-mary-robinson-at-the-aras-and-the-un/a1035077642.html,0,www.independent.ie,"Obituary: Bride Rosney, teacher and campaigner who became adviser to Mary Robinson at the Áras and the UN","Mary Robinson’s former special adviser Bride Rosney has died at the age of 74. In a wide and varied career, Rosney worked as a science teacher, school principal and, later, as head of the RTÉ press office. She was an active campaigner on many issues and a lea…",https://focus.independent.ie/thumbor/nUq_xEIkf72jw0syBbleqDpsy8E=/0x617:2290x2144/2290x1527/prod-mh-ireland/3f55a689-59a7-45a4-aed5-c6896c900803/345ff5f6-7268-4e33-b31b-8f2d9e809d82/b9ffa616-4ce9-4378-9820-8cd77702ed9d.jpg,2023-10-01T01:30:00Z,,"Mary Robinsons former special adviser Bride Rosney has died at the age of 74. In a wide and varied career, Rosney worked as a science teacher, school principal and, later, as head of the RTÉ press of… [+6739 chars]",,en,'Mary Robinson'
https://deadline.com/2023/09/britney-spears-police-wellness-check-dancing-with-knives-video-shakira-1235560917/,https://deadline.com/2023/09/britney-spears-police-wellness-check-dancing-with-knives-video-shakira-1235560917/,0,deadline.com,Britney Spears Addresses Police Wellness Check After Dancing With Knives Video Inspired By Shakira’s VMAs Performance,Britney Spears went viral this week when she shared a video on social media dancing with knives. The clip concerned people that police were called to do a wellness check on her and the singer is now calling law enforcement out. “Is it a joke in the news again…,https://deadline.com/wp-content/uploads/2023/09/britney-spears.jpg?w=1024,2023-10-01T03:11:58Z,,Britney Spears went viral this week when she shared a video on social media dancing with knives. The clip concerned people that police were called to do a wellness check on her and the singer is now … [+1473 chars],,en,'Britney Spears'
https://www.tmz.com/2023/10/01/britney-spears-cops-police-welfare-check-dancing-with-knives/,https://www.tmz.com/2023/10/01/britney-spears-cops-police-welfare-check-dancing-with-knives/,0,www.tmz.com,Britney Spears Launches on Cops Who Did Welfare Check After Dancing with Knives,"Britney Spears went off on cops Saturday ... demanding an apology after them came to her house a few days back to do a welfare check. As you know, Brit was dancing with knives Monday, and it looked perilous. She said they were prop knives, but fans…",https://imagez.tmz.com/image/59/16by9/2023/10/01/59e3f13003f14dc9bc82dadd3976bb3d_xl.jpg,2023-10-01T13:02:04Z,,"Britney Spears went off on cops Saturday ... demanding an apology after them came to her house a few days back to do a welfare check.
As you know, Brit was dancing with knives Monday, and it looked … [+1197 chars]",,en,'Britney Spears'
https://www.indiewire.com/news/breaking-news/todd-haynes-peggy-lee-biopic-michelle-williams-status-1234911400/,https://www.indiewire.com/news/breaking-news/todd-haynes-peggy-lee-biopic-michelle-williams-status-1234911400/,0,www.indiewire.com,Todd Haynes Open to Reviving Scrapped Peggy Lee Biopic with Michelle Williams: ‘The Interest Hasn’t Gone Away’,"Speaking to IndieWire on the red carpet of the New York Film Festival, Haynes refused to rule out returning to the lost passion project.",https://www.indiewire.com/wp-content/uploads/2023/10/GettyImages-684367814.jpg,2023-10-01T18:35:38Z,,"Todd Haynes has spent a large portion of the past decade trying to make “Fever,” his planned Peggy Lee biopic that never materialized. Haynes originally boarded the project in 2014, when Reese Wither… [+1883 chars]",,en,'Michelle Williams'
https://www.justjared.com/2023/10/01/justin-timberlake-jessica-biel-spotted-on-dinner-date-in-rome-following-ryder-cup/,https://www.justjared.com/2023/10/01/justin-timberlake-jessica-biel-spotted-on-dinner-date-in-rome-following-ryder-cup/,0,www.justjared.com,Justin Timberlake & Jessica Biel Spotted on Dinner Date in Rome Following Ryder Cup,"Justin Timberlake and Jessica Biel are stepping out for a nice dinner! The married couple was spotted dining with friends at Gallura Fish Restaurant in Rome, Italy on Saturday night (September 30). Justin, 42, and Jessica, 41, enjoyed dinner and wine before h…",https://cdn.justjared.com/wp-content/uploads/headlines/2023/10/justin-timberlake-jessica-biel-dinner-gallura1.jpg,2023-10-01T19:18:12Z,,"Justin Timberlake and Jessica Biel are stepping out for a nice dinner!
The married couple was spotted dining with friends at Gallura Fish Restaurant in Rome, Italy on Saturday night (September 30). … [+601 chars]",,en,'Jessica Biel'
https://www.vox.com/2023/10/1/23898555/kevinn-mccarthy-speakership-matt-gaetz,https://www.vox.com/2023/10/1/23898555/kevinn-mccarthy-speakership-matt-gaetz,0,www.vox.com,Congress just avoided a shutdown. Kevin McCarthy’s fight is just beginning.,"McCarthy, Matt Gaetz, and the motion to vacate, explained",https://cdn.vox-cdn.com/thumbor/V79sA1fy4-UCqOUEZMtbng505bs=/0x254:2778x1708/fit-in/1200x630/cdn.vox-cdn.com/uploads/chorus_asset/file/24968403/1454740442.jpg,2023-10-01T20:54:30Z,,"Congress finally managed to squeeze out a deal to fund the government for 45 days on Saturday, but the eleventh-hour resolution is already causing trouble for Speaker of the House Kevin McCarthy.
Re… [+8013 chars]",,en,'Matt Gaetz'
https://www.today.com/popculture/taylor-swift-friends-rcna118292,https://www.today.com/popculture/taylor-swift-friends-rcna118292,0,www.today.com,Brittany Mahomes spotted arriving for dinner with Taylor Swift. All about the singer's friend group,Who is in Taylor Swift's friend group in 2023? Here's a guide to the celebrities often spotted with the singer.,"https://media-cldnry.s-nbcnews.com/image/upload/t_social_share_1200x630_center,f_auto,q_auto:best/rockcms/2023-10/brittany-mahomes-taylor-swift-me-230930-434d5e.png",2023-10-01T21:20:00Z,,"Taylor Swift has been revisiting her previous eras, and her recent public appearances align perfectly with the upcoming release of her album 1989 (Taylors Version).
When the original album came out … [+5630 chars]",,en,'Taylor Swift'
https://www.marketscreener.com/news/latest/COP-28-President-Over-20-energy-companies-align-around-2050-net-zero-goal--44961259/,https://www.marketscreener.com/news/latest/COP-28-President-Over-20-energy-companies-align-around-2050-net-zero-goal--44961259/,0,www.marketscreener.com,COP 28 President: Over 20 energy companies align around 2050 net-zero goal,"(marketscreener.com) More than 20 oil and gas
companies have positively answered calls to align around net
zero by 2050, zero out methane emissions and eliminate routine
flaring by 2030, COP28 president Sultan al-Jaber said on Monday
at an energy conference.
…",https://www.marketscreener.com/images/twitter_MS_fdblanc.png,2023-10-02T06:14:32Z,,"ABU DHABI, Oct 2 (Reuters) - More than 20 oil and gas
companies have positively answered calls to align around net
zero by 2050, zero out methane emissions and eliminate routine
flaring by 2030, C… [+507 chars]",,en,'Sultan al-Jaber'
https://www.marketscreener.com/quote/commodity/BRENT-OIL-4948/news/COP28-president-says-oil-companies-support-2050-net-zero-goal-44961919/,https://www.marketscreener.com/quote/commodity/BRENT-OIL-4948/news/COP28-president-says-oil-companies-support-2050-net-zero-goal-44961919/,0,www.marketscreener.com,COP28 president says oil companies support 2050 net-zero goal,(marketscreener.com) ABU DHABI -COP28 president Sultan al-Jaber said on Monday that more than 20 oil and gas companies were rallying around his calls to curb carbon emissions ahead of a United Nations summit on climate change.https://www.marketscreener.com/qu…,https://img.zonebourse.com/reuters/2023-10/2023-10-02T080902Z_3_LYNXNPEJ91051_RTROPTP_3_CLIMATE-CHANGE-STOCKTAKE.JPG,2023-10-02T08:09:02Z,,ABU DHABI (Reuters) -COP28 president Sultan al-Jaber said on Monday that more than 20 oil and gas companies were rallying around his calls to curb carbon emissions ahead of a United Nations summit on… [+1856 chars],,en,'Sultan al-Jaber'
https://www.stereogum.com/2237356/the-number-ones-rihannas-sm-feat-britney-spears/columns/the-number-ones/,https://www.stereogum.com/2237356/the-number-ones-rihannas-sm-feat-britney-spears/columns/the-number-ones/,0,www.stereogum.com,The Number Ones: Rihanna’s “S&M” (Feat. Britney Spears),"In The Number Ones, I’m reviewing every single #1 single in the history of the Billboard Hot 100, starting with the chart’s beginning, in 1958, and working my way up into the present. Book Bonus Beat: The Number Ones: Twenty Chart-Topping Hits That Reveal the…",https://static.stereogum.com/uploads/2023/09/Rihanna-and-Britney-1695762283.jpeg,2023-10-02T12:31:29Z,,"In The Number Ones, I’m reviewing every single #1 single in the history of the Billboard Hot 100, starting with the chart’s beginning, in 1958, and working my way up into the present. Book Bonus Beat… [+13246 chars]",,en,'Britney Spears'
https://biztoc.com/x/73dd90d19de12d3a,https://biztoc.com/x/73dd90d19de12d3a,0,biztoc.com,Elon Musk live streamed himself playing 'Diablo IV' as he showed off X's new feature and asked Shivon Zilis if it was working properly,"Noam Galai/Getty Images for Heidi Klum Elon Musk played ""Diablo IV"" on Sunday night as he tested X's live streaming feature. He spent the first ten minutes asking Shivon Zilis if it was working correctly. And explained how only a user's subscribers will be ab…",https://c.biztoc.com/p/73dd90d19de12d3a/s.webp,2023-10-02T13:26:09Z,,"Noam Galai/Getty Images for Heidi KlumElon Musk played ""Diablo IV"" on Sunday night as he tested X's live streaming feature.He spent the first ten minutes asking Shivon Zilis if it was working correct… [+309 chars]",,en,'Elon Musk'
https://pitchfork.com/news/olivia-rodrigo-covers-noah-kahan-performs-3-songs-on-bbc-radio-1s-live-lounge-watch/,https://pitchfork.com/news/olivia-rodrigo-covers-noah-kahan-performs-3-songs-on-bbc-radio-1s-live-lounge-watch/,0,pitchfork.com,"Olivia Rodrigo Covers Noah Kahan, Performs “Vampire” and More on BBC Radio 1’s Live Lounge: Watch",She covered Kahan’s “Stick Season” and also played “Drivers License” and “Get Him Back!”,"https://media.pitchfork.com/photos/651acb6bce02a424a5cb7535/16:9/w_1280,c_limit/Olivia%20Rodrigo%20radio%201%20live%20lounge%20cover.jpg",2023-10-02T14:03:15Z,https://web.archive.org/web/20231003014802/https://pitchfork.com/news/olivia-rodrigo-covers-noah-kahan-performs-3-songs-on-bbc-radio-1s-live-lounge-watch,"Olivia Rodrigo visited BBC Radio 1s Live Lounge this morning to play selections from her albums Guts and Sour and cover Noah Kahans Stick Season. Watch the latter, plus Vampire, Drivers License, and … [+554 chars]",,en,'Olivia Rodrigo'
https://www.stereogum.com/2237795/olivia-rodrigo-noah-kahan-stick-season-cover-live-lounge/news/,https://www.stereogum.com/2237795/olivia-rodrigo-noah-kahan-stick-season-cover-live-lounge/news/,0,www.stereogum.com,Watch Olivia Rodrigo Cover Noah Kahan’s “Stick Season” In The BBC Radio 1 Live Lounge,"Olivia Rodrigo recently stopped by BBC Radio 1’s Live Lounge recently, where she performed “Drivers License” and two singles from her new album GUTS, “Vampire” and “Get Him Back!” She also covered a song by the folk-pop artist Noah Kahan, who we heard from la…",https://static.stereogum.com/uploads/2023/10/olivia-rodrigo-noah-kahan-cover-1696257301.jpg,2023-10-02T14:41:42Z,https://web.archive.org/web/20231003020010/https://www.stereogum.com/2237795/olivia-rodrigo-noah-kahan-stick-season-cover-live-lounge/news/,"Olivia Rodrigo recently stopped by BBC Radio 1’s Live Lounge recently, where she performed “Drivers License” and two singles from her new album GUTS, “Vampire” and “Get Him Back!” She also covered a … [+188 chars]",,en,'Olivia Rodrigo'
https://freerepublic.com/focus/f-chat/4186378/posts,https://freerepublic.com/focus/f-chat/4186378/posts,0,freerepublic.com,"California governor names Laphonza Butler, former Kamala Harris adviser, to Feinstein Senate seat [""Butler currently lives in Maryland""]","LOS ANGELES (AP) — California Gov. Gavin Newsom has selected Laphonza Butler, a Democratic strategist and adviser to Kamala Harris’ 2020 presidential campaign, to fill the U.S. Senate seat made vacant by the death of Sen. Dianne Feinstein. Butler currently li…",,2023-10-02T15:41:01Z,,"Skip to comments.
California governor names Laphonza Butler, former Kamala Harris adviser, to Feinstein Senate seat [""Butler currently lives in Maryland""]Associated Press ^
 | October 2, 2023
 | M… [+3973 chars]",,en,'Kamala Harris'
https://crooksandliars.com/2023/10/lol-fetterman-sends-comer-case-bud-light,https://crooksandliars.com/2023/10/lol-fetterman-sends-comer-case-bud-light,0,crooksandliars.com,LOL Fetterman Sends Comer A Case Of Bud Light,"Democratic U.S. Sen. John Fetterman of Pennsylvania continued his trend of calling Republican lawmakers on ""their bullshit"" by delivering a case of Bud Light beer to the House Committee on Oversight and Accountability on Thursday, as the panel held its first …",https://crooksandliars.com/files/primary_image/23/10/fetterman_budlight.jpg,2023-10-02T16:09:07Z,,"Democratic U.S. Sen. John Fetterman of Pennsylvania continued his trend of calling Republican lawmakers on ""their bullshit"" by delivering a case of Bud Light beer to the House Committee on Oversight … [+1808 chars]",,en,'John Fetterman'
https://nypost.com/2023/10/02/maryland-resident-laphonza-butler-to-be-california-senator/,https://nypost.com/2023/10/02/maryland-resident-laphonza-butler-to-be-california-senator/,0,nypost.com,Gavin Newsom picked Maryland resident Laphonza Butler to be California senator,California's soon-to-be senator for the next 15 months appears to be a Marylander.,https://nypost.com/wp-content/uploads/sites/2/2023/10/NYPICHPDPICT000053308438.jpg?quality=75&strip=all&w=1024,2023-10-02T16:09:14Z,http://wayback.archive-it.org/all/20231004092318/https://nypost.com/2023/10/02/maryland-resident-laphonza-butler-to-be-california-senator/,"California’s newest senator is a resident of the state of Maryland.
Democratic Golden State Gov. Gavin Newsom announced Sunday evening that he was tapping EMILYs List President Laphonza Butler to se… [+5139 chars]",,en,'John Fetterman'
https://biztoc.com/x/a67ff361b5d789a9,https://biztoc.com/x/a67ff361b5d789a9,0,biztoc.com,Oil Producers Pitch Themselves as Climate Solution Ahead of U.N. COP28 Summit,"Sultan al-Jaber, the president of the upcoming COP28 climate change, spoke at the energy conference in Abu Dhabi on Monday. ABU DHABI—Less two months before it hosts the United Nations’ climate summit, the United Arab Emirates on Monday gathered the world’s f…",https://c.biztoc.com/p/a67ff361b5d789a9/s.webp,2023-10-02T16:14:05Z,,"Sultan al-Jaber, the president of the upcoming COP28 climate change, spoke at the energy conference in Abu Dhabi on Monday.ABU DHABILess two months before it hosts the United Nations climate summit, … [+266 chars]",,en,'Sultan al-Jaber'
https://freerepublic.com/focus/f-news/4186393/posts,https://freerepublic.com/focus/f-news/4186393/posts,0,freerepublic.com,Fetterman: ‘I’m done normalizing this dysfunction’,"“I voted yes tonight to keep the government open, but I’m done normalizing this dysfunction,” Fetterman continued. “This is not entertainment, it’s governance. We must not allow the Freedom Caucus to turn our government into The Steve Wilkos Show.”",,2023-10-02T16:59:06Z,,"Skip to comments.
Fetterman: Im done normalizing this dysfunctionThe Hill ^
 | 9/30/23
 | Tara Suter
Posted on 10/02/2023 9:59:06 AM PDT by DallasBiff
I voted yes tonight to keep the government … [+3552 chars]",,en,'John Fetterman'
https://www.brooklynvegan.com/boygenius-lana-del-rey-played-all-things-go-2023-pics-video-setlists/,https://www.brooklynvegan.com/boygenius-lana-del-rey-played-all-things-go-2023-pics-video-setlists/,0,www.brooklynvegan.com,"boygenius & Lana Del Rey played All Things Go 2023 (pics, video, setlists)","After kicking off on Saturday, All Things Go wrapped up its 2023 edition on Sunday (10/1) at Columbia, MD’s Merriweather Post Pavilion. boygenius and Lana Del Rey headlined day two, and Lana brought out regular collaborator Jack Antonoff for a pair of songs, …",https://www.brooklynvegan.com/wp-content/uploads/2023/10/02/boygenius-lanadelrey-atg-11.jpg,2023-10-02T18:34:09Z,,"After kicking off on Saturday, All Things Go wrapped up its 2023 edition on Sunday (10/1) at Columbia, MD’s Merriweather Post Pavilion. boygenius and Lana Del Rey headlined day two, and Lana brought … [+1201 chars]",,en,'Lana Del Rey'
https://freerepublic.com/focus/f-news/4186422/posts,https://freerepublic.com/focus/f-news/4186422/posts,0,freerepublic.com,John Fetterman Responds To Senate Resolution On Dress Code With 'Kevin James Smirking' Meme,"It has been an improbably good week for memes and politics, as just one week after The White House posted a ""Worst Person You Know Made A Great Point"" meme on Twitter, Pennsylvania Senator John Fetterman arguably outdid the White House's social media team wit…",,2023-10-02T19:03:11Z,,"Skip to comments.
John Fetterman Responds To Senate Resolution On Dress Code With 'Kevin James Smirking' MemeMSN ^
 | 9/29/23
 | Adam Downer
Posted on 10/02/2023 12:03:11 PM PDT by DallasBiff
It… [+2699 chars]",,en,'John Fetterman'
https://jezebel.com/student-loan-deferment-survivors-1850884022,https://jezebel.com/student-loan-deferment-survivors-1850884022,0,jezebel.com,They Were Assaulted on Campus. They Might Have a Shot at Deferring Their Student Loans,"As a college freshman at Penn State, LaQuisha Anthony, once a star student athlete, was forced to drop out after experiencing a sexual assault. The harrowing experience would subject her to a 12-year “battle with suicide, severe depression, and financial inst…","https://i.kinja-img.com/image/upload/c_fill,f_auto,fl_progressive,g_center,h_675,pg_1,q_80,w_1200/00d85e50b1554f8250df5b313021c20f.jpg",2023-10-02T20:30:00Z,,"As a college freshman at Penn State, LaQuisha Anthony, once a star student athlete, was forced to drop out after experiencing a sexual assault. The harrowing experience would subject her to a 12-year… [+6871 chars]",,en,'John Fetterman'
https://www.highsnobiety.com/p/mugler-ss24-show/,https://www.highsnobiety.com/p/mugler-ss24-show/,0,www.highsnobiety.com,"With Angela Bassett & Paris Hilton, Mugler SS24 Did the Thing",What's not the love about Casey Cadwallader's Mugler? Massive hoop earrings. Buns-out campaigns . Ziwe appreciation . Making those sexy Mugler jeans affordable…,https://www.highsnobiety.com/static-assets/dato/1696280475-mugler-ss24-show-0.jpg,2023-10-02T21:04:43Z,,"What's not the love about Casey Cadwallader's Mugler? Massive hoop earrings. Buns-out campaigns. Ziwe appreciation. Making those sexy Mugler jeans affordable.
With Cadwallader leading at the helm, t… [+970 chars]",,en,'Paris Hilton'
https://jezebel.com/paris-hilton-x-partnership-1850893003,https://jezebel.com/paris-hilton-x-partnership-1850893003,0,jezebel.com,Will Paris Hilton Save Twitter?!,"Icon. Mogul. Global DJ. A triumvirate that’s feels about as overhyped and stale as the person it’s describing: Paris Hilton. On Monday, X (née Twitter) announced a collaboration with Hilton as a way to promote the platform’s live shopping feature. For a compa…","https://i.kinja-img.com/image/upload/c_fill,f_auto,fl_progressive,g_center,h_675,pg_1,q_80,w_1200/953fbcda45a8f02a1c41e4bb7cfd6e6c.jpg",2023-10-02T21:35:00Z,,"Icon. Mogul. Global DJ. A triumvirate thats feels about as overhyped and stale as the person its describing: Paris Hilton. On Monday, X (née Twitter) announced a collaboration with Hilton as a way to… [+2186 chars]",,en,'Paris Hilton'
https://www.breitbart.com/clips/2023/10/02/mace-havent-decided-on-backing-mccarthy-speaker-made-promises-that-have-not-been-kept/,https://www.breitbart.com/clips/2023/10/02/mace-havent-decided-on-backing-mccarthy-speaker-made-promises-that-have-not-been-kept/,0,www.breitbart.com,Mace: 'Haven't Decided' on Backing McCarthy — Speaker Made Promises 'That Have Not Been Kept',"Representative Nancy Mace (R-SC) said Monday on ABC's ""The View"" that she has not decided on how she would vote on a motion to vacate House Speaker Kevin McCarthy (R-CA) from his role as Speaker. | Clips",https://media.breitbart.com/media/2023/07/Mace-1-640x335.jpg,2023-10-02T21:47:23Z,,"Representative Nancy Mace (R-SC) said Monday on ABC’s “The View” that she has not decided on how she would vote on a motion to vacate House Speaker Kevin McCarthy (R-CA) from his role as Speaker.
Co… [+1315 chars]",,en,'Nancy Mace'
https://nypost.com/2023/10/02/absurd-attention-seeking-matt-gaetz-is-the-gops-john-fetterman/,https://nypost.com/2023/10/02/absurd-attention-seeking-matt-gaetz-is-the-gops-john-fetterman/,0,nypost.com,"Absurd, attention-seeking Matt Gaetz is the GOP’s John Fetterman",Matt Gaetz is making his biggest play yet by threatening to try to remove Kevin McCarthy from the speakership by offering a so-called motion to vacate.,https://nypost.com/wp-content/uploads/sites/2/2023/10/NYPICHPDPICT000053895698-e1696289671507.jpg?quality=75&strip=all&w=1024,2023-10-02T23:55:19Z,,"The Matt Gaetz moment is upon us, and unless you enjoy politics as absurdist theater, you might want to skip it. 
The bomb-throwing Republican congressman from Florida, who has hitherto distinguishe… [+3847 chars]",,en,'Kevin McCarthy'
http://www.newgeography.com/content/007960-could-a-third-party-save-america,http://www.newgeography.com/content/007960-could-a-third-party-save-america,0,www.newgeography.com,Could a Third Party Save America?,"With the presidential race now heating up, the US faces a choice of disastrous proportions. It is shaping up to be an unpopularity contest between Donald Trump – an unstable narcissist – and the doddering, likely corrupt Joe Biden. In fact, three-quarters of …",,2023-10-03T00:28:38Z,,"With the presidential race now heating up, the US faces a choice of disastrous proportions. It is shaping up to be an unpopularity contest between Donald Trump an unstable narcissist and the dodderin… [+3519 chars]",,en,'Joe Biden'
https://www.usmagazine.com/celebrity-news/news/justin-timberlake-jessica-biel-fly-to-a-better-place-for-rome-getaway/#article,https://www.usmagazine.com/celebrity-news/news/justin-timberlake-jessica-biel-fly-to-a-better-place-for-rome-getaway/#article,0,www.usmagazine.com,Justin Timberlake and Jessica Biel are in Sync on Rome Getaway,"Axelle/Bauer-Griffin/FilmMagic Justin Timberlake and Jessica Biel were totally in sync on their latest romantic getaway.  The couple were spotted holding hands on the streets of Rome, Italy, on Monday, October 2, per photos obtained by the Daily Mail. As they…",https://www.usmagazine.com/wp-content/uploads/2023/10/GettyImages-1396403806.jpg?crop=0px%2C224px%2C3389px%2C1780px&resize=1200%2C630&quality=86&strip=all,2023-10-03T03:21:42Z,,"Axelle/Bauer-Griffin/FilmMagic
Justin Timberlakeand Jessica Bielwere totally in sync on their latest romantic getaway. 
The couple were spotted holding hands on the streets of Rome, Italy, on Monda… [+2940 chars]",,en,'Jessica Biel'
https://www.seattlepi.com/entertainment/article/columbia-journalism-review-editor-leaving-to-18403020.php,https://www.seattlepi.com/entertainment/article/columbia-journalism-review-editor-leaving-to-18403020.php,0,www.seattlepi.com,Columbia Journalism Review editor leaving to encourage news outlets to devote more time to climate,"The leader of the Columbia Journalism Review says he's leaving that job to work at an organization that encourages news outlets to devote more attention to covering climate change. Since 2016, Kyle Pope has been editor and publisher of the leading academic ma…",https://s.hdnux.com/photos/01/34/02/65/24128891/3/rawImage.jpg,2023-10-03T04:39:27Z,,"FILE - A sign displays an unofficial temperature as jets taxi at Sky Harbor International Airport at dusk, July 12, 2023, in Phoenix. Phoenix, Arizonas most populous city, is in the record books agai… [+1966 chars]",,en,'Kyle Pope'
https://biztoc.com/x/373504426ea5faba,https://biztoc.com/x/373504426ea5faba,0,biztoc.com,Columbia Journalism Review editor leaving to encourage news outlets to devote more time to climate,"NEW YORK -- Saying that journalism isn't showing enough urgency in covering climate change, the editor of the Columbia Journalism Review is leaving his job to devote his time to try and change that. Kyle Pope, who has been editor and publisher of the magazine…",https://c.biztoc.com/p/373504426ea5faba/s.webp,2023-10-03T04:46:06Z,,"NEW YORK -- Saying that journalism isn't showing enough urgency in covering climate change, the editor of the Columbia Journalism Review is leaving his job to devote his time to try and change that.K… [+282 chars]",,en,'Kyle Pope'
