index,url,valid,domain,title,description,image,published,archive,content,quote,language,keyword
https://hiphopdx.com/news/victoria-monet-gift-usher-super-bowl-lviii-jacket,https://hiphopdx.com/news/victoria-monet-gift-usher-super-bowl-lviii-jacket,0,hiphopdx.com,Victoria Monét Gifts Usher Super Bowl LVIII Jacket Ahead Of His Halftime Show Performance,Victoria Monét had a special gift for Usher to commemorate his forthcoming Super Bowl LVIII Halftime Show performance while at a recent show.,https://static.hiphopdx.com/2023/11/victoria-monet-gifts-usher-super-bowl-lviii-jacket-ahead-of-his-halftime-show-performance-1200x675.jpg,2023-12-01T09:00:15Z,https://web.archive.org/web/20231201224247/https://hiphopdx.com/news/victoria-monet-gift-usher-super-bowl-lviii-jacket,"Victoria Monét has shown her admiration for Usher by not only giving him his proverbial flowers but a tangible token of her appreciation.
On Wednesday (November 29), the On My Mama songstress was a … [+3005 chars]",,en,'Victoria Monét'
https://www.aljazeera.com/news/2023/12/1/whos-attending-cop28-in-dubai-and-whos-giving-it-a,https://www.aljazeera.com/news/2023/12/1/whos-attending-cop28-in-dubai-and-whos-giving-it-a,0,www.aljazeera.com,Who’s attending COP28 in Dubai — and who’s giving it a miss?,"Modi, Sunak, Macron and multiple Middle Eastern leaders are there. Joe Biden and Xi Jinping are likely skipping it.",https://www.aljazeera.com/wp-content/uploads/2023/12/AP23335289535453-1701421544.jpg?resize=1920%2C1440,2023-12-01T12:51:49Z,,"More than a hundred world leaders are expected to attend the United Nations annual climate summit, COP28, which started in Dubai on Thursday and will continue until at least December 12.
On Thursday… [+3874 chars]",,en,'Joe Biden'
https://biztoc.com/x/0fb37e37373e0772,https://biztoc.com/x/0fb37e37373e0772,0,biztoc.com,“We Love You Johnny!”: Depp Gets Rock Star Treatment in Saudi Arabia,"Johnny Depp underlined his growing relationship with Saudi Arabia on Friday by taking part in a Q&A at the country’s Red Sea Film Festival in Jeddah following a screening of his feature Jeanne du Barry. The actor had been due to attend the screening itself, b…",https://c.biztoc.com/p/0fb37e37373e0772/s.webp,2023-12-01T18:22:14Z,,Johnny Depp underlined his growing relationship with Saudi Arabia on Friday by taking part in a Q&amp;A at the countrys Red Sea Film Festival in Jeddah following a screening of his feature Jeanne du … [+321 chars],,en,'Jeanne du Barry'
http://www.thewrap.com/paris-hilton-paris-in-love-season-2-family-memoir-interview/,http://www.thewrap.com/paris-hilton-paris-in-love-season-2-family-memoir-interview/,0,www.thewrap.com,Paris Hilton Says ‘Paris in Love’ Season 2 Brought Family ‘Even Closer’ After Her ‘Shocking’ Memoir,"""Paris: The Memoir"" revealed hidden past traumas from abuse at her Utah boarding school to feeling “private agony” during her early 2000s abortion
The post Paris Hilton Says ‘Paris in Love’ Season 2 Brought Family ‘Even Closer’ After Her ‘Shocking’ Memoir app…",https://www.thewrap.com/wp-content/uploads/2023/12/Paris-Hilton-Paris-in-Love.jpg,2023-12-01T19:26:34Z,,"The second season of Paris Hiltons Paris in Love delves into the socialites past traumas as she prepares to unveil her memoir to both the world and her family, prompting an emotional revelation that … [+5155 chars]",,en,'Carter Reum'
https://biztoc.com/x/ea8557fbe0b27364,https://biztoc.com/x/ea8557fbe0b27364,0,biztoc.com,Victoria Monét Proves Why She’s a Triple Threat: ‘I Feel Like It’s Definitely Uphill Right Now’,"Victoria Monét has long been considered an underdog. As far back as 2009, when she first chased her dreams of becoming a musician from Sacramento to Los Angeles, she’s spent much of her time out of the spotlight and confined to album liner notes as a songwrit…",https://c.biztoc.com/p/ea8557fbe0b27364/s.webp,2023-12-01T20:40:28Z,,"Victoria Monét has long been considered an underdog. As far back as 2009, when she first chased her dreams of becoming a musician from Sacramento to Los Angeles, shes spent much of her time out of th… [+290 chars]",,en,'Victoria Monét'
https://deadline.com/2023/12/jeanne-du-barry-red-sea-film-fest-maiwenn-johnny-depp-saudi-arabia-1235648901/,https://deadline.com/2023/12/jeanne-du-barry-red-sea-film-fest-maiwenn-johnny-depp-saudi-arabia-1235648901/,0,deadline.com,‘Jeanne du Barry’ Red Sea Film Fest Q&A: Watch Maïwenn & Johnny Depp Debate Whether Period Romance Is Funny With Saudi Audience,"French director Maïwenn and Johnny Depp hit Saudi Arabia’s Red Sea Film Festival on Friday for a special screening of the Saudi-backed period romance Jeanne du Barry followed by a Q&A. Maïwenn co-wrote, directed and stars as the titular courtesan opposite Dep…",https://deadline.com/wp-content/uploads/2023/12/GettyImages-1824672470.jpg?w=1024,2023-12-01T22:15:19Z,https://web.archive.org/web/20231202033540/https://deadline.com/2023/12/jeanne-du-barry-red-sea-film-fest-maiwenn-johnny-depp-saudi-arabia-1235648901/,"French director Maïwenn and Johnny Depp hit Saudi Arabia’s Red Sea Film Festival on Friday for a special screening of the Saudi-backed period romanceJeanne du Barry followed by a Q&amp;A.
Maïwenn co… [+2839 chars]",,en,'Jeanne du Barry'
https://biztoc.com/x/edef221118ac9a5d,https://biztoc.com/x/edef221118ac9a5d,0,biztoc.com,‘Jeanne du Barry’ Red Sea Film Fest Q&A: Watch Maïwenn & Johnny Depp Debate Whether Period Romance Is Funny With Saudi Audience,"French director Maïwenn and Johnny Depp hit Saudi Arabia’s Red Sea Film Festival on Friday for a special screening of the Saudi-backed period romance Jeanne du Barry followed by a Q&A. Maïwenn co-wrote, directed and stars as the titular courtesan opposite Dep…",https://c.biztoc.com/p/edef221118ac9a5d/s.webp,2023-12-01T22:16:09Z,,French director Maïwenn and Johnny Depp hit Saudi Arabias Red Sea Film Festival on Friday for a special screening of the Saudi-backed period romance Jeanne du Barry followed by a Q&amp;A.Maïwenn co-w… [+317 chars],,en,'Johnny Depp'
https://www.newscientist.com/article/2406098-how-big-a-problem-are-methane-and-other-non-co2-greenhouse-gases/,https://www.newscientist.com/article/2406098-how-big-a-problem-are-methane-and-other-non-co2-greenhouse-gases/,0,www.newscientist.com,How big a problem are methane and other non-CO2 greenhouse gases?,"Carbon dioxide is the dominant driver of climate change, but countries convening at COP28 are expected to make agreements to reduce methane and other often overlooked greenhouse gases",https://images.newscientist.com/wp-content/uploads/2023/12/01211858/SEI_182403116.jpg,2023-12-01T22:36:07Z,https://web.archive.org/web/20231205031211/https://www.newscientist.com/article/2406098-how-big-a-problem-are-methane-and-other-non-co2-greenhouse-gases/,"Fossil fuel production emits a majority of human-caused methane
Evgenii Panov/Shutterstock
Carbon dioxide is not the only greenhouse gas under fire at the COP28 climate summit in Dubai, United Arab… [+5618 chars]",,en,'nan nan'
https://hollywoodlife.com/2023/12/01/paris-hilton-reveals-the-gift-kim-kardashian-sent-for-baby-london/,https://hollywoodlife.com/2023/12/01/paris-hilton-reveals-the-gift-kim-kardashian-sent-for-baby-london/,0,hollywoodlife.com,Paris Hilton Gushes Over the Gift Kim Kardashian Sent for Baby London,The 'Paris in Love' star took to her Instagram Story recently to thank her longtime pal and Kris Jenner for the adorable gift they sent her newborn daughter.,https://hollywoodlife.com/wp-content/uploads/2023/12/paris-hilton-gift-kim-kardashian-baby-london-Ftr.jpg?quality=100,2023-12-01T23:32:11Z,,"Image Credit: Marion Curtis/Starpix/Shutterstock
Paris Hilton, 42, was over the moon with the gift that Kim Kardashian, 43, and her mother, Kris Jenner, 68, sent in celebration of baby London. The P… [+2442 chars]",,en,'Kim Kardashian'
https://www.rt.com/business/588426-no-science-fossil-fuels-reduction/,https://www.rt.com/business/588426-no-science-fossil-fuels-reduction/,0,www.rt.com,COP28 president claims there is ‘no science’ behind calls to phase out fossil fuels – Guardian,"The president of Cop28, Sultan Ahmed Al Jaber, cast doubt on claims that a phase-out of fossil fuels would restrict global heating to 1.5°C Read Full Article at RT.com",https://mf.b37mrtl.ru/files/2023.12/article/656c8fc085f54026ae1477b1.jpg,2023-12-03T14:48:49Z,https://web.archive.org/web/20231203150734/https://www.rt.com/business/588426-no-science-fossil-fuels-reduction/,"The president of the COP28 climate conference, Sultan Ahmed Al Jaber, has cast great doubt over zero-emissions policies being pushed by the United Nations, claiming there is “no science” to show that… [+2073 chars]",,en,'Ahmed Al Jaber'
https://www.etfdailynews.com/2023/12/03/fox-co-nasdaqfoxa-stake-boosted-by-baird-financial-group-inc/,https://www.etfdailynews.com/2023/12/03/fox-co-nasdaqfoxa-stake-boosted-by-baird-financial-group-inc/,0,www.etfdailynews.com,Fox Co. (NASDAQ:FOXA) Stake Boosted by Baird Financial Group Inc.,"Baird Financial Group Inc. grew its stake in shares of Fox Co. (NASDAQ:FOXA – Free Report) by 19.2% during the 2nd quarter, according to the company in its most recent filing with the Securities & Exchange Commission. The institutional investor owned 284,847 …",https://www.americanbankingnews.com/wp-content/timthumb/timthumb.php?src=https://www.marketbeat.com/logos/fox-co-logo.jpg?v=20221104114442&w=240&h=240&zc=2,2023-12-03T15:16:41Z,,"Baird Financial Group Inc. grew its stake in shares of Fox Co. (NASDAQ:FOXA – Free Report) by 19.2% during the 2nd quarter, according to the company in its most recent filing with the Securities &amp… [+5011 chars]",,en,'nan nan'
https://dailycaller.com/2023/12/03/un-climate-confab-uae-cold-water-rapid-green-energy-transition/,https://dailycaller.com/2023/12/03/un-climate-confab-uae-cold-water-rapid-green-energy-transition/,0,dailycaller.com,President Of UN Climate Confab Says There’s ‘No Science’ Behind Push To Phase Out Fossil Fuels,"Sultan Ahmed al-Jaber, president of this year&#039;s United Nations climate summit, said that there is &quot;no science&quot; behind calls to eliminate fossil fuels.",https://cdn01.dailycaller.com/wp-content/uploads/2023/12/GettyImages-1826492963-scaled-e1701653422837.jpg,2023-12-04T02:07:31Z,,"Sultan Ahmed Al Jaber, the president of this year’s United Nations (UN) climate summit, said that there is “no science” behind calls to eliminate fossil fuels to counter global warming, according to … [+2949 chars]",,en,'Sultan al-Jaber'
https://www.newsweek.com/fox-news-cuts-off-donald-trump-iowa-rally-arthel-neville-1849215,https://www.newsweek.com/fox-news-cuts-off-donald-trump-iowa-rally-arthel-neville-1849215,0,www.newsweek.com,Fox News Cuts Off Donald Trump During Live Broadcast,The network cut away from Trump's speech in Iowa to correct his comments about the 2020 election before switching to Florida Gov. Ron DeSantis' rally.,https://d.newsweek.com/en/full/2318108/fox-news-trump-cut.jpg,2023-12-04T14:38:47Z,https://web.archive.org/web/20231204150336/http://www.newsweek.com/fox-news-cuts-off-donald-trump-iowa-rally-arthel-neville-1849215,"Fox News cut off a live broadcast of a Donald Trump rally in Iowa to correct his ""untruths"" about the last election.
During a broadcast of Trump's Saturday rally, Fox anchor Arthel Neville cut away … [+3411 chars]",,en,'Rupert Murdoch'
https://theweek.com/royals/prince-harry-back-in-court-a-guide-to-the-duke-of-sussexs-latest-legal-battles,https://theweek.com/royals/prince-harry-back-in-court-a-guide-to-the-duke-of-sussexs-latest-legal-battles,0,theweek.com,Prince Harry back in court: a guide to the Duke of Sussex's latest legal battles,The 'most litigious' royal currently involved in cases against three major publishers as well as the Home Office,https://cdn.mos.cms.futurecdn.net/rMqQ8Nz39ZU2EpWUzPMgp4-1200-80.jpg,2023-12-04T15:15:41Z,https://web.archive.org/web/20231204153632/https://theweek.com/royals/prince-harry-back-in-court-a-guide-to-the-duke-of-sussexs-latest-legal-battles,Prince Harry was due back in court today to argue he was unfairly treated when denied security protection in 2020 shortly after he announced he and his wife were stepping back as working members of t… [+4724 chars],,en,'Prince Harry'
https://consent.yahoo.com/v2/collectConsent?sessionId=1_cc-session_5a4da164-d75c-4897-ac14-16ee8e86923b,https://consent.yahoo.com/v2/collectConsent?sessionId=1_cc-session_5a4da164-d75c-4897-ac14-16ee8e86923b,0,consent.yahoo.com,COP28 President Ahmed Al Jaber says he was misrepresented in comments on fossil fuels,,,2023-12-04T17:52:52Z,,"Si vous cliquez sur « Tout accepter », nos partenaires (y compris 239 qui font partie du Cadre de transparence et de consentement dIAB) et nous utiliserons également des témoins et vos données person… [+982 chars]",,en,'Ahmed Al Jaber'
https://www.today.com/parents/moms/paris-hilton-kids-rcna126820,https://www.today.com/parents/moms/paris-hilton-kids-rcna126820,0,www.today.com,Paris Hilton learns to change her son's diaper ... one month after his birth,Learn all about Paris Hilton's son Phoenix and daughter London.,"https://media-cldnry.s-nbcnews.com/image/upload/t_social_share_1200x630_center,f_auto,q_auto:best/rockcms/2023-12/paris-hilton-mc-231204-7812b8.jpg",2023-12-04T18:26:54Z,https://web.archive.org/web/20231204023455/https://www.today.com/parents/moms/paris-hilton-kids-rcna126820,Motherhood is messy. But 42-year-old reality star and entrepreneur Paris Hilton didn't discover just how messy it could be until she changed son Phoenix's diaper for the first time one month after he… [+5618 chars],,en,'Carter Reum'
https://www.thedailybeast.com/steve-bannon-blasts-fox-news-as-tv-for-stupid-people,https://www.thedailybeast.com/steve-bannon-blasts-fox-news-as-tv-for-stupid-people,0,www.thedailybeast.com,Steve Bannon Blasts Fox News as ‘TV for Stupid People’,"Real America’s Voice
Former Trump strategist Steve Bannon tore into Fox News for cutting away from a Donald Trump speech over the weekend and fact-checking the former president’s election conspiracies, calling the conservative cable giant “TV for stupid peop…","https://img.thedailybeast.com/image/upload/c_crop,d_placeholder_euli9k,h_687,w_1221,x_36,y_0/dpr_2.0/c_limit,w_740/fl_lossy,q_auto/v1701730745/Screenshot_Capture_-_2023-12-04_-_16-56-59_kjqftv",2023-12-04T23:11:45Z,https://web.archive.org/web/20231205072806/https://www.thedailybeast.com/steve-bannon-blasts-fox-news-as-tv-for-stupid-people,"Former Trump strategist Steve Bannon tore into Fox News for cutting away from a Donald Trump speech over the weekend and fact-checking the former presidents election conspiracies, calling the conserv… [+2099 chars]",,en,'Rupert Murdoch'
https://zacjohnson.com/aerin-elisabeth-murdoch-net-worth/,https://zacjohnson.com/aerin-elisabeth-murdoch-net-worth/,0,zacjohnson.com,Aerin Elisabeth Murdoch Net Worth – How Much is Murdoch Worth?,"Rupert Murdoch’s daughter, Aerin Elisabeth Murdoch, is a prominent member of the Murdoch family. While the exact figure of her net worth is not specified, the Murdoch family as a whole has a combined net worth of $17.1 billion, according to Forbes. Aerin Elis…",https://zacjohnson.com/wp-content/uploads/2023/12/aerin-elisabeth-murdoch-net-worth.jpg,2023-12-05T06:44:28Z,,"Rupert Murdoch’s daughter, Aerin Elisabeth Murdoch, is a prominent member of the Murdoch family. While the exact figure of her net worth is not specified, the Murdoch family as a whole has a combined… [+20102 chars]",,en,'Rupert Murdoch'
https://www.cjr.org/the_media_today/telegraph_takeover_zucker_uae.php,https://www.cjr.org/the_media_today/telegraph_takeover_zucker_uae.php,0,www.cjr.org,The elephant in the room,"<p>Recently, members of Britain’s political and media elite went to a swanky annual awards dinner held by The Spectator, a magazine of the Conservative establishment that once counted Boris Johnson as its editor. (Think the Gridiron Dinner in DC.) Attendees s…",https://www.cjr.org/wp-content/uploads/2022/02/AP_22034099601177-800x419.jpg?311942,2023-12-05T13:03:50Z,https://web.archive.org/web/20231206050949/https://www.cjr.org/the_media_today/telegraph_takeover_zucker_uae.php,"Recently, members of Britains political and media elite went to a swanky annual awards dinner held by The Spectator, a magazine of the Conservative establishment that once counted Boris Johnson as it… [+14479 chars]",,en,'Rupert Murdoch'
https://pagesix.com/2023/12/05/parents/paris-hilton-admits-she-didnt-change-son-phoenixs-diaper-for-one-month/,https://pagesix.com/2023/12/05/parents/paris-hilton-admits-she-didnt-change-son-phoenixs-diaper-for-one-month/,0,pagesix.com,Paris Hilton admits she didn’t change son Phoenix’s diaper for one month,"""I said I wouldn’t do this on my birthday, but I will for you,"" the ""Paris in Love"" star, who welcomed Phoenix via surrogate, told her baby boy.",https://pagesix.com/wp-content/uploads/sites/3/2023/12/paris-hilton-83.jpg?quality=75&strip=all&w=1024,2023-12-05T16:02:19Z,https://web.archive.org/web/20231206041058/https://pagesix.com/2023/12/05/parents/paris-hilton-admits-she-didnt-change-son-phoenixs-diaper-for-one-month/,"Paris Hilton revisited her “Simple Life” days when she changed her first diaper one month after her son Phoenix’s arrival via surrogate.
The reality star asked her sister, Nicky Hilton, if she shoul… [+2301 chars]",,en,'Carter Reum'
https://hollywoodlife.com/2023/12/05/did-paris-hilton-name-her-daughter-after-london-tipton/,https://hollywoodlife.com/2023/12/05/did-paris-hilton-name-her-daughter-after-london-tipton/,0,hollywoodlife.com,Did Paris Hilton Name Her Daughter After Brenda Song’s Character London Tipton?,London Tipton from 'The Suite Life of Zack and Cody' was inspired by Paris Hilton. So did Paris return the favor when she picked the name for her newborn daughter?,https://hollywoodlife.com/wp-content/uploads/2023/12/Paris-Hilton-Brenda-Song-feat.jpg?quality=100,2023-12-05T16:09:56Z,,"Image Credit: Shutterstock
Paris Hilton, 42, welcoming a daughter named London seemed like fate considering Paris connection to The Suite Life of Zack and Cody. In the Disney Channel series, Brenda … [+2360 chars]",,en,'Carter Reum'
https://www.newsweek.com/elon-musk-anything-person-year-opinion-1849801,https://www.newsweek.com/elon-musk-anything-person-year-opinion-1849801,0,www.newsweek.com,Elon Musk Is Anything But 'Person of the Year' | Opinion,"In our lifetime, there has never been a ""world's richest man"" more driven by dangerous ideology and none with more of a blindly devoted following.",https://d.newsweek.com/en/full/2319090/elon-musk-speaks-onstage.jpg,2023-12-05T19:36:27Z,https://web.archive.org/web/20231205202033/https://www.newsweek.com/elon-musk-anything-person-year-opinion-1849801,"When considering whether billionaire Elon Musk should be elevated with a ""Person of the Year"" title, my answer would be a resounding ""no.""
Whether you want to believe he's one of the preeminent tech… [+4741 chars]",,en,'Rupert Murdoch'
https://hollywoodlife.com/2023/12/05/paris-hilton-says-it-took-a-month-to-change-sons-diapers-after-birth/,https://hollywoodlife.com/2023/12/05/paris-hilton-says-it-took-a-month-to-change-sons-diapers-after-birth/,0,hollywoodlife.com,Paris Hilton Reveals It Took Her a Full Month to Start Changing Infant Son’s Diapers After His Birth,The mom of two joked that she was ‘scared’ before changing her baby boy’s diaper during an episode of ‘Paris in Love.’,https://hollywoodlife.com/wp-content/uploads/2023/12/paris-hilton-ss-feat.jpg?quality=100,2023-12-05T21:57:38Z,,"Image Credit: Ben Trivett/Shutterstock
Motherhood is different for all moms, and Paris Hilton dropped an interesting revelation during a recent episode of Paris in Love. The 42-year-old entrepreneur… [+2252 chars]",,en,'Carter Reum'
https://pagesix.com/2023/12/05/parents/paris-hilton-reveals-why-she-kept-pregnancies-a-secret-im-really-happy-i-did-it-that-way/,https://pagesix.com/2023/12/05/parents/paris-hilton-reveals-why-she-kept-pregnancies-a-secret-im-really-happy-i-did-it-that-way/,0,pagesix.com,Paris Hilton reveals why she kept pregnancies a secret: ‘I’m really happy I did it that way’,"The ""Stars Are Blind"" songstress and her husband, Carter Reum, welcomed their daughter, London, 10 months after the birth of their son, Phoenix.",https://pagesix.com/wp-content/uploads/sites/3/2023/12/paris.jpg?quality=75&strip=all&w=1024,2023-12-06T02:07:50Z,https://web.archive.org/web/20231206105421/https://pagesix.com/2023/12/05/parents/paris-hilton-reveals-why-she-kept-pregnancies-a-secret-im-really-happy-i-did-it-that-way/,"Paris Hilton revealed that she kept her pregnancies under wraps because most of her life has already “been so public.”
While discussing the birth of her two kids within one year with Romper, the soc… [+4114 chars]",,en,'nan nan'
https://biztoc.com/x/78cc9750088da5a2,https://biztoc.com/x/78cc9750088da5a2,0,biztoc.com,Paris Hilton On Why She Chose Surrogacy For Her Children,"Surprise, Paris Hilton has another baby! Hilton and husband Carter Reum revealed last week that they’d welcomed daughter London Marilyn Hilton Reum via surrogate, promoting son Phoenix to big brother status at the age of 10 months old. In a new interview with…",https://c.biztoc.com/p/78cc9750088da5a2/s.webp,2023-12-06T18:42:20Z,,"Surprise, Paris Hilton has another baby! Hilton and husband Carter Reum revealed last week that theyd welcomed daughter London Marilyn Hilton Reum via surrogate, promoting son Phoenix to big brother … [+302 chars]",,en,'Carter Reum'
