index,url,valid,domain,title,description,image,published,archive,content,quote,language,keyword
https://www.cbsnews.com/news/face-the-nation-full-transcript-10-08-2023/,https://www.cbsnews.com/news/face-the-nation-full-transcript-10-08-2023/,0,www.cbsnews.com,"Full transcript of ""Face the Nation,"" Oct. 8, 2023","On this ""Face the Nation"" broadcast, U.S. Secretary of State Antony Blinken and Rep. Nancy Mace, Republican of South Carolina, join Margaret Brennan.",https://assets1.cbsnewsstatic.com/hub/i/r/2023/10/08/438e8626-49f9-4322-b1a6-4b49adcfc1f4/thumbnail/1200x630/2948a60cf2aa9ad8e14129b7e1cd498e/screenshot-2023-10-08-at-7-02-42-pm.png?v=f334c339940ae79342a8ce7757900604,2023-10-08T23:16:00Z,,"On this ""Face the Nation"" broadcast, moderated by Margaret Brennan: 
<ul><li>Israeli ambassador to the U.S. Michael Herzog</li><li>Secretary of State Antony Blinken </li><li>Rep. Nancy Mace, Republi… [+47637 chars]",,en,'nan nan'
https://crooksandliars.com/2023/10/jim-jordan-supporter-nancy-mace-feigns,https://crooksandliars.com/2023/10/jim-jordan-supporter-nancy-mace-feigns,0,crooksandliars.com,Jim Jordan Supporter Nancy Mace Feigns Ignorance Of Ohio State Sex Abuse,"Rep. Nancy Mace (R-SC), an advocate for sexual assault victims, offered no defense of Rep. Jim Jordan's Ohio State wrestling controversy as she supported his bid for House Speaker.


On Sunday, CBS host Margaret Brennan asked Mace about allegations that Jorda…",https://crooksandliars.com/files/primary_image/23/10/wusa_10-08-2023_11.03.07-0001-enhanced.jpg,2023-10-09T00:55:55Z,,"Rep. Nancy Mace (R-SC), an advocate for sexual assault victims, offered no defense of Rep. Jim Jordan's Ohio State wrestling controversy as she supported his bid for House Speaker.
On Sunday, CBS ho… [+1140 chars]",,en,'Nancy Mace'
https://www.euractiv.com/section/politics/news/french-left-in-turmoil-after-melenchons-party-reacts-to-hamas-attacks/,https://www.euractiv.com/section/politics/news/french-left-in-turmoil-after-melenchons-party-reacts-to-hamas-attacks/,0,www.euractiv.com,French left in turmoil after Mélenchon’s party reacts to Hamas attacks,"France’s radical left party La France insoumise has been condemned over it’s wording related to Hamas’ attacks on Israel last Friday, which has been unanimously condemned by the entire French political class. “The armed offensive by Palestinian forces led by.…",https://www.euractiv.com/wp-content/uploads/sites/2/2023/10/7041512-800x450.jpg,2023-10-09T04:58:39Z,,"Frances radical left party La France insoumise has been condemned over its wording related to Hamas attacks on Israel last Friday, which has been unanimously condemned by the entire French political … [+3530 chars]",,en,'Jean-Luc Mélenchon'
https://www.thedailybeast.com/the-diciest-thing-steve-scalise-and-jim-jordan-are-battling-over,https://www.thedailybeast.com/the-diciest-thing-steve-scalise-and-jim-jordan-are-battling-over,0,www.thedailybeast.com,‘The Diciest Thing’ Steve Scalise and Jim Jordan Are Battling Over,"Photo Illustration by Thomas Levinson/The Daily Beast/Getty
For years, a rotating cast of House GOP leaders have shared a fatal flaw: an inclination to only address their most immediate problems.In January, Rep. Kevin McCarthy (R-CA) won the speaker’s gavel …","https://img.thedailybeast.com/image/upload/c_crop,d_placeholder_euli9k,h_1688,w_3000,x_0,y_0/dpr_2.0/c_limit,w_740/fl_lossy,q_auto/v1696823504/231008-scalise-jordan-tease_twulj9",2023-10-09T08:38:08Z,,"For years, a rotating cast of House GOP leaders have shared a fatal flaw: an inclination to only address their most immediate problems.
In January, Rep. Kevin McCarthy (R-CA) won the speakers gavel … [+10410 chars]",,en,'Jim Jordan'
https://ritholtz.com/2023/10/10-monday-am-reads-403/,https://ritholtz.com/2023/10/10-monday-am-reads-403/,0,ritholtz.com,10 Monday AM Reads,My back-to-work morning train WFH reads: • ‘A Galactic Embarrassment’: The Crypto World Is Already Sick of SBF’s Trial: FTX founder Sam Bankman-Fried’s trial for fraud is sucking all the air out of the room. Crypto folks can’t wait for it to be over. (Wired) …,https://ritholtz.com/wp-content/uploads/2023/10/amazon.png,2023-10-09T10:30:29Z,,A Galactic Embarrassment: The Crypto World Is Already Sick of SBFs Trial: FTX founder Sam Bankman-Fried’s trial for fraud is sucking all the air out of the room. Crypto folks cant wait for it to be o… [+2662 chars],,en,'Sam Bankman-Fried'
https://www.politico.com/news/2023/10/09/gavin-newsom-laphonza-butler-pick-00120477,https://www.politico.com/news/2023/10/09/gavin-newsom-laphonza-butler-pick-00120477,0,www.politico.com,The inside story of how Newsom picked Butler for Senate,The madcap 48 hours that went into Gov. Gavin Newsom naming Laphonza Butler a U.S. senator.,https://static.politico.com/13/1b/895efeee40048b7301583e6e1bc4/senate-california-butler-60155.jpg,2023-10-09T11:00:00Z,,"He was now on the clock to name her replacement. But he needed time to mourn.
The next 48 hours would come to define a transformational chapter not just in the career of Newsom, a last-term governor… [+13224 chars]",,en,'Chuck Schumer'
https://www.cosmopolitan.com/entertainment/celebs/a45482360/heidi-klum-daughter-leni-intimissimi-campaign/,https://www.cosmopolitan.com/entertainment/celebs/a45482360/heidi-klum-daughter-leni-intimissimi-campaign/,0,www.cosmopolitan.com,Heidi Klum and Her Daughter Leni Look Incredible Celebrating Their New Lingerie Campaign,Just a normal/casual mother-daughter moment!,"https://hips.hearstapps.com/hmg-prod/images/heidi-klum-and-leni-klum-attend-the-intimissimi-dinner-at-news-photo-1696850683.jpg?crop=1.00xw:0.335xh;0,0.0999xh&resize=1200:*",2023-10-09T12:08:00Z,,"Supermodel 
Heidi Klum and her daughter Leni Klum have joined forces for an ad campaign with Intimissimi, and stepped out to celebrate the launch in lingerie inspired looks. Heidi wore a pink lace m… [+1428 chars]",,en,'Leni Klum'
https://www.msnbc.com/rachel-maddow-show/maddowblog/nancy-mace-keeps-getting-tripped-details-know-rcna119460,https://www.msnbc.com/rachel-maddow-show/maddowblog/nancy-mace-keeps-getting-tripped-details-know-rcna119460,0,www.msnbc.com,Nancy Mace keeps getting tripped up by details she ought to know,Donald Trump has referred to Nancy Mace as a “grandstanding loser.” The congresswoman's latest on-air interviews probably won’t help in this regard.,"https://media-cldnry.s-nbcnews.com/image/upload/t_nbcnews-fp-1200-630,f_auto,q_auto:best/rockcms/2023-10/231009-Nancy-Mace-al-0856-ce66cb.jpg",2023-10-09T13:34:27Z,,"As Rep. Nancy Mace continues to overhaul her political reputation on Capitol Hill, making the transition from a perceived moderate to a more reliably conservative partisan, the South Carolina Republi… [+3060 chars]",,en,'Donald Trump'
https://www.the-independent.com/news/world/americas/us-politics/nancy-mace-jim-jordan-speaker-b2426619.html,https://www.the-independent.com/news/world/americas/us-politics/nancy-mace-jim-jordan-speaker-b2426619.html,0,www.the-independent.com,Nancy Mace joins Trump in endorsing Jim Jordan for speaker,The South Carolina Republican was one of only eight in her party to vote to oust Kevin McCarthy from his post,https://static.independent.co.uk/2023/02/09/21/GettyImages-1459386823.jpg?quality=75&width=1200&auto=webp,2023-10-09T13:51:40Z,,"South Carolina Congresswoman Nancy Mace endorsed Rep Jim Jordan to become the new House speaker, echoing former President Donald Trump in advocating for the Ohio Republican to replace Kevin McCarthy.… [+2004 chars]",,en,'Nancy Mace'
https://www.dailydot.com/debug/nancy-mace-jim-jordan-speaker/,https://www.dailydot.com/debug/nancy-mace-jim-jordan-speaker/,0,www.dailydot.com,Nancy Mace says she doesn’t ‘know anything’ about abuse cover-up allegations leveled at Jim Jordan—as she endorses him for House Speaker,"Rep. Nancy Mace (R-S.C.) threw her support behind Rep. Jim Jordan (R-Ohio) to become the next House Speaker—while claiming that she didn't know anything about the Ohio State sex abuse scandal that occurred while Jordan was the assistant wrestling coach.


""I …",https://uploads.dailydot.com/2023/10/Nancy-Mace.jpg?auto=compress&fm=pjpg,2023-10-09T14:09:52Z,,Rep. Nancy Mace (R-S.C.) threw her support behind Rep. Jim Jordan (R-Ohio) to become the next House Speakerwhile claiming that she didn’t know anything about the Ohio State sex abuse scandal that occ… [+2022 chars],,en,'Jim Jordan'
https://deadspin.com/jim-jordan-ohio-st-wrestling-sex-abuse-scandal-1850911739,https://deadspin.com/jim-jordan-ohio-st-wrestling-sex-abuse-scandal-1850911739,0,deadspin.com,Shouldn’t we be hearing more about Jim Jordan and the Ohio State wrestling team sex-abuse scandal ?,Allegations that he knew of the abuse and did nothing seem relevant to his trying to become third in line to the nuclear codes,"https://i.kinja-img.com/image/upload/c_fill,f_auto,fl_progressive,g_center,h_675,pg_1,q_80,w_1200/2bdfea8df798617217a91e3323fef654.jpg",2023-10-09T14:30:00Z,,"Jim Jordan wants to be Speaker of the House. 
Thats right, the man who once accused a nine-year-old child rape victim of lying about the incident in order to get an abortion wants to be third in lin… [+7977 chars]",,en,'Jim Jordan'
https://bleedingcool.com/tv/the-crown-season-6-teaser-key-art-confirm-part-1-set-for-november/,https://bleedingcool.com/tv/the-crown-season-6-teaser-key-art-confirm-part-1-set-for-november/,0,bleedingcool.com,"The Crown Season 6 Teaser, Key Art Confirm Part 1 Set For November","Our previous looks at the sixth & final season of Netflix & series creator Peter Morgan's The Crown focused on Prince William (Ed McVey) & Kate Middleton (Meg Bellamy), as well as a wedding invitation teaser image for His Royal Highness Charles, The Prince of…",https://bleedingcool.com/wp-content/uploads/2023/10/F8AQiORWQAAB8Pt-1200x628.jpg,2023-10-09T15:31:08Z,,"Posted in: Netflix, Preview, TV, YouTube | Tagged: netflix, preview, Season 6, teaser, the crown
With Part 1 set for November 16th (and Part 2 on December 14th), here's the date announcement teaser … [+2622 chars]",,en,'Ed McVey'
https://www.bloomberglinea.com/english/argentinas-senate-approves-bill-to-eliminate-income-tax/,https://www.bloomberglinea.com/english/argentinas-senate-approves-bill-to-eliminate-income-tax/,0,www.bloomberglinea.com,Argentina's Senate Approves Bill to Eliminate Income Tax,The upper house approved the legislation late Thursday advocated by Economy Minister and presidential candidate Sergio Massa,https://www.bloomberglinea.com/resizer/pmaZ-1MBpRkn9cETvoD9-9Tej10=/1024x0/filters:format(webp):quality(75)/cloudfront-us-east-1.images.arcpublishing.com/bloomberglinea/D6YK5OOBS4FI2SWBKC6QGIFWBA.jpg,2023-10-09T16:26:45Z,,"Bloomberg — Argentinas upper house of congress approved a bill late Thursday that will eliminate income taxes for almost all formal workers, a measure poised to put more pressure on a ballooning fisc… [+1675 chars]",,en,'Sergio Massa'
https://boingboing.net/2023/10/09/nancy-mace-plays-dumb-on-jim-jordans-sex-abuse-scandal-while-endorsing-him-for-speaker.html,https://boingboing.net/2023/10/09/nancy-mace-plays-dumb-on-jim-jordans-sex-abuse-scandal-while-endorsing-him-for-speaker.html,0,boingboing.net,Nancy Mace plays dumb on Jim Jordan's sex abuse scandal while endorsing him for Speaker,"South Carolina Republican Congressperson Nancy Mace has had a hard time since crossing internal party lines to vote for removing former Speaker of the House Kevin McCarthy. Mace has now endorsed the gerrymandered-into-relevance Ohio MAGA standard bearer, Jim …",https://i0.wp.com/boingboing.net/wp-content/uploads/2023/10/image-21.png?fit=1090%2C746&ssl=1,2023-10-09T17:05:51Z,,South Carolina Republican Congressperson Nancy Mace has had a hard time since crossing internal party lines to vote for removing former Speaker of the House Kevin McCarthy. Mace has now endorsed the … [+1109 chars],,en,'Kevin McCarthy'
https://nypost.com/2023/10/09/mccarthy-open-to-return-as-speaker-whatever-the-conference-wants/,https://nypost.com/2023/10/09/mccarthy-open-to-return-as-speaker-whatever-the-conference-wants/,0,nypost.com,Kevin McCarthy open to House speaker gig again: ‘Whatever the conference wants’,"Although not actively running to reclaim the gavel, Kevin McCarthy (R-Calif.) expressed willingness Monday to serve again if the House GOP conference wants it.",https://nypost.com/wp-content/uploads/sites/2/2023/10/NYPICHPDPICT000058178060.jpg?quality=75&strip=all&w=1024,2023-10-09T17:11:41Z,,"Kevin McCarthy isn’t ruling out a surprise return to the House speakership if his fellow Republicans can’t agree on who should replace him.
Although not actively running to reclaim the gavel he lost… [+4356 chars]",,en,'Kevin McCarthy'
https://www.forbes.com/sites/hughmcintyre/2023/10/09/lady-gaga-and-the-rolling-stones-hit-the-billboard-charts-together/,https://www.forbes.com/sites/hughmcintyre/2023/10/09/lady-gaga-and-the-rolling-stones-hit-the-billboard-charts-together/,0,www.forbes.com,Lady Gaga And The Rolling Stones Hit The Billboard Charts Together,"“Sweet Sounds of Heaven” makes its debut on this week’s Rock Digital Song Sales chart, which ranks the best-selling rock tunes in America.",https://imageio.forbes.com/specials-images/imageserve/65243d92e0e8f5e1d1c87e5f/0x0.jpg?format=jpg&width=1200,2023-10-09T17:52:23Z,,"NEWARK, NJ - DECEMBER 15: Lady Gaga and Mick Jagger of The Rolling Stones performs at the ... [+] Prudential Center on December 15, 2012 in Newark, New Jersey. (Editorial Use Only) The Rolling Stones… [+2025 chars]",,en,'Mick Jagger'
https://dailycaller.com/2023/10/09/jim-jordan-steve-scalise-endorsements-ahead-speaker-election/,https://dailycaller.com/2023/10/09/jim-jordan-steve-scalise-endorsements-ahead-speaker-election/,0,dailycaller.com,"Jim Jordan, Steve Scalise Rack Up Endorsements Ahead Of Speaker Election",Republicans Steve Scalise and Jim Jordan are racking up endorsements for speaker as they both vie for the position that requires 218 House votes to secure.,https://cdn01.dailycaller.com/wp-content/uploads/2023/10/video_image-e8IF38969-e1696862746257.png,2023-10-09T18:03:48Z,,<ul><li>House Majority Leader Steve Scalise and Judiciary Chairman Jim Jordan are securing the endorsements of House GOP members ahead of Wednesday’s speaker election.</li><li>Jordan and Scalise must… [+4860 chars],,en,'Nancy Mace'
https://www.msnbc.com/the-reidout/reidout-blog/nikki-haley-milley-trump-meet-the-press-rcna119490,https://www.msnbc.com/the-reidout/reidout-blog/nikki-haley-milley-trump-meet-the-press-rcna119490,0,www.msnbc.com,Haley offers meek pushback to Trump's Milley execution remark,"In an interview on ""Meet the Press,"" Republican Nikki Haley offered tepid pushback to Donald Trump’s suggestion that Ret. Gen. Mark Milley be executed.","https://media-cldnry.s-nbcnews.com/image/upload/t_nbcnews-fp-1200-630,f_auto,q_auto:best/rockcms/2023-10/231009-mtp-nikki-haley-jm-1147-43ffbb.jpg",2023-10-09T18:54:23Z,https://web.archive.org/web/20231010020151/https://www.msnbc.com/the-reidout/reidout-blog/nikki-haley-milley-trump-meet-the-press-rcna119490,"In an interview Sunday on NBC's ""Meet the Press,"" Republican presidential candidate Nikki Haley offered tepid pushback to Donald Trumps suggestion that former Chairman of the Joint Chiefs of Staff Ge… [+2975 chars]",,en,'Nancy Mace'
https://www.memeorandum.com/231009/p35,https://www.memeorandum.com/231009/p35,0,www.memeorandum.com,CBS Anchor Grills Nancy Mace Over Jim Jordan Allegedly Ignoring Sexual Abuse (Ben Blanchet/HuffPost),"Ben Blanchet / HuffPost:
CBS Anchor Grills Nancy Mace Over Jim Jordan Allegedly Ignoring Sexual Abuse  —  The South Carolina Republican told “Face the Nation” that she supports Jordan's bid to become House speaker, citing his “values” and “work ethic.”  —  LO…",https://img.huffingtonpost.com/asset/65239d132300001d0038c5be.png?cache=RXqH7mDgw4&ops=1200_630,2023-10-09T19:00:24Z,https://web.archive.org/web/20231010022035/http://www.memeorandum.com/231009/p35,"memeorandum is an auto-generated summary of the stories that US political commentators are discussing online right now.
Unlike sister sites Techmeme and Mediagazer, it is not a human-edited news out… [+72 chars]",,en,'Jim Jordan'
https://majorityfm.libsyn.com/3190-horror-in-israelpalestine-legal-theft-of-indigenous-land-w-orly-noy-peter-derrico,https://majorityfm.libsyn.com/3190-horror-in-israelpalestine-legal-theft-of-indigenous-land-w-orly-noy-peter-derrico,0,majorityfm.libsyn.com,"3190 - Horror In Israel/Palestine; ‘Legal’ Theft Of Indigenous Land w/ Orly Noy, Peter d’Errico","Happy Monday! Sam is off today, but in honor of Indigenous People's Day he spoke with Peter D'Errico, professor emeritus of legal studies at the University of Massachusetts, Amherst,  about his recent book Federal Anti-Indian Law: The Legal Entrapment of Indi…",,2023-10-09T21:25:00Z,,"Happy Monday! Sam is off today, but in honor of Indigenous People's Day he spoke with Peter D'Errico, professor emeritus of legal studies at the University of Massachusetts, Amherst,  about his recen… [+4461 chars]",,en,'Sam H'
https://www.huffpost.com/entry/kevin-mccarthy-israel-speaker_n_652444b4e4b09f4b8d415422,https://www.huffpost.com/entry/kevin-mccarthy-israel-speaker_n_652444b4e4b09f4b8d415422,0,www.huffpost.com,McCarthy Uses Israel Attack As Pitch For Being Speaker Again,"Kevin McCarthy, now just another U.S. representative, presented a televised response plan on Hamas’ attack in Israel.",https://img.huffingtonpost.com/asset/652445e2230000320038c628.jpeg?cache=BV3tiprji2&ops=1200_630,2023-10-09T22:05:59Z,,"Rep. Kevin McCarthy (R-Calif.), until recently the speaker of the House, told reporters Monday what the United States needs to do to help Israel after the militant group Hamas killed hundreds of peop… [+5329 chars]",,en,'Nancy Mace'
https://www.westernjournal.com/mccarthy-suddenly-considers-attempt-return-speaker-position-amid-israel-hamas-war/,https://www.westernjournal.com/mccarthy-suddenly-considers-attempt-return-speaker-position-amid-israel-hamas-war/,0,www.westernjournal.com,McCarthy Suddenly Considers Attempt to Return to Speaker Position Amid Israel-Hamas War,Former House Speaker Kevin McCarthy signaled Monday an openness to return to his post after stating firmly last week he would not.,https://www.westernjournal.com/wp-content/uploads/2023/10/mccarthy.jpg,2023-10-10T00:06:04Z,,"Former House Speaker Kevin McCarthy signaled Monday an openness to return to his post after stating firmly last week he would not run again.
Asked about whether he would be a candidate for speaker a… [+2831 chars]",,en,'Kevin McCarthy'
https://hollywoodlife.com/2023/10/09/heidi-klum-recalls-her-sleepless-nights-over-her-halloween-costumes/,https://hollywoodlife.com/2023/10/09/heidi-klum-recalls-her-sleepless-nights-over-her-halloween-costumes/,0,hollywoodlife.com,Heidi Klum Talks Iconic Halloween Costumes From Over the Years: ‘Sleepless Nights’,The model went back in time and revisited some of her most memorable Halloween costumes during a new October 9 interview.,https://hollywoodlife.com/wp-content/uploads/2023/10/heidi-klum-recalls-halloween-costumes-FEAT.jpg,2023-10-10T03:01:21Z,,"Image Credit: Gregory Pace/Shutterstock
Heidi Klum, 50, is the unofficial queen of Halloween! Ahead of this years holiday, the Americas Got Talent judge spoke to PEOPLE on October 9 about some of he… [+2596 chars]",,en,'Heidi Klum'
https://www.the-independent.com/news/world/americas/us-politics/kevin-mccarthy-house-speaker-candidates-latest-news-b2427077.html,https://www.the-independent.com/news/world/americas/us-politics/kevin-mccarthy-house-speaker-candidates-latest-news-b2427077.html,0,www.the-independent.com,House GOP to hold speaker forum today as McCarthy mulls return: Live,Two candidates – Steve Scalise and Jim Jordan – have officially entered the race but questions are mounting as to whether either of them has enough support to get the 218 votes needed to take the gavel,https://static.independent.co.uk/2023/10/06/16/newFile-8.jpg?quality=75&width=1200&auto=webp,2023-10-10T09:14:23Z,https://web.archive.org/web/20231010150108/http://www.the-independent.com/news/world/americas/us-politics/kevin-mccarthy-house-speaker-candidates-latest-news-b2427077.html,"House Republicans will hold an official candidate forum today where lawmakers will debate who should become the next speaker of the House of Representatives.
Slated for 5pm ET, this comes ahead of a… [+8217 chars]",,en,'Jim Jordan'
https://biztoc.com/x/ade21d4f18449fa9,https://biztoc.com/x/ade21d4f18449fa9,0,biztoc.com,Why You Can’t Spell Hollywood Without M.C.U,"MCU: The Reign of Marvel Studios, by Joanna Robinson, Dave Gonzalez and Gavin Edwards Hollywood doesn’t believe in immortals. From Mary Pickford to the MGM musical, Golden Age cowboys to teenage wizards, the city worships its gods only until their box-office …",https://c.biztoc.com/p/ade21d4f18449fa9/s.webp,2023-10-10T09:18:18Z,,"MCU: The Reign of Marvel Studios, by Joanna Robinson, Dave Gonzalez and Gavin EdwardsHollywood doesnt believe in immortals. From Mary Pickford to the MGM musical, Golden Age cowboys to teenage wizard… [+292 chars]",,en,'Mary Robinson'
https://www.nbcnews.com/politics/congress/steve-scalise-jim-jordan-house-speaker-rcna119451,https://www.nbcnews.com/politics/congress/steve-scalise-jim-jordan-house-speaker-rcna119451,0,www.nbcnews.com,Steve Scalise and Jim Jordan face a tense and divided GOP in House speaker fight,The Republicans vying to be the next House speaker will make their case to GOP lawmakers on Tuesday.,"https://media-cldnry.s-nbcnews.com/image/upload/t_nbcnews-fp-1200-630,f_auto,q_auto:best/rockcms/2023-10/231009-Speaker-House-Pitches-jg-bfe012.jpg",2023-10-10T11:00:00Z,,"WASHINGTON The Republicans vying to be the next House speaker will make their case to GOP lawmakers Tuesday, the first formal step to settle a race triggered a week ago after an internal revolt ouste… [+4015 chars]",,en,'Jim Jordan'
https://www.stereogum.com/2238526/watch-olivia-rodrigo-perform-almost-all-of-guts-at-la-concert-for-amex/news/,https://www.stereogum.com/2238526/watch-olivia-rodrigo-perform-almost-all-of-guts-at-la-concert-for-amex/news/,0,www.stereogum.com,Watch Olivia Rodrigo Perform Almost All Of GUTS At LA Concert For Amex,"About a month ago, young pop overlord Olivia Rodrigo released GUTS, arguably the year’s best pop album. Next year, Rodrigo will head out on a huge arena tour with openers PinkPantheress, Chappel Roan, Remi Wolf, and — at least at a few big shows — the Breeder…",https://static.stereogum.com/uploads/2023/10/Olivia-Rodrigo-1696942875.jpg,2023-10-10T13:18:18Z,,"About a month ago, young pop overlord Olivia Rodrigo released GUTS, arguably the year’s best pop album. Next year, Rodrigo will head out on a huge arena tour with openers PinkPantheress, Chappel Roan… [+1440 chars]",,en,'Olivia Rodrigo'
https://sputnikglobe.com/20231010/nato-ready-to-assist-in-investigation-of-balticconector-gas-leak---finnish-president-1114067937.html,https://sputnikglobe.com/20231010/nato-ready-to-assist-in-investigation-of-balticconector-gas-leak---finnish-president-1114067937.html,0,sputnikglobe.com,NATO Ready to Assist in Investigation of Balticconector Gas Leak - Finnish President,MOSCOW (Sputnik) - Finnish President Sauli Niinisto on Tuesday held talks with NATO Secretary General Jens Stoltenberg and said that the alliance is ready to assist Helsinki in investigation into an incident with the Balticconector gas pipeline.,https://cdn1.img.sputnikglobe.com/images/sharing/article/eng/1114067937.jpg?10258840631696945659,2023-10-10T13:47:38Z,https://web.archive.org/web/20231010140107/https://sputnikglobe.com/20231010/nato-ready-to-assist-in-investigation-of-balticconector-gas-leak---finnish-president-1114067937.html,"Get the latest news from around the world, live coverage, off-beat stories, features and analysis.
https://sputnikglobe.com/20231010/nato-ready-to-assist-in-investigation-of-balticconector-gas-leak-… [+1973 chars]",,en,'Jens Stoltenberg'
https://www.euractiv.com/section/politics/opinion/the-brief-brussels-should-brace-for-the-suits-effect/,https://www.euractiv.com/section/politics/opinion/the-brief-brussels-should-brace-for-the-suits-effect/,0,www.euractiv.com,The Brief – Brussels should brace for the ‘Suits effect’,"The Brussels job market is at the cusp of a 'Suits' moment, as the ever-poignant Franco-German-Belgian production 'Parlement' is about to begin its third season, lifting the lid on the inner, albeit fictional, workings of the EU bubble.",https://www.euractiv.com/wp-content/uploads/sites/2/2023/10/10102023brief-web-800x450.png,2023-10-10T14:20:03Z,,"The Brussels job market is at the cusp of a ‘Suits’ moment, as the ever-poignant Franco-German-Belgian production ‘Parlement’ is about to begin its third season, lifting the lid on the inner, albeit … [+6454 chars]",,en,'Petro Poroshenko'
https://www.thenation.com/article/politics/house-speaker-jordan-scalise/,https://www.thenation.com/article/politics/house-speaker-jordan-scalise/,0,www.thenation.com,Who’s Driving the GOP Clown Car?,"Chris Lehmann



With Kevin McCarthy out, far-right Republicans Jim Jordan and Steve Scalise are vying for the House leadership chair.




The post Who’s Driving the GOP Clown Car? appeared first on The Nation.",https://www.thenation.com/wp-content/uploads/2023/10/AP22159665909761.jpg,2023-10-10T14:39:41Z,,"Politics / October 10, 2023
With Kevin McCarthy out, far-right Republicans Jim Jordan and Steve Scalise are vying for the House leadership chair.
Ad Policy
Representatives Jim Jordan (R-Ohio), lef… [+7955 chars]",,en,'Kevin McCarthy'
