index,url,valid,domain,title,description,image,published,archive,content,quote,language,keyword
https://www.cosmopolitan.com/entertainment/celebs/a45766204/princess-beatrice-taylor-swift-bondst-dinner/,https://www.cosmopolitan.com/entertainment/celebs/a45766204/princess-beatrice-taylor-swift-bondst-dinner/,0,www.cosmopolitan.com,Princess Beatrice and Taylor Swift Dined at the Same NYC Restaurant at the Same Time,Is Princess Beatrice joining Taylor's girl squad?,"https://hips.hearstapps.com/hmg-prod/images/princess-beatrice-is-seen-in-noho-on-november-04-2023-in-news-photo-1699288725.jpg?crop=1.00xw:0.334xh;0,0.0983xh&resize=1200:*",2023-11-07T15:48:00Z,https://web.archive.org/web/20231108032935/https://www.cosmopolitan.com/entertainment/celebs/a45766204/princess-beatrice-taylor-swift-bondst-dinner/,Turns out Taylor Swift and Princess Beatrice have similar taste in New York City restaurants: The pop superstar and the British royal were both spotted at NoHo sushi restaurant BondSt on Saturday eve… [+1622 chars],,en,'Sophie Turner'
https://extratv.com/2023/11/07/bradley-cooper-and-gigi-hadid-s-relationship-is-getting-serious-very-quickly-report/,https://extratv.com/2023/11/07/bradley-cooper-and-gigi-hadid-s-relationship-is-getting-serious-very-quickly-report/,0,extratv.com,Bradley Cooper & Gigi Hadid’s Relationship Is ‘Getting Serious Very Quickly’ (Report),"Bradley Cooper, 48, and Gigi Hadid, 28, are going strong!
 A source tells Page Six, “Their relationship is on steroids,” adding, “It’s getting serious very quickly. They are together every day.”
 The insider adds that the actor finds the model “intellectually…",https://extra-images.akamaized.net/image/c4/16by9/2023/11/07/c4c5b44de87144c3a0a6f0dc2aa959d9_xl.jpg,2023-11-07T16:14:18Z,https://web.archive.org/web/20231108003540/https://extratv.com/2023/11/07/bradley-cooper-and-gigi-hadid-s-relationship-is-getting-serious-very-quickly-report/,"Bradley Cooper, 48, and Gigi Hadid, 28, are going strong!
 A source tells Page Six, “Their relationship is on steroids,” adding, “It’s getting serious very quickly. They are together every day.”
 The… [+1081 chars]",,en,'Sophie Turner'
http://www.thecut.com/2023/11/bradley-cooper-gigi-hadid-taylor-swift-night-out.html,http://www.thecut.com/2023/11/bradley-cooper-gigi-hadid-taylor-swift-night-out.html,0,www.thecut.com,Did Bradley Cooper Crash Girls’ Night?,"Gigi Hadid’s rumored new boyfriend, Bradley Cooper, reportedly made a discreet appearance at dinner and the club with Taylor Swift’s infamous entourage during girls’ night. Hmmm …",https://pyxis.nymag.com/v1/imgs/165/b31/7b8dd49b430c53427a9a0116a8060a0cbe-bradley-cooper-girls-night.1x.rsocial.w1200.jpg,2023-11-07T17:15:53Z,,"Its been a banner month for Taylor Swifts infamous entourage, which has been on a grand tour of the nations trendiest trattorias and sushi joints. A string of group dinners with her carefully curated… [+2247 chars]",,en,'Sophie Turner'
https://radaronline.com/p/sophie-turner-hires-powerhouse-miami-lawyer-joe-jonas-divorce-battle/,https://radaronline.com/p/sophie-turner-hires-powerhouse-miami-lawyer-joe-jonas-divorce-battle/,0,radaronline.com,Sophie Turner Hires Powerhouse Miami Lawyer to Fight Joe Jonas as Divorce Negotiations Rage On,Turner ditched her white-shoe law firm and hired politically connected legal eagle.,https://media.radaronline.com/brand-img/9EBwVWT0A/1200x628/sophie-turner-joe-jonas-selling-nyc-apartment-4-1699029041080.jpg,2023-11-07T18:00:00Z,,"From 2020 to 2021, she served as president of the politically connected Florida Bar Association, which distributes influential voter guides where judicial candidates are encouraged to submit a volunt… [+538 chars]",,en,'Sophie Turner'
https://pagesix.com/2023/11/07/celebrity-news/brittany-mahomes-shares-pics-from-wags-trip-to-nyc-without-taylor-swift/,https://pagesix.com/2023/11/07/celebrity-news/brittany-mahomes-shares-pics-from-wags-trip-to-nyc-without-taylor-swift/,0,pagesix.com,Brittany Mahomes shares pics from WAGs trip to NYC — without Taylor Swift,Mahomes was spotted grabbing dinner with Swift and several of the singer's A-list friends — including Selena Gomez and Gigi Hadid — over the weekend.,https://pagesix.com/wp-content/uploads/sites/3/2023/11/NYPICHPDPICT000071945024.jpg?quality=75&strip=all&w=1024,2023-11-07T19:01:28Z,https://web.archive.org/web/20231107190850/https://pagesix.com/2023/11/07/celebrity-news/brittany-mahomes-shares-pics-from-wags-trip-to-nyc-without-taylor-swift/,"Brittany Mahomes is giving fans a glimpse into her fun-filled weekend in New York City. 
Mahomes, who is the wife of Kansas City Chiefs quarterback Patrick Mahomes, shared several photos from her tr… [+3558 chars]",,en,'Sophie Turner'
https://www.pajiba.com/celebrities_are_better_than_you/joe-jonas-buys-nathan-fielder-a-drink-receives-small-bowl-of-mayo-in-return-.php,https://www.pajiba.com/celebrities_are_better_than_you/joe-jonas-buys-nathan-fielder-a-drink-receives-small-bowl-of-mayo-in-return-.php,0,www.pajiba.com,"Joe Jonas Buys Nathan Fielder A Drink, Receives Small Bowl Of Mayo In Return","On Saturday night, newly single (or is she?) Sophie Turner enjoyed a Girls Night Out™ at an oh-so-chic New York City sushi joint with Taylor Swift, Selena Gomez, Gigi Hadid, Cara Delevingne, and Brittany Mahomes. Google tells me that Brittany...",https://www.pajiba.com/assets_c/2023/11/joe%20jonas%20nathan%20fielder-thumb-700x550-258085.png,2023-11-07T19:30:00Z,https://web.archive.org/web/20231108005845/https://www.pajiba.com/celebrities_are_better_than_you/joe-jonas-buys-nathan-fielder-a-drink-receives-small-bowl-of-mayo-in-return-.php,"On Saturday night, newly single (or is she?) Sophie Turner enjoyed a Girls Night Out™ at an oh-so-chic New York City sushi joint with Taylor Swift, Selena Gomez, Gigi Hadid, Cara Delevingne, and Brit… [+1497 chars]",,en,'Sophie Turner'
https://nypost.com/2023/11/07/sports/brittany-mahomes-recaps-taylor-swift-weekend-with-nfl-wags/,https://nypost.com/2023/11/07/sports/brittany-mahomes-recaps-taylor-swift-weekend-with-nfl-wags/,0,nypost.com,Brittany Mahomes recaps epic Taylor Swift weekend with NFL WAGs,The wife of Chiefs quarterback Patrick Mahomes relived the epic weekend in a new Instagram post shared Monday.,https://nypost.com/wp-content/uploads/sites/2/2023/11/newspress-collage-g02dqomsw-1699385105001.jpg?quality=75&strip=all&1699367223&w=1024,2023-11-07T19:59:15Z,,"They made the whole city shimmer.
Brittany Mahomes relived her epic weekend in New York on Monday in a new Instagram post, days after she and fellow NFL WAGs enjoyed a star-studded night out with Ta… [+2288 chars]",,en,'Taylor Swift'
https://www.marca.com/en/nfl/kansas-city-chiefs/2023/11/07/654aa7fde2704e61498b45c5.html,https://www.marca.com/en/nfl/kansas-city-chiefs/2023/11/07/654aa7fde2704e61498b45c5.html,0,www.marca.com,Brittany Mahomes shares a WAGs night out weekend photo album with Taylor Swift in NYC,"Athough she is currently the most successful artist in the world, Taylor Swift seems to like the life of a football WAG. She has been spotted enjoying the Kansas City Chiefs&apos;",https://phantom-marca.unidadeditorial.es/9b227ada2e725cccd4546ce15a6b9e7b/resize/1200/f/webp/assets/multimedia/imagenes/2023/11/07/16993901653286.jpg,2023-11-07T21:12:45Z,https://web.archive.org/web/20231109004713/https://www.marca.com/en/nfl/kansas-city-chiefs/2023/11/07/654aa7fde2704e61498b45c5.html,"Athough she is currently the most successful artist in the world, Taylor Swift seems to like the life of a football WAG. She has been spotted enjoying the Kansas City Chiefs' games alongside Brittany… [+1779 chars]",,en,'Sophie Turner'
https://www.cosmopolitan.com/entertainment/celebs/a45769743/taylor-swift-brittany-mahomes-instagram-friendship-official/,https://www.cosmopolitan.com/entertainment/celebs/a45769743/taylor-swift-brittany-mahomes-instagram-friendship-official/,0,www.cosmopolitan.com,Taylor Swift and Brittany Mahomes Just Went Instagram Official With Their Friendship,"Brittany posted a BTS pic from her night out with Taylor Swift, Paige Buechele, and Lyndsay Bell.","https://hips.hearstapps.com/hmg-prod/images/screen-shot-2023-11-07-at-4-26-48-pm-654aabb68a573.png?crop=1xw:0.826007326007326xh;center,top&resize=1200:*",2023-11-07T21:32:00Z,https://web.archive.org/web/20231108154255/https://www.cosmopolitan.com/entertainment/celebs/a45769743/taylor-swift-brittany-mahomes-instagram-friendship-official/,"Taylor Swift and Brittany Mahomes have gone Instagram official with their friendship, cementing their status as two people who hang out together whilst also dating famous players on the Kansas City C… [+1729 chars]",,en,'Sophie Turner'
https://www.tmz.com/2023/11/07/taylor-swift-debuts-brittany-mahomes-instagram-sips-champagne-chiefs-wags/,https://www.tmz.com/2023/11/07/taylor-swift-debuts-brittany-mahomes-instagram-sips-champagne-chiefs-wags/,0,www.tmz.com,Taylor Swift Debuts On Brittany Mahomes' Instagram W/ Boozy Photo,Taylor Swift and Brittany Mahomes' friendship is Instagram official ... 'cause the wife of the Chiefs superstar QB finally shared a personal pic from their weekend in NYC where the singer spent some quality time with a few fellow K.C. WAGS! Of…,https://imagez.tmz.com/image/f1/16by9/2023/11/07/f1db3967903c48c1ab91f5808c528260_xl.jpg,2023-11-07T22:17:26Z,,Taylor Swiftand Brittany Mahomes' friendship is Instagram official ... 'cause the wife of the Chiefs superstar QB finally shared a personal pic from their weekend in NYC where the singer spent some q… [+1421 chars],,en,'Sophie Turner'
https://nypost.com/2023/11/07/sports/taylor-swift-brittany-mahomes-toast-with-champagne-in-new-photos/,https://nypost.com/2023/11/07/sports/taylor-swift-brittany-mahomes-toast-with-champagne-in-new-photos/,0,nypost.com,"Taylor Swift, Brittany Mahomes toast with champagne in new photos",No champagne problems here.,https://nypost.com/wp-content/uploads/sites/2/2023/11/swift-brittany-1.jpg?quality=75&strip=all&1699375440&w=1024,2023-11-07T22:35:47Z,https://web.archive.org/web/20231108044923/https://nypost.com/2023/11/07/sports/taylor-swift-brittany-mahomes-toast-with-champagne-in-new-photos/,"No champagne problems here.
Brittany Mahomes, the wife of the Chiefs’ star quarterback Patrick Mahomes, posted new photos on Tuesday of her and Taylor Swift toasting with some bubbly.
Swift, the gi… [+1810 chars]",,en,'Sophie Turner'
https://www.usmagazine.com/celebrity-news/news/brittany-mahomes-wants-to-play-matchmaker-for-sophie-turner/#article,https://www.usmagazine.com/celebrity-news/news/brittany-mahomes-wants-to-play-matchmaker-for-sophie-turner/#article,0,www.usmagazine.com,Brittany Mahomes Wants to ‘Play Matchmaker’ for Sophie Turner,Brittany Mahomes wants to help Sophie Turner get back out on the dating scene as the pair grow closer through their mutual bond with Taylor Swift. “Brittany knows Sophie is newly single and has hung [out] with her before when Sophie attended one of the [Kansa…,https://www.usmagazine.com/wp-content/uploads/2023/11/Brittany-Mahomes-Wants-to-Play-Matchmaker-for-Sophie-Turner-Is-Having-a-Blast-With-Taylor-Swift-296.jpg?crop=0px%2C0px%2C2000px%2C1051px&resize=1200%2C630&quality=86&strip=all,2023-11-07T22:44:23Z,,"Brittany Mahomes, Sophie Turner, Taylor Swift.Getty Images (3)
Brittany Mahomes wants to help Sophie Turner get back out on the dating scene as the pair grow closer through their mutual bond with Ta… [+3220 chars]",,en,'Sophie Turner'
https://consequence.net/2023/11/innings-extra-innings-festival-lineup-2024/,https://consequence.net/2023/11/innings-extra-innings-festival-lineup-2024/,0,consequence.net,"Chili Peppers, Dave Matthews Band, Chris Stapleton to play Arizona’s Innings Festivals in 2024","Twin festivals take place over two weekends in early 2024 and also feature Noah Kahan, Sheryl Crow, and Greta Van Fleet.
Chili Peppers, Dave Matthews Band, Chris Stapleton to play Arizona’s Innings Festivals in 2024
Scoop Harrison",https://consequence.net/wp-content/uploads/2023/11/Chili-Peppers-and-Dave-Matthews-Band.jpeg,2023-11-07T23:01:44Z,,"Temple, Arizona will play host to twin music festivals on back to back weekends in early 2024 with the Innings Festival and the all-new Extra Innings Festival. Both events will take place at Beach Pa… [+835 chars]",,en,'Sheryl Crow'
https://biztoc.com/x/3e33f7975dfb84a0,https://biztoc.com/x/3e33f7975dfb84a0,0,biztoc.com,Taylor Swift Cozies Up With Brittany Mahomes & More NFL Wives in New Pics,No “Champagne Problems” here: Taylor Swift made her debut on Brittany Mahomes’ Instagram page Tuesday (Nov. 7) with two bubbly new photos from their girls’ night out in New York City over the weekend. While the Saturday night hang also included Swift’s A-list…,https://c.biztoc.com/p/3e33f7975dfb84a0/s.webp,2023-11-07T23:14:19Z,https://web.archive.org/web/20231112091838/https://biztoc.com/x/3e33f7975dfb84a0,No Champagne Problems here: Taylor Swift made her debut on Brittany Mahomes Instagram page Tuesday (Nov. 7) with two bubbly new photos from their girls night out in New York City over the weekend.Whi… [+298 chars],,en,'Sophie Turner'
https://hollywoodlife.com/2023/11/07/taylor-swift-and-brittany-mahomes-have-fun-girls-night-out-photos/,https://hollywoodlife.com/2023/11/07/taylor-swift-and-brittany-mahomes-have-fun-girls-night-out-photos/,0,hollywoodlife.com,Brittany Mahomes Shares New Photos With Pal Taylor Swift After Fun Girls Night Out,"Three days after the pop sensation was spotted out to dinner in New York City among her A-lister besties, Brittany shared a few snapshots of the night via Instagram.",https://hollywoodlife.com/wp-content/uploads/2023/11/taylor-swift-brittany-mahomes-girls-night-Ftr.jpg?quality=100,2023-11-07T23:48:16Z,,"Image Credit: AFF-USA/Shutterstock
A night to remember! Following Taylor Swifts night out with a group of her famous friends, former soccer star Brittany Mahomes took to Instagram to share a carouse… [+2123 chars]",,en,'Sophie Turner'
https://pagesix.com/2023/11/07/entertainment/taylor-swifts-new-pal-brittany-mahomes-wants-to-play-matchmaker-for-sophie-turner/,https://pagesix.com/2023/11/07/entertainment/taylor-swifts-new-pal-brittany-mahomes-wants-to-play-matchmaker-for-sophie-turner/,0,pagesix.com,Taylor Swift’s new pal Brittany Mahomes reportedly wants to ‘play matchmaker’ for Sophie Turner,"Joe Jonas filed for divorce from the ""Game of Thrones"" actress in September and she has since spent several nights with Swift and Mahomes.",https://pagesix.com/wp-content/uploads/sites/3/2023/11/brittany-mahomes-wants-to-set-up-sophie-turner-split.jpg?quality=75&strip=all&w=1024,2023-11-08T00:39:16Z,,"Brittany Mahomes might be adding matchmaker to her résumé. 
According to Us Weekly, the former soccer player wants to help Sophie Turner find a partner following her split from her husband of four y… [+2547 chars]",,en,'Sophie Turner'
https://www.usmagazine.com/celebrity-news/news/brittany-mahomes-taylor-swift-cheers-to-nyc-champagne-problems/#article,https://www.usmagazine.com/celebrity-news/news/brittany-mahomes-taylor-swift-cheers-to-nyc-champagne-problems/#article,0,www.usmagazine.com,Taylor Swift and Brittany Mahomes Have Champagne Problems in NYC Night Out,"Brittany Mahomes gave a glimpse into her NFL wives and girlfriends (WAGs) circle — which includes Taylor Swift. Brittany, 28, posted two pictures via Instagram on Tuesday, November 7, with Swift, 33, Lyndsay Bell and Paige Buechele. (Lyndsay, for her part, is…",https://www.usmagazine.com/wp-content/uploads/2023/11/Brittany-Mahomes-and-Taylor-Swift-Cheers-to-Champagne-Problems-319.jpg?crop=0px%2C0px%2C2000px%2C1051px&resize=1200%2C630&quality=86&strip=all,2023-11-08T01:37:45Z,,"Brittany Mahomes, Taylor Swift.Getty Images (2)
Brittany Mahomes gave a glimpse into her NFL wives and girlfriends (WAGs) circle which includes Taylor Swift.
Brittany, 28, posted two pictures via I… [+2994 chars]",,en,'Sophie Turner'
https://www.marca.com/en/lifestyle/celebrities/2023/11/08/654aec14268e3eb0148b4591.html,https://www.marca.com/en/lifestyle/celebrities/2023/11/08/654aec14268e3eb0148b4591.html,0,www.marca.com,Brittany Mahomes loves hanging out with Taylor Swift; wants to play 'Cupid' for Sophie Turner,"Taylor Swift is growing more comfortable with Travis Kelce&apos;s to the NFL life, and that&apos;s thanks to Brittany Mahomes, wife of Kansas City Chiefs quarterback Patrick Mahome",https://e00-marca.uecdn.es/assets/multimedia/imagenes/2023/11/08/654aec14268e3eb0148b4591_facebook.jpg,2023-11-08T02:02:17Z,,"Taylor Swift is growing more comfortable with Travis Kelce's to the NFL life, and that's thanks to Brittany Mahomes, wife of Kansas City Chiefs quarterback Patrick Mahomes, welcoming the popstar with… [+1327 chars]",,en,'Sophie Turner'
https://deadline.com/2023/11/elections-democrats-kentucky-abortion-joe-biden-1235596422/,https://deadline.com/2023/11/elections-democrats-kentucky-abortion-joe-biden-1235596422/,0,deadline.com,"As Media Outlets Focus On Joe Biden’s Dismal Poll Numbers, Network Pundits Struggle To Make Sense Of Democrats’ Off-Year Election Victories","Democrats looked to be on their way to significant victories in off-year elections tonight, with Andy Beshear projected to win reelection in Kentucky, an abortion rights ballot measure easily approved in Ohio and Virginia’s state Senate likely to remain under…",https://deadline.com/wp-content/uploads/2023/11/GettyImages-1769246614.jpg?w=1024,2023-11-08T03:10:33Z,https://web.archive.org/web/20231108031328/https://deadline.com/2023/11/elections-democrats-kentucky-abortion-joe-biden-1235596422/,"Democrats looked to be on their way to significant victories in off-year elections tonight, with Andy Beshear projected to win reelection in Kentucky, an abortion rights ballot measure easily approve… [+3509 chars]",,en,'Joe Biden'
https://www.foxnews.com/shows/media-buzz/press-panic-tougher-coverage-biden-he-increasingly-trails-trump,https://www.foxnews.com/shows/media-buzz/press-panic-tougher-coverage-biden-he-increasingly-trails-trump,0,www.foxnews.com,Press panic: Tougher coverage of Biden as he increasingly trails Trump,"Despite years of positive media coverage of President Joe Biden, some pundits have changed their tune and urged the president to drop out of the race.",https://static.foxnews.com/foxnews.com/content/uploads/2023/08/trump-vs-biden.png,2023-11-08T08:00:31Z,,"For the mainstream media, the unthinkable has become all too plausible: Donald Trump could win a second term.
There is something of a Democratic freakout going on in light of recent polls, and for m… [+5540 chars]",,en,'Bret Baier'
https://www.cosmopolitan.com/entertainment/celebs/a45776781/brittany-mahomes-matchmaker-sophie-turner/,https://www.cosmopolitan.com/entertainment/celebs/a45776781/brittany-mahomes-matchmaker-sophie-turner/,0,www.cosmopolitan.com,"Brittany Mahomes Wants to ""Play Matchmaker"" for Sophie Turner","Brittany knows who she wants to set up Sophie with, apparently.","https://hips.hearstapps.com/hmg-prod/images/screen-shot-2023-11-08-at-7-27-13-am-654b7eafb5af5.png?crop=1xw:0.9016018306636155xh;center,top&resize=1200:*",2023-11-08T12:36:00Z,https://web.archive.org/web/20231108163646/https://www.cosmopolitan.com/entertainment/celebs/a45776781/brittany-mahomes-matchmaker-sophie-turner/,"Brittany Mahomes has joined Taylor Swift's exclusive circle of friends, and apparently has taken a liking to Sophie Turner (she thinks Sophie's a ""doll"") and now wants to help set her up with someone… [+1422 chars]",,en,'Sophie Turner'
https://www.ibtimes.com/appeal-hearing-opens-sarkozys-2012-campaign-fraud-3717959,https://www.ibtimes.com/appeal-hearing-opens-sarkozys-2012-campaign-fraud-3717959,0,www.ibtimes.com,Appeal Hearing Opens Into Sarkozy's 2012 Campaign Fraud,A Paris court on Wednesday began hearing former president Nicolas Sarkozy's appeal against his conviction for illegal campaign financing in a failed 2012 re-election bid.,https://d.ibtimes.com/en/full/4497923/nicolas-sarkozy-appeared-person-hearing.jpg,2023-11-08T13:42:33Z,,"A Paris court on Wednesday began hearing former president Nicolas Sarkozy's appeal against his conviction for illegal campaign financing in a failed 2012 re-election bid.
The 68-year-old former Fren… [+2380 chars]",,en,'nan nan'
https://www.digitaljournal.com/world/appeal-hearing-opens-into-sarkozys-2012-campaign-fraud/article,https://www.digitaljournal.com/world/appeal-hearing-opens-into-sarkozys-2012-campaign-fraud/article,0,www.digitaljournal.com,Appeal hearing opens into Sarkozy’s 2012 campaign fraud,A Paris court on Wednesday began hearing former president Nicolas Sarkozy’s appeal against his conviction for illegal campaign financing in a failed 2012 re-election bid. The 68-year-old former French head of state appeared relaxed as he appeared for the hear…,https://www.digitaljournal.com/wp-content/uploads/2023/11/1d0b6fbca61312b151532aa044f096cbc0a0ad31.jpg,2023-11-08T13:46:06Z,,"Nicolas Sarkozy appeared in person for the hearing - Copyright AFP Mohsen KARIMI
A Paris court on Wednesday began hearing former president Nicolas Sarkozy’s appeal against his conviction for illegal… [+2458 chars]",,en,'Nicolas Sarkozy'
https://hollywoodlife.com/2023/11/08/brittany-mahomes-wants-to-play-matchmaker-for-sophie-turner-report/,https://hollywoodlife.com/2023/11/08/brittany-mahomes-wants-to-play-matchmaker-for-sophie-turner-report/,0,hollywoodlife.com,Brittany Mahomes Reportedly Wants to be a ‘Matchmaker’ for Sophie Turner Amid Taylor Swift Friendship,Taylor Swift and the Kansas City Chiefs quarterback's wife are 'having a blast' as their new friendship blossoms alongside her romance with Travis Kelce.,https://hollywoodlife.com/wp-content/uploads/2023/11/Brittany-Mahomes-Sophie-Turner-FTR.jpg?quality=100,2023-11-08T16:20:49Z,,"Image Credit: Shutterstock (2)
Brittany Mahomes wants to set up her new pal Sophie Turner as shes newly single following her divorce from Joe Jonas, according to a new report from Us Weekly. An insi… [+1986 chars]",,en,'Sophie Turner'
https://www.elitedaily.com/entertainment/brittany-mahomes-sophie-turner-matchmaker,https://www.elitedaily.com/entertainment/brittany-mahomes-sophie-turner-matchmaker,0,www.elitedaily.com,"Brittany Mahomes Wants To Be Sophie Turner's ""Matchmaker""","Per reports, Brittany Mahomes wants to ""play matchmaker"" for Sophie Turner amid divorce from Joe Jonas. Here's why she wants to set up the 'GOT' actor.",https://imgix.bustle.com/uploads/image/2023/11/8/1a7b56a4-f732-4d5f-af89-fe16634cbe5f-brittany-sophie-soc001.jpeg?w=1200&h=630&fit=crop&crop=faces&fm=jpg,2023-11-08T16:48:11Z,https://web.archive.org/web/20231109044845/https://www.elitedaily.com/entertainment/brittany-mahomes-sophie-turner-matchmaker,"Amid her divorce from Joe Jonas, Sophie Turner has a lot of people in her corner. Not only has the Game Of Thrones actor joined Taylor Swifts squad with the likes of Selena Gomez and Blake Lively, bu… [+1956 chars]",,en,'Sophie Turner'
https://www.cosmopolitan.com/entertainment/tv/a45769493/kim-kardashian-dating-rules-manifestation-list/,https://www.cosmopolitan.com/entertainment/tv/a45769493/kim-kardashian-dating-rules-manifestation-list/,0,www.cosmopolitan.com,Exclusive: Kim Kardashian Shares Her Man Manifestation List on ‘The Kardashians‘,Now we know *exactly* what Kim K wants in her dream partner.,"https://hips.hearstapps.com/hmg-prod/images/screen-shot-2023-11-07-at-4-00-05-pm-654aa55beac22.png?crop=1.00xw:0.910xh;0,0.0465xh&resize=1200:*",2023-11-08T17:00:00Z,,"Between 
Taylor Swift's not-at-all-casual NYC girls' dinner with *checks notes* Selena Gomez, Sophie Turner, Gigi Hadid, and Brittany Mahomes, plus Mariah Carey szn officially in full swing (in case… [+2588 chars]",,en,'Kim Kardashian'
https://www.bostonglobe.com/2023/11/08/metro/mortimer-downey-force-mass-transit-across-us-dies-87/,https://www.bostonglobe.com/2023/11/08/metro/mortimer-downey-force-mass-transit-across-us-dies-87/,0,www.bostonglobe.com,"Mortimer Downey, force for mass transit across US, dies at 87",Mortimer L. Downey's creative financing helped revive New York City’s subway system and he also oversaw far-reaching regional and federal transportation policy for more than six decades.,https://bostonglobe-prod.cdn.arcpublishing.com/resizer/blfZb4BbGM0CeuMSNtVsJ8RX5I0=/506x0/cloudfront-us-east-1.images.arcpublishing.com/bostonglobe/YVTP2NYWDTCZRQQJXIGGO2UKNU.jpg,2023-11-08T19:41:33Z,,"Instead, he enlisted as a management trainee with the Port Authority of New York and New Jersey, his first step on a road that would take him to Washington, where he became the U.S. Transportation De… [+6378 chars]",,en,'Peter Urban'
https://www.inman.com/2023/11/08/nyc-pad-of-recently-split-joe-jonas-and-sophie-turner-lists-for-6m/,https://www.inman.com/2023/11/08/nyc-pad-of-recently-split-joe-jonas-and-sophie-turner-lists-for-6m/,0,www.inman.com,NYC pad of recently split Joe Jonas and Sophie Turner lists for $6M,"Jonas and Turner, who have been embroiled in divorce proceedings for about two months, are attempting to offload their Nolita condo for the second time.",https://assets.inman.com/wp-content/uploads/2023/11/Joe-Jonas-Sophie-Turner-NYC-Condo-1024x576.jpeg,2023-11-08T20:09:35Z,,"The verdict is in the old way of doing business is over. Join us at Inman Connect New York Jan. 23-25, when together well conquer todays market challenges and prepare for tomorrows opportunities. Def… [+2327 chars]",,en,'Sophie Turner'
