index,url,valid,domain,title,description,image,published,archive,content,quote,language,keyword
62,https://www.justjared.com/2025/06/17/pope-leo-xiv-has-some-famous-relatives-here-is-every-celebrity-the-pope-is-related-to/,0,www.justjared.com,Pope Leo XIV Has Some Famous Relatives - Here Is Every Celebrity the Pope Is Related To!,"Pope Leo XIV became the first American elected Pope earlier this year, and now we’re learning more about him. The 69-year-old, whose birth name is Robert Francis Prevost, was born in Chicago, Ill., and over a month after he became the new leader of the Roman …",https://cdn01.justjared.com/wp-content/uploads/headlines/2025/06/leo-relatives.jpg,2025-06-18T03:27:27Z,,"Pope Leo XIV became the first American elected Pope earlier this year, and now we’re learning more about him. 
The 69-year-old, whose birth name is Robert Francis Prevost, was born in Chicago, Ill.,… [+496 chars]",,en,'Pope Leo'
63,https://www.pcworld.com/article/2819904/pope-leo-xiv-warns-ai-is-a-threat-to-humanity-and-calls-for-a-treaty.html,0,www.pcworld.com,Pope Leo XIV warns AI is a threat to humanity and calls for a treaty,"In a recent article, The Wall Street Journal drew attention to the fact that Pope Leo XIV considers artificial intelligence to be a threat to humanity.




In a recent speech to a group of cardinals, the newly appointed pope noted that recent developments in…",https://www.pcworld.com/wp-content/uploads/2025/06/Artificial-intelligence-AI-robot-hand-reaching-for-human-hand.jpg?quality=50&strip=all&w=1024,2025-06-18T14:51:37Z,,"Skip to contentType your search and hit enter
When you purchase through links in our articles, we may earn a small commission. This doesn't affect our editorial independence
.
In a recent article,… [+1097 chars]",,en,'Pope Leo'
64,https://consequence.net/2025/06/pope-leo-xiv-related-madonna-family-tree/,0,consequence.net,Pope Leo XIV Is a Distant Cousin of Madonna,"The new Pope was also linked to Justin Bieber, Angelina Jolie, Justin Trudeau, and Hillary Clinton in a tracing of his family tree.
Pope Leo XIV Is a Distant Cousin of Madonna
Jaeden Pinder",https://consequence.net/wp-content/uploads/2025/06/Pope-Leo-XIV-is-a-Distant-Cousin-of-Madonna.jpg,2025-06-18T17:03:53Z,,"A tracing of Pope Leo XIV’s family tree has revealed that the first American pontiff is a distant cousin of several North American celebrities, including the pop star Madonna (not to be confused with… [+1265 chars]",,en,'Angelina Jolie'
65,https://www.justjared.com/2025/06/18/dove-cameron-explains-how-boyfriend-damiano-david-shifted-her-perspective-on-nudity-addresses-losing-descendants-co-star-cameron-boyce-ditching-her-blonde-hair/,0,www.justjared.com,"Dove Cameron Explains How Boyfriend Damiano David Shifted Her Perspective on Nudity, Addresses Losing 'Descendants' Co-Star Cameron Boyce & Ditching Her Blonde Hair","Dove Cameron is opening up about her personal and professional life. The 29-year-old “French Girls” singer spoke out in a new Nylon cover story, out now. During the interview, Dove spoke about pretend families in early acting jobs, navigating mental health st…",https://cdn01.justjared.com/wp-content/uploads/headlines/2025/06/dove-cameron-nylon-social.jpg,2025-06-18T17:06:40Z,,"Dove Cameron is opening up about her personal and professional life.
The 29-year-old “French Girls” singer spoke out in a new Nylon cover story, out now.
During the interview, Dove spoke about pret… [+262 chars]",,en,'David Cameron'
66,https://www.spacedaily.com/reports/India_grants_licence_to_Musks_Starlink_999.html,0,www.spacedaily.com,India grants licence to Musk's Starlink,"New Delhi (AFP) June 18, 2025


 New Delhi had granted a licence to Elon Musk's Starlink satellite internet service, opening India's ""next frontier of connectivity"", according to the country's communications minister. 

The launch of Starlink, which provides …",https://www.spxdaily.com/images-hg/spacex-starlink-satellite-constellation-location-navigation-gps-hg.jpg,2025-06-19T11:47:19Z,,"India grants licence to Musk's Starlinkby AFP Staff WritersNew Delhi (AFP) June 18, 2025
New Delhi had granted a licence to Elon Musk's Starlink satellite internet service, opening India's ""next fro… [+1224 chars]",,en,'Elon Musk'
67,https://dianeravitch.net/2025/06/19/how-the-election-was-rigged/,0,dianeravitch.net,Did the Tech Bros Rig the 2024 Election?,"I have always thought there was something fishy about Trump’s win last November. When Elon Musk broke up with Trump, he said boldly that Trump would have not won the election without his help, and the Democrats would now control the House. What kind of help d…",https://dianeravitch.net/wp-content/uploads/2025/06/bd431c9e-a294-48d6-8c1c-72480db41487-41034-0000074522510588_file.jpg,2025-06-19T13:00:00Z,,"I have always thought there was something fishy about Trump’s win last November. When Elon Musk broke up with Trump, he said boldly that Trump would have not won the election without his help, and th… [+12113 chars]",,en,'Curtis Yarvin'
68,https://dianeravitch.net/2025/06/19/heather-cox-richardson-under-our-mafia-boss-leader-everything-is-for-sale/,0,dianeravitch.net,"Heather Cox Richardson: Under Our Mafia Boss, Everything Is For Sale","Heather Cox Richardson describes the legal corruption that is now out in the open. Yesterday at the meeting of the leaders of the Group of Seven (G7), a forum of democracies with advanced economies, President Donald Trump told reporters: “The UK is very well …",https://dianeravitch.net/wp-content/uploads/2017/12/diane.jpg?w=200,2025-06-19T14:00:00Z,,"Heather Cox Richardson describes the legal corruption that is now out in the open.
Yesterday at the meeting of the leaders of the Group of Seven (G7), a forum of democracies with advanced economies,… [+8412 chars]",,en,'Donald Trump'
69,https://www.vanityfair.com/style/story/curtis-yarvin-venice-biennale-plan,0,www.vanityfair.com,“The Barbarians Are at the Gates”: Curtis Yarvin Has Big Art Plans for the US Pavilion at the 2026 Venice Biennale,"It’s not a retrospective of Jon McNaughton’s portraits of bloody, triumphant, muscly Trump. It’s somehow crazier.","https://media.vanityfair.com/photos/6853065b3f91d35d86a1aa13/16:9/w_1280,c_limit/VF624-true-colors-001.jpg",2025-06-19T14:49:47Z,,"On Monday, a representative for Curtis Yarvin sent over a video that served as a preview for the influential monarchist and coders desired curation of the US pavilion at the 2026 Venice Biennale. In … [+4997 chars]",,en,'Curtis Yarvin'
70,https://www.rt.com/russia/619836-telegram-durov-ignore-macron-text/,0,www.rt.com,Durov claims he stopped answering Macron’s texts,The Telegram founder says he left the French leader’s last message unanswered when discussing the Romanian election Read Full Article at RT.com,https://mf.b37mrtl.ru/files/2025.06/article/68540e57203027275b5cb8ba.jpg,2025-06-19T15:10:32Z,,Pavel Durov says he stopped replying to French President Emmanuel Macron after receiving a message in response to claims he made that France tried to influence Romania’s recent presidential election.… [+1798 chars],,en,'nan nan'
71,https://www.pcgamer.com/software/ai/calling-ai-a-threat-to-human-dignity-justice-and-labor-pope-leo-xiv-of-all-people-takes-on-big-tech/,0,www.pcgamer.com,"Calling AI a threat to 'human dignity, justice and labor,' Pope Leo XIV of all people takes on Big Tech","I'm definitely not looking to convert, but I'm listening.",https://cdn.mos.cms.futurecdn.net/RRX7LLBActnpYmVpFrbEVV.jpg,2025-06-19T15:27:13Z,,"As a tech journalist, I'm far from heartened by the AI feeding frenzy we're seeing. Besides the Trump administration rolling back Biden-era guardrails and handing OpenAI a frankly eye-watering amount… [+3906 chars]",,en,'Pope Leo'
72,https://nypost.com/2025/06/19/entertainment/ralph-fiennes-reacts-to-pope-leo-xiv-watching-conclave/,0,nypost.com,Ralph Fiennes reacts to Pope Leo XIV watching ‘Conclave’: Is it ‘rubbish’?,"""If he didn't like it, what can I do?""",https://nypost.com/wp-content/uploads/sites/2/2025/06/106773953.jpg?quality=75&strip=all&w=1024,2025-06-19T16:47:34Z,,"Ralph Fiennes has many questions for Pope Leo XIV.
In a new interview with Entertainment Weekly, the Oscar nominee, 62, was asked about Leo, 69, watching his 2024 film “Conclave” before he was elect… [+2917 chars]",,en,'Pope Leo'
73,https://www.theatlantic.com/ideas/archive/2025/06/pope-leo-xiv-artificial-intelligence/683237/,0,www.theatlantic.com,The Vatican Knows an ‘Industrial Revolution’ When It Sees One,"To update Catholic teaching for the age of AI, Pope Leo should revisit the 19th century.",https://cdn.theatlantic.com/thumbor/1OUhp8c2il7o4ZjzpI9OUCCvLGg=/0x0:2000x1042/1200x625/media/img/mt/2025/06/2025_06_18_leo_mpg/original.jpg,2025-06-20T12:00:00Z,,"The pope didn’t take long to explain why he picked the name Leo. Two days after his election, he cited his inspiration: the preceding Pope Leo, who led the Church while the West confronted the social… [+5980 chars]",,en,'Pope Leo'
74,https://www.ibtimes.com/romania-names-pro-eu-pm-after-months-instability-3776338,0,www.ibtimes.com,Romania Names Pro-EU PM After Months Of Instability,"Romanian President Nicusor Dan named pro-European Ilie Bolojan as prime minister on Friday, following weeks of talks aimed at appointing a new government to end months of political turmoil.",https://d.ibtimes.com/en/full/4606312/nicusor-dan-l-said-ilie-bolojan-r-was-best-placed-push-through-reform.jpg,2025-06-20T14:45:21Z,,"Romanian President Nicusor Dan named pro-European Ilie Bolojan as prime minister on Friday, following weeks of talks aimed at appointing a new government to end months of political turmoil.
Bolojan,… [+2359 chars]",,en,'Nicusor Dan'
75,https://www.artnews.com/art-news/news/curtis-yarvin-us-pavilion-venice-biennale-titian-proposal-1234745778/,0,www.artnews.com,Curtis Yarvin Details Proposed Titian-Centric ‘Art Hos’ US Pavilion for Venice Biennale,"Curtis Yarvin explained his proposal for an 'art hos' US Pavilion at the 2026 Venice Biennale, which would feature a Titian painting.",https://www.artnews.com/wp-content/uploads/2025/06/GettyImages-1147579535.jpg?w=1024,2025-06-20T15:25:34Z,,"Two weeks after the New Yorker revealed that a “dissident-right art hos” US Pavilion was being floated for the 2026 Venice Biennale, Vanity Fair has now reported further details of the proposal, whic… [+2186 chars]",,en,'Curtis Yarvin'
76,http://hyperallergic.com/1021943/curtis-yarvins-venice-biennale-proposal-proves-the-far-right-cant-do-art/,0,hyperallergic.com,Curtis Yarvin’s Venice Biennale Proposal Proves the Far-Right Can’t Do Art,"Not content to help disintegrate democracy here at home, the cheugy shit-poster is seeking to create a new low cultural watermark in a city known for its rising tides.",https://hyperallergic-newspack.s3.amazonaws.com/uploads/2025/03/april-fools-US-pavilion-2.jpg,2025-06-20T22:03:57Z,,"Success! Your account was created and youre signed in.Please visit My Account to verify and manage your account.
An account was already registered with this email. Please check your inbox for an aut… [+4802 chars]",,en,'Curtis Yarvin'
77,https://www.denverpost.com/2025/06/21/pope-leo-xiv-says-there-should-be-no-tolerance-for-abuse-of-any-kind-in-catholic-church/,0,www.denverpost.com,Pope Leo XIV says there should be no tolerance for abuse of any kind in Catholic Church,"By FRANKLIN BRICEÑO LIMA, Peru (AP) — Pope Leo XIV has said there should be no tolerance in the Catholic Church for any type of abuse – sexual, spiritual or abuse of authority — and called for “transparent processes” to create a culture of prevention across t…",https://www.denverpost.com/wp-content/uploads/2025/06/Vatican_Pope_57471.jpg?w=1024&h=683,2025-06-21T15:43:32Z,,"By FRANKLIN BRICEÑO
LIMA, Peru (AP) — Pope Leo XIV has said there should be no tolerance in the Catholic Church for any type of abuse – sexual, spiritual or abuse of authority — and called for “tran… [+2751 chars]",,en,'Pope Leo'
78,https://nypost.com/2025/06/22/world-news/pope-leo-xiv-says-there-should-be-no-tolerance-for-abuse-of-any-kind-in-catholic-church/,0,nypost.com,Pope Leo XIV says there should be no tolerance for abuse of any kind in Catholic Church,Leo made his first public comments about the clergy sex abuse scandal in a written message to a Peruvian journalist.,https://nypost.com/wp-content/uploads/sites/2/2025/06/newspress-collage-3ydw1wgl9-1750582031521.jpg?quality=75&strip=all&1750567645&w=1024,2025-06-22T09:07:02Z,,"Pope Leo XIV has said there should be no tolerance in the Catholic Church for any type of abuse sexual, spiritual or abuse of authority — and called for transparent processes to create a culture of p… [+2690 chars]",,en,'Robert Francis Prevost'
79,https://www.globalsecurity.org/military/library/news/2025/06/mil-250621-pdo01.htm,0,www.globalsecurity.org,Ilie Bolojan appointed prime minister of Romania after coalition agreement,"Romanian President Nicusor Dan on Friday appointed Senate President Ilie Bolojan as the country's new prime minister, following weeks of coalition negotiations among major political parties.",,2025-06-22T09:07:51Z,,"People's Daily Online
(Xinhua) 14:14, June 21, 2025
BUCHAREST, June 20 (Xinhua) -- Romanian President Nicusor Dan on Friday appointed Senate President Ilie Bolojan as the country's new prime minist… [+1672 chars]",,en,'Nicusor Dan'
80,https://www.hurriyetdailynews.com/pope-there-should-be-no-tolerance-for-abuse-in-catholic-church-210600,0,www.hurriyetdailynews.com,Pope: There should be no tolerance for abuse in Catholic Church,"Pope Leo XIV has said there should be no tolerance in the Catholic Church for any type of abuse, sexual, spiritual or abuse of authority, and called for “transparent processes” to create a culture of prevention across the church.",https://image.hurimg.com/i/hurriyet/75/200x200/6857cd6b384d5523b44eb531.jpg,2025-06-22T09:31:26Z,,"LIMA
Pope Leo XIV has said there should be no tolerance in the Catholic Church for any type of abuse, sexual, spiritual or abuse of authority, and called for transparent processes to create a cultur… [+1550 chars]",,en,'Pope Leo'
81,https://www.dailysignal.com/2025/06/22/bishop-barron-explains-how-pope-leo-xiv-could-shape-a-new-era-for-catholic-church/,0,www.dailysignal.com,Bishop Barron Explains How Pope Leo XIV Could Shape a New Era for Catholic Church,"Catholic Bishop Robert Barron was live on NBC News last month when white smoke began billowing from the Sistine Chapel’s chimney, signifying the election of... Read More
The post Bishop Barron Explains How Pope Leo XIV Could Shape a New Era for Catholic Churc…",https://www.dailysignal.com/wp-content/uploads/2025/06/250620_BishopBarron.jpg,2025-06-23T00:00:00Z,,"Catholic Bishop Robert Barron was live on NBC News last month when white smoke began billowing from the Sistine Chapels chimney, signifying the election of a new pope.
The quick decision by the Coll… [+4945 chars]",,en,'Robert Francis Prevost'
82,https://newrepublic.com/article/197078/donald-trump-war-iran-just-beginning,0,newrepublic.com,"This Is Donald Trump’s War, and It’s Only the Beginning","President Donald Trump has just committed the most basic of strategic blunders: the fallacy of the last move. This is the mistaken belief that a powerful or bold action will decisively settle a dispute in your favor. 
The enemy, however, always gets a vote. …",https://images.newrepublic.com/f8b8a4870550fa3fa0c8ddd1ad5a07a7f952c760.jpeg?w=1200&h=630&crop=faces&fit=crop&fm=jpg,2025-06-23T10:00:00Z,,President Donald Trump has just committed the most basic of strategic blunders: the fallacy of the last move. This is the mistaken belief that a powerful or bold action will decisively settle a dispu… [+1544 chars],,en,'Donald Trump'
83,https://nypost.com/2025/06/24/sports/sam-laporta-wife-get-blessed-by-pope-leo-xiv-at-the-vatican/,0,nypost.com,"Sam LaPorta, wife get blessed by Pope Leo XIV at the Vatican in ‘special moment’",The Lions might be extra blessed this year.,https://nypost.com/wp-content/uploads/sites/2/2025/06/newspress-collage-lmojuu3kb-1750806324500.jpg?quality=75&strip=all&1750791963&w=1024,2025-06-25T00:41:50Z,,"The Lions might be extra blessed this year. 
Or at least Sam LaPorta. 
The Detroit tight end and his wife, Callahan, visited St. Peter’s Basilica in Vatican City and were blessed by Pope Leo XIV, a… [+2147 chars]",,en,'Pope Leo'
https://www.thehindubusinessline.com/companies/the-biggest-risk-we-have-taken-so-far-was-jio-mukesh-ambani/article69734559.ece,https://www.thehindubusinessline.com/companies/the-biggest-risk-we-have-taken-so-far-was-jio-mukesh-ambani/article69734559.ece,0,www.thehindubusinessline.com,The biggest risk we have taken so far was Jio: Mukesh Ambani,"“We have always taken big risks because, for us, scale is important,” says Ambani noting that Reliance reinvents its business every 3-5 years, now heading towards becoming “a deep-tech and advanced manufacturing company”",https://bl-i.thgim.com/public/incoming/ae0hd6/article69734633.ece/alternates/LANDSCAPE_1200/IMG_2022-06-29T085552Z_2_2_1_R6A4HOFQ.jpg,2025-06-25T05:42:53Z,,"Reliance Jio, which has now grown to a $100 billion entity in terms of valuation, is the biggest risk the Ambanis have ever taken, said Mukesh Ambani, Chairman and Managing Director of Reliance Indus… [+2050 chars]",,en,'Mukesh Ambani'
84,https://www.livemint.com/companies/people/mukesh-ambani-reliance-industries-vision-start-business-be-billionaire-idiot-impact-people-jio-philosophy-success-risks-11750828325705.html,0,www.livemint.com,"Mukesh Ambani on vision for Reliance: ‘If you start a business to be a billionaire, you are an idiot, but…’","Mukesh Ambani on Reliance Industries' impact-led philosophy, clarity in goals, and how having the right talent helps drive innovation. Here's what he said about his goals, his father's vision, and aim for the company's longevity beyond his tenure.",https://www.livemint.com/lm-img/img/2025/06/25/1600x900/Mukesh_Ambani_Reliance_industries_Jio_news_busines_1750831377689_1750831378010.jpg,2025-06-25T06:24:29Z,,"Reliance Industries Chairman Mukesh Ambani has a north star vision for his company being impactful. Quoting his father, RIL founder Dhirubhai Ambani, the richest person in Asia noted that businesses … [+4220 chars]",,en,'Mukesh Ambani'
85,https://financialpost.com/pmn/business-pmn/ambani-and-adani-team-up-to-use-each-others-fuel-pumps,0,financialpost.com,Ambani and Adani Team Up to Use Each Other’s Fuel Pumps,"Billionaires Mukesh Ambani and Gautam Adani have partnered to sell transportation fuels using their respective groups’ retail stations across India, bolstering their distribution network across the world’s third largest oil consumer.",https://smartcdn.gprod.postmedia.digital/financialpost/wp-content/uploads/2025/06/775934934.jpg,2025-06-25T11:43:07Z,,"(Bloomberg)  
THIS CONTENT IS RESERVED FOR SUBSCRIBERS ONLY
Subscribe now to read the latest news in your city and across Canada.
<ul><li>Exclusive articles from Barbara Shecter, Joe O'Connor, Gab… [+3631 chars]",,en,'Mukesh Ambani'
86,https://abcnews.go.com/International/wireStory/pope-leo-xiv-affirms-celibacy-priests-demands-firm-123188014,0,abcnews.go.com,"Pope Leo XIV affirms celibacy for priests, demands 'firm' action on sex abuse",Pope Leo XIV has affirmed that priests must be celibate,https://i.abcnewsfe.com/a/d41ad2d5-b2de-4db6-bd55-81bb77c4fc83/wirestory_ea95357712b64d9d049b5aa0f91a3d5c_16x9.jpg?w=1600,2025-06-25T11:58:29Z,,"ROME -- ROME (AP) Pope Leo XIV affirmed Wednesday that priests must be celibate and insisted that bishops take firm and decisive action to deal with sex abusers, as he gave marching orders Wednesday … [+2799 chars]",,en,'Robert Francis Prevost'
87,https://dianeravitch.net/2025/06/25/the-philosopher-crackpot-who-hates-democracy-and-influences-powerful-tech-bros/,0,dianeravitch.net,The Philosopher Crackpot Who Hates Democracy and Influences Powerful Tech Bros,"If you haven’t heard of Curtis Yarvin, you should learn about him now. Yarvin does not believe in democracy. He believes in a society commanded by a king or autocrat. He was a prodigy as a child and now considers himself to be a political genius. Powerful men…",https://dianeravitch.net/wp-content/uploads/2025/06/img_1117-1.jpg,2025-06-25T13:00:00Z,,"If you haven’t heard of Curtis Yarvin, you should learn about him now. Yarvin does not believe in democracy. He believes in a society commanded by a king or autocrat. He was a prodigy as a child and … [+6287 chars]",,en,'Curtis Yarvin'
88,https://www.euractiv.com/section/politics/opinion/mediterranean-priorities-reframed-europe-looks-south-from-naples/,0,www.euractiv.com,Mediterranean Priorities Reframed: Europe Looks South from Naples [Promoted content],"From the 10th to the 12th of July, Naples will host a policy forum on the Mediterranean as a space of trade corridors, migration governance, and regional security at a time when Europe’s strategic depth and external authority are under reconsideration.",https://www.euractiv.com/wp-content/uploads/sites/2/2025/06/graphic.jpeg,2025-06-25T14:00:31Z,,"As the debate on Europes global vision evolves, the Mediterranean is once again positioned not as a limit, but as a strategic axis. From 10 to 12 July, a series of comprehensive policy discussions in… [+6385 chars]",,en,'nan nan'
89,https://nypost.com/2025/06/25/world-news/pope-leo-xiv-affirms-priests-must-be-celibate-demands-firm-action-on-sex-abuse/,0,nypost.com,"Pope Leo XIV affirms priests must be celibate, demands ‘firm’ action on sex abuse",Pope Leo XIV affirmed that priests must be celibate and insisted that bishops take “firm and decisive” action to deal with sex abusers.,https://nypost.com/wp-content/uploads/sites/2/2025/06/pope-leo-celibacy-abuse-hp.jpg?quality=75&strip=all&1750844035&w=1024,2025-06-25T14:14:59Z,,"Pope Leo XIV affirmed Wednesday that priests must be celibate and insisted that bishops take firm and decisive action to deal with sex abusers, as he gave marching orders to the worlds Catholic hiera… [+3332 chars]",,en,'Pope Leo'
90,https://tvline.com/news/jonathan-roumie-meets-pope-leo-xiv-the-chosen-1235467328/,0,tvline.com,The Chosen’s Jonathan Roumie Meets Pope Leo XIV After Wrapping Season 6 Crucifixion Shoot in Italy,"What a #blessed week for Jonathan Roumie. Just days after being named TVLine’s latest Performer of the Week, the star of TV’s The Chosen — the Christian historical drama that now calls Prime Video home — met Pope Leo XIV, during a Wednesday visit to the Vatic…",https://tvline.com/wp-content/uploads/2025/06/jonathan-roumie-the-pope-vatican-selfie.jpeg?w=650,2025-06-25T17:14:37Z,,"What a #blessed week for Jonathan Roumie.
Just days after being named TVLine’s latest Performer of the Week, the star of TV’s The Chosen — the Christian historical drama that now calls Prime Video h… [+1536 chars]",,en,'Pope Leo'
91,https://www.catholicnewsagency.com/news/264999/pope-leo-xiv-expresses-his-closeness-to-persecuted-christians-in-the-middle-east,0,www.catholicnewsagency.com,Pope Leo XIV expresses his closeness to persecuted Christians in the Middle East,"Pope Leo XIV waves to pilgrims at the Wednesday general audience in St. Peter's Square, Wednesday, June 25, 2025 / Credit: Daniel Ibáñez/CNA

ACI Prensa Staff, Jun 25, 2025 / 13:54 pm (CNA).
Pope Leo XIV expressed his closeness to persecuted Christians during…",https://www.catholicnewsagency.com/images/leogen625254.jpeg?jpg,2025-06-25T17:54:00Z,,"ACI Prensa Staff, Jun 25, 2025 /
 13:54 pm
Pope Leo XIV expressed his closeness to persecuted Christians during the Wednesday general audience on June 25, referring to the heinous terrorist attack … [+1878 chars]",,en,'Pope Leo'
92,https://www.breitbart.com/faith/2025/06/25/pope-leo-xiv-to-iran-and-israel-following-ceasefire-reject-arrogance-and-revenge-choose-peace/,0,www.breitbart.com,"Pope Leo XIV to Iran and Israel Following Ceasefire: 'Reject Arrogance and Revenge,' Choose Peace","Pope Leo XIV told Catholic believers during a weekly event on Wednesday that he welcomed the news of a ceasefire between Israel and Iran with ""hope,"" advising the nations to abandon plans for ""revenge"" and embrace a path to long-term peace.
The post Pope Leo …",https://media.breitbart.com/media/2025/06/GettyImages-2221349907-640x335.png,2025-06-25T18:25:57Z,,"Pope Leo XIV told Catholic believers during a weekly event on Wednesday that he welcomed the news of a ceasefire between Israel and Iran with “hope,” advising the nations to abandon plans for “reveng… [+4994 chars]",,en,'Pope Leo'
93,https://www.globenewswire.com/news-release/2025/06/25/3105405/0/en/Pope-Leo-Inspires-a-Jersey-That-Gives-Back-And-It-s-Made-Locally-in-Chicago-by-Catholic-Imprint.html,0,www.globenewswire.com,Pope Leo Inspires a Jersey That Gives Back — And It’s Made Locally in Chicago by Catholic Imprint,A Tribute to Pope Leo XIV and Chicago's Community Spirit A Tribute to Pope Leo XIV and Chicago's Community Spirit,https://ml.globenewswire.com/Resource/Download/47ccfd0d-8b03-473d-a05f-e82123dc612b,2025-06-25T19:21:00Z,,"Chicago, Illinois, June 25, 2025 (GLOBE NEWSWIRE) -- In a city where baseball, faith, and community pride run deep, a new jersey is turning heads and turning that pride into purpose. Catholic Imprint… [+3589 chars]",,en,'Pope Leo'
