index,url,valid,domain,title,description,image,published,archive,content,quote,language,keyword
https://punchng.com/ex-pm-nawaz-sharif-lands-in-pakistan-after-four-years-exile-local-media/,https://punchng.com/ex-pm-nawaz-sharif-lands-in-pakistan-after-four-years-exile-local-media/,0,punchng.com,Ex-PM Nawaz Sharif lands in Pakistan after four years exile – local media,"Three-time Pakistan Prime Minister, Nawaz Sharif, has landed in Pakistan after four years of exile, local Pakistan media reports. AFP reported, Saturday morning, that Sharif was on his way home after four years of self-imposed exile, primed to make a politica…",https://cdn.punchng.com/wp-content/uploads/2023/10/21064722/Nawaz-Sharif.jpg,2023-10-21T08:58:26Z,,"Three-time Pakistan Prime Minister, Nawaz Sharif, has landed in Pakistan after four years of exile, local Pakistan media reports.
AFP reported, Saturday morning, that Sharif was on his way home afte… [+1792 chars]",,en,'Nawaz Sharif'
https://deadline.com/2023/10/britney-spears-tried-to-speak-conservatorship-jonathan-ross-chat-show-edited-out-1235579765/,https://deadline.com/2023/10/britney-spears-tried-to-speak-conservatorship-jonathan-ross-chat-show-edited-out-1235579765/,0,deadline.com,"Britney Spears “Tried To Speak About Conservatorship, But She Was Edited Out Of UK Chat Show”","Britney Spears has written about her controversial conservatorship in her upcoming memoir, including the fact that she tried to speak about it on a TV chat show in 2016 – but her comments never made it to air. In her forthcoming book, The Woman in Me, Spears …",https://deadline.com/wp-content/uploads/2023/10/Screenshot-2023-10-21-at-11.21.02.png?w=1024,2023-10-21T10:37:03Z,,"Britney Spears has written about her controversial conservatorship in her upcoming memoir, including the fact that she tried to speak about it on a TV chat show in 2016 – but her comments never made … [+1414 chars]",,en,'Britney Spears'
https://www.rt.com/news/585474-trump-fined-gag-order-violation/,https://www.rt.com/news/585474-trump-fined-gag-order-violation/,0,www.rt.com,Trump fined for violating gag order,"Donald Trump has been fined $5,000 over failing to delete a disparaging post about a court clerk Read Full Article at RT.com",https://mf.b37mrtl.ru/files/2023.10/article/6533aba52030277391634456.jpg,2023-10-21T10:48:25Z,http://wayback.archive-it.org/all/20231023154719/https://www.rt.com/news/585474-trump-fined-gag-order-violation/,"Former US President Donald Trump has been fined $5,000 for violating a gag order in his civil fraud trial, with a New York judge warning him of possible jail time if it happens again.
In a two-page … [+1974 chars]",,en,'Donald Trump'
https://www.investing.com/news/world-news/pakistans-threetime-premier-nawaz-sharif-arrives-home-from-exile-3204864,https://www.investing.com/news/world-news/pakistans-threetime-premier-nawaz-sharif-arrives-home-from-exile-3204864,0,www.investing.com,Pakistan's three-time premier Nawaz Sharif arrives home from exile,Pakistan's three-time premier Nawaz Sharif arrives home from exile,https://i-invdn-com.investing.com/news/news_headline_open_108x81._800x533_L_1419519630.jpg,2023-10-21T13:55:56Z,,"By Asif Shahzad and Mubasher Bukhari
ISLAMABAD (Reuters) -Pakistan's three-time Prime Minister Nawaz Sharif arrived home on Saturday from four years of self-imposed exile in London, aiming to kick s… [+3790 chars]",,en,'Nawaz Sharif'
https://comicbookmovie.com/sci_fi/star-wars/x-men-star-kelsey-grammer-reflects-on-his-han-solo-audition-for-george-lucas-star-wars-a-new-hope-a207342,https://comicbookmovie.com/sci_fi/star-wars/x-men-star-kelsey-grammer-reflects-on-his-han-solo-audition-for-george-lucas-star-wars-a-new-hope-a207342,0,comicbookmovie.com,X-MEN Star Kelsey Grammer Reflects On His Han Solo Audition For George Lucas' STAR WARS: A NEW HOPE,"X-Men: The Last Stand and Frasier star Kelsey Grammer has reflected on auditioning for the role of Han Solo in Star Wars, sharing his reaction to seeing Harrison Ford in the finished movie years later.",https://comicbookmovie.com/images/articles/banners/207342.jpg,2023-10-21T14:05:49Z,https://web.archive.org/web/20231022200611/https://comicbookmovie.com/sci_fi/star-wars/x-men-star-kelsey-grammer-reflects-on-his-han-solo-audition-for-george-lucas-star-wars-a-new-hope-a207342,"Kelsey Grammer is a screen icon, particularly when it comes to his work on television. However, his career could have gone down a vastly different route had George Lucas cast him as Han Solo in Star … [+2648 chars]",,en,'Harrison Ford'
https://abcnews.go.com/International/wireStory/pakistans-thrice-elected-exiled-former-prime-minister-nawaz-104192134,https://abcnews.go.com/International/wireStory/pakistans-thrice-elected-exiled-former-prime-minister-nawaz-104192134,0,abcnews.go.com,Pakistan's self-exiled former Prime Minister Nawaz Sharif returns home ahead of a parliamentary vote,"Pakistan’s former Prime Minister Nawaz Sharif has returned home on a chartered plane from Dubai, ending four years of self-imposed exile in London as he seeks to win the support of voters in parliamentary elections due in January",https://i.abcnewsfe.com/a/80d790ff-65c9-4fe2-a92f-ac93782d8eca/wirestory_3aa71b80d34a4ac95fc6994e66d8fdbe_16x9.jpg?w=992,2023-10-21T16:38:28Z,,"ISLAMABAD -- Pakistan's former Prime Minister Nawaz Sharif arrived home Saturday on a chartered plane from Dubai, ending four years of self-imposed exile in London as he seeks to rally supporters ahe… [+3855 chars]",,en,'Nawaz Sharif'
https://time.com/6326834/javier-milei-argentina-presidential-race-candidate-bio/,https://time.com/6326834/javier-milei-argentina-presidential-race-candidate-bio/,0,time.com,Javier Milei Is the Frontrunner in Argentina’s Presidential Race. Here’s What to Know,"Milei shocked experts by winning a primary in August, launching him to the front of the race. Here's what you need to know.",https://api.time.com/wp-content/uploads/2023/10/GettyImages-1732887274.jpg?quality=85,2023-10-21T16:38:29Z,,"Javier Milei is the frontrunner in Argentina's upcoming election. A polarizing far-right candidate who rails against the political establishment and promises to jumpstart the economy, Milei has drawn… [+4533 chars]",,en,'Sergio Massa'
https://www.ibtimes.com/argentines-vote-seeking-escape-economic-shambles-3716007,https://www.ibtimes.com/argentines-vote-seeking-escape-economic-shambles-3716007,0,www.ibtimes.com,"Argentines To Vote, Seeking Escape From Economic Shambles",Argentines head to the polls on Sunday in a presidential election dominated by fury over decades of economic decline and record inflation that has propelled political outsider Javier Milei to the front of the race.,https://d.ibtimes.com/en/full/4494306/political-outsider-javier-milei-former-security-minister-patricia-bullrich-economy-minister.jpg,2023-10-22T01:30:36Z,,Argentines head to the polls on Sunday in a presidential election dominated by fury over decades of economic decline and record inflation that has propelled political outsider Javier Milei to the fro… [+4309 chars],,en,'Javier Milei'
https://deadline.com/2023/10/crossroads-director-sequel-britney-spears-1235580028/,https://deadline.com/2023/10/crossroads-director-sequel-britney-spears-1235580028/,0,deadline.com,‘Crossroads’ Director On Potential Sequel & Talks With Britney Spears,"Crossroads has been getting a lot of attention lately following the release of Britney Spears’ memoir titled The Woman in Me. The film’s director Tamra Davis recently did an interview where she talked about the potential of a sequel, which she says there have…",https://deadline.com/wp-content/uploads/2023/10/crossroads-britney-spears-taryn-manning-zoe-saldana.jpg?w=1024,2023-10-22T01:41:29Z,,"Crossroads has been getting a lot of attention lately following the release of Britney Spears‘ memoir titled The Woman in Me.
The film’s director Tamra Davis recently did an interview where she talk… [+1725 chars]",,en,'Britney Spears'
https://deadline.com/2023/10/snl-trump-cold-open-jim-jordan-bad-bunny-1235579988/,https://deadline.com/2023/10/snl-trump-cold-open-jim-jordan-bad-bunny-1235579988/,0,deadline.com,"Trump, Jim Jordan’s Failures & “Awful” America Lights Up ‘SNL’s Cold Open","“Yo-hoo, is this the loser’s room?” asked James Austin Johnson’s Donald Trump on Saturday Night Live’s cold open tonight. “Don’t we love our country, what an awful place it is,” he said later in the skit, nailing the ex-real estate mogul and one of the better…",https://deadline.com/wp-content/uploads/2023/10/trump-jordan-snl-oct-21-.jpeg?w=1024,2023-10-22T03:48:00Z,,"“Yo-hoo, is this the loser’s room?” asked James Austin Johnson’s Donald Trump on Saturday Night Live’s cold open tonight. “Don’t we love our country, what an awful place it is,” he said later in the … [+3952 chars]",,en,'Jim Jordan'
https://deadline.com/2023/10/bad-bunny-snl-recap-mick-jagger-lady-gaga-1235580076/,https://deadline.com/2023/10/bad-bunny-snl-recap-mick-jagger-lady-gaga-1235580076/,0,deadline.com,Bad Bunny Makes Splashy Spanglish ‘SNL’ Debut With A Little Help From Mick Jagger & Lady Gaga,Bad Bunny made his SNL debut tonight and it’s every Latin American’s Spanglish dream come true. From his shout-out to Sabado Gigante—the Spanglish-language game show that aired for 53 years on Univision—to his hilarious collaborations with Marcello Hernandez …,https://deadline.com/wp-content/uploads/2023/10/bad-bunny-mick-jagger-lady-gaga.jpg?w=1024,2023-10-22T05:50:16Z,,Bad Bunny made his SNL debut tonight and it’s every Latin American’s Spanglish dream come true. From his shout-out to Sabado Gigante—the Spanglish-language game show that aired for 53 years on Univis… [+2505 chars],,en,'Mick Jagger'
https://www.stereogum.com/2239990/saturday-night-live-bad-bunny-episode-videos/news/,https://www.stereogum.com/2239990/saturday-night-live-bad-bunny-episode-videos/news/,0,www.stereogum.com,"SNL Had Bad Bunny As Shrek, Trump Quoting Radiohead, And Cameos From Mick Jagger, Lady Gaga, Pedro Pascal, & Fred Armisen","Bad Bunny pulled double duty as host and musical guest on this weekend’s episode of Saturday Night Live, fresh off the release of his latest album Nadie Sabe Lo Que Va a Pasar Mañana. He performed two tracks from that, “UN PREVIEW” and “MONACO” (and was intro…",https://static.stereogum.com/uploads/2023/10/bad-bunny-snl-1697979370.jpeg,2023-10-22T12:59:44Z,,"Bad Bunny pulled double duty as host and musical guest on this weekend’s episode of Saturday Night Live, fresh off the release of his latest album Nadie Sabe Lo Que Va a Pasar Mañana. He performed tw… [+889 chars]",,en,'Mick Jagger'
https://www.tmz.com/2023/10/22/bad-bunny-snl-pedro-pascal-lady-gaga-mick-jagger/,https://www.tmz.com/2023/10/22/bad-bunny-snl-pedro-pascal-lady-gaga-mick-jagger/,0,www.tmz.com,"Bad Bunny Hosts 'SNL' with Guests Pedro Pascal, Lady Gaga","Bad Bunny took over ""SNL"" Saturday night in a big way, hosting AND performing as the musical guest, with lots of celeb firepower behind him. His opening monologue was hilarious ... Pedro Pascal served as a ""translator"" for BB, who, true to form,…",https://imagez.tmz.com/image/49/16by9/2023/10/22/4980ffe4bb8b499f906dbb1cefa553d0_xl.jpg,2023-10-22T13:02:21Z,,"Bad Bunny took over ""SNL"" Saturday night in a big way, hosting AND performing as the musical guest, with lots of celeb firepower behind him.
His opening monologue was hilarious ... Pedro Pascal serv… [+618 chars]",,en,'Mick Jagger'
https://pitchfork.com/news/watch-bad-bunnys-snl-episode-featuring-lady-gaga-mick-jagger-pedro-pascal/,https://pitchfork.com/news/watch-bad-bunnys-snl-episode-featuring-lady-gaga-mick-jagger-pedro-pascal/,0,pitchfork.com,"Watch Bad Bunny’s SNL Episode Featuring Lady Gaga, Mick Jagger, Pedro Pascal","He hosted and served as musical guest, performing “Un Preview” and “Monaco” from his new album","https://media.pitchfork.com/photos/65351e7ec11fb9c80719485d/16:9/w_1280,c_limit/bad-bunny.jpg",2023-10-22T13:07:38Z,,"In this sequel to a sketch from Pedro Pascals episode as host, Marcello Hernandez brings his white girlfriend home to meet his mom (Pedro Pascal) and Benito (his aunt). Moments after appearing, Pasca… [+1468 chars]",,en,'Lady Gaga'
https://www.tmz.com/2023/10/22/snl-afterparty-kendall-jenner-bad-bunny-lady-gaga-pedro-pascal-mick-jagger-michael-polansky/,https://www.tmz.com/2023/10/22/snl-afterparty-kendall-jenner-bad-bunny-lady-gaga-pedro-pascal-mick-jagger-michael-polansky/,0,www.tmz.com,Kendall Jenner and Bad Bunny Attend 'SNL' Afterparty with Lady Gaga and Ex-Fiance,"Bad Bunny brought his GF, Kendall Jenner, to 'SNL' .... she didn't appear on the show, but they were super tight during the afterparty. BB, Kendall and the cast, along with guest stars Pedro Pascal, Mick Jagger and Lady Gaga, all hit up Le'Avenue…",https://imagez.tmz.com/image/e5/16by9/2023/10/22/e525c390006d45fdaebf4c14bfb972cc_xl.jpg,2023-10-22T13:54:53Z,,"Bad Bunny brought his GF, Kendall Jenner, to 'SNL' .... she didn't appear on the show, but they were super tight during the afterparty.
BB, Kendall and the cast, along with guest stars Pedro Pascal,… [+507 chars]",,en,'Mick Jagger'
https://www.aljazeera.com/news/2023/10/22/argentines-vote-in-presidential-election-amid-economic-woes,https://www.aljazeera.com/news/2023/10/22/argentines-vote-in-presidential-election-amid-economic-woes,0,www.aljazeera.com,Argentines vote in presidential election amid economic woes,Far-right leader Javier Milei leads the race amid anger against traditional parties for failing to fix the economy.,https://www.aljazeera.com/wp-content/uploads/2023/10/AP23295453516448-1697981384.jpg?resize=1920%2C1440,2023-10-22T15:09:21Z,,"Argentines are voting in a presidential election that might see a far-right populist leader, who has vowed to overhaul the Latin American countrys ailing economy, emerge victorious.
Polling stations… [+2556 chars]",,en,'Sergio Massa'
https://www.startribune.com/california-gov-gavin-newsom-is-traveling-to-china-to-talk-climate-change/600313991/,https://www.startribune.com/california-gov-gavin-newsom-is-traveling-to-china-to-talk-climate-change/600313991/,0,www.startribune.com,California Gov. Gavin Newsom is traveling to China to talk climate change,"California Gov. Gavin Newsom will try to reinforce his state's role as a global leader on climate change as he begins a weeklong visit to China on Monday, a trip that presents both political risk and opportunity for crucial international collaboration.",https://www.startribune.com/static/img/branding/logos/strib-social-card.png?d=1696606793,2023-10-22T16:06:11Z,,"SACRAMENTO, Calif. California Gov. Gavin Newsom will try to reinforce his state's role as a global leader on climate change as he begins a weeklong visit to China on Monday, a trip that presents both… [+6208 chars]",,en,'Chuck Schumer'
https://abcnews.go.com/US/wireStory/california-gov-gavin-newsom-traveling-china-talk-climate-104208437,https://abcnews.go.com/US/wireStory/california-gov-gavin-newsom-traveling-china-talk-climate-104208437,0,abcnews.go.com,California Gov. Gavin Newsom is traveling to China to talk climate change,California Gov. Gavin Newsom is kicking off a weeklong visit to China focused on climate change,https://i.abcnewsfe.com/a/2a37f036-5e26-4bf4-9954-54b45e12b581/wirestory_948b7976669fbe82ef47c8838c8c50e4_12x5.jpg?w=992,2023-10-22T16:22:28Z,,"SACRAMENTO, Calif. -- California Gov. Gavin Newsom will try to reinforce his state's role as a global leader on climate change as he begins a weeklong visit to China on Monday, a trip that presents b… [+6171 chars]",,en,'Chuck Schumer'
https://www.forbes.com/sites/russellflannery/2023/10/22/california-governor-gavin-newsom-to-start-week-long-china-visit-on-monday/,https://www.forbes.com/sites/russellflannery/2023/10/22/california-governor-gavin-newsom-to-start-week-long-china-visit-on-monday/,0,www.forbes.com,California Governor Gavin Newsom To Start Week-Long China Visit On Monday,"Stops include Shenzhen, Guangzhou, Beijing and Shanghai",https://imageio.forbes.com/specials-images/imageserve/625dbc4cbcf1b6aa4a04133d/0x0.jpg?format=jpg&height=900&width=1600&fit=bounds,2023-10-22T16:31:21Z,http://wayback.archive-it.org/all/20231023024720/https://www.forbes.com/sites/russellflannery/2023/10/22/california-governor-gavin-newsom-to-start-week-long-china-visit-on-monday/,"California Governor Gavin Newsom plans to visit Tesla's Shanghai factory during his upcoming China ... [+] trip. (Photo by Xiaolu Chu/Getty Images)
Getty Images
California Governor Gavin Newsom, se… [+3798 chars]",,en,'Chuck Schumer'
https://www.indiewire.com/news/general-news/pedro-pascal-surprise-snl-cameo-bad-bunny-monologue-1234919067/,https://www.indiewire.com/news/general-news/pedro-pascal-surprise-snl-cameo-bad-bunny-monologue-1234919067/,0,www.indiewire.com,Pedro Pascal Makes Surprise ‘SNL’ Appearance as Bad Bunny’s Monologue Translator,The episode also featured unexpected cameos from Mick Jagger and Lady Gaga.,https://www.indiewire.com/wp-content/uploads/2023/10/Screen-Shot-2023-10-22-at-8.59.24-AM.png,2023-10-22T16:36:38Z,,"Season 49 of “Saturday Night Live” continued to double down on star power in its second episode. After a season premiere that featured surprise cameos from Taylor Swift and Travis Kelce, host and mus… [+1857 chars]",,en,'Mick Jagger'
https://wealthofgeeks.com/trump-gag-order-lifted/,https://wealthofgeeks.com/trump-gag-order-lifted/,0,wealthofgeeks.com,Gag Order Lifted After Trump Is Fined $5000,"Former President Donald Trump was ordered to pay a $5,000 fine this week after violating a gag order imposed by U.S. District Judge Tanya Chutkan. ... Read More",https://wealthofgeeks.com/wp-content/uploads/2023/09/Trump-7.jpg,2023-10-22T20:15:12Z,,"Former President Donald Trump was ordered to pay a $5,000 fine this week after violating a gag order imposed by U.S. District Judge Tanya Chutkan. Trial judge Arthur Engoron gave Trump the fine follo… [+2900 chars]",,en,'Donald Trump'
https://politicalwire.com/2023/10/22/argentines-head-to-the-polls/,https://politicalwire.com/2023/10/22/argentines-head-to-the-polls/,0,politicalwire.com,Argentines Head to the Polls,"“Frustrated voters in Argentina weighed whether to hand the presidency to a right-wing populist who has shaken up the political system and pledges to drastically overhaul the state if he wins an election taking place Sunday,” the AP reports.“Javier Milei, a s…",https://politicalwire.com/wp-content/uploads/2018/02/PW-podcast-logo.jpg,2023-10-22T20:48:00Z,https://web.archive.org/web/20231022210243/https://politicalwire.com/2023/10/22/argentines-head-to-the-polls/,"“There are a lot of blogs and news sites claiming to understand politics, but only a few actually do. Political Wire is one of them.”
 Chuck Todd, host of “Meet the Press”
“Concise. Relevant. To th… [+594 chars]",,en,'Javier Milei'
https://japantoday.com/category/world/california-gov.-gavin-newsom-is-traveling-to-china-to-talk-climate-change,https://japantoday.com/category/world/california-gov.-gavin-newsom-is-traveling-to-china-to-talk-climate-change,0,japantoday.com,California Gov Newsom traveling to China to talk climate change,"California Gov Gavin Newsom will try to reinforce his state's role as a global leader on climate change as he begins a weeklong visit to China on Monday, a trip that presents both political risk and opportunity for crucial international collaboration. Newsom’…",,2023-10-22T21:24:24Z,,"California Gov Gavin Newsom will try to reinforce his state's role as a global leader on climate change as he begins a weeklong visit to China on Monday, a trip that presents both political risk and … [+6182 chars]",,en,'Gavin Newsom'
https://japantoday.com/category/world/argentines-vote-seeking-elixir-for-economic-ills,https://japantoday.com/category/world/argentines-vote-seeking-elixir-for-economic-ills,0,japantoday.com,Anxious Argentines vote for way out of economic shambles,"Argentines voted Sunday in a presidential election dominated by fury over decades of economic decline and record inflation that has propelled libertarian outsider Javier Milei to the front of a tight race. Once one of the richest countries in the world, Argen…",,2023-10-22T21:24:31Z,https://web.archive.org/web/20231023022421/https://japantoday.com/category/world/argentines-vote-seeking-elixir-for-economic-ills,Argentines voted Sunday in a presidential election dominated by fury over decades of economic decline and record inflation that has propelled libertarian outsider Javier Milei to the front of a tight… [+3994 chars],,en,'Javier Milei'
https://www.newsweek.com/david-jolly-warns-republicans-aiming-speaker-are-dangerous-1836780,https://www.newsweek.com/david-jolly-warns-republicans-aiming-speaker-are-dangerous-1836780,0,www.newsweek.com,Ex-GOP Congressman Warns Republicans Aiming to Be Speaker Are 'Dangerous',"David Jolly told Newsweek on Sunday that the House speaker candidates may not start off at such a dangerous spot as Jim Jordan, but may end up there.",https://d.newsweek.com/en/full/2297895/jim-jordan-david-jolly.png,2023-10-22T22:06:45Z,,"Former Republican Representative David Jolly warned that the GOP members running for the House speakership position could be just as ""dangerous"" as Representative Jim Jordan while speaking to Newswee… [+5312 chars]",,en,'Chuck Schumer'
https://japantoday.com/category/world/argentina-election-on-knife-edge-as-peronists-appear-to-outperform,https://japantoday.com/category/world/argentina-election-on-knife-edge-as-peronists-appear-to-outperform,0,japantoday.com,Argentina election close but Peronists appear to have edge,"Argentina's general election vote was being counted on Sunday evening, with early signals suggesting the under-fire Peronist ruling coalition was performing better than expected, while all eyes remained on far-right libertarian radical Javier Milei. Argentine…",,2023-10-23T00:43:28Z,https://web.archive.org/web/20231023053840/https://japantoday.com/category/world/argentina-election-on-knife-edge-as-peronists-appear-to-outperform,"Argentina's general election vote was being counted on Sunday evening, with early signals suggesting the under-fire Peronist ruling coalition was performing better than expected, while all eyes remai… [+4710 chars]",,en,'Javier Milei'
https://cointelegraph.com/news/javier-milei-argentina-presidential-election-vote-run-off,https://cointelegraph.com/news/javier-milei-argentina-presidential-election-vote-run-off,0,cointelegraph.com,Pro-Bitcoin Javier Milei trails as Argentina’s presidential election goes to run-off,"Javier Milei, a pro-Bitcoin populist, is trailing in the Argentina’s presidential elections and is set to face centrist economy minister Sergio Massa in a Nov. 19 run-off vote.","https://images.cointelegraph.com/cdn-cgi/image/format=auto,onerror=redirect,quality=90,width=1200/https://s3.cointelegraph.com/uploads/2023-10/0eb0001f-257f-4254-9c15-3425255ebfca.jpg",2023-10-23T01:49:22Z,,Pro-Bitcoin (BTC) presidential candidate Javier Milei failed to secure victory in the first round of the Argentine presidential election and is now set to face off against economy minister Sergio Mas… [+1831 chars],,en,'Javier Milei'
https://sputnikglobe.com/20231023/milei-massa-reach-2nd-round-of-presidential-election-in-argentina---electoral-chamber-1114414878.html,https://sputnikglobe.com/20231023/milei-massa-reach-2nd-round-of-presidential-election-in-argentina---electoral-chamber-1114414878.html,0,sputnikglobe.com,"Milei, Massa Reach 2nd Round of Presidential Election in Argentina - Electoral Chamber","BUENOS AIRES (Sputnik) - Argentine Economy Minister Sergio Massa and the leader of the far-right Liberty Advances party, Javier Milei, have advanced to the second round of the Argentine presidential election, scheduled for November 19, according to the Nation…",https://cdn1.img.sputnikglobe.com/images/sharing/article/eng/1114414878.jpg?11103905631698031148,2023-10-23T03:19:08Z,,"Sputnik brings you all the latest breaking stories, expert analysis and videos from North and South America.
https://sputnikglobe.com/20231023/milei-massa-reach-2nd-round-of-presidential-election-in… [+1799 chars]",,en,'Javier Milei'
https://www.aljazeera.com/news/2023/10/23/argentina-heads-to-runoff-as-economy-minister-leads-far-right-outsider,https://www.aljazeera.com/news/2023/10/23/argentina-heads-to-runoff-as-economy-minister-leads-far-right-outsider,0,www.aljazeera.com,Argentina heads to runoff as economy minister beats far-right outsider,Sergio Massa and Javier Milei will face-off next month after stronger-than-expected showing by ruling coalition.,https://www.aljazeera.com/wp-content/uploads/2023/10/AP23295554459194-1698028321.jpg?resize=1920%2C1440,2023-10-23T03:43:08Z,,Argentina is headed for a run-off vote between Economy Minister Sergio Massa and the far-right libertarian Javier Milei after a better-than-expected performance by the ruling Peronist coalitions cand… [+1981 chars],,en,'Sergio Massa'
