index,url,valid,domain,title,description,image,published,archive,content,quote,language,keyword
https://bleedingcool.com/tv/new-years-eve-live-nashvilles-big-bash-our-preview-viewing-guide/,https://bleedingcool.com/tv/new-years-eve-live-nashvilles-big-bash-our-preview-viewing-guide/,0,bleedingcool.com,New Year's Eve Live: Nashville's Big Bash: Our Preview/Viewing Guide,"If you're not looking to spend New Year's Eve night ""rockin'"" with Ryan Seacrest over on ABC or throwing back shots with Anderson Cooper and Andy Cohen over on CNN, you might want to check out what four-time Grammy Award-winner Keith Urban and Rachel Smith (E…",https://bleedingcool.com/wp-content/uploads/2024/12/MixCollage-29-Dec-2024-09-49-PM-2537-2000x1125.jpg,2025-01-01T00:07:07Z,,"Posted in: CBS, TV | Tagged: Keith Urban, nashville, new year's eve
Kicking off at 8 pm ET with hosts Keith Urban and Rachel Smith, here's our viewers' guide to CBS's New Year's Eve Live: Nashville'… [+2993 chars]",,en,'Zach Bryan'
https://radaronline.com/p/tucker-carlson-beg-donald-trump-get-to-bottom-ufo-mysteries-america/,https://radaronline.com/p/tucker-carlson-beg-donald-trump-get-to-bottom-ufo-mysteries-america/,0,radaronline.com,Alien Nut Tucker Carlson 'Set to Beg Donald Trump to Let Him Get to Bottom of America's UFO Mysteries',"Tucker Carlson, dubbed an alien nut, is said to seek Trump's help to uncover America's UFO mysteries.",https://media.radaronline.com/brand-img/FcKl2hkLH/1200x628/tucker-carlson-set-to-beg-donald-trump-1735644136968.jpg,2025-01-02T12:00:00Z,,"""It's a hot topic that merits scrutiny, and now there's a new administration coming in that may be more open and start sharing some UFO intel."" 
Carlson's pal, SpaceX founder Elon Musk, said UFO sig… [+320 chars]",,en,'Tucker Carlson'
https://www.vanityfair.com/style/story/meghan-markle-just-launched-a-new-instagram-account-with-a-mission,https://www.vanityfair.com/style/story/meghan-markle-just-launched-a-new-instagram-account-with-a-mission,0,www.vanityfair.com,Meghan Markle Just Launched a New Instagram Account—With a Mission,The duchess is back on the platform after 5 years. A source tells Vanity Fair her return follows discussions with Meta.,"https://media.vanityfair.com/photos/6776b3ad9d329cba3f602edc/16:9/w_1280,c_limit/meghan-markle-new-instagram-account.jpg",2025-01-02T16:17:54Z,http://archive.md/20250102164844/https://www.vanityfair.com/style/story/meghan-markle-just-launched-a-new-instagram-account-with-a-mission,"On Wednesday morning, Meghan Markle kicked off the new year by returning to Instagram after a nearly five-year hiatus from the social media platform. Using her new account, @meghan, the Duchess of Su… [+2372 chars]",,en,'Meghan Markle'
https://www.forbes.com/sites/maryroeloffs/2025/01/02/what-we-know-about-meghan-markles-netflix-lifestyle-show-ahead-of-january-debut/,https://www.forbes.com/sites/maryroeloffs/2025/01/02/what-we-know-about-meghan-markles-netflix-lifestyle-show-ahead-of-january-debut/,0,www.forbes.com,What We Know About Meghan Markle’s Netflix Lifestyle Show Ahead Of January Debut,"Prince Harry and Meghan signed a five-year, $100 million contract with Netflix in 2020 to produce several shows and films.","https://imageio.forbes.com/specials-images/imageserve/6776f6c93c2aeb1c9ef92408/0x0.jpg?format=jpg&crop=2900,1630,x417,y291,safe&height=900&width=1600&fit=bounds",2025-01-02T20:37:31Z,http://archive.md/20250103004107/https://www.forbes.com/sites/maryroeloffs/2025/01/02/what-we-know-about-meghan-markles-netflix-lifestyle-show-ahead-of-january-debut/,"Meghan Markle is set to make her return to the small screen later this month with a new lifestyle show called ""With Love, Meghan,"" a Netflix original lifestyle series born out of her and Prince Harry… [+4518 chars]",,en,'Prince Harry'
https://pagesix.com/2025/01/05/style/brianna-chickenfry-returns-to-golden-globes-red-carpet-in-plunging-gown-after-zach-bryan-split/,https://pagesix.com/2025/01/05/style/brianna-chickenfry-returns-to-golden-globes-red-carpet-in-plunging-gown-after-zach-bryan-split/,0,pagesix.com,Brianna Chickenfry returns to Golden Globes red carpet in plunging gown after Zach Bryan criticized her 2024 look,"The Barstool Sports podcast host rocked a curve-hugging, sheer gown at last year's show.",https://pagesix.com/wp-content/uploads/sites/3/2025/01/96279854.jpg?quality=75&strip=all&w=1024,2025-01-06T00:22:37Z,,"Brianna Chickenfry heated up the red carpet at the 2025 Golden Globes Sunday night in a plunging strapless gown one year after ex Zach Bryan criticized her look at the same awards show. 
In addition… [+2671 chars]",,en,'Zach Bryan'
https://pagesix.com/2025/01/05/celebrity-news/brianna-chickenfry-proclaims-shes-leaving-all-men-behind-after-zach-bryan-split/,https://pagesix.com/2025/01/05/celebrity-news/brianna-chickenfry-proclaims-shes-leaving-all-men-behind-after-zach-bryan-split/,0,pagesix.com,Brianna Chickenfry proclaims she’s leaving ‘all men’ and ‘relationships’ behind this year following Zach Bryan split,The podcaster and musician split last fall after more than one year together.,https://pagesix.com/wp-content/uploads/sites/3/2025/01/96303080.jpg?quality=75&strip=all&w=1024,2025-01-06T04:31:07Z,,"In her single girl era.
Brianna Chickenfry LaPaglia proclaimed shes leaving all men and relationships behind this year while exclusively speaking to Page Six at the 2025 Golden Globes Sunday night. … [+2696 chars]",,en,'Zach Bryan'
https://dailycaller.com/2025/01/06/exclusive-hunter-biden-whistleblower-reveals-how-trump-admin-can-break-deep-states-hold-over-irs-doj/,https://dailycaller.com/2025/01/06/exclusive-hunter-biden-whistleblower-reveals-how-trump-admin-can-break-deep-states-hold-over-irs-doj/,0,dailycaller.com,"EXCLUSIVE: Hunter Biden whistleblower reveals how Trump admin can break deep state’s hold over IRS, DOJ",The whistleblower whose allegations sparked widespread scrutiny about the DOJ handling of the Hunter Biden tax case said reforms are needed in both agencies.,https://cdn01.dailycaller.com/wp-content/uploads/2025/01/GettyImages-520783510-scaled-e1735934487274.jpg,2025-01-06T13:50:14Z,http://archive.md/20250107192624/https://dailycaller.com/2025/01/06/exclusive-hunter-biden-whistleblower-reveals-how-trump-admin-can-break-deep-states-hold-over-irs-doj/,"The Department of Justice (DOJ) needs to be “completely revamped” to eliminate political bias, the Internal Revenue Service (IRS) whistleblower whose explosive allegations sparked widespread scrutiny… [+5017 chars]",,en,'Hunter Biden'
https://www.vanityfair.com/style/story/prince-william-personal-connection-to-new-orleans-attack-victim-is-shocked,https://www.vanityfair.com/style/story/prince-william-personal-connection-to-new-orleans-attack-victim-is-shocked,0,www.vanityfair.com,"Prince William, Who Has a Personal Connection to New Orleans Attack Victim, Is “Shocked”","Edward Pettifer, one of 15 killed, was the stepson of William and Prince Harry’s former nanny.","https://media.vanityfair.com/photos/677c052f26b7d97efd61efe0/16:9/w_1280,c_limit/prince-william-new-orleans.jpg",2025-01-06T16:48:25Z,,"On Saturday, Prince William and Kate Middleton sent their condolences to the victims of a New Year's Day truck attack in New Orleans, revealing the tragedys connection to the royal family. Edward Pet… [+1870 chars]",,en,'Prince William'
https://www.mediaite.com/politics/giant-shtshow-billy-bush-tells-tucker-carlson-he-had-no-recollection-of-trumps-infamous-grab-her-by-the-line-until-hearing-years-later/,https://www.mediaite.com/politics/giant-shtshow-billy-bush-tells-tucker-carlson-he-had-no-recollection-of-trumps-infamous-grab-her-by-the-line-until-hearing-years-later/,0,www.mediaite.com,‘Giant Sh*tshow!’ Billy Bush Tells Tucker Carlson He Had ‘No Recollection’ of Trump’s Infamous ‘Grab Her By the…’ Line Until Hearing Years Later,"Billy Bush opened up to Tucker Carlson about the infamous tape featuring President-elect Donald Trump that got Bush fired.
The post ‘Giant Sh*tshow!’ Billy Bush Tells Tucker Carlson He Had ‘No Recollection’ of Trump’s Infamous ‘Grab Her By the…’ Line Until He…",https://www.mediaite.com/wp-content/uploads/2025/01/billy-bush-tucker-carlson-access-hollywood-tape.jpg,2025-01-07T14:51:45Z,,"Screenshot via Tucker Carlson Network
Former Access Hollywood correspondent and Today co-host Billy Bush opened up to Tucker Carlson about the infamous tape featuring President-elect Donald Trump th… [+3236 chars]",,en,'Tucker Carlson'
https://themorningnews.org/p/tuesday-headlines-taylor-swift-meets-the-mythic,https://themorningnews.org/p/tuesday-headlines-taylor-swift-meets-the-mythic,0,themorningnews.org,Tuesday headlines: Taylor Swift meets the mythic,"An Italian village forbids its residents from becoming ill—to highlight the country's decimated healthcare system. / BBC News

Unhoused people explain what it's like when city workers trash their belongings. / ProPublica

New and ongoing programs may be solvi…",https://themorningnews.org/images/tmn-logo-share.png,2025-01-07T15:44:00Z,,"In an unwritten, unannounced policy change, Louisiana's Dept. of Health is forbidding employees from promoting Covid, flu, or mpox vaccines. / NPR
Photos of daily life for the Palestinian people—""be… [+2219 chars]",,en,'David Weiss'
https://www.celebitchy.com/903907/prince_william_wants_to_take_kate_on_a_second_honeymoon_to_kenya_this_year/,https://www.celebitchy.com/903907/prince_william_wants_to_take_kate_on_a_second_honeymoon_to_kenya_this_year/,0,www.celebitchy.com,Prince William wants to take Kate on a ‘second honeymoon’ to Kenya this year??,"Sometimes, I really do believe that the Princess of Wales and the Middleton family have Prince William over a barrel. He’s stuck in some sense. Stuck in a miserable marriage because (in my opinion) the Middletons hold too much kompromat on him. Then again, th…",,2025-01-08T12:45:05Z,,"Sometimes, I really do believe that the Princess of Wales and the Middleton family have Prince William over a barrel. Hes stuck in some sense. Stuck in a miserable marriage because (in my opinion) th… [+8798 chars]",,en,'Kate Middleton'
https://www.vanityfair.com/style/story/friends-say-kate-middleton-is-changed-as-a-person-and-reprioritizing-her-work-life-balance,https://www.vanityfair.com/style/story/friends-say-kate-middleton-is-changed-as-a-person-and-reprioritizing-her-work-life-balance,0,www.vanityfair.com,Friends Say Kate Middleton Is “Changed As a Person” and Reprioritizing Her Work/Life Balance,Sources tell the Daily Mail that Princess Catherine's experience with cancer is reshaping how she envisions her public and private roles.,"https://media.vanityfair.com/photos/677e9c6d67c7ed6eb4dd6b7d/16:9/w_1280,c_limit/kate-middleton-birthday.jpg",2025-01-08T16:21:06Z,http://archive.md/20250108195111/https://www.vanityfair.com/style/story/friends-say-kate-middleton-is-changed-as-a-person-and-reprioritizing-her-work-life-balance,"On Thursday, Kate Middleton will celebrate her 43rd birthday after a year of health challenges and time away from the spotlight. According to the Daily Mail, the Princess of Wales plans to observe th… [+3412 chars]",,en,'Kate Middleton'
https://www.newsweek.com/fbi-informant-sentencing-hunter-biden-ukraine-claim-2011813,https://www.newsweek.com/fbi-informant-sentencing-hunter-biden-ukraine-claim-2011813,0,www.newsweek.com,Ex-FBI Informant Faces Sentencing for False Biden Bribery Claim,Alexander Smirnov lied to the FBI about Hunter Biden's relations with Ukraine energy company Burisma.,https://d.newsweek.com/en/full/2559797/fbi-informant-lying-hunter-biden-charges.jpg,2025-01-08T18:18:17Z,,A former FBI informant whose fabricated bribery allegations against President Joe Biden and his son Hunter fueled Republican impeachment efforts is due for sentencing Wednesday in Los Angeles federal… [+6451 chars],,en,'David Weiss'
http://www.thehollywoodgossip.com/2025/01/scarlett-johansson-pregnant/,http://www.thehollywoodgossip.com/2025/01/scarlett-johansson-pregnant/,0,www.thehollywoodgossip.com,Is Scarlett Johansson Pregnant? Get To Know Her 2 Kids & Find Out!,"Is Scarlett Johansson expecting another child?
Is Scarlett Johansson Pregnant? Get To Know Her 2 Kids & Find Out! was originally published on The Hollywood Gossip.",https://cdn.thehollywoodgossip.com/uploads/2025/01/GettyImages-1696552380-scaled.jpg,2025-01-08T19:04:42Z,,"Scarlett Johansson is much more than a Tony-winning and Academy Award-nominated actress. She’s also a loving mom to two beautiful children. 
Scarlett is beloved for her performance as Black Widow in… [+4209 chars]",,en,'David Weiss'
https://www.voanews.com/a/ex-fbi-informant-who-made-up-claims-about-bidens-sentenced-to-6-years-/7930576.html,https://www.voanews.com/a/ex-fbi-informant-who-made-up-claims-about-bidens-sentenced-to-6-years-/7930576.html,0,www.voanews.com,Ex-FBI informant who made up claims about Bidens sentenced to 6 years,"WASHINGTON — A former FBI informant who admitted lying about U.S. President Joe Biden and son Hunter Biden’s interactions with a Ukrainian energy company was sentenced to six years in prison Wednesday, court records showed. 


Alexander Smirnov pleaded guilty…",https://gdb.voanews.com/480C99D9-210B-4F4E-9D91-9C6FAE2AD201.jpg,2025-01-09T03:10:14Z,,"WASHINGTON  A former FBI informant who admitted lying about U.S. President Joe Biden and son Hunter Bidens interactions with a Ukrainian energy company was sentenced to six years in prison Wednesday,… [+1862 chars]",,en,'Hunter Biden'
https://www.msnbc.com/rachel-maddow-show/maddowblog/key-republican-source-lied-fbi-bidens-receives-prison-sentence-rcna186973,https://www.msnbc.com/rachel-maddow-show/maddowblog/key-republican-source-lied-fbi-bidens-receives-prison-sentence-rcna186973,0,www.msnbc.com,Key Republican source who lied to the FBI about the Bidens receives prison sentence,"Alexander Smirnov may not be a household name, but his prison sentence represents a stunning fiasco for some prominent Republicans in Congress.","https://media-cldnry.s-nbcnews.com/image/upload/t_nbcnews-fp-1200-630,f_auto,q_auto:best/rockcms/2024-12/241202-joe-hunter-biden-mn-0930-ec958b.jpg",2025-01-09T15:27:46Z,,"The just-completed 118th Congress was an embarrassment for a great many reasons, including the fact that the House Republican majority formally launched an impeachment inquiry against President Joe B… [+3384 chars]",,en,'Alexander Smirnov'
https://themorningnews.org/p/thursday-headlines-we-love-la,https://themorningnews.org/p/thursday-headlines-we-love-la,0,themorningnews.org,Thursday headlines: We love LA,"California Governor Gavin Newsom says ""there's no fire season—it's fire year."" / The Los Angeles TimesA climate reporter in Pacific Palisades relates what it was like to lose her home. Similar: watching your home burn on a Ring camera. / New York Magazine, Cu…",https://themorningnews.org/images/tmn-logo-share.png,2025-01-09T16:23:00Z,,"In an unwritten, unannounced policy change, Louisiana's Dept. of Health is forbidding employees from promoting Covid, flu, or mpox vaccines. / NPR
Photos of daily life for the Palestinian people—""be… [+2219 chars]",,en,'David Weiss'
https://nypost.com/2025/01/09/us-news/special-counsel-david-weiss-expected-to-release-final-hunter-biden-report-as-soon-as-next-week/,https://nypost.com/2025/01/09/us-news/special-counsel-david-weiss-expected-to-release-final-hunter-biden-report-as-soon-as-next-week/,0,nypost.com,Special Counsel David Weiss expected to release final Hunter Biden report as soon as next week,The special counsel is required to transmit any final report to the attorney general.,https://nypost.com/wp-content/uploads/sites/2/2025/01/newspress-collage-iqr0x9skz-1736470216369.jpg?quality=75&strip=all&1736452283&w=1024,2025-01-10T00:53:17Z,,"Special Counsel David Weiss is expected to release his final report on his years-long investigation into Hunter Biden as soon as next week, Fox News has learned.
Hunter Biden was found guilty of thr… [+2655 chars]",,en,'David Weiss'
