index,url,valid,domain,title,description,image,published,archive,content,quote,language,keyword
https://radaronline.com/p/tucker-carlson-beg-donald-trump-get-to-bottom-ufo-mysteries-america/,https://radaronline.com/p/tucker-carlson-beg-donald-trump-get-to-bottom-ufo-mysteries-america/,0,radaronline.com,Alien Nut Tucker Carlson 'Set to Beg Donald Trump to Let Him Get to Bottom of America's UFO Mysteries',"Tucker Carlson, dubbed an alien nut, is said to seek Trump's help to uncover America's UFO mysteries.",https://media.radaronline.com/brand-img/FcKl2hkLH/1200x628/tucker-carlson-set-to-beg-donald-trump-1735644136968.jpg,2025-01-02T12:00:00Z,,"""It's a hot topic that merits scrutiny, and now there's a new administration coming in that may be more open and start sharing some UFO intel."" 
Carlson's pal, SpaceX founder Elon Musk, said UFO sig… [+320 chars]",,en,'Tucker Carlson'
https://www.mediaite.com/politics/giant-shtshow-billy-bush-tells-tucker-carlson-he-had-no-recollection-of-trumps-infamous-grab-her-by-the-line-until-hearing-years-later/,https://www.mediaite.com/politics/giant-shtshow-billy-bush-tells-tucker-carlson-he-had-no-recollection-of-trumps-infamous-grab-her-by-the-line-until-hearing-years-later/,0,www.mediaite.com,‘Giant Sh*tshow!’ Billy Bush Tells Tucker Carlson He Had ‘No Recollection’ of Trump’s Infamous ‘Grab Her By the…’ Line Until Hearing Years Later,"Billy Bush opened up to Tucker Carlson about the infamous tape featuring President-elect Donald Trump that got Bush fired.
The post ‘Giant Sh*tshow!’ Billy Bush Tells Tucker Carlson He Had ‘No Recollection’ of Trump’s Infamous ‘Grab Her By the…’ Line Until He…",https://www.mediaite.com/wp-content/uploads/2025/01/billy-bush-tucker-carlson-access-hollywood-tape.jpg,2025-01-07T14:51:45Z,,"Screenshot via Tucker Carlson Network
Former Access Hollywood correspondent and Today co-host Billy Bush opened up to Tucker Carlson about the infamous tape featuring President-elect Donald Trump th… [+3236 chars]",,en,'Tucker Carlson'
