index,url,valid,domain,title,description,image,published,archive,content,quote,language,keyword
https://www.justjared.com/2024/05/09/smallest-man-who-ever-lived-lyrics-who-is-taylor-swifts-song-about-an-ex-even-responded/,https://www.justjared.com/2024/05/09/smallest-man-who-ever-lived-lyrics-who-is-taylor-swifts-song-about-an-ex-even-responded/,0,www.justjared.com,'Smallest Man Who Ever Lived' Lyrics: Who Is Taylor Swift's Song About? An Ex Even Responded!,"“The Smallest Man Who Ever Lived” is one of the most-talked about songs from The Tortured Poets Department and Taylor Swift has added the track to the Eras Tour setlist. While the song starts off slow and quiet, it picks up midway through with one of Taylor‘s…",https://cdn01.justjared.com/wp-content/uploads/headlines/2024/05/smallest-lyrics.jpg,2024-05-10T01:03:39Z,,"“The Smallest Man Who Ever Lived” is one of the most-talked about songs from The Tortured Poets Department and Taylor Swift has added the track to the Eras Tour setlist.
While the song starts off sl… [+729 chars]",,en,'Matty Healy'
https://www.thepinknews.com/2024/05/10/taylor-swift-eras-tour-setlist/,https://www.thepinknews.com/2024/05/10/taylor-swift-eras-tour-setlist/,0,www.thepinknews.com,Taylor Swift adds seven new songs to The Eras Tour setlist as she kicks off European dates,"Taylor Swift has kicked off the European leg of The Eras Tour in France, and her setlist has had a very The Tortured Poets Department-style makeover. In the wake of her record-breaking new album, the singer has added seven new songs to her critically-acclaime…",https://www.thepinknews.com/wp-content/uploads/2024/05/Untitled-design-2024-05-10T170315.253.png,2024-05-10T07:00:44Z,,"Taylor Swift has kicked off the European leg of The Eras Tour in France, and her setlist has had a very The Tortured Poets Department-style makeover.
In the wake of her record-breaking new album, th… [+2598 chars]",,en,'Taylor Swift'
http://www.billboard.com/music/chart-beat/taylor-swift-dua-lipa-sabrina-carpenter-australia-aria-charts-1235679894/,http://www.billboard.com/music/chart-beat/taylor-swift-dua-lipa-sabrina-carpenter-australia-aria-charts-1235679894/,0,www.billboard.com,"ARIA Charts: Taylor Swift, Sabrina Carpenter Rule","Sabrina Carpenter has her first leader on the ARIA Singles Chart with ""Espresso.""",https://www.billboard.com/wp-content/uploads/2024/05/Taylor-Swift-_-The-Eras-Tour-Paris-France-may-9-2024-billboard-1548.jpg?w=1024,2024-05-10T08:29:55Z,,"Taylor Swift makes it three straight, as The Tortured Poets Department (via Universal) holds on for another week at No. 1 in Australia, while Sabrina Carpenter nabs her first leader on the singles su… [+1974 chars]",,en,'Sabrina Carpenter'
https://biztoc.com/x/d827e45d79e309b6,https://biztoc.com/x/d827e45d79e309b6,0,biztoc.com,Taylor Swift Holds Off Dua Lipa In Australia’s Albums Chart Race,"Taylor Swift makes it three straight, as The Tortured Poets Department (via Universal) holds on for another week at No. 1 in Australia, while Sabrina Carpenter nabs her first leader on the singles survey with “Espresso” (Island/Universal). Tortured Poets lead…",https://c.biztoc.com/p/d827e45d79e309b6/s.webp,2024-05-10T08:38:08Z,,"Taylor Swift makes it three straight, as The Tortured Poets Department (via Universal) holds on for another week at No. 1 in Australia, while Sabrina Carpenter nabs her first leader on the singles su… [+305 chars]",,en,'Taylor Swift'
https://www.cosmopolitan.com/entertainment/celebs/a60754643/is-but-daddy-i-love-him-actually-about-travis-kelce/,https://www.cosmopolitan.com/entertainment/celebs/a60754643/is-but-daddy-i-love-him-actually-about-travis-kelce/,0,www.cosmopolitan.com,"Fans Think Taylor Swift Confirmed the Last Verse of ""But Daddy I Love Him"" Is About Travis Kelce","Taylor Swift seemingly confirmed a fan theory that the last verse of ""But Daddy I Love Him"" is actually about Travis Kelce, not Matty Healy.","https://hips.hearstapps.com/hmg-prod/images/taylor-swift-performs-onstage-during-taylor-swift-the-news-photo-1715341985.jpg?crop=1.00xw:0.372xh;0,0.0982xh&resize=1200:*",2024-05-10T12:03:00Z,,"Taylor Swift has switched up on the Eras Tour! Multiple songs have been chopped (rip ""The Archer"") to make room for Tay's new The Tortured Poets Department set, which is best described as iconic. Or,… [+1139 chars]",,en,'Matty Healy'
https://www.etonline.com/see-taylor-swifts-new-eras-tour-costume-easter-eggs-after-the-tortured-poets-department-release,https://www.etonline.com/see-taylor-swifts-new-eras-tour-costume-easter-eggs-after-the-tortured-poets-department-release,0,www.etonline.com,See Taylor Swift's New Eras Tour Costume Easter Eggs,Swifties wasted no time analyzing clues and potential hidden meanings behind Taylor Swift's new wardrobe.,https://www.etonline.com/sites/default/files/styles/1280x720/public/images/2024-05/1280_taylor_swift_eras_dress.jpg?h=c673cd1c,2024-05-10T13:03:30Z,,"Taylor Swift really shook things up with the debut of her revamped Eras Tour on Thursday. 
The pop star hit the stage at the Paris La Défense Arena for the first of four nights in Paris, France, kic… [+4802 chars]",,en,'Sabrina Carpenter'
https://www.marca.com/en/nfl/2024/05/10/663e1c7f22601d52378b4621.html,https://www.marca.com/en/nfl/2024/05/10/663e1c7f22601d52378b4621.html,0,www.marca.com,Rob Gronkowski broke a glass and injured a girl during Tom Brady's roast,"The Netflix special, &quot;The Roast of Tom Brady,&quot; hosted by Kevin Hart, turned out to be a resounding success, filled with laughter and memorable moments. 
The event, lastin",https://phantom-marca.unidadeditorial.es/ca70f8e6f2d8c5bfbe8b8d6f39a4ae24/resize/1200/f/webp/assets/multimedia/imagenes/2024/05/10/17153464256194.png,2024-05-10T13:13:07Z,,"The Netflix special, ""The Roast of Tom Brady,"" hosted by Kevin Hart, turned out to be a resounding success, filled with laughter and memorable moments. 
The event, lasting over three hours, was atte… [+1324 chars]",,en,'Kevin Hart'
https://www.cbssports.com/nfl/news/tom-brady-was-given-this-surprise-40000-gift-from-kevin-hart-after-getting-roasted-on-netflix/,https://www.cbssports.com/nfl/news/tom-brady-was-given-this-surprise-40000-gift-from-kevin-hart-after-getting-roasted-on-netflix/,0,www.cbssports.com,"Tom Brady was given this surprise $40,000 gift from Kevin Hart after getting roasted on Netflix",The quarterback's roast ended with Brady getting his special gift,https://sportshub.cbsistatic.com/i/r/2024/05/10/c7b47b04-9965-4aad-913f-7e87a8cb72aa/thumbnail/1200x675/dd01ce04c5ba5bc24207b91609e5b390/tom-brady.jpg,2024-05-10T16:26:18Z,,"After getting roasted for three straight hours on Sunday, Tom Brady's night actually ended on a high note, and that's because he was given a special $40,000 gift at the end of his roast. 
As the sho… [+1976 chars]",,en,'Kevin Hart'
https://nypost.com/2024/05/10/sports/nikki-glaser-describes-uncomfortable-tom-brady-encounter-as-he-bolted-roast/,https://nypost.com/2024/05/10/sports/nikki-glaser-describes-uncomfortable-tom-brady-encounter-as-he-bolted-roast/,0,nypost.com,Nikki Glaser describes uncomfortable Tom Brady encounter as he bolted roast,Comedian Nikki Glaser explained why she thinks Tom Brady skipped afterparty following his Netflix roast last Sunday,https://nypost.com/wp-content/uploads/sites/2/2024/05/newspress-collage-zeop2sbh3-1715355967768.jpg?quality=75&strip=all&1715341637&w=1024,2024-05-10T16:37:18Z,,"Nikki Glaser said Tom Brady didn’t attend the afterparty following his Netflix roast because he was probably upset about some of the jokes about him losing his family. 
Glaser, who was a part of the… [+3968 chars]",,en,'Tom Brady'
https://www.usmagazine.com/celebrity-news/news/comedians-at-tom-brady-roast-told-not-to-joke-about-robert-kraft/#article,https://www.usmagazine.com/celebrity-news/news/comedians-at-tom-brady-roast-told-not-to-joke-about-robert-kraft/#article,0,www.usmagazine.com,Comedians at Tom Brady's Roast Were Told Not to Make Robert Kraft Jokes,"Tom Brady’s dirty laundry was hung out to dry for the world to see during his bawdy Netflix roast — but not everything was fair game. Brady, 46, was a good sport when jokes were made about his appearance, his playing career and his relationships with exes Bri…",https://www.usmagazine.com/wp-content/uploads/2024/05/Comedians-at-Tom-Brady-Roast-Were-Told-Not-to-Joke-About-Robert-Kraft-But-Gisele-Jokes-Were-Fine-Promo.jpg?crop=0px%2C0px%2C2000px%2C1051px&resize=1200%2C630&quality=86&strip=all,2024-05-10T16:58:07Z,,"Sign InUp with your social account
Continue with Google
Continue with Facebook
Continue with Amazon
Continue with AppleWe won't post to any of your accounts
Get back to the 
Tom Brady’s dirty l… [+2738 chars]",,en,'Tom Brady'
https://www.cbssports.com/nfl/news/bill-belichick-set-for-regular-role-on-manningcast-after-broadcast-debut-during-2024-nfl-draft/,https://www.cbssports.com/nfl/news/bill-belichick-set-for-regular-role-on-manningcast-after-broadcast-debut-during-2024-nfl-draft/,0,www.cbssports.com,Bill Belichick set for regular role on 'Manningcast' after broadcast debut during 2024 NFL Draft,The longtime coach is on track for a deep dive into media,https://sportshub.cbsistatic.com/i/r/2020/11/18/481c8ee8-cee9-4df2-a812-535fb9f37ffd/thumbnail/1200x675/6e39e77a9fe3e60b5e7605264ef073af/belichick-2.png,2024-05-10T18:30:33Z,,"Bill Belichick won't be coaching in 2024, but the longtime New England Patriots leader will be front and center throughout the upcoming season. After appearing on ""The Pat McAfee Show"" as an analyst … [+1390 chars]",,en,'Bill Belichick'
https://www.elitedaily.com/entertainment/taylor-swift-tortured-poets-choreo-travis-kelce-matty-healy-references,https://www.elitedaily.com/entertainment/taylor-swift-tortured-poets-choreo-travis-kelce-matty-healy-references,0,www.elitedaily.com,Taylor Swift's 'Tortured Poets' Choreo Has Travis Kelce & Matty Healy Nods,"As Taylor Swift debuted her new 'Tortured Poets Department' section of the Eras Tour, fans noticed some suspicious dance moves that seemed to be references.",https://imgix.bustle.com/uploads/image/2024/5/10/e0027d3f-9599-4066-a150-a539370a81a2-elite-daily_socialshare-template_2023-79001.jpeg?w=1200&h=630&fit=crop&crop=faces&fm=jpg,2024-05-10T19:24:48Z,,"Taylor Swift didnt just hide telling Easter eggs in her lyrics, it looks like shes also spilling about who her new songs are about in referential new dance moves. On May 9, Swift added her latest alb… [+1916 chars]",,en,'Travis Kelce'
https://pagesix.com/2024/05/10/entertainment/fans-spot-subtle-matty-healy-reference-in-taylor-swifts-new-eras-tour-setlist/,https://pagesix.com/2024/05/10/entertainment/fans-spot-subtle-matty-healy-reference-in-taylor-swifts-new-eras-tour-setlist/,0,pagesix.com,Fans spot subtle Matty Healy reference in Taylor Swift’s Eras Tour performance of scathing ‘TTPD’ song,"Swift released ""The Tortured Poets Department"" last month and fans believe several of the songs were inspired by her romance with The 1975 frontman.",https://pagesix.com/wp-content/uploads/sites/3/2024/05/81612189.jpg?quality=75&strip=all&w=1024,2024-05-10T21:42:29Z,,"Fans believe Taylor Swift all but confirmed Matty Healy is, in fact, “The Smallest Man Who Ever Lived.”
On Thursday, Swift kicked off the European leg of her Eras Tour in Paris, introducing an entir… [+3464 chars]",,en,'Matty Healy'
https://www.bostonglobe.com/2024/05/10/metro/bill-belichick-buys-house-nantucket/,https://www.bostonglobe.com/2024/05/10/metro/bill-belichick-buys-house-nantucket/,0,www.bostonglobe.com,Former Patriots coach Bill Belichick buys (another) home on Nantucket,"The former New England Patriots coach Bill Belichick recently closed on a $4.8 million home on Fair Street, according to the Nantucket Current.",https://bostonglobe-prod.cdn.arcpublishing.com/resizer/thzWPQmDbyPounHFrGD9qADKLjg=/506x0/cloudfront-us-east-1.images.arcpublishing.com/bostonglobe/GUPAFX6Y52O5RV3C3PVJHDVA7A.jpg,2024-05-10T21:43:23Z,,"According to town assessor records, the 2,854-square-foot single-family home was built in 1983.
Belichick typically spends the offseason at his compound in Sconset, on the eastern shore of the islan… [+2412 chars]",,en,'Bill Belichick'
https://bleedingcool.com/tv/saturday-night-live-season-50-being-honored-with-weekend-celebration/,https://bleedingcool.com/tv/saturday-night-live-season-50-being-honored-with-weekend-celebration/,0,bleedingcool.com,Saturday Night Live Season 50 Being Honored with Weekend Celebration,"For Season 49, it's Maya Rudolph & Vampire Weekend this weekend, Jake Gyllenhaal & Sabrina Carpenter next weekend – and then, that's a wrap! But this summer will be a bit different for NBC's Saturday Night Live – it's the summer leading into SNL's jaw-droppin…",https://bleedingcool.com/wp-content/uploads/2024/05/SNL49Mobile-2000x1125.jpg,2024-05-10T21:53:09Z,,"Posted in: NBC, Peacock, Preview, TV | Tagged: nbc, peacock, saturday night live, snl
NBC will honor Saturday Night Live Season 50 with a weekend celebration that includes a live primetime special o… [+2817 chars]",,en,'Sabrina Carpenter'
https://consent.yahoo.com/v2/collectConsent?sessionId=1_cc-session_a58e2e56-32d1-41f5-8fe5-13ee2a056a7e,https://consent.yahoo.com/v2/collectConsent?sessionId=1_cc-session_a58e2e56-32d1-41f5-8fe5-13ee2a056a7e,0,consent.yahoo.com,Peyton Manning says Bill Belichick will appear on every ManningCast this season,Bill Belichick will make more than frequent appearances on the ManningCast.,,2024-05-10T23:42:58Z,,"If you click 'Accept all', we and our partners, including 238 who are part of the IAB Transparency &amp; Consent Framework, will also store and/or access information on a device (in other words, use … [+678 chars]",,en,'Bill Belichick'
https://www.nbcsports.com/nfl/profootballtalk/rumor-mill/news/peyton-manning-says-bill-belichick-will-appear-on-every-manningcast-this-season,https://www.nbcsports.com/nfl/profootballtalk/rumor-mill/news/peyton-manning-says-bill-belichick-will-appear-on-every-manningcast-this-season,0,www.nbcsports.com,Peyton Manning says Bill Belichick will appear on every ManningCast this season,Bill Belichick will make more than frequent appearances on the ManningCast.,https://nbcsports.brightspotcdn.com/dims4/default/072894a/2147483647/strip/true/crop/4976x2799+0+260/resize/1440x810!/quality/90/?url=https%3A%2F%2Fnbc-sports-production-nbc-sports.s3.us-east-1.amazonaws.com%2Fbrightspot%2F6a%2F7d%2Fac5589084d15890e1856340750db%2Fhttps-delivery-gettyimages.com%2Fdownloads%2F506636636,2024-05-10T23:42:58Z,,"Bill Belichick will make more than frequent appearances on the ManningCast. The former Patriots coach will be on all of them.
Via BarrettSportsMedia.com, Manning said in a recent appearance on Pat M… [+1000 chars]",,en,'Bill Belichick'
https://bleacherreport.com/articles/10120604-peyton-manning-bill-belichick-to-be-permanent-guest-on-espns-manningcast-in-2024,https://bleacherreport.com/articles/10120604-peyton-manning-bill-belichick-to-be-permanent-guest-on-espns-manningcast-in-2024,0,bleacherreport.com,Peyton Manning: Bill Belichick to Be Permanent Guest on ESPN's 'ManningCast' in 2024,"Bill Belichick won't be coaching during the 2024 season, but he will be dropping knowledge throughout the year. During an appearance on The Pat McAfee Show on…","https://media.bleacherreport.com/image/upload/c_fill,g_faces,w_3800,h_2000,q_95/v1715388177/egj4q6vuzel2smrx2d4z.jpg",2024-05-11T00:50:16Z,,"JOSEPH PREZIOSO/AFP via Getty Images
Bill Belichick won't be coaching during the 2024 season, but he will be dropping knowledge throughout the year.
During an appearance on The Pat McAfee Show on F… [+418 chars]",,en,'Pat McAfee'
https://www.bostonglobe.com/2024/05/10/sports/belichick-manningcast/,https://www.bostonglobe.com/2024/05/10/sports/belichick-manningcast/,0,www.bostonglobe.com,Bill Belichick will be a new member of the ManningCast show during the 2024 NFL season,"After not being able to land a head coaching job this season, Belichick has become a media sensation this offseason with his wits and smarts.",https://bostonglobe-prod.cdn.arcpublishing.com/resizer/-sZp6add-7I-V76ba33kIX1k8bk=/506x0/cloudfront-us-east-1.images.arcpublishing.com/bostonglobe/2O6PZZW6DJDRVANAA6FED4JPIM.jpg,2024-05-11T01:10:55Z,,"Manning said Belichick will be utilized early in the game, probably in the first quarter, to help give fans a behind-the-scenes look at the Xs and Os.
Belichick drew rave reviews during his appearan… [+486 chars]",,en,'Bill Belichick'
https://www.marca.com/en/nfl/2024/05/11/663ec384e2704e548e8b45b6.html,https://www.marca.com/en/nfl/2024/05/11/663ec384e2704e548e8b45b6.html,0,www.marca.com,Bill Belichick will appear on every ManningCast this season,"Peyton Manning made a surprise appearance at Tom Brady&apos;s roast event on Sunday night, to the delight of many in a show that included Bill Belichick.
In his appearance on the p",https://phantom-marca.unidadeditorial.es/ad68c06ecfc2b4ff896ca3ae21fd0fd3/resize/1200/f/webp/assets/multimedia/imagenes/2024/05/11/17153892983029.jpg,2024-05-11T01:18:50Z,,"Peyton Manning made a surprise appearance at Tom Brady's roast event on Sunday night, to the delight of many in a show that included Bill Belichick.
In his appearance on the podium, he simply reveal… [+1514 chars]",,en,'Bill Belichick'
https://www.startribune.com/trump-trial-turns-to-sex-bank-accounts-and-power-highlights-from-the-third-week-of-testimony/600365195/,https://www.startribune.com/trump-trial-turns-to-sex-bank-accounts-and-power-highlights-from-the-third-week-of-testimony/600365195/,0,www.startribune.com,"Trump trial turns to sex, bank accounts and power: Highlights from the third week of testimony",The alleged sexual encounter at the center of Donald Trump's criminal hush money trial got a graphic airing in court this past week as porn actor Stormy Daniels shared her account before a rapt jury.,https://www.startribune.com/static/img/branding/logos/strib-social-card.png?d=1715282644,2024-05-11T04:07:00Z,,WASHINGTON The alleged sexual encounter at the center of Donald Trump's criminal hush money trial got a graphic airing in court this past week as porn actor Stormy Daniels shared her account before a… [+7058 chars],,en,'Bill Belichick'
https://abcnews.go.com/US/wireStory/trump-trial-turns-sex-bank-accounts-power-highlights-110128188,https://abcnews.go.com/US/wireStory/trump-trial-turns-sex-bank-accounts-power-highlights-110128188,0,abcnews.go.com,"Trump trial turns to sex, bank accounts and power: Highlights from the third week of testimony",The alleged sexual encounter at the center of Donald Trump’s criminal hush money trial got a graphic airing in court this past week as porn actor Stormy Daniels shared her account before a rapt jury,https://i.abcnewsfe.com/a/9183c2bf-aaec-4296-8a3b-945edf7e49e3/wirestory_c69d54c51e2fccbbc0b19e2220222b0e_16x9.jpg?w=1600,2024-05-11T04:22:19Z,,WASHINGTON -- The alleged sexual encounter at the center of Donald Trump's criminal hush money trial got a graphic airing in court this past week as porn actor Stormy Daniels shared her account befor… [+6837 chars],,en,'Stormy Daniels'
https://economictimes.indiatimes.com/news/international/world-news/trump-trial-turns-to-sex-bank-accounts-and-power-highlights-from-the-third-week-of-testimony/articleshow/110026951.cms,https://economictimes.indiatimes.com/news/international/world-news/trump-trial-turns-to-sex-bank-accounts-and-power-highlights-from-the-third-week-of-testimony/articleshow/110026951.cms,0,economictimes.indiatimes.com,"Trump trial turns to sex, bank accounts and power: Highlights from the third week of testimony","Porn actor Stormy Daniels detailed her alleged 2006 sexual encounter with former US President Donald Trump in court. Trump's defence team challenged Daniels' credibility, questioning her motives and profession. Prosecutors presented evidence linking Trump dir…","https://img.etimg.com/thumb/msid-110027106,width-1200,height-630,imgsize-31870,overlay-economictimes/photo.jpg",2024-05-11T04:36:13Z,,The alleged sexual encounter at the centre of Donald Trump's criminal hush money trial got a graphic airing in court this past week as porn actor Stormy Daniels shared her account before a rapt jury.… [+7089 chars],,en,'Stormy Daniels'
https://freerepublic.com/focus/f-religion/4237079/posts,https://freerepublic.com/focus/f-religion/4237079/posts,0,freerepublic.com,"Disturbing New ‘Christian’ Conference Features Voddie Baucham, John Cooper (of Skillet) and…. Mormon Glenn Beck!!?","A highly disturbing new conference has emerged, featuring Jason Whitlock, John Rich, Voddie Baucham, Skillet’s John Cooper and Mormon Glenn Beck????! According to the promo material, Fearless Army: Roll Call 2.0 is a “gathering, celebration, and encouragement…",,2024-05-11T04:44:23Z,,"Skip to comments.
Disturbing New Christian Conference Features Voddie Baucham, John Cooper (of Skillet) and. Mormon Glenn Beck!!?Protestia ^
 | May 10, 2024
 | staff
Posted on 05/10/2024 9:44:23 … [+4513 chars]",,en,'Jason Whitlock'
https://www.foxnews.com/entertainment/tom-bradys-roast-burns-kim-kardashian-ben-affleck-aftermath-brutal-netflix-special,https://www.foxnews.com/entertainment/tom-bradys-roast-burns-kim-kardashian-ben-affleck-aftermath-brutal-netflix-special,0,www.foxnews.com,"Tom Brady's roast burns Kim Kardashian, Ben Affleck in aftermath of brutal Netflix special",Celebrities like Kim Kardashian and Ben Affleck did not walk away unscathed from the Tom Brady roast. We take a look at all the stars that caught fire during Brady's big night.,https://static.foxnews.com/foxnews.com/content/uploads/2024/05/tom-brady-roast-.jpg,2024-05-11T08:30:23Z,,"Join Fox News for access to this content
Plus special access to select articles and other premium content with your account - free of charge.
Please enter a valid email address.
By entering your e… [+5576 chars]",,en,'Tom Brady'
https://ftw.usatoday.com/2024/05/bill-belichick-manningcast-peyton-manning-eli,https://ftw.usatoday.com/2024/05/bill-belichick-manningcast-peyton-manning-eli,0,ftw.usatoday.com,"Peyton Manning says Bill Belichick will be a permanent weekly ManningCast guest, which should actually be fun",This is actually a great idea.,https://ftw.usatoday.com/wp-content/uploads/sites/90/2016/01/gty_506637284_79128938.jpg?w=1024&h=576&crop=1,2024-05-11T13:15:37Z,,"Bill Belichick on TV is not Bill Belichick in press conferences, as we saw at the recent roast of Tom Brady on Netflix.
So the idea of him being a weekly fixture on Peyton and Eli Manning’s weekly a… [+581 chars]",,en,'Bill Belichick'
https://sports.yahoo.com/bill-belichick-will-appear-on-every-espn-manningcast-this-season-says-peyton-manning-142052524.html,https://sports.yahoo.com/bill-belichick-will-appear-on-every-espn-manningcast-this-season-says-peyton-manning-142052524.html,0,sports.yahoo.com,"Bill Belichick will appear on every ESPN 'ManningCast' this season, says Peyton Manning","Bill Belichick will appear on every episode of ESPN's ""ManningCast"" this season, according to Peyton Manning, The legendary coach is expected to join the show during the first quarter.",https://s.yimg.com/ny/api/res/1.2/gv3p0JkDSpsM2MIg3Swukw--/YXBwaWQ9aGlnaGxhbmRlcjt3PTEyMDA7aD04MDA-/https://s.yimg.com/os/creatr-uploaded-images/2024-01/ee5f93b0-c382-11ee-abbf-b86104c61318,2024-05-11T14:20:52Z,,"Fans wondering how often Bill Belichick will appear on ESPN's ""ManningCast"" don't have to guess or wait for each week's schedule of guests. The six-time Super Bowl winner will be on every episode of … [+1647 chars]",,en,'Bill Belichick'
https://www.bostonglobe.com/2024/05/11/sports/patriots-nfl-draft-analysis/,https://www.bostonglobe.com/2024/05/11/sports/patriots-nfl-draft-analysis/,0,www.bostonglobe.com,"Beyond Drake Maye, what should we make of the Patriots’ first draft post-Bill Belichick?",Bill Belichick became infamous for reaching for players. Eliot Wolf’s first draft wasn’t too different from those of his predecessor.,https://bostonglobe-prod.cdn.arcpublishing.com/resizer/t2D1y61NEiFph1gHIPvgu3jb5u8=/506x0/cloudfront-us-east-1.images.arcpublishing.com/bostonglobe/AQJYXXRGK5FDSD7CO6TDWXNTEE.jpg,2024-05-11T15:03:33Z,,"Except Wolfs first draft wasnt too different from those of his predecessor. The Patriots second- and third-round picks, receiver JaLynn Polk and offensive tackle Caedan Wallace, were considered by so… [+12984 chars]",,en,'Bill Belichick'
https://www.forbes.com/sites/entertainment/article/francis-ford-coppola-movies/,https://www.forbes.com/sites/entertainment/article/francis-ford-coppola-movies/,0,www.forbes.com,"Every Francis Ford Coppola Movie, Ranked And In Release Order","Explore the cinematic journey of Francis Ford Coppola through his acclaimed films, arranged by release date and ranking. See his genius across diverse genres.",https://imageio.forbes.com/specials-images/imageserve/662bb774cd1b9fafca189b05/0x0.jpg?format=jpg&height=900&width=1600&fit=bounds,2024-05-11T16:00:00Z,,"Francis Ford Coppola attends the ""The Godfather"" 50th Anniversary Celebration at Paramount Theatre ... [+] on February 22, 2022 in Los Angeles.
WireImage
In its story about Francis Ford Coppolas st… [+25085 chars]",,en,'Francis Ford Coppola'
