index,url,valid,domain,title,description,image,published,archive,content,quote,language,keyword
https://www.avclub.com/francis-ford-coppola-megalopolis-bad-behavior-1851478523,https://www.avclub.com/francis-ford-coppola-megalopolis-bad-behavior-1851478523,0,www.avclub.com,There are new allegations of Francis Ford Coppola's bad behavior on the Megalopolis set,"Francis Ford Coppola isn’t exactly known for being the most cuddly and nurturing guy, especially if those traits would come at the expense of his art. The set of Apocalypse Now was famously so chaotic that it led to a near-fatal heart attack for its star and …","https://i.kinja-img.com/image/upload/c_fill,h_675,pg_1,q_80,w_1200/6338f21a8f9c11355d0fcf0534ca5f56.jpg",2024-05-15T14:53:00Z,,"Francis Ford Coppola isnt exactly known for being the most cuddly and nurturing guy, especially if those traits would come at the expense of his art. The set of Apocalypse Nowwas famously so chaotic … [+3740 chars]",,en,'Francis Ford Coppola'
https://variety.com/2024/tv/news/conan-obrien-must-go-renewed-season-2-max-1236003905/,https://variety.com/2024/tv/news/conan-obrien-must-go-renewed-season-2-max-1236003905/,0,variety.com,‘Conan O’Brien Must Go’ Renewed for Season 2 at Max,The travel series “Conan O’Brien Must Go” has been renewed for Season 2 at Max. The announcement was made as part of the Warner Bros. Discovery upfront presentation to advertisers in New York on Wednesday. The second season of the series will consist of six e…,https://variety.com/wp-content/uploads/2024/05/Conan-OBrien-Must-Go-e1715734842197.jpg?w=573&h=323&crop=1,2024-05-15T15:25:00Z,,"The travel series “Conan O’Brien Must Go” has been renewed for Season 2 at Max. 
The announcement was made as part of the Warner Bros. Discovery upfront presentation to advertisers in New York on We… [+1394 chars]",,en,'nan nan'
http://deadline.com/2024/05/conan-obrien-must-go-renewed-season-2-max-1235916752/,http://deadline.com/2024/05/conan-obrien-must-go-renewed-season-2-max-1235916752/,0,deadline.com,‘Conan O’Brien Must Go’ Renewed For Season 2 At Max,Conan O’Brien is going to trouble six more countries. The former host of the The Tonight Show has had his travelogue – Conan O’Brien Must Go – renewed for a second season. The news was revealed at the Warner Bros. Discovery Upfront. O’Brien was at the upfront…,https://deadline.com/wp-content/uploads/2024/05/conan-o-brien.jpg?w=980,2024-05-15T15:28:39Z,,"Conan O’Brien is going to trouble six more countries.
The former host of the The Tonight Show has had his travelogue – Conan O’Brien Must Go – renewed for a second season.
The news was revealed at … [+1046 chars]",,en,'nan nan'
https://www.bostonherald.com/2024/05/15/tom-brady-says-roast-affected-his-kids-wouldnt-do-it-again/,https://www.bostonherald.com/2024/05/15/tom-brady-says-roast-affected-his-kids-wouldnt-do-it-again/,0,www.bostonherald.com,"Tom Brady says roast affected his kids, ‘wouldn’t do it again","“I loved when the jokes were about me,” Brady said. “I didn’t like the way it affected my kids.”",https://www.bostonherald.com/wp-content/uploads/2024/05/GettyImages-2151621349.jpg?w=1024&h=683,2024-05-15T17:08:49Z,,"By EVAN ROSEN | erosen@nydailynews.com | New York Daily News
Tom Brady is sharing his true feelings about his Netflix roast earlier this month, admitting that some of the jokes shared during the eve… [+1910 chars]",,en,'Tom Brady'
https://kottke.org/24/05/the-trailer-for-francis-ford-coppolas-megalopolis,https://kottke.org/24/05/the-trailer-for-francis-ford-coppolas-megalopolis,0,kottke.org,The Trailer for Francis Ford Coppola’s Megalopolis,Francis Ford Coppola has been making Megalopolis since 1983 and has self funded it “in part by the sale of a significant p,https://i.ytimg.com/vi/RU1QyAYa60g/sddefault.jpg,2024-05-15T17:11:29Z,,Francis Ford Coppola has been making Megalopolis since 1983 and has self funded it “in part by the sale of a significant portion of the director’s wine empire”. But the trailer is finally here and it… [+2217 chars],,en,'Francis Ford Coppola'
https://biztoc.com/x/84903db52ff55233,https://biztoc.com/x/84903db52ff55233,0,biztoc.com,Francis Ford Coppola Accused of Trying to Kiss Extras on ‘Megalopolis’ Set,"As anticipation for the premiere of “Megalopolis,” Francis Ford Coppola’s first film in more than a decade, built to a fever pitch at Cannes, the director faced accusations Tuesday that he tried to kiss extras during a nightclub sequence. A report in The Guar…",https://c.biztoc.com/p/84903db52ff55233/s.webp,2024-05-15T17:26:07Z,,"As anticipation for the premiere of Megalopolis, Francis Ford Coppolas first film in more than a decade, built to a fever pitch at Cannes, the director faced accusations Tuesday that he tried to kiss… [+300 chars]",,en,'Francis Ford Coppola'
https://slashdot.org/firehose.pl?op=view&amp;id=173879499,https://slashdot.org/firehose.pl?op=view&amp;id=173879499,0,slashdot.org,Can Cannes Save ‘Megalopolis’? Francis Ford Coppola Prepares to Unveil His $120 Million Epic as Controversy Builds - Variety,Can Cannes Save ‘Megalopolis’? Francis Ford Coppola Prepares to Unveil His $120 Million Epic as Controversy BuildsVariety ‘Megalopolis’ Producer Addresses Report of Francis Ford Coppola Trying to Kiss Extras on Set: ‘I Was Never Aware of Any Complaints of Har…,,2024-05-15T17:34:29Z,,Sign up for the Slashdot newsletter! OR check out the new Slashdot job board to browse remote jobs or jobs in your areaDo you develop on GitHub? You can keep using GitHub but automatically sync your … [+268 chars],,en,'Francis Ford Coppola'
https://bleedingcool.com/tv/snl-midweek-yearbook-signing-pressure-too-much-for-jake-gyllenhaal/,https://bleedingcool.com/tv/snl-midweek-yearbook-signing-pressure-too-much-for-jake-gyllenhaal/,0,bleedingcool.com,SNL Midweek: Yearbook-Signing Pressure Too Much for Jake Gyllenhaal,"With NBC's Saturday Night Live wrapping up Season 49 this weekend with host Jake Gyllenhaal (Apple TV's Presumed Innocent) & musical guest Sabrina Carpenter, we've reached our final SNL Midweek Sketch for the season. So it's only fitting that SNL star Marcell…",https://bleedingcool.com/wp-content/uploads/2024/05/Jake-Gyllenhaal-Signs-Marcello-Hernandezs-SNL-Finale-Yearbook-0-16-screenshot-2000x1125.jpg,2024-05-15T17:43:08Z,,"Posted in: NBC, Peacock, Preview, streaming, TV, YouTube | Tagged: jake gyllenhaal, nbc, sabrina carpenter, saturday night live, snl
In the following midweek sketch: Jake Gyllenhaal deals with the p… [+2745 chars]",,en,'Sabrina Carpenter'
https://economictimes.indiatimes.com/news/international/us/did-francis-ford-coppola-kiss-extras-on-set-while-filming-megalopolis-this-is-what-executive-producer-said/articleshow/110156222.cms,https://economictimes.indiatimes.com/news/international/us/did-francis-ford-coppola-kiss-extras-on-set-while-filming-megalopolis-this-is-what-executive-producer-said/articleshow/110156222.cms,0,economictimes.indiatimes.com,Did Francis Ford Coppola kiss extras on set while filming 'Megalopolis'? This is what executive producer said,"Allegations have emerged around Francis Ford Coppola trying to kiss extras on set while producer Demetre defends him publicly, claiming he was not aware of any such complaints.","https://img.etimg.com/thumb/msid-110156346,width-1200,height-630,imgsize-85048,overlay-economictimes/photo.jpg",2024-05-15T17:50:49Z,,"(Catch all the US News, UK News, Canada News, International Breaking News Events, and Latest News Updates on The Economic Times.)
Download The Economic Times News App to get Daily International News… [+8 chars]",,en,'Francis Ford Coppola'
https://comicbookmovie.com/sci_fi/megalopolis-may-struggle-to-find-a-distributor-as-controversial-new-details-from-batshit-shoot-emerge-a210997,https://comicbookmovie.com/sci_fi/megalopolis-may-struggle-to-find-a-distributor-as-controversial-new-details-from-batshit-shoot-emerge-a210997,0,comicbookmovie.com,"MEGALOPOLIS May Struggle To Find A Distributor As Controversial New Details From ""Batshit"" Shoot Emerge","Has Francis Ford Coppola's (alleged) on-set behaviour hindered the chances of his sci-fi epic passion project, Megalopolis, finding a distributor?",https://comicbookmovie.com/images/articles/banners/210997.jpg,2024-05-15T18:20:49Z,,"Francis Ford Coppola will finally unveil Megalopolis at the Cannes Film Festival next week, but a new report outlining the legendary filmmaker's on-set antics could make the already daunting task of … [+3079 chars]",,en,'Francis Ford Coppola'
https://radaronline.com/p/francis-ford-coppola-megalopolis-old-school-behavior-kiss-extras-accused/,https://radaronline.com/p/francis-ford-coppola-megalopolis-old-school-behavior-kiss-extras-accused/,0,radaronline.com,'Old School' Behavior Around Women: Francis Ford Coppola Accused of Trying to Kiss Extras on 'Megalopolis' Set,Francis Ford Coppola has been accused of trying to kiss female extras on the set of his new movie 'Megalopolis.',https://media.radaronline.com/brand-img/c-okFbseL/1200x628/francis-ford-coppola-1715792599427.jpg,2024-05-15T18:30:00Z,,"Leaving Las Vegas director Mike Figgis, a longtime friend of Coppola's who was invited to document the making of the film in Atlanta, had a more positive take on the production.
""I have no idea wher… [+832 chars]",,en,'Francis Ford Coppola'
https://www.forbes.com/sites/conormurray/2024/05/15/francis-ford-coppolas-long-awaited-megalopolis-finally-premiering-at-cannes-after-absolute-madness-alleged-on-set-what-to-know/,https://www.forbes.com/sites/conormurray/2024/05/15/francis-ford-coppolas-long-awaited-megalopolis-finally-premiering-at-cannes-after-absolute-madness-alleged-on-set-what-to-know/,0,www.forbes.com,Francis Ford Coppola’s Long-Awaited ‘Megalopolis’ Finally Premiering At Cannes After ‘Absolute Madness’ Alleged On Set: What To Know,"Reports suggest the film’s production—which Coppola financed himself—was turbulent, and reactions to initial screenings have been mixed.","https://imageio.forbes.com/specials-images/imageserve/6644ff669bc7405bb18a2e01/0x0.jpg?format=jpg&crop=3301,1856,x0,y54,safe&height=900&width=1600&fit=bounds",2024-05-15T18:34:27Z,,"Francis Ford Coppolas nearly 50-year passion project, Megalopolis, has finally materialized and will premiere at Cannes this weekbut the films arrival has been marred by allegations of inappropriate … [+5576 chars]",,en,'Francis Ford Coppola'
https://exclaim.ca/film/article/francis-ford-coppola-megalopolis-set-behaviour-crew,https://exclaim.ca/film/article/francis-ford-coppola-megalopolis-set-behaviour-crew,0,exclaim.ca,"Francis Ford Allegedly Tried Kissing Extras, Smoked Weed ""Often"" on 'Megalopolis' Set","Days ahead of his long-awaited, self-financed sci-fi epic Megalopolis premiering at the Cannes Film Festival, it's been alleged that direct",https://assets.exclaim.ca/image/upload/v1715800928/Francis_Ford_Coppola_11_61e835e4ce.jpg,2024-05-15T19:24:46Z,,"Days ahead of his long-awaited, self-financed sci-fi epic Megalopolis premiering at the Cannes Film Festival, it's been alleged that director Francis Ford Coppola's approach on set was so exasperatin… [+5563 chars]",,en,'Francis Ford Coppola'
https://www.cracked.com/article_42190_kim-kardashian-doesnt-know-how-nikki-glaser-handles-roasts-its-abuse.html,https://www.cracked.com/article_42190_kim-kardashian-doesnt-know-how-nikki-glaser-handles-roasts-its-abuse.html,0,www.cracked.com,Kim Kardashian Doesn’t Know How Nikki Glaser Handles Roasts: ‘It’s Abuse’,"By Matt Solomon Published: May 15th, 2024",https://s3.crackedcdn.com/phpimages/article/5/0/2/1079502.jpg,2024-05-15T19:30:00Z,,"Did anyone have a worse time at the Tom Brady roast than Kim Kardashian? 
From the crowds merciless booing to catching strays from other roasters, Kardashian may have been more scarred by the evenin… [+2689 chars]",,en,'Andrew Schulz'
https://www.breitbart.com/entertainment/2024/05/15/nolte-hollywood-uses-anonymous-accusations-destroy-maverick-francis-ford-coppola/,https://www.breitbart.com/entertainment/2024/05/15/nolte-hollywood-uses-anonymous-accusations-destroy-maverick-francis-ford-coppola/,0,www.breitbart.com,Nolte: Hollywood Uses Anonymous Accusations to Destroy Maverick Francis Ford Coppola,"The despicable left-wing Guardian is using anonymous sources to personally destroy Francis Ford Coppola on behalf of corporate Hollywood.
The post Nolte: Hollywood Uses Anonymous Accusations to Destroy Maverick Francis Ford Coppola appeared first on Breitbart.",https://media.breitbart.com/media/2024/05/Francis-Ford-Coppola-640x335.jpg,2024-05-15T19:31:39Z,,"The despicable left-wing Guardian is using anonymous sources to personally destroy Francis Ford Coppola on behalf of corporate Hollywood.
Coppola is 85 years old, has won numerous Oscars, directed a… [+3821 chars]",,en,'Francis Ford Coppola'
https://www.indiewire.com/news/general-news/chris-hemsworth-martin-scorsese-francis-ford-coppola-criticizing-marvel-harsh-1235004832/,https://www.indiewire.com/news/general-news/chris-hemsworth-martin-scorsese-francis-ford-coppola-criticizing-marvel-harsh-1235004832/,0,www.indiewire.com,Chris Hemsworth: Martin Scorsese and Francis Ford Coppola Criticizing Marvel Is ‘an Eye-Roll’,Chris Hemsworth reflected on Martin Scorsese and Francis Ford Coppola criticizing Marvel.,https://www.indiewire.com/wp-content/uploads/2024/05/martin-scorsese-chris-hemsworth-francis-ford-coppola2.jpg?w=650,2024-05-15T20:00:00Z,,"Chris Hemsworth is reflecting on the “harsh” criticisms of Marvel from auteurs Martin Scorsese and Francis Ford Coppola. 
While both legendary filmmakers’ respective opinions on superhero franchises… [+1818 chars]",,en,'Francis Ford Coppola'
https://timesofindia.indiatimes.com/world/europe/coppola-tried-to-kiss-extras-on-set-megalopolis-crew/articleshow/110157524.cms,https://timesofindia.indiatimes.com/world/europe/coppola-tried-to-kiss-extras-on-set-megalopolis-crew/articleshow/110157524.cms,0,timesofindia.indiatimes.com,Coppola tried to kiss extras on set: 'Megalopolis' crew,"Crew members allege misconduct by Francis Ford Coppola on 'Megalopolis' set before Cannes Film Festival premiere, featuring Adam Driver. Coppola, known for 'The Godfather' trilogy and 'Apocalypse Now', faces allegations of inappropriate behavior towards femal…","https://static.toiimg.com/thumb/msid-110157526,width-1070,height-580,imgsize-750594,resizemode-75,overlay-toi_sw,pt-32,y_pad-40/photo.jpg",2024-05-15T21:05:14Z,,Oldest animal species alive on earth and where to spot them?,,en,'Francis Ford Coppola'
https://slashdot.org/firehose.pl?op=view&amp;id=173880737,https://slashdot.org/firehose.pl?op=view&amp;id=173880737,0,slashdot.org,Francis Ford Coppola Accused of Trying to Kiss Extras on 'Megalopolis' Set - The New York Times,Francis Ford Coppola Accused of Trying to Kiss Extras on 'Megalopolis' SetThe New York Times ‘Megalopolis’ Producer Addresses Report of Francis Ford Coppola Trying to Kiss Extras on Set: ‘I Was Never Aware of Any Complaints of Harassment’Variety What To Know …,,2024-05-15T21:12:49Z,,Sign up for the Slashdot newsletter! OR check out the new Slashdot job board to browse remote jobs or jobs in your areaDo you develop on GitHub? You can keep using GitHub but automatically sync your … [+268 chars],,en,'Francis Ford Coppola'
https://slashdot.org/firehose.pl?op=view&amp;id=173881965,https://slashdot.org/firehose.pl?op=view&amp;id=173881965,0,slashdot.org,Francis Ford Coppola Accused Of Trying To Kiss Extras On 'Megalopolis' Set - HuffPost,Francis Ford Coppola Accused Of Trying To Kiss Extras On 'Megalopolis' SetHuffPost ‘Megalopolis’ Producer Addresses Report of Francis Ford Coppola Trying to Kiss Extras on Set: ‘I Was Never Aware of Any Complaints of Harassment’Variety Reports of chaos on 'Me…,,2024-05-15T23:12:36Z,,"""My sense of purpose is gone! I have no idea who I AM!""
 ""Oh, my God... You've.. You've turned him into a DEMOCRAT!""
-- Doonesbury",,en,'Francis Ford Coppola'
http://deadline.com/2024/05/nikki-glaser-tom-brady-regretting-roast-1235918362/,http://deadline.com/2024/05/nikki-glaser-tom-brady-regretting-roast-1235918362/,0,deadline.com,Nikki Glaser On Tom Brady Regretting Roast: “I Feel He Didn’t Consider The Backlash From His Family”,Nikki Glaser received a standing ovation after appearing on The Greatest Roast of All Time: Tom Brady and is now sharing more insight into her observations of the event. While appearing on Today with Hoda and Jenna to promote her latest Netflix comedy special…,https://deadline.com/wp-content/uploads/2024/05/nikki-glaser-tom-brady-roast.jpg?w=1024,2024-05-15T23:42:59Z,,"Nikki Glaser received a standing ovation after appearing on The Greatest Roast of All Time: Tom Brady and is now sharing more insight into her observations of the event.
While appearing on Today wit… [+2389 chars]",,en,'Tom Brady'
https://bleacherreport.com/articles/10117587-jets-2024-nfl-schedule-released-for-aaron-rodgers-return-from-injury,https://bleacherreport.com/articles/10117587-jets-2024-nfl-schedule-released-for-aaron-rodgers-return-from-injury,0,bleacherreport.com,Jets 2024 NFL Schedule Released for Aaron Rodgers' Return from Injury,"Last year was supposed to be the year for the New York Jets, but as the old saying goes, the best-laid plans often go awry. After entering 2023 with Super…","https://media.bleacherreport.com/image/upload/c_fill,g_faces,w_3800,h_2000,q_95/v1713475033/rw6lgatoowtcc40nhtvm.jpg",2024-05-16T00:04:15Z,,"Nick Cammett/Diamond Images via Getty Images
Last year was supposed to be the year for the New York Jets, but as the old saying goes, the best-laid plans often go awry.
After entering 2023 with Sup… [+5385 chars]",,en,'Bill Belichick'
https://www.startribune.com/all-eyes-are-on-coppola-in-cannes-sound-familiar/600366285/,https://www.startribune.com/all-eyes-are-on-coppola-in-cannes-sound-familiar/600366285/,0,www.startribune.com,All eyes are on Coppola in Cannes. Sound familiar?,"Francis Ford Coppola on Thursday will premiere at the Cannes Film Festival a film on which he has risked everything, one that's arriving clouded by rumors of production turmoil. Sound familiar?",https://www.startribune.com/static/img/branding/logos/strib-social-card.png?d=1715794744,2024-05-16T00:25:02Z,,"CANNES, France Francis Ford Coppola on Thursday will premiere at the Cannes Film Festival a film on which he has risked everything, one that's arriving clouded by rumors of production turmoil. Sound … [+3946 chars]",,en,'Francis Ford Coppola'
https://abcnews.go.com/Entertainment/wireStory/eyes-coppola-cannes-sound-familiar-110282557,https://abcnews.go.com/Entertainment/wireStory/eyes-coppola-cannes-sound-familiar-110282557,0,abcnews.go.com,All eyes are on Coppola in Cannes. Sound familiar?,Francis Ford Coppola will soon premiere at the Cannes Film Festival a film on which he has risked everything that’s arriving clouded by rumors of production turmoil,https://i.abcnewsfe.com/a/cd4df8e3-5982-4483-99c0-be4b1bf33409/wirestory_60e6fe4b066e91f1ceeea5feac0dc0bf_16x9.jpg?w=1600,2024-05-16T00:30:33Z,,"CANNES, France -- Francis Ford Coppola on Thursday will premiere at the Cannes Film Festival a film on which he has risked everything, one that's arriving clouded by rumors of production turmoil. Sou… [+3879 chars]",,en,'Francis Ford Coppola'
https://www.digitaljournal.com/world/coppolas-epic-megalopolis-finally-arrives-at-cannes/article,https://www.digitaljournal.com/world/coppolas-epic-megalopolis-finally-arrives-at-cannes/article,0,www.digitaljournal.com,Coppola’s epic ‘Megalopolis’ finally arrives at Cannes,"Another masterpiece emerging from chaos, or just a chaotic mess? One of Hollywood’s most mythologised directors, Francis Ford Coppola, returns Thursday to the Cannes Film Festival with the almost impossibly hyped “Megalopolis”. He has been in this position be…",https://www.digitaljournal.com/wp-content/uploads/2024/05/7e117874509d22d7abcfcda0edbb49e9ea46df8c.jpg,2024-05-16T02:34:59Z,,"Adam Driver stars in 'Megalopolis' - Copyright AFP HENRY NICHOLLS
Another masterpiece emerging from chaos, or just a chaotic mess? One of Hollywood’s most mythologised directors, Francis Ford Coppol… [+2809 chars]",,en,'Francis Ford Coppola'
https://www.digitaljournal.com/entertainment/coppolas-epic-megalopolis-finally-arrives-at-cannes/article,https://www.digitaljournal.com/entertainment/coppolas-epic-megalopolis-finally-arrives-at-cannes/article,0,www.digitaljournal.com,Coppola’s epic ‘Megalopolis’ finally arrives at Cannes,"One of Hollywood's most mythologised directors, Francis Ford Coppola, returns Thursday to the Cannes Film Festival.
The post Coppola’s epic ‘Megalopolis’ finally arrives at Cannes appeared first on Digital Journal.",https://www.digitaljournal.com/wp-content/uploads/2024/05/7e117874509d22d7abcfcda0edbb49e9ea46df8c.jpg,2024-05-16T02:34:59Z,,"Adam Driver stars in 'Megalopolis' - Copyright AFP HENRY NICHOLLS
Another masterpiece emerging from chaos, or just a chaotic mess? One of Hollywood’s most mythologised directors, Francis Ford Coppol… [+2809 chars]",,en,'Francis Ford Coppola'
https://www.forbes.com/sites/timlammers/2024/05/15/aubrey-plaza-defends-francis-ford-coppola-ahead-of-megalopolis-cannes-premiere/,https://www.forbes.com/sites/timlammers/2024/05/15/aubrey-plaza-defends-francis-ford-coppola-ahead-of-megalopolis-cannes-premiere/,0,www.forbes.com,Aubrey Plaza Defends Francis Ford Coppola Ahead Of ‘Megalopolis’ Cannes Premiere,"Aubrey Plaza of Francis Ford Coppola’s ""Megalopolis"" is commenting on a damning report with allegations of went on during the making of the director’s movie opus. Click in to read what she says.","https://imageio.forbes.com/specials-images/imageserve/66457a1909922d0a2b1ff6a7/0x0.jpg?format=jpg&crop=2361,1582,x369,y4,safe&height=900&width=1600&fit=bounds",2024-05-16T03:45:31Z,,"Aubrey Plaza at the 75th Primetime Emmy Awards held at the Peacock Theater on January 15, 2024 in ... [+] Los Angeles, California. (Photo by Gilbert Flores/Variety via Getty Images)
Variety via Gett… [+4587 chars]",,en,'Francis Ford Coppola'
https://slashdot.org/firehose.pl?op=view&amp;id=173883713,https://slashdot.org/firehose.pl?op=view&amp;id=173883713,0,slashdot.org,Reports of chaos on 'Megalopolis' set as trailer drops - SFGATE,Reports of chaos on 'Megalopolis' set as trailer dropsSFGATE ‘Megalopolis’ Producer Addresses Report of Francis Ford Coppola Trying to Kiss Extras on Set: ‘I Was Never Aware of Any Complaints of Harassment’Variety What To Know About Coppola's Controversial Ca…,,2024-05-16T03:52:58Z,,Sign up for the Slashdot newsletter! OR check out the new Slashdot job board to browse remote jobs or jobs in your areaDo you develop on GitHub? You can keep using GitHub but automatically sync your … [+268 chars],,en,'Francis Ford Coppola'
https://biztoc.com/x/c1eba39863a3f39f,https://biztoc.com/x/c1eba39863a3f39f,0,biztoc.com,‘Megalopolis’ will premiere at Cannes amid controversy,"Francis Ford Coppola’s new sci-fi film will premiere at the Cannes Film Festival this week, 40 years after its inception. The film, which Coppola has described as a Roman epic set in modern America, stars Adam Driver. Coppola sold a winery to help fund the mo…",https://c.biztoc.com/p/c1eba39863a3f39f/s.webp,2024-05-16T05:06:07Z,,"Francis Ford Coppolas new sci-fi film will premiere at the Cannes Film Festival this week, 40 years after its inception. The film, which Coppola has described as a Roman epic set in modern America, s… [+305 chars]",,en,'Francis Ford Coppola'
https://news.sky.com/story/tom-brady-vows-to-be-better-parent-after-netflix-roast-tore-into-divorce-13136859,https://news.sky.com/story/tom-brady-vows-to-be-better-parent-after-netflix-roast-tore-into-divorce-13136859,0,news.sky.com,Tom Brady vows to be 'better parent' after Netflix roast,"Tom Brady has promised to be ""a better parent"" after a Netflix comedy special poked fun at his divorce.",https://e3.365dm.com/24/05/1600x900/skynews-tom-brady-netflix_6555581.jpg?20240516083351,2024-05-16T07:22:00Z,,"Tom Brady has promised to be ""a better parent"" after a Netflix comedy special poked fun at his divorce.
The seven-time Super Bowl champion appeared on The Roast Of Tom Brady, where comedians like Ke… [+2319 chars]",,en,'Tom Brady'
http://www.hollywoodreporter.com/movies/movie-news/megalopolis-imax-global-release-cannes-francis-ford-coppola-1235901041/,http://www.hollywoodreporter.com/movies/movie-news/megalopolis-imax-global-release-cannes-francis-ford-coppola-1235901041/,0,www.hollywoodreporter.com,Francis Ford Coppola's 'Megalopolis' in Imax Release: Cannes,"""One of the things that we pride ourselves on is being filmmaker-friendly,"" says Imax CEO Rich Gelfond.",https://www.hollywoodreporter.com/wp-content/uploads/2024/04/MEGALOPOLIS.jpg?w=1024,2024-05-16T11:36:59Z,,"Imax is going big, mega actually, unveiling on Thursday that Francis Ford Coppola’s highly anticipated Megalopolis, premiering at the Cannes Film Festival on Thursday evening, will get a global Imax … [+1573 chars]",,en,'Francis Ford Coppola'
