index,url,valid,domain,title,description,image,published,archive,content,quote,language,keyword
https://www.nzherald.co.nz/entertainment/joe-jonas-has-been-spotted-hanging-out-with-model-stormi-bree-henley/K42PS3CM75G5TFXIBRVPJE7MTA/,https://www.nzherald.co.nz/entertainment/joe-jonas-has-been-spotted-hanging-out-with-model-stormi-bree-henley/K42PS3CM75G5TFXIBRVPJE7MTA/,0,www.nzherald.co.nz,Joe Jonas has been spotted hanging out with model Stormi Bree Henley,The freshly single star arrived at a private airport terminal with a new beau on his arm.,https://www.nzherald.co.nz/resizer/DDVwPjc-eTKOpRnC-h19wYfqwVY=/1200x675/smart/filters:quality(70)/cloudfront-ap-southeast-2.images.arcpublishing.com/nzme/3O2AVQNU5JHZVCA5P2QQQGNDWA.JPG,2024-01-07T00:57:52Z,,A newly single star has been spotted with a model amid a messy divorce. Photo / Getty ImagesFreshly single Joe Jonas has been seen spending time with model Stormi Bree Henley after his headline-makin… [+2169 chars],,en,'Joe Jonas'
https://www.dw.com/en/ukraine-updates-scholz-criticized-for-taurus-hesitation/live-67908633,https://www.dw.com/en/ukraine-updates-scholz-criticized-for-taurus-hesitation/live-67908633,0,www.dw.com,Ukraine updates: Scholz criticized for Taurus 'hesitation',"Former President Joachim Gauck has criticized the German government's ""hesitation"" in delivering Taurus cruise missiles to Ukraine, and urged Europe to bolster its independent defense capabilities. Follow DW for more.",https://static.dw.com/image/65704847_6.jpg,2024-01-07T07:16:00Z,,"Germany's former President Joachim Gauck has issued stark criticism of Chancellor Olaf Scholz over the latter's hesitation in delivering long-range Taurus cruise missiles to Ukraine.
""The Chancellor… [+1782 chars]",,en,'Joachim Gauck'
https://www.politico.com/news/magazine/2024/01/07/lauren-boebert-colorado-district-00134137,https://www.politico.com/news/magazine/2024/01/07/lauren-boebert-colorado-district-00134137,0,www.politico.com,‘We Don’t Want to Be a National Laughingstock’: Why Lauren Boebert Had to Ditch Her District,The Colorado lawmaker’s decision to switch districts was a desperate act by a desperate candidate.,https://static.politico.com/d8/f5/8b3957cc48068c56d316b04c5174/https-delivery-gettyimages.com/downloads/1540353367,2024-01-07T12:00:00Z,,"I still blame Biden and the Democrats for the skyrocketing costs, Reid explained, but I got a weird sort of feeling when Boebert was ranting about masks because, by that point, masks were irrelevant … [+14682 chars]",,en,'Lauren Boebert'
https://biztoc.com/x/d9928be0b690f3e8,https://biztoc.com/x/d9928be0b690f3e8,0,biztoc.com,‘We Don’t Want to Be a National Laughingstock’: Why Lauren Boebert Had to Ditch Her District,"“I still blame Biden and the Democrats for the skyrocketing costs,” Reid explained, “but I got a weird sort of feeling when Boebert was ranting about masks because, by that point, masks were irrelevant here. What mattered was the cost of gas and food and rent…",https://c.biztoc.com/p/d9928be0b690f3e8/s.webp,2024-01-07T12:24:10Z,,"I still blame Biden and the Democrats for the skyrocketing costs, Reid explained, but I got a weird sort of feeling when Boebert was ranting about masks because, by that point, masks were irrelevant … [+291 chars]",,en,'Lauren Boebert'
https://www.commondreams.org/opinion/endless-war-2666881362,https://www.commondreams.org/opinion/endless-war-2666881362,0,www.commondreams.org,Endless War and the American 'Ghost Budget' That Pays for It,"The post-9/11 wars in Iraq and Afghanistan were enabled by a historically unprecedented combination of budgetary procedures and financing methods. Unlike all previous U.S. wars, the post-9/11 wars were funded without higher taxes or non-war budget cuts, and t…",https://www.commondreams.org/media-library/u-s-army-staff-sergeant-robert-dominguez-stands-guard-next-to-a-burning-oil-well-on-march-27-2003-in-rumayla-iraq.jpg?id=33003324&width=1200&height=600&coordinates=0%2C155%2C0%2C156,2024-01-07T12:51:02Z,,"The post-9/11 wars in Iraq and Afghanistan were enabled by a historically unprecedented combination of budgetary procedures and financing methods. Unlike all previous U.S. wars, the post-9/11 wars we… [+10505 chars]",,en,'Immanuel Kant'
https://abcnews.go.com/US/special-counsel-probe-uncovers-new-details-trumps-inaction/story?id=106131854,https://abcnews.go.com/US/special-counsel-probe-uncovers-new-details-trumps-inaction/story?id=106131854,0,abcnews.go.com,Special counsel probe uncovers new details about Trump's inaction on Jan. 6: Sources,"Special counsel Jack Smith has uncovered previously undisclosed details about former President Trump's refusal to help stop the Jan. 6 attack on the Capitol, sources say.",https://i.abcnewsfe.com/a/2a051f05-bda7-43dc-b2d3-e52c31b13f51/Trump-ht-er-240105_1704496130662_hpMain_16x9t.jpg?w=992,2024-01-07T13:02:38Z,http://wayback.archive-it.org/all/20240107161003/https://abcnews.go.com/US/special-counsel-probe-uncovers-new-details-trumps-inaction/story?id=106131854,"Watch ""This Week with George Stephanopoulos"" Sunday morning for more coverage.
Special counsel Jack Smith's team has uncovered previously undisclosed details about former President Donald Trump's re… [+13572 chars]",,en,'Ivanka Trump'
https://consent.yahoo.com/v2/collectConsent?sessionId=1_cc-session_5b4aef6c-6b95-4a2b-b03f-6cfbeec37a48,https://consent.yahoo.com/v2/collectConsent?sessionId=1_cc-session_5b4aef6c-6b95-4a2b-b03f-6cfbeec37a48,0,consent.yahoo.com,Lauren Boebert involved in physical fight with ex-husband in Colorado restaurant,,,2024-01-07T13:59:04Z,,"Si vous cliquez sur « Tout accepter », nos partenaires (y compris 243 qui font partie du Cadre de transparence et de consentement dIAB) et nous utiliserons également des témoins et vos données person… [+982 chars]",,en,'Lauren Boebert'
https://www.newsweek.com/lauren-boebert-vows-fight-capitol-rioters-jan-6-anniversary-1858449,https://www.newsweek.com/lauren-boebert-vows-fight-capitol-rioters-jan-6-anniversary-1858449,0,www.newsweek.com,Lauren Boebert Vows to 'Fight' for Capitol Rioters on Jan. 6 Anniversary,"The congresswoman said Saturday she will ""fight for justice to be restored to America and for these wrongs to be made right.""",https://d.newsweek.com/en/full/2332233/boebert.jpg,2024-01-07T15:55:02Z,,"Representative Lauren Boebert, a Colorado Republican, vowed to ""fight"" for jailed Capitol rioters on Saturday on the third anniversary of January 6, 2021.
On that fateful day, a mob of Donald Trump'… [+4098 chars]",,en,'Lauren Boebert'
https://biztoc.com/x/b745101c4cc1679d,https://biztoc.com/x/b745101c4cc1679d,0,biztoc.com,"Lauren Boebert vows to ""fight"" for Capitol rioters on Jan. 6 anniversary","Representative Lauren Boebert, a Colorado Republican, vowed to ""fight"" for jailed Capitol rioters on Saturday on the third anniversary of January 6, 2021. On that fateful day, a mob of Donald Trump's supporters laid siege on the U.S. Capitol building in Washi…",https://c.biztoc.com/p/b745101c4cc1679d/s.webp,2024-01-07T15:56:05Z,,"Representative Lauren Boebert, a Colorado Republican, vowed to ""fight"" for jailed Capitol rioters on Saturday on the third anniversary of January 6, 2021.On that fateful day, a mob of Donald Trump's … [+306 chars]",,en,'Lauren Boebert'
https://www.mediaite.com/news/jim-jordan-says-biden-probes-most-damning-evidence-came-from-hunter-associate-devon-archer-who-flat-denied-knowing-of-any-joe-biden-wrongdoing/,https://www.mediaite.com/news/jim-jordan-says-biden-probes-most-damning-evidence-came-from-hunter-associate-devon-archer-who-flat-denied-knowing-of-any-joe-biden-wrongdoing/,0,www.mediaite.com,Jim Jordan Says Biden Probe’s ‘Most Damning Evidence’ Came From Hunter Associate Devon Archer — Who Flat Denied Knowing Of Any Joe Biden Wrongdoing,"Jim Jordan said the ""most damning evidence"" in the House's Biden probe came from a witness who flatly denied knowing of any wrongdoing on Biden's part.
The post Jim Jordan Says Biden Probe’s ‘Most Damning Evidence’ Came From Hunter Associate Devon Archer — Wh…",https://www.mediaite.com/wp-content/uploads/2024/01/Sunday-Morning-Futures-With-Maria-Bartiromo-10_09_05-am-2024-01-07.jpg,2024-01-07T16:39:15Z,,House Judiciary Chairman Jim Jordan (R-OH) said Sunday that the “most damning evidence” to date in the House’s investigation of President Joe Biden came from a witness who flatly denied knowing of an… [+2485 chars],,en,'Devon Archer'
https://www.politico.com/newsletters/playbook/2024/01/07/what-was-lloyd-austin-thinking-00134190,https://www.politico.com/newsletters/playbook/2024/01/07/what-was-lloyd-austin-thinking-00134190,0,www.politico.com,Playbook: What was Lloyd Austin thinking?,And the Trump campaign ramps up attacks against Nikki Haley.,https://static.politico.com/64/14/ba9af96c445e8fdb40d0b6ec53d8/https-delivery-gettyimages.com/downloads/1756543617,2024-01-07T17:23:16Z,,"Presented by ACLI, Finseca, IRI, NAFA and NAIFA
With help from Eli Okun, Garrett Ross and Bethany Irvine
Defense Secretary Lloyd Austin's hospitalization raises questions about the closeness of Aus… [+21349 chars]",,en,'Rand Paul'
https://crooksandliars.com/2024/01/jordan-pretends-debunked-burisma-fairy,https://crooksandliars.com/2024/01/jordan-pretends-debunked-burisma-fairy,0,crooksandliars.com,Jordan Pretends Debunked Burisma Fairy Tale Is 'Most Damning Evidence' Yet,Irony just died again this Sunday when Jim Jordan told Fox's Maria Bartiromo how terribly serious it is for someone not to comply with a Congressional subpoena. As House Republicans prepare to hold Hunter Biden in contempt of Congress for refusing to appear b…,https://crooksandliars.com/files/primary_image/24/01/fox-bartiromo-jordan-010724_0.png,2024-01-08T14:00:01Z,,Irony just died again this Sunday when Jim Jordan told Fox's Maria Bartiromo how terribly serious it is for someone not to comply with a Congressional subpoena. As House Republicans prepare to hold H… [+2265 chars],,en,'Jim Jordan'
https://www.newsweek.com/taylor-swift-golden-globes-selfie-bill-hader-saturday-night-live-snl-1858619,https://www.newsweek.com/taylor-swift-golden-globes-selfie-bill-hader-saturday-night-live-snl-1858619,0,www.newsweek.com,Taylor Swift's Unexpected Golden Globes Selfie Caught on Camera,"The pop star's surprising snap with Bill Hader had fans ""freaking out,"" with the photo dubbed ""The most 'father of daughters' selfie ever taken.""",https://d.newsweek.com/en/full/2332534/main-taylor-swift-inset-swift-hader.png,2024-01-08T14:51:34Z,,"Whether it's the MTV VMAs or the Grammys, Taylor Swift knows how to steal the show at an awards ceremony.
The pop star went viral not once, but twice, during the Golden Globes on Sunday night. First… [+3387 chars]",,en,'Joe Jonas'
https://biztoc.com/x/c59b8948cabe1a41,https://biztoc.com/x/c59b8948cabe1a41,0,biztoc.com,"8 Must-Hear New Country Songs: Willie Nelson, Charley Crockett, Brittney Spencer, Megan Moroney and More","This week’s Must-Hear New Country column features newcomers, legends and legends-in-the-making. Charley Crockett teams with Willie Nelson for a duet, while Brittney Spencer, Megan Moroney, Elvie Shane and more reliable favorites offer up stellar new releases.…",https://c.biztoc.com/p/c59b8948cabe1a41/s.webp,2024-01-08T15:54:57Z,,"This weeks Must-Hear New Country column features newcomers, legends and legends-in-the-making. Charley Crockett teams with Willie Nelson for a duet, while Brittney Spencer, Megan Moroney, Elvie Shane… [+305 chars]",,en,'Willie Nelson'
https://boingboing.net/2024/01/08/jared-mr-ivanka-kushner-and-his-sage-advice-on-how-to-be-a-success-video.html,https://boingboing.net/2024/01/08/jared-mr-ivanka-kushner-and-his-sage-advice-on-how-to-be-a-success-video.html,0,boingboing.net,"Jared ""Mr. Ivanka"" Kushner and his sage advice on how to be a success (video)","Self-help guru Jared Kushner (aka Donald Trump's rich toady-in-law) shared some pearls of wisdom on how to face obstacles and grab success by the cojones. 
""If you want to accomplish something, you know, a lot of people … complain about what other people do o…",,2024-01-08T16:11:29Z,,"Self-help guru Jared Kushner (aka Donald Trump's rich toady-in-law) shared some pearls of wisdom on how to face obstacles and grab success by the cojones. 
""If you want to accomplish something, you … [+1317 chars]",,en,'Jared Kushner'
https://www.msnbc.com/rachel-maddow-show/maddowblog/problem-jim-jordans-damning-evidence-biden-rcna132855,https://www.msnbc.com/rachel-maddow-show/maddowblog/problem-jim-jordans-damning-evidence-biden-rcna132855,0,www.msnbc.com,The problem with Jim Jordan’s ‘damning evidence’ against Biden,"If the most damning evidence Republicans have against President Biden is Devon Archer debunking their claims, then Republicans don't have any damning evidence.","https://media-cldnry.s-nbcnews.com/image/upload/t_nbcnews-fp-1200-630,f_auto,q_auto:best/rockcms/2024-01/240108-jim-jordan-al-1054-5ab8a4.jpg",2024-01-08T16:22:24Z,,"At one point during Rep. Jim Jordans latest interview with Maria Bartiromo, the Ohio Republican told the Fox News anchor that he wants to see Hunter Biden face consequences for failing to fully compl… [+1996 chars]",,en,'Jim Jordan'
https://www.brooklynvegan.com/we-are-the-world-documentary-coming-to-netflix-this-month/,https://www.brooklynvegan.com/we-are-the-world-documentary-coming-to-netflix-this-month/,0,www.brooklynvegan.com,‘We Are the World’ documentary coming to Netflix this month,"“We Are the World,” the 1985 all-star charity single credited to USA for Africa — co-written by Michael Jackson and Lionel Richie and featuring Bob Dylan, Stevie Wonder, Paul Simon, Tina Turner, Billy Joel, Bruce Springsteen, Willie Nelson, Kenny Rodgers, Dar…",https://www.brooklynvegan.com/wp-content/uploads/2024/01/08/The_Greatest_Night_In_Pop_A2021_2_4_462.jpeg,2024-01-08T16:52:41Z,,"“We Are the World,” the 1985 all-star charity single credited to USA for Africa — co-written by Michael Jackson and Lionel Richie and featuring Bob Dylan, Stevie Wonder, Paul Simon, Tina Turner, Bill… [+1781 chars]",,en,'Bruce Springsteen'
https://bleacherreport.com/articles/10104121-nfl-exec-says-chiefs-patrick-mahomes-does-not-trust-who-he-is-throwing-to,https://bleacherreport.com/articles/10104121-nfl-exec-says-chiefs-patrick-mahomes-does-not-trust-who-he-is-throwing-to,0,bleacherreport.com,NFL Exec Says Chiefs' Patrick Mahomes 'Does Not Trust Who He Is Throwing To',"The Kansas City Chiefs are the No. 3 seed in the AFC playoffs, but most of the talk surrounding the conference has centered on the top-seed Baltimore Ravens…","https://media.bleacherreport.com/image/upload/c_fill,g_faces,w_3800,h_2000,q_95/v1704739720/zswejuahliunbwd6ngnh.jpg",2024-01-08T18:55:39Z,,"Kevork Djansezian/Getty Images
The Kansas City Chiefs are the No. 3 seed in the AFC playoffs, but most of the talk surrounding the conference has centered on the top-seed Baltimore Ravens and the re… [+1344 chars]",,en,'Patrick Mahomes'
https://www.aljazeera.com/news/2024/1/8/governors-revolt-why-iowas-kim-reynolds-split-from-trump-ahead-of-caucus,https://www.aljazeera.com/news/2024/1/8/governors-revolt-why-iowas-kim-reynolds-split-from-trump-ahead-of-caucus,0,www.aljazeera.com,Governor’s revolt: Why Iowa’s Kim Reynolds split from Trump ahead of caucus,"As the US's Iowa caucus nears, Reynolds breaks with tradition by endorsing a Trump rival. What does she stand to gain?",https://www.aljazeera.com/wp-content/uploads/2024/01/AP23309636202107-1704741459.jpg?resize=1920%2C1440,2024-01-08T21:03:26Z,,"For decades, it was a tradition for Iowa governors to remain neutral ahead of the states all-important caucuses the first major contest of the United States presidential race.
And Republican Governo… [+9005 chars]",,en,'Ivanka Trump'
https://zacjohnson.com/immanuel-kant-net-worth/,https://zacjohnson.com/immanuel-kant-net-worth/,0,zacjohnson.com,Immanuel Kant Net Worth – How Much Was Immanuel Kant Worth?,"Immanuel Kant, the iconic philosopher, had a net worth of $5 million at the time of his passing in 1804. His fortune was amassed through his career as a philosopher and author, as well as the recognition and awards he received for his contributions to academi…",https://zacjohnson.com/wp-content/uploads/2024/01/Immanuel-Kant-net-worth.jpg,2024-01-08T21:40:00Z,,"Immanuel Kant, the iconic philosopher, had a net worth of $5 million at the time of his passing in 1804. His fortune was amassed through his career as a philosopher and author, as well as the recogni… [+23986 chars]",,en,'Immanuel Kant'
https://zacjohnson.com/john-locke-net-worth-2/,https://zacjohnson.com/john-locke-net-worth-2/,0,zacjohnson.com,John Locke Net Worth – How Much Was John Locke Worth?,"John Locke, a renowned philosopher and writer, has had a significant impact on the world of literature and philosophy. While his intellectual contributions are widely recognized, many are curious about his financial success and net worth. In this article, we …",https://zacjohnson.com/wp-content/uploads/2024/01/John-Locke-net-worth.jpg,2024-01-08T22:31:48Z,,"John Locke, a renowned philosopher and writer, has had a significant impact on the world of literature and philosophy. While his intellectual contributions are widely recognized, many are curious abo… [+28812 chars]",,en,'Immanuel Kant'
https://pubs.rsc.org/en/content/articlelanding/2024/dt/d3dt03549b,https://pubs.rsc.org/en/content/articlelanding/2024/dt/d3dt03549b,0,pubs.rsc.org,Charge-compensated nido-carborane derivatives in the synthesis of iron(II) bis(dicarbollide) complexes,"Dalton Trans., 2024, Accepted ManuscriptDOI: 10.1039/D3DT03549B, PaperMarina Yu. Stogniy, Sergey A. Anufriev, Ekaterina V. Bogdanova, Nadezhda A. Gorodetskaya, Aleksei A. Anisimov, Kyrill Suponitsky, Ivan Grishin, Igor B. SivaevA series of stable iron(II) bis…",,2024-01-09T00:00:00Z,,"M. Yu. Stogniy, S. A. Anufriev, E. V. Bogdanova, N. A. Gorodetskaya, A. A. Anisimov, K. Suponitsky, I. Grishin and I. B. Sivaev,
 Dalton Trans., 2024, Accepted Manuscript
, DOI: 10.1039/D3DT03549B… [+691 chars]",,en,'Kyrill'
https://www.marketscreener.com/news/latest/Analysis-Macron-sends-out-France-s-youngest-prime-minister-to-fend-off-far-right-45706981/,https://www.marketscreener.com/news/latest/Analysis-Macron-sends-out-France-s-youngest-prime-minister-to-fend-off-far-right-45706981/,0,www.marketscreener.com,Analysis-Macron sends out France's youngest prime minister to fend off far right,"(marketscreener.com) By naming young political prodigy Gabriel Attal as prime minister, French President Emmanuel Macron is showing what he hopes is a winning hand to beat the far right, which is leading in opinion polls ahead of June's European parliamentary…",https://www.marketscreener.com/images/reuters/2024-01/2024-01-09T151046Z_1_LYNXMPEK080KB_RTROPTP_3_FRANCE-POLITICS-RESHUFFLE.JPG,2024-01-09T15:18:24Z,,"PARIS (Reuters) - By naming young political prodigy Gabriel Attal as prime minister, French President Emmanuel Macron is showing what he hopes is a winning hand to beat the far right, which is leadin… [+4628 chars]",,en,'Gabriel Attal'
https://www.stereogum.com/2247209/watch-the-trailer-for-new-we-are-the-world-documentary-the-greatest-night-in-pop/news/,https://www.stereogum.com/2247209/watch-the-trailer-for-new-we-are-the-world-documentary-the-greatest-night-in-pop/news/,0,www.stereogum.com,Watch The Trailer For New “We Are The World” Documentary The Greatest Night In Pop,"One night in January 1985, many of the biggest stars in pop history got together to record the same song at the same time. Michael Jackson and Lionel Richie had written a song called “We Are The World,” and it was slated to come out as a benefit single for Af…",https://static.stereogum.com/uploads/2024/01/USA-For-Africa-1704817110.jpeg,2024-01-09T16:19:51Z,,"One night in January 1985, many of the biggest stars in pop history got together to record the same song at the same time. Michael Jackson and Lionel Richie had written a song called “We Are The Worl… [+1691 chars]",,en,'Lionel Richie'
https://variety.com/2024/artisans/news/cinema-audio-society-2024-nominations-1235865872/,https://variety.com/2024/artisans/news/cinema-audio-society-2024-nominations-1235865872/,0,variety.com,"‘Ferrari,’ ‘Barbie,’ ‘Killers of the Flower Moon,’ ‘Taylor Swift: The Eras Tour’ Among Cinema Audio Society Nominations","The Cinema Audio Society has announced the nominations for the 60th annual CAS Awards. “Barbie,” “Ferrari,” “Oppenheimer” and “Maestro” are among the 2024 nominees for outstanding achievement in sound mixing for motion pictures – live action. Other nominees a…",https://variety.com/wp-content/uploads/2022/10/Ferrari.jpg?w=1000&h=563&crop=1,2024-01-09T17:15:00Z,,"The Cinema Audio Society has announced the nominations for the 60th annual CAS Awards.
“Barbie,” “Ferrari,” “Oppenheimer” and “Maestro” are among the 2024 nominees for outstanding achievement in sou… [+8644 chars]",,en,'Taylor Swift'
https://decider.com/2024/01/09/whoopi-goldberg-sunny-hostin-divided-pro-palestine-protestors-biden-church-speech-the-view/,https://decider.com/2024/01/09/whoopi-goldberg-sunny-hostin-divided-pro-palestine-protestors-biden-church-speech-the-view/,0,decider.com,Whoopi Goldberg And Sunny Hostin Divided On ‘The View’ Over Pro-Palestine Protestors At Biden’s Church Speech: “You Can’t Do That”,A group of protestors interrupted the president's speech on Monday at a church where nine people were killed by a white supremacist in 2015.,https://decider.com/wp-content/uploads/2024/01/Whoopi-Sunny.jpg?quality=75&strip=all&w=1200,2024-01-09T17:16:25Z,,"The View waded into contentious waters on this morning’s episode as Whoopi Goldberg and Sunny Hostin got heated during a discussion about the Israel-Hamas conflict and the Biden administration. 
Gol… [+2753 chars]",,en,'Sunny Hostin'
https://www.mediaite.com/politics/beware-the-media-whoopi-goldberg-and-joy-behar-go-after-the-fourth-estate-in-heated-commentary-on-the-view/,https://www.mediaite.com/politics/beware-the-media-whoopi-goldberg-and-joy-behar-go-after-the-fourth-estate-in-heated-commentary-on-the-view/,0,www.mediaite.com,‘Beware the Media!’ Whoopi Goldberg and Joy Behar Go After the Fourth Estate in Heated Commentary on The View,"The View's Whoopi Goldberg warned voters young and old to ""beware the media"" so it doesn't guide the way they cast their ballots.
The post ‘Beware the Media!’ Whoopi Goldberg and Joy Behar Go After the Fourth Estate in Heated Commentary on The View first appe…",https://www.mediaite.com/wp-content/uploads/2024/01/The-View.jpg,2024-01-09T17:41:09Z,,"The View’sWhoopi Goldberg and Joy Behar warned against the media’s influence on how voters cast their ballots in the 2024 presidential election.
During a discussion of Gen. Z disagreeing with the wa… [+2446 chars]",,en,'Joy Behar'
https://decider.com/2024/01/09/joy-behar-claims-feet-have-created-foot-fetishists-steamy-chat-kinks-the-view/,https://decider.com/2024/01/09/joy-behar-claims-feet-have-created-foot-fetishists-steamy-chat-kinks-the-view/,0,decider.com,Joy Behar Claims Her Feet Have “Created Foot Fetishists” While Talking About “Kinks” On ‘The View’: “I Feel That I’m Responsible”,Behar could have a booming side hustle if she ever decided to sell foot pics.,https://decider.com/wp-content/uploads/2024/01/view-5.jpg?quality=75&strip=all&w=1200,2024-01-09T17:53:21Z,,"Joy Behar could have a booming side hustle if she ever decided to sell feet pics. On this morning’s episode of The View, the longtime co-host turned heads when she bragged about her “beautiful” feet … [+1888 chars]",,en,'Sunny Hostin'
https://dailycaller.com/2024/01/09/joy-behar-sunny-hostin-meet-the-press-kristen-welker/,https://dailycaller.com/2024/01/09/joy-behar-sunny-hostin-meet-the-press-kristen-welker/,0,dailycaller.com,"‘That Was Disappointing’: Joy Behar, Sunny Hostin Rip ‘Meet The Press’ Host",&quot;The View&quot; co-hosts Joy Behar and Sunny Hostin criticized &quot;Meet the Press&quot; host Kristen Welker over her interview with a prominent Republican congresswoman.,https://cdn01.dailycaller.com/wp-content/uploads/2024/01/Screenshot-2024-01-09-at-12.26.59%e2%80%afPM-e1704821287446.png,2024-01-09T18:05:01Z,,"“The View” co-hosts Joy Behar and Sunny Hostin criticized “Meet the Press” host Kristen Welker Tuesday over her interview with a prominent Republican congresswoman.
Behar lamented Welker for not pus… [+1553 chars]",,en,'Sunny Hostin'
https://pagesix.com/2024/01/09/entertainment/whoopi-goldberg-walks-off-the-view-during-foot-fetish-convo/,https://pagesix.com/2024/01/09/entertainment/whoopi-goldberg-walks-off-the-view-during-foot-fetish-convo/,0,pagesix.com,Whoopi Goldberg walks off ‘The View’ set during awkward conversation about foot fetishes,"""You have to entertain your partner's kink, within reason,"" co-host Alyssa Farah Griffin said, prompting Goldberg to stand up and walk away.",https://pagesix.com/wp-content/uploads/sites/3/2024/01/74624558.jpg?quality=75&strip=all&w=1024,2024-01-09T18:52:28Z,,"She’s putting her foot down.
Whoopi Goldberg temporarily walked off the set of “The View” when her co-hosts began talking about foot fetishes.
During Tuesday’s episode of the ABC talk show, the lad… [+2924 chars]",,en,'Alyssa Farah Griffin'
