index,url,valid,domain,title,description,image,published,archive,content,quote,language,keyword
https://decider.com/2024/04/30/vanderpump-rules-ally-lewber-assigns-zodiac-taylor-swift-albums/,https://decider.com/2024/04/30/vanderpump-rules-ally-lewber-assigns-zodiac-taylor-swift-albums/,0,decider.com,‘Vanderpump Rules’ Star Ally Lewber Puts Taylor Swift Knowledge To The Test And Assigns A Zodiac To Each Album [EXCLUSIVE],"Fearless is a Taurus, while The Tortured Poets Department is a Pisces, according to Lewber.",https://decider.com/wp-content/uploads/2024/04/Ally-Lewber-Swiftology.jpg?quality=75&strip=all&w=1200,2024-05-01T00:00:00Z,https://web.archive.org/web/20240501003937/https://decider.com/2024/04/30/vanderpump-rules-ally-lewber-assigns-zodiac-taylor-swift-albums/,"Ally Lewber is not only an astrology expert, but she’s also Vanderpump Rules‘ resident Swiftie. When the aspiring musician stopped by DECIDER’s offices last week, we put her knowledge to the test by … [+2933 chars]",,en,'Joe Alwyn'
https://www.today.com/popculture/music/lance-bass-justin-timberlake-its-gonna-be-may-rcna150142,https://www.today.com/popculture/music/lance-bass-justin-timberlake-its-gonna-be-may-rcna150142,0,www.today.com,Lance Bass expertly trolls Justin Timberlake for his infamous ‘It’s gonna be May’ meme,It appears Justin Timberlake will never live “It’s gonna be May” down.,"https://media-cldnry.s-nbcnews.com/image/upload/t_social_share_1200x630_center,f_auto,q_auto:best/rockcms/2024-05/lance-bass-justin-timberlake-08772e.jpg",2024-05-01T03:24:37Z,,"It appears Justin Timberlake will never live Its gonna be May down.
On April 30, Lance Bass took the meme to another level when he created a TikTok poking fun at his former 'N Sync band member ramen… [+2078 chars]",,en,'Justin Timberlake'
https://www.marca.com/en/basketball/nba/los-angeles-lakers/2024/05/01/6631bab8ca47412c358b456f.html,https://www.marca.com/en/basketball/nba/los-angeles-lakers/2024/05/01/6631bab8ca47412c358b456f.html,0,www.marca.com,"Jason Whitlock destroys LeBron and Bronny James, who he calls a 'Make-A-Wish' kid in the NBA if he lands on Lakers",Former ESPN columnist and FS1 personality Jason Whitlock recently made a bold prediction about LeBron James and his son Bronny following the end of the Los Angeles Lakers&apos; sea,https://phantom-marca.unidadeditorial.es/0cfe5fafba7909771530263d2bfc34e9/resize/1200/f/webp/assets/multimedia/imagenes/2024/05/01/17145345447781.jpg,2024-05-01T03:46:09Z,,"Former ESPN columnist and FS1 personality Jason Whitlock recently made a bold prediction about LeBron James and his son Bronny following the end of the Los Angeles Lakers' season. On his podcast ""Fea… [+2136 chars]",,en,'Jason Whitlock'
https://blogs.lse.ac.uk/europpblog/2024/05/01/france-the-2024-european-parliament-elections-a-pre-presidential-election/,https://blogs.lse.ac.uk/europpblog/2024/05/01/france-the-2024-european-parliament-elections-a-pre-presidential-election/,0,blogs.lse.ac.uk,France: the 2024 European Parliament elections – a pre-presidential election?,"Marine Le Pen’s Rassemblement National is predicted to be the big winner from France’s European Parliament election. Marta Lorimer writes that while many will be tempted to interpret the outcome as a sign that Le Pen could win the 2027 presidential election, …",https://blogsmedia.lse.ac.uk/blogs.dir/28/files/2024/04/marine-le-pen-march-2024-featured.jpg,2024-05-01T03:47:28Z,,Marine Le Pens Rassemblement National is predicted to be the big winner from Frances European Parliament election. Marta Lorimer writes that while many will be tempted to interpret the outcome as a s… [+6507 chars],,en,'Marine Le Pen'
https://www.thedailybeast.com/the-secret-sauce-behind-netflixs-all-out-comedy-dominance,https://www.thedailybeast.com/the-secret-sauce-behind-netflixs-all-out-comedy-dominance,0,www.thedailybeast.com,The Secret Sauce Behind Netflix’s All-Out Comedy Dominance,"Photo Illustration by Luis G. Rendon/The Daily Beast/Getty Images
Most people tend to know Netflix best for their explosive docudramas on cults and killers, or for reviving mid TV shows from other networks, or for titillating sex and violence, or even for mi…","https://img.thedailybeast.com/image/upload/c_crop,d_placeholder_euli9k,h_1688,w_3000,x_0,y_0/dpr_2.0/c_limit,w_740/fl_lossy,q_auto/v1714534404/050124-netflixcomedy-hero_l9tsjg",2024-05-01T08:44:43Z,,"Most people tend to know Netflix best for their explosive docudramas on cults and killers, or for reviving mid TV shows from other networks, or for titillating sex and violence, or even for mind-bend… [+10844 chars]",,en,'nan nan'
https://www.timeout.com/london/news/what-swifties-and-travis-kelce-fans-had-to-say-at-the-black-dog-pub-050124,https://www.timeout.com/london/news/what-swifties-and-travis-kelce-fans-had-to-say-at-the-black-dog-pub-050124,0,www.timeout.com,What Swifties – and Travis Kelce fans – had to say at the Black Dog pub,We went down to the south London pub name-checked by Taylor Swift to chat with fans and locals,https://media.timeout.com/images/106124220/image.jpg,2024-05-01T13:31:14Z,,"The other week (on April 19, to be specific) Taylor Swift released her much-anticipated 11th studio album The Tortured Poets Department – along with a secret double album The Anthology. And buried in… [+3157 chars]",,en,'Travis Kelce'
https://www.elitedaily.com/lifestyle/lance-bass-21-life-lessons,https://www.elitedaily.com/lifestyle/lance-bass-21-life-lessons,0,www.elitedaily.com,*NSYNC's Lance Bass Shares Life Lessons He Wishes He Knew At 21,"TikTok has allowed Lance Bass from *NSYNC to gain Gen Z fans during this Y2K revival, and so he shares life lessons he wishes he knew when he was 21.",https://imgix.bustle.com/uploads/image/2024/4/29/f71493d7-b1e6-4285-8f53-43a615f72e4f-social-share.png?w=1200&h=630&fit=crop&crop=faces&fm=jpg,2024-05-01T15:35:31Z,,"In the early 2000s, *NSYNC dominated the charts the way Taylor Swift and Ariana Grande do today. The group comprised of Justin Timberlake, JC Chasez, Joey Fatone, Chris Kirkpatrick, and Lance Bass he… [+4504 chars]",,en,'Joey Fatone'
https://www.anothermag.com/design-living/15608/the-best-films-to-look-out-for-at-cannes-film-festival-2024,https://www.anothermag.com/design-living/15608/the-best-films-to-look-out-for-at-cannes-film-festival-2024,0,www.anothermag.com,The Best Films to Look Out for at Cannes Film Festival 2024,"From Andrea Arnold’s new film starring Barry Keoghan and Franz Rogowski, to Yorgos Lanthimos’ three-hour anthology epic; here are the best films to look out for at Cannes this year",https://images-prod.anothermag.com/1200/246-0-1350-900/azure/another-prod/440/6/446841.jpg,2024-05-01T16:51:00Z,https://web.archive.org/web/20240501192211/https://www.anothermag.com/design-living/15608/the-best-films-to-look-out-for-at-cannes-film-festival-2024,"May 01, 2024Megalopolis (Francis Ford Coppola)
Last year, all the talk around Francis Ford Coppolas long-gestating sci-fi epic was whether he would ever get around to finishing it; now, having steer… [+5861 chars]",,en,'Willem Dafoe'
https://www.elitedaily.com/entertainment/taylor-swift-i-can-do-it-with-a-broken-heart-sad-detail,https://www.elitedaily.com/entertainment/taylor-swift-i-can-do-it-with-a-broken-heart-sad-detail,0,www.elitedaily.com,"Taylor Swift's ""I Can Do It With A Broken Heart"" Has A Sad Detail","'Tortured Poets' has plenty of heartbreaking moments, and now, Swifties are picking up on another sad detail in ""I Can Do It With A Broken Heart.""",https://imgix.bustle.com/uploads/getty/2024/5/1/3bb4b93d-68c1-486c-ac17-413aa938c823-getty-2032603281.jpg?w=1200&h=630&fit=crop&crop=focalpoint&fm=jpg&fp-x=0.5455&fp-y=0.1876,2024-05-01T20:41:05Z,,"As you can probably tell from the name, Taylor Swifts Tortured Poets Department doesnt lack heartbreak. The 31-track double album details plenty of devastating details, seemingly about Swifts past ro… [+2447 chars]",,en,'Joe Alwyn'
https://www.cinemablend.com/game-of-thrones-news/joey-fatone-reveals-its-gonna-be-may-meme-justin-timberlake-game-of-thrones-spoof,https://www.cinemablend.com/game-of-thrones-news/joey-fatone-reveals-its-gonna-be-may-meme-justin-timberlake-game-of-thrones-spoof,0,www.cinemablend.com,Joey Fatone Reveals The Best ‘It’s Gonna Be May’ Meme Features Justin Timberlake In A Game Of Thrones Spoof,"Joey Fatone revealed the ""It's Gonna Be May"" meme that cracks him up and it features Justin Timberlake and Game of Thrones.",https://cdn.mos.cms.futurecdn.net/nGDQtcw7gUvGa9j5QmR8q4-1200-80.jpg,2024-05-01T21:54:39Z,,"Is it really May if it doesn’t start with Justin Timberlake being trolled over “It’s Gonna Be May?”
 The answer, in this day and age, is no. Every April 30 and May 1 the memes roll in, and we all ge… [+3017 chars]",,en,'Joey Fatone'
https://music.douban.com/review/15915359/,https://music.douban.com/review/15915359/,0,music.douban.com,这是最阴郁刻薄的Taylor Swift，却也是她音乐生涯的里程碑 (评论: The Tortured Poets Department),"马布斯评论: The Tortured Poets Department (https://music.douban.com/subject/36766055/)
评价: 推荐

{""blocks"":[{""key"":""9ru9h"",""text"":""本文首发于《深焦艺文志》公众号"",""type"":""unstyled"",""depth"":0,""inlineStyleRanges"":[],""enti...",https://img9.doubanio.com/view/thing_review/large/public/p10636456.jpg,2024-05-01T23:30:56Z,,"·The Tortured Poets DepartmentTTPDTTPD
TTPD
TTPD
TTPD
Fortnight
Post Malone
The Tortured Poets DepartmentMy Boy Only Breaks His Favorite ToysDown BadSo LongLondon
But Daddy I Love Him
Fresh O… [+1352 chars]",,en,'Taylor Swift'
https://www.justjared.com/2024/05/01/espresso-lyrics-sabrina-carpenter-explains-real-meaning-of-the-song/,https://www.justjared.com/2024/05/01/espresso-lyrics-sabrina-carpenter-explains-real-meaning-of-the-song/,0,www.justjared.com,'Espresso' Lyrics: Sabrina Carpenter Explains Real Meaning of the Song,"Sabrina Carpenter‘s new song “Espresso” is a major contender to be the song of the summer and everyone is falling in love with the hot new track! One of the popular lines from the song that has been going viral on TikTok is, “I’m working late ’cause I’m a sin…",https://cdn01.justjared.com/wp-content/uploads/headlines/2024/05/sabrina-espres.jpg,2024-05-01T23:56:12Z,,"Sabrina Carpenter‘s new song “Espresso” is a major contender to be the song of the summer and everyone is falling in love with the hot new track!
One of the popular lines from the song that has been… [+1625 chars]",,en,'Sabrina Carpenter'
https://www.theadvocate.com/baton_rouge/sports/lsu/lsusroster-coming-into-focus-as-transfer-portal-closes/article_81a9ce96-330b-54b9-919c-1868683cae2b.html,https://www.theadvocate.com/baton_rouge/sports/lsu/lsusroster-coming-into-focus-as-transfer-portal-closes/article_81a9ce96-330b-54b9-919c-1868683cae2b.html,0,www.theadvocate.com,Kim Mulkey's fourth LSU team is coming into focus as transfer portal window closes,"While Hailey Van Lith visited schools, looking for a place to finish her collegiate career, the LSU women's basketball team searched quietly for a ballhandler who could replace her.",https://bloximages.newyork1.vip.townnews.com/theadvocate.com/content/tncms/assets/v3/editorial/2/db/2dbcfa5e-8684-589a-b341-e1a6771a7282/65b33ec828fb0.image.jpg?crop=1467%2C770%2C67%2C63&resize=1200%2C630&order=crop%2Cresize,2024-05-02T10:00:00Z,http://archive.md/20240502135617/https://www.theadvocate.com/baton_rouge/sports/lsu/lsusroster-coming-into-focus-as-transfer-portal-closes/article_81a9ce96-330b-54b9-919c-1868683cae2b.html,"Poa has defensive chops and experience in Mulkeys system.
Day-Wilson offers starting experience and shooting prowess. The rising senior started 71 games across three seasons, two at Duke and one at … [+712 chars]",,en,'Kim Mulkey'
https://www.usmagazine.com/celebrity-news/news/matty-healy-is-uncomfortable-with-focus-on-taylor-swift-romance/#article,https://www.usmagazine.com/celebrity-news/news/matty-healy-is-uncomfortable-with-focus-on-taylor-swift-romance/#article,0,www.usmagazine.com,Matty Healy Is 'Uncomfortable' With Focus on Taylor Swift Romance,"The 1975’s Matty Healy is focusing on his new relationship after inspiring ex-girlfriend Taylor Swift‘s latest album. “Matty’s uncomfortable with the renewed attention on his relationship [with Taylor] — especially because he’s [with someone] new,” an insider…",https://www.usmagazine.com/wp-content/uploads/2024/05/Matty-Healy-Is-Uncomfortable-With-Focus-on-Taylor-Swift-Romance.jpg?crop=0px%2C0px%2C2000px%2C1051px&resize=1200%2C630&quality=86&strip=all,2024-05-02T12:00:54Z,,"Sign InUp with your social account
Continue with Google
Continue with Facebook
Continue with Amazon
Continue with AppleWe won't post to any of your accounts
Get back to the 
The 1975’s Matty He… [+2772 chars]",,en,'Joe Alwyn'
https://www.boredpanda.com/nsyncs-lance-bass-trolls-justin-timberlake-its-gonna-be-may-meme/,https://www.boredpanda.com/nsyncs-lance-bass-trolls-justin-timberlake-its-gonna-be-may-meme/,0,www.boredpanda.com,“The Best Parody”: Lance Bass Is Praised For Imitating Justin Timberlake’s “It’s Gonna Be May”,"""Roses are red, April is gray, but when you wake up tomorrow…It’s gonna be May!""
The post “The Best Parody”: Lance Bass Is Praised For Imitating Justin Timberlake’s “It’s Gonna Be May” first appeared on Bored Panda.",https://www.boredpanda.com/blog/wp-content/uploads/2024/05/fb_image_66337854e761f.png,2024-05-02T12:53:41Z,,"Justin Timberlakeand Lance Bass embraced the annual “It’s gonna be May” meme-turned-holiday, commemorating the iconic mispronunciation from NSYNC’s 2000 hit song It’s Gonna Be Me. This time around, L… [+4540 chars]",,en,'Justin Timberlake'
https://pagesix.com/2024/05/02/entertainment/taylor-swift-supports-theory-connecting-ttpd-midnights/,https://pagesix.com/2024/05/02/entertainment/taylor-swift-supports-theory-connecting-ttpd-midnights/,0,pagesix.com,Taylor Swift supports fan theory connecting ‘The Tortured Poets Department’ and ‘Midnights’,"Swifties celebrated her reaction, with one gushing, ""If Taylor Swift liking this doesn't validate you, I don't know what will you got the trophy!""",https://pagesix.com/wp-content/uploads/sites/3/2024/05/taylor-swift-2.jpg?quality=75&strip=all&w=1024,2024-05-02T13:20:50Z,,"Taylor Swift has given her stamp of approval.
The singer reacted to a social media theory linking her latest album, “The Tortured Poets Department,” to its 2022 predecessor, “Midnights.”
“The first… [+2427 chars]",,en,'Taylor Swift'
https://www.today.com/popculture/news/taylor-swift-black-dog-pub-london-rcna150348,https://www.today.com/popculture/news/taylor-swift-black-dog-pub-london-rcna150348,0,www.today.com,Taylor Swift's song 'The Black Dog' makes real-life pub famous: 'It just went from 1 to 100',"Taylor Swift fans are rushing to a London pub called The Black Dog after the singer made it famous in her song on her new album, ""The Tortured Poets Department.""","https://media-cldnry.s-nbcnews.com/image/upload/t_social_share_1200x630_center,f_auto,q_auto:best/rockcms/2024-05/the-black-dog-pub-mc-2x1-240502-copy-013c3b.jpg",2024-05-02T13:43:57Z,,"Taylor Swift has put a local British pub on the map.
On her new album, ""The Tortured Poets Department,"" she has a song called ""The Black Dog,"" and fans think it's about a London bar that has the sam… [+1819 chars]",,en,'Taylor Swift'
https://screenrant.com/megalopolis-francis-ford-coppola-sci-fi-movie-godfather-first-line/,https://screenrant.com/megalopolis-francis-ford-coppola-sci-fi-movie-godfather-first-line/,0,screenrant.com,Francis Ford Coppola's 2024 Sci-Fi Movie Pays Off The Godfather's First Line 52 Years Later,Francis Ford Coppola’s new movie is worth getting excited about if only for its connection to a famous line from The Godfather’s first scene.,https://static1.srcdn.com/wordpress/wp-content/uploads/2024/05/the-godfather-marlon-brando-don-vito-corleone-megalopolis-nathalie-emmanuel-adam-driver.jpg,2024-05-02T14:05:11Z,,"Summary
<ul><li> Megalopolis by Francis Ford Coppola mirrors The Godfather's iconic line ""I believe in America"" over five decades later. </li><li> Despite differences, both films share themes of soc… [+6197 chars]",,en,'Francis Ford Coppola'
https://www.cracked.com/article_42040_roastmaster-general-jeff-ross-says-nothing-off-limits-for-tom-brady-skewering.html,https://www.cracked.com/article_42040_roastmaster-general-jeff-ross-says-nothing-off-limits-for-tom-brady-skewering.html,0,www.cracked.com,Roastmaster General Jeff Ross Says Nothing Is Off Limits for Tom Brady Skewering,Except for one thing: ‘He asked us not to mention his prosthetic leg’,https://s3.crackedcdn.com/phpimages/article/6/3/2/1071632.jpg,2024-05-02T14:30:00Z,,"In football training camps and practices, violent defenders are forbidden from crushing quarterbacks. But there will be no such kid-glove treatment for Tom Brady at his comedy roast this weekend, war… [+2492 chars]",,en,'Tom Brady'
https://www.firstshowing.net/2024/new-trailer-for-50th-anniv-re-release-of-coppolas-the-conversation/,https://www.firstshowing.net/2024/new-trailer-for-50th-anniv-re-release-of-coppolas-the-conversation/,0,www.firstshowing.net,New Trailer for 50th Anniv. Re-Release of Coppola's 'The Conversation',"""Don't get involved in this, Mr. Caul."" Don't get involved in what?! Who is after him?! Studiocanal UK has revealed a new re-release trailer for Francis Ford Coppola's The Conversation, for its 50th anniversary this year. The film initially opened in 1974 and…",https://media2.firstshowing.net/firstshowing/img16/TheConversation50thMainpostTW1.jpg,2024-05-02T14:55:02Z,,"by Alex BillingtonMay 2, 2024Source:YouTube
""Don't get involved in this, Mr. Caul."" Don't get involved in what?! Who is after him?! Studiocanal UK has revealed a new re-release trailer for Francis F… [+2689 chars]",,en,'Francis Ford Coppola'
http://deadline.com/2024/05/maya-rudolph-jake-gyllenhaal-host-saturday-night-live-season-49-nbc-1235902502/,http://deadline.com/2024/05/maya-rudolph-jake-gyllenhaal-host-saturday-night-live-season-49-nbc-1235902502/,0,deadline.com,Maya Rudolph & Jake Gyllenhaal Set As Final Hosts For Season 49 Of ‘Saturday Night Live’,"Saturday Night Live is closing out Season 49 with two three-peats. After Dua Lipa pulls double duty on May 4, Maya Rudolph will host the sketch comedy show for the third time on May 11. Vampire Weekend will make its fourth appearance as musical guest. On May …",https://deadline.com/wp-content/uploads/2024/05/Jake-Gyllenhaal-and-Maya-Rudolph.jpg?w=1024,2024-05-02T17:00:00Z,,"Saturday Night Liveis closing out Season 49 with two three-peats.
After Dua Lipa pulls double duty on May 4, Maya Rudolph will host the sketch comedy show for the third time on May 11. Vampire Weeke… [+621 chars]",,en,'Sabrina Carpenter'
http://www.thehollywoodgossip.com/2024/05/tom-brady-roast-guests/,http://www.thehollywoodgossip.com/2024/05/tom-brady-roast-guests/,0,www.thehollywoodgossip.com,Tom Brady Roast Surprise Guests Revealed: Who’s Tearing Into The QB?,"Some of the guests at the upcoming Tom Brady roast are going to be very familiar faces. Even if Tom …
Tom Brady Roast Surprise Guests Revealed: Who’s Tearing Into The QB? was originally published on The Hollywood Gossip.",https://cdn.thehollywoodgossip.com/uploads/2024/05/0501_tombrady_header.jpg,2024-05-02T17:05:02Z,,"Some of the guests at the upcoming Tom Brady roast are going to be very familiar faces.
Even if Tom Brady isn’t as hot as he once was, he remains one of the few football stars who has crossed over i… [+5052 chars]",,en,'Tom Brady'
https://www.justjared.com/2024/05/02/maya-rudolph-jake-gyllenhaal-to-host-next-episodes-of-snl-vampire-weekend-sabrina-carpenter-to-perform-as-musical-guests/,https://www.justjared.com/2024/05/02/maya-rudolph-jake-gyllenhaal-to-host-next-episodes-of-snl-vampire-weekend-sabrina-carpenter-to-perform-as-musical-guests/,0,www.justjared.com,"Maya Rudolph & Jake Gyllenhaal to Host Next Episodes of 'SNL,' Vampire Weekend & Sabrina Carpenter to Perform as Musical Guests!","Saturday Night Live is setting up the schedule for their next few episodes! Maya Rudolph will host the May 11 episode alongside Vampire Weekend as musical guest, while the May 18 episode will by headlined by Jake Gyllenhaal with performances from Sabrina Carp…",https://cdn01.justjared.com/wp-content/uploads/headlines/2024/05/snl-2024-social.jpg,2024-05-02T17:19:08Z,,"Saturday Night Live is setting up the schedule for their next few episodes!
Maya Rudolph will host the May 11 episode alongside Vampire Weekend as musical guest, while the May 18 episode will by hea… [+642 chars]",,en,'Sabrina Carpenter'
https://bleedingcool.com/tv/saturday-night-live-season-49-maya-rudolph-jake-gyllenhaal-hosting/,https://bleedingcool.com/tv/saturday-night-live-season-49-maya-rudolph-jake-gyllenhaal-hosting/,0,bleedingcool.com,"Saturday Night Live Season 49: Maya Rudolph, Jake Gyllenhaal Hosting","With Dua Lipa set to host and serve as musical guest for this weekend's return of NBC's Saturday Night Live, we were wondering how many more shows would be left this season. Well, we got our answer this afternoon – with May 11th seeing SNL icon & comedy geniu…",https://bleedingcool.com/wp-content/uploads/2024/05/MixCollage-02-May-2024-01-06-PM-1797-2000x1125.jpg,2024-05-02T17:20:10Z,,"Posted in: NBC, Peacock, Preview, streaming, TV | Tagged: nbc, preview, saturday night live, season 49, snl
NBC's Saturday Night Live has host Maya Rudolph &amp; Vampire Weekend on May 11th and host… [+3164 chars]",,en,'Sabrina Carpenter'
https://www.brooklynvegan.com/vampire-weekend-maya-rudolph-jake-gyllenhaal-sabrina-carter-to-close-out-snls-current-season/,https://www.brooklynvegan.com/vampire-weekend-maya-rudolph-jake-gyllenhaal-sabrina-carter-to-close-out-snls-current-season/,0,www.brooklynvegan.com,"Vampire Weekend, Maya Rudolph, Jake Gyllenhaal & Sabrina Carter to close out SNL’s current season","Saturday Night Live only has three more episodes left in its 49th season. Dua Lipa, whose new album Radical Optimism is out Friday, pulls double duty as host and musical guest this Saturday (May 4), and they’ve just announced the host and musical guests for t…",https://www.brooklynvegan.com/wp-content/uploads/2024/02/07/Vampire-Weekend-Primary-Press-Photo-by-Michael-Schmelling1.jpg,2024-05-02T17:45:49Z,,"Saturday Night Live only has three more episodes left in its 49th season. Dua Lipa, whose new album Radical Optimism is out Friday, pulls double duty as host and musical guest this Saturday (May 4), … [+599 chars]",,en,'Sabrina Carpenter'
https://www.stereogum.com/2261969/vampire-weekend-and-sabrina-carpenter-are-snls-last-two-musical-guests-of-the-season/news/,https://www.stereogum.com/2261969/vampire-weekend-and-sabrina-carpenter-are-snls-last-two-musical-guests-of-the-season/news/,0,www.stereogum.com,Vampire Weekend And Sabrina Carpenter Are SNL’s Last Two Musical Guests Of The Season,"Saturday Night Live has Dua Lipa pulling double duty as host and musical guest in the wake of new album Radical Optimism, and today they revealed the hosts and musical guests for two more episodes to close out Season 49.",https://static.stereogum.com/uploads/2024/05/GettyImages-2148466224-1714671546-scaled.jpg,2024-05-02T17:54:26Z,,"Saturday Night Live has Dua Lipa pulling double duty as host and musical guest in the wake of new album Radical Optimism, and today they revealed the hosts and musical guests for two more episodes to… [+681 chars]",,en,'Sabrina Carpenter'
https://www.newsweek.com/how-taylor-swift-ttpd-affecting-matty-healys-new-relationship-1896730,https://www.newsweek.com/how-taylor-swift-ttpd-affecting-matty-healys-new-relationship-1896730,0,www.newsweek.com,How Taylor Swift's 'TTPD' Is Reportedly Impacting Matty Healy's New Relationship,The 1975 frontman allegedly isn't a fan of all the attention surrounding the 'TTPD' release.,https://d.newsweek.com/en/full/2387345/taylor-swift-matty-healy.jpg,2024-05-02T19:26:30Z,,"Entertainment gossip and news from Newsweek's network of contributors
The 1975's Matty Healy has moved forward with his life and focusing on his new relationship, despite the buzz surrounding his me… [+3176 chars]",,en,'Joe Alwyn'
https://biztoc.com/x/5d22656dcce5f52a,https://biztoc.com/x/5d22656dcce5f52a,0,biztoc.com,How Taylor Swift's 'TTPD' is reportedly impacting Matty Healy's new romance,"Entertainment gossip and news from Newsweek's network of contributors The 1975's Matty Healy has moved forward with his life and focusing on his new relationship, despite the buzz surrounding his mention in Taylor Swift's latest album, The Tortured Poets Depa…",https://c.biztoc.com/p/5d22656dcce5f52a/s.webp,2024-05-02T19:38:05Z,,"Entertainment gossip and news from Newsweek's network of contributorsThe 1975's Matty Healy has moved forward with his life and focusing on his new relationship, despite the buzz surrounding his ment… [+301 chars]",,en,'Taylor Swift'
