index,url,valid,domain,title,description,image,published,archive,content,quote,language,keyword
https://www.marca.com/en/lifestyle/uk-news/2024/09/10/66e080c422601d17118b45a5.html,https://www.marca.com/en/lifestyle/uk-news/2024/09/10/66e080c422601d17118b45a5.html,0,www.marca.com,Why did Harry and Meghan announce their new show minutes after Kate Middleton's cancer video? Nauseating publicity,Kate Middleton&apos;s revelation she is free from cancer was the dominant story of the day but not if Prince Harry and Netflix had anything to say about it after they announced a n,https://phantom-marca.unidadeditorial.es/968100dc8f08dd5240916a4c77086ff4/resize/1200/f/webp/assets/multimedia/imagenes/2024/09/10/17259887874419.jpg,2024-09-10T18:24:38Z,https://web.archive.org/web/20240912012857/https://www.marca.com/en/lifestyle/uk-news/2024/09/10/66e080c422601d17118b45a5.html,Kate Middleton's revelation she is free from cancer was the dominant story of the day but not if Prince Harry and Netflix had anything to say about it after they announced a new TV show just two hour… [+1970 chars],,en,'Prince Andrew'
https://www.tmz.com/2024/09/10/kim-kardashian-mingling-celebs-kering-foundation-dinner-video/,https://www.tmz.com/2024/09/10/kim-kardashian-mingling-celebs-kering-foundation-dinner-video/,0,www.tmz.com,Kim Kardashian Mingles With Celebs In New Video From Inside Kering Foundation Gala,"Kim Kardashian is making the rounds in new footage from inside the Kering Foundation's Caring for Women dinner ... chatting up Jeff Bezos, Lauren Sanchez and Donatella Versace. TMZ obtained exclusive video from inside Monday's star-studded gala in…",https://imagez.tmz.com/image/65/16by9/2024/09/10/65a204ef48494629b81e8f5ed8e00554_xl.jpg,2024-09-10T19:21:35Z,,"Kim Kardashian is making the rounds in new footage from inside the Kering Foundation's Caring for Women dinner ... chatting up Jeff Bezos, Lauren Sanchez and Donatella Versace.
TMZ obtained exclusiv… [+892 chars]",,en,'Kim Kardashian'
https://www.marca.com/en/lifestyle/uk-news/2024/09/10/66e08e8a22601d3a518b45e7.html,https://www.marca.com/en/lifestyle/uk-news/2024/09/10/66e08e8a22601d3a518b45e7.html,0,www.marca.com,Prince Andrew's sex scandal bursts to the surface in new Amazon TV drama,The disgraced Prince Andrew&apos;s controversial links to the Jeffrey Epstein scandal rears its ugly head once again as a new Amazon TV drama sensationally suggests the Duke of Yor,https://phantom-marca.unidadeditorial.es/60ac042048be15e70fab04361f848c62/crop/0x0/2044x1363/resize/1200/f/webp/assets/multimedia/imagenes/2024/09/10/17259917529611.jpg,2024-09-10T19:21:57Z,https://web.archive.org/web/20240917010244/https://www.marca.com/en/lifestyle/uk-news/2024/09/10/66e08e8a22601d3a518b45e7.html,The disgraced Prince Andrew's controversial links to the Jeffrey Epstein scandal rears its ugly head once again as a new Amazon TV drama sensationally suggests the Duke of York couldn't remember slee… [+2622 chars],,en,'Prince Andrew'
https://rlsbb.cc/billboard-hot-100-singles-chart-2024-08-31/,https://rlsbb.cc/billboard-hot-100-singles-chart-2024-08-31/,0,rlsbb.cc,Billboard Hot 100 Singles Chart (2024.08.31),"Tracklist:01. Shaboozey - A Bar Song (Tipsy)02. Post Malone, Morgan Wallen - I Had Some Help03. Lady Gaga, Bruno Mars - Die With A Smile (New Entry)04. Kendrick Lamar - Not Like Us05. Billie Eilish - BIRDS OF A FEATHER06. Chappell Roan - Good Luck, Babe!07. S…",,2024-09-10T19:55:51Z,,"Tracklist:01. Shaboozey - A Bar Song (Tipsy)02. Post Malone, Morgan Wallen - I Had Some Help03. Lady Gaga, Bruno Mars - Die With A Smile (New Entry)04. Kendrick Lamar - Not Like Us05. Billie Eilish -… [+4007 chars]",,en,'Lady Di'
https://www.blogto.com/eat_drink/2024/09/adam-driver-toronto-new-restaurant/,https://www.blogto.com/eat_drink/2024/09/adam-driver-toronto-new-restaurant/,0,www.blogto.com,Adam Driver just dined at Toronto's most anticipated new restaurant,"Legendary director, Francis Ford Coppola, and Academy Award-nominated actor, Adam Driver, just got an exclusive invite to dine at one of Toronto's most anticipated new restaurants.
There's no way around it: Toronto is in the thick of TIFF.
King Street has m…",https://media.blogto.com/articles/2024910-milos-driver-2.jpg?w=1200&cmd=resize_then_crop&height=630&quality=70,2024-09-10T20:12:15Z,https://web.archive.org/web/20240910211605/http://www.blogto.com/eat_drink/2024/09/adam-driver-toronto-new-restaurant/,"Legendary director, Francis Ford Coppola, and Academy Award-nominated actor, Adam Driver, just got an exclusive invite to dine at one of Toronto's most anticipated new restaurants.
There's no way ar… [+2456 chars]",,en,'Francis Ford Coppola'
https://www.justjared.com/2024/09/10/adam-driver-joins-francis-ford-coppola-nathalie-emmanuel-more-at-megalopolis-premiere-at-tiff-2024/,https://www.justjared.com/2024/09/10/adam-driver-joins-francis-ford-coppola-nathalie-emmanuel-more-at-megalopolis-premiere-at-tiff-2024/,0,www.justjared.com,"Adam Driver Joins Francis Ford Coppola, Nathalie Emmanuel, & More at 'Megalopolis' Premiere at TIFF 2024","The Megalopolis stars are stepping out to promote their new movie! Adam Driver, Nathalie Emmanuel, and Giancarlo Esposito joined director Francis Ford Coppola at the a screening of their upcoming movie on Thursday evening (Sept. 9) held at the 2024 Toronto Fi…",https://cdn01.justjared.com/wp-content/uploads/headlines/2024/09/mega-tiff.jpg,2024-09-11T01:58:34Z,,"The Megalopolis stars are stepping out to promote their new movie!
Adam Driver, Nathalie Emmanuel, and Giancarlo Esposito joined director Francis Ford Coppola at the a screening of their upcoming mo… [+1087 chars]",,en,'Francis Ford Coppola'
https://www.npr.org/2024/09/10/nx-s1-5107976/taylor-swift-instagram-endorse-kamala-harris,https://www.npr.org/2024/09/10/nx-s1-5107976/taylor-swift-instagram-endorse-kamala-harris,0,www.npr.org,Taylor Swift endorses Kamala Harris in Instagram post after debate,"In an Instagram post after the presidential debate on Tuesday night, Taylor Swift said she was voting for Kamala Harris.",https://npr.brightspotcdn.com/dims3/default/strip/false/crop/6000x3375+0+202/resize/1400/quality/100/format/jpeg/?url=http%3A%2F%2Fnpr-brightspot.s3.amazonaws.com%2F9e%2Fc5%2F35f67c0948218b0ab849870d0fb4%2Fgettyimages-1474302747.jpg,2024-09-11T03:17:21Z,,"Taylor Swift is entering her 2024 election era.
The mega pop star has thrown her support behind Vice President Harris, just under two months out from the election.
""I think she is a steady-handed, … [+450 chars]",,en,'Taylor Swift'
https://pitchfork.com/news/taylor-swift-endorses-kamala-harris-for-president/,https://pitchfork.com/news/taylor-swift-endorses-kamala-harris-for-president/,0,pitchfork.com,Taylor Swift Endorses Kamala Harris for President,"In a rare political statement, Swift criticized former President Donald J. Trump and called Vice President Harris “a steady-handed, gifted leader”","https://media.pitchfork.com/photos/66e10cd030752d7913daddea/16:9/w_1280,c_limit/Taylor-Swift.jpg",2024-09-11T03:22:58Z,,"Taylor Swift has made a rare political endorsement, telling the world that she will be voting for the Democratic nominee, Vice President Kamala Harris, in the U.S. presidential election. Im voting fo… [+2332 chars]",,en,'Donald Trump'
https://gizmodo.com/taylor-swift-officially-endorses-kamala-harris-after-trumps-debate-meltdown-2000497324,https://gizmodo.com/taylor-swift-officially-endorses-kamala-harris-after-trumps-debate-meltdown-2000497324,0,gizmodo.com,Taylor Swift Officially Endorses Kamala Harris After Trump’s Debate Meltdown,"Swift signed the post as ""Childless Cat Lady,"" a dig at Donald Trump's running mate JD Vance.",https://gizmodo.com/app/uploads/2024/09/Taylor-Swift-at-a-concert-in-England-copy-1.jpeg,2024-09-11T03:29:46Z,https://web.archive.org/web/20240911044945/https://gizmodo.com/taylor-swift-officially-endorses-kamala-harris-after-trumps-debate-meltdown-2000497324,Taylor Swift officially endorsed Kamala Harris for president Tuesday night in an Instagram post after months of speculation. The pop star said she was prompted to make her voting preference known aft… [+4732 chars],,en,'Taylor Swift'
https://www.stereogum.com/2279814/taylor-swift-shares-statement-endorsing-kamala-harris-for-president/news/,https://www.stereogum.com/2279814/taylor-swift-shares-statement-endorsing-kamala-harris-for-president/news/,0,www.stereogum.com,Taylor Swift Endorses Kamala Harris For President,"After years of anticipation and speculation, it has finally happened: Taylor Swift has endorsed a candidate for president of the United States. Late Tuesday night after the first debate between Kamala Harris and Donald Trump, Swift publicly threw her support …",https://static.stereogum.com/uploads/2024/09/GettyImages-2166914755-1726026533-scaled.jpg,2024-09-11T03:59:26Z,https://web.archive.org/web/20240911052212/https://www.stereogum.com/2279814/taylor-swift-shares-statement-endorsing-kamala-harris-for-president/news/,"After months (years?) of anticipation and speculation, it has finally happened: Taylor Swift has endorsed a candidate in the 2024 US presidential race. Late Tuesday night after the first debate betwe… [+3805 chars]",,en,'Taylor Swift'
https://www.euractiv.com/section/migration/news/germanys-border-checks-could-embolden-michel-barniers-tough-on-immigration-stance/,https://www.euractiv.com/section/migration/news/germanys-border-checks-could-embolden-michel-barniers-tough-on-immigration-stance/,0,www.euractiv.com,Germany’s border checks could embolden Michel Barnier’s tough-on-immigration stance,"Germany’s decision on Monday (9 September) to introduce checks at all national border crossings to curb irregular migration may put pressure on France to respond, with President Emmanuel Macron's party seeming in favour of a tougher stance on migration policy.",https://www.euractiv.com/wp-content/uploads/sites/2/2024/09/WhatsApp-Image-2024-09-11-at-7.01.18 AM-800x450.jpeg,2024-09-11T04:30:22Z,https://web.archive.org/web/20240911052220/https://www.euractiv.com/section/migration/news/germanys-border-checks-could-embolden-michel-barniers-tough-on-immigration-stance/,"Germanys decision on Monday (9 September) to introduce checks at all national border crossings to curb irregular migration may pressure France to respond, with President Emmanuel Macron’s party seemi… [+5154 chars]",,en,'Emmanuel Macron'
https://www.counterpunch.org/2024/09/11/black-benedict-arnolds/,https://www.counterpunch.org/2024/09/11/black-benedict-arnolds/,0,www.counterpunch.org,“Defending the Indefensible”,"How can one explain those members of oppressed minority groups who make a profession out of publicly, as George Orwell quipped, “defending the indefensible” and supporting the Republican Party and Donald Trump, against the interests of their own people? On th…",https://www.counterpunch.org/wp-content/uploads/2024/09/visuals-S2wnPueyJx4-unsplash-680x495.jpg,2024-09-11T04:47:52Z,,"Image by Visuals.
How can one explain those members of oppressed minority groups who make a profession out of publicly, as George Orwell quipped, defending the indefensible and supporting the Republ… [+10262 chars]",,en,'Ronna McDaniel'
https://consent.yahoo.com/v2/collectConsent?sessionId=1_cc-session_fc10f6cf-f9e3-4795-b2a3-f5ca344b8f22,https://consent.yahoo.com/v2/collectConsent?sessionId=1_cc-session_fc10f6cf-f9e3-4795-b2a3-f5ca344b8f22,0,consent.yahoo.com,The guy who sold his Miami mansion to Jeff Bezos for $79 million is really angry he didn't charge more for it,,,2024-09-11T07:43:22Z,,"If you click 'Accept all', we and our partners, including 239 who are part of the IAB Transparency &amp; Consent Framework, will also store and/or access information on a device (in other words, use … [+678 chars]",,en,'Jeff Bezos'
https://www.businessinsider.com/jeff-bezo-79-million-mansion-indian-creek-lawsuit-leo-kryss-2024-9,https://www.businessinsider.com/jeff-bezo-79-million-mansion-indian-creek-lawsuit-leo-kryss-2024-9,0,www.businessinsider.com,The guy who sold his Miami mansion to Jeff Bezos for $79 million is really angry he didn't charge more for it,"Jeff Bezos bought a $79 million mansion in Miami last year. Now, the brokerage that sold the home is being sued, reported the Wall Street Journal.",https://i.insider.com/64d6156d005c4a00183ddc12?width=1200&format=jpeg,2024-09-11T07:46:24Z,https://web.archive.org/web/20240911083037/https://www.businessinsider.com/jeff-bezo-79-million-mansion-indian-creek-lawsuit-leo-kryss-2024-9,"The seller of Jeff Bezos' $79 million mansion in Indian Creek, Miami, is suing the real estate brokerage for $6 million for not disclosing Bezos as the buyer.Karwai Tang/WireImage via Getty Images; J… [+3197 chars]",,en,'Jeff Bezos'
https://www.juxtapoz.com/news/magazine/a-new-global-conversation-a-spotlight-on-the-contemporary-art-movement-in-mexico/,https://www.juxtapoz.com/news/magazine/a-new-global-conversation-a-spotlight-on-the-contemporary-art-movement-in-mexico/,0,www.juxtapoz.com,A New Global Conversation: A Spotlight on the Contemporary Art Movement in Mexico,"When did Mexico become one of the world’s hottest art destinations? The Mexican capital, in particular, known for Aztec architecture and storied murals, is thriving in a dynamic creative scene as artists like Perla Krauze, Gonzalo Garcia, and Fernando Laposse…",https://www.juxtapoz.com/media/k2/items/cache/445699d26289ef481ffa9a0eef6c3acc_L.jpg?t=1725825322,2024-09-11T08:40:11Z,https://web.archive.org/web/20240911101029/https://www.juxtapoz.com/news/magazine/a-new-global-conversation-a-spotlight-on-the-contemporary-art-movement-in-mexico/,"When did Mexico become one of the world’s hottest art destinations? The Mexican capital, in particular, known for Aztec architecture and storied murals, is thriving in a dynamic creative scene as art… [+12126 chars]",,en,'nan nan'
https://www.businessinsider.com/mark-zuckerberg-meta-net-worth-wealth-rich-list-musk-bezos-2024-9,https://www.businessinsider.com/mark-zuckerberg-meta-net-worth-wealth-rich-list-musk-bezos-2024-9,0,www.businessinsider.com,Mark Zuckerberg could become the richest person on the planet after a $51 billion wealth surge this year,"Meta CEO Mark Zuckerberg has gained an unmatched $51 billion in net worth this year, and could surpass Elon Musk and Jeff Bezos with a bit of luck.",https://i.insider.com/66e05e3fa0ff598b266622d5?width=1200&format=jpeg,2024-09-11T09:23:47Z,https://web.archive.org/web/20240911093019/https://www.businessinsider.com/mark-zuckerberg-meta-net-worth-wealth-rich-list-musk-bezos-2024-9,"Meta CEO Mark Zuckerberg.Getty
<ul><li>Mark Zuckerberg could become the world's wealthiest person after surging up the rich list.</li><li>The Meta CEO has gained $51 billion this year and recently r… [+3700 chars]",,en,'Jeff Bezos'
https://biztoc.com/x/5974f0a69dc8f6ce,https://biztoc.com/x/5974f0a69dc8f6ce,0,biztoc.com,Democrats Aren't Creating Disorder; They're Preserving It..,"Democrats Aren't Creating Disorder; They're Preserving It...
 
Authored by Jonathan Turley,
In 1968, in the midst of Democratic convention riots, Chicago Mayor Richard Daley famously declared, “The policeman isn’t there to create disorder; the policeman is th…",https://biztoc.com/cdn/5974f0a69dc8f6ce_s.webp,2024-09-11T11:25:12Z,,"Democrats Aren't Creating Disorder; They're Preserving It...
Authored by Jonathan Turley,In 1968, in the midst of Democratic convention riots, Chicago Mayor Richard Daley famously declared, The poli… [+121 chars]",,en,'Jonathan Turley'
https://pitchfork.com/news/how-to-watch-vmas-2024/,https://pitchfork.com/news/how-to-watch-vmas-2024/,0,pitchfork.com,How to Watch the 2024 MTV Video Music Awards,"Taylor Swift, SZA, and Sabrina Carpenter are among the nominees, while Megan Thee Stallion, Chappell Roan, Eminem, Katy Perry, and many more are set to perform during the broadcast","https://media.pitchfork.com/photos/66e08841211609fcd17da190/16:9/w_1280,c_limit/Taylor-Swift-VMAs.jpg",2024-09-11T12:00:00Z,https://web.archive.org/web/20240911132321/https://pitchfork.com/news/how-to-watch-vmas-2024/,"The 2024 MTV Video Music Awards take place tonight (September 11) at UBS Arena on Long Island. The main ceremony broadcasts live on MTV, beginning at 8 p.m. Eastern Daylight Time (5 p.m. Pacific Dayl… [+1668 chars]",,en,'Taylor Swift'
https://www.theatlantic.com/politics/archive/2024/09/taylor-swift-kamala-harris-cats/679781/,https://www.theatlantic.com/politics/archive/2024/09/taylor-swift-kamala-harris-cats/679781/,0,www.theatlantic.com,Taylor Swift’s Three-Word Burn of J. D. Vance,"The pop star and self-described ""childless cat lady"" endorses Kamala Harris.",https://cdn.theatlantic.com/thumbor/5YS30nKmFIk0wXO9xISfXJYDeac=/0x43:2000x1085/1200x625/media/img/mt/2024/09/taylor_endorsement/original.jpg,2024-09-11T12:27:29Z,http://archive.md/20240911123207/https://www.theatlantic.com/politics/archive/2024/09/taylor-swift-kamala-harris-cats/679781/,"The last three words of Taylor Swift’s latest Instagram post were the funniest. After yesterday’s presidential debate, a new picture appeared in her feed, which has 283 million followers. Swift was h… [+7611 chars]",,en,'Kamala Harris'
https://www.cnet.com/tech/services-and-software/how-to-watch-the-2024-mtv-vmas-tonight-without-cable/,https://www.cnet.com/tech/services-and-software/how-to-watch-the-2024-mtv-vmas-tonight-without-cable/,0,www.cnet.com,How to Watch the 2024 MTV VMAs Tonight Without Cable,"This year's lineup of nominees is stacked with artists like Taylor Swift, Beyoncé, Kendrick Lamar and Sabrina Carpenter.",https://www.cnet.com/a/img/resize/1cadbe595a4b51854caebc28a6a6dcee1add7e33/hub/2024/09/10/eb9dde3b-2ec0-4b86-97a6-6a569285c317/eminem-megan-thee-stallion-halle-bailey-mtv-vma-1.jpg?auto=webp&fit=crop&height=675&width=1200,2024-09-11T13:50:36Z,https://web.archive.org/web/20240911135827/https://www.cnet.com/tech/services-and-software/how-to-watch-the-2024-mtv-vmas-tonight-without-cable/,"Fan-fueled and full of guest performers, the 2024 MTV Video Music Awards will be hosted by Megan Thee Stallion and feature an opening performance from Eminem. Both artists have been nominated across … [+2323 chars]",,en,'Sabrina Carpenter'
https://biztoc.com/x/f9065abfc35ee4bb,https://biztoc.com/x/f9065abfc35ee4bb,0,biztoc.com,Turkey's Erdogan Says Russia Must Return Crimea to Ukraine,"Turkish President Recep Tayyip Erdoğan, who in the past has been called a ""dear friend"" by Vladimir Putin, dealt a blow to the Russian leader when he advocated the return of annexed Crimea to Ukraine.
""Our support for Ukraine's territorial integrity, sovereig…",https://biztoc.com/cdn/f9065abfc35ee4bb_s.webp,2024-09-11T14:33:07Z,https://web.archive.org/web/20240911151055/https://biztoc.com/x/f9065abfc35ee4bb,"Turkish President Recep Tayyip Erdoan, who in the past has been called a ""dear friend"" by Vladimir Putin, dealt a blow to the Russian leader when he advocated the return of annexed Crimea to Ukraine.… [+130 chars]",,en,'Recep Tayyip Erdoan'
https://www.businessinsider.com/bill-gates-mackenzie-scott-billionaires-philanthropy-giving-pledge-charity-schmitz-2024-9,https://www.businessinsider.com/bill-gates-mackenzie-scott-billionaires-philanthropy-giving-pledge-charity-schmitz-2024-9,0,www.businessinsider.com,"Bill Gates and other billionaires can learn from MacKenzie Scott's giving, a philanthropy expert says","Billionaire philanthropists may tackle problems that governments won't, but they could give better if they followed MacKenzie Scott's approach.",https://i.insider.com/66e1a5ca5444ffafa7645744?width=1200&format=jpeg,2024-09-11T15:04:33Z,,"Hans Peter Schmitz is a professor at North Carolina State University.Hans Peter Schmitz
<ul><li>Billionaires like Bill Gates wield enormous power and influence in the philanthropic realm.</li><li>Ma… [+5235 chars]",,en,'Bill Gates'
https://qz.com/jeff-bezos-indian-creek-village-home-purchase-lawsuit-1851645719,https://qz.com/jeff-bezos-indian-creek-village-home-purchase-lawsuit-1851645719,0,qz.com,Brazilian mogul sues real estate firm for not telling him Jeff Bezos was buying his home,"A Brazilian businessman who sold his house to Jeff Bezos sued the real estate company that brokered the deal, claiming they lied about the Amazon (AMZN) founder’s involvement.Read more...","https://i.kinja-img.com/image/upload/c_fill,h_675,pg_1,q_80,w_1200/2866ecf4560199d4051ffc812761976e.webp",2024-09-11T15:38:00Z,,"In This Story
A Brazilian businessman who sold his house to Jeff Bezos sued the real estate company that brokered the deal, claiming they lied about the Amazon (AMZN) founders involvement.
Leo Krys… [+1342 chars]",,en,'Jeff Bezos'
https://rlsbb.cc/various-artists-country-pop-2024-2024/,https://rlsbb.cc/various-artists-country-pop-2024-2024/,0,rlsbb.cc,Various Artists - Country Pop 2024 (2024),Tracklist:01. Zach Bryan - Pink Skies02. Dasha - Austin03. Luke Combs - Ain't No Love in Oklahoma (From Twisters The Album)04. Benson Boone - Death Wish Love (From Twisters The Album)05. Bailey Zimmerman - New to Country06. Dan + Shay - Bigger Houses07. Warre…,,2024-09-11T16:26:48Z,,Tracklist:01. Zach Bryan - Pink Skies02. Dasha - Austin03. Luke Combs - Ain't No Love in Oklahoma (From Twisters The Album)04. Benson Boone - Death Wish Love (From Twisters The Album)05. Bailey Zimme… [+1879 chars],,en,'Zach Bryan'
https://petapixel.com/2024/09/11/citing-generative-ai-concerns-taylor-swift-endorses-kamala-harris/,https://petapixel.com/2024/09/11/citing-generative-ai-concerns-taylor-swift-endorses-kamala-harris/,0,petapixel.com,"Citing Generative AI Concerns, Taylor Swift Endorses Kamala Harris","Pop megastar Taylor Swift endorsed Vice President Kamala Harris for President immediately following last night's Presidential Debate on ABC, citing Donald Trump using AI-generated images to falsely claim that Swift had endorsed the former President.
[Read Mor…",https://petapixel.com/assets/uploads/2024/09/swift-harris-endorsement-ai-featured.jpg,2024-09-11T16:27:50Z,https://web.archive.org/web/20240911200646/https://petapixel.com/2024/09/11/citing-generative-ai-concerns-taylor-swift-endorses-kamala-harris/,"Pop megastar Taylor Swift endorsed Vice President Kamala Harris for President immediately following last night’s Presidential Debate on ABC, citing Donald Trump using AI-generated images to falsely c… [+2406 chars]",,en,'Kamala Harris'
https://rlsbb.cc/various-artists-in-my-fall-feels-2024-2024/,https://rlsbb.cc/various-artists-in-my-fall-feels-2024-2024/,0,rlsbb.cc,Various Artists - in my fall feels 2024 (2024),"Tracklist:01. Zach Bryan - Oak Island02. Michael Marcagi - Tear It All Apart03. Coldplay - Sparks04. Vance Joy - Georgia05. Ed Sheeran - The A-Team06. The Smiths - Please, Please, Please, Let Me Get What I Want07. Adam Melchor - Last Time08. The Head And The …",,2024-09-11T16:28:25Z,,"Tracklist:01. Zach Bryan - Oak Island02. Michael Marcagi - Tear It All Apart03. Coldplay - Sparks04. Vance Joy - Georgia05. Ed Sheeran - The A-Team06. The Smiths - Please, Please, Please, Let Me Get … [+1095 chars]",,en,'Zach Bryan'
https://www.vox.com/culture/371396/taylor-swift-kamala-harris-endorsement-democrats-elon-musk,https://www.vox.com/culture/371396/taylor-swift-kamala-harris-endorsement-democrats-elon-musk,0,www.vox.com,Will Taylor Swift’s Kamala Harris endorsement actually matter?,"Taylor Swift, always noted for her flair for dramatic timing, finally endorsed Vice President Kamala Harris in the presidential race Tuesday night.  Moments after the first debate between Harris and former President Donald Trump, Swift posted her endorsement …",https://platform.vox.com/wp-content/uploads/sites/2/2024/09/GettyImages-2166913977.jpg?quality=90&strip=all&crop=0%2C10.736331008928%2C100%2C78.527337982145&w=1200,2024-09-11T18:30:21Z,https://web.archive.org/web/20240911184520/https://www.vox.com/culture/371396/taylor-swift-kamala-harris-endorsement-democrats-elon-musk,"Taylor Swift, always noted for her flair for dramatic timing, finally endorsed Vice President Kamala Harris in the presidential race Tuesday night. 
Moments after the first debate between Harris and… [+11384 chars]",,en,'Kamala Harris'
https://rlsbb.cc/various-artists-slow-and-sweet-fall-mornings-2024/,https://rlsbb.cc/various-artists-slow-and-sweet-fall-mornings-2024/,0,rlsbb.cc,Various Artists - slow and sweet fall mornings (2024),Tracklist:01. Vance Joy - Georgia02. Coldplay - Sparks03. Zach Bryan - Better Days (feat. John Mayer)04. Michael Marcagi - Scared to Start05. Rachel Chinouriri - Robbed06. Love - Always See Your Face07. Bonnie Raitt - Thank You08. The Head And The Heart - Hon…,,2024-09-11T19:50:09Z,,Tracklist:01. Vance Joy - Georgia02. Coldplay - Sparks03. Zach Bryan - Better Days (feat. John Mayer)04. Michael Marcagi - Scared to Start05. Rachel Chinouriri - Robbed06. Love - Always See Your Face… [+1078 chars],,en,'Zach Bryan'
https://arstechnica.com/ai/2024/09/taylor-swift-cites-ai-deepfakes-in-endorsement-for-kamala-harris/,https://arstechnica.com/ai/2024/09/taylor-swift-cites-ai-deepfakes-in-endorsement-for-kamala-harris/,0,arstechnica.com,Taylor Swift cites AI deepfakes in endorsement for Kamala Harris,"Taylor Swift on AI: ""The simplest way to combat misinformation is with the truth.""",https://cdn.arstechnica.net/wp-content/uploads/2024/09/taylor_screenshot_2-760x380.jpg,2024-09-11T19:56:30Z,https://web.archive.org/web/20240911200029/https://arstechnica.com/ai/2024/09/taylor-swift-cites-ai-deepfakes-in-endorsement-for-kamala-harris/,"Enlarge/ A screenshot of Taylor Swift's Kamala Harris Instagram post, captured on September 11, 2024.
30
On Tuesday night, Taylor Swift endorsed Vice President Kamala Harris for US President on Ins… [+1273 chars]",,en,'Taylor Swift'
