index,url,valid,domain,title,description,image,published,archive,content,quote,language,keyword
https://bleedingcool.com/tv/76th-emmy-awards-bleeding-cools-viewing-guide-to-tonights-ceremony/,https://bleedingcool.com/tv/76th-emmy-awards-bleeding-cools-viewing-guide-to-tonights-ceremony/,0,bleedingcool.com,76th Emmy Awards: Bleeding Cool's Viewing Guide to Tonight's Ceremony,Will FX Networks continue its awards season drama and comedy dominance with Shōgun and The Bear? Could we be looking at some surprising upsets? Who will walk away with the best acceptance speech – and what unexpected moment will be be posting about on social …,https://bleedingcool.com/wp-content/uploads/2024/09/EMY_S2024_KA_4000x2250_v1-1_PRE-2000x1125.jpg,2024-09-15T22:07:08Z,https://web.archive.org/web/20240915224954/https://bleedingcool.com/tv/76th-emmy-awards-bleeding-cools-viewing-guide-to-tonights-ceremony/,"Posted in: ABC, Hulu, TV | Tagged: emmy awards, Emmys
Check out Bleeding Cool's guide to what you need to know about tonight's 76th Emmy Awards, hosted by Eugene Levy &amp; Dan Levy (Schitt's Creek)… [+9475 chars]",,en,'Jon Hamm'
https://science.slashdot.org/story/24/09/15/2220209/stephen-hawking-was-wrong---extremal-black-holes-are-possible,https://science.slashdot.org/story/24/09/15/2220209/stephen-hawking-was-wrong---extremal-black-holes-are-possible,0,science.slashdot.org,Stephen Hawking Was Wrong - Extremal Black Holes Are Possible,"""Even black holes have edge cases,"" writes Astronomy magazine contributing editor Steve Nadis, in an article in Quanta magazine (republished today by Wired):


Black holes rotate in space. As matter falls into them, they start to spin faster; if that matter h…",https://a.fsdn.com/sd/topics/space_64.png,2024-09-15T22:23:00Z,http://archive.md/20240916000931/https://science.slashdot.org/story/24/09/15/2220209/stephen-hawking-was-wrong---extremal-black-holes-are-possible,"""Even black holes have edge cases,"" writes Astronomy magazine contributing editor Steve Nadis, in an article in Quanta magazine (republished today by Wired):
Black holes rotate in space. As matter f… [+3666 chars]",,en,'Stephen Hawking'
https://www.today.com/popculture/awards/henry-winkler-ron-howard-happy-days-reunion-emmys-2024-rcna171233,https://www.today.com/popculture/awards/henry-winkler-ron-howard-happy-days-reunion-emmys-2024-rcna171233,0,www.today.com,Henry Winkler and Ron Howard have a ‘Happy Days’ reunion at the Emmys,"It was a ""Happy Days"" reunion at the 2024 Emmys. Inside the moment. Here's a recap of the reunion and moment.","https://media-cldnry.s-nbcnews.com/image/upload/t_social_share_1200x630_center,f_auto,q_auto:best/rockcms/2024-09/ron-howard-henry-winkler-happy-days-mc-240915-02-ab4a46.jpg",2024-09-16T02:04:02Z,https://web.archive.org/web/20240916041935/https://www.today.com/popculture/awards/henry-winkler-ron-howard-happy-days-reunion-emmys-2024-rcna171233,"It was a ""Happy Days"" reunion at the 2024 Emmys. 
Henry Winkler and Ron Howard took the stage at the Sept. 15 awards ceremony, stepping into a re-creation of their beloved set to celebrate the show'… [+1279 chars]",,en,'Ron Howard'
https://www.businessinsider.com/larry-page-family-office-koop-ceo-wayne-osborne-wealth-management-2024-9,https://www.businessinsider.com/larry-page-family-office-koop-ceo-wayne-osborne-wealth-management-2024-9,0,www.businessinsider.com,Meet the enigmatic manager who oversees Larry Page's Google fortune,"Wayne Osborne manages the money of Google founder Larry Page, the world's sixth-richest man. He's looking to expand.",https://i.insider.com/66c8c7e41aa2ac29ee33c4a9?width=1200&format=jpeg,2024-09-16T09:23:02Z,http://archive.md/20240916104050/https://www.businessinsider.com/larry-page-family-office-koop-ceo-wayne-osborne-wealth-management-2024-9,"Wayne Osborne (left) has overseen Larry Page's life and finances since 2012, as head of the Google founder's family fund.Dre Waltizer; Jeff Chiu/AP Photo; Google; Getty Images; Alyssa Powell/BI
In 2… [+20194 chars]",,en,'Larry Page'
https://rlsbb.cc/various-artists-country-music-2024-2/,https://rlsbb.cc/various-artists-country-music-2024-2/,0,rlsbb.cc,Various Artists - COUNTRY MUSIC (2024),Tracklist:01. Dasha - Austin02. Zach Bryan - Pink Skies03. Luke Combs - Ain't No Love in Oklahoma (From Twisters The Album)04. Redferrin - Just like Johnny05. Dan + Shay - Bigger Houses06. Bailey Zimmerman - Hell or High Water (From Twisters The Album)07. Meg…,,2024-09-16T09:27:44Z,,Tracklist:01. Dasha - Austin02. Zach Bryan - Pink Skies03. Luke Combs - Ain't No Love in Oklahoma (From Twisters The Album)04. Redferrin - Just like Johnny05. Dan + Shay - Bigger Houses06. Bailey Zim… [+1717 chars],,en,'Zach Bryan'
https://rlsbb.cc/various-artists-country-mornin-coffee-2024/,https://rlsbb.cc/various-artists-country-mornin-coffee-2024/,0,rlsbb.cc,Various Artists - Country Mornin Coffee (2024),Tracklist:01. Michael Marcagi - Scared to Start02. Zach Bryan - Pink Skies03. Luke Combs - Ain't No Love in Oklahoma (From Twisters The Album)04. Sam Barber - Dancing in the Sky05. Avery Anna - Worst in Me06. The Castellows - Cowboy Kind of Love07. Warren Zei…,,2024-09-16T09:27:44Z,,Tracklist:01. Michael Marcagi - Scared to Start02. Zach Bryan - Pink Skies03. Luke Combs - Ain't No Love in Oklahoma (From Twisters The Album)04. Sam Barber - Dancing in the Sky05. Avery Anna - Worst… [+1003 chars],,en,'Zach Bryan'
https://rlsbb.cc/various-artists-virale-country-2024/,https://rlsbb.cc/various-artists-virale-country-2024/,0,rlsbb.cc,Various Artists - Virale country (2024),Tracklist:01. Zach Bryan - Pink Skies (feat. Watchhouse)02. Dasha - Austin03. Luke Combs - Ain't No Love in Oklahoma (From Twisters The Album)04. Bailey Zimmerman - Hell or High Water (From Twisters The Album)05. Warren Zeiders - Heartbreaker06. Dan + Shay - …,,2024-09-16T09:27:44Z,,Tracklist:01. Zach Bryan - Pink Skies (feat. Watchhouse)02. Dasha - Austin03. Luke Combs - Ain't No Love in Oklahoma (From Twisters The Album)04. Bailey Zimmerman - Hell or High Water (From Twisters … [+925 chars],,en,'Zach Bryan'
https://www.androidheadlines.com/2024/09/sergey-brin-is-back-at-google-working-on-ai.html,https://www.androidheadlines.com/2024/09/sergey-brin-is-back-at-google-working-on-ai.html,0,www.androidheadlines.com,"Sergey Brin is back at Google, working on AI","We know Sundar Pichai as the man in charge at Google today, but there were several people who led the company back in the day. One of those people was",https://www.androidheadlines.com/wp-content/uploads/2024/09/Sergey-Brin.jpg,2024-09-16T12:08:11Z,https://web.archive.org/web/20240916195639/https://www.androidheadlines.com/2024/09/sergey-brin-is-back-at-google-working-on-ai.html,"We know Sundar Pichai as the man in charge at Google today, but there were several people who led the company back in the day. One of those people was Sergey Brin, one of the co-founders of the compa… [+1917 chars]",,en,'Sundar Pichai'
https://www.coindesk.com/policy/2024/09/16/sen-elizabeth-warrens-pro-crypto-opponent-john-deaton-has-a-plan-to-beat-her/,https://www.coindesk.com/policy/2024/09/16/sen-elizabeth-warrens-pro-crypto-opponent-john-deaton-has-a-plan-to-beat-her/,0,www.coindesk.com,"Sen. Elizabeth Warren's Pro-Crypto Opponent, John Deaton, Has a Plan to Beat Her","Defeating U.S. Sen. Elizabeth Warren (D-Mass.), a national hero in progressive circles, seems a stretch for a relatively little-known Republican in the liberal bastion of Massachusetts. But candidate John Deaton, known among crypto fans for his legal advocacy…",https://www.coindesk.com/resizer/XYUUrGLBHQ5kq1swxDQtn0F7m34=/1200x628/center/middle/cloudfront-us-east-1.images.arcpublishing.com/coindesk/UM5VLMDJGREW7C2IRXDSQGX5KY.jpg,2024-09-16T13:00:00Z,https://web.archive.org/web/20240916133544/https://www.coindesk.com/policy/2024/09/16/sen-elizabeth-warrens-pro-crypto-opponent-john-deaton-has-a-plan-to-beat-her/,"Please note that ourprivacy policy,terms of use,cookies, anddo not sell my personal informationhas been updated.
CoinDesk is anaward-winningmedia outlet that covers the cryptocurrency industry. Its … [+593 chars]",,en,'Elizabeth Warren'
https://www.cinemablend.com/television/selena-gomez-shared-sweet-footage-her-niece-celebrating-emmy-night,https://www.cinemablend.com/television/selena-gomez-shared-sweet-footage-her-niece-celebrating-emmy-night,0,www.cinemablend.com,‘Tia’ Selena Gomez Shared Sweet Footage Of Her Niece Celebrating Her Emmy Night,This is pure joy.,https://cdn.mos.cms.futurecdn.net/hSNfb2iuwzjSW33c6tMvsX-1200-80.png,2024-09-16T15:29:10Z,https://web.archive.org/web/20240916180648/https://www.cinemablend.com/television/selena-gomez-shared-sweet-footage-her-niece-celebrating-emmy-night,"Sunday was a big night for many stars of the small screen — especially for the casts of some of the 2024 Emmy Awards’ big winners
 like The Bear, Shōgun and Baby Reindeer. Even for many of the cele… [+3074 chars]",,en,'Selena Gomez'
http://wwd.com/pop-culture/celebrity-news/emmy-awards-2024-after-parties-looks-1236618623/,http://wwd.com/pop-culture/celebrity-news/emmy-awards-2024-after-parties-looks-1236618623/,0,wwd.com,"Emmy Awards After Parties: Kristen Wiig Adds Sparkles to Sheer Dress, Quinta Brunson Goes Green and More Looks From Disney, Apple TV+, HBO + Max Receptions","Emmy Awards 2024 after parties included looks from Kristen Wiig, Quinta Brunson and more stars after the awards ceremony on Sunday.",https://wwd.com/wp-content/uploads/2024/09/emmys-after-parties-fi.jpg?w=1000&h=563&crop=1,2024-09-16T17:30:00Z,https://web.archive.org/web/20240916185543/https://wwd.com/pop-culture/celebrity-news/emmy-awards-2024-after-parties-looks-1236618623/,"After the 2024 Emmy Awards, several celebrities attended various after parties around Los Angeles on Sunday. Kristen Wiig and Quinta Brunson were just a few of the stars who were seen on the red carp… [+1846 chars]",,en,'Kristen Wiig'
https://www.benzinga.com/startups/24/09/40882577/mark-zuckerbergs-wealth-skyrockets-by-51-billion-this-year-putting-him-on-track-to-claim-the-title-o,https://www.benzinga.com/startups/24/09/40882577/mark-zuckerbergs-wealth-skyrockets-by-51-billion-this-year-putting-him-on-track-to-claim-the-title-o,0,www.benzinga.com,"Mark Zuckerberg's Wealth Skyrockets by $51 Billion This Year, Putting Him on Track to Claim the Title of Richest Person on Earth",,https://cdn.benzinga.com/files/images/story/2024/09/16/What-Happened-_0.jpeg?width=1200&height=800&fit=crop,2024-09-16T18:17:16Z,https://web.archive.org/web/20240916180552/https://www.benzinga.com/startups/24/09/40882577/mark-zuckerbergs-wealth-skyrockets-by-51-billion-this-year-putting-him-on-track-to-claim-the-title-o,"Mark Zuckerberg, Meta Platforms’ CEO, has added a jaw-dropping $51 billion to his fortune this year, bringing his total net worth to $179 billion, according to the Bloomberg Billionaires Index. This … [+3369 chars]",,en,'Mark Zuckerberg'
https://qz.com/larry-ellison-jeff-bezos-second-richest-person-world-1851649359,https://qz.com/larry-ellison-jeff-bezos-second-richest-person-world-1851649359,0,qz.com,Oracle's Larry Ellison has dethroned Jeff Bezos as the world's second-richest person,"The artificial intelligence boom has sent Oracle (ORCL) co-founder Larry Ellison’s net worth past that of Jeff Bezos, making him the new second-richest person in the world.Read more...","https://i.kinja-img.com/image/upload/c_fill,h_675,pg_1,q_80,w_1200/45c0489fbe000a6a6b6516ad3b8b7428.jpg",2024-09-16T19:52:00Z,https://web.archive.org/web/20240916201521/https://qz.com/larry-ellison-jeff-bezos-second-richest-person-world-1851649359,"In This Story
The artificial intelligence boom has sent Oracle (ORCL) co-founder Larry Ellisons net worth past that of Jeff Bezos, making him the new second-richest person in the world.
The Oracle … [+1806 chars]",,en,'Jeff Bezos'
https://extratv.com/2024/09/16/emmys-2024-fashion-jennifer-aniston-selena-gomez-and-more-stars-shine/,https://extratv.com/2024/09/16/emmys-2024-fashion-jennifer-aniston-selena-gomez-and-more-stars-shine/,0,extratv.com,"Emmys 2024 Fashion: Jennifer Aniston, Selena Gomez & More Stars Shine","“Extra’s” Adam Glassman and Terri Seymour are breaking down the hottest looks on the 2024 Emmys red carpet!
 When it comes to trends, black was a top pick, from Reese Witherspoon in Dior with gold floral detailing to Laura Dern in an off-the-shoulder Gabriela…",https://extra-images.akamaized.net/image/96/16by9/2024/09/16/96ca5e6c2d904ceeb42bc4b601fb4caf_xl.jpg,2024-09-16T21:09:30Z,https://web.archive.org/web/20240917042955/https://extratv.com/2024/09/16/emmys-2024-fashion-jennifer-aniston-selena-gomez-and-more-stars-shine/,"“Extra’s” Adam Glassman and Terri Seymour are breaking down the hottest looks on the 2024 Emmys red carpet!
 When it comes to trends, black was a top pick, from Reese Witherspoon in Dior with gold fl… [+1079 chars]",,en,'Selena Gomez'
https://oilprice.com/Energy/Energy-General/Aramcos-New-Deals-With-China-Signal-A-Further-Deepening-Of-Sino-Saudi-Relations.html,https://oilprice.com/Energy/Energy-General/Aramcos-New-Deals-With-China-Signal-A-Further-Deepening-Of-Sino-Saudi-Relations.html,0,oilprice.com,Aramco’s New Deals With China Signal A Further Deepening Of Sino-Saudi Relations,"A little under a year before the Russian invasion of February 2022, Saudi Aramco’s chief executive officer, Amin Nasser, had spent several days at the annual China Development Forum hosted in Beijing, during which time he stated: “Ensuring the continuing secu…",https://d32r1sh890xpii.cloudfront.net/article/718x300/2024-09-16_lkeqcsr59t.jpg,2024-09-16T22:00:00Z,https://web.archive.org/web/20240917010104/https://oilprice.com/Energy/Energy-General/Aramcos-New-Deals-With-China-Signal-A-Further-Deepening-Of-Sino-Saudi-Relations.html,"Former President Donald Trump has…
Volkswagen scraps a three-decade-old job…
A large amount of Libyan…
By Simon Watkins - Sep 16, 2024, 5:00 PM CDT
A little under a year before the Russian invasi… [+8775 chars]",,en,'Amin Nasser'
https://www.businessinsider.com/larry-ellison-oracle-wealth-tesla-stock-billionaires-rich-list-ai-2024-9,https://www.businessinsider.com/larry-ellison-oracle-wealth-tesla-stock-billionaires-rich-list-ai-2024-9,0,www.businessinsider.com,Oracle's Larry Ellison is now the world's 4th-richest person after a $57 billion wealth surge this year,"Larry Ellison has overtaken LVMH's Bernard Arnault, Microsoft's Bill Gates and Steve Ballmer, and Google's Larry Page in wealth gains this year.",https://i.insider.com/66e94f57d17aa3c7b2b33ae2?width=1200&format=jpeg,2024-09-17T10:22:32Z,http://archive.md/20240918064930/https://www.businessinsider.com/larry-ellison-oracle-wealth-tesla-stock-billionaires-rich-list-ai-2024-9,"Larry Ellison also owns a stake in Tesla worth about $10 billion.Justin Sullivan/Getty Images
<ul><li>Larry Ellison surged past LVMH chief Bernard Arnault to become the world's fourth-richest person… [+2190 chars]",,en,'Larry Page'
https://www.newsweek.com/king-charles-surprising-reaction-prince-andrew-interview-revealed-1954894,https://www.newsweek.com/king-charles-surprising-reaction-prince-andrew-interview-revealed-1954894,0,www.newsweek.com,King Charles' Surprising Reaction to Prince Andrew Interview Revealed,Emily Maitlis has revealed how she was told King Charles reacted to his brother's car crash interview over his friendship with Epstein.,https://d.newsweek.com/en/full/2473108/king-charles-prince-andrew-emily-maitlis.png,2024-09-17T10:34:40Z,https://web.archive.org/web/20240917113814/https://www.newsweek.com/king-charles-surprising-reaction-prince-andrew-interview-revealed-1954894,"The journalist who conducted Prince Andrew's car crash BBC Newsnight interview in 2019 has discussed how King Charles reacted to the PR crisis that ended his brother's royal career, ahead of the rele… [+5172 chars]",,en,'King Charles'
https://theplaylist.net/transformers-one-final-trailer-chris-hemsworth-brian-tyree-henry-lead-the-all-star-cast-in-this-animated-action-film-20240917/,https://theplaylist.net/transformers-one-final-trailer-chris-hemsworth-brian-tyree-henry-lead-the-all-star-cast-in-this-animated-action-film-20240917/,0,theplaylist.net,‘Transformers One’ Final Trailer: Chris Hemsworth & Brian Tyree Henry Lead The All-Star Cast In This Animated Action Film,"We are only a few days away from the release of “Transformers One,” but the marketing machine is still chugging along. Now, we have the “final” trailer to tease us one last time before the film arrives in theaters.
READ MORE: 2024 Fall Film Preview: 50 Movies…",https://cdn.theplaylist.net/wp-content/uploads/2024/09/17092521/transformers-one.jpg,2024-09-17T13:26:12Z,https://web.archive.org/web/20240917151551/https://theplaylist.net/transformers-one-final-trailer-chris-hemsworth-brian-tyree-henry-lead-the-all-star-cast-in-this-animated-action-film-20240917/,"We are only a few days away from the release of Transformers One, but the marketing machine is still chugging along. Now, we have the final trailer to tease us one last time before the film arrives i… [+1554 chars]",,en,'Chris Hemsworth'
https://www.foxsports.com/stories/nfl/qb-stock-market-week-3-kyler-murray-back-has-sam-darnold-arrived,https://www.foxsports.com/stories/nfl/qb-stock-market-week-3-kyler-murray-back-has-sam-darnold-arrived,0,www.foxsports.com,QB Stock Market Week 3: Kyler Murray is back. Has Sam Darnold arrived?,"A handful of veterans are making the most of second chances, while more than a few recent top picks are struggling. Here is Henry McKenna's latest starting QB rankings.",https://a57.foxsports.com/statics.foxsports.com/www.foxsports.com/content/uploads/2024/09/1408/814/nfl-qbstockwatch-9x16-1.png?ve=1&tl=1,2024-09-17T14:07:58Z,https://web.archive.org/web/20240917234928/https://www.foxsports.com/stories/nfl/qb-stock-market-week-3-kyler-murray-back-has-sam-darnold-arrived,"It was a much better week for quarterbacks.
We can be honest about Week 1: It was widely unimpressive from the league's passers. There's no coincidence that Josh Allen topped this list with a pair o… [+11348 chars]",,en,'Sam H'
https://nypost.com/2024/09/17/business/oracles-larry-ellison-becomes-worlds-third-richest-person/,https://nypost.com/2024/09/17/business/oracles-larry-ellison-becomes-worlds-third-richest-person/,0,nypost.com,"Oracle’s Larry Ellison beats Zuckerberg, Arnault to become world’s third-richest person","Earlier on Tuesday, Ellison briefly beat out Amazon’s Jeff Bezos before dipping back down to second.",https://nypost.com/wp-content/uploads/sites/2/2024/09/newspress-collage-aavk7zc29-1726589919400.jpg?quality=75&strip=all&1726575545&w=1024,2024-09-17T16:19:19Z,https://web.archive.org/web/20240917201423/https://nypost.com/2024/09/17/business/oracles-larry-ellison-becomes-worlds-third-richest-person/,"Oracle co-founder Larry Ellison became the third richest person in the world on Tuesday with a net worth of $203.9 billion, according to Forbes, surpassing Mark Zuckerberg and Bernard Arnault.
Earli… [+2527 chars]",,en,'Jeff Bezos'
https://www.forbes.com/sites/maryroeloffs/2024/09/17/harris-and-trumps-biggest-celebrity-endorsements-billie-eilish-nicky-jam-and-more/,https://www.forbes.com/sites/maryroeloffs/2024/09/17/harris-and-trumps-biggest-celebrity-endorsements-billie-eilish-nicky-jam-and-more/,0,www.forbes.com,"Harris And Trump’s Biggest Celebrity Endorsements: Billie Eilish, Nicky Jam And More",Billie and Finneas Eilish endorsed Kamala Harris on Tuesday.,"https://imageio.forbes.com/specials-images/imageserve/66e9adfdbbfbe08b3ff97c38/0x0.jpg?format=jpg&crop=3915,2203,x0,y0,safe&height=900&width=1600&fit=bounds",2024-09-17T16:32:03Z,https://web.archive.org/web/20240917163937/https://www.forbes.com/sites/maryroeloffs/2024/09/17/harris-and-trumps-biggest-celebrity-endorsements-billie-eilish-nicky-jam-and-more/,"Celebrity voices have entered the 2024 presidential race in a variety of ways in recent weeks, and some of the biggest names in politics and in Hollywood have lent their voices to a particular candid… [+8645 chars]",,en,'Billie Eilish'
https://variety.com/2024/music/news/billie-eilish-endorses-kamala-harris-president-1236147555/,https://variety.com/2024/music/news/billie-eilish-endorses-kamala-harris-president-1236147555/,0,variety.com,"Billie Eilish and Finneas Endorse Kamala Harris for President Because ‘We Can’t Let Extremists Control Our Lives, Our Freedoms and Our Future’","Billie Eilish and Finneas have officially endorsed Kamala Harris for president over Donald Trump. In a joint video post on Instagram, the Grammy and Oscar-winning duo celebrated National Voter Registration Day by encouraging their followers to vote early and …",https://variety.com/wp-content/uploads/2024/09/GettyImages-2066791992-e1726590814648.jpg?w=1000&h=563&crop=1,2024-09-17T16:42:35Z,http://archive.md/20240918191059/https://variety.com/2024/music/news/billie-eilish-endorses-kamala-harris-president-1236147555/,"Billie Eilish and Finneas have officially endorsed Kamala Harris for president over Donald Trump. In a joint video post on Instagram, the Grammy and Oscar-winning duo celebrated National Voter Regist… [+1900 chars]",,en,'Billie Eilish'
http://www.billboard.com/culture/politics/billie-eilish-finneas-endorse-kamala-harris-slam-project-2025-1235777468/,http://www.billboard.com/culture/politics/billie-eilish-finneas-endorse-kamala-harris-slam-project-2025-1235777468/,0,www.billboard.com,"Billie Eilish & Finneas Endorse Kamala Harris, Slam Project 2025","Billie Eilish and Finneas have endorsed Kamala Harris, slammed Project 2025 and urged fans to vote on National Registration Day. Get the details.",https://www.billboard.com/wp-content/uploads/2023/07/FINNEAS-and-Billie-Eilish-2023-met-gala-billboard-1548.jpg?w=1024,2024-09-17T16:43:04Z,http://archive.md/20240917202219/https://www.billboard.com/culture/politics/billie-eilish-finneas-endorse-kamala-harris-slam-project-2025-1235777468/,"This year, Billie Eilish and Finneas are voting the color of the final track on their May album, Hit Me Hard and Soft: blue. In honor of National Voter Registration Day, the sister-brother musical te… [+2257 chars]",,en,'Billie Eilish'
http://www.rollingstone.com/music/music-news/billie-eilish-finneas-harris-walz-endorsement-1235104330/,http://www.rollingstone.com/music/music-news/billie-eilish-finneas-harris-walz-endorsement-1235104330/,0,www.rollingstone.com,"Billie Eilish, Finneas Endorse Harris-Walz: ‘Vote Like Your Life Depends on It’",Billie Eilish and Finneas have endorsed Kamala Harris and Tim Walz for the 2024 presidential election.,https://www.rollingstone.com/wp-content/uploads/2024/09/finneas-billie-kamala.jpg?crop=0px%2C33px%2C1798px%2C1015px&resize=1600%2C900,2024-09-17T16:58:26Z,,"Billie Eilish and Finneas have endorsed Kamala Harris and Tim Walz for the 2024 presidential election.
The Oscar-Award-winning musicians and siblings posted a reel to Instagram on Tuesday — National… [+1298 chars]",,en,'Billie Eilish'
https://www.tmz.com/2024/09/17/billie-eilish-endorses-kamala-harris/,https://www.tmz.com/2024/09/17/billie-eilish-endorses-kamala-harris/,0,www.tmz.com,Billie Eilish Follows in Taylor Swift's Footsteps & Endorses Kamala Harris,"Taylor Swift and Billie Eilish are ""Birds of a Feather"" when it comes to their election plans ... as the 22-year-old singer is voicing her support for Kamala Harris. The pop star took to Instagram alongside brother and music producer Finneas…
 Permalink",https://imagez.tmz.com/image/a5/16by9/2024/09/17/a5674c536e1d4d80a371d8fc7de2b0f6_xl.jpg,2024-09-17T17:11:18Z,,"Taylor Swift and Billie Eilish are ""Birds of a Feather"" when it comes to their election plans ... as the 22-year-old singer is voicing her support for Kamala Harris.
The pop star took to Instagram a… [+1796 chars]",,en,'Billie Eilish'
http://deadline.com/2024/09/billie-eilish-endorses-kamala-harris-1236091862/,http://deadline.com/2024/09/billie-eilish-endorses-kamala-harris-1236091862/,0,deadline.com,Billie Eilish And Finneas Endorse Kamala Harris In Video Urging Voter Registration,"Billie Eilish and Finneas endorsed Kamala Harris in a social media video urging their followers to sign up to register to vote. “We are voting for Kamala Harris and Tim Walz because they are fighting to protect our reproductive freedom, our planet and our dem…",https://deadline.com/wp-content/uploads/2024/05/GettyImages-2074893116.jpg?w=1024,2024-09-17T17:27:33Z,http://archive.md/20240918190417/https://deadline.com/2024/09/billie-eilish-endorses-kamala-harris-1236091862/,"Billie Eilish and Finneas endorsed Kamala Harris in a social media video urging their followers to sign up to register to vote.
“We are voting for Kamala Harris and Tim Walz because they are fightin… [+889 chars]",,en,'Billie Eilish'
https://www.huffpost.com/entry/billie-eilish-finneas-endorse-kamala-harris-for-president_n_66e9ae85e4b06998fbed3bf2,https://www.huffpost.com/entry/billie-eilish-finneas-endorse-kamala-harris-for-president_n_66e9ae85e4b06998fbed3bf2,0,www.huffpost.com,Billie Eilish And Finneas Endorse Kamala Harris For President,"""Vote like your life depends on it because it does,"" the pop artist said alongside her brother in a video shared on social media.",https://img.huffingtonpost.com/asset/66e9b1ee220000fa0080abba.jpeg?cache=EMlQT1xoB7&ops=1200_630,2024-09-17T17:32:40Z,http://archive.md/20240918190620/https://www.huffpost.com/entry/billie-eilish-finneas-endorse-kamala-harris-for-president_n_66e9ae85e4b06998fbed3bf2,"On Tuesday, Billie Eilish and her brother, Finneas, endorsed Kamala Harris for president in a video posted on Eilishs social media urging people to register to vote.
We are voting for Kamala Harris … [+2712 chars]",,en,'Kamala Harris'
