index,url,valid,domain,title,description,image,published,archive,content,quote,language,keyword
https://www.breitbart.com/sports/2024/05/07/nikki-glaser-reveals-what-comedians-could-not-say-during-tom-brady-roast/,https://www.breitbart.com/sports/2024/05/07/nikki-glaser-reveals-what-comedians-could-not-say-during-tom-brady-roast/,0,www.breitbart.com,Nikki Glaser Reveals What Comedians Could Not Say During Tom Brady Roast,"Comedienne Nikki Glaser has revealed what comedians could and could not say during the Netflix Roast of Tom Brady special. 
The post Nikki Glaser Reveals What Comedians Could Not Say During Tom Brady Roast appeared first on Breitbart.",https://media.breitbart.com/media/2024/05/nikki-glaser-netflix-roast-tom-brady-640x335.jpg,2024-05-07T14:26:21Z,,"Comedienne Nikki Glaser has revealed what comedians could and could not say during the Netflix Roast of Tom Brady special.
Speaking with Howard Stern on Monday’s Sirus XM show, Glaser said that they… [+3522 chars]",,en,'Tom Brady'
https://www.nbcsports.com/nfl/profootballtalk/rumor-mill/news/yes-there-were-off-limits-topics-in-the-supposedly-no-holds-barred-tom-brady-roast,https://www.nbcsports.com/nfl/profootballtalk/rumor-mill/news/yes-there-were-off-limits-topics-in-the-supposedly-no-holds-barred-tom-brady-roast,0,www.nbcsports.com,"Yes, there were off-limits topics in the supposedly no-holds-barred Tom Brady roast","If the goal was to generate maximum attention, the Tom Brady roast has been a success.",https://nbcsports.brightspotcdn.com/dims4/default/ec68b10/2147483647/strip/true/crop/5304x2984+0+276/resize/1440x810!/quality/90/?url=https%3A%2F%2Fnbc-sports-production-nbc-sports.s3.us-east-1.amazonaws.com%2Fbrightspot%2Fab%2F8e%2Fd1bf961345c9854c3919ab6c41f3%2Fhttps-delivery-gettyimages.com%2Fdownloads%2F2151653448,2024-05-07T14:30:01Z,,"If the goal was to generate maximum attention, the Tom Brady roast has been a success.
After the three-hour (two hours too long) live event on Sunday night, plenty of people have reacted to the cont… [+2399 chars]",,en,'Tom Brady'
https://www.marca.com/en/nfl/2024/05/07/663a3479ca4741182b8b45a6.html,https://www.marca.com/en/nfl/2024/05/07/663a3479ca4741182b8b45a6.html,0,www.marca.com,Gisele Bundchen frustrated on Netflix roast about marriage with Tom Brady,Supermodel Gisele Bundchen has voiced her displeasure regarding the jokes targeting her previous marriage to Tom Brady during a Netflix special dedicated to roasting the former NFL,https://phantom-marca.unidadeditorial.es/55f63ac72b971a9e847eee09039a6719/resize/1200/f/webp/assets/multimedia/imagenes/2023/09/26/16957305232712.png,2024-05-07T14:39:52Z,,Supermodel Gisele Bundchen has voiced her displeasure regarding the jokes targeting her previous marriage to Tom Brady during a Netflix special dedicated to roasting the former NFL quarterback. The e… [+1664 chars],,en,'Tom Brady'
https://extratv.com/2024/05/07/gisele-bundchen-disappointed-after-irresponsible-tom-brady-roast-report/,https://extratv.com/2024/05/07/gisele-bundchen-disappointed-after-irresponsible-tom-brady-roast-report/,0,extratv.com,Gisele Bündchen ‘Disappointed’ After ‘Irresponsible’ Tom Brady Roast (Report),"Tom Brady’s ex-wife Gisele Bündchen is not happy about his Netflix roast, People magazine reports.
 A source tells the magazine that the model is ""deeply disappointed by the disrespectful portrayal of her family on Sunday evening's roast show.""
 The insider c…",https://extra-images.akamaized.net/image/a7/16by9/2024/05/07/a753c6b3ae504b1db84fed50b6a62101_xl.jpg,2024-05-07T14:57:36Z,,"Tom Bradys ex-wife Gisele Bündchen is not happy about his Netflix roast, People magazine reports.
A source tells the magazine that the model is ""deeply disappointed by the disrespectful portrayal of… [+3205 chars]",,en,'Tom Brady'
https://www.nbcnews.com/pop-culture/pop-culture-news/nikki-glaser-reveals-topic-team-collectively-chose-skip-tom-bradys-roa-rcna151043,https://www.nbcnews.com/pop-culture/pop-culture-news/nikki-glaser-reveals-topic-team-collectively-chose-skip-tom-bradys-roa-rcna151043,0,www.nbcnews.com,Nikki Glaser reveals the topic the team ‘collectively’ chose to skip at Tom Brady’s roast,Nikki Glaser has garnered some rave reviews for her performance on Netflix’s “The Roast of Tom Brady.”,"https://media-cldnry.s-nbcnews.com/image/upload/t_nbcnews-fp-1200-630,f_auto,q_auto:best/rockcms/2024-05/240507-Nikki-Glaser-tom-brady-al-1055-6ca848.jpg",2024-05-07T15:01:52Z,,Nikki Glaser has garnered some rave reviews for her performance on Netflixs The Roast of Tom Brady. And while Glaser and all the other acts went all in on poking fun at the seven-time Super Bowl winn… [+2686 chars],,en,'Tom Brady'
https://www.cbsnews.com/news/tom-brady-roast-aaron-hernandez-fiancee-shayanna-jenkins/,https://www.cbsnews.com/news/tom-brady-roast-aaron-hernandez-fiancee-shayanna-jenkins/,0,www.cbsnews.com,Aaron Hernandez's fiancée condemns jokes made about late NFL player,"""It's sad that I'm trying to raise my children in such a cruel world,"" said Hernandez' partner and mother of his only child.",https://assets2.cbsnewsstatic.com/hub/i/r/2024/05/07/8b24406b-9abf-4a9b-808b-7bbdf87706ed/thumbnail/1200x630/eca2ebdbfb761d148c6579c525a63dd4/gettyimages-2151655284.jpg?v=1d6c78a71b7b6252b543a329b3a5744d,2024-05-07T15:02:46Z,,"Shayanna Jenkins, the fiancée of late New England Patriots tight end Aaron Hernandez, condemned jokes made at his expense during NFL legend Tom Brady's roast. 
Jenkins, who is the mother of Hernande… [+2214 chars]",,en,'Tom Brady'
https://brobible.com/culture/article/gisele-bundchen-angry-tom-brady-roast-jokes/,https://brobible.com/culture/article/gisele-bundchen-angry-tom-brady-roast-jokes/,0,brobible.com,Gisele Bundchen Reportedly Angry About Getting Ripped On For Cheating On Tom Brady During His Roast,"While Tom Brady seemed to be a good sport about most of the jokes made at his expense during his Netflix roast — except, seemingly, one about Robert Craft and massages — his ex-wife Gisele Bundchen reportedly isn’t as amiable. According to a report from Peopl…",https://brobible.com/wp-content/uploads/2024/05/tom-brady-and-gisele-bunchden-at-the-met-gala.jpg,2024-05-07T15:21:50Z,,"Getty Image
While Tom Brady seemed to be a good sport about most of the jokes made at his expense during his Netflix roast except, seemingly, one about Robert Craft and massages his ex-wife Gisele B… [+2011 chars]",,en,'Tom Brady'
https://variety.com/2024/film/news/jeff-ross-denies-tom-brady-mad-robert-craft-joke-1235994291/,https://variety.com/2024/film/news/jeff-ross-denies-tom-brady-mad-robert-craft-joke-1235994291/,0,variety.com,Jeff Ross Denies Tom Brady Was Angry Over Robert Kraft Massage Joke at Netflix Roast; Brady Told Him ‘Don’t Say That S— Again’ but ‘He Was Having Fun’,One of the most viral moments to emerge out of Tom Brady’s Netflix roast was when the NFL icon got up from his seat and told off roaster Jeff Ross after the comedian made a massage joke about Patriots owner Robert Craft. Brady was heard telling ross: “Don’t s…,https://variety.com/wp-content/uploads/2024/05/Screen-Shot-2024-05-07-at-10.55.22-AM.png?w=1000&h=563&crop=1,2024-05-07T15:38:01Z,,One of the most viral moments to emerge out of Tom Brady‘s Netflix roast was when the NFL icon got up from his seat and told off roaster Jeff Ross after the comedian made a massage joke about Patriot… [+1897 chars],,en,'Tom Brady'
https://www.marca.com/en/nfl/2024/05/07/663a4c7e268e3eca158b45a0.html,https://www.marca.com/en/nfl/2024/05/07/663a4c7e268e3eca158b45a0.html,0,www.marca.com,Tom Brady and the emotional tribute to his father on his 80th birthday,"Tom Brady paid a heartfelt emotional tribute to his father after celebrating his 80th birthday on Monday. The former New England Patriots quarterback joined his father, Tom Brady S",https://phantom-marca.unidadeditorial.es/2a72774928e181f43150ad39999f0f87/crop/0x0/1974x1316/resize/1200/f/webp/assets/multimedia/imagenes/2024/05/07/17150965843322.png,2024-05-07T15:49:41Z,,"Tom Brady paid a heartfelt emotional tribute to his father after celebrating his 80th birthday on Monday. The former New England Patriots quarterback joined his father, Tom Brady Sr., as he marked re… [+1956 chars]",,en,'Tom Brady'
https://biztoc.com/x/9d25c669c6293afa,https://biztoc.com/x/9d25c669c6293afa,0,biztoc.com,Jeff Ross Denies Tom Brady Was Angry Over Robert Kraft Massage Joke at Netflix Roast; Brady Told Him ‘Don’t Say That S,One of the most viral moments to emerge out of Tom Brady‘s Netflix roast was when the NFL icon got up from his seat and told off roaster Jeff Ross after the comedian made a massage joke about Patriots owner Robert Kraft. Brady was heard telling Ross: “Don’t s…,https://c.biztoc.com/p/9d25c669c6293afa/s.webp,2024-05-07T15:52:06Z,,One of the most viral moments to emerge out of Tom Bradys Netflix roast was when the NFL icon got up from his seat and told off roaster Jeff Ross after the comedian made a massage joke about Patriots… [+288 chars],,en,'Tom Brady'
http://www.thecut.com/article/what-did-gisele-think-of-the-tom-brady-roast.html,http://www.thecut.com/article/what-did-gisele-think-of-the-tom-brady-roast.html,0,www.thecut.com,Gisele Wasn’t Impressed With the Tom Brady Roast,"Tom Brady’s Netflix roast was littered with jokes about the dissolution of his marriage to Gisele Bündchen, and Gisele wasn’t remotely impressed.",https://pyxis.nymag.com/v1/imgs/a50/c07/4a0227a056bdbb0673f503a941e09d80cd-gisele-tom-jokes.1x.rsocial.w1200.jpg,2024-05-07T15:52:57Z,http://archive.md/20240508014456/https://www.thecut.com/article/what-did-gisele-think-of-the-tom-brady-roast.html,Anyone tuning in to The Roast of Tom Brady on Sunday should have known to expect some jokes about the dissolution of his marriage to Gisele Bündchen. But no one could have predicted just how many jab… [+2031 chars],,en,'Gisele Bündchen'
https://www.foxnews.com/entertainment/judy-garland-reportedly-had-help-pi-fight-addiction-prince-william-kate-going-through-hell,https://www.foxnews.com/entertainment/judy-garland-reportedly-had-help-pi-fight-addiction-prince-william-kate-going-through-hell,0,www.foxnews.com,"Judy Garland reportedly had help of PI to fight addiction, Prince William and Kate 'going through hell'","The Fox News Entertainment newsletter brings you the latest Hollywood headlines, celebrity interviews and stories from Los Angeles and beyond.",https://static.foxnews.com/foxnews.com/content/uploads/2024/05/judy-garland-kate-middleton-prince-william.jpg,2024-05-07T15:58:25Z,,"Welcome to the Fox News Entertainment Newsletter. To receive this newsletter in your email, subscribe here
.
OVER THE RAINBOW - 'Wizard of Oz' star Judy Garland fought crippling drug addiction with… [+1344 chars]",,en,'Tom Brady'
http://www.vulture.com/article/sabrina-carpenter-incorrect-lyrics-espresso.html,http://www.vulture.com/article/sabrina-carpenter-incorrect-lyrics-espresso.html,0,www.vulture.com,"Why You Can’t Stop Saying ‘That’s That Me, Espresso’","As Sabrina Carpenter’s ‘Espresso’ continues rising, we asked a linguist why we can’t stop saying ‘That’s that me, espresso.’",https://pyxis.nymag.com/v1/imgs/c71/9d4/87cf3c2de9605c23a563ee9341aa205788-sabrina-carpenter-coachella.1x.rsocial.w1200.jpg,2024-05-07T16:00:49Z,,"Cant sleep? Blame espresso. No, not the coffee, Sabrina Carpenters breezy new single. Since the pop singer dropped Espresso last month, its grammatically incorrect hook Thats that me, espresso has ta… [+5512 chars]",,en,'Sabrina Carpenter'
https://freerepublic.com/focus/f-chat/4236240/posts,https://freerepublic.com/focus/f-chat/4236240/posts,0,freerepublic.com,Patriots owner tells Putin: ‘Give me my f‑‑‑ing ring back’,"“As Putin removed the ring, Kraft put out his hand. But Putin slipped the ring into his own pocket,” Benedict wrote. “Perplexed, Kraft looked at Weill, who subtly shook his head from side to side, signaling Kraft not to say anything. But Putin was stealing hi…",,2024-05-07T16:02:15Z,,"Skip to comments.
Patriots owner tells Putin: Give me my fing ring back
https://thehill.com/blogs/in-the-know/4646979-robert-kraft-vladimir-putin-give-ring-back/ ^Posted on 05/07/2024 9:02:15 AM PD… [+4159 chars]",,en,'Putin'
https://bleedingcool.com/tv/saturday-night-live-welcomes-maya-rudolph-vampire-weekend-video/,https://bleedingcool.com/tv/saturday-night-live-welcomes-maya-rudolph-vampire-weekend-video/,0,bleedingcool.com,"Saturday Night Live Welcomes Maya Rudolph, Vampire Weekend (VIDEO)","Before NBC's Saturday Night Live Season 49 wraps up on May 18th with host Jake Gyllenhaal (Prime Video's Road House) and musical guest Sabrina Carpenter, this weekend sees SNL icon & comedy genius Maya Rudolph (Apple TV+'s Loot) hosting – joined by musical gu…",https://bleedingcool.com/wp-content/uploads/2024/05/MixCollage-07-May-2024-11-46-AM-7598-2000x1125.jpg,2024-05-07T16:07:08Z,,"Posted in: NBC, Peacock, Preview, streaming, TV | Tagged: maya rudolph, nbc, peacock, saturday night live, snl, Vampire Weekend
NBC's Saturday Night Live rolled out the SNL video ""red carpet"" for th… [+2938 chars]",,en,'Sabrina Carpenter'
https://nypost.com/2024/05/07/sports/drew-bledsoe-says-gisele-joke-from-tom-brady-roast-came-from-wife/,https://nypost.com/2024/05/07/sports/drew-bledsoe-says-gisele-joke-from-tom-brady-roast-came-from-wife/,0,nypost.com,Drew Bledsoe reveals his wife wrote the Gisele Bündchen joke from Tom Brady roast,Bledsoe was one of the many who mocked Brady over his divorce Sunday at Netflix's star-studded roast.,https://nypost.com/wp-content/uploads/sites/2/2024/05/newspress-collage-hemqsyvvj-1715097909186.jpg?quality=75&strip=all&1715083774&w=1024,2024-05-07T16:11:23Z,http://archive.md/20240507184118/https://nypost.com/2024/05/07/sports/drew-bledsoe-says-gisele-joke-from-tom-brady-roast-came-from-wife/,"Drew Bledsoe had some help preparing for Sunday’s roast of his former teammate, Tom Brady.
When recapping his appearance on Netflix’s “Greatest Roast of All Time: Tom Brady,” the ex-Patriots quarter… [+2875 chars]",,en,'Tom Brady'
http://deadline.com/2024/05/jeff-ross-to-tom-brady-confrontation-live-roast-robert-kraft-massage-joke-1235907431/,http://deadline.com/2024/05/jeff-ross-to-tom-brady-confrontation-live-roast-robert-kraft-massage-joke-1235907431/,0,deadline.com,Jeff Ross Shares Take On Tom Brady Confrontation During Live Roast After Robert Kraft Massage Joke,"Jeff Ross is giving his take on The Greatest Roast of All Time: Tom Brady and that particular moment when the former NFL star got out of his seat after a joke about Robert Kraft. As the “Roastmaster General” on the Netflix comedy special, Ross was tasked to r…",https://deadline.com/wp-content/uploads/2024/05/jeff-ross-tom-brady-roast-kraft.jpg?w=1024,2024-05-07T16:27:29Z,,"Jeff Ross is giving his take on The Greatest Roast of All Time: Tom Brady and that particular moment when the former NFL star got out of his seat after a joke about Robert Kraft.
As the “Roastmaster… [+1536 chars]",,en,'Tom Brady'
https://biztoc.com/x/760fda2a9832f867,https://biztoc.com/x/760fda2a9832f867,0,biztoc.com,Jeff Ross Shares Take On Tom Brady Confrontation During Live Roast After Robert Kraft Massage Joke,"Jeff Ross is giving his take on The Greatest Roast of All Time: Tom Brady and that particular moment when the former NFL star got out of his seat after a joke about Robert Kraft. As the “Roastmaster General” on the Netflix comedy special, Ross was tasked to r…",https://c.biztoc.com/p/760fda2a9832f867/s.webp,2024-05-07T16:28:07Z,,Jeff Ross is giving his take on The Greatest Roast of All Time: Tom Brady and that particular moment when the former NFL star got out of his seat after a joke about Robert Kraft.As the Roastmaster Ge… [+306 chars],,en,'Tom Brady'
https://www.catholicnewsagency.com/news/257602/why-tom-brady-and-garth-brooks-will-be-at-the-vatican-this-weekend,https://www.catholicnewsagency.com/news/257602/why-tom-brady-and-garth-brooks-will-be-at-the-vatican-this-weekend,0,www.catholicnewsagency.com,Why Tom Brady and Garth Brooks will be at the Vatican this weekend,"Singer-songwriter Garth Brooks (left), former NFL quarterback Tom Brady (right), and other celebrity guests will meet Pope Francis in an audience at Apostolic Palace on May 11, 2024, as participants in the Vatican’s World Meeting on Human Fraternity. / Credit…",https://www.catholicnewsagency.com/storage/image/brooksfrancisbrady050724.jpg?jpg,2024-05-07T16:30:00Z,,"It is one of 12 roundtables organized throughout Rome at the second annual World Meeting on Human Fraternity called #BeHuman on topics ranging from education to peace-building, with economist Jeffrey… [+1512 chars]",,en,'Tom Brady'
https://hollywoodlife.com/2024/05/07/why-gisele-bundchen-missed-2024-met-gala/,https://hollywoodlife.com/2024/05/07/why-gisele-bundchen-missed-2024-met-gala/,0,hollywoodlife.com,Why Gisele Bundchen Missed the 2024 Met Gala After Ex Tom Brady Was Roasted,"The model and fashion was expected to attend the event but skipped because she was ""very busy,"" according to a new report.",https://hollywoodlife.com/wp-content/uploads/2024/05/gisele-bundchen-featured.jpg?quality=100,2024-05-07T16:36:54Z,,"View galleryImage Credit: Getty Images
Gisele Bündchen was a no-show at the 2024 Met Gala on Monday, May 6. The model, 43, was expected to walk the red carpet at the Costume Institute Benefit, but s… [+2327 chars]",,en,'Tom Brady'
https://www.cbssports.com/nfl/news/gisele-bundchen-angered-by-tom-brady-roast-retired-qbs-ex-wife-irked-by-disrespectful-portrayal-per-report/,https://www.cbssports.com/nfl/news/gisele-bundchen-angered-by-tom-brady-roast-retired-qbs-ex-wife-irked-by-disrespectful-portrayal-per-report/,0,www.cbssports.com,"Gisele Bundchen angered by Tom Brady roast: Retired QB's ex-wife irked by disrespectful portrayal, per report",Gisele was not happy with some of the jokes at the Tom Brady roast,https://sportshub.cbsistatic.com/i/r/2024/05/07/e463dd57-be93-4683-9704-8d27d0adeda5/thumbnail/1200x675/9bb1c6f85a009df648b7b5721c0bc1ee/gisele-bundchen.jpg,2024-05-07T16:49:26Z,http://archive.md/20240507183614/https://www.cbssports.com/nfl/news/gisele-bundchen-angered-by-tom-brady-roast-retired-qbs-ex-wife-irked-by-disrespectful-portrayal-per-report/,"There was a lot of laughter during the three-hour roast of Tom Brady on Sunday night, but one person who definitely didn't find any of the jokes funny during the event was Gisele Bundchen. 
It seems… [+2745 chars]",,en,'Gisele Bundchen'
https://biztoc.com/x/95f3f90cd3accac7,https://biztoc.com/x/95f3f90cd3accac7,0,biztoc.com,Which Musician Had Your Favorite Look at the 2024 Met Gala? Vote!,"From Ariana Grande to Lana Del Rey, Usher to Sabrina Carpenter, dozens of stars gathered in New York City Monday (May 7) for the biggest American fashion event of the year, each one looking more show-stopping than the last. Related Met Gala 2024: Photos From …",https://c.biztoc.com/p/95f3f90cd3accac7/s.webp,2024-05-07T17:00:20Z,,"From Ariana Grande to Lana Del Rey, Usher to Sabrina Carpenter, dozens of stars gathered in New York City Monday (May 7) for the biggest American fashion event of the year, each one looking more show… [+229 chars]",,en,'Sabrina Carpenter'
https://www.mediaite.com/sports/supermodel-gisele-bundchen-reportedly-upset-by-irresponsible-jokes-at-ex-husband-tom-bradys-roast/,https://www.mediaite.com/sports/supermodel-gisele-bundchen-reportedly-upset-by-irresponsible-jokes-at-ex-husband-tom-bradys-roast/,0,www.mediaite.com,Supermodel Gisele Bundchen Reportedly Upset by ‘Irresponsible’ Jokes at Ex-Husband Tom Brady’s Roast,"Supermodel Gisele Bundchen was ""deeply disappointed"" by the jokes told at Tom Brady's Netflix roast over the weekend, sources told People Magazine.
The post Supermodel Gisele Bundchen Reportedly Upset by ‘Irresponsible’ Jokes at Ex-Husband Tom Brady’s Roast f…",https://www.mediaite.com/wp-content/uploads/2024/05/AP22302344829411-scaled.jpg,2024-05-07T17:02:40Z,,"Aurore Marechal/AP
Supermodel Gisele Bundchen was “deeply disappointed” by the jokes told at Tom Brady’s Netflix roast over the weekend, sources told People Magazine.
Guests at the live special on … [+1426 chars]",,en,'Gisele Bundchen'
https://biztoc.com/x/5c7c8fba07a0d3ab,https://biztoc.com/x/5c7c8fba07a0d3ab,0,biztoc.com,Supermodel Gisele Bundchen Reportedly Upset by ‘Irresponsible’ Jokes at Ex-Husband Tom Brady’s Roast,"Aurore Marechal/AP Supermodel Gisele Bundchen was “deeply disappointed” by the jokes told at Tom Brady’s Netflix roast over the weekend, sources told People Magazine. Guests at the live special on Sunday left no stone unturned in their digs at Brady, taking s…",https://c.biztoc.com/p/5c7c8fba07a0d3ab/s.webp,2024-05-07T17:04:06Z,,"Aurore Marechal/APSupermodel Gisele Bundchen was deeply disappointed by the jokes told at Tom Bradys Netflix roast over the weekend, sources told People Magazine.Guests at the live special on Sunday … [+288 chars]",,en,'Tom Brady'
https://slashdot.org/firehose.pl?op=view&amp;id=173805480,https://slashdot.org/firehose.pl?op=view&amp;id=173805480,0,slashdot.org,"2024 Met Gala red carpet photos: Zendaya, Tyla, Ariana Grande, Sabrina Carpenter, Doja Cat, Lizzo and more - NBC News","2024 Met Gala red carpet photos: Zendaya, Tyla, Ariana Grande, Sabrina Carpenter, Doja Cat, Lizzo and moreNBC News Met Gala 2024 Unforgettable Looks: Zendaya, Cardi B, Kim Kardashian and MoreThe New York Times Met Gala 2024 Red Carpet: Celebs Not On ThemeBuzz…",,2024-05-07T17:13:44Z,,Sign up for the Slashdot newsletter! OR check out the new Slashdot job board to browse remote jobs or jobs in your areaDo you develop on GitHub? You can keep using GitHub but automatically sync your … [+268 chars],,en,'Sabrina Carpenter'
https://people.com/nikki-glaser-agreed-not-go-after-tom-brady-kids-during-roast-8644632,https://people.com/nikki-glaser-agreed-not-go-after-tom-brady-kids-during-roast-8644632,0,people.com,Nikki Glaser Says They Agreed Not to Go After Tom Brady’s Kids During Roast,"Nikki Glaser revealed the all the roasters on hand 'collectively' agreed to leave Brady’s children, Jack, Vivian and Benjamin, out of their jokes",https://people.com/thmb/NXxchih0OxvESKuVoHk0z3yvrII=/1500x0/filters:no_upscale():max_bytes(150000):strip_icc():focal(749x0:751x2)/nikki-glaser-tom-brady-tout-050724-b0cc0fef613e47d69a408a5a6619226a.jpg,2024-05-07T17:14:52Z,,"For Tom Brady's roast, there was one topic that was absolutely off limits, according to comedian and one of his many roasters Nikki Glaser.
Appearing on The Howard Stern Show on SiriusXM on May 6, G… [+1633 chars]",,en,'Nikki Glaser'
https://www.cosmopolitan.com/style-beauty/beauty/a60719220/sabrina-carpenter-met-gala-skincare/,https://www.cosmopolitan.com/style-beauty/beauty/a60719220/sabrina-carpenter-met-gala-skincare/,0,www.cosmopolitan.com,Sabrina Carpenter Used These Under-$20 Cetaphil Products for Her Met Gala Skincare,Sabrina Carpenter’s Met Gala glow is a result of these affordable Cetaphil skincare products that you can snag on Amazon.,"https://hips.hearstapps.com/hmg-prod/images/sabrina-carpenter-skincare-663a61841cd76.jpg?crop=1xw:1xh;center,top&resize=1200:*",2024-05-07T17:15:00Z,,"Okay, we know the deal. Celebs have the glowiest and smoothest skin because they have access to the fanciest 
beauty tools
, luxe facials, and $$$ skincare regimens. Right?! Well, our girl Sabrina … [+1451 chars]",,en,'Sabrina Carpenter'
https://www.cracked.com/article_42096_here-are-the-jokes-nikki-glaser-didnt-tell-at-the-tom-brady-roast.html,https://www.cracked.com/article_42096_here-are-the-jokes-nikki-glaser-didnt-tell-at-the-tom-brady-roast.html,0,www.cracked.com,Here Are The Jokes Nikki Glaser Didn’t Tell at the Tom Brady Roast,‘Proceeds from tonight’s show are going toward CTE research and the NFL’s coordinated effort to cover it up’,https://s3.crackedcdn.com/phpimages/article/9/8/0/1073980.jpg,2024-05-07T17:21:00Z,,"Everyone agrees, says Howard Stern. Nikki Glaser was the unanimous MVP at this weekends Tom Brady roast, blasting the quarterback with flamethrowers like You have seven rings well, eight now that Gis… [+2884 chars]",,en,'Tom Brady'
https://www.justjared.com/2024/05/07/barry-keoghan-sabrina-carpenter-attend-met-gala-after-parties-after-making-red-carpet-couple-debut/,https://www.justjared.com/2024/05/07/barry-keoghan-sabrina-carpenter-attend-met-gala-after-parties-after-making-red-carpet-couple-debut/,0,www.justjared.com,Barry Keoghan & Sabrina Carpenter Attend Met Gala After Parties After Making Red Carpet Couple Debut,Sabrina Carpenter and Barry Keoghan kept the party going after the 2024 Met Gala! The new couple made their red carpet debut and then changed into different outfits to attend the after parties on Monday night (May 6) in New York City. Sabrina was seen leaving…,https://cdn01.justjared.com/wp-content/uploads/headlines/2024/05/sabrina-fter.jpg,2024-05-07T17:31:51Z,,"Sabrina Carpenter and Barry Keoghan kept the party going after the 2024 Met Gala!
The new couple made their red carpet debut and then changed into different outfits to attend the after parties on Mo… [+528 chars]",,en,'Sabrina Carpenter'
