index,url,valid,domain,title,description,image,published,archive,content,quote,language,keyword
https://finance.yahoo.com/news/china-woos-dimon-musk-amid-000250183.html,https://finance.yahoo.com/news/china-woos-dimon-musk-amid-000250183.html,0,finance.yahoo.com,"China Woos Dimon, Musk Amid Pressure on Xi to Boost Economy","(Bloomberg) -- China is rolling out the red carpet for global business leaders including Jamie Dimon and Elon Musk, seeking to allay fears the world’s second...",https://s.yimg.com/ny/api/res/1.2/.KkBYeFw9qZRAKJWts22gA--/YXBwaWQ9aGlnaGxhbmRlcjt3PTEyMDA7aD04MDA-/https://media.zenfs.com/en/bloomberg_markets_842/e46112c5fbfc501d2a8a44abfeb08bde,2023-06-01T00:02:50Z,,"(Bloomberg) -- China is rolling out the red carpet for global business leaders including Jamie Dimon and Elon Musk, seeking to allay fears the worlds second-largest economy is becoming more hostile t… [+6408 chars]",,en,'Wang Wentao'
https://www.washingtonpost.com/politics/2023/05/31/nikki-haley-husband-deploy-africa/,https://www.washingtonpost.com/politics/2023/05/31/nikki-haley-husband-deploy-africa/,0,www.washingtonpost.com,Nikki Haley’s husband will deploy to Africa with the National Guard,The likely yearlong deployment from Michael Haley will come as Haley campaigns for president.,https://www.washingtonpost.com/wp-apps/imrs.php?src=https://arc-anglerfish-washpost-prod-washpost.s3.amazonaws.com/public/3GWQOMJJVCCJEOFKQZ65UGF57Q.jpg&w=1440,2023-06-01T00:09:19Z,,"Comment on this story
Comment
The husband of former South Carolina governor and current presidential candidate Nikki Haley will deploy to Africa in the coming weeks with the Army National Guard, a … [+2275 chars]",,en,'Nikki Haley'
https://deadline.com/2023/05/writers-strike-kim-kardashian-picket-lines-musicians-horror-lovers-wga-1235384160/,https://deadline.com/2023/05/writers-strike-kim-kardashian-picket-lines-musicians-horror-lovers-wga-1235384160/,0,deadline.com,"Dispatches From The Picket Lines, Day 30: Kim Kardashian Called Out, Writers & Musicians Band Together In NYC; Monsters, Lovers, Bagels Hit L.A. Streets","As one of Reality TV’s royal family crossed the line, striking film and television writers joined forces on Wednesday in New York City with another group of culture workers involved in a pay dispute: musicians.  While a five-piece band played bopping brass an…",https://deadline.com/wp-content/uploads/2023/05/Strike-NYC-May-31.jpg?w=1000,2023-06-01T00:52:07Z,https://web.archive.org/web/20230601012608/https://deadline.com/2023/05/writers-strike-kim-kardashian-picket-lines-musicians-horror-lovers-wga-1235384160/,"As one of Reality TV’s royal family crossed the line, striking film and television writers joined forces on Wednesday in New York City with another group of culture workers involved in a pay dispute:… [+5574 chars]",,en,'Kim Kardashian'
https://biztoc.com/x/e263dae5948bb96b,https://biztoc.com/x/e263dae5948bb96b,0,biztoc.com,"Dispatches From The Picket Lines, Day 30: Kim Kardashian Called Out, Writers & Musicians Band Together In NYC; Monsters, Lovers, Bagels Hit L.A. Streets","As one of Reality TV’s royal family crossed the line, striking film and television writers joined forces on Wednesday in New York City with another group of culture workers involved in a pay dispute: musicians. While a five-piece band played bopping brass and…",https://c.biztoc.com/p/e263dae5948bb96b/og.webp,2023-06-01T01:00:08Z,https://web.archive.org/web/20230601042052/https://biztoc.com/x/e263dae5948bb96b,"As one of Reality TVs royal family crossed the line, striking film and television writers joined forces on Wednesday in New York City with another group of culture workers involved in a pay dispute: … [+289 chars]",,en,'Kim Kardashian'
https://www.forbes.com/sites/johnbbrandon/2023/05/31/former-vp-mike-pence-is-trending-on-twitter-but-not-for-the-best-reasons/,https://www.forbes.com/sites/johnbbrandon/2023/05/31/former-vp-mike-pence-is-trending-on-twitter-but-not-for-the-best-reasons/,0,www.forbes.com,"Former VP Mike Pence Is Trending On Twitter, But Not For The Best Reasons","Rumor has it that former VP Mike Pence will announce his presidential run, breaking from his alliance with Trump and forging ahead on his own.",https://imageio.forbes.com/specials-images/imageserve/6477ee9630ec66ebd0a62ddf/0x0.jpg?format=jpg&width=1200,2023-06-01T01:45:59Z,https://web.archive.org/web/20230601015620/https://www.forbes.com/sites/johnbbrandon/2023/05/31/former-vp-mike-pence-is-trending-on-twitter-but-not-for-the-best-reasons/,"ARLINGTON, VA - AUGUST 09: U.S. Vice President Mike Pence announces the Trump Administration's plan ... [+] to create the U.S. Space Force by 2020 during a speech at the Pentagon August 9, 2018 in Ar… [+2590 chars]",,en,'Chip Somodevilla'
https://www.denverpost.com/2023/05/31/desantis-plays-up-his-personal-side-and-swipes-at-trump-during-campaign-blitz-across-iowa/,https://www.denverpost.com/2023/05/31/desantis-plays-up-his-personal-side-and-swipes-at-trump-during-campaign-blitz-across-iowa/,0,www.denverpost.com,DeSantis plays up his personal side — and swipes at Trump — during campaign blitz across Iowa,Ron DeSantis has made a four-stop blitz through Iowa during his first full day of presidential campaigning. He's aiming for a personal connection with voters even as he intensifies his criticism of former President Donald Trump. The Florida governor’s first a…,https://www.denverpost.com/wp-content/uploads/2023/05/Election_2024_DeSantis_64140-1.jpg?w=1024&h=682,2023-06-01T01:49:13Z,https://web.archive.org/web/20230601020504/https://www.denverpost.com/2023/05/31/desantis-plays-up-his-personal-side-and-swipes-at-trump-during-campaign-blitz-across-iowa/,"By THOMAS BEAUMONT and WILL WEISSERT (Associated Press)
SALIX, Iowa (AP) — Ron DeSantis blitzed through Iowa during his first full day of presidential campaigning on Wednesday, aiming for the kind o… [+7188 chars]",,en,'Nikki Haley'
https://www.bostonherald.com/2023/05/31/desantis-plays-up-his-personal-side-and-swipes-at-trump-during-campaign-blitz-across-iowa/,https://www.bostonherald.com/2023/05/31/desantis-plays-up-his-personal-side-and-swipes-at-trump-during-campaign-blitz-across-iowa/,0,www.bostonherald.com,DeSantis plays up his personal side — and swipes at Trump — during campaign blitz across Iowa,Ron DeSantis has made a four-stop blitz through Iowa during his first full day of presidential campaigning. He's aiming for a personal connection with voters even as he intensifies his criticism of former President Donald Trump. The Florida governor’s first a…,https://www.bostonherald.com/wp-content/uploads/2023/05/Election_2024_DeSantis_64140-1.jpg?w=1024&h=682,2023-06-01T01:49:13Z,https://web.archive.org/web/20230601023610/https://www.bostonherald.com/2023/05/31/desantis-plays-up-his-personal-side-and-swipes-at-trump-during-campaign-blitz-across-iowa/,"By THOMAS BEAUMONT and WILL WEISSERT (Associated Press)
SALIX, Iowa (AP) — Ron DeSantis blitzed through Iowa during his first full day of presidential campaigning on Wednesday, aiming for the kind o… [+7188 chars]",,en,'Donald Trump'
https://www.startribune.com/desantis-plays-up-his-personal-side-and-swipes-at-trump-during-campaign-blitz-across-iowa/600278924/,https://www.startribune.com/desantis-plays-up-his-personal-side-and-swipes-at-trump-during-campaign-blitz-across-iowa/600278924/,0,www.startribune.com,DeSantis plays up his personal side — and swipes at Trump — during campaign blitz across Iowa,"Ron DeSantis blitzed through Iowa during his first full day of presidential campaigning on Wednesday, aiming for the kind of personal connections with voters that critics say have long eluded him while stepping up his verbal swipes at former President Donald …",https://www.startribune.com/static/img/branding/logos/strib-social-card.png?d=1685567251,2023-06-01T01:50:02Z,https://web.archive.org/web/20230601035206/https://www.startribune.com/desantis-plays-up-his-personal-side-and-swipes-at-trump-during-campaign-blitz-across-iowa/600278924/,"SALIX, Iowa Ron DeSantis blitzed through Iowa during his first full day of presidential campaigning on Wednesday, aiming for the kind of personal connections with voters that critics say have long el… [+7122 chars]",,en,'Nikki Haley'
https://finance.yahoo.com/news/ukraine-recap-nato-ministers-discuss-075406078.html,https://finance.yahoo.com/news/ukraine-recap-nato-ministers-discuss-075406078.html,0,finance.yahoo.com,Ukraine Recap: Three People Die in Latest Russian Attack on Kyiv,"(Bloomberg) -- At least three people were killed, including two children, in the latest Russian missile assault on Kyiv, Mayor Vitali Klitschko said on...",https://s.yimg.com/ny/api/res/1.2/KYD7b9E7881vWcMsPTh47w--/YXBwaWQ9aGlnaGxhbmRlcjt3PTEyMDA7aD04MDA-/https://media.zenfs.com/en/bloomberg_markets_842/0e6aa3062bf76b8ad52ccc5e710cff1d,2023-06-01T03:12:04Z,https://web.archive.org/web/20230601042106/https://finance.yahoo.com/news/ukraine-recap-nato-ministers-discuss-075406078.html,"(Bloomberg) -- At least three people were killed, including two children, in the latest Russian missile assault on Kyiv, Mayor Vitali Klitschko said on Telegram early Thursday. The attack, the 19th i… [+1641 chars]",,en,'Vitali Klitschko'
https://www.eonline.com/news/1375893/kim-kardashian-recalls-telling-pete-davidson-what-youre-getting-yourself-into-during-romance,https://www.eonline.com/news/1375893/kim-kardashian-recalls-telling-pete-davidson-what-youre-getting-yourself-into-during-romance,0,www.eonline.com,Kim Kardashian Cautioned Pete Davidson About This While Dating,"Kim Kardashian knew the king of Staten Island might not want to join his queen on TV.
Noting she was acutely aware of the difficulties of dating while on reality television, the SKIMS founder,...","https://akns-images.eonline.com/eol_images/Entire_Site/2022214/rs_1200x1200-220314170458-1200-kim-kardashian-pete-davdison-GettyImages-967592940-624044902.jpg?fit=around%7C1080:1080&output-quality=90&crop=1080:1080;center,top",2023-06-01T04:00:00Z,,"Kim Kardashian knew the king of Staten Island might not want to join his queen on TV.
Noting she was acutely aware of the difficulties of dating while on reality television, the SKIMS founder, 42, r… [+764 chars]",,en,'Kim Kardashian'
https://www.independent.co.uk/news/world/americas/us-politics/donald-trump-ap-gop-iowa-new-hampshire-b2349365.html,https://www.independent.co.uk/news/world/americas/us-politics/donald-trump-ap-gop-iowa-new-hampshire-b2349365.html,0,www.independent.co.uk,Trump returns to campaign trail in Iowa as GOP rival DeSantis makes case to New Hampshire voters,"Former President Donald Trump returns to the campaign trail Thursday as his chief rival for the GOP presidential nomination, Florida Gov. Ron DeSantis, is undertaking his first swing through early voting states as an official candidate",https://static.independent.co.uk/2023/06/01/05/Election_2024_DeSantis_Trump_94003.jpg?quality=75&width=1200&auto=webp,2023-06-01T04:04:42Z,https://web.archive.org/web/20230601055800/https://www.independent.co.uk/news/world/americas/us-politics/donald-trump-ap-gop-iowa-new-hampshire-b2349365.html,"Sign up for the daily Inside Washington email for exclusive US coverage and analysis sent to your inbox
Get our free Inside Washington email
Former President Donald Trump returns to the campaign tr… [+3540 chars]",,en,'Donald Trump'
https://www.thestar.com/news/world/us/2023/06/01/trump-returns-to-campaign-trail-in-iowa-as-gop-rival-desantis-makes-case-to-new-hampshire-voters.html,https://www.thestar.com/news/world/us/2023/06/01/trump-returns-to-campaign-trail-in-iowa-as-gop-rival-desantis-makes-case-to-new-hampshire-voters.html,0,www.thestar.com,Trump returns to campaign trail in Iowa as GOP rival DeSantis makes case to New Hampshire voters,"LACONIA, N.H. (AP) — Former President Donald Trump returns to the campaign trail Thursday as his chief rival for the GOP presidential nomination, Flor...",https://images.thestarimages.com/ve4BhzKvwisoP-Bnh4GybRh_3Hk=/1280x1024/smart/filters:cb(1685592525103):format(webp)/https://www.thestar.com/content/dam/thestar/news/world/us/2023/06/01/trump-returns-to-campaign-trail-in-iowa-as-gop-rival-desantis-makes-case-to-new-hampshire-voters/2023060100064-6478190b074e8bb2ad54ac9cjpeg.jpg,2023-06-01T04:05:36Z,https://web.archive.org/web/20230601052641/https://www.thestar.com/news/world/us/2023/06/01/trump-returns-to-campaign-trail-in-iowa-as-gop-rival-desantis-makes-case-to-new-hampshire-voters.html,"LACONIA, N.H. (AP) Former President Donald Trump returns to the campaign trail Thursday as his chief rival for the GOP presidential nomination, Florida Gov. Ron DeSantis, is undertaking his first swi… [+3741 chars]",,en,'Nikki Haley'
https://abcnews.go.com/Politics/wireStory/trump-returns-campaign-trail-iowa-gop-rival-desantis-99747679,https://abcnews.go.com/Politics/wireStory/trump-returns-campaign-trail-iowa-gop-rival-desantis-99747679,0,abcnews.go.com,Trump returns to campaign trail in Iowa as GOP rival DeSantis makes case to New Hampshire voters,"Former President Donald Trump returns to the campaign trail Thursday as his chief rival for the GOP presidential nomination, Florida Gov. Ron DeSantis, is undertaking his first swing through early voting states as an official candidate",https://s.abcnews.com/images/Politics/wirestory_077af60ad9e300a89fd729663c5ac5f4_12x5_992.jpg,2023-06-01T04:07:00Z,https://web.archive.org/web/20230601041955/https://abcnews.go.com/Politics/wireStory/trump-returns-campaign-trail-iowa-gop-rival-desantis-99747679,"LACONIA, N.H. -- Former President Donald Trump returns to the campaign trail Thursday as his chief rival for the GOP presidential nomination, Florida Gov. Ron DeSantis, is undertaking his first swing… [+3414 chars]",,en,'Ron DeSantis'
https://socialmediaexplorer.com/content-sections/news-and-noise/former-vp-mike-pence-is-trending-on-twitter-but-not-for-the-best-reasons/,https://socialmediaexplorer.com/content-sections/news-and-noise/former-vp-mike-pence-is-trending-on-twitter-but-not-for-the-best-reasons/,0,socialmediaexplorer.com,"Former VP Mike Pence Is Trending On Twitter, But Not For The Best Reasons","ARLINGTON VA. – AUGUST 9, 2017: U.S. Vice president Mike Pence announced the Trump Administration plan … [+]In a speech delivered at the Pentagon on August 9, 2018, in Arlington, Virginia, Pence announced that the...read more
The post Former VP Mike Pence Is …",https://socialmediaexplorer.com/wp-content/uploads/2023/06/0x0.jpg,2023-06-01T06:00:37Z,https://web.archive.org/web/20230601072222/https://socialmediaexplorer.com/content-sections/news-and-noise/former-vp-mike-pence-is-trending-on-twitter-but-not-for-the-best-reasons/,"ARLINGTON VA. – AUGUST 9, 2017: U.S. Vice president Mike Pence announced the Trump Administration plan … [+]In a speech delivered at the Pentagon on August 9, 2018, in Arlington, Virginia, Pence anno… [+2599 chars]",,en,'Chip Somodevilla'
https://www.thedailybeast.com/ron-desantis-pastor-buddy-tom-ascol-appears-to-defend-uganda-gay-death-penalty,https://www.thedailybeast.com/ron-desantis-pastor-buddy-tom-ascol-appears-to-defend-uganda-gay-death-penalty,0,www.thedailybeast.com,Holy Hell: DeSantis’ Pastor Buddy Tweeted WHAT?,"Photo Illustration by Thomas Levinson/The Daily Beast/Bronwyn Opossum/Twitter
Even the odious Sen. Ted Cruz expressed outrage at Uganda’s draconian new anti-LBGTQ statutes.“This Uganda law is horrific & wrong,” the Texas Republican tweeted on May 2. “Any law…","https://img.thedailybeast.com/image/upload/c_crop,d_placeholder_euli9k,h_1688,w_3000,x_0,y_0/dpr_2.0/c_limit,w_740/fl_lossy,q_auto/v1685585121/230531-tom-ascol-tease_eikquz",2023-06-01T08:33:11Z,https://web.archive.org/web/20230601113524/https://www.thedailybeast.com/ron-desantis-pastor-buddy-tom-ascol-appears-to-defend-uganda-gay-death-penalty,"Even the odious Sen. Ted Cruz expressed outrage at Ugandas draconian new anti-LBGTQ statutes.
This Uganda law is horrific &amp; wrong, the Texas Republican tweeted on May 2. Any law criminalizing ho… [+3692 chars]",,en,'Ted Cruz'
https://sputnikglobe.com/20230601/erdogan-receives-5218-of-vote-in-turkish-presidential-election--1110842622.html,https://sputnikglobe.com/20230601/erdogan-receives-5218-of-vote-in-turkish-presidential-election--1110842622.html,0,sputnikglobe.com,Erdogan Receives 52.18% of Vote in Turkish Presidential Election,"ANKARA (Sputnik) - Reelected Turkish President Recep Tayyip Erdogan won the second round of the election with 52.18% of the vote, while his rival Kemal Kilicdaroglu received 47.82% of the vote, Turkey’s Supreme Election Council said on Thursday.",https://cdn1.img.sputnikglobe.com/images/sharing/article/eng/1110842622.jpg?11108420171685626877,2023-06-01T08:55:00Z,https://web.archive.org/web/20230601175455/https://sputnikglobe.com/20230601/erdogan-receives-5218-of-vote-in-turkish-presidential-election--1110842622.html,"When a picture is worth a thousand words. See what's happening in the world from a more visual perspective with Sputnik's photo galleries, infographics and other multimedia content.
https://sputnikg… [+1570 chars]",,en,'Kemal Kilicdaroglu'
http://washingtonmonthly.com/2023/06/01/the-debt-ceiling-deal-shows-joe-biden-is-a-normal-president-just-like-he-promised/,http://washingtonmonthly.com/2023/06/01/the-debt-ceiling-deal-shows-joe-biden-is-a-normal-president-just-like-he-promised/,0,washingtonmonthly.com,The Debt-Ceiling Deal Shows Joe Biden is a Normal President Just Like He Promised,"Skeptics said he couldn’t bring regular order, let alone bipartisanship, to Washington after the Trump years. But that’s precisely what he’s doing. 
The post The Debt-Ceiling Deal Shows Joe Biden is a Normal President Just Like He Promised appeared first on W…",https://washingtonmonthly.com/wp-content/uploads/2023/05/AP23149721602574-scaled.jpg,2023-06-01T09:00:00Z,,"On May 25, Noah Rothman of the conservative National Review wrote, Joe Biden promised to satisfy the publics desire for a return to normalcy and failed to deliver. 
Two days later, Biden achieved pe… [+6841 chars]",,en,'Ted Cruz'
https://www.usatoday.com/story/news/politics/2023/06/01/donald-trump-2024-opponents/70273623007/,https://www.usatoday.com/story/news/politics/2023/06/01/donald-trump-2024-opponents/70273623007/,0,www.usatoday.com,Donald Trump draws a huge field of 2024 opponents: Here's why that could help and hurt him,"Too many other candidates would split up the ""anti-Trump vote,"" analysts said, but could also make the case against re-nominating him.",https://s.yimg.com/ny/api/res/1.2/Ez06yghgafWEsxCDsL2q_A--/YXBwaWQ9aGlnaGxhbmRlcjt3PTEyMDA7aD04OTk-/https://media.zenfs.com/en/usa_today_news_641/352a101a7aa61ca2d6e332772fcf2216,2023-06-01T09:24:05Z,https://web.archive.org/web/20230601094605/https://www.usatoday.com/story/news/politics/2023/06/01/donald-trump-2024-opponents/70273623007/,"WASHINGTON - The Republican primary is getting awfully crowded, and that could be good news for Donald Trump - in theory.
As Chris Christie and Mike Pence prepare to join the field, the theory is th… [+4986 chars]",,en,'Nikki Haley'
https://www.newsweek.com/full-list-house-republicans-voted-against-debt-ceiling-deal-1803734,https://www.newsweek.com/full-list-house-republicans-voted-against-debt-ceiling-deal-1803734,0,www.newsweek.com,Full List of House Republicans Who Voted Against Debt-Ceiling Deal,Rep. Scott Perry and other members of the Freedom Caucus voted against the compromise negotiated by President Joe Biden and Speaker Kevin McCarthy.,https://d.newsweek.com/en/full/2241389/scott-perry.jpg,2023-06-01T09:42:40Z,https://web.archive.org/web/20230601103608/https://www.newsweek.com/full-list-house-republicans-voted-against-debt-ceiling-deal-1803734,"In a major make-or-break vote on Wednesday, an overwhelming bipartisan coalition in the House of Representatives agreed to push through the deal to raise the government borrowing limit negotiated by … [+3999 chars]",,en,'Kevin McCarthy'
https://www.dailymail.co.uk/femail/article-12147729/Prince-William-Kate-Middletons-close-connections-Jordan.html,https://www.dailymail.co.uk/femail/article-12147729/Prince-William-Kate-Middletons-close-connections-Jordan.html,0,www.dailymail.co.uk,Prince William and Kate Middleton's close connections to Jordan,"William, 40, and Kate, 41, are among a host of foreign royalty attending the nuptials of Crown Prince Hussein, 28, and architect bride Rajwa Alseif, 29, on Thursday at the Zahran Palace.",https://i.dailymail.co.uk/1s/2023/06/01/10/71646345-0-image-a-89_1685612666037.jpg,2023-06-01T10:05:18Z,https://web.archive.org/web/20230601103719/https://www.dailymail.co.uk/femail/article-12147729/Prince-William-Kate-Middletons-close-connections-Jordan.html,"The Prince and Princess of Wales have made a surprise visit to Jordan to attend the wedding of the country's Crown Prince Hussein.
William, 40, and Kate, 41, are among a host of foreign royalty atte… [+7024 chars]",,en,'Prince William'
https://www.independent.co.uk/voices/kevin-mccarthy-approval-rating-debt-ceiling-vote-b2349566.html,https://www.independent.co.uk/voices/kevin-mccarthy-approval-rating-debt-ceiling-vote-b2349566.html,0,www.independent.co.uk,Voices: The debt limit vote signals the beginning of the end for Kevin McCarthy,The Speaker has always been eager to please. That may be his undoing,https://static.independent.co.uk/2023/05/31/15/GettyImages-1247945793.jpg?quality=75&width=1200&auto=webp,2023-06-01T10:23:27Z,https://web.archive.org/web/20230601130625/https://www.independent.co.uk/voices/kevin-mccarthy-approval-rating-debt-ceiling-vote-b2349566.html,"Sign up for the View from Westminster email for expert analysis straight to your inbox
Get our free View from Westminster email
If House Speaker Kevin McCarthy has one defining trait, its his eager… [+4631 chars]",,en,'Kevin McCarthy'
https://freerepublic.com/focus/f-news/4157486/posts,https://freerepublic.com/focus/f-news/4157486/posts,0,freerepublic.com,Turkish support in Germany for Erdogan fuels integration debate,Strong backing for President Recep Tayyip Erdogan among Turks in Germany in last weekend's historic election has sparked renewed soul-searching about whether Berlin's attempts to integrate the minority are failing. There were scenes of jubilation in some Germ…,,2023-06-01T10:49:08Z,https://web.archive.org/web/20230601111000/https://freerepublic.com/focus/f-news/4157486/posts,"Skip to comments.
Turkish support in Germany for Erdogan fuels integration debateFrance 24 ^Posted on 06/01/2023 3:49:08 AM PDT by FarCenter
Strong backing for President Recep Tayyip Erdogan among … [+2575 chars]",,en,'Kemal Kilicdaroglu'
https://www.eonline.com/news/1376037/kim-kardashian-teases-potential-new-romance-with-fred-in-kardashians-teaser,https://www.eonline.com/news/1376037/kim-kardashian-teases-potential-new-romance-with-fred-in-kardashians-teaser,0,www.eonline.com,Kim Kardashian Hints at New Romance in Kardashians Teaser,"Kim Kardashian seems to be back in the dating game. Though the SKIMS founder previously shared that she wasn't quite ""ready to mingle"" after her split from Pete Davidson, she did hint at a...","https://akns-images.eonline.com/eol_images/Entire_Site/202342/rs_1200x1200-230502113413-1200-Kim_Kardashian-2023_TIME100_GALA-gj.jpg?fit=around%7C1080:1080&output-quality=90&crop=1080:1080;center,top",2023-06-01T11:58:38Z,,"Kim Kardashian seems to be back in the dating game.Though the SKIMS founder previously shared that she wasn't quite ""ready to mingle"" after her split from Pete Davidson, she did hint at a possible ro… [+890 chars]",,en,'Kim Kardashian'
https://economictimes.indiatimes.com/news/international/world-news/pope-francis-accepts-resignation-of-bishop-franco-mulakkal-after-rape-accusations/articleshow/100680190.cms,https://economictimes.indiatimes.com/news/international/world-news/pope-francis-accepts-resignation-of-bishop-franco-mulakkal-after-rape-accusations/articleshow/100680190.cms,0,economictimes.indiatimes.com,Pope Francis accepts resignation of bishop Franco Mulakkal after rape accusations,"The Vatican announced the decision on Thursday, without giving any further information. Mulakkal, 59, was appointed bishop of the Diocese of Jalandhar, in Punjab state, in 2013. He stepped down temporarily from the post in 2018 when he was accused by a nun of…","https://img.etimg.com/thumb/msid-100680286,width-1070,height-580,imgsize-58546,overlay-economictimes/photo.jpg",2023-06-01T12:12:18Z,https://web.archive.org/web/20230601154337/https://economictimes.indiatimes.com/news/international/world-news/pope-francis-accepts-resignation-of-bishop-franco-mulakkal-after-rape-accusations/articleshow/100680190.cms,"Q4 Nos Spring a Surprise, Lift FY23 Growth to 7.2%A stronger-than-expected fourth quarter lifted Indias growth to 7.2% in FY23, exceeding the 7% cited in the second advance estimates released in Febr… [+805 chars]",,en,'Pope Francis'
