index,url,valid,domain,title,description,image,published,archive,content,quote,language,keyword
https://www.c21media.net/news/cherokee-film-hires-michael-musante-as-part-of-film-and-tv-funding-push/,https://www.c21media.net/news/cherokee-film-hires-michael-musante-as-part-of-film-and-tv-funding-push/,0,www.c21media.net,Cherokee Film hires Michael Musante as part of film and TV funding push,"US-based Cherokee Film has appointed Michael Musante as executive in charge of film and TV finance and development. Musante joins Cherokee Film with an extensive background in film production, acquisit...",https://cdn.c21media.net/wp-content/uploads/2024/08/mikemusante2024-ls.jpg,2024-08-01T09:34:30Z,,"US-based Cherokee Film has appointed Michael Musante as executive in charge of film and TV finance and development.
Michael Musante
Musante joins Cherokee Film with an extensive background in film … [+1727 chars]",,en,'Lily Gladstone'
https://consequence.net/2024/08/how-to-get-tickets-to-pink-2024-tour/,https://consequence.net/2024/08/how-to-get-tickets-to-pink-2024-tour/,0,consequence.net,How to Get Tickets to P!NK’s 2024 “Summer Carnival Tour”,"P!NK’s “Summer Carnival Tour” returns to North America this August with Sheryl Crow. Learn how to get tickets here.
How to Get Tickets to P!NK’s 2024 “Summer Carnival Tour”
Jo Vito",https://consequence.net/wp-content/uploads/2023/12/Pink-Sheryl-Crow.jpeg,2024-08-01T12:18:46Z,,"P!NK has announced 2024 dates for her “Summer Carnival Tour,” bringing the roadshow back for a run with support from Sheryl Crow, The Script, and more this summer.
Find tickets here, and read on for… [+4300 chars]",,en,'Sheryl Crow'
https://comicbookmovie.com/tv/marvel/agatha-coven-of-chaos/agatha-all-along-new-stills-reveal-first-look-at-aubrey-plaza-in-her-green-witch-costume-a212447,https://comicbookmovie.com/tv/marvel/agatha-coven-of-chaos/agatha-all-along-new-stills-reveal-first-look-at-aubrey-plaza-in-her-green-witch-costume-a212447,0,comicbookmovie.com,AGATHA ALL ALONG: New Stills Reveal First Look At Aubrey Plaza In Her Green Witch Costume,"Some new promo stills for Marvel Studios' Agatha All Along have been released, and they give us a first look at Aubrey Plaza suited-up as Rio Vidal in her ""warrior witch"" costume...",https://comicbookmovie.com/images/articles/banners/212447.jpg,2024-08-01T14:56:11Z,,"Some new promo stills for Marvel Studios' Agatha All Along have been unveiled (via Empire), giving us another look at Kathryn Hahn as the returning Agatha Harkness along with the show's supporting pl… [+2766 chars]",,en,'Aubrey Plaza'
https://www.stereogum.com/2274324/charli-xcx-guess-remix-feat-billie-eilish/music/,https://www.stereogum.com/2274324/charli-xcx-guess-remix-feat-billie-eilish/music/,0,www.stereogum.com,Charli XCX – “Guess (Remix Feat. Billie Eilish)”,"There was “Girl, so confusing” with Lorde, “360” with Yung Lean and Robyn, “Von dutch” with Addison Rae, and now, there’s “Guess” with Billie Eilish. After teasing a “Guess” rework with a surprise collaborator the other day, Charli XCX has unveiled the latest…",https://static.stereogum.com/uploads/2024/08/Guess-feat-Billie-Eilish-Charli-xcx-1722538366.jpeg,2024-08-01T22:00:31Z,,"There was “Girl, so confusing” with Lorde, “360” with Yung Lean and Robyn, “Von dutch” with Addison Rae, and now, there’s “Guess” with Billie Eilish. After teasing a “Guess” rework with a surprise co… [+793 chars]",,en,'Billie Eilish'
https://www.justjared.com/2024/08/01/guess-charli-xcx-billie-eilish-team-up-for-brat-remix/,https://www.justjared.com/2024/08/01/guess-charli-xcx-billie-eilish-team-up-for-brat-remix/,0,www.justjared.com,'Guess': Charli xcx & Billie Eilish Team Up for 'Brat' Remix - Watch the Music Video!,"Charli xcx and Billie Eilish are teaming up! After the 31-year-old Brat superstar teased a collaborator on her new song “Guess” earlier in the week, which fans quickly (and accurately) guessed to be the 22-year-old “Birds of a Feather” singer, the duo dropped…",https://cdn01.justjared.com/wp-content/uploads/headlines/2024/08/charli-xcx-billie-eilish-guess-social.jpg,2024-08-01T22:00:48Z,,"Charli xcx and Billie Eilish are teaming up!
After the 31-year-old Brat superstar teased a collaborator on her new song “Guess” earlier in the week, which fans quickly (and accurately) guessed to be… [+617 chars]",,en,'Billie Eilish'
https://consequence.net/2024/08/charli-xcx-billie-eilish-guess-remix-stream/,https://consequence.net/2024/08/charli-xcx-billie-eilish-guess-remix-stream/,0,consequence.net,Charli XCX Invites Billie Eilish to a Panty Party in Video for “Guess” Remix: Watch,"The latest high-profile remix to come from Charli XCX's Brat.
Charli XCX Invites Billie Eilish to a Panty Party in Video for “Guess” Remix: Watch
Jonah Krueger",https://consequence.net/wp-content/uploads/2024/08/Billie-Charli-XCX-Guess-video.jpeg,2024-08-01T22:10:26Z,,"Despite what the headlines say, Brat Summer appears to be alive and well. Charli XCX is making sure of it, as the pop star just dropped a remix of “Guess” featuring Billie Eilish. In keeping with the… [+1371 chars]",,en,'Billie Eilish'
http://www.rollingstone.com/music/music-news/billie-eilish-charli-xcx-guess-remix-1235072590/,http://www.rollingstone.com/music/music-news/billie-eilish-charli-xcx-guess-remix-1235072590/,0,www.rollingstone.com,Billie Eilish Crashes Charli XCX’s Panty Party in Video for ‘Guess’ Remix,"Charli XCX released single 'Guess' alongside Billie Eilish, who's also having a major summer thanks to Hit Me Hard and Soft's 'Birds of a Feather.'",https://www.rollingstone.com/wp-content/uploads/2024/08/charlie-billie-remix.jpg?crop=0px%2C0px%2C1798px%2C1014px&resize=1600%2C900,2024-08-01T22:17:44Z,,"It’s a Brat and Billie summer! On Thursday, Charli XCX and Billie Eilish released a remix for Charli’s song “Guess” that’s sending the internet into a frenzy.
The pair also released a video directed… [+2316 chars]",,en,'Billie Eilish'
https://pitchfork.com/news/charli-xcx-and-billie-eilish-share-new-guess-remix-watch-the-video/,https://pitchfork.com/news/charli-xcx-and-billie-eilish-share-new-guess-remix-watch-the-video/,0,pitchfork.com,Charli XCX and Billie Eilish Share New “Guess” Remix: Watch the Video,"The new “Guess Featuring Billie Eilish” visual features a ton of underwear, all of which has been charitably redistributed","https://media.pitchfork.com/photos/66ac164e8d96df8166737778/16:9/w_1280,c_limit/Billie-Eilish-Charli-XCX.jpg",2024-08-01T23:18:30Z,,"Charli XCX has released another Brat remix. This time, shes enlisted Billie Eilish for a new version of the bonus song Guess. The new song comes with a video directed by Aidan Zamiri. It features a t… [+1029 chars]",,en,'Billie Eilish'
https://www.eonline.com/news/1405702/billie-eilish-and-charli-xcx-dance-on-pile-of-underwear-in-nsfw-guess-music-video,https://www.eonline.com/news/1405702/billie-eilish-and-charli-xcx-dance-on-pile-of-underwear-in-nsfw-guess-music-video,0,www.eonline.com,"See Billie Eilish and Charli XCX's Music Video for NSFW Track ""Guess""","Billie Eilish is having a Brat summer.
The nine-time Grammy winner hopped on a remix of Charli XCX’s Brat bonus track “Guess,” as well as the music video for the NSFW track.
In the visuals,...","https://akns-images.eonline.com/eol_images/Entire_Site/202471/rs_1200x1200-240801175324-charli-xcx-billie-eilish.jpg?fit=around%7C1080:1080&output-quality=90&crop=1080:1080;center,top",2024-08-02T00:55:39Z,,"Billie Eilish is having a Brat summer.
The nine-time Grammy winner hopped on a remix of Charli XCXsBrat bonus track Guess, as well as the music video for the NSFW track.
In the visuals, released on… [+714 chars]",,en,'Billie Eilish'
https://hypebeast.com/2024/8/charli-xcx-billie-eilish-guess-single-stream,https://hypebeast.com/2024/8/charli-xcx-billie-eilish-guess-single-stream,0,hypebeast.com,"Charli XCX and Billie Eilish Drop Flirtatious Remix of ""Guess""","Charli XCX has joined forces with Billie Eilish for a remix of her BRAT deluxe cut, ""Guess.""Produced by The Dare and FINNEAS, the two-and-a-half-minute joint hears the pair brazenly trade flirtatious verses involving underwear, a hark back to Eilish's lyric o…",https://image-cdn.hypb.st/https%3A%2F%2Fhypebeast.com%2Fimage%2F2024%2F08%2F01%2Fcharli-xcx-billie-eilish-guess-single-stream-tw.jpg?w=1080&cbr=1&q=90&fit=max,2024-08-02T04:12:47Z,,"Charli XCX has joined forces with Billie Eilish for a remix of her BRAT deluxe cut, “Guess.”
Produced by The Dare and FINNEAS, the two-and-a-half-minute joint hears the pair brazenly trade flirtatio… [+389 chars]",,en,'Billie Eilish'
https://rlsbb.ru/beat-bobby-flay-s36e08-1080p-web-h264-frequency/,https://rlsbb.ru/beat-bobby-flay-s36e08-1080p-web-h264-frequency/,0,rlsbb.ru,Beat Bobby Flay S36E08 1080p WEB h264-FREQUENCY,"Season 36, Episode 08 – “Breakfast of Champions”Pastry chef Duff Goldman and journalist Gayle King interrogate Bobby Flay, while chefs Brian Ingram and Dayana Joseph cook up a breakfast of champions.Links: HOMEPAGE – TVDBBeat.Bobby.Flay.S36E08.1080p.WEB.H264-…",,2024-08-02T04:27:45Z,,"Season 36, Episode 08 “Breakfast of Champions”Pastry chef Duff Goldman and journalist Gayle King interrogate Bobby Flay, while chefs Brian Ingram and Dayana Joseph cook up a breakfast of champions.
… [+379 chars]",,en,'Gayle King'
https://www.counterpunch.org/2024/08/02/just-calm-down/,https://www.counterpunch.org/2024/08/02/just-calm-down/,0,www.counterpunch.org,“Just Calm Down”,"Emmanuel Macron dissolved France’s National Assembly, tensions have been running high. Politicians have been attacked, their offices vandalised and activists beaten up. Threats proliferate online; political leaders trade insults. In the media, journalists and…",https://www.counterpunch.org/wp-content/uploads/2021/06/cp-default-share.png,2024-08-02T05:45:35Z,,"Emmanuel Macron dissolved Frances National Assembly, tensions have been running high. Politicians have been attacked, their offices vandalised and activists beaten up. Threats proliferate online; pol… [+3627 chars]",,en,'Emmanuel Macron'
https://biztoc.com/x/bd2df9b0a73cb56d,https://biztoc.com/x/bd2df9b0a73cb56d,0,biztoc.com,Hard Work Isn't Necessarily Productive,"Many people think it’s unfair for some people to earn a lot more than others for jobs that look similar on the surface. Consider pro sports, where recently people learned that rising stars like Caitlin Clark, Cameron Brink, Angel Reese, and others earn a tiny…",https://biztoc.com/cdn/bd2df9b0a73cb56d_s.webp,2024-08-02T08:19:50Z,,"Many people think its unfair for some people to earn a lot more than others for jobs that look similar on the surface. Consider pro sports, where recently people learned that rising stars like Caitli… [+130 chars]",,en,'Cameron Brink'
https://www.dazeddigital.com/music/article/64286/1/charli-xcx-donated-the-10-000-panties-off-guess-to-a-woman-s-charity?utm_source=Link&utm_medium=Link&utm_campaign=RSSFeed&utm_term=charli-xcx-and-billie-eilish-share-aidan-zamiri-directed-new-guess-video,https://www.dazeddigital.com/music/article/64286/1/charli-xcx-donated-the-10-000-panties-off-guess-to-a-woman-s-charity?utm_source=Link&utm_medium=Link&utm_campaign=RSSFeed&utm_term=charli-xcx-and-billie-eilish-share-aidan-zamiri-directed-new-guess-video,0,www.dazeddigital.com,Charli xcx and Billie Eilish share Aidan Zamiri-directed new ‘Guess’ video,"‘Guess Featuring Billie Eilish’ features a pile of 10,000 panties, all of which have been donated to women’s charity I Support The Girls",,2024-08-02T09:43:00Z,,.read-more{display:none};read more raquo;,,en,'Billie Eilish'
https://newrepublic.com/article/184485/foreign-policy-mistake-us-keeps-repeating-middle-east,https://newrepublic.com/article/184485/foreign-policy-mistake-us-keeps-repeating-middle-east,0,newrepublic.com,The Foreign Policy Mistake the U.S. Keeps Repeating in the Middle East,"Early in his presidency, Barack Obama addressed
an audience at Cairo University in an attempt to improve America’s standing in
the Arab world. Titled “A New Beginning,”
the speech called for “mutual interest and mutual respect” between the United
States and M…",https://images.newrepublic.com/e58dcc2df98ad8c9c9f603b7f7d345d56cf18bae.jpeg?w=1200&h=630&crop=faces&fit=crop&fm=jpg,2024-08-02T10:00:00Z,,"What Really Went Wrong: The West and the Failure of Democracy in the Middle East
Yale University Press, 317 pp., $28.00
The implosion of Obamas visionand his replication
of Cold Warera American po… [+2579 chars]",,en,'Barack Obama'
https://www.bbc.com/news/articles/cqe6e702jvno,https://www.bbc.com/news/articles/cqe6e702jvno,0,www.bbc.com,Charli XCX donates thousands of pants from new video,A video for the Guess remix features thousands of pairs of underwear and Billie Eilish on a bulldozer.,https://ichef.bbci.co.uk/news/1024/branded_news/e28e/live/bbcb6b90-50b8-11ef-8c01-a105af990b4e.jpg,2024-08-02T10:20:31Z,,"Ten thousand pairs of underwear which were used in Charli XCX and Billie Eilish's latest music video have been donated to charity.
Guess, a remix of the Brat original, dropped on Thursday night and … [+1939 chars]",,en,'Billie Eilish'
https://www.businessinsider.com/ryan-salame-posting-ftx-crypto-trump-sbf-awaiting-prison-2024-8,https://www.businessinsider.com/ryan-salame-posting-ftx-crypto-trump-sbf-awaiting-prison-2024-8,0,www.businessinsider.com,"As Ryan Salame stares down years in prison for his role in FTX, he's spending his time doing what he loves: posting","As the FTX insider recovers from a dog attack that delayed his prison sentence, he's posting on X about Sam Bankman-Fried's trial and Donald Trump.",https://i.insider.com/66aba1ca1a227600e633758c?width=1200&format=jpeg,2024-08-02T11:20:02Z,,"Ryan Salame is returned to X ahead of his prison sentence.REUTERS/Brendan McDermid
<ul><li>Ryan Salame was sentenced to 7½ years in prison for his role in the collapse of FTX.</li><li>Awaiting priso… [+11057 chars]",,en,'Donald Trump'
http://www.egotastic.com/billie-eilish-wants-to-see-charli-xcxs-underwear/,http://www.egotastic.com/billie-eilish-wants-to-see-charli-xcxs-underwear/,0,www.egotastic.com,Billie Eilish Wants to See Charli XCX’s Underwear!,"Chalri XCX has remixed her latest single off her new album called Brat and she’s enlisted the help of Billie Eilish to jump on the new song called Guess. The song is basically an anthem about girls underwear and since Billie is like, a lesbian now, she was th…",http://www.egotastic.com/wp-content/uploads/2024/08/Charli-XCX.jpg,2024-08-02T14:12:05Z,,Chalri XCX has remixed her latest single off her new album called Brat and she's enlisted the help of Billie Eilish to jump on the new song called Guess. The song is basically an anthem about girls u… [+316 chars],,en,'Billie Eilish'
https://www.forbes.com/sites/hughmcintyre/2024/08/02/billie-eilish-may-be-headed-for-another-smash-with-her-new-collaboration/,https://www.forbes.com/sites/hughmcintyre/2024/08/02/billie-eilish-may-be-headed-for-another-smash-with-her-new-collaboration/,0,www.forbes.com,Billie Eilish May Be Headed For Another Smash With Her New Collaboration,"Billie Eilish joined Charli XCX on the remix of the latter's song ""Guess,"" now called “Guess featuring Billie Eilish,” which has become a quick sales win.",https://imageio.forbes.com/specials-images/imageserve/61fd63b61e8bbea6bccba91b/0x0.jpg?format=jpg&height=900&width=1600&fit=bounds,2024-08-02T17:27:07Z,,"LOS ANGELES, CALIFORNIA - DECEMBER 04: Billie Eilish attends Variety 2021 Music Hitmakers Brunch ... [+] presented by Peacock and GIRLS5EVA at City Market Social House on December 04, 2021 in Los Ang… [+2775 chars]",,en,'Billie Eilish'
https://www.businessinsider.com/charli-xcx-brat-remix-features-billie-eilish-lorde-addison-rae-2024-8,https://www.businessinsider.com/charli-xcx-brat-remix-features-billie-eilish-lorde-addison-rae-2024-8,0,www.businessinsider.com,Charli XCX's 'Brat' era is making remixes fun again. Other pop stars should take note.,"Charli XCX has released several remixed versions of fan-favorite ""Brat"" tracks, featuring artists like Billie Eilish, Lorde, and Addison Rae.",https://i.insider.com/66acf438393cd3c8629ae46f?width=1200&format=jpeg,2024-08-02T19:51:48Z,,"Billie Eilish and Charli XCX.Terrence O'Connor
<ul><li>Charli XCX released a new version of her fan-favorite song ""Guess"" on Thursday featuring Billie Eilish.</li><li>The ""Brat"" remixes all feel lik… [+5967 chars]",,en,'Billie Eilish'
https://www.justjared.com/2024/08/02/finneas-defends-sister-billie-eilish-after-tiktoker-says-her-guess-verse-is-predatory-towards-charli-xcx/,https://www.justjared.com/2024/08/02/finneas-defends-sister-billie-eilish-after-tiktoker-says-her-guess-verse-is-predatory-towards-charli-xcx/,0,www.justjared.com,Finneas Defends Sister Billie Eilish After TikToker Says Her 'Guess' Verse is 'Predatory' Towards Charli XCX,"Finneas is fiercely defending his younger sister Billie Eilish. On Thursday (August 1), Billie, 22, teamed up with Charli XCX on the remix of “Guess,” and in the accompanying music video, the two entertainers rolled around in piles of underwear. After the col…",https://cdn01.justjared.com/wp-content/uploads/headlines/2024/08/finneas-defends-billie-guess.jpg,2024-08-03T02:15:53Z,,"Finneas is fiercely defending his younger sister Billie Eilish.
On Thursday (August 1), Billie, 22, teamed up with Charli XCX on the remix of “Guess,” and in the accompanying music video, the two en… [+953 chars]",,en,'Billie Eilish'
https://screenrant.com/1990s-box-office-flops-everyone-loves/,https://screenrant.com/1990s-box-office-flops-everyone-loves/,0,screenrant.com,10 Box Office Flops From The 1990s That Everyone Loves,"Financial success has never been a dependable measure of a movies success, and some of the best movies of the 1990s failed to turn a profit.",https://static1.srcdn.com/wordpress/wp-content/uploads/2024/07/imagery-from-the-big-lebowski-and-true-romance.jpg,2024-08-03T14:30:10Z,,"Summary
<ul><li>
 Box office returns don't always measure a movie's success, and some 90s flops gained cult followings later.
 </li><li>
 Marketing and timing play a big role in a movie's commerc… [+12341 chars]",,en,'nan nan'
https://www.forbes.com/sites/hughmcintyre/2024/08/03/billie-eilish-replaces-kendrick-lamar-at-no-1/,https://www.forbes.com/sites/hughmcintyre/2024/08/03/billie-eilish-replaces-kendrick-lamar-at-no-1/,0,www.forbes.com,Billie Eilish Replaces Kendrick Lamar At No. 1,"Billie Eilish and Charli XCX's “Guess featuring Billie Eilish” jumps 182 spots to hit No. 1 on Spotify's daily U.S. chart, replacing Kendrick Lamar's ""Not Like Us"" on top.","https://imageio.forbes.com/specials-images/imageserve/66ae6d79413686df747e7c9c/0x0.jpg?format=jpg&crop=1559,1169,x0,y0,safe&height=900&width=1600&fit=bounds",2024-08-03T17:49:33Z,,"GLASTONBURY, ENGLAND - JUNE 24: Billie Eilish headlines the Pyramid Stage during day three of ... [+] Glastonbury Festival at Worthy Farm, Pilton on June 24, 2022 in Glastonbury, England. Billie Eili… [+2301 chars]",,en,'Billie Eilish'
https://www.usmagazine.com/celebrity-news/news/finneas-defends-sister-billie-eilishs-guess-verse/#article,https://www.usmagazine.com/celebrity-news/news/finneas-defends-sister-billie-eilishs-guess-verse/#article,0,www.usmagazine.com,Finneas Slams Trolls Who Say Billie Eilish’s ‘Guess’ Verse Crossed a Line,"Billie Eilish’s brother Finneas had heard enough from one particular troll on TikTok, taking the user to task over allegations of his sister “queerbaiting.” A post from user @windows199x accused Eilish, 22, of being “predatory” in her flirty verse on the remi…",https://www.usmagazine.com/wp-content/uploads/2024/08/Finneas-Defends-Sister-Billie-Eilish-After-Troll-Claims-Guess-Verse-Is-Predatory-01-2024.jpg?crop=0px%2C0px%2C2000px%2C1051px&resize=1200%2C630&quality=86&strip=all,2024-08-03T23:03:09Z,,"Sign InUp with your social account
Continue with Google
Continue with Facebook
Continue with Amazon
Continue with AppleWe won't post to any of your accounts
Get back to the 
Finneas and Billie … [+2590 chars]",,en,'Billie Eilish'
https://www.justjared.com/2024/08/03/director-provides-promising-update-about-sequel-to-this-fan-favorite-tom-cruise-movie/,https://www.justjared.com/2024/08/03/director-provides-promising-update-about-sequel-to-this-fan-favorite-tom-cruise-movie/,0,www.justjared.com,Director Provides Promising Update About Sequel to This Fan-Favorite Tom Cruise Movie,"Doug Liman provided a promising update about a long-teased sequel to one of Tom Cruise‘s fan-favorite movies. For a while now, there’s been buzz that Tom will film a follow-up to 2014′s Edge of Tomorrow, which he starred in with Emily Blunt. Earlier this year…",https://cdn01.justjared.com/wp-content/uploads/headlines/2024/08/tom-sequel.jpg,2024-08-04T01:19:18Z,,"Doug Liman provided a promising update about a long-teased sequel to one of Tom Cruise‘s fan-favorite movies. 
For a while now, there’s been buzz that Tom will film a follow-up to 2014′s Edge of Tom… [+1243 chars]",,en,'Emily Blunt'
https://www.justjared.com/2024/08/04/charli-xcxs-birthday-party-guest-list-revealed-lorde-billie-eilish-anya-taylor-joy-glen-powell-more/,https://www.justjared.com/2024/08/04/charli-xcxs-birthday-party-guest-list-revealed-lorde-billie-eilish-anya-taylor-joy-glen-powell-more/,0,www.justjared.com,"Charli xcx's Birthday Party Guest List Revealed - Lorde, Billie Eilish, Anya Taylor-Joy, Glen Powell & More!","Charli xcx is going all out for her birthday! The Brat superstar turned 32 on Friday (August 2), and celebrated with a superstar-filled birthday party over the weekend. Tons of celebs came out to celebrate with Charli on her special day on Saturday night (Aug…",https://cdn01.justjared.com/wp-content/uploads/headlines/2024/08/charli-xcx-birthday-party-social.jpg,2024-08-04T13:16:30Z,,"Charli xcx is going all out for her birthday!
The Brat superstar turned 32 on Friday (August 2), and celebrated with a superstar-filled birthday party over the weekend.
Tons of celebs came out to c… [+181 chars]",,en,'Anya Taylor-Joy'
https://www.abc.net.au/news/2024-08-05/aerosmith-retire-from-touring-billie-eilish-charli-xcx/104183198,https://www.abc.net.au/news/2024-08-05/aerosmith-retire-from-touring-billie-eilish-charli-xcx/104183198,0,www.abc.net.au,Charli xcx and Billie Eilish make streaming history with Guess remix,"Plus Aerosmith make ""heartbreaking and difficult"" decision to retire from touring — and other entertainment news you might have missed.",https://live-production.wcms.abc-cdn.net.au/f89abb789e21bb33ef4b14fcdc54ac8a?impolicy=wcms_watermark_news&cropH=960&cropW=1707&xPos=107&yPos=0&width=862&height=485&imformat=generic,2024-08-05T02:40:49Z,,"Welcome to ICYMI, where we recount the pop culture and entertainment news from over the weekend that you might have missed.
Let us get you caught up.
The internet goes crazy for Billie and Charli
… [+5870 chars]",,en,'Billie Eilish'
https://www.thelineofbestfit.com/news/as-predicted-taylor-swift-has-released-yet-another-variant-of-the-tortured-poets-department,https://www.thelineofbestfit.com/news/as-predicted-taylor-swift-has-released-yet-another-variant-of-the-tortured-poets-department,0,www.thelineofbestfit.com,"As predicted, Taylor Swift has released yet another variant of The Tortured Poets Department","Taylor Swift has released a new variant of The Tortured Poets Department, bringing the total to almost forty different versions.",https://best-fit.transforms.svdcdn.com/production/images/Taylor-Swift-The-Black-Dog.jpg?w=1200&h=1032&q=100&auto=format&fit=crop&dm=1713511789&s=6cabff6b0581178604fe54effad62f93,2024-08-05T09:57:18Z,,"The controversy was speculated when Charli XCX and Billie Eilish unveiled their debut collaboration, ""Guess"". When Charli and Eilish respectively released their latest albums, BRAT and HIT ME HARD AN… [+1483 chars]",,en,'Taylor Swift'
https://pitchfork.com/news/charli-xcx-billie-eilish-jane-remover-high-vis-this-week-pitchfork-selects-playlist/,https://pitchfork.com/news/charli-xcx-billie-eilish-jane-remover-high-vis-this-week-pitchfork-selects-playlist/,0,pitchfork.com,"Charli XCX & Billie Eilish, Jane Remover, High Vis, and More: This Week’s Pitchfork Selects Playlist","Our weekly playlist highlights songs that our writers, editors, and contributors are listening to on repeat","https://media.pitchfork.com/photos/66afe0c532283d834154cfc7/16:9/w_1280,c_limit/August%205_2-1.png",2024-08-05T12:20:57Z,,"The staff of Pitchfork listens to a lot of new music. A lot of it. On any given day our writers, editors, and contributors go through an imposing number of new releases, giving recommendations to eac… [+1108 chars]",,en,'Billie Eilish'
https://www.thelineofbestfit.com/news/finneas-defends-billie-eilish-over-queerbaiting-comment-what-a-take-you-little-clown,https://www.thelineofbestfit.com/news/finneas-defends-billie-eilish-over-queerbaiting-comment-what-a-take-you-little-clown,0,www.thelineofbestfit.com,"FINNEAS defends Billie Eilish over queerbaiting comment: ""What a take you little clown""","FINNEAS has come to the defence of his sister Billie Eilish, following a comment that said she was being ""predatory"".",https://best-fit.transforms.svdcdn.com/production/images/billie-eilish-finneas-oscars-2022-backstage-youtube.jpg?w=1200&h=848&q=100&auto=format&fit=crop&dm=1649181472&s=34d542d6c62689cd7e29e2391ae59e1f,2024-08-05T13:00:00Z,,"Last week, Charli XCX and Billie Eilish released ""Guess"" as their debut collaboration. The track is a remix of the original which features on Charli's latest album, BRAT. The collaboration has made h… [+1404 chars]",,en,'Billie Eilish'
