index,url,valid,domain,title,description,image,published,archive,content,quote,language,keyword
0,https://www.newyorker.com/magazine/2025/06/09/curtis-yarvin-profile,0,www.newyorker.com,Curtis Yarvin’s Plot Against America,"A Profile of Curtis Yarvin, the right-wing thinker behind the Substack “Gray Mirror,” who has been embraced by J. D. Vance, Marc Andreessen, Peter Thiel, and other supporters of Donald Trump. Ava Kofman reports.","https://media.newyorker.com/photos/683767e393997519c53e33da/16:9/w_1280,c_limit/r46546.jpg",2025-06-02T10:00:00Z,,"In the spring and summer of 2008, when Donald Trump was still a registered Democrat, an anonymous blogger known as Mencius Moldbug posted a serial manifesto under the heading An Open Letter to Open-M… [+11478 chars]",,en,'Curtis Yarvin'
1,https://www.forbes.com/sites/taxnotes/2025/06/02/the-american-pope-and-citizenship-based-taxation/,0,www.forbes.com,The American Pope And Citizenship-Based Taxation,Robert Goulder considers whether the election of Pope Leo XIV could prompt a broad rethinking on U.S. policy toward citizenship-based taxation.,https://imageio.forbes.com/specials-images/imageserve/683da742a4d418242c4273ef/0x0.jpg?format=jpg&height=900&width=1600&fit=bounds,2025-06-02T13:41:29Z,,"Newly elected Pope Leo XIV, Robert Prevost arrives on the main central loggia balcony of the St ... More Peter's Basilica for the first time, after the cardinals ended the conclave, in The Vatican, o… [+14056 chars]",,en,'Pope Leo'
2,https://reason.com/2025/06/03/did-bill-buckley-really-lead-a-successful-revolution/,0,reason.com,Did Bill Buckley Really Lead a Successful Revolution?,"Buckley: The Life and the Revolution that Changed America, by Sam Tanenhaus, Random House, 1,040 pages, $40 For decades, William F. Buckley",https://d2eehagpk5cl65.cloudfront.net/img/q60/uploads/2025/06/6-2-25-v1.jpg,2025-06-02T19:08:39Z,,"Buckley: The Life and the Revolution that Changed America, by Sam Tanenhaus, Random House, 1,040 pages, $40 For decades, William F. Buckley Jr.—journalist, editor, novelist, television host, mayoral … [+12791 chars]",,en,'Sam H'
3,https://www.newyorker.com/newsletter/the-daily/trumpworlds-court-philosopher,0,www.newyorker.com,Trumpworld’s Court Philosopher,Curtis Yarvin plots against America. Plus: Ronan Farrow on what Elon Musk’s alleged drug use means for DOGE—and for the rest of us.,"https://media.newyorker.com/photos/66bbc14a3a338ff378df3b0c/16:9/w_1280,c_limit/newsletter-flagship-daily-header2.png",2025-06-02T23:05:00Z,,"Were conducting a health check on American democracy. In a new section that were calling How Bad Is It? well be taking stock of the latest threats to civic life, with context from our expertsstarting… [+5823 chars]",,en,'Curtis Yarvin'
4,https://www.jpost.com/international/article-856319,0,www.jpost.com,Polish nationalist Nawrocki wins presidency in setback for pro-EU government,"In a victory for European conservatives inspired by US President Donald Trump, Nawrocki secured 50.89% of the vote, election commission data showed.","https://images.jpost.com/image/upload/f_auto,fl_lossy/c_fill,g_faces:center,h_407,w_690/665932",2025-06-03T02:17:30Z,,"Nationalist opposition candidate Karol Nawrocki narrowly won Poland's presidential election, results showed on Monday, delivering a big blow to the centrist government's efforts to cement Warsaw's pr… [+4390 chars]",,en,'Donald Trump'
5,https://ra.co/news/82906,0,ra.co,"SXSW London criticised for hosting panels with Tony Blair, David Cameron","Appearances by the ex-UK prime ministers, to discuss AI and healthcare respectively, have prompted some artists to pull out.",https://static.ra.co/images/news/2025/tonyblairsxsw.png,2025-06-03T11:30:00Z,,"<ul><li>
</li><li>Appearances by the ex-UK prime ministers, to discuss AI and healthcare respectively, have prompted some artists to pull out.</li><li></li><li>Former UK prime ministers Tony Blair a… [+2424 chars]",,en,'David Cameron'
6,https://www.fark.com/comments/13693438/Back-in-2011-Curtis-Yarvin-said-that-Trump-was-one-of-two-figures-who-seemed-biologically-suited-to-be-an-American-monarch-The-other-was-Chris-Christie,0,www.fark.com,"""Back in 2011, [Curtis] Yarvin said that Trump was one of two figures who seemed ""biologically suited"" to be an American monarch. (The other was Chris Christie.)"" [Fail]","""Back in 2011, [Curtis] Yarvin said that Trump was one of two figures who seemed ""biologically suited"" to be an American monarch. (The other was Chris Christie.)""",https://usrimg-full.fark.net/W/Wv/fark_Wv6Ji3Kmb7Lf1J95L3nXmU3WyT0.jpg?AWSAccessKeyId=JO3ELGV4BGLFW7Y3EZXN&Expires=1749441600&Signature=dYXuXgg1DaXzkXI3R70%2FLPiiUSI%3D,2025-06-03T13:34:35Z,,"dv-ous:Martian_Astronomer: ""What wins Yarvin converts is less the soundness of his arguments than the transgressive energy they exude: he makes his listeners feel that he is granting them access to f… [+1080 chars]",,en,'Curtis Yarvin'
7,https://www.forbes.com/sites/instituteforjustice/2025/06/03/cities-consider-using-eminent-domain-for-unholy-property-seizures/,0,www.forbes.com,Cities Consider Using Eminent Domain For Unholy Property Seizures,A couple of American cities are looking to use eminent domain to seize some holy sites: the boyhood of home of Pope Leo XIV and an episcopal church.,https://imageio.forbes.com/specials-images/imageserve/683f0b10ac72f2fb2b22218d/0x0.jpg?format=jpg&height=900&width=1600&fit=bounds,2025-06-03T14:53:47Z,,"A person takes a picture of the childhood home of the new Pope Leo XIV in Dolton, Illinois, (Photo ... More by KAMIL KRZACZYNSKI/AFP via Getty Images)
AFP via Getty Images
Robert Prevost grew up in… [+6654 chars]",,en,'Pope Leo'
8,https://www.thehindubusinessline.com/info-tech/starlink-to-get-licence-from-government-to-operate-satcom-in-next-few-days/article69653826.ece,0,www.thehindubusinessline.com,Starlink to get licence from government to operate Satcom in next few days,"Elon Musk's Starlink secures license to operate satellite communications in India, joining Airtel-Oneweb and Jio Satellite Communication.",https://bl-i.thgim.com/public/incoming/or452j/article69653900.ece/alternates/LANDSCAPE_1200/IMG_BL_-_22_02_2020_-_98_2_1_NMDHJJKT.jpg,2025-06-03T18:15:00Z,,Elon Musk-owned Starlink is finally getting the licence to operate its satellite communications (Satcom) in India. The companys executives will be arriving in India to get the approval from the gover… [+2029 chars],,en,'Mukesh Ambani'
9,https://www.boredpanda.com/shocking-wild-pope-facts-msn/,0,www.boredpanda.com,15 Shocking Pope Facts That May Leave You Flabbergasted Or Eager To Know More,"The conclave is over, and the white smoke has already cleared from St. Peter's Basilica. The cardinals have gone home, and the new Pope, Leo XIV, has already begun to fulfill his duties. The Catholic world is returning to a quiet routine - as it always has fo…",https://www.boredpanda.com/blog/wp-content/uploads/2025/05/shocking-wild-pope-facts-fb4.png,2025-06-03T21:00:34Z,,"Article created by: Denis Krotovas
The conclave is over, and the white smoke has already cleared from St. Peter's Basilica. The cardinals have gone home, and the new Pope, Leo XIV, has already begun… [+571 chars]",,en,'Pope Leo'
10,https://www.lawyersgunsmoneyblog.com/2025/06/magas-idea-of-an-intellectual,0,www.lawyersgunsmoneyblog.com,MAGA’s idea of an intellectual,"It would be tempting to dismiss Curtis Yarvin to be too silly to be worth a New Yorker profile (and, on the merits, nearly impossible not to), were it not for his very real influence: A decade on, with the Trumpian right embracing strongman rule, Yarvin’s lin…",,2025-06-04T02:16:10Z,,"It would be tempting to dismiss Curtis Yarvin to be too silly to be worth a New Yorker profile (and, on the merits, nearly impossible not to), were it not for his very real influence:
A decade on, w… [+4625 chars]",,en,'Curtis Yarvin'
11,https://www.digitaljournal.com/world/us-doubles-steel-aluminum-tariffs-as-oecd-ministers-gather/article,0,www.digitaljournal.com,"US doubles steel, aluminum tariffs as OECD ministers gather","The United States doubled steel and aluminum tariffs Wednesday, casting a pall on a gathering of OECD ministers as President Donald Trump’s intensifying trade war weighs on the world economy. Trump’s sweeping tariffs on allies and adversaries alike — includin…",https://www.digitaljournal.com/wp-content/uploads/2025/06/4acd2c97a64eeef3cce80994cf0d226e50c96d47.jpg,2025-06-04T04:07:20Z,,"US President Donald Trump's latest tariff plans come as the OECD cut its global growth forecast on the back of his sweeping duties - Copyright AFP/File Frederic J. BROWN
The United States doubled st… [+4137 chars]",,en,'Katherina Reiche'
12,https://www.hurriyetdailynews.com/us-doubles-steel-aluminum-tariffs-as-oecd-ministers-gather-209928,0,www.hurriyetdailynews.com,"US doubles steel, aluminum tariffs as OECD ministers gather","The United States doubled steel and aluminum tariffs Wednesday, casting a pall on a gathering of OECD ministers as President Donald Trump's intensifying trade war weighs on the world economy.",https://image.hurimg.com/i/hurriyet/75/200x200/683fec4e1f20a2984e65ba37.jpg,2025-06-04T06:48:57Z,,"WASHINGTON
OECD Secretary-General Mathias Cormann delivers a speech during the opening session of the OECD ministerial Council meeting at OECD headquarters in Paris, on June 3, 2025 
The United Sta… [+4286 chars]",,en,'Katherina Reiche'
13,https://www.bangkokpost.com/business/general/3041761/trump-says-extremely-hard-to-do-trade-deal-with-xi,0,www.bangkokpost.com,Trump says ‘extremely hard’ to do trade deal with Xi,"WASHINGTON - US President Donald Trump said Wednesday it was &ldquo;extremely hard&rdquo; to reach a deal with Chinese counterpart Xi Jinping, as he ramped up his global trade war by doubling tariffs on steel and aluminium imports.",https://static.bangkokpost.com/media/content/20250604/c1_5641681_700.jpg,2025-06-04T08:45:00Z,,"WASHINGTON - US President Donald Trump said Wednesday it was “extremely hard” to reach a deal with Chinese counterpart Xi Jinping, as he ramped up his global trade war by doubling tariffs on steel an… [+3986 chars]",,en,'Donald Trump'
14,http://www.rollingstone.com/politics/politics-features/trump-republican-bill-legalize-doge-dismantle-government-1235354830/,0,www.rollingstone.com,GOP Bill Would Legalize DOGE and Let Trump Dismantle Everything,Donald Trump’s DOGE team is on dubious legal footing. Republicans have an efficiency bill to let him tear apart the federal government.,https://www.rollingstone.com/wp-content/uploads/2025/06/trump-gop-bill-could-restructure-govt-.jpg?w=1600&h=900&crop=1,2025-06-04T14:29:38Z,,"With the so-called Department of Government Efficiency (DOGE) team on dubiouslegalfooting, congressional Republicans are quietly inching forward legislation to grant President Donald Trump new, lawfu… [+33365 chars]",,en,'Curtis Yarvin'
15,https://www.thelocal.de/20250604/germany-unveils-tax-breaks-to-boost-stagnant-economy,0,www.thelocal.de,Germany unveils tax breaks to boost stagnant economy,Germany's government on Wednesday put forward a sweeping package of corporate tax breaks aimed at boosting investment and pulling Europe's largest economy out of the doldrums.,https://assets.thelocal.com/cdn-cgi/rs:fit:1200/quality:75/plain/https://apiwp.thelocal.com/wp-content/uploads/2025/06/watermarks-logo-AFP__20250604__496M7KQ__v1__Preview__GermanyPoliticsGovernmentCabinet.jpg@webp,2025-06-04T16:05:52Z,,"Germany's government on Wednesday put forward a sweeping package of corporate tax breaks aimed at boosting investment and pulling Europe's largest economy out of the doldrums.
 ""It's important to se… [+2316 chars]",,en,'nan nan'
16,https://biztoc.com/x/6c30ec12c9aa04f4,0,biztoc.com,Wednesday assorted links,"1. Australia may be passing a tax on unrealized capital gains.
2. The wisdom of Nate Silver.
3. The full Tic Tac 2010 report. Here is one summary. Here is a Grok summary. I will read it when back home.
4. Curtis Yarvin profile (New Yorker).
5. A new and diffe…",https://biztoc.com/cdn/948/og.png,2025-06-04T16:14:40Z,,1. Australia may be passing a tax on unrealized capital gains.2. The wisdom of Nate Silver.3. The full Tic Tac 2010 report. Here is one summary. Here is a Grok summary. I will read it when back home.… [+149 chars],,en,'Curtis Yarvin'
17,https://biztoc.com/x/9e44887b598fc9ea,0,biztoc.com,"Putin, Pope Leo XIV discuss Ukraine, protecting Christians",Kremlin spokesperson Dmitry Peskov told Tass on Wednesday that Russian President Vladimir Putin held a phone call with Pope Leo XIV. It was the first time Putin spoke with the leader of the Catholic C...,https://biztoc.com/cdn/9e44887b598fc9ea_s.webp,2025-06-04T17:10:13Z,,Kremlin spokesperson Dmitry Peskov told Tass on Wednesday that Russian President Vladimir Putin held a phone call with Pope Leo XIV. It was the first time Putin spoke with the leader of the Catholic … [+69 chars],,en,'Pope Leo'
18,https://www.digitaljournal.com/world/germany-unveils-tax-breaks-to-boost-stagnant-economy/article,0,www.digitaljournal.com,Germany unveils tax breaks to boost stagnant economy,Germany’s government on Wednesday put forward a sweeping package of corporate tax breaks aimed at boosting investment and pulling Europe’s largest economy out of the doldrums. “It’s important to send a clear signal in support of our country’s economic strengt…,https://www.digitaljournal.com/wp-content/uploads/2025/06/61a19c38d52ca57ba5e523d59e92d04155f9e5f6.jpg,2025-06-04T21:37:35Z,,"Germany's economy has struggled in recent years in the face of high production costs at home, increasingly fierce Chinese competition and growing global trade tensions fired by US President Donald Tr… [+2483 chars]",,en,'nan nan'
https://economictimes.indiatimes.com/markets/stocks/news/d-streets-lofty-equity-valuations-are-pure-bollywood-andy-mukherjee/articleshow/121664191.cms,https://economictimes.indiatimes.com/markets/stocks/news/d-streets-lofty-equity-valuations-are-pure-bollywood-andy-mukherjee/articleshow/121664191.cms,0,economictimes.indiatimes.com,D-Street's lofty equity valuations are pure Bollywood: Andy Mukherjee,Indian equity valuations puzzle experts. Cement companies are pricier than global peers. Some believe retail investors follow tycoons like Mukesh Ambani and Gautam Adani. Adani's cement consolidation may boost pricing power. Domestic funds face pressure to in…,"https://img.etimg.com/thumb/msid-121664185,width-1200,height-630,imgsize-72122,overlay-etmarkets/articleshow.jpg",2025-06-06T03:35:48Z,,"Even to seasoned investment professionals, Indias lofty equity valuations are a head-scratcher. Hows a sell-side researcher to explain to a foreign institution that the countrys cement makers are mor… [+4381 chars]",,en,'Gautam Adani'
19,https://financialpost.com/pmn/musks-starlink-gets-key-license-to-launch-satellite-internet-services-in-india,0,financialpost.com,Musk’s Starlink gets key license to launch satellite internet services in India,"NEW DELHI (AP) — India has granted a key license to Elon Musk’s Starlink, bringing the satellite provider a step closer to launching its commercial internet services in the country, a top Indian government official said on Friday. “Yes. License has been grant…",,2025-06-06T13:25:15Z,,"NEW DELHI (AP) India has granted a key license to Elon Musks Starlink, bringing the satellite provider a step closer to launching its commercial internet services in the country, a top Indian governm… [+4121 chars]",,en,'Elon Musk'
https://abcnews.go.com/Business/wireStory/musks-starlink-gets-key-license-launch-satellite-internet-122571827,https://abcnews.go.com/Business/wireStory/musks-starlink-gets-key-license-launch-satellite-internet-122571827,0,abcnews.go.com,Musk's Starlink gets key license to launch satellite internet services in India,Elon Musk’s Starlink has received a key license in India for launching its satellite internet services in the country,https://s.abcnews.com/images/US/abc_news_default_2000x2000_update_16x9_992.jpg,2025-06-06T13:42:02Z,,"NEW DELHI -- India has granted a key license to Elon Musks Starlink, bringing the satellite provider a step closer to launching its commercial internet services in the country, a top Indian governmen… [+1917 chars]",,en,'Elon Musk'
20,https://www.euractiv.com/section/politics/opinion/the-brief-6-june-2025-the-good-the-bad-and-the-ugly/,0,www.euractiv.com,"The Brief – 6 June 2025: The Good, the Bad, and the Ugly",Brussels started the week smarting after the Polish presidential elections. On Tuesday Geert Wilders torpedoed the Dutch government. Meanwhile France is doing battle with Big Porn. Here are highlights from a lively week.,https://www.euractiv.com/wp-content/uploads/sites/2/2025/06/BT1-3.jpg,2025-06-06T16:22:19Z,,"Mark your calendars: VivaTech returns to Paris between June 11-14
Join Europe's biggest startup and tech event! Only a few days left to secure your spot.
Book your pass now!
Good afternoon and wel… [+4119 chars]",,en,'George Simion'
https://timesofindia.indiatimes.com/city/mumbai/mukesh-ambani-announces-151cr-endowment-to-his-alma-mater-ict/articleshow/121683104.cms,https://timesofindia.indiatimes.com/city/mumbai/mukesh-ambani-announces-151cr-endowment-to-his-alma-mater-ict/articleshow/121683104.cms,0,timesofindia.indiatimes.com,Mukesh Ambani announces 151cr endowment to his alma mater ICT,"Mumbai: When Mukesh Ambani — India's richest man and chairman of Reliance Industries — returned to his alma mater, the Institute of Chemical Technolog.","https://static.toiimg.com/thumb/msid-117518373,width-1070,height-580,imgsize-98012,resizemode-75,overlay-toi_sw,pt-32,y_pad-40/photo.jpg",2025-06-06T18:25:46Z,,"Lights, Camera, Exorcism! 9 actresses who played possessed roles flawlessly",,en,'Mukesh Ambani'
21,https://economictimes.indiatimes.com/news/india/mukesh-ambani-gifts-rs-151-crore-to-ict-as-guru-dakshina-to-mentor-prof-m-m-sharma/articleshow/121691431.cms,0,economictimes.indiatimes.com,Mukesh Ambani gifts Rs 151 crore to ICT as 'Guru Dakshina' to mentor Prof M M Sharma,"Mukesh Ambani, Chairman of Reliance Industries, donated Rs 151 crore to the Institute of Chemical Technology. The donation occurred during the launch of Professor Man Mohan Sharma's biography. Ambani called the donation Guru Dakshina, acknowledging Sharma's g…","https://img.etimg.com/thumb/msid-121691462,width-1200,height-630,imgsize-18218,overlay-economictimes/articleshow.jpg",2025-06-07T08:30:37Z,,"Investment Ideas
Grow your wealth with stock ideas &amp; sectoral trends.
Stock Reports Plus
Buy low &amp; sell high with access to Stock Score, Upside potential &amp; more. 
BigBull Porfolio
Ge… [+438 chars]",,en,'Mukesh Ambani'
22,https://www.irishtimes.com/opinion/2025/06/07/mark-oconnell-what-a-surprise-to-learn-this-powerful-wizard-of-the-dark-enlightenment-is-just-another-needy-dork/,0,www.irishtimes.com,Mark O'Connell: What a surprise to learn this powerful wizard of the Dark Enlightenment is just another needy dork,"Curtis Yarvin has, for about a decade and a half now, been a highly influential figure on Silicon Valley’s anti-democratic right",https://www.irishtimes.com/resizer/v2/GWOV2IE22JAHRDCNVSJPSMT3SQ.jpg?smart=true&auth=4602a8a3bd3fecdb65f4b0526cade3f6a309ed3341abacd80d07f9a3bf0ca90f&width=1200&height=630,2025-06-08T05:00:00Z,,"This weeks issue of the New Yorker features a long, fascinating profile of the rightwing blogger and software developer Curtis Yarvin, by the writer Ava Kofman. Yarvin has, for about a decade and a h… [+7366 chars]",,en,'Curtis Yarvin'
23,https://www.thehindubusinessline.com/companies/gautam-adanis-draws-1041-cr-pay-in-fy25-lags-behind-peers/article69670763.ece,0,www.thehindubusinessline.com,"Gautam Adani's draws ₹10.41 cr pay in FY25, lags behind peers",Gautam Adani's 2024-25 remuneration of ₹10.41 crore is lower than industry peers and his key executives.,https://bl-i.thgim.com/public/incoming/pfql4w/article69670773.ece/alternates/LANDSCAPE_1200/2024-11-28T193006Z_950630400_RC2IEBAJC3UF_RTRMADP_3_ADANI-GROUP-USA-ANDHRA-STATE.JPG,2025-06-08T05:25:56Z,,"India's second richest person Gautam Adani received a total remuneration of 10.41 crore in the fiscal year ended March 31, 2025, lower than most industry peers and his own key executives.
Adani, 62,… [+3285 chars]",,en,'Gautam Adani'
24,https://www.abc.net.au/news/2025-06-08/pope-leo-xiv-criticises-nationalism-sunday-mass/105392026,0,www.abc.net.au,"Leo XIV, the first US-born pope, criticises nationalism at Sunday mass","Pope Leo criticised the emergence of nationalist political movements around the globe on Sunday, calling them ""unfortunate"" — without naming a specific country or national leader.",https://live-production.wcms.abc-cdn.net.au/bcd6d1396755b627f96619bcc66176b3?impolicy=wcms_watermark_news&cropH=1755&cropW=3120&xPos=0&yPos=158&width=862&height=485&imformat=generic,2025-06-08T11:50:35Z,,"Pope Leo criticised the emergence of nationalist political movements around the globe on Sunday, calling them unfortunate, without naming a specific country or national leader.
Leo, the first pope t… [+1826 chars]",,en,'Robert Francis Prevost'
25,https://www.theatlantic.com/politics/archive/2025/06/obama-retirement-trump-era/683068/,0,www.theatlantic.com,Where Is Barack Obama?,The “audacity of hope” presidency has given way to the fierce lethargy of semi-retirement.,https://cdn.theatlantic.com/thumbor/CVOG8CjjfX8MoV_maZ-RsniWJW4=/0x68:2696x1472/1200x625/media/img/mt/2025/06/2025_05_27_obama/original.jpg,2025-06-08T12:00:00Z,,"Last month, while Donald Trump was in the Middle East being gifted a $400 million luxury jet from Qatar, Barack Obama headed off on his own foreign excursion: a trip to Norway, in a much smaller and … [+15488 chars]",,en,'Pope Leo'
26,https://www.npr.org/2025/06/08/nx-s1-5427172/pope-leo-criticizes-political-nationalism-prays-for-reconciliation,0,www.npr.org,Pope Leo criticizes political nationalism and prays for reconciliation and dialogue,"The pope celebrated Sunday Mass in St. Peter's Square in front of tens of thousands faithful, and asked the Holy Spirit to ""break down barriers and tear down the walls of indifference and hatred.""",https://npr.brightspotcdn.com/dims3/default/strip/false/crop/4850x2728+0+245/resize/1400/quality/100/format/jpeg/?url=http%3A%2F%2Fnpr-brightspot.s3.amazonaws.com%2F1a%2Ffe%2F2930fd264d2f805759874f344ac4%2Fap25159310610279.jpg,2025-06-08T17:43:06Z,,VATICAN CITY Pope Leo XIV criticized the surge of nationalist political movements in the world as he prayed Sunday for reconciliation and dialogue a message in line with his pledges to make the Catho… [+1366 chars],,en,'Pope Leo'
27,http://www.rollingstone.com/politics/politics-news/israel-detains-greta-thunberg-activists-gaza-aid-ship-1235359000/,0,www.rollingstone.com,"Israel Detains Greta Thunberg, Other Activists After Halting Gaza-Bound Aid Ship",Israeli forces detained Greta Thunberg and other activists after it halted a Gaza-bound humanitarian aid ship.,https://www.rollingstone.com/wp-content/uploads/2025/06/GretaThunberg-1.jpg?w=1600&h=900&crop=1,2025-06-09T03:29:51Z,,"Israel has detained Greta Thunberg and other activists with the Freedom Flotilla Coalition (FFC), who were aboard a humanitarian aid ship the Madleen en route to Gaza when it was intercepted. The ves… [+2037 chars]",,en,'Pope Leo'
28,https://radaronline.com/p/pope-leo-entitled-to-33000-month-salary/,0,radaronline.com,"EXCLUSIVE: Holy Roller! How Pope Leo Could Rake in $33,000 a MONTH – Without Spending a Penny","Pope Leo could rake in $33,000 a month – and get to save it all.",https://media.radaronline.com/brand-img/lzRaVu28I/1200x628/holy-payday-pope-leo-rakes-33000-monthly-no-spending-1749118877658.jpg,2025-06-09T10:30:00Z,,"It really is pennies from heaven. 
Newly installed Pope Leo XIV is entitled to a massive monthly stipend thats estimated at $33,000 in addition to other pricey perks as the head of the Roman Catholi… [+601 chars]",,en,'Robert Francis Prevost'
29,https://www.artnews.com/art-news/news/us-pavilion-2026-venice-biennale-dissident-right-art-hos-1234744650/,0,www.artnews.com,‘Dissident-Right Art Hos’ US Pavilion Pitched for Venice Biennale by Far-Right Blogger Curtis Yarvin,Far-right blogger Curtis Yarvin has pitched a 'dissident-right art hos' US Pavilion for the 2026 Venice Biennale.,https://www.artnews.com/wp-content/uploads/2025/06/GettyImages-2150951142.jpg?w=1024,2025-06-09T15:37:38Z,,"While many countries have begun revealing their plans for their pavilions at the 2026 Venice Biennale, one nation notably has not: the United States. And while the application process for that pavili… [+2430 chars]",,en,'Curtis Yarvin'
30,https://www.rt.com/news/618870-ex-british-pm-threatened-icc/,0,www.rt.com,Ex-British PM threatened ICC over Israel – media,David Cameron reportedly warned prosecutor Karim Khan against issuing arrest warrants for Israeli leaders Read Full Article at RT.com,https://mf.b37mrtl.ru/files/2025.06/article/6847378b85f54018a67006a2.jpg,2025-06-09T20:23:12Z,,Former British Prime Minister David Cameron threatened to defund the International Criminal Court (ICC) and withdraw the UK from its founding treaty if Chief Prosecutor Karim Khan sought arrest warra… [+1861 chars],,en,'David Cameron'
