index,url,valid,domain,title,description,image,published,archive,content,quote,language,keyword
https://www.theroot.com/republican-group-likens-kamala-harris-to-a-slave-d-l-1851637044,https://www.theroot.com/republican-group-likens-kamala-harris-to-a-slave-d-l-1851637044,0,www.theroot.com,"Republican Group Likens Kamala Harris To A Slave, D.L. Hughley Publicly Apologizes To VP, Don Lemon Interview Black Trump Supporters, 5 Top Moments From Kamala Harris’ First Interview And More","Photo: KEVIN LAMARQUE (Getty Images), The Denver Post, Gabrielle Lurie (Getty Images), Jason Allen (AP), OLIVIER DOULIERY (Getty Images), Brian Cassella (Getty Images), KAMIL KRZACZYNSKI (Getty Images), Image: Jacek Boczarski (Getty Images), Arturo Holmes (Ge…","https://i.kinja-img.com/image/upload/c_fill,h_675,pg_1,q_80,w_1200/ebbdcb4ab13cb59d16c25b331b52620f.jpg",2024-09-01T04:00:00Z,,"Fathers. We all have them, but all too often, parental dynamics dont go as smooth as we want them to. Last Thursday, Vice President Kamala Harris gave the most important speech of her career thus far… [+174 chars]",,en,'Kamala Harris'
https://www.etfdailynews.com/2024/09/01/1140-shares-in-alphabet-inc-nasdaqgoogl-purchased-by-strategic-financial-partners-ltd/,https://www.etfdailynews.com/2024/09/01/1140-shares-in-alphabet-inc-nasdaqgoogl-purchased-by-strategic-financial-partners-ltd/,0,www.etfdailynews.com,"1,140 Shares in Alphabet Inc. (NASDAQ:GOOGL) Purchased by Strategic Financial Partners Ltd.","Strategic Financial Partners Ltd. purchased a new position in Alphabet Inc. (NASDAQ:GOOGL – Free Report) during the second quarter, according to its most recent Form 13F filing with the SEC. The fund purchased 1,140 shares of the information services provider…",https://www.americanbankingnews.com/wp-content/timthumb/timthumb.php?src=https://www.marketbeat.com/logos/google-inc-logo-1200x675.png&w=240&h=240&zc=2,2024-09-01T10:10:47Z,,"Strategic Financial Partners Ltd. purchased a new position in Alphabet Inc. (NASDAQ:GOOGL – Free Report) during the second quarter, according to its most recent Form 13F filing with the SEC. The fund… [+6633 chars]",,en,'nan nan'
https://www.etfdailynews.com/2024/09/01/oldfather-financial-services-llc-acquires-300-shares-of-alphabet-inc-nasdaqgoogl/,https://www.etfdailynews.com/2024/09/01/oldfather-financial-services-llc-acquires-300-shares-of-alphabet-inc-nasdaqgoogl/,0,www.etfdailynews.com,Oldfather Financial Services LLC Acquires 300 Shares of Alphabet Inc. (NASDAQ:GOOGL),"Oldfather Financial Services LLC lifted its stake in Alphabet Inc. (NASDAQ:GOOGL – Free Report) by 22.5% in the second quarter, according to its most recent Form 13F filing with the Securities and Exchange Commission (SEC). The firm owned 1,635 shares of the …",https://www.americanbankingnews.com/wp-content/timthumb/timthumb.php?src=https://www.marketbeat.com/logos/google-inc-logo-1200x675.png&w=240&h=240&zc=2,2024-09-01T10:10:48Z,,"Oldfather Financial Services LLC lifted its stake in Alphabet Inc. (NASDAQ:GOOGL – Free Report) by 22.5% in the second quarter, according to its most recent Form 13F filing with the Securities and Ex… [+6783 chars]",,en,'Sundar Pichai'
https://www.huffpost.com/entry/ap-us-election-2024-trump-influencers_n_66d4554ee4b0c1583a903392,https://www.huffpost.com/entry/ap-us-election-2024-trump-influencers_n_66d4554ee4b0c1583a903392,0,www.huffpost.com,Trump Courts Conservative Male Influencers To Try To Reach Younger Men,"Donald Trump’s campaign has fully embraced the bravado-filled, macho, often contrarian online spaces of younger men on livestreaming platforms.",https://img.huffingtonpost.com/asset/66d455a02300003a0078216e.jpeg?ops=1200_630,2024-09-01T11:53:50Z,,"Former US President and Republican presidential candidate Donald Trump speaks during a town hall meeting at La Crosse Center in La Crosse, Wisconsin, on August 29, 2024. (Photo by KAMIL KRZACZYNSKI /… [+7933 chars]",,en,'Don Lemon'
https://www.etfdailynews.com/2024/09/01/339047-shares-in-alphabet-inc-nasdaqgoog-acquired-by-hantz-financial-services-inc/,https://www.etfdailynews.com/2024/09/01/339047-shares-in-alphabet-inc-nasdaqgoog-acquired-by-hantz-financial-services-inc/,0,www.etfdailynews.com,"339,047 Shares in Alphabet Inc. (NASDAQ:GOOG) Acquired by Hantz Financial Services Inc.","Hantz Financial Services Inc. acquired a new stake in shares of Alphabet Inc. (NASDAQ:GOOG – Free Report) in the 2nd quarter, according to its most recent 13F filing with the SEC. The fund acquired 339,047 shares of the information services provider’s stock, …",https://www.americanbankingnews.com/wp-content/timthumb/timthumb.php?src=https://www.marketbeat.com/logos/google-inc-logo-1200x675.png&w=240&h=240&zc=2,2024-09-01T14:24:48Z,,"Hantz Financial Services Inc. acquired a new stake in shares of Alphabet Inc. (NASDAQ:GOOG – Free Report) in the 2nd quarter, according to its most recent 13F filing with the SEC. The fund acquired 3… [+5827 chars]",,en,'Sundar Pichai'
http://www.rollingstone.com/politics/politics-news/trump-orban-republicans-concerned-1235093328/,http://www.rollingstone.com/politics/politics-news/trump-orban-republicans-concerned-1235093328/,0,www.rollingstone.com,Trump Praises Authoritarian Viktor Orbán and Even Republicans Are Concerned,The Hungarian prime minister has visited Trump in Florida twice this year and boasted that he has influence over Trump's policy proposals,https://www.rollingstone.com/wp-content/uploads/2024/09/GettyImages-2168336456.jpg?w=1600&h=900&crop=1,2024-09-01T15:05:59Z,https://web.archive.org/web/20240901154148/https://www.rollingstone.com/politics/politics-news/trump-orban-republicans-concerned-1235093328/,"Donald Trump praised Hungarian Prime Minister Viktor Orbán, but some Republicans have deep concerns about Orbán’s influence over the former president.
“Viktor Orbán… I mean he’s strong. They conside… [+2243 chars]",,en,'Viktor Orbán'
https://www.etfdailynews.com/2024/09/01/davies-financial-advisors-inc-has-2-30-million-position-in-alphabet-inc-nasdaqgoog/,https://www.etfdailynews.com/2024/09/01/davies-financial-advisors-inc-has-2-30-million-position-in-alphabet-inc-nasdaqgoog/,0,www.etfdailynews.com,Davies Financial Advisors Inc. Has $2.30 Million Position in Alphabet Inc. (NASDAQ:GOOG),"Davies Financial Advisors Inc. cut its position in shares of Alphabet Inc. (NASDAQ:GOOG – Free Report) by 6.2% during the second quarter, Holdings Channel reports. The institutional investor owned 12,530 shares of the information services provider’s stock aft…",https://www.americanbankingnews.com/wp-content/timthumb/timthumb.php?src=https://www.marketbeat.com/logos/google-inc-logo-1200x675.png&w=240&h=240&zc=2,2024-09-01T15:38:52Z,,"Davies Financial Advisors Inc. cut its position in shares of Alphabet Inc. (NASDAQ:GOOG – Free Report) by 6.2% during the second quarter, Holdings Channel reports. The institutional investor owned 12… [+6394 chars]",,en,'nan nan'
https://www.indiewire.com/news/festivals/wolfs-venice-george-clooney-brad-pitt-streaming-1235042771/,https://www.indiewire.com/news/festivals/wolfs-venice-george-clooney-brad-pitt-streaming-1235042771/,0,www.indiewire.com,‘Wolfs’ Stars George Clooney and Brad Pitt Praise (and Admonish) Certain Aspects of Streaming,"Venice: While discussing his upcoming Apple TV+ feature ""Wolfs,"" Clooney reflected on past films he's done with streamers and the need for more theatrical opportunities.",https://www.indiewire.com/wp-content/uploads/2024/09/GettyImages-2169714194.jpg?w=650,2024-09-01T17:15:00Z,https://web.archive.org/web/20240901200528/https://www.indiewire.com/news/festivals/wolfs-venice-george-clooney-brad-pitt-streaming-1235042771/,"At the press conference for their new film “Wolfs,” which will have its world premiere at the Venice Film Festival, stars George Clooney and Brad Pitt kept things strictly professional in the sense t… [+2450 chars]",,en,'Jake Gyllenhaal'
https://time.com/7016688/george-clooney-president-biden-dropping-out-election-comments/,https://time.com/7016688/george-clooney-president-biden-dropping-out-election-comments/,0,time.com,George Clooney Addresses Biden Dropping Out After His Op-Ed Called for a New Nominee,"At the Venice Film Festival, George Clooney discussed President Joe Biden dropping out of the election race after he publicly urged him to.",https://api.time.com/wp-content/uploads/2024/09/Untitled-design-7.png?w=1200&h=628&crop=1,2024-09-01T17:31:58Z,,"Actor George Clooney addressed President Joe Biden dropping out of the presidential race, which he did 11 days after Clooney addressed the President in an opinion piece for the New York Times titled:… [+2665 chars]",,en,'George Clooney'
http://www.rollingstone.com/tv-movies/tv-movie-news/george-clooney-praises-selfless-biden-op-ed-response-1235093397/,http://www.rollingstone.com/tv-movies/tv-movie-news/george-clooney-praises-selfless-biden-op-ed-response-1235093397/,0,www.rollingstone.com,George Clooney Praises Biden for Ending Campaign: ‘Most Selfless Thing a President Has Done’,"""For someone to say I think there’s a better path forward, all the credit goes to him,"" says actor who penned op-ed calling for Biden to step down as Democratic candidate",https://www.rollingstone.com/wp-content/uploads/2024/09/GettyImages-2169732980.jpg?w=1600&h=900&crop=1,2024-09-01T19:25:25Z,,"George Clooney commented for the first time Sunday on his op-ed that called on Joe Biden to end his presidential campaign at the Venice International Film Festival, where the actor also praised the “… [+1893 chars]",,en,'George Clooney'
https://www.slashfilm.com/1654608/wolfs-review-george-clooney-brad-pitt/,https://www.slashfilm.com/1654608/wolfs-review-george-clooney-brad-pitt/,0,www.slashfilm.com,"Wolfs Review: Brad Pitt And George Clooney Reunite For A Stylish, Serviceable Scorsese Riff","Frequently funny and consistently stylish, Wolfs, starring George Clooney and Brad Pitt, is an enjoyable enough crime comedy. Here's our review.",https://www.slashfilm.com/img/gallery/wolfs-review-brad-pitt-and-george-clooney-reunite-for-a-stylish-serviceable-scorsese-riff/l-intro-1725050325.jpg,2024-09-01T19:50:00Z,,"Yet for as entertaining as ""Wolfs"" is, carried in no small part by Pitt and Clooney's command performances, viewers may come away slightly underwhelmed. Not all of that is the fault of Watts' actual … [+2806 chars]",,en,'George Clooney'
https://www.indiewire.com/criticism/movies/wolfs-review-george-clooney-brad-pitt-1235042813/,https://www.indiewire.com/criticism/movies/wolfs-review-george-clooney-brad-pitt-1235042813/,0,www.indiewire.com,‘Wolfs’ Review: Name a More Iconic Duo Than George Clooney and Brad Pitt in a Comic Thriller with Class,"Venice: Meanwhile, the very talented Austin Abrams holds his own alongside two matinee idols who star as fixers hired for the same job.",https://www.indiewire.com/wp-content/uploads/2024/08/Wolfs_898591.png?w=650,2024-09-01T19:56:49Z,,"Jon Watts rediscovers his filmmaking joie de vivre with the classic comic thriller “Wolfs,” starring George Clooney and Brad Pitt as a pair of lone-working fixers who find themselves cleaning up the … [+4514 chars]",,en,'Brad Pitt'
https://rlsbb.cc/various-artists-country-mixtape-2024-2024/,https://rlsbb.cc/various-artists-country-mixtape-2024-2024/,0,rlsbb.cc,Various Artists - Country Mixtape 2024 (2024),Tracklist:01. Dasha - Austin (Boots Stop Workin')02. Zach Bryan - Pink Skies03. Warren Zeiders - Heartbreaker04. Brittney Spencer - New to This Town05. Gwen Stefani - Purple Irises06. Cameron Whitcomb - Rocking Chair07. Eli Winders - Another Love08. Megan Mor…,,2024-09-01T20:21:23Z,,Tracklist:01. Dasha - Austin (Boots Stop Workin')02. Zach Bryan - Pink Skies03. Warren Zeiders - Heartbreaker04. Brittney Spencer - New to This Town05. Gwen Stefani - Purple Irises06. Cameron Whitcom… [+1539 chars],,en,'Zach Bryan'
https://www.tmz.com/2024/09/01/brad-pitt-red-carpet-debut-ines-de-ramon/,https://www.tmz.com/2024/09/01/brad-pitt-red-carpet-debut-ines-de-ramon/,0,www.tmz.com,Brad Pitt Makes Red Carpet Debut with Ines de Ramon at Venice Film Festival,Brad Pitt's taking a big step with his girlfriend Ines de Ramon in Italy ... stepping out with her in the most official way a celeb can -- with a red carpet under their feet! The dynamic duo hit the Venice Film Festival red carpet Sunday night…,https://imagez.tmz.com/image/22/16by9/2024/09/01/2286d568f8cc415490fa351d5e209e91_xl.jpg,2024-09-01T21:59:45Z,,"Brad Pitt's taking a big step with his girlfriend Ines de Ramon in Italy ... stepping out with her in the most official way a celeb can -- with a red carpet under their feet!
The dynamic duo hit the… [+1443 chars]",,en,'George Clooney'
https://www.indiewire.com/news/festivals/wolfs-premiere-george-clooney-brad-pitt-1235042847/,https://www.indiewire.com/news/festivals/wolfs-premiere-george-clooney-brad-pitt-1235042847/,0,www.indiewire.com,‘Wolfs’ Premiere Proves George Clooney and Brad Pitt Still Stop Fans in Their Tracks,Fans and celebrities alike were out in force for the world premiere of the duo's Apple TV+ crime comedy at Venice Film Festival.,https://www.indiewire.com/wp-content/uploads/2024/09/GettyImages-2169776610.jpg?w=650,2024-09-01T23:23:58Z,,"There really is another level of star power when a film adds both George Clooney and Brad Pitt to the equation.
While the big premieres at the 2024 Venice Film Festival so far have had some wiggle r… [+2331 chars]",,en,'Brad Pitt'
https://www.foxnews.com/media/germany-started-criminal-investigation-social-media-user-calling-female-politician-fat,https://www.foxnews.com/media/germany-started-criminal-investigation-social-media-user-calling-female-politician-fat,0,www.foxnews.com,Germany started criminal investigation into social media user for mocking politician for being 'fat',"Germany attempted to launch a criminal investigation into a Gab user for allegedly calling politician Ricarda Lang 'fat,' but the social media company refused to comply with demands.",https://static.foxnews.com/foxnews.com/content/uploads/2024/08/female-politician-.jpg,2024-09-02T01:00:08Z,https://web.archive.org/web/20240902010908/https://www.foxnews.com/media/germany-started-criminal-investigation-social-media-user-calling-female-politician-fat,"German officials attempted to start a criminal investigation into a Gab social media user who allegedly called a left-wing female politician ""fat,"" but the platform refused to comply with the German … [+3002 chars]",,en,'Ricarda Lang'
https://www.boredpanda.com/brad-pitt-girlfriend-ines-de-ramon-red-carpet-venice-film-festival/,https://www.boredpanda.com/brad-pitt-girlfriend-ines-de-ramon-red-carpet-venice-film-festival/,0,www.boredpanda.com,Brad Pitt Goes Red Carpet Official With Girlfriend Ines de Ramon Amid Heated Divorce Battle,"Brad Pitt and Ines de Ramon made their relationship red carpet official at the 2024 Venice Film Festival about two years after they began dating.
The post Brad Pitt Goes Red Carpet Official With Girlfriend Ines de Ramon Amid Heated Divorce Battle first appear…",https://www.boredpanda.com/blog/wp-content/uploads/2024/09/fb_image_66d56281aae23.png,2024-09-02T08:15:17Z,,"Brad Pitt and Ines de Ramon made their relationship red carpet official in the most glamorous way possible—by walking hand-in-hand at one of the world’s most prestigious film festivals.
About two ye… [+3278 chars]",,en,'Ines de Ramon'
http://deadline.com/2024/09/ethan-hawke-francis-ford-coppola-megalopolis-richard-linklater-blue-moon-venice-film-festival-2024-1236075556/,http://deadline.com/2024/09/ethan-hawke-francis-ford-coppola-megalopolis-richard-linklater-blue-moon-venice-film-festival-2024-1236075556/,0,deadline.com,Ethan Hawke Praises Francis Ford Coppola’s Self-Funded ‘Megalopolis’ & Teases Performance In Richard Linklater’s ‘Blue Moon’: “It’s The Hardest I’ve Ever Worked”,Ethan Hawke rolled through the Venice Film Festival this morning for a career Q&A ahead of a gala event this evening where he will present Aussie filmmaker Peter Weir with a career achievement award. The session was long and partly in Italian. Hawke’s answers…,https://deadline.com/wp-content/uploads/2024/09/GettyImages-2169694582-e1725268410374.jpg?w=1024,2024-09-02T09:15:48Z,https://web.archive.org/web/20240902091824/https://deadline.com/2024/09/ethan-hawke-francis-ford-coppola-megalopolis-richard-linklater-blue-moon-venice-film-festival-2024-1236075556/,Ethan Hawke rolled through the Venice Film Festival this morning for a career Q&amp;A ahead of a gala event this evening where he will present Aussie filmmaker Peter Weir with a career achievement aw… [+2973 chars],,en,'Francis Ford Coppola'
https://finance.yahoo.com/news/warren-buffett-cautioned-ready-stock-104500651.html,https://finance.yahoo.com/news/warren-buffett-cautioned-ready-stock-104500651.html,0,finance.yahoo.com,Warren Buffett cautioned that you should be ready for any stock you buy to plunge ‘50% or more’,The legendary investor says this type of person shouldn't own stocks.,https://media.zenfs.com/en/moneywise_327/91864839a9a0c977218a86637a5bea8e,2024-09-02T10:45:00Z,,"Warren Buffett cautioned that you should be ready for any stock you buy to plunge 50% or more
One of Warren Buffetts most famous pieces of advice is to be fearful when others are greedy and to be gr… [+4511 chars]",,en,'Warren Buffet'
https://www.businessinsider.com/george-clooney-brad-pitt-wolfs-35-million-why-pay-cut-2024-9,https://www.businessinsider.com/george-clooney-brad-pitt-wolfs-35-million-why-pay-cut-2024-9,0,www.businessinsider.com,George Clooney denied he and Brad Pitt were each paid $35 million for 'Wolfs.' Here's why they had to return some of their pay.,"George Clooney debunked a New York Times report that he and Brad Pitt were paid $35 million for the upcoming action-comedy movie ""Wolfs.""",https://i.insider.com/66d58a09289b805d1db363eb?width=1200&format=jpeg,2024-09-02T10:50:18Z,,"George Clooney and Brad Pitt at the Venice International Film Festival World Premiere for ""Wolfs.""Eric Charbonneau/Apple TV+ via Getty Images
<ul><li>The New York Times reported George Clooney and B… [+2369 chars]",,en,'George Clooney'
https://appleinsider.com/articles/24/09/02/tim-cook-hangs-out-with-george-clooney-as-wolfs-gets-standing-ovation,https://appleinsider.com/articles/24/09/02/tim-cook-hangs-out-with-george-clooney-as-wolfs-gets-standing-ovation,0,appleinsider.com,Tim Cook hangs out with George Clooney as 'Wolfs' gets standing ovation,"Tim Cook was in Italy for the Venice Film Festival where Apple TV+ movie ""Wolfs"" got its world premiere, while George Clooney called it a ""bummer"" that Apple was limiting its theatrical release.Brad Pitt and George Clooney in 'Wolfs'""Wolfs"" premiered out of c…",https://photos5.appleinsider.com/gallery/59840-122481-wolfs-pitt-clooney-xl.jpg,2024-09-02T12:00:25Z,,"Tim Cook was in Italy for the Venice Film Festival where Apple TV+ movie ""Wolfs"" got its world premiere, while George Clooney called it a ""bummer"" that Apple was limiting its theatrical release.
""Wo… [+1179 chars]",,en,'Brad Pitt'
https://www.newsweek.com/jason-kelce-buffalo-wild-wings-collab-dad-ed-kelce-request-1947532,https://www.newsweek.com/jason-kelce-buffalo-wild-wings-collab-dad-ed-kelce-request-1947532,0,www.newsweek.com,Jason Kelce's Dad Sends Buffalo Wild Wings Request Amid Son's New Gig,"The former Philadelphia Eagles star teamed up with the restaurant to promote his ""Kelce's Picks"" menu items.",https://d.newsweek.com/en/full/2462403/jason-kelce-ed-kelce-novacare-complex-philadelphia.png,2024-09-02T14:07:10Z,,"Jason Kelce's dad has sent Buffalo Wild Wings a request amid his son's new gig with the restaurant.
Jason Kelce announced his retirement from the Philadelphia Eagles in March after 13 seasons with t… [+3404 chars]",,en,'Jason Kelce'
https://freerepublic.com/focus/f-news/4262273/posts,https://freerepublic.com/focus/f-news/4262273/posts,0,freerepublic.com,"RFK, Jr. podcast with Rand Paul. Our discussion today with
US Senator Rand Paul covers the censorship of opinions and ideas related to the pandemic…","Our discussion today with US Senator Rand Paul covers the censorship of opinions and ideas related to the pandemic, emphasizing the importance of free speech and the marketplace of ideas. This conversation touches on the history and current state of bioweapon…",,2024-09-02T15:19:50Z,https://web.archive.org/web/20240902165127/https://freerepublic.com/focus/f-news/4262273/posts,"Skip to comments.
RFK, Jr. podcast with Rand Paul. Our discussion today with
US Senator Rand Paul covers the censorship of opinions and ideas related to the pandemicYouTube ^
 | 8/17/24
 | RP and… [+1870 chars]",,en,'Rand Paul'
https://economictimes.indiatimes.com/news/international/us/presumed-innocent-season-2-will-jake-gyllenhaal-return-heres-all-speculations-about-storyline/articleshow/113000476.cms,https://economictimes.indiatimes.com/news/international/us/presumed-innocent-season-2-will-jake-gyllenhaal-return-heres-all-speculations-about-storyline/articleshow/113000476.cms,0,economictimes.indiatimes.com,Presumed Innocent Season 2: Will Jake Gyllenhaal return? Here’s all speculations about storyline,"Apple TV+ has confirmed a second season for ""Presumed Innocent."" The show, which Apple claims is its most-watched drama, left viewers with many questions after Season 1. While details on the story and cast remain unclear, speculation suggests multiple possibl…","https://img.etimg.com/thumb/msid-113000465,width-1200,height-630,imgsize-20276,overlay-economictimes/photo.jpg",2024-09-02T15:51:49Z,https://web.archive.org/web/20240902163621/https://economictimes.indiatimes.com/news/international/us/presumed-innocent-season-2-will-jake-gyllenhaal-return-heres-all-speculations-about-storyline/articleshow/113000476.cms,"Apple TV+ has officially announced the renewal of ""Presumed Innocent"" for a second season. With Season 1's conclusion, fans are curious about the direction the show will take in its next chapter.Pres… [+1806 chars]",,en,'Jake Gyllenhaal'
https://economictimes.indiatimes.com/news/international/us/elon-musk-out-of-control-should-be-threatened-with-arrest-says-ex-clinton-secretary/articleshow/113000733.cms,https://economictimes.indiatimes.com/news/international/us/elon-musk-out-of-control-should-be-threatened-with-arrest-says-ex-clinton-secretary/articleshow/113000733.cms,0,economictimes.indiatimes.com,"Elon Musk, out of control, should be threatened with arrest, says ex-Clinton secretary","Robert Reich, the former labor secretary, calls Elon Musk out of control and offers ways to limit his power, especially concerning X and SpaceX.","https://img.etimg.com/thumb/msid-113000731,width-1200,height-630,imgsize-26856,overlay-economictimes/photo.jpg",2024-09-02T16:06:33Z,,"Elon Musk, according to former labor secretary Robert Reich, is out of control, and authorities should threaten arrest. In a column that was published on Friday, former Labor Secretary Robert Reich, … [+3093 chars]",,en,'Jake Gyllenhaal'
https://punchng.com/bill-gates-to-meet-with-african-leaders-to-discuss-health-agriculture/,https://punchng.com/bill-gates-to-meet-with-african-leaders-to-discuss-health-agriculture/,0,punchng.com,"Bill Gats to meet African leaders on health, agriculture","The co-chair of the Bill & Melinda Gates Foundation, Bill Gates is visiting Nigeria this week, as part of the foundation’s ongoing commitment to Africa’s development. Gates will be meeting with national and local leaders, partners, grantees, and innovators to…",https://cdn.punchng.com/wp-content/uploads/2024/09/01231237/BILL-GATES.jpg,2024-09-02T16:11:25Z,,"The co-chair of the Bill &amp; Melinda Gates Foundation, Bill Gates is visiting Nigeria this week, as part of the foundation’s ongoing commitment to Africa’s development.
Gates will be meeting with … [+2303 chars]",,en,'Bill Gates'
https://www.thejournal.ie/germany-afd-explainer-6477104-Sep2024/,https://www.thejournal.ie/germany-afd-explainer-6477104-Sep2024/,0,www.thejournal.ie,Who are the far-right AfD and what are their chances of gaining power in Germany?,"The party won a state election in the country on Sunday, with Chancellor Olaf Scholz calling the result “worrying”.",https://img2.thejournal.ie/article/6477104/river/?height=400&version=6477679,2024-09-02T16:57:19Z,https://web.archive.org/web/20240902180443/https://www.thejournal.ie/germany-afd-explainer-6477104-Sep2024/,"GERMANY HAS SEEN a far-right political party win a state legislature election for the first time since the Second World War.
Alternative für Deutschland or Alternative for Germany (AfD) - topped the… [+11328 chars]",,en,'Thomas Haldenwang'
https://financialpost.com/pmn/business-pmn/harris-biden-teaming-up-to-court-union-vote-in-labor-day-blitz,https://financialpost.com/pmn/business-pmn/harris-biden-teaming-up-to-court-union-vote-in-labor-day-blitz,0,financialpost.com,"Harris, Biden Teaming Up to Court Union Vote in Labor Day Blitz","Vice President Kamala Harris is looking to strengthen her standing with blue-collar workers on Labor Day with visits to two critical swing states, including a joint campaign appearance with President Joe Biden.",,2024-09-02T17:08:10Z,,"Vice President Kamala Harris is looking to strengthen her standing with blue-collar workers on Labor Day with visits to two critical swing states, including a joint campaign appearance with President… [+9348 chars]",,en,'Joe Biden'
