index,url,valid,domain,title,description,image,published,archive,content,quote,language,keyword
https://www.counterpunch.org/2024/01/05/cubas-government-analyzes-and-responds-to-economic-woes/,https://www.counterpunch.org/2024/01/05/cubas-government-analyzes-and-responds-to-economic-woes/,0,www.counterpunch.org,Cuba’s Government Analyzes and Responds to Economic Woes,"“Our joy is immense … We don’t deceive ourselves thinking that everything ahead will be easy, when perhaps everything is going to be more difficult.” That was Fidel Castro, hours after the victory of Cuba’s Revolution. Difficulties were center stage 65 years …",https://www.counterpunch.org/wp-content/uploads/2021/06/cp-default-share.png,2024-01-05T06:49:11Z,,"Our joy is immense We dont deceive ourselves thinking that everything ahead will be easy, when perhaps everything is going to be more difficult. That was Fidel Castro, hours after the victory of Cuba… [+10891 chars]",,en,'Miguel Díaz-Canel'
https://pagesix.com/2024/01/05/entertainment/joe-jonas-enjoying-spending-time-with-model-stormi-bree-report/,https://pagesix.com/2024/01/05/entertainment/joe-jonas-enjoying-spending-time-with-model-stormi-bree-report/,0,pagesix.com,Joe Jonas ‘enjoying’ spending time with model Stormi Bree amid Sophie Turner divorce: report,"The DNCE frontman and former Miss Tennessee Teen USA have been spotted vacationing in Mexico and Aspen, Colo., this week.",https://pagesix.com/wp-content/uploads/sites/3/2024/01/74429962.jpg?quality=75&strip=all&w=1024,2024-01-05T12:52:20Z,,"Joe Jonas is “Burnin’ Up” for Stormi Bree.
The Jonas Brothers member is “enjoying” spending time with the model amid his divorce from Sophie Turner, Us Weekly reported Thursday. 
His main priority … [+2080 chars]",,en,'Sophie Turner'
https://earmilk.com/2024/01/05/alex-zelenka-delivers-a-remix-of-lana-del-reys-song-say-yes-to-heaven/,https://earmilk.com/2024/01/05/alex-zelenka-delivers-a-remix-of-lana-del-reys-song-say-yes-to-heaven/,0,earmilk.com,"Alex Zelenka delivers a remix of Lana Del Rey's song ""Say Yes To Heaven""","Alex Zelenka, a well-known DJ and music producer, has created a fantastic remix of Lana Del Rey's song ""Say Yes To Heaven."" The remix is a beautiful blend of emotions…
The post Alex Zelenka delivers a remix of Lana Del Rey's song ""Say Yes To Heaven"" appeared …",https://earmilk.com/wp-content/uploads/2022/11/earmilkfiller00030.jpg,2024-01-05T14:04:33Z,,"Alex Zelenka, a well-known DJ and music producer, has created a fantastic remix of Lana Del Rey's song ""Say Yes To Heaven."" The remix is a beautiful blend of emotions and beats that will take you to … [+787 chars]",,en,'Lana Del Rey'
https://www.theroot.com/dont-play-with-her-whoopi-goldberg-slams-jeffrey-epste-1851143123,https://www.theroot.com/dont-play-with-her-whoopi-goldberg-slams-jeffrey-epste-1851143123,0,www.theroot.com,Don't Play With Her! Whoopi Goldberg Slams Jeffrey Epstein List Rumors,"Don’t play with Whoopi Goldberg. From her beginnings as a stand up comedian to Oscar-winning movie star, and now co-host of “The View,” Goldberg deserves her flowers. She has also always been forthright about what she likes and what she loves to do in her per…","https://i.kinja-img.com/image/upload/c_fill,h_675,pg_1,q_80,w_1200/0e27fcce0ee61782f8a8b3602f1b26a8.jpg",2024-01-05T14:37:00Z,,"Dont play with Whoopi Goldberg. From her beginnings as a stand up comedian to Oscar-winning movie star, and now co-host of The View, Goldberg deserves her flowers. She has also always been forthright… [+2017 chars]",,en,'Sunny Hostin'
https://www.usmagazine.com/celebrity-news/news/travis-kelce-supports-taylor-swifts-bff-selena-gomez-benny-blanco/#article,https://www.usmagazine.com/celebrity-news/news/travis-kelce-supports-taylor-swifts-bff-selena-gomez-benny-blanco/#article,0,www.usmagazine.com,"Travis Kelce Subtly Supports Taylor Swift's BFF Selena Gomez, Benny Blanco","Travis Kelce is sharing his support for girlfriend Taylor Swift’s “squad,” starting with Selena Gomez. Kelce, 34, dropped a “like” on a GQ Sports Instagram picture of Gomez, 31, cuddling up to her boyfriend, Benny Blanco, at the Los Angeles Lakers basketball …",https://www.usmagazine.com/wp-content/uploads/2024/01/Promo-Travis-Kelce-Subtly-Supports-Taylor-Swift-BFF-Selena-Gomez-and-Her-New-Romance-With-Benny-Blanco.jpg?crop=0px%2C0px%2C1753px%2C921px&resize=1200%2C630&quality=86&strip=all,2024-01-05T15:48:02Z,,"Taylor Swift and Travis KelceGotham/GC Images
Travis Kelce is sharing his support for girlfriend Taylor Swifts squad, starting with Selena Gomez.
Kelce, 34, dropped a like on a GQ Sports Instagram … [+2572 chars]",,en,'Taylor Swift'
https://www.startribune.com/house-republicans-ready-contempt-of-congress-charges-against-hunter-biden-over-a-subpoena-he-defied/600332643/,https://www.startribune.com/house-republicans-ready-contempt-of-congress-charges-against-hunter-biden-over-a-subpoena-he-defied/600332643/,0,www.startribune.com,House Republicans ready contempt of Congress charges against Hunter Biden over a subpoena he defied,House Republicans plan to move forward next week with holding Hunter Biden in contempt of Congress after the president's son defied a congressional subpoena to appear for a private deposition last month.,https://chorus.stimg.co/25205814/merlin_73000135.jpg?h=630&w=1200&fit=crop&bg=999&crop=faces,2024-01-05T16:11:02Z,,WASHINGTON House Republicans plan to move forward next week with holding Hunter Biden in contempt of Congress after the president's son defied a congressional subpoena to appear for a private deposit… [+2502 chars],,en,'David Weiss'
https://abcnews.go.com/US/wireStory/house-republicans-ready-contempt-congress-charges-hunter-biden-106134308,https://abcnews.go.com/US/wireStory/house-republicans-ready-contempt-congress-charges-hunter-biden-106134308,0,abcnews.go.com,House Republicans ready contempt of Congress charges against Hunter Biden over a subpoena he defied,House Republicans plan to move forward next week with holding Hunter Biden in contempt of Congress after the Democratic president’s son defied a congressional subpoena to appear for a private deposition last month,https://i.abcnewsfe.com/a/0c58792b-917d-47bf-884b-435ef91c21ea/wirestory_f3702d3e40af6649f4e8677aa54269ed_16x9.jpg?w=992,2024-01-05T16:22:31Z,,WASHINGTON -- House Republicans plan to move forward next week with holding Hunter Biden in contempt of Congress after the president's son defied a congressional subpoena to appear for a private depo… [+2485 chars],,en,'Hunter Biden'
https://www.bostonglobe.com/2024/01/05/nation/hunter-biden-congress-investigation-impeachment/,https://www.bostonglobe.com/2024/01/05/nation/hunter-biden-congress-investigation-impeachment/,0,www.bostonglobe.com,House Republicans ready contempt of Congress charges against Hunter Biden over a subpoena he defied,House Republicans plan to move forward next week with holding Hunter Biden in contempt of Congress after the Democratic president’s son defied a congressional subpoena to appear for a private deposition last month.,https://bostonglobe-prod.cdn.arcpublishing.com/resizer/Y9Iie6fshlOWtIoYA8E2qlWNALc=/506x0/cloudfront-us-east-1.images.arcpublishing.com/bostonglobe/AYUA5WCYC4XU43ADTSUS3JF6VE.jpg,2024-01-05T16:26:00Z,,WASHINGTON (AP) House Republicans plan to move forward next week with holding Hunter Biden in contempt of Congress after the presidents son defied a congressional subpoena to appear for a private dep… [+2476 chars],,en,'David Weiss'
https://www.lgbtqnation.com/2024/01/lauren-boebert-is-outraged-that-trans-people-will-get-health-care-under-new-law/,https://www.lgbtqnation.com/2024/01/lauren-boebert-is-outraged-that-trans-people-will-get-health-care-under-new-law/,0,www.lgbtqnation.com,Lauren Boebert is outraged that trans people will get health care under new law,"The new law isn't specifically about gender-affirming care, but Boebert made it all about trans people.",https://abuwjaawap.cloudimg.io/v7/_lgbtqnation-assets_/assets/2023/02/lauren-boebert-twitter-hearing.png?auto=format&auto=compress&fit=crop&gravity=face&w=1200&h=630&force_format=jpeg&wat=1&wat_gravity=southeast&wat_pad=40,2024-01-05T16:37:25Z,,"Rep. Lauren Boebert (R-CO) is outraged about a new California law that expands healthcare access to low-income adults regardless of their immigration status, and she made her complaint all about tran… [+2290 chars]",,en,'Lauren Boebert'
https://www.newsweek.com/lauren-boebert-reveals-real-reason-behind-switching-districts-1858197,https://www.newsweek.com/lauren-boebert-reveals-real-reason-behind-switching-districts-1858197,0,www.newsweek.com,Lauren Boebert Reveals Real Reason Behind Switching Districts,"The congresswoman previously said she wanted a ""fresh start"" in her decision to switch congressional districts in Colorado.",https://d.newsweek.com/en/full/2331929/lauren-boebert.jpg,2024-01-05T16:40:30Z,,"Representative Lauren Boebert, a Colorado Republican, cited her ""personal life"" on Friday as one of the main reasons behind her decision to run for reelection in a different district in 2024.
""The f… [+3876 chars]",,en,'Lauren Boebert'
https://biztoc.com/x/6cc3e71bc2b289c0,https://biztoc.com/x/6cc3e71bc2b289c0,0,biztoc.com,Lauren Boebert reveals real reason behind switching districts,"Representative Lauren Boebert, a Colorado Republican, cited her ""personal life"" on Friday as one of the main reasons behind her decision to run for reelection in a different district in 2024. ""The fresh start is really in regards to my personal life. There's …",https://c.biztoc.com/p/6cc3e71bc2b289c0/s.webp,2024-01-05T16:46:08Z,,"Representative Lauren Boebert, a Colorado Republican, cited her ""personal life"" on Friday as one of the main reasons behind her decision to run for reelection in a different district in 2024.""The fre… [+308 chars]",,en,'Lauren Boebert'
http://www.thecut.com/2024/01/joe-jonas-stormi-bree-dating.html,http://www.thecut.com/2024/01/joe-jonas-stormi-bree-dating.html,0,www.thecut.com,Looks Like Joe Jonas Is Jetting Around With Stormi Bree,"Joe Jonas and model-influencer Stormi Bree have been spotted in Cabo and Aspen, sparking dating rumors.",https://pyxis.nymag.com/v1/imgs/2ba/d74/50cf6ef083891051ac1911dd7857daed21-joe-jonas-stormi-bree-lede-0124.1x.rsocial.w1200.jpg,2024-01-05T17:27:22Z,,"If theres one thing celebs love to do, its go on vacation during the first week of January. While seemingly everyone in the world is circling back with you, people like Joe Jonas are jetting from Cab… [+1644 chars]",,en,'Joe Jonas'
https://biztoc.com/x/e9ac2a54a7b4e16b,https://biztoc.com/x/e9ac2a54a7b4e16b,0,biztoc.com,Sunny Hostin Roasts 'Tokenism' Behind Nikki Haley's 'I Have Black Friends' Comment,"The View’s Sunny Hostin delivered a “public service announcement” to Republican presidential candidate Nikki Haley on Friday’s show: “Do not say, ‘I have Black friends.’ Ever.” The co-hosts discussed Haley’s attempt to clean up her Civil War “slavery” gaffe d…",https://c.biztoc.com/p/e9ac2a54a7b4e16b/s.webp,2024-01-05T17:36:45Z,,"The Views Sunny Hostin delivered a public service announcement to Republican presidential candidate Nikki Haley on Fridays show: Do not say, I have Black friends. Ever.The co-hosts discussed Haleys a… [+278 chars]",,en,'Sunny Hostin'
https://freebeacon.com/biden-administration/burisma-consultants-are-registering-as-foreign-agents-but-not-hunter-biden/,https://freebeacon.com/biden-administration/burisma-consultants-are-registering-as-foreign-agents-but-not-hunter-biden/,0,freebeacon.com,Burisma Consultants are Registering as Foreign Agents. But Not Hunter Biden.,"A second consultant for the Ukrainian energy firm Burisma Holdings registered as a foreign agent this week, raising more questions about Hunter Biden’s refusal to do the same.
The post Burisma Consultants are Registering as Foreign Agents. But Not Hunter Bide…",https://freebeacon.com/wp-content/uploads/2023/09/2023-09-20T203332Z_2_LYNXMPEJ8J0Y3_RTROPTP_4_USA-BIDEN-HUNTER-PLEA-e1695305136372.jpg,2024-01-05T18:20:15Z,,"A second consultant for the Ukrainian energy firm Burisma Holdings registered as a foreign agent this week, raising more questions about Hunter Bidens refusal to do the same.
John Buretta, a partner… [+2796 chars]",,en,'David Weiss'
https://pagesix.com/2024/01/05/entertainment/joe-jonas-stormi-bree-post-photos-from-ski-trip-as-romance-rumors-heat-up/,https://pagesix.com/2024/01/05/entertainment/joe-jonas-stormi-bree-post-photos-from-ski-trip-as-romance-rumors-heat-up/,0,pagesix.com,"Joe Jonas and Stormi Bree post photos, videos from Aspen ski trip as romance rumors heat up","The ""Celebrate!"" crooner and former beauty pageant contestant jetted to Colorado after spending New Year's Eve in Cabo San Lucas, Mexico, for a performance.",https://pagesix.com/wp-content/uploads/sites/3/2024/01/74437925.jpg?quality=75&strip=all&w=1024,2024-01-05T19:13:32Z,,"Joe Jonas and Stormi Bree gave followers a sneak peek into their ski trip to Aspen, Colo. just days after they were spotted flying out of Mexico together.
The Jonas Brothers frontman captured footag… [+2433 chars]",,en,'Joe Jonas'
https://politicalwire.com/2024/01/05/house-republicans-down-another-vote/,https://politicalwire.com/2024/01/05/house-republicans-down-another-vote/,0,politicalwire.com,House Republicans Down Another Vote,"“House Majority Leader Steve Scalise will be away from Washington until February as he undergoes a stem-cell transplant,” Punchbowl News reports.“House Republicans currently have a 220-seat majority. Rep. Bill Johnson (R-OH) is leaving Congress Jan. 21. After…",https://politicalwire.com/wp-content/uploads/2018/02/PW-podcast-logo.jpg,2024-01-05T19:43:35Z,,"“There are a lot of blogs and news sites claiming to understand politics, but only a few actually do. Political Wire is one of them.”
 Chuck Todd, host of “Meet the Press”
“Concise. Relevant. To th… [+594 chars]",,en,'Steve Scalise'
https://www.pbs.org/newshour/politics/house-republicans-prepare-contempt-charges-against-hunter-biden-for-defying-a-subpoena,https://www.pbs.org/newshour/politics/house-republicans-prepare-contempt-charges-against-hunter-biden-for-defying-a-subpoena,0,www.pbs.org,House Republicans prepare contempt charges against Hunter Biden for defying a subpoena,The Republicans who lead the House Oversight and Accountability Committee and the Judiciary Committee announced Friday that they will hold votes on contempt charges against Hunter Biden as the GOP moves into the final stages of its impeachment inquiry.,https://d3i6fh83elv35t.cloudfront.net/static/2024/01/2023-12-18T142014Z_1677221029_RC2QZ4AZGJAQ_RTRMADP_3_USA-BIDEN-1024x682.jpg,2024-01-05T20:33:44Z,,WASHINGTON (AP) House Republicans plan to move forward next week with holding Hunter Biden in contempt of Congress after the president’s son defied a congressional subpoena to appear for a private de… [+2653 chars],,en,'David Weiss'
https://pagesix.com/2024/01/05/style/joe-jonas-rumored-girlfriend-stormi-bree-sports-singers-beanie-while-on-vacation-together-in-aspen/,https://pagesix.com/2024/01/05/style/joe-jonas-rumored-girlfriend-stormi-bree-sports-singers-beanie-while-on-vacation-together-in-aspen/,0,pagesix.com,Joe Jonas’ rumored girlfriend Stormi Bree sports singers’ beanie while on vacation together in Aspen,"Jonas and Bree first sparked romance on Wednesday when the pair were seen at a private airport in Cabo, and they were later spotted in Aspen, Colo.",https://pagesix.com/wp-content/uploads/sites/3/2024/01/74441452.jpg?quality=75&strip=all&w=1024,2024-01-05T21:27:44Z,,"The couple that bundles up together, stays together.
Stormi Bree appeared to be wearing the same striped beanie that Joe Jonas owns while on a trip to Aspen together amid romance rumors.
The model … [+2414 chars]",,en,'Joe Jonas'
https://www.cnn.com/2024/01/05/politics/justice-department-trump-cases-expenses/index.html,https://www.cnn.com/2024/01/05/politics/justice-department-trump-cases-expenses/index.html,0,www.cnn.com,"Justice Department, special counsel have spent nearly $24 million on Trump-related cases | CNN Politics","The Justice Department has spent nearly $24 million investigating and prosecuting former President Donald Trump and his allies, according to expense reports.","https://media.cnn.com/api/v1/images/stellar/prod/231228230243-02-trump-file-122823.jpg?c=16x9&q=w_800,c_fill",2024-01-05T21:51:34Z,,"The Justice Department has spent nearly $24 million investigating and prosecuting former President Donald Trump and his allies, according to expense reports.
In the most recent expense report releas… [+2597 chars]",,en,'Donald Trump'
https://www.usmagazine.com/celebrity-news/news/joe-jonas-shares-photos-of-aspen-getaway-with-model-stormi-bree/#article,https://www.usmagazine.com/celebrity-news/news/joe-jonas-shares-photos-of-aspen-getaway-with-model-stormi-bree/#article,0,www.usmagazine.com,Joe Jonas Gives Peek Inside Aspen Getaway With Model Stormi Bree,"Joe Jonas seemed to fully enjoy his time in Aspen, Colorado, with model Stormi Bree. The Jonas Brothers singer, 34, shared a few clips of his snowy getaway via his Instagram Story on Friday, January 5. He showed off the breathtaking view while riding on a ski…",https://www.usmagazine.com/wp-content/uploads/2024/01/feature-Joe-Jonas-Gives-Peek-Inside-Aspen-Getaway-After-Vacation-With-Model-Stormi-Bree.jpg?crop=0px%2C0px%2C2000px%2C1051px&resize=1200%2C630&quality=86&strip=all,2024-01-05T22:02:04Z,,"Joe Jonas seemed to fully enjoy his time in Aspen, Colorado, with model Stormi Bree.
The Jonas Brothers singer, 34, shared a few clips of his snowy getaway via his Instagram Story on Friday, January… [+2167 chars]",,en,'Joe Jonas'
https://abcnews.go.com/US/latest-expenditures-special-counsel-jack-smith-spent-13m/story?id=106144032,https://abcnews.go.com/US/latest-expenditures-special-counsel-jack-smith-spent-13m/story?id=106144032,0,abcnews.go.com,"With latest expenditures, special counsel Jack Smith has spent nearly $13M on Trump probes, DOJ report shows","With latest expenditures, special counsel Jack Smith has spent nearly $13M on Trump probes, DOJ report showsgo.com",https://i.abcnewsfe.com/a/d185fc90-e433-48e4-8e64-7cdf1701fb1f/jack-smith-ap-jef-240105_1704486803334_hpMain_16x9.jpg?w=992,2024-01-05T22:07:57Z,,"Between April and September of last year, special counsel Jack Smith spent $7.3 million on his probes into former President Donald Trump, raising his total expenses to nearly $12.7 million, according… [+3482 chars]",,en,'David Weiss'
https://dailycaller.com/2024/01/05/house-gop-majority-one-seat-february/,https://dailycaller.com/2024/01/05/house-gop-majority-one-seat-february/,0,dailycaller.com,House GOP’s Majority Will Temporarily Drop To 1 Seat Following Steve Scalise’s Cancer Treatment,The Republican majority in the House of Representatives will fall to one seat after Jan. 21 due to the medical absence of House Majority Leader Steve Scalise.,https://cdn01.dailycaller.com/wp-content/uploads/2023/11/Scalise-Israel-Aid-Bill-e1698955717495.png,2024-01-05T23:07:56Z,,"The Republican majority in the House of Representatives will fall to one seat after Jan. 21 due to the medical absence of House Majority Leader Steve Scalise from the chamber.
Scalise, who was diagn… [+3168 chars]",,en,'Steve Scalise'
https://www.tmz.com/2024/01/05/joe-jonas-ski-model-stormi-bree-aspen-romance-rumors-swirl/,https://www.tmz.com/2024/01/05/joe-jonas-ski-model-stormi-bree-aspen-romance-rumors-swirl/,0,www.tmz.com,"Joe Jonas Goes Skiing with Model Stormi Bree, Fuels Romance Rumors","Joe Jonas is taking things with a former Miss Teen USA titleholder to new heights ... hitting the famed altitude of Colorado for a ski day as he moves on from his ex, Sophie Turner. The singer hit the slopes Friday in Aspen with Stormi Bree ...…",https://imagez.tmz.com/image/21/16by9/2024/01/06/21a0728b538e469282ddfd3cd8075cbe_xl.jpg,2024-01-06T01:22:43Z,,"Joe Jonas is taking things with a former Miss Teen USA titleholder to new heights ... hitting the famed altitude of Colorado for a ski day as he moves on from his ex, Sophie Turner.
The singer hit t… [+800 chars]",,en,'Joe Jonas'
https://pagesix.com/2024/01/05/entertainment/inside-joe-jonas-and-stormi-brees-cozy-aspen-ski-date/,https://pagesix.com/2024/01/05/entertainment/inside-joe-jonas-and-stormi-brees-cozy-aspen-ski-date/,0,pagesix.com,Inside Joe Jonas and Stormi Bree’s ‘cozy’ Aspen ski date,"The rumored couple was first linked when they were spotted leaving the Cabo San Lucas, Mexico, airport together and heading to Aspen earlier this week.",https://pagesix.com/wp-content/uploads/sites/3/2024/01/74450088.jpg?quality=75&strip=all&w=1024,2024-01-06T02:44:30Z,,"Joe Jonas is swooning over his rumored new girlfriend, Stormi Bree.
Pictures obtained by Page Six exclusively show the “Celebrate” crooner and model getting cozy over a pitcher of beer at the Highla… [+3917 chars]",,en,'Joe Jonas'
https://hiphopdx.com/news/tyler-creator-doja-cat-rumor-coachella-2024,https://hiphopdx.com/news/tyler-creator-doja-cat-rumor-coachella-2024,0,hiphopdx.com,"Tyler, The Creator & Doja Cat Rumored To Be Headlining Coachella 2024","Tyler, The Creator and Doja Cat are rumored to be headlining Coachella 2024 according to a new report, along with singer Lana Del Rey.",https://static.hiphopdx.com/2024/01/tyler-the-creator-doja-cat-rumored-headlining-coachella-2024-1200x675.jpg,2024-01-06T04:00:14Z,,"Tyler, The Creator and Doja Cat have allegedly been selected to headline this years for Coachella 2024, along with Lana del Rey.
Hits Daily Double reported Friday (January 5) that their sources conf… [+3243 chars]",,en,'Lana Del Rey'
https://www.foxnews.com/politics/former-burisma-lawyer-registers-foreign-agent-seven-years-later-amid-biden-investigations,https://www.foxnews.com/politics/former-burisma-lawyer-registers-foreign-agent-seven-years-later-amid-biden-investigations,0,www.foxnews.com,Former Burisma lawyer registers as foreign agent more than seven years later amid Hunter Biden investigations,A lawyer who previosuly represented Burisma chief Mykola Zlochevsky registered Thursday as a foreign agent for work he did more than seven years ago.,https://static.foxnews.com/foxnews.com/content/uploads/2023/06/Hunter-Biden-and-Mykola-Zlochevski-.jpg,2024-01-06T16:26:54Z,,"Read this article for free!
Plus get unlimited access to thousands of articles, videos and more with your free account!
Please enter a valid email address.
By entering your email, you are agreeing… [+6061 chars]",,en,'Hunter Biden'
https://www.justjared.com/2024/01/06/joe-jonas-stormi-bree-go-skiing-together-in-aspen-amid-dating-rumors/,https://www.justjared.com/2024/01/06/joe-jonas-stormi-bree-go-skiing-together-in-aspen-amid-dating-rumors/,0,www.justjared.com,Joe Jonas & Stormi Bree Go Skiing Together in Aspen Amid Dating Rumors,"The Joe Jonas and Stormi Bree dating rumors are heating up! After the 34-year-old Jonas Brothers singer and the 33-year-old model were seen flying out of Mexico together, the two were photographed hanging out and skiing while in Aspen, Colorado. Keep reading …",https://cdn01.justjared.com/wp-content/uploads/headlines/2024/01/stormi-ski-joe.jpg,2024-01-06T17:50:08Z,,"The Joe Jonas and Stormi Bree dating rumors are heating up!
After the 34-year-old Jonas Brothers singer and the 33-year-old model were seen flying out of Mexico together, the two were photographed h… [+802 chars]",,en,'Joe Jonas'
https://people.com/stormi-bree-sports-hat-previously-worn-by-joe-jonas-8423178,https://people.com/stormi-bree-sports-hat-previously-worn-by-joe-jonas-8423178,0,people.com,Stormi Bree Sports Hat Previously Worn by Joe Jonas,"Joe Jonas and Stormi Bree were recently photographed hitting the slopes with friends during a trip to Aspen, Colorado, and the model even shared a selfie seemingly wearing Jonas' multi-colored beanie that he wore last month.",https://people.com/thmb/L2Sj8a1ou154ZIYaIeiH4s0Yw38=/1500x0/filters:no_upscale():max_bytes(150000):strip_icc():focal(963x383:965x385)/Joe-Jonas-Stormi-Bree-010624-03-622000c9223d4fde803f1ad0e2bc01b9.jpg,2024-01-06T18:38:33Z,,"Stormi Bree is taking some fashion inspiration from Joe Jonas.
The 33-year-old model shared a cozy selfie to her Instagram Story sporting a multi-colored knit beanie that the Cake by the Ocean singe… [+2543 chars]",,en,'Joe Jonas'
https://hollywoodlife.com/2024/01/06/joe-jonas-stormi-bree-ski-date-photos/,https://hollywoodlife.com/2024/01/06/joe-jonas-stormi-bree-ski-date-photos/,0,hollywoodlife.com,Joe Jonas Hits the Slopes For a Cozy Ski Date With Rumored New GF Stormi Bree: Photos,The beauty also appeared to use the singer's hat for the fun-looking outing.,https://hollywoodlife.com/wp-content/uploads/2023/09/joe-jonas-daughters-nyc-ftr.jpg?quality=100,2024-01-06T22:08:13Z,,"View galleryImage Credit: Ken McKay/ITV/Shutterstock
Joe Jonas, 34, and Stormi Bree, 33, were photographed having a great time on the slopes during a cozy ski date in Aspen, CO on Saturday. The sing… [+1747 chars]",,en,'Joe Jonas'
